ロードリーローブ下,Lordly Robe Bottom
レジェンズウィング,Legends Wing
ドルワームの紋章旗,Dolworm Banner
闇朱の破砕将ボーガ,Red Crush General Boga
バザールを護るもの,Protecting the Bazaar
黄チェックの便せん,Yellow Checkered Paper
星雲のモビール・青,Blue Nebula Mobile
アイスダンスズボン,Ice Dance Pants
冬風マキシスカート,Winter Maxi Skirt
ゴーレムのきぐるみ,Golem Costume
コマンダーコート上,Commander Coat Top
ねこまどうの像・庭,Meowgician Statue (G)
オブジェクト座標106,Object Coordinates 106
ゼレスタイトの大盾,Celestite Greatshield
オブジェクト座標256,Object Coordinates 256
カウンターブースト,Counter Boost
ダンディオ団長の妻,Captain Dandio's Wife
しぐさ書・スマイル,Emote "Best Smile"
代理人レレッポの像,Agent Releppo Statue
ハンマー屋トカチャ,Hammer Shop Tokacha
預かり所カルバンク,Storage Calbank
シスター・ゼレニナ,Sister Zelenina
どこでもクラッカー,Anywhere Cracker
お祭りやぐら館の塀,Festival Fence
清廉天使のグローブ,Honest Angel Gloves
レッドブレイクグミ,Red Break Gummy
異界獣ヘイズキング,Haze King, the Otherworldly
オブジェクト座標277,Object Coordinates 277
魔法使いのぼうし２,Mage Hat 2
野いちごバスケット,Wild Strawberry Basket
メダルオーナーの館,Medal Owner's Hall
ディープギアグラス,Deep Gear Glasses
スタンダード２印章,Standard 2 Stamp
森のこびとのポスト,Forest Dwarf Mailbox
会場案内係ファリネ,Venue Guide Farine
ウルベア魔神兵たち,Urbea Aztechs
ゴルスラ会長の帽子,Chairman Gemsly Hat
ファーラット浮き輪,Feralball Floatie
しゃしょうふろっく,Conductor Flock
苺お菓子のオーブン,Berry Sweet Oven
しぐさ書・たてごと,Emote "Harp"
プリンスタキシード,Prince Tuxedo
うつしよの竜箱・改,Worldly Dragon Box v2
がーるもっずこーと,Girl Mod Coat
ふわふわサメバーン,Fluffy Sharkburn
シーサイドチェスト,Seaside Chest
王都カミハルムイ南,Royal City Kamiharmui S.
背離する魔幻の血統,Separation Phantom Family
ベラストル家のイス,Belastre Chair
たんすミミックの書,Wardrobe Mimic Book
ふわあまアーモンド,Soft Almond
りょうりにんすぷる,Chef Sprue
亡き王に手向ける花,Flowers for the Late King
激辛トマトジュース,Super Hot Tomato Juice
純真天使のグローブ,Pure Angel Gloves
アスフェルド大光章,Large Asfeld Medal
グレースギフト・桃,Pink Grace Gift
スノーボールンたち,Snowballon and co.
住宅素材屋ノーニャ,Housing Materials Nonya
愛しのツボ錬金職人,Beloved Pot Alchemist
獣魔ローガストの像,Logast Statue
色飾りタイルの鏡台,Color Tile Vanity
純真天使のドレス下,Pure Angel Dress Bottom
スターの足置き・赤,Red Star Footrest
ウェディングアーチ,Wedding Arch
ガナドールスーツ上,Victor Shirt
ゴールドモンスター,Gold Monster
プラコンシェルジュ,Private Concierge
三姉妹の飛行船・青,Blue 3 Sisters Blimp
ゴールドマン衣装券,Gold Golem Costume Tkt
音符のチェスト・黒,Black Music Chest
お姫様のベンチ・橙,Princess Bench
予言者学園女学生靴,Prophet School Shoes(F)
ルファ神殿への亀裂,Crevice to Rufa Temple
邪将トロルバッコス,General Gladiator Troll
ユシュカのこころ７,Yushka's Heart Lv. 7
フィギュアチケット,Figure Ticket
旅芸人ピュージュＧ,Minstrel Pyuju G
釣り道に　王道なし,No Noble Path in Fishing
第１回カジノ祭・銀,1st Casino Fest Silver
オブジェクト座標255,Object Coordinates 255
クローバーＴシャツ,Clover T-Shirt
紫色チューリップ傘,Purple Tulip Umbrella
ブレイブマシュマロ,Brave Marshmallows
オブジェクト座標042,Object Coordinates 042
アルウェーン管理棟,Alweyn Admin Building
師団長の七つの教訓,Commander's Lessons
究極邪教司祭カード,Ultimate Aamon Card
アズラン地方の木Ｂ,Azlan Region Tree B
神兵のガントレット,Divine Soldier Gloves
オブジェクト座標287,Object Coordinates 287
オブジェクト座標036,Object Coordinates 036
大富豪なりきり宝箱,Tycoon Treasure Chest
おどるほうせきたち,Goodybags
たゆたう水面投影機,Water Surface Projector
エルドナ神のリボン,Eldona's Ribbon
オブジェクト座標214,Object Coordinates 214
娯楽島ラッカラン駅,Luckland Island Station
ライトニングダガー,Thunderstorm Skean
入学案内係フラッセ,Admissions Guide Flasse
ごうかなラグ中・赤,Red Fancy Rug M
住宅素材屋ポッポル,Housing Materials Poppol
メレアーデパンプス,Mereade Heels
あくまのいしょう２,Imp Costume 2
シルエット・猫・白,White Silhouette Cat
旧ネクロデアの石碑,Old Necrodea Monument
漆黒の匪賊ギャレス,Black Bandit, Gareth
桜のキーエンブレム,Sakura Key Emblem
ゼドラ王国服モブ８,Zedra Royal Clothes Mob 8
異国のレンガ館の壁,Exotic Brick Wall
最新の混乱封印対策,Chaos Sealing Measures
ペコリア・アルファ,Pekoria Alpha
ワンダラーズブーツ,Wanderers Boots
森林警備隊グローブ,Forest Ranger Gloves
ネオンフラッシュ青,Neon Flash (Blue)
オブジェクト座標012,Object Coordinates 012
オブジェクト座標158,Object Coordinates 158
アルカナ・セラピア,Arcana Serapia
ドーナッツの浮き輪,Donut Floatie
バトマスアーマー上,Battlemaster Chest
チョコ神ぬいぐるみ,Choco-God Plushie
ドラグーンメイル上,Dragoon Mail Top
果てなき夢の芸人道,Dream of Entertaining
古代つちわらしたち,Ancient Lickspittles
お魚のパーカー水着,Fish Hoodie Swimsuit
スパングルドレス下,Spangled Dress Bottom
海邪甲デプスロガン,Depthsogan, Evil of the Sea
軍馬の大剣の作り方,Great War Horse's Sword
シスター・エレーヌ,Sister Elaine
紫電とどろく時は今,Purple Lightning Time
魔瘴魂グウィネーロ,Miasma Soul Gwinero
小さなラメのシール,Small Glitter Sticker
異国のレンガ館の塀,Exotic Brick Fence
アクティブウィッグ,Active Wig
小さな英雄のズボン,Little Hero's Pants
しぐさ書・お祝い黄,Emote "Celebrate Ylw."
しぐさ書・究極呪文,Emote "Ultimate Spell"
ベルヴァインの森西,Belvain Forest West
しぐさ書・ムフフ本,Emote "Ogler's Digest"
ピクニックプクラス,Pukulas Picnic
偽ひとくいサーベル,Fake Erazor Blade
ゼクレスのテーブル,Zechres Table
ステージチュチュ上,Stage Tutu Top
闇の領界風間仕切り,Dark Realm Partition
光のフライパンの本,Light Fry Pan Book
オブジェクト座標162,Object Coordinates 162
トロピカルテーブル,Tropical Table
フォーチュングラブ,Fortune Gloves
グレーリリィのタネ,Dark Gray Lily Seed
トレジャーキャップ,Treasure Cap
ジェスターシューズ,Jester Shoes
ほのおのつるぎの書,Fire Blade Book
みかわしの服セット,Evasion Outfit
ベビーピンクダリア,Light Pink Dahlia
ストロベリーチョコ,Strawberry Chocolate
ヴァイパーファング,Cobra Strike
実録！魔剣の作り方,Making a Fizzle Foil
大森林のレンジャー,Great Forest Ranger
郵便局員ジェノール,Postman Gennault
メス三毛猫スーツⅠ,Calico Cat Suit (F) Ⅰ
わだつみのかんむり,Sea God Crown
おとぎの森スカート,Fairy Forest Skirt
ふかふかないしょう,Hatching Outfit
マイタウン水没地区,My Town Submerged District
預かり所フォッチャ,Storage Foccia
警備魔神兵０４７号,Aztech Guard No. 047
オブジェクト座標143,Object Coordinates 143
パンフレットを読む,Read Pamphlet
いやしの服のレシピ,Healing Outfit Recipe
しぐさ書・Ｓスター,Emote "Signal Star"
嵐の領界のついたて,Storm Realm Partition
キングリザード・強,Vicious Liege Lizard
Ｓジェネラルカード,Shogum Card
スチームテーブル小,Steam Table S
パンジーのサンダル,Pansy Sandals
オブジェクト座標274,Object Coordinates 274
シュジャクカプセル,Peashock Toy
かーにばるこーでⅠ,Carnival Outfit Ⅰ
ギュッとウシぐるみ,Cow Arm Doll Plush
呪文ぼうそう率 +2.0%,Haywire Rate +2%
ほこらの祭祀場・嵐,Storm Shrine Ritual Ground
小型の四角い水そう,Square Aquarium S
天の川モビール・白,White Milky Way Mobile
フーたんのブローチ,Futan Brooch
チョコが詰まった袋,Chocolate Filled Bag
ハートの兵隊の服上,Heart Soldier Coat
しぐさ書・もうそう,Emote "Swoon"
キャットキャンディ,Cat Lollipop
白夜に消えた運転士,Vanish in the Midnight Sun
第８回ヒューザの像,8th Hyuza Statue
ＭＰ消費しない率+4%,MP Saver +4%
タップペンギーたち,Pogoin' Penguins
ドロまみれの新色！,New Muddy Color!
ポーポラ地方への道,Road to Popola Region
古グランゼドーラ城,Old Gran Zedora Castle
魔物管理人ミグニネ,Monster Manager Mignine
サハラコートセット,Sahara Outfit
スライダークスーツ,Nemeslime Suit
スライムナイトの像,Slime Knight Statue
オブジェクト座標240,Object Coordinates 240
悪霊の神々強メダル,Apex Evil Trinity Medal
オレンジキャンディ,Orange Ice Pop
オーガニックサラダ,Ogre-nic Salad
千里の名馬プリズム,1000 Mile Horse Prism
パピヨンソファ・夢,Dream Papillon Sofa
新鮮な異形獣のツノ,Fresh Hexabeast Horn
タイフーンレザー上,Typhoon Leather Shirt
聖騎士のよろいの書,Holy Knight Armor Book
破壊のオノの作り方,Obliteratoriser Book
エステラのこころ２,Estella's Heart Lv. 2
森林警備隊の制服上,Forest Ranger Shirt
呪文のためのナイフ,Knife for Spells
しゅうれん用ブーツ,Training Boots
ダルメシアンシャツ,Dalmatian Shirt
予言のサークレット,Circlet of Prophecy
シュバルツシュルト,Schwarzchuld
きらめく星の贈り物,Twinkling Star's Gift
おもちゃの草原・雪,Toy Grass Field (Snow)
バトルロードコイン,Battle Road Coin
ハクオウのこころ２,Hakuo's Heart Lv. 2
チェイサーレザー上,Chaser Leather Shirt
姉神封印神殿　入口,Goddess Seal Temple Entry
だいまどうのぼうし,Great Mage Hat
ピクニックファラス,Faras Picnic
雪だるまスライダー,Snowman Slide
きぬのローブセット,Silk Outfit
ドルワーム研究員服,Dolworm Research Suit
歌詠みのヘアバンド,Poet's Hairband
バーベキューセット,Barbecue Set
オブジェクト座標098,Object Coordinates 098
バトマスアーマー下,Battlemaster Leggings
第６回釣りコン・銅,6th Fish Contest Bronze
タイタス号の望遠鏡,Titus Telescope
魔塔の赤宝石付き壁,Red Tower Jeweled Wall
ラディカルシールド,Radical Shield
中級・呪文錬金の本,Intermediate Spell
ユシュカのこころ３,Yushka's Heart Lv. 3
王国軍司令部の武器,Royal Army Weapons
白銀獣ロムドゴーグ,Silver Beast Romdogog
トライバルグローブ,Tribal Gloves
大地の箱舟プリズム,Ark of the Earth Prism
第１１回ファラス像,11th Faras Statue
ゴレオン将軍カード,Goreham-Hogg Card
フューチャースーツ,Future Suit
黄昏導く魔杖の知識,Twilight Staff's Wisdom
第３回セラフィの像,3rd Seraphi Statue
マジカルじんべい上,Magical Jinbei Top
ピンクローズのタネ,Pink Rose Seed
レモンスライムの壁,Lemon Slime Wall
防衛魔神兵０５７号,Aztech Guard No. 057
シュガーナイトの服,Sugar Knight's Clothes
壊れた異形獣のツノ,Broken Hexabeast Horn
ゼドラ王国服モブ５,Zedra Royal Clothes Mob 5
ＤＱⅧ主人公の衣装,DQⅧ Hero Costume
セラフィぬいぐるみ,Seraphi Plushie
オブジェクト座標242,Object Coordinates 242
結界の守護者カード,Barrier Guardians Card
フカフカのもみガラ,Soft Rice Husks
蒼怨の邪骨将マッゼ,Navy Bone General Mazze
夕焼け雲のチェスト,Sunset Cloud Chest
ぐるぐるキャンディ,Spiral Lollipop
しぐさ書・たけのこ,Emote "Bamboo Shoot"
攻撃時に雷耐性低下,Thunder Resist Down Attack
ゼクレス城・テラス,Zechres Castle - Terrace
オブジェクト座標033,Object Coordinates 033
キーたんぬいぐるみ,Keytan Plushie
郵便局員ポエーツォ,Postman Poezzo
ドラグーングリーブ,Dragoon Greaves
レインボーリキッド,Rainbow Liquid
パッチ柄ソファ・桃,Pink Patch Sofa
エキゾチックピアス,Exotic Earrings
おしゃれストリート,Fashion Street
太古の偶像を求めて,In Search of Ancient Idols
となかいのきぐるみ,Reindeer Costume
ふわふわフラフの箱,Fluffy Fluff Box
ガタラ駅の模型・雪,Gatara Stn. Model(Snow)
ぱぱるたうんてんし,Driver Papalta
ゼドラ王国服モブ１,Zedra Royal Clothes Mob 1
ゴールデンライト青,Golden Light (Blue)
追加クエダミー１０,not used
コーヒーカップ・桃,Pink Coffee Set
大光の管制室への扉,Door to Pulse Control Room
サマーウルフ衣装券,Summer Wolf Costume Tkt
ファラザードの書簡,Farazard Correspondence
エテーネ軍の兵士Ｄ,Ethene Army Soldier D
オブジェクト座標021,Object Coordinates 021
クリムゾングローブ,Crimson Gloves
ドワーフテーブル大,Dwarf Table L
緑キノコのテーブル,Green Mushroom Table
川辺の休憩所への道,Path to Riverside Rest Area
キャンディのピアス,Candy Earrings
聖守護者ブーメラン,Sentinel's Boomerang
錬金悪魔の言い伝え,Alchemy Demon Lore
シャーマンシールド,Heedoovoodoo Shield
魔物管理人ピョンル,Monster Manager Ponel
ディバインアックス,Divine Axe
スイゼン湿原の木Ａ,Suizen Marsh Tree A
オブジェクト座標276,Object Coordinates 276
ドラキーの写真立て,Dracky Frame
トレジャーコート上,Treasure Coat Top
お菓子のパーティ机,Sweet Party Table
カラミティデーモン,Calamity Demon
キングアックスの書,King Axe Book
マデッサンスバッジ,Madessaince Badge
チェックのイス・赤,Red Checkered Chair
神具解放の審問宮３,Sanctuary of Divine Relics 3
オブジェクト座標007,Object Coordinates 007
ゴールドマンＸ２号,Gold Golem X 2
勇者姫アンルシア像,Anlucia Statue
ゴルフレディウェア,Golf Women's Wear
チョコレートの花束,Chocolate Bouquet
アストルティアの楯,Shield of Astoltia
ゴルゴンザカプセル,Gorgonza Toy
ソルシエールの服上,Sorciere's Top
ドラパンクシューズ,Dracky Punk Shoes
すいーとないしょう,Sweet Outfit
ビクトリーチケット,Victory Ticket
行動時10%でヘビチャ,Heavy Charge On Action 10%
第１０回エルジュ像,10th Erju Statue
聖守護者のウィング,Sentinel's Wings
黒衣の剣士のブーツ,Dark Swordsman Boots
ホイミントドレス下,Heal Mint Skirt
もじゃらきラクーン,Raccoon Platypunk
スカイブルーの花束,Sky Blue Bouquet
家具屋・旅人バザー,Furniture Shop/Traveler's Bazaar
幻想画「一期一会」,Fantasy Art "One in a Life"
ブラッドメイジたち,Blood Mages
スカーレットナイト,Scarlet Knight
オブジェクト座標130,Object Coordinates 130
スマートローボード,Smart Lowboard
白パールコンパクト,White Pearl Compact
猛将ギーグハンマー,General Giga Clubber
ダズの岩穴・大空洞,Daz Grotto - Caverns
万魔の塔・二の災壇,Banma Tower - 2nd Platform
ファンキータイツ上,Funky Vest
オブジェクト座標196,Object Coordinates 196
マポレーナプリズム,Genie Sanguini Prism
小さな英雄グローブ,Little Hero's Gloves
ウェディカウンタ小,Weddie Counter S
三毛猫スーツ衣装券,Calico Cat Suit Ticket
ほこらの祭祀場・氷,Ice Shrine Ritual Ground
マスカレイドグラブ,Masquerade Gloves
ゴールドマンＸ４号,Gold Golem X 4
メタル出現率アップ,Metal Encounter Rate Up
第８回ラウルの像庭,8th Raul Statue (G)
おもちゃのトンネル,Toy Tunnel
ディバインバスター,Divine Buster
ポセイドンテーブル,Poseidon Table
トロピカルジュース,Tropical Juice
スライム柄の浮き輪,Slime Pattern Floatie
レプリカード発行証,Replicard Proof
トポルのクラムパイ,Topol Crumb Pie
酒場の庭オルゴール,Tavern Music Box (G)
うんてんしこぺちゃ,Driver Kopecha
ジュエルスティック,Jewel Wand
ドワーフ作業うでわ,Dwarf Work Bangles
ペペロゴーラの私室,Peperogora's Private Room
凶拳は天を超えるか,Evil Fist Crosses Heaven
お姫様キッチン・桃,Pink Princess Kitchen
宝珠のプチプチ香水,Jewel Perfume XS
まてきのスティック,Brouhaha Boomstick
しのギフトボックス,Death Gift Box
ツリーは白銀に消ゆ,Tree's Disappearance
サーカスハウスの壁,Circus House Wall
チアガールのリスト,Cheerleader Bangles
タウン案内係カーサ,Town Guide Casa
獄氷鬼フィルグレア,Icekeeper Filglare
サンゴールドの花束,Sungold Bouquet
しぐさ書・雪だるま,Emote "Snowman"
タロットパック・青,Blue Tarot Pack
アンノウンハンマー,Unknown Hammer
マジカルギフト・白,White Magical Gift
パピヨンチェア・夢,Dream Papillon Chair
きなこづちの像・庭,Honeyhood Statue (G)
ふわふわ雲のソファ,Fluffy Cloud Sofa
プクリポテーブル大,Pukulipo Table L
オブジェクト座標278,Object Coordinates 278
風鈴のシャンデリア,Wind Chime Chandelier
ウェスタンレイピア,Western Rapier
ブレイブアンルシア,Brave Anlucia
きじゅつしのズボン,Illusionist's Pants
闇夜の巨人カプセル,Dark Night Giant Toy
しぐさ書・からあげ,Emote "Fried Chicken"
スイゼン湿原への道,Road to Suizen Marsh
白蛇のこんの作り方,Make a White Snake Rod
ウェディテーブル小,Weddie Table S
スライムつむりの盾,Shell Slime Shield
フラワーの気球・桃,Pink Flower Balloon
お花の外灯の作り方,Making Flower Lights
オブジェクト座標140,Object Coordinates 140
警備魔神兵０４９号,Aztech Guard No. 049
雪夜のエントランス,Snowy Night Entrance
バージニアステッキ,Virginia Stick
しっこくのターバン,Macabre Turban
ダンシングライト緑,Dancing Light (Green)
ドン・モグーラの像,Don Mole Statue
ギュッとリルチェラ,Lilcherat Arm Doll
コンシェルジュ１４,Concierge 14
スライムのキッチン,Slime Kitchen
しぐさ書・○を描く,Emote "Draw an O"
マイタウン未開地区,My Town Savage District
表情の書・ドヤがお,Expression "Smug"
さざなみギフト・黄,Yellow Ripples Gift
アクロバーガー・小,Small Acro-Burger
ドラゴンキッズの書,Small Fry Book
ホイミントミュール,Heal Mint Shoes
小さな英雄の便せん,Little Hero Paper
じょせいめいどふく,Maid Outfit (F)
ごうかなダンロ・緑,Green Fancy Fireplace
雑貨屋さんの屋根茶,Brown Shop Roof
ガウシア樹海への道,Road to Gaussia Woodlands
カジノバニーリスト,Casino Bunny Wristbands
クールスターマイク,Cool Star Microphone
壁かけＤＱⅩⅠの絵,DQⅩⅠ Painting
グレイスフルコート,Graceful Coat
レーナム緑野への道,Road to Lenam Fields
庭用砂丘のオブジェ,Sand Dune Curio (G)
メタスラのチェスト,Metal Slime Chest
オブジェクト座標261,Object Coordinates 261
リボントークハット,Ribbon Toque
超おたから花ルビー,Ruby Treasure Flower
サフィア宙橋への扉,Door to Saphia Bridge
ハクオウのこころ１,Hakuo's Heart Lv. 1
オブジェクト座標060,Object Coordinates 060
キラパン青プリズム,Blue Sabrecat Prism
聖守護者のハンマー,Sentinel's Hammer
ナイトのピース・黒,Black Knight Piece
悪夢のヤドリギ広場,Mistltoe Plaza of Nightmares
強・ボーンズメダル,Apex Bones Medal
シスター・カティヤ,Sister Katya
ヴァルハラグリーブ,Valhalla Greaves
錬金魔王の言い伝え,Alchemy Demon King Lore
くーるすたーせっと,Cool Star Outfit
レンタルドルボード,Rental Dolboard
プラコン・黒い唐傘,Black Paper Umbrella
フォーチュンブーツ,Fortune Boots
アスフェルド学園駅,Asfeld Academy Station
グランドタイタス号,Grand Titus
花狩人のころも・紫,Purple Flower Hunter Outfit
福まねきのタヌキ像,Good Luck Tanuki Statue
オブジェクト座標249,Object Coordinates 249
赤のキーエンブレム,Red Key Emblem
オブジェクト座標137,Object Coordinates 137
シスター・ビゴスラ,Sister Bigosla
茶柴モダンカプセル,Hip Brown Shiba Toy
ドルワーム研究員帽,Dolworm Research Hat
プラコンドレス・紫,Purple Dress
氷魔王の大矛・オノ,Ice Demon King Axe
ボーンクラッシャー,Bonecrusher
紅蓮のクイーンビー,Crimson Queen Bee
シスター・アナベル,Sister Annabel
壁かけ朝食シェルフ,Breakfast Wall Shelf
オブジェクト座標034,Object Coordinates 034
ナウマンコックの像,Naumanncook Statue
サファイアのピアス,Sapphire Earrings
レンジャコート下２,Ranger Coat Bottom 2
アンノウンステッキ,Unknown Wand
第８回釣りコン・銅,8th Fish Contest Bronze
テーブルとごちそう,Table and Feast
ヴィーラのころも下,Vila's Garment Bottom
冥王ネルゲルチェア,Nergel Chair
ドワーフ作業ぼうし,Dwarf Work Hat
カンダタこぶんリポ,Merry Man Lipo
メレアーデドレス上,Mereade Dress Top
タウン案内係スミカ,Town Guide Sumika
しましまマフラー赤,Red Striped Scarf
ぷりんすたきしーど,Prince Tuxedo
オーガの町人ブーツ,Ogre Merchant Boots
妖炎魔女のドレス下,Fire Witch Lower Gown
くろがねのよろい上,Darksteel Cuirass
オーガの村人うでわ,Ogre Villager Bracers
オブジェクト座標178,Object Coordinates 178
オスクトルクラウン,Oscutor Crown
深い森の修道院の塀,Monastery Fence
オブジェクト座標100,Object Coordinates 100
青色サイネリアの傘,Blue Cineraria Umbrella
第２回クロウズの像,2nd Claws Statue
ダラズ採掘場への道,Road to Daraz Quarry
シルエットブレンダ,Silhouette Brenda
ウィザードバス・黒,Black Wizard Bath
祭壇風のカウンター,Altar-Style Counter
スタジアムシューズ,Stadium Shoes
マジックチャクラム,Magic Circle
忠節の騎馬プリズム,Loyal Horse Prism
ビクトリーチップ地,Earth Victory Chip
ブルーハートピアス,Blue Heart Earrings
召集！　五領界会談,Convene! 5 Realms Meeting
ストームタルト・小,Small Storm Tart
アラビアンターバン,Arabian Turban
ジェスタースーツ上,Jester Suit Top
ヤドリギ広場　出口,Mistletoe Plaza Exit
フォーリオンの松明,Fourion Torch
配布用経験値の聖典,Experience Scripture
聖銀のどくろあらい,Sacred Silver Haardvark
ゴーレムぬいぐるみ,Golem Plushie
オブジェクト座標124,Object Coordinates 124
花婿のサークレット,Groom's Circlet
オブジェクト座標180,Object Coordinates 180
輝けるつるぎの伝説,Shining Sword Legend
ユーライザ神の光輪,Yuliza's Halo
第２回釣りコン・金,2nd Fish Contest Gold
サボテンダー強たち,Apex Cactuars
マスカレイドヘルム,Masquerade Helm
メギドロームの手下,Megidrome Henchman
アジサイコサージュ,Hydrangea Corsage
ローヌ風焼き肉弁当,Rhone-Style Grilled Bento
とある老行者の試練,Trials of an Old Pilgrim
マリンスライムの像,Seaslime Statue
レンタル衣装無料券,Free Outfit Rent Ticket
カーディナルナイト,Cardinal Knight
オブジェクト座標132,Object Coordinates 132
鍛冶素材屋フウザム,Smithing Materials Fuzam
ウェットスーツ・白,White Wetsuit
オブジェクト座標250,Object Coordinates 250
天の冒険者のズボン,Divine Traveler Pants
よくばり木箱セット,Well-Made Crate Set
降魔のよろいセット,Demonfel Armor Set
第１２回セラフィ像,12th Seraphi Statue
ナドラガンドの混沌,Primordial Nadragand
ふわふわホミロット,Fluffy Healix
ハートのベンチ・桃,Pink Heart Bench
しぐさ書・お祝い緑,Emote "Celebrate Green"
ルベランスティック,Ruberan Wand
天使人形ルーミリア,Angel Doll Lumeria
パールキャスケット,Pearl Cap
初心者用ブーメラン,Beginner's Boomerang
シングルアンテナＢ,Single Antenna B
黄金獣アルムゴーグ,Golden Beast Armogog
しぐさ書・お祝い白,Emote "Celebrate White"
ヒストリカキッチン,Historica Kitchen
さいほう職人腕あて,Sewer's Armguards
庭用ネオン・レター,Neon Letter (G)
マイタウン農村地区,My Town Rural District
実装テストアトラス,Implementation Test Atlas
八の星獣イジュツィ,8th Star Beast Ijutsi
サリアスぬいぐるみ,Sarias Plushie
ジェスタースーツ下,Jester Suit Bottom
奇跡の錬金ツボの本,Miracle Alch Pot Book
憎しみは時を超えて,Hatred is Timeless
ヒグラシの哀歌・庭,Evening Cicada Elegy(G)
ポーリアが望むモノ,What Paulia Wants
ベルセルクブレード,Mad Warrior's Blade
ポップスターマイク,Pop Star Microphone
ごうかなラグ大・緑,Green Fancy Rug L
あやしいカウンタ小,Suspicious Counter S
しぐさ書・勉強する,Emote "Study"
英雄はすべてを救う,A Hero Saves All
ホーリークリスタル,Holy Crystal
作りかけぬいぐるみ,Unfinished Plushie
ソーミャ宛ての手紙,Letter to Somya
おどるほうせきの書,Goodybag Book
まもの使いのくつ２,Monster Master Shoes 2
バブスラジャムパン,Bubble Slime Jam Bread
