アルファ用アルウェ王妃の別荘跡(子供たちの隠れ家内部Test),Queen Alwe's Villa Ruins for Alpha (Test Inside Children's Hideout)
どらごんくえすとえいとしゅじんこうのいしょう,DQⅧ Hero Costume
バトル班用テストマップ（いにしえのゼルメア）,Team Battle Map Test (Ancient Zelmea)
このマップは モンスターから逃げられません。,You can't run from monsters on this map.
マッチングテストステージ（同期後移動用）,Match test stage (for moving beat testing)
　　　～モンスター討伐隊隊員からの依頼～,         Monster Strike Force Request
マッチングテストステージ（同期テスト用）,Match test stage (for sync testing)
グランゼドーラ領-グランゼドーラ王国 入口,Gran Zedora Territory - Gran Zedora Kingdom Entry
リャナ荒涼地帯-ねじれたる異形の大地 入口,Lyana Desolate Area - Twisted Deformed Earth Entry
メルサンディ穀倉帯-こもれびの広場 入口,Melsandy Millfields - Sunbeam Square Entry
アラハギーロ地方-アラハギーロ王国 入口,Al-Ahagiro Region - Kingdom of Al-Ahagiro Entry
メルサンディ穀倉帯-メルサンディ村 入口,Melsandy Millfields - Melsandy Village Entry
メルサンディ穀倉帯-さびれたほこら 入口,Melsandy Millfields - Deserted Shrine Entry
アラハギーロ地方-モンスター格闘場 入口,Al-Ahagiro Region - Monster Arena Entry
季節イベント「お月見」　コンパニオン,Seasonal Event "Moon View" Companion
ぷらこんだんせいようそくたいむらさき,Purple Ceremony Gown
季節イベント「オ月見」　コンパニオン,Seasonal Event "Moon View" Companion
バトル班用テストマップ（ムスト廃墟）,Team Battle Map Test (Musuto Ruins)
アラハギーロ地方-ムルードの岩山 入口,Al-Ahagiro Region - Murudo Mountain Entry
アラハギーロ地方-日除けのほら穴 入口,Al-Ahagiro Region - Sunshade Cave Entry
メルサンディ穀倉帯-メルン水車郷 入口,Melsandy Millfields - Melun Watermill Entry
ぷらこんだんせいようそくたいみどり,Green Ceremony Gown
ぷらこんすくーるせいふくおんなちゃ,Brown School Uniform (F)
ぷらこんすくーるせいふくおとこしろ,White School Uniform (M)
ぷらこんすくーるせいふくおとここん,Blue School Uniform (M)
ぷらこんすくーるせいふくおんなくろ,Black School Uniform (F)
ぷらこんすくーるせいふくおとこちゃ,Brown School Uniform (M)
ルファ神殿エントランス（オープン）,Rufa Temple - Entry (Open)
ぷらこんすくーるせいふくおとこあか,Red School Uniform (M)
神代過ぎ～　春の桜よ　無為に咲く～,Past ages divine, the spring blossoms bloom, waiting idly by...
ぷらこんすくーるせいふくおんなあか,Red School Uniform (F)
ぷらこんすくーるせいふくおんなこん,Blue School Uniform (F)
ぷらこんすくーるせいふくおんなしろ,White School Uniform (F)
ぷらこんすくーるせいふくおとこくろ,Black School Uniform (M)
コニウェア平原-ココラタの浜辺 入口,Coniware Plain - Cocolata Beach Entry
アルファ用井戸(ダンダダ団のアジト),Well for Alpha (Robbin' 'Ood Gang HQ)
リャナ荒涼地帯-ソーラリア峡谷 入口,Lyana Desolate Area - Solaria Canyon Entry
バトル班用テストマップ(ツスクル）,Team Battle Map Test (Tsusukuru)
ぷらこんじょせいようみどりさんた,Green Women's Santa Suit
ぷらこんじょせいしのびのふくあお,Blue Women's Ninja Suit
ぷらこんだんせいようみどりさんた,Green Men's Santa Suit
ぷらこんじょせいみこふくむらさき,Purple Priestess Dress
あすふぇるどがくえんがくせいふく,Asfeld Academy Uniform
ぷらこんじょせいむらさきふりそで,Purple Women's Kimono
ぷらこんじょせいしのびのふくもも,Pink Women's Ninja Suit
だんせいぷらこんふくだーくぐれー,Dark Gray Clothes (M)
じょせいぷらこんふくあいすぶるー,Ice Blue Clothes (F)
ぷらこんだんせいしのびのふくあお,Blue Men's Ninja Suit
ぷらこんじょせいしのびのふくくろ,Black Women's Ninja Suit
ぷらこんだんせいしのびのふくこん,Navy Men's Ninja Suit
ぷらこんじょせいしのびのふくこん,Navy Women's Ninja Suit
プンスコのテーブル＆ティーセット,Punsuko's Table & Tea Set
ぷらこんだんせいしのびのふくくろ,Black Men's Ninja Suit
ぷらこんだんせいしのびのふくちゃ,Tea Men's Ninja Suit
ぷらこんだんせいようそくたいあお,Blue Ceremony Gown
ぷらこんだんせいようそくたいちゃ,Tea Ceremony Gown
ぷらこんじょせいしのびのふくあか,Red Women's Ninja Suit
バトル班用テストマップ（獅子門）,Team Battle Map Test (Lion Gate)
ぷらこんだんせいようそくたいはい,Ash Ceremony Gown
だんせいぷらこんふくみっどないと,Midnight Clothes (M)
だんせいぷらこんふくみすとぐれー,Mist Gray Clothes (M)
じょせいぷらこんふくみっどないと,Midnight Clothes (F)
ぷらこんだんせいしのびのふくあか,Red Men's Ninja Suit
セレドット山道-ベリルのほら穴 前,Celedot Mountain Pass - Beryl Den
レビュール街道北-海風の洞くつ 前,Reviewle Highway North - Seabreeze Cave
リンジャハル海岸-教会シスター 前,Linjahar Coast - Church Sister
マデ島＆エテーネ王宮（4.5CS専用）,Made Isle & Ethene Royal Manor (4.5CS only)
攻撃力上昇時特技ダメ+20(試合無効),Skill Dmg. While Atk. ↑ +20 (PvP×)
リンジャハル海岸-リンジャの塔 前,Linjahar Coast - Linja Tower
受けた属性ダメージの 10%ＨＰ回復,10% Attribute Damage Taken As HP
追憶の世界-アルウェ王妃の別荘跡,World of Remembrance-The Ruins of Queen Alwe
プログラマー用負荷検証ステージ4,Loading Programmer Verification Stage 4
プログラマー用負荷検証ステージ1,Loading Programmer Verification Stage 1
プログラマー用負荷検証ステージ3,Loading Programmer Verification Stage 3
必殺チャージ時 チャージ時間-10秒,Charge Time -10 sec. On Special Charge
プログラマー用負荷検証ステージ2,Loading Programmer Verification Stage 2
プログラマー用負荷検証ステージ5,Loading Programmer Verification Stage 5
ぼうえいぐんのせいふくむらさき,Purple Defense Force Suit
ぷらこんだんせいようしろさんた,White Men's Santa Suit
ぷらこんじょせいようくろさんた,Black Women's Santa Suit
豪魔将ベリンダ＆豪魔将ブレンダ,Generals Belinda & Brenda
魔天の勇者＆聖夜の破壊者・雪組,Demon Sky Hero & Holy Night Wrecker Snow Team
ぷらこんじょせいようあおあろは,Blue Women's Aloha
ぷらこんじょせいようももあろは,Pink Women's Aloha
じょせいぷらこんふくさんせっと,Sunset Clothes (F)
ぷらこんだんせいようくろさんた,Black Men's Santa Suit
ぷらこんじょせいようあかさんた,Red Women's Santa Suit
ぷらこんじょせいようももさんた,Pink Women's Santa Suit
ぷらこんこどもようみずぎせっと,Children's Swimsuit
ぷらこんだんせいようしろあろは,White Men's Aloha
えるどなしんのしょうぞくせっと,Eldona's Outfit
瀕死時 15%こうげき力+60(試合無効),Attack +60 On Death 15% (PvP×)
\s\m\eは　ダイスをふった。　→　,\s\m\e rolls a die. → It's a !
瀕死時 20%こうげき力+60(試合無効),Attack +60 On Death 20% (PvP×)
\s\m\eは　コインをなげた。　→　,\s\m\e flips a coin. → The coin lands on !
ぷらこんだんせいようあかさんた,Red Men's Santa Suit
魔天の勇者＆聖夜の破壊者・闇組,Demon Sky Hero & Holy Night Wrecker Dark Team
ぷらこんじょせいようしろあろは,White Women's Aloha
ぷらこんじょせいみこふくみどり,Green Priestess Dress
はなかりゅうどのころもむらさき,Purple Flower Hunter Outfit
ぷらこんだんせいようももあろは,Pink Men's Aloha
壊れたアストルティアのコンパス,Broken Astoltia Compass
ぼうえいぐんのせいふくはいいろ,Gray Defense Force Suit
ぷらこんだんせいようあおあろは,Blue Men's Aloha
ゴリウスの怨霊＆魔道士キルギル,Gorius' Vengeance & Wizard Kirgyl
30%の確率で受けたダメージ10%反射,30% Chance to Reflect 10% Damage
ぷらこんじょせいようしろさんた,White Women's Santa Suit
扉は　かたく　閉ざされている。,The door is tightly closed.
ぷらこんじょせいようあかあろは,Red Women's Aloha
\s\m\eは　カードを引いた。　→　,\s\m\e draws a card. → They drew the !
ぷらこんだんせいはかまむらさき,Purple Men's Hakama
味方死亡時 50%でためる(試合無効),Tension Revenge 50% (PvP×)
ぷらこんだんせいようももさんた,Pink Men's Santa Suit
リャナ荒涼地帯-滝を臨む集落 前,Lyana Desolate Area - Waterfall Village
デフェル荒野-不思議の魔塔 入口,Defel Desert - Mysterious Tower Entry
セレドット山道-セレドの町 入口,Celedot Mountain Pass - Town of Celed Entry
モンセロ温泉峡-中央のやぐら 前,Moncello Spring Gorge - Central Scaffold
敵を倒すと 3%でためる(試合無効),Tension On Enemy Defeat 3% (PvP×)
レビュール街道南-三門の関所 前,Reviewle Highway South - Three Way Gate
会心と暴走時魔物にダメージ +100,Critical/Haywire Damage +100
リャナ荒涼地帯-くずれた灯台 前,Lyana Desolate Area - Collapsed Lighthouse
ドラクロン山地-竜守りの小屋 前,Draklon Mountains - Dragon Guard's Hut
行動時 2%で聖女の守り(試合無効),Alma Mater On Action 2% (PvP×)
ジャイラ密林-クドゥスの泉 入口,Jyra Jungle - Kudus Spring Entry
コニウェア平原-教会シスター 前,Coniware Plain - Church Sister
アルファ用追憶の世界 別荘跡編,World of Recollection for Alpha Villa Ruins
テンション時魔物にダメージ+100,Damage During Tension +100
戦いで 魔物に狙われにくくなる,Less likely to be targeted in battle
こうげき魔力とかいふく魔力 +10,Magical Might/Mending +10
ぷらこんおんなどらきゅらふく,Women's Dracula Costume
わかむしゃのかっちゅうせっと,Young Warrior Armor Set
行動時 5%でバイシオンとピオラ,Oomph & Accelerate On Action 5%
ぷらこんじょせいみこふくもも,Pink Priestess Dress
ぷらこんすいーとふくだいだい,Orange Sweet Clothes
じょせいぷらこんふくむらさき,Purple Clothes (F)
行動時 5%でバイシオンとスカラ,Oomph & Buff On Action 5%
魔人エンラージャ＆ムッチーノ,Genie Enraja & Muccino
ぼうえいぐんのせいふくみどり,Green Defense Force Suit
2.0%でターン消費なし(試合無効),Free Turn 2% (PvP×)
はなかりゅうどのころもみどり,Green Flower Hunter Outfit
チームゆく年くる年　２０２１,Team New Year 2021
チームゆく年くる年　２０２２,Team New Year 2022
ぷらこんじょせいようきあろは,Yellow Women's Aloha
はなかりうどのころもむらさき,Purple Flower Hunter Outfit
チームゆく年くる年　２０１８,Team New Year 2018
チームゆく年くる年　２０２０,Team New Year 2020
ぷらこんしゃわーよういしょう,Shower Outfit
ぷらこんじょせいももふりそで,Pink Women's Kimono
嵐魔ウェンリルとアクラガレナ,Wenrir the Storm & Akragarena
チームゆく年くる年　２０２４,Team Twenty Twenty Four
あすふぇるどがくえんふゆふく,Asfeld Academy Winter Wear
魔天の勇者＆キラークリスマス,Demon Sky Hero & Christmas Killing Machine
巨人コアを守るジア・クトたち,Defenders of the Core
ぷらこんおんなぱんぷきんふく,Women's Pumpkin Clothes
3.0%でターン消費なし(試合無効),Free Turn 3% (PvP×)
ぷらこんきゅーぴっどむらさき,Purple Cupid
だんせいしらなみがらのゆかた,White Wave Yukata (M)
闇に唄う氷にまぎれし聖なる者,Frozen Sacred Singer
ぷらこんじょせいしろふりそで,White Women's Kimono
ぷらこんだんせいようきあろは,Yellow Men's Aloha
ぷらこんじょせいみこふくあお,Blue Priestess Dress
じょせいしらなみがらのゆかた,White Wave Yukata (F)
ぷらこんじょせいみこふくあか,Red Priestess Dress
ラダ・ガートたちに連絡を取る,Contact Lada Gart's Group
ＤＱⅧしゅじんこうのいしょう,DQⅧ Hero Costume
ぷらこんおとこどらきゅらふく,Men's Dracula Costume
ぷらこんじょせいあかふりそで,Red Women's Kimono
ヴァレリアの仮面（割れる前）,Valeria's Unbroken Mask
行動時 7%でバイシオンとピオラ,Oomph & Accelerate On Action 7%
ぷらこんじょせいくろふりそで,Black Women's Kimono
どるわーむけんきゅういんふく,Dolworm Research Suit
あすふぇるどがくえんなつふく,Asfeld Academy Summer Wear
チームゆく年くる年　２０１９,Team New Year 2019
フォークに刺さったパンケーキ,Pancakes Stuck in a Fork
ぷらこんおとこぱんぷきんふく,Men's Pumpkin Clothes
はるかぜおうえんだんいしょう,Spring Cheer Team Outfit
チームゆく年くる年　２０２３,Team New Year 2023
チームゆく年くる年　２０１７,Team New Year 2017
ぷらこんだんせいようあかろは,Red Men's Aloha
ジャイラ密林-大樹の根元 入口,Jyra Jungle - Big Tree Root Entry
デフェル荒野-教会シスター 前,Defel Desert - Church Sister
モンセロ温泉峡-管理人小屋 前,Moncello Spring Gorge - Caretaker's Hut
デフェル荒野-ピラミッド 入口,Defel Desert - Pyramid Entry
ロヴォス高地-教会シスター 前,Rovos Highlands - Church Sister
グランゼドーラ領-見張り塔 前,Gran Zedora Territory - Watchtower Front
モンセロ温泉峡-北のやぐら 前,Moncello Spring Gorge - North Scaffold
コニウェア平原-三門の関所 前,Coniware Plain - Three Way Gate
モンセロ温泉峡-南のやぐら 前,Moncello Spring Gorge - South Scaffold
モンセロ温泉峡-ご神体の間 前,Moncello Spring Gorge - Hall of Worship
炎・土・闇の攻撃ダメージ +5%,Fire/Earth/Dark Damage +5%
リンジャハル海岸-高台の遺跡,Linjahar Coast - Hilltop Ruins
セレドット山道-滝見の吊り橋,Celedot Mountain Pass - Fallsview Bridge
追憶の世界-キラキラ大風車塔,World Of Remembrance-Windmill Tower
だるめしあんがーるいしょう,Dalmatian Outfit (F)
イルーシャのスケッチブック,Irusha's Sketchbook
『ついてクンをひっこめる』,"Remove Pet"
ムストの町・風車へのはしご,Morst - Ladder to the Windmill
ぷらこんいけてるみずぎあお,Blue Cool Swimsuit
ぷらこんおしゃれみずぎもも,Pink Snazzy Swimsuit
はなかりゅうどのころもあお,Blue Flower Hunter Outfit
未完のモンセロ温泉峡への道,Road to Undone Moncello Spring Gorge
はなかりうどのころもみどり,Green Flower Hunter Outfit
ドラゴンクエストＸショップ,Dragon Quest X Shop
ドルボ用マネキンプクリポ用,For Pukulipo Mannequin For Dolboard
行動時 5%でテンションアップ,Tension On Action 5%
男性プラコン服ミストグレー,Mist Gray Clothes (M)
ドルボ用マネキンドワーフ用,For Dwarf Mannequin For Dolboard
ぷらこんいけてるみずぎしろ,White Cool Swimsuit
ぷらこんおしゃれみずぎあお,Blue Snazzy Swimsuit
ぷらこんえんじぇるふくあお,Blue Angel Clothes
『おうちでついてクン設定』,"House Pet Settings"
女性プラコン服アイスブルー,Ice Blue Clothes (F)
だんせいぷらこんふくぴんく,Pink Clothes (M)
ぷらこんおしゃれみずぎあか,Red Snazzy Swimsuit
ぷらこんぱてぃしえふくあお,Blue Pastry Chef Suit
特技のダメージ +10(試合無効),Skill Damage +10 (PvP×)
ぷらこんだんせいはかましろ,White Men's Hakama
ムストの町・教会跡への出口,Exit to Morst - Church Ruins
ドルボ用マネキンニンゲン用,For Human Mannequin For Dolboard
１００万ゴールドの入った袋,1 Million Gold Bag
ぷらこんおしゃれみずぎくろ,Black Snazzy Swimsuit
壊れたハイハイジャンプさん,Broken Mr. High High Jump
らんぷれんきんれんしゅうぎ,Lamp Alchemy Training Wear
ぷらこんぱてぃしえふくしろ,White Pastry Chef Suit
古グランゼドーラ領への出口,Exit to Old Gran Zedora Territory
ぼうえいぐんのせいふくきん,Gold Defense Force Suit
ルクスガルン大空洞への亀裂,Crevice to Luxgarn Caverns
からすかぐらのしょうぞくⅡ,Crow Dance Costume Ⅱ
ぷらこんぱてぃしえふくもも,Pink Pastry Chef Suit
ぷらこんえんじぇるふくあか,Red Angel Clothes
ぷらこんいけてるみずぎもも,Pink Cool Swimsuit
未開のジャングル地区への道,Road to Savage Jungle
特技のダメージ +15(試合無効),Skill Damage +15 (PvP×)
アスフェルド学園女性用夏服,Asfeld Summer Uniform (F)
からすかぐらのしょうぞくⅠ,Crow Dance Costume Ⅰ
アスフェルド学園女性用水着,Asfeld Swimwear (F)
未来への扉とまどろみの少女,The Door to the Future & the Slumbering Girl
ぷらこんだんせいはかまあお,Blue Men's Hakama
男性プラコン服ダークグレー,Dark Gray Clothes (M)
ぷらこんおしゃれみずぎしろ,White Snazzy Swimsuit
ぷらこんいけてるみずぎくろ,Black Cool Swimsuit
特技のダメージ +20(試合無効),Skill Damage +20 (PvP×)
じょせいぷらこんふくぴんく,Pink Clothes (F)
ドルボ用マネキンウェディ用,For Weddie Mannequin For Dolboard
はなかりゅうどのころもあか,Red Flower Hunter Outfit
ぷらこんだんせいはかまくろ,Black Men's Hakama
ランドン山脈山頂付近への道,Road to Landon Mountains Summit
戦闘中常時マホトラのころも,Magic Cloak Always Active
フラワーガーデン地区への道,Road to Flower Garden District
ぷらこんえんじぇるふくもも,Pink Angel Clothes
だんせいぷらこんふくえんじ,Red Clothes (M)
じょせいぷらこんふくえんじ,Red Clothes (F)
ハディン地下洞くつへの出口,Exit to Hadine Cavern
女性プラコン服ミッドナイト,Midnight Clothes (F)
魔物商人＆商品ナンバー１３,Monster Merchant & Item Number 13
砂の都ファラザードへの出口,Exit to Farazard
アスフェルド学園男性用水着,Asfeld Swimwear (M)
未完のドラクロン山地への道,Road to Undone Draklon Mountains
男性プラコン服ミッドナイト,Midnight Clothes (M)
ぷらこんいけてるみずぎあか,Red Cool Swimsuit
行動時 3%でテンションアップ,Tension On Action 3%
とうばつたいこうほうきょく,Strike Force Bureau
ぷらこんえんじぇるふくしろ,White Angel Clothes
スターキメラから取った羽根,Cosmic Chimaera Feather
ぷらこんえんじぇるふくくろ,Black Angel Clothes
清き風吹き　草木は芽吹く～,Pure winds blown and trees grown, budding green as the breeze is thrown
ぼうえいぐんのせいふくあか,Red Defense Force Suit
だるめしあんぼーいいしょう,Dalmatian Outfit (M)
ぼうえいぐんのせいふくこん,Blue Defense Force Suit
攻撃時 5%でチャージ時間-10秒,Charge Time -10s On Attack 5%
ぷらこんだんせいはかまこん,Navy Blue Men's Hakama
ぷらこんぱてぃしえふくあか,Red Pastry Chef Suit
アルムゴーグ＆ロムドゴーグ,Armogog & Romdogog
古レビュール街道北への出口,Exit to Old Reviewle Highway North
アスフェルド学園男性用夏服,Asfeld Summer Uniform (M)
イア・タア　シンパッ・ケウ,E-yis, aneu dish cubrey
ロヴォス高地-ゼドラ洞 入口,Rovos Highlands - Zedra Cave Entry
受けるダメージを10軽減する,Damage Taken -10
ワルド水源-湖上の休息所 前,Wald Headwaters - Lake Retreat
　(フォース無効・試合無効),　(Fource×/PvP×)
5000年の旅路 遥かなる故郷へ,5000 Year Journey to a Faraway Hometown
必殺チャージ時 身かわし+10%,Dodge +10% On Special Charge
プログラマー検証ステージ5,Programmer Verification Stage 5
スイーツゾーン控え室 出口,Sweets Zone Waiting Room Exit
味方死亡時 20%でバイシオン,Oomph If Ally Dies 20%
プログラマー検証ステージ4,Programmer Verification Stage 4
ゼクレス城・魔導広場 入口,Zechres Castle - Magic Square Entry
デス・ジャンクション 入口,Death Junction Entry
ビンゴすごろくホール 入口,Bingo/Sugoroku Hall Entry
エピステーサ底なし穴 出口,Epistesa Bottomless Pit Exit
湖の小島・神のまなこ 出口,Lake Islet - The All-seeing Eye Exit
プログラマー検証ステージ6,Programmer Verification Stage 6
ビンゴすごろくホール 出口,Bingo/Sugoroku Hall Exit
ランプ錬金ギルド 地下１階,Lamp Alchemy Guild B1F
カルデア山道のアジト 出口,Chaldea Mountain Road Hideout Exit
レビュール街道北-谷合の森,Reviewle Highway North - Veil of the Vale
オルセコ闘技城・舞台 出口,Orseco Combat Castle - Stage Exit
カルデア山道のアジト 入口,Chaldea Mountain Road Hideout Entry
とこしえの神殿楯の間 出口,Temple of Eternity Shield Room Exit
ビタースイーツゾーン 出口,Bittersweets Zone Exit
アストルティア博物館 入口,Astoltia Museum Entry
開戦時 10%でヘヴィチャージ,Starting Heavy Charge 10%
エピステーサ底なし穴 入口,Epistesa Bottomless Pit Entry
オルセコ闘技城・舞台 入口,Orseco Combat Castle - Stage Entry
受けるダメージを5軽減する,Damage Taken -5
プログラマー検証ステージ8,Programmer Verification Stage 8
湖の小島・神のまなこ 入口,Lake Islet - The All-seeing Eye Entry
からすかぐらのしょうぞく1,Crow Dance Costume Ⅰ
からすかぐらのしょうぞく2,Crow Dance Costume Ⅱ
ゼクレス城・魔導広場 出口,Zechres Castle - Magic Square Exit
リンジャハル海岸-海岸遺跡,Linjahar Coast - Coast Ruins
モリナラ地下洞・深淵 入口,Molinara Underground Abyss Entry
プログラマー検証ステージ3,Programmer Verification Stage 3
宇宙船・立入禁止区画 入口,Spacecraft - Restricted Area Entry
宇宙船・立入禁止区画 出口,Spacecraft - Restricted Area Exit
デス・ジャンクション 出口,Death Junction Exit
とこしえの神殿楯の間 入口,Temple of Eternity Shield Room Entry
スライムレースホール 入口,Slime Race Hall Entry
アストルティア博物館 出口,Astoltia Museum Exit
モリナラ地下洞・深淵 出口,Molinara Underground Abyss Exit
プログラマー検証ステージ1,Programmer Verification Stage 1
スライムレースホール 出口,Slime Race Hall Exit
シガール町長の執務室 入口,Mayor Sigal's Office Entry
古グランゼドーラ王国 入口,Old Gran Zedora Kingdom Entry
プログラマー検証ステージ2,Programmer Verification Stage 2
スイーツゾーン控え室 入口,Sweets Zone Waiting Room Entry
真夏のトレジャーハント！,Midsummer Treasure Hunt!
エミリエ婦人のマナー講座,Lady Emily's Manner Course
さらば愛しのシシカバブ！,Farewell Dear Shish-Kebab!
来たれ　おしゃれマスター,Come, Master of Fashion
輝く私のプレシャスデイズ,My Shining Precious Days
デスマスターアジトの椅子,Death Master Hideout Chair
マスター・ユービアの誘い,Master Yubia's Invite
白亜の臨海都市地区への道,Road to Chalky Waterfront
アルビデ死体・左手袋なし,Albide Corpse - Left Arm Missing
はるかぜちあーずいしょう,Spring Cheer Outfit
ダークポイックリンのハネ,Dark Poiclin Wing
モヒカント＆バッファロン,Mohawker & Buffalogre
スペシャルな石をアナタに,A Special Stone for You
新春わんわんワンだふる！,New Year Dogs Yelping!
ジャリムバハ砂漠への出口,Exit to Jyarimbaha Desert
マスター・ユービアの試練,Master Yubia's Trials
ナイトたちの血戦２０２１,Knights Bloody Battle 2021
プラコンスクール制服男紺,Blue School Uniform (M)
ゆうびんきょくいんしーら,Postman Shira
始めよう！バラ色冒険生活,Begin! Rosy Adventure
マッシュルーム地区への道,Road to Mushroom District
バトエンファイター誕生！,Batoen Fighters are Born!
だんせいきんぎょのゆかた,Men's Goldfish Yukata
プラコンスクール制服女茶,Brown School Uniform (F)
旅のお供に　超便利ツール,Useful Tool For Travelers
集え！カボチャのもとに２,Gather Round the Pumpkin!2
プラコンスクール制服男白,White School Uniform (M)
ぷらこんすいーとふくくろ,Black Sweet Clothes
ドルボ用マネキンオーガ用,For Ogre Mannequin For Dolboard
これって神のお告げなの？,Is This a Sign From God?
ティプローネ高地への出口,Exit to Tiplone Highlands
教えて！　ミラクル整理術,Tell Me! Miracle Organizer
ワンダラーズマントセット,Wanderers Outfit
せんれきに　登録された！,was registered in your Records!
ただの　しかばねのようだ,It's just a corpse
タロットマスターへの道！,The Way to Tarot Master!
プラコンスクール制服女白,White School Uniform (F)
じょしのすくーるせいふく,Girl School Uniform
ライドオン　ドルボード！,Ride On, Dolboard!
トゥーンタウン地区への道,Road to Toontown District
みいらおとこのいしょう２,Mummy Boy Costume 2
幻の色違いを釣りあげろ！,Catch Phantom Colors!
