エゼソル峡谷への道,Road to Ezesol Canyon
フォーリオンのラグ,Fourion Rug
苺お菓子のオーブン,Berry Sweet Oven
バブスラジャムパン,Bubble Slime Jam Bread
魔天兵ゴルドーたち,Evil Soldier Goldo and co.
オブジェクト座標142,Object Coordinates 142
オグチャビ像こげ茶,Olive Ogreed Chubby St.
メレアーデカプセル,Mereade Toy
異界獣ヘイズシナー,Haze Sinner, the Otherworldly
第３回カジノ祭・金,3rd Casino Fest Gold
ゴージャスなゆびわ,Gorgeous Ring
ヴィンテージの時計,Vintage Watch
ほこらの祭祀場・氷,Ice Shrine Ritual Ground
ゾディアックコード,Zodiac Code
武闘家ヤーン分身Ｂ,Martial Artist Yarn Copy B
オブジェクト座標260,Object Coordinates 260
ベラのギフト引換券,Honey's Gift Voucher
しぐさ書・究極呪文,Emote "Ultimate Spell"
始まりの大魔王の舞,First Demon Lord Dance
カウンターブースト,Counter Boost
マジカルじんべい下,Magical Jinbei Bottom
パピヨンドーム・夢,Dream Papillon Dome
パンジーのビスチェ,Pansy Bustier
魔物管理人シャウラ,Monster Manager Shaula
たれキジ猫カプセル,Lazy Brown Cat Toy
スワンボートベンチ,Swan Boat Bench
燃えるほのおの凱歌,Triumph of Flames
竜族の隠れ里の温泉,Nadravian's Rest Bath
ワイルドキャンディ,Wild Lollipop
あやしいテーブル大,Suspicious Table L
エックス君冒険印章,Adventurous X Stamps
りゅうおうアックス,True Dragonlord Axe
凱歌のガントレット,Valkyrie Gauntlets
星くずの灯ろう・紫,Purple Stardust Lantern
キングスライム噴水,King Slime Fountain
労働魔神機０３８号,Aztech Labor Mech No. 038
海賊なりきりたき火,Pirate Campfire
ビクトリーボックス,Victory Box
ホオズキランプの木,Winter Cherry Lamp Tree
アストルティア図鑑,Astoltia Picture Book
サファイアのピアス,Sapphire Earrings
ふんわりパンケーキ,Fluffy Pancakes
聖守護者ブーメラン,Sentinel's Boomerang
しぐさ書・ネオン黄,Emote "Neon Yellow"
ブラッドメイジたち,Blood Mages
モダンバニーフレア,Modern Bunny Skirt
ドラゴンスラッシュ,Dragon Smash
青の巨人ブルメル強,Apex Blue Giant Blumel
マスカレイドスーツ,Masquerade Suit
攻撃時に雷耐性低下,Thunder Resist Down Attack
ビクトリーチップ闇,Dark Victory Chip
氷の魔王のスーツ下,Ice Demon Suit Bottom
白トラ太猫カプセル,Fat White Tabby Toy
花火交換屋ユリユリ,Fireworks Exchange Yuriyuri
アスバルのこころ１,Asbal's Heart Lv1
ダミーうでＥ００１,Dummy Hand E001
白蛇のこんの作り方,Make a White Snake Rod
シスター・クレセダ,Sister Creseda
プラコンゴーレム服,Golem Costume
アンノウンハンマー,Unknown Hammer
おてんば姫グローブ,Alena's Gloves
惜別の置き手紙伝説,Farewell Letter Legend
魔物管理人ポリッピ,Monster Manager Polippi
マーメイドティアラ,Mermaid Tiara
メレアーデスカート,Mereade Skirt
アクロバットケーキ,Acrobatic Cake
オブジェクト座標094,Object Coordinates 094
フラウススティック,Flaus Wand
第２回カジノ祭・金,2nd Casino Fest Gold
りょうりにんぴーら,Chef Peera
王都カミハルムイ南,Kamiharmui City South
翠将鬼ジェルザーク,Gelzark, the Green General
第１１回セラフィ像,11th Seraphi Statue
月のおうぎのレシピ,Lunar Fan Recipe
カフェテラスの看板,Cafe Terrace Sign
ごうかなラグ中・緑,Green Fancy Rug M
鳥かごのポスト・桃,Pink Birdcage Mailbox
お花の外灯の作り方,Making Flower Lights
サラムのブーメラン,Salam's Boomerang
エルドナ神のリボン,Eldona's Ribbon
水晶のイスと机の本,Crystal Furniture Book
ウェディのターバン,Weddie Turban
暴君バサグランデ強,Apex Tyrant Bogan
オブジェクト座標055,Object Coordinates 055
パワーストーンマン,Power Stone Golem
しぐさ書・決め左前,Emote "Pose L. Front"
強・キャッツメダル,Apex Cats Medal
小辛翼竜バードアイ,Hot Pterosaur
バトルマスターの影,Battlemaster's Shadow
炎うず巻く聖なる鳥,Fiery Holy Bird
ギガンテスカプセル,Gigantes Toy
ポセイドンバスタブ,Poseidon Bathtub
悪夢より来たるもの,The One From Nightmares
雪だるまスライダー,Snowman Slide
オブジェクト座標071,Object Coordinates 071
キューピッド衣装券,Cupid Costume Ticket
かたりべの服セット,Storyteller's Outfit
淡い記憶を紐解いて,Unraveling Faint Memories
オパールのオーブン,Opal Oven
まがんの杖の作り方,Making a Hocus Locus
第３回セラフィの像,3rd Seraphi Statue
メタスラのバスタブ,Metal Slime Bathtub
カラフル花火台・白,White Fireworks Stand
オブジェクト座標043,Object Coordinates 043
白猫オッドカプセル,Odd White Cat Toy
マポレーナステッキ,Genie Sanguini Wand
ムーンバニーブーツ,Moon Bunny Boots
アクエリアスガード,Shield of Aquarius
闇の領界のレリーフ,Dark Realm Relief
古代ウルベア魔神兵,Ancient Urbea Aztech
防衛魔神兵０５５号,Aztech Guard No. 055
アシュレイの髪飾り,Ashley's Hairpin
新七不思議コン・銅,Seven Wonders Bronze
黒猫オッドカプセル,Odd Black Cat Toy
ピカレスクグローブ,Picaresque Gloves
お花の外灯・ブルー,Blue Flower Light (G)
聖王のナイフの壁画,Dryspell Knife Book
王都カミハルムイ北,Kamiharmui City North
スラライトステッキ,Slimelight Stick
サハラコートセット,Sahara Outfit
アンルシアの便せん,Anlucia Paper
ギガントヒルズ・強,Vicious Drakularge
魔幻園マデッサンス,Demon Park Madessaince
ぬすむ成功率アップ,Half-Inch Success Up
ジュレリア地下廃坑,Juleria Underground Mine
ディバインクラウン,Divine Crown
破壊のオノの作り方,Obliteratoriser Book
錬金悪魔の言い伝え,Alchemy Demon Lore
ジェントルコート下,Gentleman's Pants
学園の菜園の飾り棚,Academy Garden Shelf
エンゼルスラネオン,Angel Slime Neon Sign
全職さいだいＨＰ+10,Max HP +10
旅人バザー・道具屋,Traveler's Bazaar/Item Shop
ギュッと魔勇者の箱,Evil Hero Arm Doll Box
しおさいキャンディ,Salted Candy
魔物管理人セモーナ,Monster Manager Semona
エステラのこころ４,Estella's Heart Lv4
スコーピオンテイル,Scorpion Tail
パラディチェイン２,Paladin Chain Mail 2
遊び人のサングラス,Gadabout's Sunglasses
領界調査バインダー,Realm Survey Binder
レアドロップ率1.1倍,Rare Drop Rate 1.1x
素材タネ屋ムントン,Material Seed Shop Munton
グリーンシザー・強,Vicious Green Scissors
茶トラ太猫カプセル,Fat Brown Tabby Toy
最新の混乱封印対策,Chaos Sealing Measures
オブジェクト座標120,Object Coordinates 120
踊り神ボニータ右羽,Dance God Bonita Right Wing
伝説の三悪魔コイン,Legendary Evils Coin
バトルレックスの書,Hacksaurus Book
ピンクモーモンラグ,Pink Sanguini Rug
カラフル天井ライト,Colorful Ceiling Light
オブジェクト座標211,Object Coordinates 211
キラーマジンガの像,Uberkilling Statue
ナイトマリーのタネ,Night Marie Seed
ゴシック調のベッド,Gothic Bed
アオちゃんカプセル,Bluey Toy
ミツバチパーカー上,Honeybee Hoodie
ギュメイ将軍コイン,Goresby-Purrvis Coin
銀の錬金ツボ小の本,Silver Pot S Book
グランゼドーラ兵Ａ,Gran Zedora Soldier A
ホイミントバンダナ,Heal Mint Bandana
四角型のトピアリー,Square Topiary
スノーボールンたち,Snowballon and co.
学園男子のエプロン,Schoolboy Apron
プラコン・赤い唐傘,Red Paper Umbrella
アカツキショウグン,Mandrake Murderer
童話の街並みの街灯,Fairy-Tale Lamppost
召喚士リンジャーラ,Summoner Linjara
ウルベア魔神兵たち,Urbea Aztechs
ディバインメイル下,Divine Mail Bottom
花菱模様のノンラー,Floral Pattern Non La
バイオレットの花束,Violet Bouquet
お掃除マシン・白式,White Cleaning Machine
カラフルスラ花火台,Slime Fireworks Stand
ボディーガード呼び,Call Bodyguard
黒鳥のサークレット,Blackbird Circlet
強戦士の聖域・前室,Warrior's Sanctuary - Gate
雑貨屋さんの屋根茶,Brown Shop Roof
しぐさ書・狼まわし,Emote "Wolf Spin"
新春初ウリ冒険譚！,New Year First Adventure!
ふわふわホミロット,Fluffy Healix
小島に隠された秘密,Secret Hidden on the Isle
ミイラエルフ人形男,Mummy Elf Doll (M)
経験値の古文書・大,Experience Scroll L
ぽぽえるうんてんし,Driver Popoel
水着貸し屋レターヌ,Swimsuit Rental Shop Letann
召集！　五領界会談,Convene! 5 Realms Meeting
ジュラシックロイド,Jurassic Droid
クルクルポシェット,Bag o' Books
壁かけフウラ肖像画,Fuura Portrait
配布用経験値の聖典,Experience Scripture
おとぎの森エプロン,Fairy Forest Apron
プラチナのランプ小,Platinum Lamp S
ふしぎな燭台・黄色,Yellow Mysterious Candlestick
ウェディングチェア,Wedding Chair
エテーネ軍の兵士Ｄ,Ethene Army Soldier D
捨てられた城への道,Road to Abandoned Castle
党首マスター・ドー,Spicy Party Leader Mustardo
しぐさ書・お祝い黄,Emote "Celebrate Ylw."
深い森の修道院の塀,Monastery Fence
ピオラの杖の作り方,Rod of Rapidity Book
オブジェクト座標252,Object Coordinates 252
疾き盗賊のグローブ,Erik's Gloves
ダラズ採掘場への道,Road to Daraz Quarry
オブジェクト座標289,Object Coordinates 289
潮風のディーバたち,Sea Breeze Divas
ノーブルギフト・黒,Black Noble Gift
ポイズントリル・強,Vicious Poison Trill
しましまマフラー青,Blue Striped Scarf
ドワーフカウンタ大,Dwarf Counter L
プラズマリムーバー,Plasma Remover
クローバーＴシャツ,Clover T-Shirt
いやしの服のレシピ,Healing Outfit Recipe
ナドラガ教団大神殿,Nadraga Order's Grand Temple
イグナイトメイル下,Ignite Mail Bottom
銀甲の崩撃将ダバム,Silver Raze General Dabam
予言者学園女学生服,FTA Uniform (F)
マジックチャクラム,Magic Circle
壁かけ夜の神殿の絵,Temple of Night Painting
とこしえのゆりかご,Eternal Cradle
目覚めし五つの種族,Awakening of the Five Tribes
蚊帳つきフトン・紫,Purple Futon with Net
シスター・アマティ,Sister Amati
グリーターデーモン,Greeter Daemon
プリティサングラス,Pretty Sunglasses
ゴレオン将軍カード,Goreham-Hogg Card
良薬はキケンな香り,Good Medicine Smells Bad
第１０回ナジーン像,10th Najinn Statue
ジュレー島下層遺跡,Lower Jule Island Ruins
ダイナースニーカー,Diner Sneakers
ダンディタキシード,Dandy Tuxedo
タイタニアステッキ,Butterfly Baton
シスター・エレーヌ,Sister Elaine
オブジェクト座標098,Object Coordinates 098
ゲフェンダイトの袋,Gefendite Sack
プクリポのあいさつ,Pukulipo Greeting
賢哲のころもセット,Wise Man Outfit
オブジェクト座標083,Object Coordinates 083
メッキのトロフィー,Plated Trophy
スタースイーツ・小,Small Star Sweets
ムーディーテーブル,Moody Table
しぐさ書・とまどう,Emote "Bewildered"
天地雷鳴士の高みへ,The Heights of a Druid
フォートレスハウス,Fortress House
ドット階段柄のラグ,Stairs Rug
ヴェリナード城下町,Verinard Castle Town
ゆめみの竜箱タンス,Dreamy Dragon Wardrobe
青のほこらの洞くつ,Blue Shrine Cave
防衛軍の制服・灰色,Gray Defense Force Suit
大きなお花のベッド,Large Flower Bed
マデュライトルアー,Darkonium Lure
オブジェクト座標228,Object Coordinates 228
オブジェクト座標255,Object Coordinates 255
スイカのタライ・金,Gold Watermelon Basin
ゴレオン将軍練習札,Goreham-Hogg Tag
魔法使いは行方不明,The Mage is Missing
ダンサーヘアバンド,Dance Hairband
プチデビルスーツ下,Petit Devil Pants
お土産屋さんの縁台,Souvenir Shop Bench
桃色チューリップ傘,Pink Tulip Umbrella
ゴールドマンＸ７号,Gold Golem X 7
よろず屋ドロッジェ,General Shop Drogger
極天女帝の浮遊椅子,Sky Empress' Floating Chair
翠煙の波皇将ネブド,Blue Wave General Nebudo
ふわふわサメバーン,Fluffy Sharkburn
リンベリィのドレス,Linberry's Dress
レジェンズショット,Legends Bow
機工博士のコート上,Engineer's Upper Coat
壁かけ潜水艦ライト,Submarine Wall Light
シャボン玉の花かご,Bubble Flower Basket
占い師ミネアの依頼,Help Fortune Teller Meena
エンジェルウィング,Angel Wing
お友達紹介チケット,Refer-a-Friend Ticket
ハートのベッド・黄,Yellow Heart Bed
市松模様のふりそで,Checkered Kimono
ドルボードの残がい,Dolboard Remains
パラソルスティック,Jolly Brolly
ちからのペンダント,Wrecklace
かっぱえび家の帽子,Shrimp Snack Hat
ピュアスノーの花束,Pure Snow Bouquet
アスバルのこころ９,Asbal's Heart Lv9
真夏のビーチ便せん,Midsummer Beach Paper
花狩人の衣装券・黄,Yellow Flowerer Voucher
花束交換屋ププリン,Bouquet Shop Pupurin
ふわあまアーモンド,Soft Almond
郵便局員ポエーツォ,Postman Poezzo
闇色に染まるマント,Cloak of Darkness
ミラクルサンド・小,Small Miracle Sandwich
未完の風穴の研究室,Undone Windy Cave Lab
オブジェクト座標062,Object Coordinates 062
ビビッド・グリーン,Vivid Green
とある老行者の試練,Trials of an Old Pilgrim
第８回釣りコン・銅,8th Fish Contest Bronze
暗黒大樹の番人たち,Dark Tree Guardians
古代つちわらしたち,Ancient Lickspittles
ポップスターの服下,Pop Star Skirt
マタドールスーツ上,Matador Suit Top
強戦士の聖域・闘場,Warrior's Sanctuary - Arena
創世の神の絵の写真,God of Creation Photo
レトロなポスト・金,Gold Retro Mailbox
ふわふわフラフの箱,Fluffy Fluff Box
プチマジンガカード,Frail Uberkilling Card
鉄巨兵ダイダルモス,Iron Giant Daedalmos
プクリポプランター,Pukulipo Planter
インディヴィテスト,Indivi Test
ベジタブル家具の本,Veggie Furniture Book
七夕の吹き流し・星,Paper Star Streamers
うさみみギフト・青,Blue Rabbit Ears Gift
竜と剣の水玉便せん,Dragon Polka Dot Paper
おうち用野道のラグ,Field Path Rug
三毛猫スーツ衣装券,Calico Cat Suit Voucher
幻想画「一獲千金」,Fantasy Art "Get Rich Fast"
しぐさ書・怒り心頭,Emote "Furious"
ワンダラーズブーツ,Wanderers Boots
レジェンズアックス,Legends Axe
オブジェクト座標259,Object Coordinates 259
紫水晶のカーペット,Amethyst Carpet
ビクトリーチップ金,Gold Victory Chip
花狩人の衣装券・赤,Red Flowerer Voucher
おつかれさまでした,Thanks for your hard work.
ジュレット駅の模型,Julet Station Model
ホイミスライムの書,Healslime Book
ポップスターセット,Pop Star Outfit
パラディノアックス,Paladinsaurus Axe
ヒューザスティック,Hyuza Wand
タウン案内係ポポコ,Town Guide Popoko
コロシアムバーガー,Coliseum Burger
さいほう職人腕あて,Sewer's Armguards
タータンマフラー赤,Red Tartan Scarf
トレジャーコート上,Treasure Coat Top
ゴルフメンズウェア,Golf Men's Wear
きれいなバラのトゲ,Beautiful Rose Thorn
さざなみギフト・黄,Yellow Ripples Gift
ザンクローネソファ,Zankrone Sofa
ボーイモッズコート,Boy Mod Coat
メタル出現率アップ,Metal Encounter Rate Up
ダークグレーの花束,Dark Gray Bouquet
メレアーデキッチン,Mereade Kitchen
朽ちた遺跡の庭用壁,Ruin Wall (G)
しらふじいろダリア,White Wisteris Dahlia
タイタス号の飾り棚,Titus Shelf
ロードリーローブ下,Lordly Robe Bottom
スマートローボード,Smart Lowboard
ズッシリゾット・小,Small Sushi Risotto
聖王のつるぎの壁画,Dryspell Sword Book
ヤドリギ広場　出口,Mistletoe Plaza Exit
ベビタン竜族人形男,Imp Nadravian Doll (M)
おいしく焼きしめて,Deliciously Roasted
キャンディのピアス,Candy Earrings
ボディーガード強化,Bodyguard Boost
ゆらゆら牛さん・白,White Rocking Ox
古グランゼドーラ城,Old Gran Zedora Castle
とこなつココナッツ,Summer Coconut
小さな英雄の便せん,Little Hero Paper
セクシーギフト・黒,Black Sexy Gift
ギュッとリィンの箱,Lynn Arm Doll Box
ごうかなラグ大・赤,Red Fancy Rug L
スパイスカレー・小,Small Spicy Curry
ウェディの人形・男,Weddie Doll (M)
グーシオンカプセル,Dark Pazuzu Toy
ガーデンスーツ衣装,Garden Suit Outfit
攻撃時25%暴走アップ,Haywire Up Attack 25%
預かり所仮面オレン,Storage Masked Oran
支援魔神機０２１号,Aztech Support Mech No. 021
初心者用スティック,Beginner's Wand
郵便局員ブリッシュ,Postman Blish
ハロウィン衣装券Ⅳ,Halloween Voucher Ⅳ
森林警備隊グローブ,Forest Ranger Gloves
フーたんのブローチ,Futan Brooch
リーフシードラゴン,Leafy Seadragon
スクアーロの写真４,Squalo's 4th Photo
オーガの村人うでわ,Ogre Villager Bracers
大聖堂のオルゴール,Cathedral Music Box
きじゅつしのズボン,Illusionist's Pants
東洋風透かし窓・華,Floral Orient Window
キラパン白プリズム,White Sabrecat Prism
レンダーヒルズ地区,Lender Hills District
ゼドラ王国服モブ６,Zedra Royal Clothes Mob 6
不気味なペンダント,Spooky Pendant
ドット旅の扉柄ラグ,Travel Door Rug
将軍のゆびわの破片,General Ring Shard
揺らぎはじめる世界,World That Begins to Shake
けんぽうぎの作り方,Make a Tussler's Outfit
深い森の邸宅の屋根,Forest Manor Roof
ワンダラーズマント,Wanderers Mantle
古レビュール街道北,Old Reviewle Highway North
光飾りタイルの鏡台,Light Tile Vanity
ヒールカルボナーラ,Heal Carbonara
異国の寺院の庭用床,Exotic Temple Floor (G)
パンパニーニノート,Panpanini's Notebook
サイクロンアッパー,Air Raiser
ユーライザフェイク,Yuliza Fake
となかいのきぐるみ,Reindeer Costume
ラダトームのブーツ,Tantegel Boots
メタスラの大剣の本,Metal Gooreatsword Book
四季の壁画つき浴槽,Four Seasons Bathtub
湖の魔獣ボルゲルグ,Lake Beast Volgerg
星空のチェスト・青,Blue Starry Chest
ビクトリーチップ黄,Yellow Victory Chip
どうぐ使いぼうし２,Item Master Hat 2
魔想念レギルラッゾ,Demonic Thought Legirrazzo
真紅の殺人機械たち,Crimson Killing Machines
オブジェクト座標268,Object Coordinates 268
ミラーガントレット,Mirror Gauntlets
スライムのチェスト,Slime Chest
タウン案内係カーサ,Town Guide Casa
プラコンドレス・青,Blue Dress
プチゴレオンカード,Frail Goreham Card
転生の花（つぼみ）,Rebirth Flower (Bud)
メタッピーの像・庭,Mecha-Mynah Statue (G)
王宮のオーブン・赤,Red Royal Oven
クモの巣カーペット,Spider Web Carpet
豪華なシャンデリア,Luxury Chandelier
ハート兵隊スカート,Heart Soldier Skirt
フリルスイムワンピ,Frill Swim Dress
エテーネのあいさつ,Ethene Greeting
マジカルギフト・青,Blue Magical Gift
チームゆく年くる年,Team New Year
ウワサの魔物の写真,Rumored Monster Photo
お菓子のテーブル大,Sweet Table L
オブジェクト座標261,Object Coordinates 261
預かり所フォッチャ,Storage Foccia
ハクオウのこころ７,Hakuo's Heart Lv7
エトワールグローブ,Etoile Gloves
マスター・ポーリア,Guildmaster Paulia
フェアリーウィング,Fairy Wings
お花大好きブラバー,Flower Lover Blubba
月明かりは消えない,Moonlight Never Goes Out
光とブレスの防ぎ方,Defend Light and Breath
第１１回ケイト像庭,11th Kate Statue (G)
クローバーシールド,Clover Shield
アイドルギフト・白,White Idol Gift
リポちゃんふうせん,Lipo Balloon
レンタル花がら水着,Rental Floral Swimwear
シルエット・犬・白,White Silhouette Dog
果てなき修練の末に,After Endless Training
クリスマスレンタ頭,Christmas Rental Head
防衛魔神兵０５２号,Aztech Guard No. 052
ハクオウのこころ１,Hakuo's Heart Lv1
おどるほうせきの書,Goodybag Book
学者のころもセット,Academic Outfit
オブジェクト座標257,Object Coordinates 257
ごうかな食器棚・緑,Green Fancy Cupboard
スライムぬいぐるみ,Slime Plushie
ダイナーズボン衣装,Diner Trousers Outfit
攻撃時25%でヘナトス,Blunt Attack 25%
イルーシャトランプ,Illusia Cards
タッツィのお手伝い,Tazzi's Help
マーメイドオブジェ,Mermaid Curio
月に還る双子の物語,Tale of Two Moons
がーるもっずこーと,Girl Mod Coat
ゼドラ王国服モブ８,Zedra Royal Clothes Mob 8
キラパンぬいぐるみ,Sabrecat Plushie
鍛冶素材屋レヴェリ,Smithing Materials Reverie
エテーネ王国２印章,Ethene Kingdom 2 Stamps
お花の鉢植え・家用,Flower Plant Pot
ブレイブギフト・黒,Black Brave Gift
エキゾチックピアス,Exotic Earrings
試みの荒野への出口,Exit to Wilderness of Trials
クロッシュウェア下,Bell Leggings
プラコン・白い唐傘,White Paper Umbrella
オブジェクト座標034,Object Coordinates 034
しぐさ書・線香花火,Emote "Sparkler"
スカーレットナイト,Scarlet Knight
ヒューザのこころ１,Hyuza's Heart Lv1
魔物管理人アゼルル,Monster Manager Azerul
ウサギ魔物の装束上,Rabbit Monster Shirt
黄金獣アルムゴーグ,Golden Beast Armogog
ゼクレス魔導兵たち,Zechres Mages
冥府と虚空の支配者,Ruler of the Void and the Dead
オブジェクト座標018,Object Coordinates 018
スマートな水着・黄,Yellow Smart Swimsuit
オブジェクト座標155,Object Coordinates 155
壊れた酒場の置き物,Broken Tavern Ornament
賢者の杖クラッシュ,Sage's Staff Crash
パッチ柄ソファ・青,Blue Patch Sofa
赤バラのドレッサー,Red Rose Vanity
魔塔の青宝石付き壁,Blue Tower Jeweled Wall
キューピッドの噴水,Cupid Fountain
しぐさ書・Ｓハート,Emote "Signal Heart"
シルフウィング・青,Blue Sylph Wings
マリン調のバスタブ,Marine Bathtub
カボチャカウンタ小,Pumpkin Counter S
スライダークカード,Nemeslime Card
耐火性きんちゃく袋,Fireproof Bag
シール少年マツタケ,Sticker Boy Matsutake
お花のパールピアス,Flower Pearl Earrings
メレアーデウィッグ,Mereade Wig
ケツァルコアトルス,Quetzalcoatlus
グレースギフト・緑,Green Grace Gift
キングスライムの像,King Slime Statue
アジサイじんべい上,Hydrangea Jinbei Top
空飛ぶ円盤プリズム,Flying Saucer Prism
オブジェクト座標104,Object Coordinates 104
おめかしＶチケット,Dress-up V Ticket
王様のハンティング,King's Hunting
チョッピ荒野の木Ｂ,Choppi Wilderness TreeB
オフビートなアイツ,That Offbeat Person
魔法使いの服セット,Mage Outfit
ドワーフの人形・男,Dwarf Doll (M)
生と死の重なるとき,Life and Death Overlap
ぶんぶんパニック！,Buzz Buzz Panic!
ウィザード鏡台・黒,Black Wizard Vanity
オブジェクト座標089,Object Coordinates 089
超さいほう針小の本,Super Needle S Book
魔衛隊士のよろい下,Demon Guard Leggings
ドラキーマの像・庭,Drackyma Statue (G)
壁かけＤＱⅩⅠの絵,DQⅩⅠ Painting
ポーポラ地方の木Ａ,Popola Region Tree A
ナチュラルチェスト,Natural Chest
オーガニックサラダ,Ogre-nic Salad
ウサぐるみグローブ,Rabbit Gloves
ガラスケースのカギ,Glass Case Key
星空のチェスト・紫,Purple Starry Chest
第８回ナラジアの像,8th Narasia Statue
ファフニルメイル下,Fafnir Mail Bottom
幻想画「一喜一憂」,Fantasy Art "Hope and Fear"
ソーミャ宛ての手紙,Letter to Somya
おばけのいしょう２,Ghost Costume 2
？？？？からの小包,Parcel from ????
大地の箱舟プリズム,Ark of the Earth Prism
おうち用地面のラグ,Ground Rug
お庭用グリッドラグ,Grid Rug (G)
ワイルドマシュマロ,Wild Marshmallows
水玉模様のふりそで,Polka Dot Kimono
ユシュカのこころ４,Yushka's Heart Lv4
栄光の騎士道指南書,Glorious Chivalry Guide
オブジェクト座標139,Object Coordinates 139
アリアハンかんむり,Aliahan Circlet
パクレ警部の事件簿,Inspector Pakul's Case
クイックジャケット,Quick Jacket
カボチャテーブル小,Pumpkin Table S
ネジガラミの根の束,Bundle of Twisty Root
小さな英雄のブーツ,Little Hero's Boots
エッグの写真ケース,Egg Photo Case
ホットな海パン・黒,Black Hot Trunks
チョッピ荒野の木Ｃ,Choppi Wilderness TreeC
スラタワーステッキ,Slime Stack Stick
空が紅く染まるとき,When the Sky Turns Red
ばくだん岩の像・庭,Rockbomb Statue (G)
シスター・プリミン,Sister Purimin
しぐさ書・リュート,Emote "Play Lute"
預かり所ビッティス,Storage Bittis
アズ・フーラズーラ,Azu Fluzula
うさみみギフト・白,White Rabbit Ears Gift
おてんば姫のブーツ,Alena's Boots
ファルコンウィング,Falcon Wing
前ウェーブつけ毛Ａ,Front Wavy Hairpiece A
不死の魔王ネロドス,Nerodos, the Immortal Demon King
血潮の浜辺への出口,Exit to Bloody Beach
オブジェクト座標171,Object Coordinates 171
