トコトコリゼルコ,Trotting Lieseluco
ゴシックパラソル,Glumbrella
セラフィムのやり,Seraph's Spear
不滅の闘士のオノ,Axe of the Immortal
塔のガーディアン,Tower Guardian
男性プラコン服白,White Clothes (M)
シスター・サテラ,Sister Satella
トランプグローブ,Tycoon Gloves
レンタル屋パルノ,Rental Shop Parno
蒼天のソウラ印章,Souten no Soura Stamps
キリングエナジー,Killing Energy
ドラキュラパーツ,Dracula Parts
しぐさ書・お祝い,Celebrate
ドラポヨモニター,Tubby Dracky Monitor
シスター・ノンナ,Sister Nonna
レジェンズケース,Legends Case
さいほうサンダル,Sewer's Sandals
マダムの店の緞帳,Madame's Shop Curtain
聖守護者のつるぎ,Sentinel's Sword
ヴェリナード領西,Verinard West
表情の書・ねがお,Sleepy
キャプテンドラゴ,Captain Drago
キュルル花火・虹,Rainbow Kyururu Fwork
種族ＬＯＶＥ印章,Kindred Devotion Stamps
チョコっと衣装券,Choco Costume Ticket
魚交換員ポポヘプ,Fish Exchange Popohepu
時の化身クルッチ,Ickle the Tockle
ファラザード印章,Farazard Stamps
ステラトルネード,Stella Tornado
オフビートクロー,Offbeat Claw
めっとなしすーつ,Helmetless Suit
キノコのスタンド,Mushroom Stand
シーサイドタンス,Seaside Wardrobe
マジカル姫ハット,Magical Hat
スラシャボンの像,Liq. Soap Slime Statue
とこなつハッピ下,Summer Skirt
クリスマスライブ,Christmas Live
スチームキッチン,Steam Kitchen
お祝いシャワー緑,Celebration (Green)
よろず屋ミガンス,General Shop Migans
しっかりせんべい,Firm Rice Cracker
たいようのおどり,Sun Dance
おばけのいしょう,Ghost Costume
ゴールデンライト,Golden Light
フォースブレード,Force Blade
ナルビア宿屋の家,Nalbia Inn House
蘇りし大祭壇の間,Restored Grand Altar
アサシンブラッド,Hellbound Hunter
うらないしはっけ,F. Teller Hakke
ガートラント城駅,Gartlant Castle Station
１億ゴールドの袋,100 Million Gold Bag
王城の悪夢・３階,Nightmare's Castle 3F
栄華へのきざはし,Stairway to Splendor
マザー・ヨハンナ,Mother Johanna
かなしきいれーん,Sad Elaine
魔天殻レメゲノン,Sky Shell Remegenon
ネタ「グレドラ」,Great Dragon Trick
アビスキャンディ,Abyss Lollipop
レジェンズロッド,Legends Rod
苺お菓子のベンチ,Berry Sweet Bench
セラフィパラソル,Seraphi Umbrella
つっこみレーサー,Ridge Racer
セピアンフリル下,Sepian Pants
ルビン宙橋への扉,Door to Rubin Bridge
ブルービックバン,Blue Big Bang
飛竜の巣のベッド,Flying Dragon Nest Bed
クエド丘陵への道,Road to Kuedo Hill
リリオルを探せ！,Find Lyriol!
デスマスターの証,Death Certificate
実行委員エルスカ,Executive Committee Elska
ゴールドデーモン,Gold Daemon
ノーブルコート下,Noble Coat Bottom
深い森の邸宅の塀,Forest Manor Fence
ミラクルブースト,Hurt Converter
初期プクリポ女性,Initial Pukulipo Female
リトライストーン,Retry Stone
プチデビルブーツ,Petit Devil Boots
学園男子の夏服改,Schoolboy Summer Wear 2
冒険者のてぶくろ,Adventurer's Gloves
エルフカウンタ大,Elf Counter L
レースの観客１２,Race Spectator 12
ヤマネコグローブ,Wildcat Gloves
空のワインボトル,Empty Wine Bottle
魔の試練・第１層,Demon Trials - L1
シンプルシューズ,Simple Shoes
星降りのローブ下,Starry Robe Bottom
あこがれの盗賊王,Longing for a Thief King
ブレイブクリーム,Brave Cream
妖精変身ステッキ,Fairy Makeover Wand
におうだちの心得,Steadfast Forbearance
守護鬼の間への道,Road to Keeper's Chamber
三姉妹のモビール,3 Sisters Mobile
白木のテーブル大,Plain Table L
香りたつ幻の果実,Fragrant & Great Fruits
シロブタカプセル,White Pig Toy
機密文書・Ｐ１号,Classified Document "P1"
たいやきプリズム,Taiyaki Prism
お祝いシャワー黄,Celebration (Yellow)
モンスター討伐隊,Monster Strike Force
便せん屋ヒメウズ,Stationery Shop Himeuzu
ふわふわクマノミ,Floaty Clownfish
アサガオのアーチ,Morning Glory Arch
オーロラカメリア,Aurora Camellia
大地の竜玉の破片,Earthwyrm's Eye Shard
お茶屋のパラソル,Teahouse Umbrella
ネオン・メーター,Neon Meter
賢者セレディーネ,Sage Celedine
クラシカルハット,Classical Hat
しびれくらげ０５,Man o' War 05
ももんじゃケープ,Platypunk Cape
預かり所ユリーラ,Storage Yurila
マキュリの給水所,Makyuri Drink Station
エテーネ王国印章,Ethene Kingdom Stamps
指先で触れる世界,World at Your Fingertips
ほのおのグリーブ,Flame Greaves
シンイのこころ７,Shini's Heart Lv7
ディバインロッド,Divine Rod
マドロック海賊団,Madlock Pirates
レクスルクスの楔,Lexlux Link
ロボとサジェの畑,Robot Sajay Field
魔宮の守護者たち,Evil Shrine Guardians
討伐隊員シーナン,Strike Force Sinan
カージナルテトラ,Cardinal Tetra
こげ茶猫カプセル,Olive Cat Toy
パンプキッズ・強,Vicious Pumpkid
初心者用の片手剣,Beginner's Sword
哀愁のパン耳伝説,Sorrow Bread Legend
ネタ「だいこん」,Radish Trick
デビパンクブレス,Devil Punk Bracelets
乗り物係ナポポフ,Vehicle Clerk Napopofu
銅の鍛冶ハンマー,Copper Hammer
帝国三将軍カード,Triumgorate Card
ゴールデンリーフ,Golden Leaf
希少な水晶の伝承,Rare Crystal Folklore
荷馬車の作業員Ａ,Wagon Worker A
縁日のお面屋さん,Festival Mask Shop
タイフーンブーツ,Typhoon Boots
ギガモーモリーナ,Giga Sanguilina
水の領界のガゼボ,Water Realm Gazebo
キュルル花火・赤,Red Kyururu Firework
預かり所トッケロ,Storage Tokkero
親分ザメの浮き輪,Boss Shark Floatie
ゴシック調の本棚,Gothic Bookshelf
黄金ツボの調度品,Golden Urn Decor
Ｖジャンプベレー,V Jump Beret
星拳士シャドポン,Starfighter Shadowpon
聖守護者のおうぎ,Sentinel's Fan
よろず屋ペピール,General Shop Pepeelu
商人たちのテント,Merchants' Tents
ウェディングくま,Wedding Bear
ムーディーソファ,Moody Sofa
夢の王国グローブ,Dream Kingdom Gloves
ししおどしセット,Scaredeer Set
プクリポの便せん,Pukulipo Paper
落陽の草原の木Ａ,Sunset Meadow Tree A
オーガカウンタ大,Ogre Counter L
バトマスグローブ,Battlemaster Gloves
ドラゴン花火・黄,Yellow Dragon Firework
どういたしまして,You're welcome.
暗黒の魔人コイン,Ruin Coin
ファンシーカカオ,Fancy Cacao
ダラリア砂岩遺跡,Daleria Sandstone Ruins
黄金のブローチ？,Golden Brooch ?
スカウト率アップ,Scout Rate Boost
エックス君の像３,Mr. X Statue 3
魔侯爵のグリーブ,Marquis Greaves
ピクニックウルタ,Ulta Picnic
プヨンターゲット,Healium Balloon
忘我のシシカバブ,Forgetful Shish Kebab
シスター・ウナス,Sister Unasu
預かり所カチュア,Storage Kachua
住宅素材屋ハクヒ,Housing Materials Hakuhi
最果ての地下遺跡,Deepest Depths
パーティードレス,Party Dress
レシピ屋ルペッタ,Recipe Shop Ruperta
アラハギーロ城内,Al-Ahagiro Castle
ラズバーンの怨霊,Razburn's Ghost
海竜ヴォドニーグ,Sea Dragon Vodnig
エンジェル衣装券,Angel Costume Ticket
マッドレインボー,Rainbow Mannequin
ダイナーシューズ,Diner Shoes
ユマテルの教べん,Umatel's Pointer
光の神殿の便せん,Temple of Light Paper
ヴォルカドラゴン,Volcanic Dragon
赤バラのチェスト,Red Rose Chest
手本書・たこ焼き,Takoyaki Manual
かぜきりの弓の書,Blowy Bow Book
アークワンドの本,Celestial Sceptre Book
アイスタルト・小,Small Ice Tart
シンイのこころ５,Shini's Heart Lv5
フェルナーの客室,Felner's Guest Room
はがねのグリーブ,Steel Greaves
手品師の服セット,Conjurer's Outfit
預かり所マノリタ,Storage Manorita
しぐさ書・自撮り,Selfie
手袋にかけた想い,Thoughts On Gloves
キラキラスライム,Glittering Slime
ファンキーブーツ,Funky Boots
クリムゾンヘルム,Crimson Helm
グリゴリふれんず,Watcher Friends
闇雷竜のまなざし,Dark Thundragon's Gaze
鉱石の天井ランプ,Ore Ceiling Lamp
ポイズンリザード,Killer Gila
踊り子のサンダル,Dancer Sandals
出張購買員ガダン,Team Vendor Agent Gadan
カイザーアックス,Kaiser Axe
バカンウグレ遺跡,Bakanugure Ruins
プラチナメイル上,Platinum Mail Top
住宅素材屋ツィネ,Housing Materials Zinei
出張大使バガトゥ,Ambassador Bagatu
ビントンの陳情書,Vinton's Petition
シスター・モンテ,Sister Monte
シャークサンダル,Shark Sandals
わかがしらひのき,Young Hinoki
鋼殻のトロフィー,Steel Shell Trophy
ぴえろいしょうⅠ,Clown Costume Ⅰ
よろず屋ガーディ,General Shop Gadi
過去からの訪問者,Visitors From the Past
奈落の門への出口,Exit to Abyss Gate
アインスリッター,Eins Ritter
学園の教室のイス,School Classroom Chair
ブラッディ・ゼア,Bloody Zea
深淵をのぞくネコ,Cat Gazing into the Abyss
まよえるまるこす,Lost Marcos
プチスライダーク,Frail Nemeslime
荒ぶる魔王の痛み,Pain of the Demon King
アラモンドの植木,Alamond Plant
まっちゃガーベラ,Matcha Gerbera
シスター・フュン,Sister Hyun
あくまのツボ呪文,Demon Pot Spell
しぐさ書・ツリー,Tree Trick
ベルトロの部下Ｄ,Bertro Subordinate D
プティマイユの像,Petit Maille Statue
モッズヘッドホン,Mod Headphones
ゴシックコート下,Gothic Coat Bottom
出張購買員サシモ,Team Vendor Agent Sashim
建物屋ペルホネン,Building Shop Pelhonen
ビジューなビキニ,Bijou Bikini
祈願の神殿のラグ,Gratitemple Rug
占い師の丸型ラグ,Diviner Round Rug
占い師たちの休日,Fortune Teller's Holiday
しぐさ書・キラ星,Stars
賢者の杖の作り方,Making a Sage's Staff
ドラキュラスーツ,Dracula Suit
ふしぎなイレモン,Mysterious Lemon
学園の校庭の砂場,Schoolyard Sandbox
鉄枠木板張りの壁,Iron Framed Wood Wall
ゾーマ　ユウシャ,Zoma, Hero
深淵をのぞくもの,Look Into The Abyss
ギガスクラッパー,Giga Scrapper
学生のローファー,School Loafers
ウェディのリスト,Weddie Bracers
さめきぐるみあお,Blue Shark Suit
プティフウラの像,Petit Fuura Statue
ツインアンテナＢ,Twin Antenna B
ユグドラシルの本,Spryggdrasil Book
しぐさ書・拾遺譚,Collected Tales
道具鍛冶グローブ,Toolsmith's Gloves
ドラパンクパンツ,Dracky Punk Pants
ゴスバニーブレス,Goth Bunny Bracelets
カムシカプリズム,Azlantelope Prism
カシャル海底神殿,Kashal Undersea Temple
フリーズウィップ,Malevolash
ブルーファルコン,Blue Falcon
クルヴィダの王冠,Kuruvida's Crown
シュバリエハット,Chevalier Hat
どうぐを愛した男,He Who Loves Items
レシピ屋ミアーレ,Recipe Shop Miare
壁かけ紋章旗・紫,Purple Wall Banner
うろこのよろい下,Scale Leggings
飛竜のタマゴ欠片,Dragon Egg Piece
しんぷあれくせい,Father Alexei
おきもの赤キノコ,Red Mushroom Ornament
ジャックの衣装３,Jack's Costume 3
DQ3賢者男　ゾーマ,DQ3 Sage (M), Zoma
プラチナミミック,Platinum Mimic
学園ゴシップ新聞,Academy Gossip News
若手芸人のズボン,Young Talent Pants
キャラメルの花束,Caramel Bouquet
夕焼け雲のソファ,Sunset Cloud Sofa
ディバインヘルム,Divine Helm
しぐさリスト選択,Emote List
オーブなプチ香水,Orb Perfume S
スイーツの便せん,Sweet Paper
ギルド移籍許可証,Guild Transfer Permit
魔の試練・第２層,Demon Trials - L2
しぐさ書・たき火,Bonfire
ギガントドラゴン,Drakulard
ごうかなツボ・緑,Green Fancy Pot
王宮のタンス・青,Blue Royal Wardrobe
Ｓキラーブレード,Trauminator Blade
ウェディチェスト,Weddie Chest
転送係エグバート,Transfer Agent Egbert
アルビノホシエイ,Albino Stingray
さとりのグローブ,Gloves of Clarity
輝ける生命の群生,Swarm of Life
取引商アルトゥナ,Trader Altuna
ドラグーンソード,Dragoon Sword
しょうにんぼった,Merchant Botta
セクシーキャット,Sexy Cat
シスター・ソマリ,Sister Somali
吊るしテラリウム,Hanging Terrarium
死神スライダーク,Nemeslime
デモンズゲイトＢ,Demon's Gate B
クローバーのカギ,Clover Key
凶将バリクナジャ,General Togrus Maximus
えきいんぼうまん,Attendant Bowma
流れ着いた愛の詩,Drifted Away Love Poem
ダークキングの像,Dark King Slime Statue
ミミックの像・庭,Mimic Statue (G)
パラディンの心得,Tips for Paladins
シルバーウィング,Silver Wings
ようせいのおでん,Fairy Hot Stick
上級亡霊兵士たち,High Spirit Soldiers
預かり所ブシュラ,Storage Bushra
アメジストライク,Amethystriker
大型の和風水そう,Japanese Aquarium L
巨大ナスビナーラ,Giga Large Woebergine
超パーティー仮面,Super Party Mask
キュルルのチョコ,Kyururu Chocolate
マリン調のベンチ,Marine Bench
ディバインソード,Divine Sword
賢者のころも上２,Sage Robe Top 2
ふわふわ雲の本棚,Fluffy Cloud Bookshelf
プクリポ研究者３,Pukulipo Researcher 3
スイカのテーブル,Watermelon Table
ウルトラ大砲置き,Call Ultra Cannon
ももんじゃフード,Platypunk Hood
混沌竜ランブルス,Rumbles, Dragon of Chaos
セクシーテーブル,Sexy Table
フロートプラント,Floating Plant
ギュメイ将軍の像,Goresby-Purrvis Statue
ブーナー熱帯雨林,Booner Rainforest
踊り子と願いごと,A Dancer and a Wish
アクセ屋カーメロ,Accessory Shop Karmelo
ごちそうターキー,Feast Turkey
よろず屋ポナック,General Shop Ponak
あやしいバスタブ,Suspicious Bathtub
聖王のブーメラン,Dryspell Boomerang
トポルのフェンス,Topol Fence
ステューデントＢ,Student B
赤キノコのベッド,Red Mushroom Bed
住宅素材屋セスタ,Housing Materials Cesta
キューティココア,Cutie Cocoa
アンノウンサイズ,Unknown Scythe
ハロふわモーモン,Halloween T. Sanguini
りゅうおうクロー,True Dragonlord Claws
しぐさ書・花吹雪,Cherry Blossoms
アメジストの衝撃,A Smash of Purple
ランプ錬金ギルド,Lamp Alchemy Guild
魔幻都市の便せん,Phantom City Paper
荒ぶる王子のオノ,Princely Axe
黄金のアンクの箱,Golden Ankh Box
よろず屋プロシオ,General Shop Proshi
よろい兵士の置物,Armor Soldier Ornament
マスター・カンナ,Guildmaster Kanna
トリットアーチズ,Trit Arches
レンダーシアの服,Lendersia Clothing
シュパルトエッジ,Rift Edge
念晶錬磨場・初級,Telecrystal Refinery - Beginner
シスター・パパラ,Sister Papala
くさった死体・強,Vicious Walking Corpse
占い師の四角ラグ,Diviner Square Rug
ドラキーの像・庭,Dracky Statue (G)
ピクニックパドレ,Padre Picnic
追加クエダミー９,not used
芸人の服の作り方,Making a Talent Outfit
さめきぐるみあか,Red Shark Suit
ハロウィンタンス,Halloween Wardrobe
便せんは芸術だ！,Paper is an Art
わかめ王子ぐるみ,King Kelp Plushie
ガーデンパンプス,Garden Pumps
ピンクラインの柱,Pink Line Pillar
ツボ錬金設備・庭,Pot Alchemy Facility(G)
シスター・ラクト,Sister Lakuto
ホラーマシンの像,Killed Machine Statue
ウリボーカプセル,Wild Boar Toy
ピョンスロット卿,Sir Pyoncelot
防砂ダム・展望台,Sand Dam Observatory
ウェディ秘書モブ,Weddie Secretary Mob
グレモリーの紋章,Gremory Crest
フォステイル広場,Fostail Square
ダミー足Ｅ００９,Dummy Feet E009
ふくめんうさぎ３,Masked Rabbit 3
シスター・レレノ,Sister Releno
てんとうスカラベ,Spotted Scarab
ブリガンオーダー,Brigan Order
トコトコロボ椅子,Trotting Robot Chair
プクリポ研究者２,Pukulipo Researcher 2
花びらチャーム桃,Pink Petal Charm
もこふわパジャマ,Fluffy Pyjamas
東洋風ベッド・華,Floral Orient Bed
聖夜の反逆者軍団,Holy Night Rebel Army
セーラスハンマー,Selas Hammer
レシピ屋リトリア,Recipe Shop Litoria
さみだれ突き・零,Multithrust+
ねこまどう便せん,Meowgician Paper
ほうき星の贈り物,Comet's Gift
おうごんのかけら,Gold Nuglet
銀河のツボ錬金書,Galaxy Pot Alchemy Book
中型の和風水そう,Japanese Aquarium M
特製まくら２９号,Special Pillow No. 29
ウサぐるみのくつ,Rabbit Shoes
預かり所シラクモ,Storage Shirakumo
ガズバランの封洞,Gazbalan Sealed Cave
落陽の草原の木Ｃ,Sunset Meadow Tree C
しぐさ書・ピース,Peace Sign
ギュッとソーミャ,Somya Arm Doll
ポランパンの書状,Poranpan's Letter
いにしえのパーツ,Ancient Parts
ステューデントＲ,Student R
ガナドールバンド,Victor Headband
福笑いのラグ・目,Fukuwarai Eye Rug
ハクオウフェイク,Hakuo Fake
しびれくらげ０１,Man o' War 01
ふわふわクリオネ,Floaty Sea Slug
感謝のエネルギー,Gratitude Energy
しょうにんでんな,Merchant Denna
モモリオンの王冠,Sanguini King's Crown
アスバルへの親書,Official Letter to Asbal
救助された侍女Ａ,Relief Maid A
２段ブロック・赤,Red 2-Step Block
黒曜のパーティ机,Obsidian Party Table
タコメッＴシャツ,Octopot T-Shirt
複数魚水そう・中,Multi-Fish Aquarium M
クルーガーブーツ,Kluger Boots
ホンワカ羽毛の束,Snuggly Feather Bundle
夢の王国ドレス下,Dream Kingdom Skirt
天の川のついたて,Milky Way Partition
天使のタキシード,Angel Tuxedo
しょうにんかりま,Merchant Karima
レースの観客１０,Race Spectator 10
ボロボロのリボン,Tattered Ribbon
超暴走魔法陣・零,Uber Ring of Ruin
しぐさ書・大テレ,Very Shy
ラッキークッキー,Lucky Cookies
お姫様ベッド・桃,Pink Princess Bed
風変わりな研究書,Eccentric Research
ギガデンデロベー,Giga Dendelobe
えきいんしーどる,Attendant Shidoru
シンプルパーカー,Simple Hoodie
住宅素材屋テラナ,Housing Materials Terrana
レジェンズエッジ,Legends Edge
緑キノコのベッド,Green Mushroom Bed
水鳥のいる池・庭,Bird Pond (G)
名探偵のコート下,Sleuth's Coat Bottom
マーメイドパレオ,Mermaid Pareo
幸運を呼ぶサロン,Lucky Salon
ロイヤルステップ,Royal Step
悪神の心域２印章,Heartlands 2 Stamps
氷結らんげき・改,Crushed Ice+
深遠なるぱふぱふ,Profound Puff-puff
エメラルドの花束,Emerald Bouquet
帝国三将軍練習札,Triumgorate Tag
黄金の飾り両手剣,Ornamental Greatsword
たちきりブラザー,Bigger Buzzbee
スライムくんたち,Slime monsters
ムーディータンス,Moody Wardrobe
バンデッドブーツ,Brigand's Boots
タンポラゴラの像,Dandeligora Statue
鉱物生命体の弾丸,Life Mineral Bullet
ゲルト海峡への道,Road to Gert Strait
ギガントモンキー,Gigant Gorilla
呪われし友に手を,Hand to My Cursed Friend
しゃしょうぱーり,Conductor Pari
メタスラにくまん,Metal Slime Meat Bun
どうぐ使いの特訓,Item Master's Training
氷の上のぬくもり,Warmth On the Ice
魔天導ビブローン,Bibron, Way of Evil
へいしうぃりあむ,Soldier William
海賊と海神の秘宝,A Pirate's Treasure
悪霊の神々練習札,Evil Trinity Tag
童話の街並みの柱,Fairy-Tale Pillar
大地の箱舟　２幕,Ark of the Earth Act 2
パッションパレオ,Passion Pareo
ましょううおたち,Salamanglers
ウィリーデクロー,Vilide Claws
フェンサーマント,Fencing Cloak
ベリアル強カード,Apex Belial Card
ダイバーゴーグル,Diver Goggles
月うさぎのランプ,Moon Rabbit Lamp
プラチナグリーブ,Platinum Greaves
さまようたましい,Lost Soul
ひかりのグローブ,Shimmering Gloves
武器鍛冶職人の道,The Weaponsmith's Way
魔因細胞のかけら,Demon Cell Fragment
スイカのイス・黄,Yellow Watermelon Chair
メタル迷宮招待券,Metal Maze Ticket
究明者のコート下,Research Coat Bottom
アンフィスバエナ,Amphisbaena
ナンナのこころ２,Nanna's Heart Lv2
ドルタムトランプ,Doltam Cards
スピードアップ床,Speed Up Floor
ルティショー像黒,Black Astolti Short St.
壱の式修了の陽符,Yang I Completion Charm
タンブラーリスト,Tumbler Bangles
パッションリボン,Passion Ribbon
パニックキャノン,Gone Ballistic
竜将アンテロたち,Dragon General Antelo
カジュアルドレス,Casual Dress
強襲隊長シシオウ,Assault Captain Shishiou
師団長のグリーブ,Commander Greaves
アラハギーロ王国,Kingdom of Al-Ahagiro
追想の王城・３階,Memory's Castle 3F
模様入り木板の柱,Patterned Wood Pillar
スパークショット,Starstrike
モーニングスター,Morning Star
リルチェラソファ,Lilcherat Sofa
餅つきジャーミィ,Mochi-Pounding Jammy
ステューデントＧ,Student G
精霊獣ペリッチィ,Spirit Beast Prichy
バーニングバード,Firebird Throw
はじめてのルーペ,Beginner's Loupe
じごくのたまねぎ,Brimstone Bulb
ウルベア地下遺跡,Ruins of Urbea
パワフルステーキ,Powerful Steak
過去からの贈り物,Gift From the Past
ヴェリナード王国,Verinard Kingdom
パンドラボックス,Pandora's Box
ローヌ樹林帯の草,Rhone Woodlands Grass
メタスラのベッド,Metal Slime Bed
ファーラット・強,Vicious Feralball
セラフィのうちわ,Seraphi Fan
ドラゴンクロー絶,Apex Dragon Claws
ときのすいしょう,Chronocrystal
ダミー足Ｅ０６３,Dummy Feet E063
メンメ式万能パテ,Menme All-Purpose Putty
伝説のグリンガム,The Whip of Legend
武器防具屋ソロリ,Weapon & Armor Shop Sorori
放送局員ドラビー,Broadcaster DV
壁かけ団子花飾り,Dumpling Floral Decor
天ツ風の原への道,Road to Howling Highlands
邪竜教団サミット,Summit of the Dragon Order
テレパスタイツⅡ,Telepath Tights Ⅱ
お正月の便利な壁,New Year Wall
プチ伝説の三悪魔,Frail Legendary Evils
ガズバランの牙Ｃ,Gazbalan's Fang C
レトロなランタン,Retro Lantern
むげんの弓の物語,Purblind Bow Story
古き踊り子の伝説,Old Dancer's Legend
どうぐやはんちゃ,Item Shop Hancha
はぐれメタル召喚,Liquid Metal Summon
めいふのばんにん,Hellbound Heretic
ふかみどりダリア,Dark Green Dahlia
禁忌の幻影神・封,Sealing Phantom
さめきぐるみくろ,Black Shark Suit
エレガントブレス,Elegant Bracelets
白バラのテーブル,White Rose Table
おくびょうな白猫,Cowardly White Cat
フォトライフ・金,Photo Life Gold
ショーナへの手紙,Letter to Shauna
とびきりスパイス,Superb Spice
ジョイフルカカオ,Joyful Cocoa
大王イカのズボン,King Squid Pants
育みの大地への道,Road to Flourish Fields
銀の錬金ランプ小,Silver Lamp S
敵を倒すとためる,Killer Tension
ロイヤルクッキー,Royal Cookies
大盾サイズの星空,Greatshield Sized Sky
商品ナンバー１２,Item Number 12
じょうりゅうせき,Distillastone
キュララナビーチ,Kyurarana Beach
ノクトルグローブ,Nocturne Gloves
レースの観客０９,Race Spectator 09
オルフェア地方西,Orphea Region West
リソルの生徒手帳,Resol's Student ID
予言者学園学生服,FTA Uniform (M)
異形の大地への道,Road to Deformed Earth
シールドブレイク,Shattershield
ブレイブストーン,Brave Stone
裏ナイトチケット,Knight Ticket Back
グランドネビュラ,Solar Flair
ドラキーのぼうし,Dracky Hat
テラシナーラの像,Bulbergine Statue
ドラゴンバスター,Wyrmfang
ヤマネコシューズ,Wildcat Shoes
プラコン用編み物,Private Concierge Knitting
凶拳暴鬼ダルカス,Darkas
ピラミッドの写真,Pyramid Photo
黒ねこの便利な壁,Black Cat Wall
グラコス強カード,Apex Gracos Card
格式高い申請用紙,Formal Application Form
攻城隊長ガンザン,Siege Captain Ganzan
機工博士のぼうし,Engineer's Hat
ふわふわメンダコ,Floaty Flapjack Octopus
タロット屋バビロ,Tarot Shop Babilo
エンゼルスタッフ,Angel Staff
シスター・ロッカ,Sister Lokka
破壊神シドーの像,Malroth Statue
ペリドットの宝石,Peridot Gem
バルディスタ工兵,Valdistan Engineer
預かり所キーラル,Storage Keeral
アンノウンソード,Unknown Sword
預かり所カーリィ,Storage Karry
ピリからペッパー,Hot Stuff
スチームオーブン,Steam Oven
郵便局員アレカヒ,Postman Arekahi
かんおけカプセル,Coffin Toy
壁かけ紋章旗・盾,Shield Wall Banner
カスタム屋プポル,Customizer Pupol
しびれくらげ１７,Man o' War 17
バグレア教会跡地,Bagulea Church Vestige
かいぞくＴシャツ,Pirate T-Shirt
ベビーサタンの書,Imp Book
トナカイシューズ,Reindeer Boots
ホースデビル・強,Vicious Gamigin
取引商ディーリア,Trader Delia
ほしくずのピアス,Stardust Earrings
ジャリムバハ砂漠,Jyarimbaha Desert
白鳥の弓の作り方,How to Make a Swan Bow
ホイップゴースト,Whipped Scream
よろず屋カトラズ,General Shop Katraz
東洋風ランプ・雅,Chic Orient Hung Lamp
聖天舎のテーブル,Monastery Table
ＣＭ用プクリポ３,Pukulipo For CM 3
キラーマジンガ強,Apex Uberkilling Machine
幻界闘士のゆびわ,Phantom Fighter Ring
プシューケーの盾,Psyche Shield
