海底探検かきわり,Seafloor Backdrop
らいだーすすーつ,Riders Suit
フェンサーマント,Fencing Cloak
昏冥庫パニガルム,Panigalm's Abyss Vault
魔衛隊士のかぶと,Demon Guard Helmet
めろでぃあせっと,Melody Outfit
バルディスタ憲兵,Valdistan Police
ギュッとヒューザ,Hyuza Arm Doll
しんぷあれくせい,Father Alexei
ネタ「爆発っ！」,Explode Trick!
魔人王ドミネウス,Demonic Domineus
魚交換員プルンパ,Fish Exchange Purunpa
悪神の心域２印章,Heartlands 2 Stamps
シスター・ローネ,Sister Rone
名探偵のシューズ,Sleuth's Shoes
ショップポイント,Shop Points
ペシュヤ地下空洞,Peshuya Underground Cave
エラフィダイノス,Zere Dragon
プクリポバスタブ,Pukulipo Bathtub
グレンドラゴニア,Glendragonia
壁かけ行灯ランプ,Paper Wall Lantern
疾き盗賊のブーツ,Erik's Boots
マーメイドハープ,Lorelei's Harp
コルセアバンダナ,Corsair Bandana
バッジ交換券・虹,Rainbow Badge Ticket
ジュレー島の木Ａ,Jule Island Tree A
王軍師のグローブ,Royal Soldier Gloves
ジア燃石生産場２,Diatite Production Plant 2
お祝いシャワー虹,Celebration (Rainbow)
大トラ猫カプセル,Big Tabby Toy
モーグリのぼうし,Moogle Hat
しんごんのじゅず,Rosary
シャイニングボウ,Shining Shot
ベホイムスライム,Sootheslime
新春ふくびきマン,New Year Lottery Man
インテリローブ上,Scholar's Robe Top
初期プクリポ女性,Initial Pukulipo Female
パピヨンウィング,Papillon Wings
バタフライヒール,Butterfly Heels
ゴシック調のイス,Gothic Chair
音符のベッド・彩,Color Music Bed
イルーシャのペン,Illusia's Pen
第１２回ピコ像庭,12th Pico Statue (G)
サンタのてぶくろ,Santa Mitts
バラのコサージュ,Rose Corsage
ナイトスナイパー,Night Sniper
黒仙翼の羽ばたき,Fairy Wings Flapping
ユマテルの教べん,Umatel's Pointer
ザンクローネパン,Zankrone Bread
お化け提灯の鳥居,Ghost Lantern Arch
グロリスのしずく,Droplet of Gloris
氷結らんげき・改,Crushed Ice+
フラウスブレード,Flaus Blade
レースの観客１７,Race Spectator 17
小型の球体水そう,Spherical Aquarium S
時の化身クルッチ,Ickle the Tockle
白亜の王城・２階,Chalky Castle 2F
カエルパーカー上,Frog Hoodie
門より出でし魔獣,Beast from the Gate
オノでエキサイト,Excite With an Axe
郵便局員サショラ,Postman Sashola
また遊ぼう便せん,See You Again Paper
魂を刈り取る天使,Angel Who Reaps Souls
ブルービックバン,Blue Big Bang
あたまリボン茶券,Tea Head Ribbon Ticket
フォーリオンの空,Skies of Fourion
デビパンクシャツ,Devil Punk Shirt
ドラグーンランス,Dragoon Lance
カラフルチケット,Colorful Ticket
追憶のキャンバス,Remembrance Canvas
ウェスタンブーツ,Western Boots
謎の首長竜の写真,Mystery Lake Beast Photo
壁かけパッケージ,Wall Hanging Package
貢献賞トロフィー,Contribution Trophy
ティプローネ高地,Tiplone Highlands
チェルシーの写真,Photo of Chelsea
ブロブフィッシュ,Blobfish
新兵支給てぶくろ,Recruit Gloves
次期天使長の行方,Find The Next Archangel
地獄のミサワ印章,Misawa of Hell Stamps
パレードシューズ,Mardi Garb Shoes
黒曜のテーブル大,Obsidian Table L
メロディアヘッド,Melody Hair Ornaments
じょうりゅうせき,Distillastone
魔物管理人ジラー,Monster Manager Jira
アクセ屋ルイッサ,Accessory Shop Luisa
覇者のローブ・銀,Silver Champ Robe
紺碧のピラー根本,Azure Pillar Root
レースの観客２６,Race Spectator 26
ケキちゃんハウス,Cakey House
アルゴングレート,Great Argon Lizard
バシっ娘を継ぐ石,The Bazoom Girl's Stone
パピヨンドレス下,Papillon Dress Bottom
あおざいいしょう,Ao Dai Outfit
牙狼のジャケット,Fanged Wolf Jacket
魔物管理人ニトト,Monster Manager Nitoto
光のさいほう針小,Light Needle S
メギストリス紫花,Megistris Flowers
シスター・ミアナ,Sister Miana
「楽園」の展示室,"Paradise" Exhibit Room
セピアンフリル下,Sepian Pants
しびれくらげ２５,Man o' War 25
エテーネスズラン,Ethene Lilies
ジャックの衣装２,Jack's Costume 2
勝てるケンカの本,Winning Fight Book
シーサイドソファ,Seaside Sofa
ファラオ・ヘッド,Pharaoh's Head
レギオングリーブ,Legion Greaves
アイゼルトランプ,Eisel Deck
全滅時の復活場所,resurrection spot
メラゴースト・塔,Tower Firespirit
とこなつハッピ上,Summer Top
ときめく砂糖菓子,Sugar Candy
あやしいチェスト,Suspicious Chest
聖守護者のゆびわ,Sentinel's Ring
預かり所トッケロ,Storage Tokkero
マッドフィンガー,Muddy Finger
ファラオ・ヘルマ,Pharaoh Herma
よろず屋ミガンス,General Shop Migans
ナイフフィッシュ,Knifefish
ヘルビースト・強,Vicious Sculptrice
第１３回ラキ像庭,13th Lycae Statue (G)
パピヨンプリズム,Papillon Prism
毛皮に包まれた氷,Fur-wrapped Ice
ファンキーブーツ,Funky Boots
ツインクルタクト,Twinkle Little Staff
テレパスタイツⅡ,Telepath Tights Ⅱ
預かり所ポンヌク,Storage Ponnuk
木製ハニータンス,Wooden Honey Wardrobe
女神の魂の在りか,Soul of the Goddess
ダマスク模様の壁,Damask Pattern Wall
ギルガランのくつ,Gilgaran's Shoes
王家のペンダント,Royal Family's Pendant
メロンのチェスト,Melon Chest
アンルシアの像＋,Anlucia Statue +
おもてなしの行灯,Hospitality Lantern
しぐさ書・ガード,Paladin's Palisade
レースの観客１９,Race Spectator 19
夢の王国ドレス上,Dream Kingdom Shirt
筆頭研究員の手袋,Top Researcher Gloves
ショッパーバッグ,Shopping Bag
三毛太猫カプセル,Fat Calico Cat Toy
猛爆隊長ダイノス,Bomb Captain Dinos
赤バラのテーブル,Red Rose Table
無垢なる勇者の剣,Innocent Hero's Sword
イースターアーチ,Easter Arch
しぐさ書・ヨッ！,Yo!
ファラスカプセル,Faras Toy
いきのいいサザエ,Very Fresh Turban Shell
砂の都の吊り飾り,Sand City Decoration
エドアルドの人形,Eduardo's Doll
バンデッドボトム,Brigand's Bottom
つやめく毛髪の束,Glossy Hair Bunch
魚交換員パパルパ,Fish Exchange Papalupa
ゴマフビウミウシ,Sea Bunny
欲望の邪鬼ゴモル,Demon of Desire Gomoru
ノリまゆげシール,Eyebrows Sticker
時元神キュロノス,Kyuronos, Ruler of Time
セレドの民家庭具,Celed House Decor (G)
魔物管理人シュン,Monster Manager Shuna
オルストフの尻尾,Orstov's Tail
スマートチェスト,Smart Chest
ドラゴンクロー絶,Apex Dragon Claws
グロリアスコート,Glorious Coat
ムーディータンス,Moody Wardrobe
雨の島・井戸の中,Pluvi Isle - Inside Well
夏の渚のサンダル,Summer Beach Sandals
しなびた花の写真,Wilted Flower Photo
辺境警備隊兵士Ｂ,Frontier Guard Soldier B
ちゃがまゴンの像,Wyrkettle Statue
最強クイズ問題集,Best Quiz Questions
つりしのいしょう,Angler's Costume
ゴールドエッグ２,Golden Egg 2
パピヨンクラウン,Papillon Crown
セクシーキャット,Sexy Cat
シックゴスブーツ,Chic Goth Boots
遊び人の特注花火,Gadabout's Firework
魔天賊ボティたち,Sky Bandit Boti and co.
小悪魔王子の王冠,Devil Prince's Crown
帝国三将軍練習札,Triumgorate Tag
タロット屋バビロ,Tarot Shop Babilo
とこなつバングル,Summer Bangles
うすざくらダリア,Pale Pink Dahlia
ドラキーの像・庭,Dracky Statue (G)
ユニコーンのツノ,Unicorn Horn
グレープジュース,Grape Juice
プチテンタコルス,Frail Abyssal Octopot
猫パンチ（左手）,Cat Punch (Left Hand)
ナジーンカプセル,Najinn Toy
ナルビア宿屋の扉,Nalbia Inn Door
プク姫様つきの畑,Puku Princess Field
ウェーブアイロン,Wave Iron
ユシュカパラソル,Yushka Umbrella
救助された侍女Ｂ,Relief Maid B
先王ゾルトグリン,Former King Zoltgrin
スライム露天風呂,Slime Outdoor Bath
金のほこらへの道,Road to Gold Shrine
ジェントルダンス,Gentle Gentleman
１０周年記念会場,10th Anniversary Venue
キャプテンの眼帯,Captain's Eyepatch
カレイドスコープ,Kaleidoscope
ケイトのサンダル,Kate's Sandals
撃滅隊長ジェリゴ,Destruct Captain Jerigo
黄昏の詩人の舞台,Twilight Poet's Stage
パドレの錬金人形,Padre Alchemy Doll
よろず屋ピンドフ,General Shop Pindoff
マイスターハット,Meister Hat
ヤバい宝石の包み,Dangerous Gem Package
ふくびき魔法ビン,Lottery Flask
ネイビーリュック,Navy Backpack
決めポーズ左前列,Decisive Pose L Front
ウィリーデナイフ,Vilide Knife
ロベールの家の鍵,Robere's Housekey
リバイブスナック,Revive Snack
シスター・リュリ,Sister Lulie
コイン屋ペピール,Coin Shop Pepeelu
異界将軍ギュメイ,Goresby-Purrvis, the Otherworldly
メレアーデリスト,Mereade Wristbands
カボチャの便せん,Pumpkin Paper
シスター・カレン,Sister Karen
カントリーブリム,Country Brim
紫イモのテーブル,Purple Yam Table
素材屋・コイン屋,Material Shop/Coin Shop
記憶のパドレア邸,Memory of Padrea Mansion
スノードーム・銀,Silver Snow Globe
ファラスのズボン,Faras' Pants
よごれたほうたい,Grubby Bandage
手作りのロザリオ,Handmade Rosary
預かり所オリジェ,Storage Orige
カムシカプリズム,Azlantelope Prism
ツヤめきペイント,Glossy Paint
青色パンジーの傘,Blue Pansy Umbrella
冒険者のはちまき,Adventurer's Headband
庭用お月見ランプ,Moon Viewing Lamp (G)
レジェンドホース,Godsteed
臨時大使ムチョロ,Temp Ambassador Mucholo
グリゴリふれんず,Watcher Friends
ネレウスアックス,Nereus Axe
第１１回ルミナ像,11th Lumina Statue
玉ネギのチェスト,Onion Chest
マリン調のタンス,Marine Wardrobe
学園のスニーカー,School Sneakers
ウェナベリーの枝,Wenaberry Branch
セラフィムのやり,Seraph's Spear
支援端末Ｐ１０９,Support Terminal P109
上級亡霊兵士たち,High Spirit Soldiers
おうごんのかけら,Gold Nuglet
氷の魔王のマスク,Ice Witch Mask
Ⅱ‐ディアノーグ,Ⅱ‐Diamagon
トライバルブーツ,Tribal Boots
ゴスバニーブレス,Goth Bunny Bracelets
排他検証ステージ,Exclusive Survey Stage
クリスモスゾンビ,Christmas Zombie
ブラバニクイーン,Dark Hare
ブチ太猫カプセル,Fat Spotted Cat Toy
スラタワー便せん,Slime Stack Paper
つかれきったサメ,Lazy Larry
案内係ラファーヌ,Guide Rafane
ウェナールピアス,Wenal Earrings
ノクゼリアエッジ,Noxeria Edge
プクリポ間仕切り,Pukulipo Partition
ナチュラルベッド,Natural Bed
ぽかぽかマフラー,Warm Scarf
参加受付クライブ,Receptionist Clive
ジャンボトマト２,Jumbo Tomato 2
エンゼルハンマー,Angel Hammer
超パーティー仮面,Super Party Mask
スイカのテーブル,Watermelon Table
ラブリークッキー,Lovely Cookies
ありがとう便せん,Thank You Paper
ふるぼけたタライ,Worn-out Washbasin
ヤマネコグローブ,Wildcat Gloves
トーテムケープ上,Totem Cape
ポイックリンの像,Poiclin Statue
釣り用ダミー宝箱,Fishing Treasure Chest
マジンガ先生たち,Master Machines
大王イカのズボン,King Squid Pants
イーギュアの大牙,Rapscallion's Fang
スチームモノクル,Steam Monocle
花華メイドの下駄,Flower Maid Geta
冒険者のてぶくろ,Adventurer's Gloves
ナスビの本棚・白,Pale Eggplant Bookshelf
ローズコサージュ,Rose Corsage
レジェンズエッジ,Legends Edge
ヤーン　涙の鉄拳,Yarn, Iron Fist of Tears
さみだれうち・改,Rain of Pain+
デーモンバスター,Demonsbane
女学生のブレザー,Schoolgirl Blazer
クラウングローブ,Clown Gloves
カジュアルブレス,Casual Bracelet
みかづきプリズム,Crescent Moon Prism
レッドタキシード,Red Tuxedo
邪精霊マガツカゼ,Magatsukaze, the Wicked Wind
ガーネットダリア,Garnet Dahlia
はやてのバンダナ,Agility Bandana
高貴な紋付はかま,Noble Crest Hakama
アサシンコート下,Assassin Coat Bottom
オルセコ王家の墓,Orseco Royal Tomb
アスバルへの親書,Official Letter to Asbal
魔物管理人ハズキ,Monster Manager Hazuki
しょくにんききな,Crafter Kikina
キャプテンブーツ,Captain's Boots
ユーライザのメモ,Yuliza's Note
ルミナスウィング,Luminous Wings
ガナドールブーツ,Victor Boots
タロットテーブル,Tarot Table
おきもの赤キノコ,Red Mushroom Ornament
シーサイドベッド,Seaside Bed
マジカルスーツ下,Magical Suit Bottom
ヴェリナード王国,Verinard Kingdom
しぐさ書・スイカ,Watermelon Trick
輝天のスティック,Sky Wand
チェーンジーンズ,Chain Jeans
夢色ショーケース,Dreamy Showcase
まほうの盾の秘密,Magic Shield Secret
ルビーのドレス上,Ruby's Dress Top
星辰のツボ錬金書,Stars Jar Alchemy Book
マタドールバンド,Matador Headband
パニックキャノン,Gone Ballistic
ゼブラマンティス,Zebra Mantis
ほくほく肉じゃが,Meat & Potatoes
みかがみの盾の本,Silver Shield Book
シルエット・記号,Silhouette Sign
花透かし細工の壁,Floral Wall
がうがうキャップ,Bow-Wow Cap
ギガントドラゴン,Drakulard
シスター・サーラ,Sister Sarah
よろず屋プロシオ,General Shop Proshi
アメジストローズ,Amethyst Rose
イオ１０系の写真,Bang 10 Series Photo
古代魔術のうでわ,Ancient Magic Bangles
パワフルニンニク,Powerful Garlic
預かり所スピーラ,Storage Spira
魚交換員プトゥン,Fish Exchange Putun
白ゴシック柄の柱,White Gothic Pillar
魔天導ビブローン,Bibron, Way of Evil
ふかふかなキノコ,Soft Mushroom
防具屋グリッチャ,Armor Shop Gritcha
ナルビア宿屋の柱,Nalbia Inn Pillar
ネヴァングリーブ,Nemain Greaves
とびきりスパイス,Superb Spice
スチーム本棚・赤,Red Steam Bookshelf
レシピ屋ロミルダ,Recipe Shop Romilda
冬来たりなば……,Winter Comes...
限定交換屋ポタン,Limited Exchange Shop Potan
トポルのパラソル,Topol Umbrella
道具鍛冶作業着下,Toolsmith's Apron
ツインアンテナＤ,Twin Antenna D
バケーロの子分Ｂ,Bakero's Henchman B
りゅうぐう王・塔,Tower Nessicure
仮面バスター仮面,Maskmaster Mask
紹介人アラーニャ,Introducer Aranya
カルサドラ溶岩洞,Calsadora Pyroduct
ノクゼリアクロー,Noxeria Claws
あったかセラフィ,Warm Seraphi
若手芸人のズボン,Young Talent Pants
シャボンプリズム,Bubble Prism
アルウェーンの町,Alweyn Township
アドミラルハット,Admiral's Hat
ネコ姫の間仕切り,Cat Princess Partition
カミルのローブ上,Kamil's Robe Top
ブレイブクッキー,Brave Cookies
アメジストの置物,Amethyst Ornament
金平糖ライト・桃,Pink Candy Light
預かり所ヒメネス,Storage Himenes
努力の彫像の写真,Effort Sculpture Photo
プリムリリーの服,Primlily's Clothes
ガタラ風たいまつ,Gatara-Style Brazier
ドルタムシールド,Doltam Shield
東洋風ベンチ・華,Floral Orient Bench
ダンシングライト,Dancing Light
ぐんたいガニ・強,Vicious Crabid
反乱軍メンバー１,Rebel Army Member 1
悲愴のウィリーデ,Vilide the Pathetic
クオードの剣の鞘,Quard's Scabbard
レースの観客１３,Race Spectator 13
楽しい扇の作り方,Fun Fan Making
ゴクラクギョ・白,White Betta
ファリネのチョコ,Farine's Chocolate
美容師のプライド,Hairdresser's Pride
カルベロビュート,Wizardly Whip
えきいんぴけっと,Attendant Piket
七夕・雨斬りの書,Festival Rain Slayer
モーモンの像・庭,T. Sanguini Statue (G)
スマートウォール,Smart Wall
タータンシューズ,Tartan Shoes
邪神ヤファギル戒,Yaphagil, the Precept
三角ランタンの木,Triangle Lantern Tree
ヴォイドアンカー,Anchor of Rancour
ヘルヴェルの上司,Helvel's Superior
賢者セレディーネ,Sage Celedine
2014/2月分クエスト,Quest for 2014/02
オーシャングラス,Ocean Glasses
レモンハルト劇場,Lemonheart Theatre
銀のさいほう針小,Silver Needle S
エステラの紹介状,Estella's Intro Letter
きら星のグローブ,Twinkling Gloves
お姫様ベッド・桃,Pink Princess Bed
おしゃれカタログ,Fashion Catalog
ニーベルのゆびわ,Nibel's Ring
ダンサーシューズ,Dance Shoes
ラベンダーの花束,Lavender Bouquet
馬蹄のイヤリング,Horseshoe Earrings
よろいのきし・凶,Knight Destructant
カボチャの食器棚,Pumpkin Cupboard
壁画管理ペコリア,Mural Management Pekoria
制圧隊長ゾベエガ,Suppress Commander Zobega
スタジアムシャツ,Stadium Shirt
ジャックのローブ,Jack's Robe
ひっさつコマンド,Special command
ルベランショット,Ruberan Bow
プチビッグな香水,Big Perfume S
ミランぬいぐるみ,Milan Plushie
ドリームチケット,Dream Ticket
ドゥラ院長のメモ,Director Dura's Note
なげくカンナさん,Grieving Master Kanna
キラーマジンガ強,Apex Uberkilling Machine
ツインアンテナＣ,Twin Antenna C
はじめてのオフ会,A Face to Face First
誓約の園のガゼボ,Covenant Gazebo
せいどうのかぶと,Bronze Helm
けんぽうぎセット,Tussler's Outfit
大樹の鳥籠　入口,The Tree's Cage Entry
ミイラ男のぼうし,Mummy Boy Hat
ポセイドンランプ,Poseidon Lamp
破砕将のハンマー,Crush General's Hammer
ブラッディ・ゼア,Bloody Maize
初期ウェディ女性,Initial Weddie Female
交換屋クラリッサ,Exchange Shop Clarissa
絶牙の白獅子たち,White Fang Lions
ウルトラ大砲置き,Call Ultra Cannon
ネコ姫のチェスト,Cat Princess Chest
プラチナミミック,Platinum Mimic
ほうおうの巻き物,Phoenix Scroll
お菓子の間仕切り,Sweet Partition
ピンキーパンサー,Pink Sabrecat
バトルスタンパー,Battle Basher
第１２回ラウル像,12th Rahul Statue
アロケルのおうぎ,Allocer Fan
スライムのゆかた,Slime Yukata
野いちごサンダル,Wild Strawberry Sandals
落陽の草原の木Ａ,Sunset Meadow Tree A
からくりランサー,Bamboolancer
オレンジと白の傘,Orange/White Umbrella
プチＳジェネラル,Frail Shogum
レビュール街道北,Reviewle Highway North
攻撃時25%でルカニ,Sap Attack 25%
ひかりのグローブ,Shimmering Gloves
ジア燃石生産場１,Diatite Production Plant 1
グランゼドーラ門,Gran Zedora Gate
ふわふわメンダコ,Floaty Flapjack Octopus
猫貴族のスカート,Aristocat Skirt
アイアンウィング,Flyin' Iron
マキュリのチェア,Makyuri Chair
記念大王スライム,Commemorative King Slime
マーガレットの傘,Marguerite Umbrella
口調の書・能天気,Tone Book - Easygoing
白いヴェールの女,White Veiled Woman
エビルソーサラー,Evil Sorcerer
手品師のグローブ,Conjurer's Gloves
ダーマ神殿の看板,Alltrades Abbey Sign
デモンズゲイトＡ,Demon's Gate A
動くあいさつ印章,Animated Stamps
前座芸人のズボン,Show Opener's Pants
ＣＭ用プクリポ４,Pukulipo For CM 4
えにし紡いで……,Weaving Bonds...
王宮のベンチ・赤,Red Royal Bench
ステラツイスター,Stella Twister
尖塔の守護鬼たち,Keeper of the Spire
キラーマシン・強,Vicious Killing Machine
タダ土地チケット,Free Plot Ticket
便せん屋ライジー,Stationery Shop Raiji
キュララな夏休み,Kyurara Summer Holiday
ファルコンダガー,Gryphon's Wing
フィネトカ映写機,Finetka Projector
レシピ屋トリーナ,Recipe Shop Torina
プリズンイーグル,Prison Eagle
荒ぶる魔王の痛み,Pain of the Demon King
しゃしょうばぎー,Conductor Bagy
３段ブロック・緑,Green 3-Step Block
ダンダダ団アジト,Robbin' 'Ood Gang HQ
よろず屋ポロペン,General Shop Poropen
アークワンドの本,Celestial Sceptre Book
スイートウィッグ,Sweet Wig
スライムの食器棚,Slime Cupboard
シスター・ロロサ,Sister Lolosa
グランゼドーラ駅,Gran Zedora Station
ポセイドンタンス,Poseidon Wardrobe
さめきぐるみきん,Gold Shark Suit
しびれくらげ１２,Man o' War 12
シスター・トーレ,Sister Torre
ソレイユバンドゥ,Sunflower Band
クリスマスの絵本,Christmas Picture Book
新作家具屋メアル,New Indoor Furniture Shop Mare
ニコニコな大冒険,Adventure With a Smile
キャッ飛び便せん,Vampire Cat Paper
ユーススニーカー,Youth Sneakers
預かり所クローブ,Storage Clove
辺境の雪山への道,Road to Snowy Mountain
オーガのあいさつ,Ogre Greeting
アマリリスの笑顔,Amaryllis' Smile
チョコスティック,Choco Stick
売り子フィービー,Vendor Phoebe
はじめてのドレス,My First Dress
黎明の霊堂への扉,Door to Mausoleum of Daybreak
レース屋ヒキシオ,Race Registrar Hikishio
神光放つツメの書,Holy Light Claws Book
アラハギーロ地方,Al-Ahagiro Region
アトラスカプセル,Atlas Toy
神殿レイダメテス,Reidametes Temple
水鳥のいる池・庭,Bird Pond (G)
激情の竜エステラ,Estella, Dragon of Passion
ほっとイヤーマフ,Soft Earmuffs
邪神ヤファギル封,Yaphagil, the Seal
聖王のムチの壁画,Dryspell Whip Book
ウルタのコート下,Ulta Coat Bottom
ピクシーシューズ,Pixie Shoes
原始獣のコート下,Primal Beast Leggings
ステューデントＳ,Student S
グレートアックス,Bad Axe
パレードウェア下,Mardi Garb Bottom
ワープ装置・天獄,Heavenly Hell Warp
フォトライフ・銀,Photo Life Silver
パティシエの服下,Pastry Chef Bottom
ルージュアックス,Rouge Rhino Axe
ステンドシールド,Stained Glass Shield
冷眠室ペコリアＢ,Cryogenics Pekoria B
プクリポチェスト,Pukulipo Chest
スターダムブレス,Stardom Bracelets
ドワーフバスタブ,Dwarf Bathtub
福笑いのラグ・目,Fukuwarai Eye Rug
銅の鍛冶ハンマー,Copper Hammer
額のしずくシール,Forehead Drop Sticker
ルベランブレード,Ruberan Blade
キジ太猫カプセル,Fat Brown Cat Toy
ジーガンフの写真,Jiganf Photo
ホワイトジャッジ,White Clubber
ラブリーチケット,Lovely Ticket
美容師プラティナ,Hairdresser Platina
サウルステントウ,Ladyceratops
スコーピオサイス,Scorpio Scythe
ハートの本棚・黄,Yellow Heart Bookshelf
ひつじのころも下,Sheep Skirt
グレン領東への道,Road to Glen East
ビリジアンの花束,Viridian Bouquet
セレブキャンディ,Celebrity Lollipop
特攻隊長バーナー,Commander Burner
壁かけ管理棟の窓,Admin Building Window
スカウトスカート,Scout Skirt
プラコン用編み物,Private Concierge Knitting
ラウルのゴーグル,Rahul's Goggles
プロミネンスの盾,Shield of the Sun
もみじこぞう・強,Vicious Leafy Larrikin
星空のベッド・青,Blue Starry Bed
はやぶさの剣の書,Falcon Blade Book
ＣＭ用ウェディ３,Weddie For CM 3
邪神ヴァニタトス,Dark Deity Vanitatos
ドラゴンガイア強,Apex Gaia Dragon
バラのスティック,Rose Wand
壱の式修了の陽符,Yang I Completion Charm
今そこにいる辛党,Now That's a Spicy Party
シスター・ロッカ,Sister Lokka
ふとっちょキノコ,Fat Mushroom
グングンのびーる,Rapid Fertilizer
ワイルドファング,Wild Fang
賢者の手を引いて,Pull the Wise Man's Arm
預かり所パリュス,Storage Paruse
キレキレキッシュ,Sharp Quiche
ウィリーデロッド,Vilide Rod
ピクニックアサヒ,Asahi Picnic
ゾンビキラーの本,Zombiesbane Book
王宮魔術師のくつ,Royal Mage Shoes
初心者用の両手杖,Beginner's Staff
しっこくのマント,Macabre Mantle
ハンマー作り入門,Hopeful Hammer Making
六大陸堂の便せん,Six Continents Paper
第１２回ラキ像庭,12th Lycae Statue (G)
カムシカカプセル,Azlantelope Prism
悠久の時を超えて,Beyond the Bounds of Time
憎悪のダークネス,Darkness of Hatred
まほうせんしだん,Armamentalist Corps
クラシック風の壁,Classic Wall
トポルの蝶々かご,Topol Butterfly Basket
ソードギフト・紺,Navy Blue Sword Gift
ハヤブサ観察日記,Falcon Watcher's Diary
からっぽの赤宝箱,Empty Red Treasure Chest
ダストンキャップ,Duston Cap
ぬい合わせた願い,Stitched Together Wishes
ズッキーニャ・祖,Ancestral Cruelcumber
預かり所ジュエル,Storage Jules
トレジャーデモン,Treasure Demon
イルーシャの部屋,Illusia's Room
星夜のローファー,Starry Night Loafers
清涼スイムワンピ,Cool Swim Dress
石だたみ柄のラグ,Cobblestone Pattern Rug
スマイルチケット,Smile Ticket
風のころも安置箱,Wind Robe Coffer
シュパルトクロー,Rift Claws
聖王の大剣の壁画,Dryspell Blade Book
セラフィのポスト,Seraphi Mailbox
デスマスの礼服下,Death Master Bottom
レビュール菜の花,Reviewle Rapeseed
ブラッディヘッド,Bloody Horns
レジェンズランス,Legends Lance
魔軍十二将の絵画,Twelve Tyrants Painting
シスター・レレノ,Sister Releno
東洋風チェア・華,Floral Orient Chair
びようしいちじく,Hairdresser Ichijiku
白亜の王城・１階,Chalky Castle 1F
ネコ姫のスツール,Cat Princess Stool
バラ模様付きの壁,Rose Pattern Wall
氷の魔王のマント,Ice Demon Cloak
春風チアーズ衣装,Spring Cheer Outfit
道具屋チャーロン,Item Shop Charon
