カテドラルローブ,Cathedral Robe
Ｖロンのイス・赤,Red Vron Chair
天翼のイヤーカフ,Heavenly Wing Ear Cuffs
ジャングルの岩壁,Jungle Rock Wall
サフランローブ下,Saffron Robe Bottom
特製まくら２９号,Special Pillow No. 29
ダル・ジャムール,Dar Jamal
武勲の城のつづら,Valor Castle Wicker Box
カミハルムイ城前,Kamiharmui Castle Front
額のしずくシール,Forehead Drop Sticker
転送係エグバート,Transfer Agent Egbert
ポーズ書・聖騎士,Pose "Paladin"
ダークネビュラス,Dark Nebulus
管理端末Ｑ４８５,Management Terminal Q485
ようがんのカケラ,Lava Lump
グランゼドーラ領,Gran Zedora Territory
赤いエクササイズ,Red Exercise
リルチェラソファ,Lilcherat Sofa
バズカフェの植木,Pazu Cafe Plant
案内係ペリュイヌ,Guide Peruine
グレイブディガー,Grave Digger
原始獣フォドラス,Primitive Beast Fodras
青リンゴのタンス,Green Apple Wardrobe
女性プラコン服紫,Purple Clothes (F)
サバイバルスキル,Ruggedness skill
ふわふわサンダル,Fluffy Sandals
小鳥のガゼボ・茶,Brown Small Bird Gazebo
ビーナスステップ,Venus Step
モンスター格闘場,Monster Arena
レースの観客２２,Race Spectator 22
さざなみのしずく,Rippledrops
預かり所イウマド,Storage Iwmad
シンプルパーカー,Simple Hoodie
ゴシックビスチェ,Gothic Bustier
「楽園」の展示室,"Paradise" Exhibit Room
ディバインロッド,Divine Rod
レクタリスセット,Lectalis' Outfit
ウルベアの自販機,Urbea Vending Machine
星空のタンス・紫,Purple Starry Wardrobe
ネタ「こまいぬ」,Foo Dog Trick
魔法学園のブーツ,Magic Student Boots
スライムチケット,Slime Ticket
ヒューザパラソル,Hyuza Umbrella
全滅時の復活場所,resurrection spot
まほうのグリーブ,Magic Greaves
イシスのブローチ,Isis' Brooch
クラッシュロッド,Crusher Rod
トリットアーチズ,Trit Arches
アビスソルジャー,Abyss Soldier
占い師たちの休日,Fortune Teller's Holiday
酒場のオルゴール,Tavern Music Box
ＣＭ用ドワーフ２,Dwarf For CM 2
ファルコンダガー,Gryphon's Wing
ジャングルリップ,Jungle Tulip
ドラキーＴシャツ,Dracky T-Shirt
ジュースの自販機,Juice Vending Machine
バルザックゾンビ,Zombie Baalzack
エネルギー制御室,Energy Control Room
ぱてぃきょうだい,Sibling Patti
天命のつるぎの書,Sword of Judgment Book
五大陸のモビール,Five Continents Mobile
アステルウィップ,Aster Whip
レインボーファン,Rainbow Fan
魔勇者ぬいぐるみ,Evil Hero Plushie
無垢なる勇者の剣,Innocent Hero's Sword
サメきぐるみ・桃,Pink Sharksuit
ふわふわペコリア,Fluffy Pekoria
ウェスタンブーツ,Western Boots
禁忌の邪神のオノ,Forbidden God Axe
アヌビスアタック,Anubis Assault
３段ブロック・緑,Green 3-Step Block
クラウングローブ,Clown Gloves
魔幻都市ゴーラ跡,Ruins of Gora
イチゴの天井飾り,Strawberry Decor
管理人アチュリン,Caretaker Achurin
しぐさ書・決め後,Emote "Pose Rear"
預かり所スリーズ,Storage Sleaze
壁かけおばけの窓,Haunted Window
武勲の城の漆喰壁,Valor Castle Wall
キャプテンマント,Captain's Cloak
取引商アルトゥナ,Trader Altuna
マジカルチケット,Magical Ticket
しぐさ書・バトル,Emote "Battle"
チェイサーアーム,Chaser Armguards
しょくにんききな,Crafter Kikina
タホドラキー・祖,Ancestor Drackmage
獄嵐鬼ウェンリル,Stormkeeper Wenrir
魚交換員ポップイ,Fish Exchange Popui
輝天のスティック,Sky Wand
紫水晶のオーブン,Amethyst Oven
美容師のプライド,Hairdresser's Pride
魔天骸オロバドン,Demon Skeleton Orobadon
ちいさな時の球根,Tiny Time Bulb
しぐさ書・決め左,Emote "Pose Left"
道具屋ポッピーナ,Item Shop Poppina
第８回ラウルの像,8th Rahul Statue
おっかけパンサー,Chasing Panther
ＣＭ用ウェディ３,Weddie For CM 3
開かずの間・前室,Unseen Room Chamber
シスター・サテラ,Sister Satella
紹介人アラーニャ,Introducer Aranya
アークデーモンＢ,Archdemon B
えきいんぺいんず,Attendant Penzu
オーナーの館１階,Owner's Mansion 1F
新エテーネの脚帯,New Ethene Gaiters
学園女子の夏服上,Schoolgirl Summer Top
『他の人の家へ』,"To Other House"
しぐさ書・かかし,Emote "Scarecrow"
代理人ジェイダー,Agent Jayda
スライムのベンチ,Slime Bench
アンノウンクロー,Unknown Claws
破戒王ベルムド強,Apex Sin King Bermud
ドルワーム兵士２,Dolworm Soldier 2
グランゼドーラ駅,Gran Zedora Station
グレイトマーマン,Merderer
追加クエダミー９,not used
別離の剣器・不屈,Parting Blade of Fortitude
インテリローブ下,Scholar's Robe Bottom
チャコルのポーチ,Charcoal Pouch
星からのまれびと,Stranger from the Stars
ウーパールーパー,Axolotl
花びらチャーム桃,Pink Petal Charm
忍び寄る闇の足音,Creeping Dark Footsteps
妖剣士オーレン強,Apex Swordmaster Oren
木彫りのロザリオ,Wood Carved Rosary
黒夜叉のよろい上,Black Bane Armor
郵便局員ペープペ,Postman Pepupe
ガーデンシャワー,Garden Shower
死神スライダーク,Nemeslime
ルティショー像茶,Tea Astolti Short St.
はくあいのゆびわ,Care Ring
ぽかぽかマフラー,Warm Scarf
全身全霊斬り・改,Unbridled Blade+
源世庫パニガルム,Origin Vault Panigalm
便せん屋ウツセミ,Stationery Shop Utsusemi
便せん屋キキョウ,Stationery Shop Kikyo
アスバルのベスト,Asbal's Vest
大魔王城の便せん,Demon Lord Castle Paper
カプリコルランス,Capricor Lance
海竜ヴォドニーグ,Sea Dragon Vodnig
シルバーアロワナ,Silver Arowana
夕焼け雲のタンス,Sunset Cloud Wardrobe
船尾甲板・最上部,Poop Deck - Top
ネオケラトドゥス,Neoceratodus
博愛騎士のピアス,Love Knight Earrings
飛竜のタマゴ割れ,Broken Dragon Egg
ガブリエルのやり,Gabriel's Spear
終わりを告げる者,The Doomsayer
ゾーマ　ユウシャ,Zoma, Hero
大地の箱舟　終幕,Ark of the Earth End Act
Ｌ型のトピアリー,L-Shaped Topiary
カルベロビュート,Wizardly Whip
ウィンターブーツ,Winter Boots
秘密の部屋・倉庫,Secret Room - Storage
冬来たりなば……,Winter Comes...
ステンドシールド,Stained Glass Shield
郵便配達人バイグ,Mailman Baigu
超あまつゆのいと,Super Celestial Skein
預かり所ティルダ,Storage Tilda
クリスマスツリー,Christmas Tree
ダフィアのお守り,Daphea's Amulet
蝶模様のふりそで,Butterfly Kimono
木造御殿のアーチ,Wood Palace Arch
わかめ王子ぐるみ,King Kelp Plushie
ゴクラクギョ・青,Blue Betta
アラビアン衣装券,Arabian Outfit Voucher
防衛軍の制服・金,Gold Defense Force Suit
古グランゼドーラ,Old Gran Zedora
高価なゴブレット,Expensive Goblet
バンデッドボトム,Brigand's Bottom
イオ１０系の写真,Bang 10 Series Photo
グランゼニスの剣,Gran Zenith Sword
大怪傑のグローブ,Wondrous Gloves
グレイトグラタン,Great Gratin
はやてのバンダナ,Agility Bandana
預かり所グログス,Storage Gulgus
ピクニックリィン,Lynn Picnic
家出したスラルド,Runaway Goomerald
壁かけ武器セット,Weapon Wall Set
くろがねの小ビン,Iron Phial
ももじゃの像・庭,Platypeach Statue (G)
悪魔の翼プリズム,Devil Wings Prism
お馬さんが見たい,I Wanna See The Horse
ギュッとプオーン,Rebjorn Arm Doll
バーニングバード,Firebird Throw
ヒューザキッチン,Hyuza Kitchen
古びた糸とじの書,Old Thread-Bound Book
イクチオサウルス,Ichthyosaurus
フルムーンチェア,Full Moon Chair
ガズバランの牙Ａ,Gazbalan's Fang A
木工素材屋ミヅキ,Woodworking Materials Mizuki
エネルギー体・大,Large Energy Body
レジェンズロッド,Legends Rod
ジア・クルヴィダ,Dia Kuruvida
白亜の博物館の壁,Chalk Museum Wall
東洋風タンス・華,Floral Orient Wardrobe
フェアリー衣装Ⅰ,Fairy Costume Ⅰ
レースの観客２３,Race Spectator 23
保育地区ペコリア,Nursery Area Pekoria
グレートハンマー,Great Hammer
ショコラチケット,Chocolate Ticket
師団長のよろい上,Commander Armor
預かり所ボルリラ,Storage Borrilla
記憶の帝国技術庁,Memory of Empire Tech
スチームキッチン,Steam Kitchen
光の神殿・最上層,Temple of Light - Top Floor
預かり所ぺイジー,Storage Peiji
シンプルキャップ,Simple Cap
どん欲のグリーニ,Greedy Greenie
魔物管理人レジエ,Monster Manager Regie
ジュエルシャワー,Jewel Shower
壁かけ紋章旗・盾,Shield Wall Banner
カプサイシューズ,Capsai Shoes
グランゼドーラ門,Gran Zedora Gate
オーガカウンタ大,Ogre Counter L
ウェディバスタブ,Weddie Bathtub
はじめての木工術,Would-Be Woodworking
舞い手の服セット,Performer's Outfit
モンスター討伐隊,Monster Strike Force
住宅素材屋ナナイ,Housing Materials Nanai
女神ルティアナ像,Lutiana Statue
プリンセスドレス,Princess Dress
ドルステーション,Dol Station
スラタワーヘッド,Slime Stack Head
しびれくらげ先生,Sir Man o' War
大とうぞくのカギ,Great Thief's Key
海魔の眼甲の破片,Nacreous Necromonocle Shard
ある船乗りの手記,Sailor's Memoir
ナドラダイト鉱石,Nadradite
その者　釣り老師,The Master of Fishing
バレットハンマー,Bullet Hammer
怪魔鳥バトロウス,Monstrous Bird Batros
スチームカッター,Steam Boomerang
闇騎士のよろい下,Dark Knight Lower Armor
ふわふわ雲の本棚,Fluffy Cloud Bookshelf
青年貴族のぼうし,Nobleman's Hat
ラッキークッキー,Lucky Cookies
竜王のツメの伝説,Dragonlord Claws Legend
レースの観客０８,Race Spectator 08
水晶のカウンタ大,Crystal Counter L
案内係ディアマン,Guide Diamond
パンプキンキッズ,Pumpkin kids
こあくまの弓の本,Imp Bow Book
ガーデンドレス下,Garden Dress Bottom
ハルバルド海賊団,Halbard Pirates
ピカレスクコート,Picaresque Coat
金宝箱のチェスト,Gold Treasure Chest
Ｖロンのラグ・赤,Red Vron Rug
アビサルシャーク,Abyssal Shark
バルディスタ槍兵,Valdista Spearman
シンイのこころ２,Shini's Heart Lv2
デスマーキュリー,Mortcury
暁の使者コッケン,Dawnkeeper Cuckoo
１００億の身代金,10 Billion Ransom
しぐさ書・ギフト,Emote "Gift"
人生で大切なもの,Important Things in Life
フォースシールド,Force Shield
パラディンの部屋,Paladin's Room
カルサドラ大空洞,Calsadora Hollow
グリゴリふれんず,Watcher Friends
マスターグレイト,Master Dragon
飛竜の巣のベッド,Flying Dragon Nest Bed
臨時大使ムチョロ,Temp Ambassador Mucholo
スウィートビキニ,Sweet Bikini
トポルの村への道,Road to Topol Village
オパールのタンス,Opal Wardrobe
壁かけ聖天舎の窓,Monastery Window
中腹への道　入口,Path to Halfway Entry
弐の五声は呼の声,Second of 5 Voices Call
肆の五声は哭の声,Fourth of 5 Voices Weep
第１２回ラウル像,12th Rahul Statue
レオーネトランプ,Leone Cards
プチデビル衣装券,Petit Devil Voucher
ノコギリエイ・黄,Yellow Sawfish
プクリポの便せん,Pukulipo Paper
エキサイトアクス,Excite Axe
白亜の博物館の塀,Chalk Museum Fence
神殿レイダメテス,Reidametes Temple
授業ドワーフ女性,Dwarf Female Student
チェッカーハット,Checkered Hat
邪神ヤファギル戒,Yaphagil, the Precept
魔女の長日傘・青,Blue Witch Day Umbrella
守護鬼の間への道,Road to Keeper's Chamber
お姫様の本棚・橙,Princess Bookshelf
預かり所トッケロ,Storage Tokkero
スイレンの釣り堀,Water Lily Fish Pond
こぞうバックラー,Leery Buckler
ギガスクラッパー,Giga Scrapper
ジャングル風の柱,Jungle-Style Pillar
妖精郷の舞踏服上,Faerie Realm Shirt
臨時大使カヤカリ,Temp Ambassador Kayakari
ツインアンテナＤ,Twin Antenna D
モグラのエリート,Murderous Mole
ヘルゲゴーグ・烈,Reinforced Helgegog
レース屋プクヨミ,Race Registrar Pukuyomi
波間に消えた記憶,Memory Lost in the Waves
パドレの錬金人形,Padre Alchemy Doll
中型の丸い水そう,Round Aquarium M
蘇りしラズバーン,Risen Razburn
代理人グラドマン,Agent Gladman
ショッパーバッグ,Shopping Bag
ブチブタカプセル,Spotted Pig Toy
グラコス強メダル,Apex Gracos Medal
聖王のオノの壁画,Dryspell Axe Book
サフラングローブ,Saffron Gloves
渡し守アリーモス,Ferryman Alimos
魔獣サルファバル,Demon Beast Sulphubal
シャークサンダル,Shark Sandals
春風の吹く日まで,When a Spring Wind Blows
カミルのローブ上,Kamil's Robe Top
王家のペンダント,Royal Family's Pendant
ファラザード兵Ｂ,Farazard Soldier B
黒レザーのタンス,Black Leather Wardrobe
毛皮に包まれた氷,Fur-wrapped Ice
シナイジッチたち,Sinazitch and co.
キツネパーカー下,Fox Shorts
クリスタルゲージ,Crystal Gauge
出張大使ポミリン,Ambassador Pomirin
ホワイトホイップ,White Chocolate Whisp
はじめてのドレス,My First Dress
影の谷への昇降機,Elevator to Vale of Shadow
レシピ屋オオジャ,Recipe Shop Ooja
カジュアルヒール,Casual Heels
煙霧の谷への出口,Exit to Misty Valley
ビントンの陳情書,Vinton's Petition
魔天鬼グーラたち,Sky Ogre Geira and co.
第３回魔勇者の像,3rd Evil Hero Statue
アルゴングレート,Great Argon Lizard
ふわふわコウリン,Fluffy Kourin
レジェンズエッジ,Legends Edge
異界アスタルジア,Astalgia
ファントムダガー,Phantom Dagger
大盾サイズの星空,Greatshield Sized Sky
超鍛冶ハンマー小,Super Hammer S
セラフィトランプ,Seraphi Cards
渡し守ディレーク,Ferryman Direkke
魔創兵長バスラー,Evil Captain Bassler
矢文のポスト・緑,Green Arrow Mailbox
弐の式修了の陰符,Yin II Completion Charm
郵便局員カンココ,Postman Kancoco
旅人の優雅な日常,Graceful Traveler Life
イラッシャイマセ,Welcome
ユマテルの教べん,Umatel's Pointer
ダンディクッキー,Dandy Cookies
モーモンゆず風呂,T. Sanguini Yuza Bath
執行獣ガンガブラ,Beastly Gangabra
ならず者のねぐら,Rogue's Roost
東洋風ランプ・華,Floral Orient Hung Lamp
聖守護者のタクト,Sentinel's Baton
ニシキゴイの短剣,Colorful Carp Dagger
しましまキャット,Candy Cat
手編みのセーター,Hand-Knit Sweater
魔物管理人ニョイ,Monster Manager Nyoi
アンノウンワンド,Unknown Staff
ナイトメアリーフ,Lethal Leaf
あくまのツボ呪文,Demon Pot Spell
原始獣のシャプカ,Primal Beast Shapka
ながれ星の贈り物,Shooting Star's Gift
白バラのテーブル,White Rose Table
かんだたげんすい,Robbin' 'Ood Marshal
トコトコリゼルコ,Trotting Lieseluco
はぐれメタル召喚,Liquid Metal Summon
しぐさ書・スイカ,Emote "Watermelon"
ベホマズン像・庭,King Cureslime St. (G)
ベビーサタンの書,Imp Book
黒衣の剣士パドレ,Dark Swordsman Padre
クルーガーブーツ,Kluger Boots
不滅の闘士のオノ,Axe of the Immortal
乱破の忍び装束下,Spy's Ninja Bottom
ジングルグラコス,Jingle Gracos
三姉妹のモビール,3 Sisters Mobile
ハロウィンアーチ,Halloween Arch
武器鍛冶グローブ,Weaponsmith's Gloves
シェンロンロッド,Xenlon Rod
とこなつシューズ,Summer Shoes
渚のシェルランプ,Beach Shell Lamp
調理職人コック帽,Cook's Hat
ヴァースのほら穴,Verse Cave
行動時 5%でバーハ,Insulate On Action 5%
始源の歌姫のくつ,First Diva's Shoes
オーフィーヌ海底,Orfine Seabed
おたからの花びら,Iridescent Petal
ピクニックパドレ,Padre Picnic
ゼネシアのころも,Zenethia's Garments
リソルぬいぐるみ,Resol Plushie
シュメリアブレス,Sumeria Bracelets
うさぐるみぴんく,Pink Rabbit
ブレイブクッキー,Brave Cookies
魔物管理人シュン,Monster Manager Shuna
サンダーシャウト,Hellbound Hair-Raiser
悠久の時を超えて,Beyond the Bounds of Time
かなしきだみあん,Sad Damien
パワフルステーキ,Powerful Steak
ふわふわ雲のイス,Fluffy Cloud Chair
ふるぼけたタライ,Underpants Dance
ガンコ職人の息子,Stubborn Craftsman's Son
アンドレアルの像,Rashaverak Statue
錬金強化屋アーク,Alchemy Enhancement Shop Arc
ワラキウスの幻影,Shade of Warachius
マーメイド仕切り,Mermaid Partition
ヴァルハラの館へ,To Valhalla Hall
７ｍｖドワーフ男,7mv Dwarf Man
人食い火竜コイン,Tatsunaga Coin
妖精図書館の本棚,Fairy Library Bookshelf
クロッコの全財産,Crocco's Belongings
ガーデンシューズ,Garden Shoes
オーシャングラス,Ocean Glasses
バラの刈り取り方,How to Cut Roses
郵便局員マドゥン,Postman Madun
オーロラウンダー,Aurorarounder
常闇のブーメラン,Everdark Boomerang
リカバースナック,Recover Snack
よみがえる不死鳥,Resurrected Phoenix
行動時10%で血吸い,Siphon On Action 10%
チェイサーブーツ,Chaser Boots
クマチャンブーツ,Beary Cute Boots
プクリポソファ大,Pukulipo Sofa L
村王クリフゲーン,Chief Cliffgain
防衛軍の制服・Ｙ,Defense Force Suit Y
出張大使バガトゥ,Ambassador Bagatu
新作家具屋メアル,New Indoor Furniture Shop Mare
黒のピアノのイス,Black Piano Seat
閃魔細胞のかけら,Fiend Cell Fragment
セレモニーロッド,Ceremony Rod
幻の海トラシュカ,Phantom Sea Trashka
世界樹のよろい上,Yggdrasil Armor Top
筆頭研究員の手袋,Top Researcher Gloves
忠誠のチョーカー,Champion's Choker
テルドミールたち,Upover Rider and co.
三姉妹の馬車・桃,Pink 3 Sisters Carriage
ココラタのテント,Cocolata Tent
オスクトルブーツ,Oscutor Boots
エルフカウンタ小,Elf Counter S
きぞくねずダリア,Noble Gray Dahlia
ナイフフィッシュ,Knifefish
踊り子のスカート,Dancer Skirt
ポセイドンベッド,Poseidon Bed
縁日のお面屋さん,Festival Mask Shop
シルエット・庭草,Silhouette Grass (G)
ラヴィアンローズ,Rose Spectaculars
ラピッドステッキ,Rapid Stick
ベルトロの部下Ａ,Bertro Subordinate A
シィジャン兵士長,Captain Shijan
シャイニングボウ,Shining Shot
天使の翼プリズム,Angel Wings Prism
ホイミント衣装券,Heal Mint Outfit Voucher
くらやみハーピー,Succubat
ライダーグローブ,Rider Gloves
夢のドレスを君に,A Dream Dress For You
シンイのこころ８,Shini's Heart Lv8
ウェディングくま,Wedding Bear
さみだれ突き・零,Multithrust+
モグふわベビタン,Fluffy Chef Imp
黒仙翼の羽ばたき,Fairy Wings Flapping
魚交換員ビコメチ,Fish Exchange Bikomechi
果ての泉の孔雀姫,The Peacock Princess
マーブルシュガー,Marble Sugar
きのこ村のぼうし,Shroom Village Hat
ドワーフバスタブ,Dwarf Bathtub
プチアーノン・強,Vicious Khalamari Kid
ウィリーデスピア,Vilide Spear
くじゃくのおうぎ,Peacock Fan
輝ける生命の群生,Swarm of Life
超おたからのタネ,Super Treasure Seed
武器屋リュウトウ,Weapon Shop Ryuto
ドルタムトランプ,Doltam Cards
スライムの石の柱,Slime Stone Pillar
封印の守り手たち,Seal Guardians
超さいほう針の本,Super Needle Book
くらげポンポン帽,Jellyfish Pom Pom Hat
ジャックのカード,Jack Card
ファラスのズボン,Faras' Pants
異国の寺院の香炉,Exotic Temple Censer
プラチナシールド,Platinum Shield
バシっ娘ルンリィ,Bazoom Girl Lunry
レインコートの像,Raincoat Statue
トポルのフェンス,Topol Fence
看板・ビックリ！,Sign - Exclamation!
３階への転送装置,Transporter to 3F
ウェイトブレイク,Weight Break
フレンジーの部屋,Frenzy's Room
フェアリーバット,Fruity Succubat
ウェナーフェイス,Wena Face
シールドアタック,Blockenspiel
レクスルクスの楔,Lexlux Link
バズッチャイーナ,Pazuccina
トーテムサンダル,Totem Sandals
よろず屋リューロ,General Shop Ryuro
プレゼントリスト,Present List
うごめくモノたち,Wiggling Things
ルージュアックス,Rouge Rhino Axe
桜モダングローブ,Cherry Modern Gloves
シンイのこころ６,Shini's Heart Lv6
ファラオ・ニビス,Pharaoh Nibis
ズワイガニネオン,Snow Crab Neon Sign
金剛不壊の武装術,Unbreakable Varja
アマリリスの笑顔,Amaryllis' Smile
デザートデーモン,Dessert Demon
強者賞トロフィー,Strongman Trophy
ナラジアトランプ,Narasia Cards
タンクハンバーグ,Tank Hamburger
白猫のワンピース,White Cat Dress
王軍師のグローブ,Royal Soldier Gloves
建物屋ペルホネン,Building Shop Pelhonen
カメさまカプセル,Galapagod Toy
レースの観客０９,Race Spectator 09
預かり所セテーラ,Storage Setera
限定交換屋ポタン,Limited Exchange Shop Potan
ドッグラマッコイ,Dogjamas
デスクローゼット,Mimicloset
フォーマルドレス,Formal Dress
よろいのきし・凶,Knight Destructant
ファーラット・強,Vicious Feralball
ガーデンスーツ上,Garden Suit Top
バシルーラの起源,The Origins of Bazoom
ツーショット写真,Two-Shot Photo
飛竜のベストの書,Flying Dragon Book
アドミラルハット,Admiral's Hat
スチームハンマー,Steam Hammer
クレセントエッジ,Razer-Wing
プラコン用編み物,Private Concierge Knitting
フラウスシールド,Flaus Shield
便せん屋ヒキワリ,Stationery Shop Hikiwari
防衛軍のインカム,Defense Force Intercom
乗り物係ナポポフ,Vehicle Clerk Napopofu
清廉天使のブーツ,Honest Angel Boots
懐かしのゲーム機,Nostalgic Game Console
銀河のかみかざり,Galaxy Hair Ornament
セピアンフリル上,Sepian Shirt
ライトタルト・小,Small Light Tart
マッシュスライム,Slimeshroom
バラのスティック,Rose Wand
わかがしらひのき,Young Hinoki
預かり所ボラデュ,Storage Boradu
究明者のシューズ,Research Shoes
マーチングズボン,Marching Trousers
アスバルのマント,Asbal's Cape
リードシクティス,Leedsichthys
３０分キャンドル,30 Minute Candle
真・やいばくだき,True Attack Attacker
ギガデンデロベー,Giga Dendelobe
ボンボントップス,Pompom Top
郵便局員ツィサア,Postman Tsisa
青嵐のおうぎ絵巻,Tempest Fan Book
壁かけ掛け軸・冬,Winter Wall Scroll
ダイヤココナッツ,Diamond Coconut
バズミルクティー,Pazu Milk Tea
ユーライザの部屋,Yuliza's Room
たいようのおどり,Sun Dance
ベルトロの部下Ｃ,Bertro Subordinate C
じんめんじゅ・強,Vicious Treeface
ドリームミミック,Dream Mimic
ムストの町・地下,Underneath Morst
ギャルいウィング,Stellar Wings
ジャックの衣装３,Jack's Costume 3
エルボブ像グレー,Gray Eltona Bobtail St.
カエルの置物・庭,Frog Ornament (G)
ステンドレイピア,Stained Glass Rapier
フェンサーハット,Fencing Hat
トコトコロボ椅子,Trotting Robot Chair
バルディスタ弓兵,Valdista Archer
クエスト代行受付,Quester's Behest
バスターウィップ,Scourge Whip
預かり所ガリュア,Storage Garua
究明者のコート上,Research Coat Top
バッジ交換券・光,Light Badge Ticket
プリズニャン・強,Vicious Jailcat
キュルル花火・黄,Yellow Kyururu Firework
歌詠みのころも上,Poet's Attire Top
しぐさ書・ハート,Emote "Draw a Heart"
リザードマン・強,Vicious Mandrake Major
ヴァイパーブーツ,Viper Boots
ヒューザトランプ,Hyuza Cards
レンドアのベッド,Lendor Bed
オルセコ王家の墓,Orseco Royal Tomb
銀のフライパン小,Silver Frypan S
壁かけ紋章旗・剣,Sword Wall Banner
塔のガーディアン,Tower Guardian
シャンパンタワー,Champagne Tower
ガズバランの封洞,Gazbalan Sealed Cave
スパークショット,Starstrike
ウェディの便せん,Weddie Paper
アンルシアの写真,Photo of Anlucia
かんだたみならい,Robbin' 'Ood Amateur
マイレージメダル,Mileage Medal
2015/2月分クエスト,Quest for 2015/02
朽ちた遺跡の宝箱,Ruin Treasure Chest
ロングタキシード,Long Tuxedo
武器鍛冶職人の道,The Weaponsmith's Way
交換屋メリーポコ,Exchange Shop Meripoko
ひっさつコマンド,Special command
いっぱつのつるぎ,One Shot Sword
魂がつまびく音色,Soul Strumming Tone
パッチ柄ラグ・青,Blue Patch Rug
イカ焼きプリズム,Fried Squid Prism
ジア・クリスタル,Dia Crystal
ベホイミスライム,Medislime
出張購買員パタタ,Team Vendor Agent Patata
オーフィーヌの海,Orfine Sea
デフェル荒野の石,Defel Desert Stone
黎明の霊堂への扉,Door to Mausoleum of Daybreak
ヤーン　涙の鉄拳,Yarn, Iron Fist of Tears
カプレーゼタクト,Fromage Flay Wand
ツインアンテナＡ,Twin Antenna A
ジャンボオニオン,Jumbo Onion
黒レザーのベッド,Black Leather Bed
しろはなだダリア,White Dahlia
神光放つ短剣の書,Holy Light Dagger Book
スーパーテンツク,Sluggernaut
グリードイーター,Greed Eater
クオードのズボン,Quard's Pants
しびれくらげ２５,Man o' War 25
住宅素材屋テラナ,Housing Materials Terrana
パープルエッグ２,Purple Egg 2
アヌビスのアンク,Anubis' Ankh
ゲノミーキャップ,Crankiid Cap
ふわふわキンギョ,Fluffy Goldfish
