オブジェクト座標244,Object Coordinates 244
しぐさ書・ネオン赤,Emote "Neon Red"
シルエット・DQ1欠番,Silhouette DQ1 Missing #
怨霊の憑いた戦士Ｂ,Warrior With a Grudge B
オブジェクト座標224,Object Coordinates 224
オブジェクト座標235,Object Coordinates 235
嵐の領界の雷岩・庭,Storm Realm Rock (G)
アマラーク城の衝立,Amarak Castle Screen
キンスラ王冠ランプ,King Slime Crown Lamp
しぐさ書・キンスラ,Emote "King Slime"
神具解放の審問宮３,Sanctuary of Divine Relics 3
超ようせいのひだね,Super Lamplight
原初の炎（ランプ）,Origin Flame (Lamp)
ガタラアームズの旗,Gatara Arms Banner
ゼネシアのころも上,Zenethia's Robe
ゼクレス城・テラス,Zechres Castle - Terrace
ウロコフネタマガイ,Scaly-Foot Gastropod
チョコが詰まった袋,Chocolate Filled Bag
旅のコンシェルジュ,Travel Concierge
エルフＧＰプリズム,Elf GP Prism
まもの導師のブーツ,Monster Guru's Boots
ドラゴンキッズ・強,Vicious Small Fry
クリムゾングローブ,Crimson Gloves
まもの使いのブレス,Monster Master Bangles
しぐさ書・星の魔法,Emote "Star Magic"
プラコン用のカップ,Private Concierge Cup
スノースターリボン,Snowstar Ribbon
スライムジェネラル,Shogum
おめかしＶチケット,Dress-up V Ticket
ポーズ書・ラジャー,Pose "Roger!"
アニメ塗りフィルム,Anime Paint Film
パンパニーニノート,Panpanini's Notebook
自動人形ドミネウス,Automaton Domineus
第１３回ポルテ像庭,13th Porte Statue (G)
ルクスガルン大空洞,Luxgarn Caverns
三姉妹人形・庭用青,Blue 3 Sisters Doll (G)
隠しきれないひと味,Unmistakable Hidden Flavor
ジアクト軍の飛行艇,Dia Kut Army Airship
オブジェクト座標065,Object Coordinates 065
しぐさ書・ムフフ本,Emote "Ogler's Digest"
ヴァリースタジアム,Valley Stadium
ディアブロプリズム,Diablo Prism
第１０回ラウル像庭,10th Rahul Statue (G)
アンルシアカプセル,Anlucia Toy
サメバーンプリズム,Sharkburn Prism
ヒトデのブーメラン,Starfish Boomerang
ディエゴからの試練,Trials From Diego
ヒューザのこころ９,Hyuza's Heart Lv9
バブルスライム・強,Vicious Bubble Slime
ナルビア民家のラグ,Nalbia House Rug
ウィンターゴーグル,Winter Goggles
しにがみきぞくの盾,Bone Baron Shield
ライガークラッシュ,Wild Animaul
ごうかなベッド・赤,Red Fancy Bed
壁かけロトのつるぎ,Erdrick's Sword Mount
エフェクト両手剣２,Greatsword Effect 2
ナドラガ神のほこら,Nadraga Shrine
スチームベッド・赤,Red Steam Bed
オブジェクト座標111,Object Coordinates 111
マリン調のオーブン,Marine Oven
オブジェクト座標165,Object Coordinates 165
氷闇の月飾りの破片,Icy Dark Moon Shard
前座芸人のバンダナ,Show Opener's Bandana
ディープギアマスク,Deep Gear Mask
小さな英雄のよろい,Little Hero's Armor
ネジガラミの根の束,Bundle of Twisty Root
カボチャのバスタブ,Pumpkin Bathtub
王都カミハルムイ北,Kamiharmui City North
死へと導く滅びの光,Dying Light Leads to Death
グロリアスコートＷ,Glorious Coat and Wig
ミスター・シャウト,Hell Raizer
オブジェクト座標281,Object Coordinates 281
オス三毛猫スーツⅠ,Calico Cat Suit (M) Ⅰ
ファイアタルト・小,Small Fire Tart
カントリードレス上,Country Dress Top
タイタス号の天井扇,Titus Ceiling Fan
三姉妹の飛行船・桃,Pink 3 Sisters Blimp
ガタラ原野への出口,Exit to Gatara Fields
南国の釣りざお・闇,Dark Tropic Fishing Rod
カルサドラアックス,Calsadora Axe
クリームつむりの像,Cream Slime Statue
オブジェクト座標180,Object Coordinates 180
僧兵のころもセット,Monk Warrior Outfit
第１１回ラウル像庭,11th Rahul Statue (G)
しぐさ書・ひやかす,Emote "Tease"
エンゼルフィッシュ,Angelfish
ファフニルメイル下,Fafnir Mail Bottom
ハチワレ猫カプセル,Tuxedo Cat Toy
悪霊の神々強カード,Apex Evil Trinity Card
ホワイトキュロット,White Culottes
大自然にあこがれて,Longing for Nature
オブジェクト座標080,Object Coordinates 080
炎帝のいくさ装束上,Fire God Shirt
バルサミコスの遺物,Balsamicos' Remains
コケ玉の盆栽セット,Moss Ball Bonsai Set
ふわふわブーケ飾り,Floating Boquet Decor
ポールスターボトム,North Star Pants
赤点はもうヤバい！,Failing Marks are Bad!
グーラ・マシュラン,Gullah Mashraan
マジカルエッセンス,Magical Essence
メタスラのキッチン,Metal Slime Kitchen
アマラーク城のラグ,Amarak Castle Rug
ふわふわサメバーン,Floaty Sharkburn
ギュッとリィンの箱,Lynn Arm Doll Box
Ｓジェネラルカード,Shogum Card
壁かけＤＱⅠⅩの絵,DQⅨ Painting
オブジェクト座標089,Object Coordinates 089
ガラクタボックス２,Junk Box 2
ゼドラ王国服モブ６,Zedra Royal Clothes Mob 6
第１回釣りコン・銅,1st Fish Contest Bronze
スターシルクハット,Superstar Top Hat
カボチャカウンタ大,Pumpkin Counter L
メス三毛猫スーツⅠ,Calico Cat Suit (F) Ⅰ
ようせいのあまざけ,Fairy Sweet Sake
おもちゃの空・晴れ,Toy Clear Sky
黄金のブローチの箱,Golden Brooch Box
たゆたう水面投影機,Water Surface Projector
未完の風穴の研究室,Undone Windy Cave Lab
ディバインステッキ,Divine Stick
キングスライム・強,Vicious King Slime
オパールの間仕切り,Opal Partition
ネレウススティック,Nereus Wand
警備魔神兵０４９号,Aztech Guard No. 049
カブリオレプリズム,Cabriolet Prism
オブジェクト座標227,Object Coordinates 227
ゴレオン将軍の鉄球,Goreham-Hogg's Flail
庭用ネオン・レター,Neon Letter (G)
十周年大使サリベス,Anniversary Ambassador Sarybeth
カラミティスコルプ,Calamity Scorpion
第６回釣りコン・銀,6th Fish Contest Silver
グレイブディガー強,Apex Grave Digger
プチゴレオンカード,Frail Goreham Card
メリクリギフト・紺,Navy Christmas Gift
ワイルドマシュマロ,Wild Marshmallows
強化お願いします！,Please strengthen!
党首マスター・ドー,Spicy Party Leader Mustardo
しぐさ書・メタキン,Emote "Metal King"
星辰のランプ錬金書,Stars Lamp Alchemy Book
第５回討伐ＴＡ・金,5th Boss TA Gold
ドワーフ作業首まき,Dwarf Work Scarf
プラコンゴーレム服,Golem Costume
リンカサークレット,Linka's Circlet
王さまのプレゼント,The King's Present
ジュエルスティック,Jewel Wand
マッシュルーム地区,Mushroom District
ネコ呼びよせグッズ,Call Cat Items
オブジェクト座標229,Object Coordinates 229
リボンスターのくつ,Star Ribbon Shoes
バルディア山岳地帯,Valdia Mountain Region
カラミティドラゴン,Calamity Dragon
オルフェア駅の模型,Orphea Station Model
オバケのかぶりもの,Ghost Hood
メガルーラストーン,Mega Zoomstone
ガード時50%で早詠み,Cast Speed Up On Block 50%
だんせいしつじふく,Butler Uniform (M)
ゾディアックコード,Zodiac Code
ウルベア地下遺跡前,Ruins of Urbea
蘇りし冥王ネルゲル,Risen Netherlord Nergel
魔塔の鉄の間仕切り,Tower Iron Partition
ピカレスクグローブ,Picaresque Gloves
ゴレオン将軍コイン,Goreham-Hogg Coin
ボルケーノウィップ,Volcano Whip
試みの荒野への出口,Exit to Wilderness of Trials
オブジェクト座標101,Object Coordinates 101
オブジェクト座標045,Object Coordinates 045
ホイミントドレス上,Heal Mint Blouse
緑キノコのテーブル,Green Mushroom Table
翠将鬼ジェルザーク,Gelzark, the Green General
デスマシーン練習札,Slaughtomaton Tag
川辺の休憩所への道,Path to Riverside Rest Area
悪霊の神々強メダル,Apex Evil Trinity Medal
王宮のオーブン・青,Blue Royal Oven
セピアのトーマ人形,Sepia Toma Doll
スライムベスハウス,She-Slime House
奏演王ベイオウルフ,Performance King Beowulf
しぐさ書・ペンペン,Emote "Spank"
スチームテーブル大,Steam Table L
しぐさ書・お祝い虹,Emote "Celebrate Rnbw."
さとりのころもの書,Clarity Outfit Book
レインスカート・青,Blue Rain Skirt
サイクロンアッパー,Air Raiser
ローズグレーダリア,Rose Gray Dahlia
オーブンの古い写真,Old Oven Photograph
魔法戦士団グローブ,Armamentalist Gloves
清廉天使のグローブ,Honest Angel Gloves
メタスラのチェスト,Metal Slime Chest
庭用ネオン・ハート,Neon Heart (G)
オブジェクト座標096,Object Coordinates 096
四角型のトピアリー,Square Topiary
ビューティクリーム,Beauty Cream
銀の錬金ランプの本,Silver Lamp Book
バルメシュケの水晶,Balmeschke's Crystal
攻撃時10%でヘナトス,Blunt Attack 10%
古代王族のボトムス,Ancient Royal Bottoms
タッツィぬいぐるみ,Tazzi Plushie
オブジェクト座標168,Object Coordinates 168
魔物管理侍女マトリ,Monster Maid Matori
はじめての防具鍛冶,Amateur Armorsmithing
果たせなかった契り,Unfulfilled Promise
ふわふわ雲プリズム,Fluffy Cloud Prism
袋入りプーちゃん帽,Pu Bag Hat
オブジェクト座標234,Object Coordinates 234
アクアマリンマリー,Aqua Marie
セレディーネの手紙,Celedine's Letter
オブジェクト座標194,Object Coordinates 194
舞い手のヘアバンド,Performer's Hairband
だいまどうローブ下,Great Mage Lower Robe
増殖獣バイロゴーグ,Multiplying Beast Biologog
ギンガムマフラー赤,Red Gingham Scarf
スライムかが巳もち,Kagami Mochi Slime
ベラストル家の暖炉,Belastre Fireplace
思案の洞くつへの道,Road to Contemplating Cave
異国の寺院のタイル,Exotic Temple Tile
モダンバニータイツ,Modern Bunny Tights
トレジャーグローブ,Treasure Gloves
妖精の隠れ家の石壁,Fairy Lair Stone Wall
しぐさ書・聞かざる,Emote "Don't Listen"
闇の大魔王ローブ下,Archfiend's Lower Robe
ファンキータイツ上,Funky Vest
クールスターセット,Cool Star Outfit
輝く虹を追いかけて,Chasing a Rainbow
オブジェクト座標187,Object Coordinates 187
アクアマリンの花束,Aqua Bouquet
スライムナイトの盾,Slime Knight Shield
ハニーポットチェア,Honey Pot Chair
星空のチェスト・青,Blue Starry Chest
ヒューザのこころ２,Hyuza's Heart Lv2
ペコリア・アルファ,Pekoria Alpha
月見の隕石型宇宙船,Moonview Meteor Spacecraft
マイタウン水没地区,My Town Submerged District
星辰武王の最終試練,Star Warrior's Last Trial
警備魔神兵０４１号,Aztech Guard No. 041
強・タロットメダル,Apex Tarot Medal
青のキーエンブレム,Blue Key Emblem
ヘパイトスのひだね,Hephaestus' Flame
マグマの杖のレシピ,Magma Staff Recipe
ドランド平原への道,Road to Drand Plains
オブジェクト座標200,Object Coordinates 200
レトロなサングラス,Retro Sunglasses
うさみみギフト・青,Blue Rabbit Ears Gift
ギュメイ将軍練習札,Goresby-Purrvis Tag
月明かりの谷への道,Road to Moonlit Valley
パピヨンベッド・夢,Dream Papillon Bed
ショップ店員クレマ,Shop Clerk Kurema
かがやける期待の星,Shining Hope Star
赤の錬金石２０こ券,20 Red Gems Ticket
しおさいキャンディ,Salted Candy
星空のチェスト・紫,Purple Starry Chest
とある天使の罪と罰,Sins of a Certain Angel
お祭りやぐら館の塀,Festival Fence
ギュッとザンクの箱,Zankrone Arm Doll Box
メロディアスーツ下,Melody Suit Bottom
バトルステーキ・小,Small Battle Steak
きのこのスティック,Shroom Stick
しぐさ書・たけのこ,Emote "Bamboo Shoot"
しぐさ書・アイドル,Emote "Idol"
ごうかなタンス・緑,Green Fancy Wardrobe
マイタウン農村地区,My Town Rural District
ふたつ結びエクステ,Double Knot Extension
歓迎会用テーブル１,Table for Welcome Party 1
マイタウン採掘地区,My Town Mining District
ムーンバニーヘッド,Moon Bunny Head
レオパードウェア下,Leopard Pants
鍛冶ハンマーの逆襲,Smith Hammer Strikes Back
天地雷鳴士の装束上,Druid Attire Top
人面樹ぬいぐるみ小,Treeface Plushie S
マンドラゴラベレー,Mandragora Beret
ライトニングダガー,Thunderstorm Skean
バルディジニアの花,Valdia Zinnia Flowers
オブジェクト座標073,Object Coordinates 073
オブジェクト座標041,Object Coordinates 041
レース受付係タータ,Race Receptionist Tarta
ピッカピカのレンズ,Sparkling Lens
ディバインクラウン,Divine Crown
セイレーンパレオ上,Siren's Pareo Top
はんじゅくスライム,Soft Boiled Slime
ムーンバニーシャツ,Moon Bunny Shirt
シーザーレインボー,Rainbow Scissor
カジノ祭３ビンゴ銅,CasinoFest 3 Bingo Brnz
女性白波柄のゆかた,White Wave Yukata (F)
良薬はキケンな香り,Good Medicine Smells Bad
レインスカート・白,White Rain Skirt
ダークファンタズマ,Shadeshifter
エレファントノーズ,Elephantnose Fish
おおきづちの像・庭,Hammerhood Statue (G)
サハラコートセット,Sahara Outfit
伝説の三悪魔練習札,Legendary Evils Tag
エージェントハット,Agent Hat
ふわふわジョニール,Floaty Joneal
ウィザード鏡台・黒,Black Wizard Vanity
ドン・モグーラの像,Don Mole Statue
ベストゼレスタイト,Best Celestite
ドラゴンスラッシュ,Dragon Smash
三毛ねこの便利な壁,Calico Cat Wall
天宮騎士のよろい下,Sky Knight Bottom
閃輝晶獣ビルビギス,Crystalfiend Bilbigis
名もなき草原への道,Road to Nameless Field
ガラスケースのカギ,Glass Case Key
お花の鉢植え・家用,Flower Plant Pot
ゴッドジャグリング,God Juggling
タロットパック・緑,Green Tarot Pack
精霊王のクローク下,Faerie King Skirt
あいじょうオムレツ,Affection Omelet
求道者の道着セット,Seeker's Outfit
いにしえの黄金石版,Ancient Gold Tablet
白蛇のこんの作り方,Make a White Snake Rod
庭用ネオン・アロー,Neon Arrow (G)
エンタシスマンの書,Prancing Pillar Book
会心まいしんラップ,Confidence Rap
防衛魔神兵０５７号,Aztech Guard No. 057
若手芸人のバンダナ,Young Talent Bandana
第８回ナジーンの像,8th Najinn Statue
オブジェクト座標222,Object Coordinates 222
初級魔法戦士タイツ,Novice ARM Tights
結界の守護者カード,Barrier Guardians Card
幻界の四諸侯練習札,Dread Fiends Tag
人形劇の背景セット,Puppet Show Set
あやしいカウンタ小,Suspicious Counter S
郵便局員ポエーツォ,Postman Poezzo
シックゴスドレス上,Chic Goth Dress Top
おうえんだんのふく,Cheer Team Suit
たびびとのリュック,Traveler's Backpack
ジェスターキャップ,Jester Cap
シスター・ニルーナ,Sister Nirna
セピアの魔勇者人形,Sepia Evil Hero Doll
ヘヴィーアーマー下,Heavy Armor Bottom
行動時20%で魔力覚醒,Channel Anger On Action 20%
ギガントヒルズ・強,Vicious Drakularge
赤のほこらの洞くつ,Red Shrine Cave
魔女のとんがり帽子,Witch's Pointy Hat
みんなに声をかける,Speak with everyone.
運動会・赤組衣装券,Red Team Voucher
壁かけ古びた張り紙,Old Papers Wall Decor
ゴールデンボックス,Golden Box
オブジェクト座標134,Object Coordinates 134
金平糖モビール・庭,Candy Mobile (G)
ランプ錬金設備・庭,Lamp Alch. Facility (G)
あなたと私の弓作り,You and I Making a Bow
水底にたゆたうもの,Undersea Dwellers
おうち用芝生のラグ,Lawn Rug
シルエット・鳥・白,White Silhouette Bird
あらびあんいしょう,Arabian Outfit
武器チャームメダル,Weapon Charm Medal
銀のさいほう針の本,Silver Needle Book
魔物管理人アゼルル,Monster Manager Azerul
アスバルのこころ２,Asbal's Heart Lv2
タロットパック・金,Gold Tarot Pack
みならいあくま・祖,Ancestor Winkster
ユシュカのこころ８,Yushka's Heart Lv8
プチ潮風のディーバ,Frail Sea Breeze Diva
薬草戦士と豊かな土,Herbal Warrior & Rich Soil
伝説の防具を求めて,Wish for Legendary Armor
オブジェクト座標206,Object Coordinates 206
カジノ祭５ビンゴ銅,CasinoFest 5 Bingo Brnz
バルディスタ竜騎兵,Valdista Dragon Cavalry
プラチナトレイの本,Platinum Platter Book
預かり所カルバンク,Storage Calbank
シーグリーンダリア,Sea Green Dahlia
舞踏魔プレシアンナ,Dancing Demon Prescianna
コンシェルジュ０３,Concierge 03
オブジェクト座標159,Object Coordinates 159
ブレイブギフト・青,Blue Brave Gift
聖者のほういセット,Saint's Outfit
やいばのブーメラン,Edged Boomerang
フリーズギフト・灰,Ash Freeze Gift
りょうしゅたけとら,Lord Taketora
凶拳は天を超えるか,Evil Fist Crosses Heaven
ラダトームのブーツ,Tantegel Boots
月光スミレの花びら,Moonlight Violet Petal
とこなつココナッツ,Summer Coconut
小型の四角い水そう,Square Aquarium S
手品師のヘアバンド,Conjurer's Hairband
トナカイのきぐるみ,Reindeer Costume
グレイトフルロッド,Grateful Rod
月うさぎのブランコ,Moon Rabbit Swing
在りし日を示す地図,Map of the Past
上級・ＭＰ錬金の本,Advanced MP
ウェディのあいさつ,Weddie Greeting
プチゲルニック将軍,Frail Hootingham-Gore
白夜に消えた運転士,Vanish in the Midnight Sun
旅芸人ピュージュＪ,Minstrel Pyuju J
スタースイーツ・小,Small Star Sweets
労働魔神機０３８号,Aztech Labor Mech No. 038
ヒエヒエなんです！,It's Freezing!
魔物管理人ピョンル,Monster Manager Ponel
ジェントルシューズ,Gentleman's Shoes
オブジェクト座標085,Object Coordinates 085
預かり所バルバトゥ,Storage Barbatou
ヴィスタリア姫の机,Princess Vistaria Desk
おそうじ童子のこん,Sweepy Samurai Rod
オブジェクト座標189,Object Coordinates 189
おつかれさまでした,Thanks for your hard work.
荒削りのブーメラン,Rough Boomerang
上級・呪文錬金の本,Advanced Spell
クオードのサーベル,Quard's Sabre
キンスラぬいぐるみ,King Slime Plushie
防衛魔神兵０５１号,Aztech Guard No. 051
戦士のよろいセット,Warrior Armor Set
オルクステラへの扉,Door to Orchesterra
原初の炎（聖火台）,Origin Flame (Platform)
ハイビスコサージュ,Hibiscus Corsage
なげきムーングラス,Mourning Moon Glasses
モチつき「返し手」,Pound Mochi "Returner"
アンテイクドレス上,Antique Dress
作ろう！てつよろい,Let's Make Iron Armor!
フカフカのもみガラ,Fluffy Rice Husks
プラチナ鍛冶ハン小,Platinum Hammer S
ワイドワイドブリム,Wide Wide Brim
メロディアグローブ,Melody Gloves
エンペラーレグホン,Emperor Leghorn
守護天使のガーベラ,Guardian Angel's Gerbera
神兵のよろいセット,Divine Soldier Armor Set
汚染源ヘドロヌーバ,Sludgeraker, Source of Pollution
支援魔神機０２４号,Aztech Support Mech No. 024
しぐさ書・うなずく,Emote "Nod"
ビルダーズブロック,Builders Block
勇者姫アンルシア像,Anlucia Statue
第２回釣りコン・金,2nd Fish Contest Gold
デアダイアのかけら,Deadia Shard
シックゴスグローブ,Chic Goth Gloves
セルケトのブローチ,Serket's Brooch
オブジェクト座標190,Object Coordinates 190
どうぐ使いのズボン,Item Master Pants
三姉妹の飛行船・黄,Yellow 3 Sisters Blimp
妖精の女王ウィング,Fairy Queen Wings
聖なる王城の便せん,Holy Royal Castle Paper
雑貨屋さんの屋根白,White Shop Roof
エピステーサ桃小花,Pink Epistesa Flowers
オブジェクト座標184,Object Coordinates 184
イグナイトグリーブ,Ignite Greaves
すいーとないしょう,Sweet Outfit
第１３回マローネ像,13th Marone Statue
古代魔術のほうい下,Ancient Magic Bottom
庭用ハロウィンの墓,Halloween Tombstone (G)
第１３回セラフィ像,13th Seraphi Statue
お花畑の庭用ベッド,Flower Field Bed (G)
スカーレットコート,Scarlet Coating
ガナドールスーツ下,Victor Pants
タイタス号の伝声管,Titus Voice Pipe
第５回討伐ＴＡ・銅,5th Boss TA Bronze
ミネアのオルゴール,Meena Music Box
職やりなおしの宝珠,Resetta Stone
第４回討伐ＴＡ・金,4th Boss TA Gold
壁かけのメルヘン窓,Fairy-Tale Window
アジサイ姫ゆかた上,Hydrangea Yukata Top
降魔のサークレット,Demonfel Circlet
苺お菓子の間仕切り,Berry Sweet Partition
ウルベア魔神兵たち,Urbea Aztechs
うごくせきぞうの像,Living Statue Statue
ダラズ採掘場への道,Road to Daraz Quarry
アシュレイトランプ,Ashley Cards
Ｓキラーマシンの像,Trauminator Statue
ダンディサングラス,Aviator Sunglasses
第５回釣りコン・金,5th Fish Contest Gold
紅白ダケの冬虫夏草,Caterpillar Fungus
クルーガースーツ下,Kluger Pants
第２回カンダタの像,2nd Robbin' 'Ood Statue
魔物管理人ミグニネ,Monster Manager Mignine
グローリーアックス,Great Axe
ゼネシアのころも下,Zenethia's Skirt
ごうかなラグ大・赤,Red Fancy Rug L
警備魔神兵０４４号,Aztech Guard No. 044
黒ねこシャンデリア,Black Cat Chandelier
鳥かごのポスト・黄,Yellow Birdcage Mailbox
妖魔ジュリアンテ強,Apex Mystical Juliante
博愛騎士のよろい下,Love Knight Lower Armor
ヴァルハラメイル下,Valhalla Mail Bottom
スタンドマイク・庭,Microphone Stand (G)
クルーガースーツ上,Kluger Shirt
マーメイドテーブル,Mermaid Table
コーヒーカップ・桃,Pink Coffee Set
星のおうぎのレシピ,Stellar Fan Recipe
緑花のフランベリー,Green Flanberry
ダーマ神殿のテント,Alltrades Abbey Tent
ザードの尖塔・２階,Zard Spire 2F
まもの使いずきん２,Monster Master Hood 2
オブジェクト座標207,Object Coordinates 207
ちからのペンダント,Wrecklace
ビクトリーチップ光,Light Victory Chip
カジノ祭６ビンゴ銅,CasinoFest 6 Bingo Bronze
パピヨンポスト・幻,Phantom Papillon Mailbox
ルコリアぬいぐるみ,Lucolia Plushie
ガートラント兵士Ｃ,Gartlant Soldier C
ダークプラムの花束,Dark Plum Bouquet
マデュライトの延板,Darkonium Plate
ポイズントリル・強,Vicious Poison Trill
クールスターマイク,Cool Star Microphone
グレモリーの大紋章,Gremory Sigil
モザイクタイルの壁,Mosaic Tile Wall
フリルスタービキニ,Frilled Star Bikini
こおりの杖のレシピ,Shiverstick Recipe
レッドブレイクグミ,Red Break Gummy
僧兵のサークレット,Monk Warrior Circlet
強・ボーンズメダル,Apex Bones Medal
竜の頭の石像の写真,Dragon Head Statue Photo
起源将ジェルザーク,Gelzark, General of Origin
スターコートセット,Superstar Outfit
やりなおしの無限石,Infinite Repeatstone
フューリーブレード,Fury Blade
ムーンバニーブレス,Moon Bunny Bracelets
バズカフェのアイス,Pazu Cafe Ice Cream
海のステンドグラス,Sea Stained Glass
魔塔の青い炎の台座,Blue Tower Flame
預かり所アイリーン,Storage Irene
ウェディカウンタ大,Weddie Counter L
夏休みの絵日記・銀,Silver Summer Break Diary
選定者ワルキュウリ,Selector Val-cu-rie
キズだらけのレンズ,Scratched Lens
ニセモノの見取り図,Fake Blueprint
幻界の四諸侯コイン,Dread Fiends Coin
ゆめみの銀箱タンス,Dreamy Silver Wardrobe
童話の街並みの門柱,Fairy-Tale Gatepost
オブジェクト座標266,Object Coordinates 266
超天遊戯－死の書－,Chosen's Teachings Book 4
迷宮の主の間への道,Path to Boss
コンシェルジュ０９,Concierge 09
リソルの肖像画・庭,Resol Portrait (G)
ギュッとリルチェラ,Lilcherat Arm Doll
プチバラモスブロス,Frail Soul of Baramos
ユシュカのこころ２,Yushka's Heart Lv2
破邪の紋章のレシピ,Sacred Crest Recipe
輝きの草原への出口,Exit to Shining Meadow
ライトイエロダリア,Light Yellow Dahlia
超天遊戯－壱の書－,Chosen's Teachings Book 1
攻撃時25%暴走アップ,Haywire Up Attack 25%
はがねのブーメラン,Soarin' Steel
ゆらゆら羊さん・紫,Purple Rocking Sheep
プラコンプスゴン服,Pusgon Costume
占星術師のローブ下,Astrologer Lower Robe
蚊帳つきフトン・紫,Purple Futon with Net
銀のロザリオの破片,Silver Rosary Shard
七夕の職人道具絵巻,Festival Craftsman Book
まほうよろいの秘密,Magic Armor Secret
キュロンイーター花,Kyuroneater Flower
オブジェクト座標279,Object Coordinates 279
オブジェクト座標116,Object Coordinates 116
経験値の古文書・小,Experience Scroll S
アルウェーン管理棟,Alweyn Admin Building
いたずらウサギの畑,Naughty Rabbit Field
ごうかな花びん・緑,Green Fancy Vase
カンダタこぶんプー,Merry Man Pu
レッドローズのタネ,Red Rose Seed
王国の悪夢・洞くつ,Kingdom of Terror - Cave
オブジェクト座標030,Object Coordinates 030
パンジーのビスチェ,Pansy Bustier
創造神マデサゴーラ,Worldmaker Madesagora
タウン案内係カーサ,Town Guide Casa
小さな英雄はちがね,Little Hero's Headband
防衛魔神兵０５５号,Aztech Guard No. 055
ゼドラ王国服モブ３,Zedra Royal Clothes Mob 3
ディープギアグラス,Deep Gear Glasses
ガーデニングセット,Gardening Set
