スノースターセット,Snowstar Outfit
ファヒータのホウキ,Fajita's Broom
ハイビスコサージュ,Hibiscus Corsage
書斎の筆記具セット,Study Writing Set
厭悪のルベランギス,Ruberangis the Vile
グレンの歴史４７巻,Glen History Volume 47
荘厳な神殿の便せん,Majestic Abbey Paper
ハートのベンチ・黄,Yellow Heart Bench
耐火性きんちゃく袋,Fireproof Bag
レアドロップ率1.1倍,Rare Drop Rate 1.1x
グランミュージアム,Grand Museum
シスター・ミシェル,Sister Michelle
プロディトスーツ下,Plaudit Pants
執行者ザジザディリ,Enforcer Zajizadir
ダークペルシャの杖,Whiskamancer Staff
タップペンギーたち,Pogoin' Penguins
黄チェックの便せん,Yellow Checkered Paper
ユシュカのこころ１,Yushka's Heart Lv1
どこでもクラッカー,Anywhere Cracker
あどるふうんてんし,Driver Adolf
取りよせ商チャガナ,Collection Merchant Chagana
エゼソル峡谷への道,Road to Ezesol Canyon
ゴレオン将軍練習札,Goreham-Hogg Tag
森のこびとのおうち,Forest Dwarf Home
セイレーングローブ,Siren's Gloves
お祭りやぐら館の壁,Festival Wall
おおきなリボン水白,Watercolor Ribbon L
マイタウン白亜地区,My Town Chalk District
リンベリィトランプ,Linberry Cards
特製やきにくセット,Deluxe Grilled Meat Set
黒曜の隕石孔への道,Road to Meteorite Hole
奇跡のさいほう針小,Miracle Needle S
きまぐれ猫のブーツ,Silly Cat Boots
ヴィーラのバンダナ,Vila's Bandana
マジックチャクラム,Magic Circle
オブジェクト座標015,Object Coordinates 015
オブジェクト座標207,Object Coordinates 207
しぐさ書・究極呪文,Ultimate Spell Trick
模様入りしっくい壁,Pattern Plaster Wall
キャットキャンディ,Cat Lollipop
星空のチェスト・紫,Purple Starry Chest
小さな英雄グローブ,Little Hero's Gloves
パドレア邸ブランコ,Padrea Mansion Swing
マーメイドサンダル,Mermaid Sandals
カンダタこぶんプー,Merry Man Pu
凱歌のガントレット,Valkyrie Gauntlets
かたりべのてぶくろ,Storyteller's Gloves
武器鍛冶職人の挑戦,Weaponsmith's Challenge
ビリジアンカメリア,Virdian Camellia
マンドラゴラ黒たち,Black Mandragora
ふわふわ雲のソファ,Fluffy Cloud Sofa
オブジェクト座標225,Object Coordinates 225
アブソリュートレイ,Absolute Beam
シーサイドオブジェ,Seaside Curio
じゃんぼりぃの帽子,Janbori's Hat
パンジーのサンダル,Pansy Sandals
グレゴールの洞くつ,Gregor Cavern
ラッキー便せん４０,Lucky Paper 40
メデューサウィッグ,Medusa Wig
からくりしょうぐん,Bamboolict
白銀獣ロムドゴーグ,Silver Beast Romdogog
リソルのフウキの証,Resol's SCC Emblem
ふしぎな燭台・赤色,Red Mysterious Candlestick
トンボ柄のじんべい,Dragonfly Jinbei
マジックファンの本,Magic Fan Book
カラフル風船・紫桃,Purple & Pink Balloons
影の深底への昇降機,Elevator to Shadowy Deeps
ポップスターブーツ,Pop Star Boots
チョッピ荒野の木Ａ,Choppi Wilderness TreeA
オブジェクト座標205,Object Coordinates 205
ピンクパールリング,Pink Pearl Ring
アマラーク城の壁改,Amarak Castle Wall
ミラクルサンド・小,Small Miracle Sandwich
スクアーロの写真４,Squalo's 4th Photo
ディエゴぬいぐるみ,Diego Plushie
ゼクレス魔導兵たち,Zechres Mages
りゅうおうトランプ,Dragonlord Cards
（ラッキーフロア）, (Lucky Floor)
海邪甲デプスロガン,Depthsogan, Evil of the Sea
おもちゃのサーカス,Toy Circus
ミツバチパーカー上,Honeybee Hoodie
至高の名水を求めて,Search for the Best Water
壁かけ忌まわしき絵,Abominable Painting
ふわふわトラちゃん,Floaty Traeie
星座の導き・いて座,Star Guide・Sagittarius
オブジェクト座標251,Object Coordinates 251
コルット地方への道,Road to Colt Region
銀河のランプ錬金書,Galaxy Lamp Alch. Book
レッドガーベラの傘,Red Gerbera Umbrella
ドラグーングリーブ,Dragoon Greaves
ジュレー島下層遺跡,Lower Jule Island Ruins
マリンスライムの像,Seaslime Statue
大型の四角い水そう,Square Aquarium L
プクリポテーブル小,Pukulipo Table S
プチＳグレネーどり,Frail Bombird S
労働魔神機０３４号,Aztech Labor Mech No. 034
みろーれのいしょう,Milore Costume
すざくの弓の秘伝書,Vermilion Bird Bow Book
第８回討伐ＴＡ・金,8th Boss TA Gold
セイクリッドソード,Sacred Sword
オトシゴスティック,Seahorse Stick
グランドタイタス丼,Grand Titus Bowl
追憶の武器鍛冶職人,Weaponsmith of Remembrance
お兄ちゃんへの手紙,Letter to Brother
第８回ナジーンの像,8th Najinn Statue
しぐさ書・やきそば,Yakisoba
ヴァルディスタ兵１,Valdista Soldier 1
グレースギフト・緑,Green Grace Gift
ヤシの葉の便利な壁,Palm Leaf Wall
すいーとないしょう,Sweet Outfit
バトエンジャーの像,Batoenger Statue
ツリーは白銀に消ゆ,Tree's Disappearance
プラコン用丸メガネ,Small Round Glasses
オス三毛猫スーツⅡ,Calico Cat Suit (M) Ⅱ
第５回討伐ＴＡ・銀,5th Boss TA Silver
フォステイルソファ,Fostail Sofa
コンシェルジュ１０,Concierge 10
アラビアンウェア上,Arabian Vest
クモの巣カーペット,Spider Web Carpet
ドラキーマの像・庭,Drackyma Statue (G)
大光の管制室への扉,Door to Pulse Control Room
北の渡し守ギマール,North Ferryman Guimard
ゼネシアのウィッグ,Zenethia Wig
シスター・ビゴスラ,Sister Bigosla
オブジェクト座標284,Object Coordinates 284
武器チャームメダル,Weapon Charm Medal
キュロンイーター花,Kyuroneater Flower
絶対滅神ジャゴヌバ,Jagonuba, the Absolute Annihilator
チョッピ荒野の木Ｃ,Choppi Wilderness TreeC
３連発花火・赤青緑,3 Fireworks RBG
死霊姫ヤサギリたち,Dead Princess Yasagil
ラッキーチケット銀,Silver Lucky Ticket
プラチナ錬金ランプ,Platinum Alchemy Lamp
水着貸し屋レターヌ,Swimsuit Rental Shop Letann
夏の恋は泡のごとく,Summer Love, Like a Bubble
ももんじゃグローブ,Platypunk Gloves
ドルタムのこころ３,Doltam's Heart Lv3
ダンディタキシード,Dandy Tuxedo
レンジャーコート下,Ranger Coat Bottom
グレイスフルハット,Graceful Hat
魔物シールド勲章券,Shield Medal Ticket
防衛魔神兵０５１号,Aztech Guard No. 051
うさぎエステラ人形,Rabbit Estella Doll
小さなラメのシール,Small Glitter Sticker
ハロウィンバルーン,Halloween Balloon
スパイスカレー・小,Small Spicy Curry
キューキョクＶロン,Ultimate Vron
おてんば姫のブーツ,Alena's Boots
オブジェクト座標255,Object Coordinates 255
森林警備隊グローブ,Forest Ranger Gloves
Ｖジャンプの仮面改,V Jump Mask v2
パピヨンソファ・夢,Dream Papillon Sofa
ブロンズブーメラン,Bronze Boomerang
グレイスフルボトム,Graceful Pants
魔道士キャロルギル,Wizard Kyrolgyl
ほわいとたきしーど,White Tuxedo
ウィリーデブレード,Vilide Blade
オブジェクト座標282,Object Coordinates 282
イケてる歌詞カード,Cool Lyrics Card
ギュメイ将軍練習札,Goresby-Purrvis Tag
キングリザード・強,Vicious Liege Lizard
美と富と豊穣と幸運,Beauty, Wealth And Luck
ショコラなシューズ,Chocolate Shoes
赤のほこらの洞くつ,Red Shrine Cave
シャボン玉の花かご,Bubble Flower Basket
ゲルニック将軍の杖,Hootingham-Gore's Staff
冒険ゼミ会員ベスエ,Adventurer Seminar Member Shea
３９ドラクエレンズ,DQ 39th Lens
バスルームのチェア,Bathroom Chair
ミッドナイトの花束,Midnight Bouquet
わだつみのかんむり,Sea God Crown
真の戦士への道のり,Becoming a True Warrior
第８回ラウルの像庭,8th Rahul Statue (G)
チョコレートリップ,Chocolate Tulip
ヒストリカのうちわ,Historica Fan
第１０回ユシュカ像,10th Yushka Statue
白霜の流氷野への道,Road to Frosty Floes
タロットパック・青,Blue Tarot Pack
聖湖ゼニートの壁泉,Zenit Wall Fountain
プリズニャンコタツ,Jailcat Kotatsu
バトエンジャーお面,Batoenger Mask
深い森の邸宅の屋根,Forest Manor Roof
憤怒の大剣の作り方,Making a Fury Blade
福笑いのラグ・まゆ,Fukuwarai Eyebrow Rug
おおきなリボン青白,Blue/White Ribbon L
てつのよろいセット,Iron Armor Set
ダークポイックリン,Dark Poiclin
ジェスタースーツ上,Jester Suit Top
草食モーモンの写真,Herbivore Sanguini Photo
万魔の塔・一の災壇,Banma Tower - 1st Platform
黄昏より君を連れて,Take You From Twilight
しぐさ書・スマイル,Best Smile
ふわふわ雲のタンス,Fluffy Cloud Wardrobe
ネオン・虹サークル,Neon Rainbow Circle
パンジーのビスチェ,Pansy Bustier
ナンナのこころ１０,Nanna's Heart Lv10
郵便局員ジョレミー,Postman Joremy
白蛇のこんの作り方,Make a White Snake Rod
防衛魔神兵０５７号,Aztech Guard No. 057
オブジェクト座標107,Object Coordinates 107
壁かけ海賊フラッグ,Pirate Flag Wall Decor
ふわふわフラフの箱,Floaty Fluff Box
プクリポのあいさつ,Pukulipo Greeting
強戦士の聖域・闘場,Book of Bosses - Arena
リゼ＆ルコプリズム,L & L Prism
第１回カジノ祭・銅,1st Casino Fest Bronze
カジノバニースーツ,Casino Bunny Suit
ゴルフメンズウェア,Golf Men's Wear
ブラックタキシード,Black Tuxedo
悪魔道化師ゲイザー,Demon Clown Gazer
フォートレスハウス,Fortress House
アジサイ姫ゆかた上,Hydrangea Yukata Top
レジェンズステッキ,Legends Wand
オブジェクト座標040,Object Coordinates 040
使い手をいやすオノ,Wielder-Healing Axe
雪原のファーブーツ,Snowfield Fur Boots
ちびっこ竜族ポーチ,Nadravian Kids Pouch
ネルゲルぬいぐるみ,Nergel Plushie
紫炎の滅機将シュバ,Violet General Shuba
亡き王国に捧げる詩,Ode to a Departed Kingdom
烈風のころもセット,Gale Garments Set
レーンの村のアーチ,Rane Village Arch
パピヨンツリー・幻,Phantom Papillon Tree
マドハンドの像・庭,Muddy Hand Statue (G)
ぬいぐるみ屋ビスカ,Plushie Shop Bisca
エゼソル峡谷の木Ｃ,Ezesol Canyon Tree C
オバケのかぶりもの,Ghost Hood
黄金のペンプリズム,Golden Pen Prism
かーにばるこーでⅡ,Carnival Outfit Ⅱ
幻界のゆびわの破片,Phantom Ring Shard
カボチャテーブル小,Pumpkin Table S
サフィア宙橋への扉,Door to Saphia Bridge
庭用ネオン・アロー,Neon Arrow (G)
図解・虚空を断つ剣,Void Sword Schematic
ビクトリーチケット,Victory Ticket
ビクトリーチップ菜,Vegetable Victory Chip
しぐさ書・キンスラ,King Slime Trick
さざなみギフト・白,White Ripples Gift
プリマベーラピアス,Primavera Earrings
聖銀のどくろあらい,Silver Haardvark
フラワーの気球・桃,Pink Flower Balloon
サボテンダーマスク,Cactuar Mask
きじゅつしのブーツ,Illusionist's Boots
プチキラーマジンガ,Frail Uberkilling Machine
旅芸人ピュージュＪ,Minstrel Pyuju J
特別郵便局員レチカ,Special Postman Lechika
アンチイエローバー,Anti-Yellow Bar
黒衣の剣士キッチン,Dark Swordsman Kitchen
呪われた大地への道,Road to Cursed Land
ふうまの盾の作り方,Make a Dampening Shield
新鮮な異形獣のツノ,Fresh Hexabeast Horn
リボンスターの服上,Star Ribbon Top
吊るし潜水艦ライト,Submarine Hanging Light
うつしよの天箱・改,Worldly Sky Box+
武闘家ヤーン分身Ｂ,Martial Artist Yarn Copy B
星辰のランプ錬金書,Stars Lamp Alchemy Book
南国の釣りざお・闇,Dark Tropic Fishing Rod
きのこ村のエプロン,Shroom Village Apron
バトエンをかかげる,Raise Battle Pencil
夏休みの絵日記・銅,Bronze Summer Break Diary
たちきりバチの群れ,A Swarm of Buzzbees
若手芸人のてぶくろ,Young Talent Gloves
凶拳は天を超えるか,Evil Fist Crosses Heaven
オブジェクト座標231,Object Coordinates 231
うんてんしこぺちゃ,Driver Kopecha
スライムレース印章,Slime Race Stamps
王宮のチェスト・赤,Red Royal Chest
ペンシルボーイの像,Prancing Pencil Statue
スコアアタック銅赤,Score Attack Bronze
やみしばりの像・庭,Hellbound Horror (G)
破壊神の眼甲の破片,Wrecking Eye Shard
オブジェクト座標067,Object Coordinates 067
カラス神楽の装束Ⅱ,Crow Dance Costume Ⅱ
公演会２５夏レンズ,Summer '25 Show Lens
ごうかな飾り棚・赤,Red Fancy Shelf
アシュレイフェイク,Ashley Fake
取りよせ商ドロフィ,Collection Merchant Dorofi
ストリートバンダナ,Street Bandana
クリムゾングレイブ,Crimson Glaive
歯車じかけの便せん,Gear Paper
しゃくねつのカケラ,Searing Shard
第１０回ナンナの像,10th Nanna Statue
メタル天馬プリズム,Metal Tantamount Prism
うつしよの銅箱・改,Worldly Bronze Box+
アスバルのこころ２,Asbal's Heart Lv2
おてんば姫のぼうし,Alena's Hat
しのギフトボックス,Death Gift Box
ラウルの肖像画・庭,Rahul Portrait (G)
夏休みの絵日記・金,Gold Summer Break Diary
亡き王に手向ける花,Flowers for the Late King
怨霊の憑いた戦士Ｂ,Warrior With a Grudge B
しぐさ書・とまどう,Bewildered
ギャルのコサージュ,Stellar Starflower
行動時25%早詠みの杖,Faster Caster On Action 25%
ビクトリーチップ青,Blue Victory Chip
見覚えのあるドレス,Familiar Dress
はじゃのろーぶきん,Gold Champ Robe
たけやりへいの陣笠,Bambooligan Helmet
ホワイトキャンドル,White Chocolate Candle
預かり所フォッチャ,Storage Foccia
魔女ハバネロのムチ,Witch Habanero's Whip
中層・サフィア宙橋,Middle Area - Sapphira Bridge
バレンタインココア,Valentine Cocoa
まもの使いずきん２,Monster Master Hood 2
代理人レレッポの像,Agent Releppo Statue
スーパースターの証,Noscar
あそび商人ニャポー,Play Merchant Meowpaw
プラチナ錬金ツボ小,Platinum Pot S
オブジェクト座標256,Object Coordinates 256
シスター・デリアン,Sister Derian
ライトニングソード,Thunderstorm Sword
しぐさ書・お祝い虹,Celebrate Rainbow
司祭のほういセット,Pastor's Outfit
もじゃらきラクーン,Raccoon Platypunk
はじめての防具鍛冶,Amateur Armorsmithing
蒼穹兵団のよろい上,Azure Corps Armor
商人トルネコの依頼,Merchant Torneko's Request
切り替わり物干し台,Switchable Clothesline
フェアリーウィング,Fairy Wings
七夕デート大作戦！,A Star Festival Date!
プチマジンガカード,Frail Uberkilling Card
モダンローズヒール,Modern Rose Heels
みんなに声をかける,Speak with everyone.
ごーれむのきぐるみ,Golem Costume
扉つきアーチ型の壁,Arched Wall with Door
魔物管理侍女マトリ,Monster Maid Matori
旅芸人の衣装セット,Minstrel Outfit
海沿いのヴィラの床,Seaside Villa Floor
謎の幽霊列車の写真,Mystery Ghost Train Photo
プラコンドレス・橙,Orange Dress
ゆめみの闇箱タンス,Dreamy Dark Wardrobe
再しぐさ書・盆踊り,Bon Dance (Reprint)
ギュッとリゼロッタ,Lieselotte Arm Doll
マーチングキャップ,Marching Cap
壁かけ読書家の本棚,Avid Reader Bookshelf
グランゼニスの王冠,Gran Zenith's Crown
ダーマ神殿のテント,Alltrades Abbey Tent
水辺のシェルベッド,Waterside Shell Bed
だいまどうのぼうし,Great Mage Hat
ヒールカルボナーラ,Heal Carbonara
三姉妹人形・庭用橙,Orange 3 Sis. Doll (G)
プラコン男あくま服,Men's Imp Costume
シャイニーウィング,Shiny Wings
常闇の竜プクナード,Everdark Dragon Pukunad
イグナイトメイル下,Ignite Mail Bottom
メリクリギフト・紺,Navy Christmas Gift
ポンポンベタ・青赤,Red Pom Pom Betta
モダンローズの手袋,Modern Rose Gloves
スターリースタッフ,Starry Staff
黒パールコンパクト,Black Pearl Compact
ライノス・ルージュ,Rouge Rhino
コッケンのトマリギ,Cuckoo's Perch
黒い影の正体の写真,Shadow's True Form Photo
死へと導く獣の伝承,Beast That Leads to Death
魔物ブルーメット券,Blue Helmet Ticket
オブジェクト座標157,Object Coordinates 157
Ｖロンのタンス・赤,Red Vron Wardrobe
アンルシアキッチン,Anlucia Kitchen
ローヌ樹林帯への道,Road to Rhone Woodlands
運動会・白組衣装券,White Team Voucher
オフィサーキャップ,Officer Cap
ブライダルグローブ,Bridal Gloves
ハウジング同好会室,Housing Club Room
しぐさ書・雪の魔法,Snow Magic
女性もみじのゆかた,Maple Yukata (F)
アンドレアルメダル,Rashaverak Medal
ヴァンガードコート,Vanguard Coat
ハロウィン衣装券Ⅲ,Halloween Voucher Ⅲ
ブランドンビースト,Brandon's Beast
砂の都ファラザード,Farazard
消えることのない炎,Unquenchable Flames
黄金の棺桶風ベッド,Gold Coffin Bed
スライムのキッチン,Slime Kitchen
ブルーム・ブリーズ,Bloom Breeze
オシリスのブローチ,Osiris' Brooch
フェルアバの洞くつ,Felaba Cave
リボンスターの服下,Star Ribbon Pants
オブジェクト座標201,Object Coordinates 201
東洋風ついたて・華,Floral Orient Partition
三姉妹人形・家用桃,Pink 3 Sisters Doll
シックに着こなして,Wear it Chicly
スキマスぬいぐるみ,Skimas Plushie
赤点はもうヤバい！,Failing Marks are Bad!
東洋風ついたて・雅,Chic Orient Partition
ディカス団長のメモ,Commander Dicus' Note
荒城の宝物殿への道,Path to Palace Treasury
武器屋の家の設計図,Weapon Shop Blueprint
童話の街並みの街灯,Fairy-Tale Lamppost
エルドナ神のリボン,Eldona's Ribbon
労働魔神機０３１号,Aztech Labor Mech No. 031
スノーボールンたち,Snowballon and co.
カルデア山道の横穴,Chaldea Mountain Road Cave
極天女帝のローブ下,Sky Empress Robe Bottom
ヘイズバットの分身,Avatar of Haze Bat
英雄はすべてを救う,A Hero Saves All
デビルアーマーの書,Harmour Book
スターリーステッキ,Starry Stick
バーベキューセット,Barbecue Set
強化お願いします！,Please strengthen!
レラージェアックス,Leraje Axe
はいたついんまずる,Deliverer Mazur
海賊なりきりたき火,Pirate Campfire
オーブンの古い写真,Old Oven Photograph
護りの盾アンルシア,Protector Anlucia
スポットライト・庭,Spotlight (G)
しぐさ書・ごきげん,Cheery
原初の炎（聖火台）,Origin Flame (Platform)
じごくの弓の黙示録,Oh-No, An Apocalypse
ミイラエルフ人形女,Mummy Elf Doll (F)
真・暗殺武器の歴史,True Assassin Weapons
プラコン男オバケ服,Men's Ghost Costume
モダンバニータイツ,Modern Bunny Tights
オブジェクト座標219,Object Coordinates 219
アンルシアの剣鞘無,Sword Unsheathed Anlucia
壁かけラウル肖像画,Rahul Portrait
王国軍司令部の緑扉,Royal Army Green Door
ゴールドマンＸ３号,Gold Golem X 3
グリーンタキシード,Green Tuxedo
キングエレファント,Elephant King
オブジェクト座標148,Object Coordinates 148
踊り神ボニータ右羽,Dance God Bonita Right Wing
ビクトリーチップ黄,Yellow Victory Chip
夜天に飛来せしもの,Nymean
あまつちに雷鳴轟く,Thunder Rumbles in the Sky
きんのブレスレット,Gold Bracer
お花の鉢植え・家用,Flower Plant Pot
くろがねのよろい上,Darksteel Cuirass
リシアの新作アクセ,Lycia's New Accessory
オパールのキッチン,Opal Kitchen
バージンロードラグ,Wedding Aisle Rug
ムニエカ・隠し通路,Munieka - Secret Passage
スターコートセット,Superstar Outfit
帝国の闇サンタたち,The Yuleish Empire
キナリ太猫カプセル,Fat Kinari Cat Toy
第１３回マローネ像,13th Marone Statue
せいどうのよろい下,Bronze Armor Bottom
エンゼルスティック,Angel Wand
鉄壁のよろいセット,Ironclad Armor Set
どうぐ使いのブーツ,Item Master Boots
オブジェクト座標083,Object Coordinates 083
くろがねのはちがね,Darksteel Headband
カジノ祭６ビンゴ金,CasinoFest 6 Bingo Gold
キンスラぬいぐるみ,King Slime Plushie
ビクトリーボックス,Victory Box
スライムかが巳もち,Kagami Mochi Slime
ファルコンウィング,Falcon Wing
灰ねこシャンデリア,Ash Cat Chandelier
そのオノは星を断つ,Go and Axe the Stars
しぐさ書・雪だるま,Snowman
シグナルクローバー,Clover Signal
ユシュカのこころ６,Yushka's Heart Lv6
管理タブレット新品,New Management Tablet
スマート吊りランプ,Smart Hanging Lamp
オブジェクト座標092,Object Coordinates 092
マダム・フェリシア,Madame Felicia
カラフル風船・赤黄,Red & Yellow Balloons
短くなったロウソク,Shortened Candle
白銀のフランベリー,Silver Flanberry
本棚付きの大きな壁,Bookshelf Wall L
惜別の置き手紙伝説,Farewell Letter Legend
カンダタこぶんクー,Merry Man Ku
超さいほう針小の本,Super Needle S Book
行動時20%バイシオン,Oomph On Action 20%
ビクトリーチップ刻,Time Victory Chip
大いなる危機の胎動,Great Crisis in Motion
お祭りやぐら館の塀,Festival Fence
モモリオンの日記帳,Sanguini King's Diary
ブルーリリィのタネ,Blue Lily Seed
ゴローさん部屋着下,Goro Shorts
聖湖ゼニートの小屋,Zenit Cabin
シープ木馬プリズム,Rocking Sheep Prism
ダンシングライト緑,Dancing Light (Green)
シスター・クレセダ,Sister Creseda
ルファ神殿への亀裂,Crevice to Rufa Temple
大魔王マデサゴーラ,Demon Lord Madesagora
オラクルギフト・桃,Pink Oracle Gift
ホイミントドレス下,Heal Mint Skirt
求めるは仙者の霊薬,Seeking a Hermit's Elixir
キャロルじんべい上,Carol Jinbei Top
ギフト係リーフィー,Gift Clerk Leafy
アルウェーンの街灯,Alweyn Lamppost
エテーネのあいさつ,Ethene Greeting
トランク型のタンス,Suitcase-Style Wardrobe
ジェントルコート下,Gentleman's Pants
妖炎魔女のパンプス,Fire Witch Shoes
しぐさ書・空気イス,Air Chair
転生の花（つぼみ）,Rebirth Flower (Bud)
ピクニッククロニコ,Chronico Picnic
ゼドラ王国服モブ４,Zedra Royal Clothes Mob 4
やるきのジャーミィ,Jacked Jammy
カボチャのバスタブ,Pumpkin Bathtub
キュロン湿原への道,Road to Kyuron Marshlands
カジノ祭３ビンゴ金,CasinoFest 3 Bingo Gold
黒紫チューリップ傘,Blk/Prp. Tulip Umbrella
バルディスタ魔術兵,Valdistan Caster
支援魔神機０２２号,Aztech Support Mech No. 022
フライパン屋パオス,Frying Pan Shop Paos
メタスラのバスタブ,Metal Slime Bathtub
ウェディのターバン,Weddie Turban
ポップスターリスト,Pop Star Wristbands
ウイングエッジの本,Razor-Wing Book
オーガニックサラダ,Ogre-nic Salad
行動時10%聖なる祈り,Care Prayer On Action 10%
メレアーデキッチン,Mereade Kitchen
チームゆく年くる年,Team New Year
ドルタムのこころ８,Doltam's Heart Lv8
ギュッとウシぐるみ,Cow Arm Doll Plush
ステージチュチュ上,Stage Tutu Top
はじゃのよろいきん,Gold Champ Armor
ロードリーローブ上,Lordly Robe
どうぐ使いのぼうし,Item Master Hat
ガラクタボックス２,Junk Box 2
防衛魔神兵０５４号,Aztech Guard No. 054
花狩人の衣装券・赤,Red Flowerer Voucher
ガーディアンヘルム,Guardian Helm
スチーム装備セット,Steam Equipment Set
ウェスタンレイピア,Western Rapier
ジュレイダ連塔遺跡,Juleida Tower Remains
ガイアファンタジア,Gaia Fantasia
とこしえのゆりかご,Eternal Cradle
旅芸人ピュージュＨ,Minstrel Pyuju H
魔天兵ゴルドーたち,Evil Soldier Goldo and co.
オブジェクト座標118,Object Coordinates 118
ドット風セラフィ像,Pixel Seraphi Statue
闇の領界のレリーフ,Dark Realm Relief
おおきなリボン黒桃,Black/Pink Ribbon L
ゼネシアのかんむり,Zenethia's Crown
ヴァレリアカプセル,Valeria Toy
戦闘中ＭＰ自動回復,Auto MP Recovery
ヴァランガアックス,Valanga Axe
ブレイブギフト・黒,Black Brave Gift
エージェントの服上,Agent Coat Top
２人のクライアント,Two Clients
グレースギフト・黄,Yellow Grace Gift
ブルートライデント,Blue Trident
ポーズ書・キュート,Cute Pose
預かり所シャーヤー,Storage Shayer
南国の釣りざお・炎,Fire Tropic Fishing Rod
プラチナ鍛冶ハンマ,Platinum Hammer
グレイブディガー強,Apex Grave Digger
ＤＱＸ５周年の御旗,5th Anniversary Flag
ビクトリーチップ紫,Purple Victory Chip
月に還る双子の物語,Tale of Two Moons
赤バラのドレッサー,Red Rose Vanity
支援魔神機０２７号,Aztech Support Mech No. 027
ゾディアックコード,Zodiac Code
アンノウンショット,Unknown Bow
リビングスタチュー,Sculpture Vulture
キングヒドラコイン,King Hydra Coin
プラコン風呂用衣装,Bath Outfit
ゼクレス城・宝物庫,Zechres Castle - Treasury
第３回釣りコン・銅,3rd Fish Contest Bronze
しぐさ書・あらまあ,Oh My!
マスター・クレップ,Guildmaster Krepp
スチームテーブル大,Steam Table L
オブジェクト座標135,Object Coordinates 135
こおりの杖のレシピ,Shiverstick Recipe
クマリスぬいぐるみ,Kumaris Plushie
