アルファ用アルウェ王妃の別荘跡(子供たちの隠れ家内部Test),Queen Alwe's Villa Ruins for Alpha (Test Inside Children's Hideout)
バトル班用テストマップ（いにしえのゼルメア）,Team Battle Map Test (Ancient Zelmea)
どらごんくえすとえいとしゅじんこうのいしょう,DQⅧ Hero Costume
このマップは モンスターから逃げられません。,You can't run from monsters on this map.
　　　～モンスター討伐隊隊員からの依頼～,         Monster Strike Force Request
マッチングテストステージ（同期テスト用）,Match test stage (for sync testing)
マッチングテストステージ（同期後移動用）,Match test stage (for moving beat testing)
グランゼドーラ領-グランゼドーラ王国 入口,Gran Zedora Territory - Gran Zedora Kingdom Entry
リャナ荒涼地帯-ねじれたる異形の大地 入口,Lyana Desolate Area - Twisted Deformed Earth Entry
アラハギーロ地方-モンスター格闘場 入口,Al-Ahagiro Region - Monster Arena Entry
メルサンディ穀倉帯-メルサンディ村 入口,Melsandy Millfields - Melsandy Village Entry
アラハギーロ地方-アラハギーロ王国 入口,Al-Ahagiro Region - Kingdom of Al-Ahagiro Entry
メルサンディ穀倉帯-こもれびの広場 入口,Melsandy Millfields - Sunbeam Square Entry
メルサンディ穀倉帯-さびれたほこら 入口,Melsandy Millfields - Deserted Shrine Entry
季節イベント「お月見」　コンパニオン,Seasonal Event "Moon View" Companion
季節イベント「オ月見」　コンパニオン,Seasonal Event "Moon View" Companion
ぷらこんだんせいようそくたいむらさき,Purple Ceremony Gown
バトル班用テストマップ（ムスト廃墟）,Team Battle Map Test (Musuto Ruins)
メルサンディ穀倉帯-メルン水車郷 入口,Melsandy Millfields - Melun Watermill Entry
アラハギーロ地方-日除けのほら穴 入口,Al-Ahagiro Region - Sunshade Cave Entry
アラハギーロ地方-ムルードの岩山 入口,Al-Ahagiro Region - Murudo Mountain Entry
神代過ぎ～　春の桜よ　無為に咲く～,Past ages divine, the spring blossoms bloom, waiting idly by...
ぷらこんすくーるせいふくおんなしろ,White School Uniform (F)
ぷらこんすくーるせいふくおんなちゃ,Brown School Uniform (F)
ぷらこんすくーるせいふくおとこあか,Red School Uniform (M)
ぷらこんすくーるせいふくおとこちゃ,Brown School Uniform (M)
ぷらこんすくーるせいふくおとこしろ,White School Uniform (M)
ぷらこんだんせいようそくたいみどり,Green Ceremony Gown
ぷらこんすくーるせいふくおんなこん,Blue School Uniform (F)
ぷらこんすくーるせいふくおんなあか,Red School Uniform (F)
ぷらこんすくーるせいふくおとここん,Blue School Uniform (M)
ぷらこんすくーるせいふくおとこくろ,Black School Uniform (M)
ルファ神殿エントランス（オープン）,Rufa Temple - Entry (Open)
ぷらこんすくーるせいふくおんなくろ,Black School Uniform (F)
リャナ荒涼地帯-ソーラリア峡谷 入口,Lyana Desolate Area - Solaria Canyon Entry
アルファ用井戸(ダンダダ団のアジト),Well for Alpha (Robbin' 'Ood Gang HQ)
コニウェア平原-ココラタの浜辺 入口,Coniware Plain - Cocolata Beach Entry
バトル班用テストマップ(ツスクル）,Team Battle Map Test (Tsusukuru)
だんせいぷらこんふくみっどないと,Midnight Clothes (M)
バトル班用テストマップ（獅子門）,Team Battle Map Test (Lion Gate)
ぷらこんじょせいしのびのふくあか,Red Women's Ninja Suit
ぷらこんだんせいようそくたいはい,Ash Ceremony Gown
ぷらこんじょせいようみどりさんた,Green Women's Santa Suit
ぷらこんじょせいしのびのふくもも,Pink Women's Ninja Suit
ぷらこんじょせいしのびのふくくろ,Black Women's Ninja Suit
プンスコのテーブル＆ティーセット,Punsuko's Table & Tea Set
ぷらこんだんせいしのびのふくくろ,Black Men's Ninja Suit
ぷらこんじょせいしのびのふくこん,Navy Women's Ninja Suit
ぷらこんだんせいようそくたいあお,Blue Ceremony Gown
ぷらこんじょせいしのびのふくあお,Blue Women's Ninja Suit
あすふぇるどがくえんがくせいふく,Asfeld Academy Uniform
じょせいぷらこんふくみっどないと,Midnight Clothes (F)
だんせいぷらこんふくだーくぐれー,Dark Gray Clothes (M)
ぷらこんだんせいしのびのふくちゃ,Tea Men's Ninja Suit
ぷらこんじょせいみこふくむらさき,Purple Priestess Dress
ぷらこんだんせいしのびのふくあか,Red Men's Ninja Suit
ぷらこんじょせいむらさきふりそで,Purple Women's Kimono
ぷらこんだんせいしのびのふくあお,Blue Men's Ninja Suit
ぷらこんだんせいようそくたいちゃ,Tea Ceremony Gown
ぷらこんだんせいしのびのふくこん,Navy Men's Ninja Suit
じょせいぷらこんふくあいすぶるー,Ice Blue Clothes (F)
だんせいぷらこんふくみすとぐれー,Mist Gray Clothes (M)
ぷらこんだんせいようみどりさんた,Green Men's Santa Suit
リンジャハル海岸-教会シスター 前,Linjahar Coast - Church Sister
リンジャハル海岸-リンジャの塔 前,Linjahar Coast - Linja Tower
マデ島＆エテーネ王宮（4.5CS専用）,Made Isle & Ethene Royal Manor (4.5CS only)
攻撃力上昇時特技ダメ+20(試合無効),Skills +20 While Atk. ↑ (PvP×)
レビュール街道北-海風の洞くつ 前,Reviewle Highway North - Seabreeze Cave
セレドット山道-ベリルのほら穴 前,Celedot Mountain Pass - Beryl Den
必殺チャージ時 チャージ時間-10秒,Charge Time -10 sec. On Special
プログラマー用負荷検証ステージ4,Loading Programmer Verification Stage 4
プログラマー用負荷検証ステージ1,Loading Programmer Verification Stage 1
プログラマー用負荷検証ステージ5,Loading Programmer Verification Stage 5
受けた属性ダメージの 10%ＨＰ回復,10% Attribute Damage Taken As HP
追憶の世界-アルウェ王妃の別荘跡,World of Remembrance-The Ruins of Queen Alwe
プログラマー用負荷検証ステージ2,Loading Programmer Verification Stage 2
プログラマー用負荷検証ステージ3,Loading Programmer Verification Stage 3
魔天の勇者＆聖夜の破壊者・闇組,Demon Sky Hero & Holy Night Wrecker Dark Team
ぷらこんこどもようみずぎせっと,Children's Swimsuit
瀕死時 20%こうげき力+60(試合無効),Near-Death Attack +60 20% (PvP×)
ぷらこんじょせいようあかさんた,Red Women's Santa Suit
ぷらこんじょせいようももさんた,Pink Women's Santa Suit
30%の確率で受けたダメージ10%反射,30% Chance to Reflect 10% Damage
ぷらこんじょせいようももあろは,Pink Women's Aloha
魔天の勇者＆聖夜の破壊者・雪組,Demon Sky Hero & Holy Night Wrecker Snow Team
ぷらこんじょせいようしろあろは,White Women's Aloha
\s\m\eは　カードを引いた。　→　,\s\m\e draws a card. → They drew the !
ぷらこんだんせいようくろさんた,Black Men's Santa Suit
ぷらこんじょせいようしろさんた,White Women's Santa Suit
ぷらこんだんせいようしろあろは,White Men's Aloha
ぷらこんじょせいようあおあろは,Blue Women's Aloha
ぷらこんだんせいようももあろは,Pink Men's Aloha
ぷらこんじょせいみこふくみどり,Green Priestess Dress
ぷらこんだんせいようしろさんた,White Men's Santa Suit
壊れたアストルティアのコンパス,Broken Astoltia Compass
ぼうえいぐんのせいふくむらさき,Purple Defense Force Suit
ぼうえいぐんのせいふくはいいろ,Gray Defense Force Suit
ぷらこんだんせいはかまむらさき,Purple Men's Hakama
えるどなしんのしょうぞくせっと,Eldona's Outfit
\s\m\eは　ダイスをふった。　→　,\s\m\e rolls a die. → It's a !
ぷらこんだんせいようあかさんた,Red Men's Santa Suit
ぷらこんじょせいようくろさんた,Black Women's Santa Suit
はなかりゅうどのころもむらさき,Purple Flower Hunter Outfit
ぷらこんだんせいようあおあろは,Blue Men's Aloha
ぷらこんじょせいようあかあろは,Red Women's Aloha
\s\m\eは　コインをなげた。　→　,\s\m\e flips a coin. → The coin lands on !
豪魔将ベリンダ＆豪魔将ブレンダ,Generals Belinda & Brenda
じょせいぷらこんふくさんせっと,Sunset Clothes (F)
瀕死時 15%こうげき力+60(試合無効),Near-Death Attack +60 15% (PvP×)
ぷらこんだんせいようももさんた,Pink Men's Santa Suit
味方死亡時 50%でためる(試合無効),Tension Revenge 50% (PvP×)
扉は　かたく　閉ざされている。,The door is tightly closed.
ゴリウスの怨霊＆魔道士キルギル,Gorius' Vengeance & Wizard Kirgyl
会心と暴走時魔物にダメージ +100,Critical/Haywire Damage +100
コニウェア平原-教会シスター 前,Coniware Plain - Church Sister
リャナ荒涼地帯-滝を臨む集落 前,Lyana Desolate Area - Waterfall Village
レビュール街道南-三門の関所 前,Reviewle Highway South - Three Way Gate
敵を倒すと 3%でためる(試合無効),Tension On Enemy Defeat 3% (PvP×)
モンセロ温泉峡-中央のやぐら 前,Moncello Spring Gorge - Central Scaffold
ドラクロン山地-竜守りの小屋 前,Draklon Mountains - Dragon Guard's Hut
デフェル荒野-不思議の魔塔 入口,Defel Desert - Mysterious Tower Entry
行動時 2%で聖女の守り(試合無効),Alma Mater On Action 2% (PvP×)
リャナ荒涼地帯-くずれた灯台 前,Lyana Desolate Area - Collapsed Lighthouse
ジャイラ密林-クドゥスの泉 入口,Jyra Jungle - Kudus Spring Entry
セレドット山道-セレドの町 入口,Celedot Mountain Pass - Town of Celed Entry
アルファ用追憶の世界 別荘跡編,World of Recollection for Alpha Villa Ruins
こうげき魔力とかいふく魔力 +10,Magical Might/Mending +10
戦いで 魔物に狙われにくくなる,Less likely to be targeted in battle
テンション時魔物にダメージ+100,Damage During Tension +100
行動時 5%でバイシオンとスカラ,Oomph & Buff On Action 5%
3.0%でターン消費なし(試合無効),Free Turn 3% (PvP×)
チームゆく年くる年　２０２３,Team New Year 2023
どるわーむけんきゅういんふく,Dolworm Research Suit
ぷらこんじょせいみこふくもも,Pink Priestess Dress
ぷらこんじょせいくろふりそで,Black Women's Kimono
闇に唄う氷にまぎれし聖なる者,Frozen Sacred Singer
チームゆく年くる年　２０１９,Team New Year 2019
嵐魔ウェンリルとアクラガレナ,Wenrir the Storm & Akragarena
はるかぜおうえんだんいしょう,Spring Cheer Team Outfit
はなかりゅうどのころもみどり,Green Flower Hunter Outfit
ＤＱⅧしゅじんこうのいしょう,DQⅧ Hero Costume
行動時 7%でバイシオンとピオラ,Oomph & Accelerate On Action 7%
ぷらこんおんなぱんぷきんふく,Women's Pumpkin Clothes
はなかりうどのころもむらさき,Purple Flower Hunter Outfit
ぷらこんすいーとふくだいだい,Orange Sweet Clothes
ぼうえいぐんのせいふくみどり,Green Defense Force Suit
魔天の勇者＆キラークリスマス,Demon Sky Hero & Christmas Killing Machine
2.0%でターン消費なし(試合無効),Free Turn 2% (PvP×)
ぷらこんじょせいももふりそで,Pink Women's Kimono
じょせいぷらこんふくむらさき,Purple Clothes (F)
巨人コアを守るジア・クトたち,Defenders of the Core
ぷらこんだんせいようきあろは,Yellow Men's Aloha
フォークに刺さったパンケーキ,Pancakes Stuck in a Fork
だんせいしらなみがらのゆかた,White Wave Yukata (M)
行動時 5%でバイシオンとピオラ,Oomph & Accelerate On Action 5%
チームゆく年くる年　２０１７,Team New Year 2017
ぷらこんおとこどらきゅらふく,Men's Dracula Costume
ぷらこんおんなどらきゅらふく,Women's Dracula Costume
じょせいしらなみがらのゆかた,White Wave Yukata (F)
チームゆく年くる年　２０２１,Team New Year 2021
ぷらこんじょせいあかふりそで,Red Women's Kimono
わかむしゃのかっちゅうせっと,Young Warrior Armor Set
あすふぇるどがくえんふゆふく,Asfeld Academy Winter Wear
ヴァレリアの仮面（割れる前）,Valeria's Unbroken Mask
ぷらこんじょせいみこふくあか,Red Priestess Dress
ぷらこんじょせいようきあろは,Yellow Women's Aloha
ぷらこんじょせいみこふくあお,Blue Priestess Dress
チームゆく年くる年　２０２２,Team New Year 2022
ぷらこんきゅーぴっどむらさき,Purple Cupid
チームゆく年くる年　２０１８,Team New Year 2018
ぷらこんじょせいしろふりそで,White Women's Kimono
あすふぇるどがくえんなつふく,Asfeld Academy Summer Wear
チームゆく年くる年　２０２０,Team New Year 2020
魔人エンラージャ＆ムッチーノ,Genie Enraja & Muccino
ラダ・ガートたちに連絡を取る,Contact Lada Gart's Group
チームゆく年くる年　２０２４,Team Twenty Twenty Four
ぷらこんしゃわーよういしょう,Shower Outfit
ぷらこんおとこぱんぷきんふく,Men's Pumpkin Clothes
ぷらこんだんせいようあかろは,Red Men's Aloha
モンセロ温泉峡-ご神体の間 前,Moncello Spring Gorge - Hall of Worship
コニウェア平原-三門の関所 前,Coniware Plain - Three Way Gate
デフェル荒野-ピラミッド 入口,Defel Desert - Pyramid Entry
モンセロ温泉峡-北のやぐら 前,Moncello Spring Gorge - North Scaffold
モンセロ温泉峡-南のやぐら 前,Moncello Spring Gorge - South Scaffold
ロヴォス高地-教会シスター 前,Rovos Highlands - Church Sister
ジャイラ密林-大樹の根元 入口,Jyra Jungle - Big Tree Root Entry
グランゼドーラ領-見張り塔 前,Gran Zedora Territory - Watchtower Front
デフェル荒野-教会シスター 前,Defel Desert - Church Sister
モンセロ温泉峡-管理人小屋 前,Moncello Spring Gorge - Caretaker's Hut
リンジャハル海岸-高台の遺跡,Linjahar Coast - Hilltop Ruins
追憶の世界-キラキラ大風車塔,World Of Remembrance-Windmill Tower
セレドット山道-滝見の吊り橋,Celedot Mountain Pass - Fallsview Bridge
炎・土・闇の攻撃ダメージ +5%,Fire/Earth/Dark Damage +5%
古グランゼドーラ領への出口,Exit to Old Gran Zedora Territory
だるめしあんぼーいいしょう,Dalmatian Outfit (M)
イア・タア　シンパッ・ケウ,E-yis, aneu dish cubrey
フラワーガーデン地区への道,Road to Flower Garden District
アルムゴーグ＆ロムドゴーグ,Armogog & Romdogog
はなかりゅうどのころもあか,Red Flower Hunter Outfit
ぷらこんいけてるみずぎあお,Blue Cool Swimsuit
ドルボ用マネキンドワーフ用,For Dwarf Mannequin For Dolboard
未来への扉とまどろみの少女,The Door to the Future & the Slumbering Girl
アスフェルド学園男性用水着,Asfeld Swimwear (M)
魔物商人＆商品ナンバー１３,Monster Merchant & Item Number 13
アスフェルド学園男性用夏服,Asfeld Summer Uniform (M)
ぷらこんえんじぇるふくしろ,White Angel Clothes
男性プラコン服ダークグレー,Dark Gray Clothes (M)
じょせいぷらこんふくえんじ,Red Clothes (F)
ぷらこんいけてるみずぎくろ,Black Cool Swimsuit
からすかぐらのしょうぞくⅠ,Crow Dance Costume Ⅰ
男性プラコン服ミッドナイト,Midnight Clothes (M)
ぷらこんいけてるみずぎあか,Red Cool Swimsuit
ぷらこんえんじぇるふくくろ,Black Angel Clothes
行動時 5%でテンションアップ,Tension On Action 5%
ハディン地下洞くつへの出口,Exit to Hadine Cavern
とうばつたいこうほうきょく,Strike Force Bureau
ぷらこんおしゃれみずぎくろ,Black Snazzy Swimsuit
女性プラコン服ミッドナイト,Midnight Clothes (F)
アスフェルド学園女性用水着,Asfeld Swimwear (F)
１００万ゴールドの入った袋,1 Million Gold Bag
ぷらこんおしゃれみずぎしろ,White Snazzy Swimsuit
ぼうえいぐんのせいふくこん,Blue Defense Force Suit
『おうちでついてクン設定』,"House Pet Settings"
ぼうえいぐんのせいふくあか,Red Defense Force Suit
だんせいぷらこんふくぴんく,Pink Clothes (M)
ぷらこんおしゃれみずぎあか,Red Snazzy Swimsuit
ぷらこんおしゃれみずぎあお,Blue Snazzy Swimsuit
ぷらこんえんじぇるふくもも,Pink Angel Clothes
らんぷれんきんれんしゅうぎ,Lamp Alchemy Training Wear
じょせいぷらこんふくぴんく,Pink Clothes (F)
清き風吹き　草木は芽吹く～,Pure winds blown and trees grown, budding green as the breeze is thrown
からすかぐらのしょうぞくⅡ,Crow Dance Costume Ⅱ
ドルボ用マネキンウェディ用,For Weddie Mannequin For Dolboard
特技のダメージ +15(試合無効),Skill Damage +15 (PvP×)
はなかりうどのころもみどり,Green Flower Hunter Outfit
ぷらこんぱてぃしえふくしろ,White Pastry Chef Suit
アスフェルド学園女性用夏服,Asfeld Summer Uniform (F)
女性プラコン服アイスブルー,Ice Blue Clothes (F)
未開のジャングル地区への道,Road to Savage Jungle
ぷらこんだんせいはかましろ,White Men's Hakama
ぷらこんおしゃれみずぎもも,Pink Snazzy Swimsuit
だんせいぷらこんふくえんじ,Red Clothes (M)
ランドン山脈山頂付近への道,Road to Landon Mountains Summit
ぷらこんだんせいはかまあお,Blue Men's Hakama
ムストの町・教会跡への出口,Exit to Morst - Church Ruins
ぼうえいぐんのせいふくきん,Gold Defense Force Suit
行動時 3%でテンションアップ,Tension On Action 3%
ぷらこんえんじぇるふくあお,Blue Angel Clothes
特技のダメージ +10(試合無効),Skill Damage +10 (PvP×)
古レビュール街道北への出口,Exit to Old Reviewle Highway North
ドルボ用マネキンニンゲン用,For Human Mannequin For Dolboard
ドラゴンクエストＸショップ,Dragon Quest X Shop
ぷらこんだんせいはかまくろ,Black Men's Hakama
ぷらこんえんじぇるふくあか,Red Angel Clothes
男性プラコン服ミストグレー,Mist Gray Clothes (M)
だるめしあんがーるいしょう,Dalmatian Outfit (F)
未完のドラクロン山地への道,Road to Undone Draklon Mountains
スターキメラから取った羽根,Cosmic Chimaera Feather
特技のダメージ +20(試合無効),Skill Damage +20 (PvP×)
イルーシャのスケッチブック,Irusha's Sketchbook
ルクスガルン大空洞への亀裂,Crevice to Luxgarn Caverns
ぷらこんいけてるみずぎしろ,White Cool Swimsuit
ドルボ用マネキンプクリポ用,For Pukulipo Mannequin For Dolboard
未完のモンセロ温泉峡への道,Road to Undone Moncello Spring Gorge
ぷらこんぱてぃしえふくもも,Pink Pastry Chef Suit
はなかりゅうどのころもあお,Blue Flower Hunter Outfit
戦闘中常時マホトラのころも,Magic Cloak Always Active
ぷらこんぱてぃしえふくあお,Blue Pastry Chef Suit
ぷらこんだんせいはかまこん,Navy Blue Men's Hakama
攻撃時 5%でチャージ時間-10秒,Charge Time -10s On Attack 5%
ムストの町・風車へのはしご,Morst - Ladder to the Windmill
壊れたハイハイジャンプさん,Broken Mr. High High Jump
ぷらこんいけてるみずぎもも,Pink Cool Swimsuit
砂の都ファラザードへの出口,Exit to Farazard
ぷらこんぱてぃしえふくあか,Red Pastry Chef Suit
『ついてクンをひっこめる』,"Remove Pet"
　(フォース無効・試合無効),　(Fource×/PvP×)
ワルド水源-湖上の休息所 前,Wald Headwaters - Lake Retreat
必殺チャージ時 身かわし+10%,Dodge +10% On Special Charge
5000年の旅路 遥かなる故郷へ,5000 Year Journey to a Faraway Hometown
受けるダメージを10軽減する,Damage Taken -10
ロヴォス高地-ゼドラ洞 入口,Rovos Highlands - Zedra Cave Entry
ゼクレス城・魔導広場 出口,Zechres Castle - Magic Square Exit
からすかぐらのしょうぞく2,Crow Dance Costume Ⅱ
受けるダメージを5軽減する,Damage Taken -5
シガール町長の執務室 入口,Mayor Sigal's Office Entry
デス・ジャンクション 入口,Death Junction Entry
モリナラ地下洞・深淵 入口,Molinara Underground Abyss Entry
宇宙船・立入禁止区画 入口,Spacecraft - Restricted Area Entry
プログラマー検証ステージ4,Programmer Verification Stage 4
エピステーサ底なし穴 出口,Epistesa Bottomless Pit Exit
レビュール街道北-谷合の森,Reviewle Highway North - Veil of the Vale
ビンゴすごろくホール 入口,Bingo & Sugoroku Hall Entry
古グランゼドーラ王国 入口,Old Gran Zedora Kingdom Entry
プログラマー検証ステージ3,Programmer Verification Stage 3
味方死亡時 20%でバイシオン,Oomph If Ally Dies 20%
プログラマー検証ステージ6,Programmer Verification Stage 6
オルセコ闘技城・舞台 出口,Orseco Combat Castle - Stage Exit
プログラマー検証ステージ1,Programmer Verification Stage 1
プログラマー検証ステージ5,Programmer Verification Stage 5
プログラマー検証ステージ2,Programmer Verification Stage 2
湖の小島・神のまなこ 入口,Lake Islet - The All-seeing Eye Entry
とこしえの神殿楯の間 入口,Temple of Eternity Shield Room Entry
スイーツゾーン控え室 入口,Sweets Zone Waiting Room Entry
ゼクレス城・魔導広場 入口,Zechres Castle - Magic Square Entry
ビンゴすごろくホール 出口,Bingo & Sugoroku Hall Exit
リンジャハル海岸-海岸遺跡,Linjahar Coast - Coast Ruins
スライムレースホール 入口,Slime Race Hall Entry
アストルティア博物館 入口,Astoltia Museum Entry
オルセコ闘技城・舞台 入口,Orseco Combat Castle - Stage Entry
からすかぐらのしょうぞく1,Crow Dance Costume Ⅰ
エピステーサ底なし穴 入口,Epistesa Bottomless Pit Entry
プログラマー検証ステージ8,Programmer Verification Stage 8
ビタースイーツゾーン 出口,Bittersweets Zone Exit
宇宙船・立入禁止区画 出口,Spacecraft - Restricted Area Exit
デス・ジャンクション 出口,Death Junction Exit
ランプ錬金ギルド 地下１階,Lamp Alchemy Guild B1F
開戦時 10%でヘヴィチャージ,Starting Heavy Charge 10%
モリナラ地下洞・深淵 出口,Molinara Underground Abyss Exit
カルデア山道のアジト 出口,Chaldea Mountain Road Hideout Exit
アストルティア博物館 出口,Astoltia Museum Exit
カルデア山道のアジト 入口,Chaldea Mountain Road Hideout Entry
湖の小島・神のまなこ 出口,Lake Islet - The All-seeing Eye Exit
スイーツゾーン控え室 出口,Sweets Zone Waiting Room Exit
とこしえの神殿楯の間 出口,Temple of Eternity Shield Room Exit
スライムレースホール 出口,Slime Race Hall Exit
ゆうびんきょくいんしーら,Postman Shira
パラディンチェインセット,Paladin Mail Set
プラコンスクール制服男黒,Black School Uniform (M)
その翼は未来へと羽ばたく,Wings Soar to the Future
ぷらこんおとこおばけふく,Men's Ghost Costume
だんせいぷらこんふくしろ,White Clothes (M)
ステージジャンパーセット,Stage Jumper Set
あこがれの称号さ見てえ！,I Always Wanted This Title
カンフージャケットセット,Kung Fu Jacket Set
悪夢のヤドリギ広場　入口,Mistletoe Plaza of Nightmares Entry
グランゼドーラ領への出口,Exit to Gran Zedora Territory
みいらおとこのいしょう２,Mummy Boy Costume 2
転生フィーバーおまじない,Rarified Fever Charm
敵を倒すと 5%でバイシオン,Oomph On Enemy Defeat 5%
モヒカント＆バッファロン,Mohawker & Buffalogre
来たれ　おしゃれマスター,Come, Master of Fashion
はるかぜちあーずいしょう,Spring Cheer Outfit
ウルタ専用反重力飛行装置,Ulta's Anti-Gravity Flight Device
プラコンスクール制服男紺,Blue School Uniform (M)
ウワサのどうぐかばん工房,Rumored Item Bag Workshop
悪夢のヤドリギ広場　出口,Mistletoe Plaza of Nightmares Exit
古レビュール街道南への道,Road to Old Reviewle Highway South
だいなーすかーといしょう,Diner Skirt Outfit
ティプローネ高地への出口,Exit to Tiplone Highlands
せんれきに　登録された！,was registered in your Records!
オーフィーヌ海底への出口,Exit to Orfine Seabed
中断して天星郷に帰還する,Suspend and Return to the Firmament
ママと私の魔法仕立て術！,Mom and Me Magic Tailoring
ダークポイックリンのハネ,Dark Poiclin Wing
そるしえーるのふくせっと,Sorciere's Outfit
始めよう！バラ色冒険生活,Begin! Rosy Adventure
４色ポップコーンを作れ！,Make Four-Color Popcorn!
モダンバニーフレアセット,Modern Bunny Skirt Set
はーとぼーいへいたいふく,Heart Soldier Uniform (M)
デカイ仕事受けるっしょ？,You'll Get a Big Job?
ロード・オブ・どうぐ使い,Lord of Item Master
オルフェア地方東への出口,Exit to Orphea Region East
マスター・ユービアの試練,Master Yubia's Trials
おごそかな林道地区への道,Road to Solemn Forest Road
魔兵ヒプノス＆魔兵タナト,Hypnos & Thanatos
ナイトたちの血戦２０１９,Knights Bloody Battle 2019
