スマートな水着・桃,Pink Smart Swimsuit
賢者のころもセット,Sage Outfit
お菓子の国のライト,Candy Country Light
雑貨屋さんの屋根茶,Brown Shop Roof
地獄のトリコロール,Tricolor of Terror
スノースターセット,Snowstar Outfit
オブジェクト座標156,Object Coordinates 156
リリオルへの贈り物,Gift to Lyriol
しぐさ書・ネオン赤,Neon Red
歌詠みのヘアバンド,Poet's Hairband
エルフのパーティ机,Elf Party Table
オブジェクト座標082,Object Coordinates 082
呪術師ゴルガーレン,Shaman Golgaren
ピンクダマスクの柱,Pink Damask Pillar
ゲフェンダイトの袋,Gefendite Sack
ともしびこぞう提灯,Wickerman Paper Lantern
クールスターハット,Cool Star Hat
ベビタン竜族人形女,Imp Nadravian Doll (F)
ジア・ルミナのコア,Dia Lumina Core
オブジェクト座標163,Object Coordinates 163
色飾りタイルのイス,Color Tile Chair
ユシュカのこころ６,Yushka's Heart Lv6
スイカさまの像・庭,Mr.Watermelon Statue(G)
ブレイブギフト・白,White Brave Gift
月明かりの谷への道,Road to Moonlit Valley
王宮のオーブン・青,Blue Royal Oven
オブジェクト座標258,Object Coordinates 258
オブジェクト座標108,Object Coordinates 108
通常ドロップ率1.1倍,Normal Drop Rate 1.1x
ハートのベッド・黄,Yellow Heart Bed
りょうりにんぼーら,Chef Bora
泡雪のコートセット,Light Snow Outfit
桃果のフランベリー,Pink Flanberry
だいまどうローブ上,Great Mage Upper Robe
ステーション機関室,Station Engine Room
紫水晶のテーブル大,Amethyst Table L
三毛猫スーツのヒゲ,Calico Cat Whiskers
ジングルジャケット,Jingle Jacket
ウサギ魔物のブーツ,Rabbit Monster Boots
お姫様の食器棚・橙,Princess Cupboard
動くモンスター印章,Animated Monster Stamps
美少女怪盗のポーズ,Phantom Thief Pose
ザグバン丘陵への道,Road to Zagban Hills
モダンローズビジュ,Modern Rose Bijou
キングスライムの像,King Slime Statue
ニニエルザドレス下,Ninierza Bottom Dress
シスター・デリアン,Sister Derian
エルドナ神のぞうり,Eldona's Sandals
オブジェクト座標063,Object Coordinates 063
古物研究家エンチェ,Antiquarian Anch
踊り神ボニータ右羽,Dance God Bonita Right Wing
愛と信頼の預かり所,Love and Trust Depository
マイタウン水没地区,My Town Submerged District
警備魔神兵０４６号,Aztech Guard No. 046
カボチャのキッチン,Pumpkin Kitchen
小型の四角い水そう,Square Aquarium S
オブジェクト座標028,Object Coordinates 028
オーガキングの盾扉,Testudogre Shield Door
竜と生きるは竜術士,A Dragomancer's Life
苺お菓子の間仕切り,Berry Sweet Partition
蒼穹兵団のグリーブ,Azure Corps Greaves
リボンスターアクセ,Star Ribbon Accessory
道に迷いました……,I got lost...
マスターの悩みの種,Master's Source of Worry
スライダークカード,Nemeslime Card
オブジェクト座標111,Object Coordinates 111
魔物管理人ヒュリー,Monster Manager Huri
紅蓮のフランベリー,Bright Red Flanberry
シルエット・ナイト,Silhouette Knight
しぐさ書・うなずく,Nod
シルエット・五種族,Silhouette 5 Tribes
ビクトリーチップ祭,Festival Victory Chip
しぐさ書・たけのこ,Bamboo Shoot Trick
マスター・ヴェキオ,Guildmaster Vecchio
ドベルニッチの写真,Dobernitch Photo
英雄の真実を追って,Chasing the Hero's Truth
ゴールデンゴーレム,Balhib
スコアアタック銅赤,Score Attack Bronze
マジックルーレット,Magic Roulette
しぐさ書・決め右前,Decisive Pose R. Front
自由人の集落への道,Road to Freedom Village
結界の守護者カード,Barrier Guardians Card
ピクニックリベリオ,Purrgatroyd Picnic
忍びのマフラー・黄,Yellow Ninja Scarf
白夜に消えた運転士,Vanish in the Midnight Sun
せいどうのよろい上,Bronze Armor Top
カーニバルコーデⅠ,Carnival Outfit Ⅰ
大きなお花のベッド,Large Flower Bed
ドミネウス邸への道,Road to Domineus Mansion
踊魔の霊符・花嫁紫,Iris Dancer Talisman
ガナドールスーツ下,Victor Pants
Ｖロンのタンス・赤,Red Vron Wardrobe
ウサぐるみグローブ,Rabbit Gloves
第１３回ポルテ像庭,13th Porte Statue (G)
グレイツェルチェア,Gretzel Chair
メタスラッＴシャツ,Metal Slime T-Shirt 2
コマンダーグローブ,Commander Gloves
どうぐ使いのブーツ,Item Master Boots
フェザースティック,Winged Wand
きらめく星の贈り物,Twinkling Star's Gift
ソノラのダークネス,Sonora's Darkness
バラレースふりそで,Rose Lace Furisode
ニブルヘイム・サガ,Nibelheim Saga
きのこのスティック,Shroom Stick
導きの風に技閃きて,Flash in the Guiding Wind
労働魔神機０３４号,Aztech Labor Mech No. 034
ジョイフルショコラ,Joyful Chocolate
ポンポンベタ・青赤,Red Pom Pom Betta
ザオ系射程距離 +0.5m,Zin-type Range +0.5m
プクリポテーブル小,Pukulipo Table S
ゼブラパーカー水着,Zebra Hoodie Swimsuit
おうち用水辺のラグ,Waterside Rug
オブジェクト座標265,Object Coordinates 265
氷魔王の大矛・ヤリ,Ice Demon King Spear
ゴールデンライト緑,Golden Light (Green)
おおきなリボン黒桃,Black/Pink Ribbon L
花咲ける木工職人道,The Woodworker's Way
マスカレイドスーツ,Masquerade Suit
妖精図書館のはしご,Fairy Library Ladder
守護天使のガーベラ,Guardian Angel's Gerbera
キングリザード・強,Vicious Liege Lizard
ハロウィン衣装券Ⅴ,Halloween Voucher Ⅴ
オブジェクト座標172,Object Coordinates 172
ウィザード鏡台・黒,Black Wizard Vanity
キューブライト・庭,Cube Light (G)
ネタ「おたから袋」,Treasure Bag Trick
オブジェクト座標148,Object Coordinates 148
しぐさ書・まぶしい,Dazzling
おばけキャンドル強,Vicious Wax Murderer
聖湖ゼニートの壁泉,Zenit Wall Fountain
ホイミンぬいぐるみ,Healie Plushie
オブジェクト座標215,Object Coordinates 215
ベジタブル家具の本,Veggie Furniture Book
ギンガムマフラー赤,Red Gingham Scarf
ビクトリーチップ海,Sea Victory Chip
プチゴレオンカード,Frail Goreham Card
グランゼニスの王冠,Gran Zenith's Crown
しぐさ書・バトエン,Battle Pencil
ウサぐるみのぼうし,Rabbit Hat
攻撃時10%暴走アップ,Haywire Up On Attack 10%
行動時10%聖なる祈り,Care Prayer On Action 10%
シスター・ディモス,Sister Deimos
プリズニャン観覧車,Jailcat Ferris Wheel
パラディチェイン２,Paladin Chain Mail 2
アマラーク城への道,Road to Amarak Castle
ソルシエールハット,Sorciere's Hat
自由人の集落のイス,Freedom Village Chair
サプライズラッシュ,Bolt from the Blue
ヴァルディスタ兵１,Valdista Soldier 1
マイタウン古代地区,My Town Ancient District
シングルアンテナＡ,Single Antenna A
カラフルスラ花火台,Slime Fireworks Stand
ホワイトキャンドル,White Chocolate Candle
トライバルグローブ,Tribal Gloves
飛竜のベストセット,Flying Dragon Outfit
オブジェクト座標032,Object Coordinates 032
マジェスタスーツ下,Majesta Pants
バレンタインアーチ,Valentine's Arch
やるきのジャーミィ,Jacked Jammy
ウィリーデアックス,Vilide Axe
トーマ青年の剣鞘無,Sword Unsheathed Toma
住宅素材屋ピノッピ,Housing Materials Pinoppi
ブートキャンパーズ,The Boot Campers
ビクトリーチップ冥,Hades Victory Chip
オブジェクト座標056,Object Coordinates 056
怨霊の憑いた戦士Ｃ,Warrior With a Grudge C
炎うず巻く聖なる鳥,Fiery Holy Bird
プラコンシェルジュ,Private Concierge
鍛冶素材屋フウザム,Smithing Materials Fuzam
ロッキンマートの塀,Rockin' Mart Fence
オブジェクト座標055,Object Coordinates 055
カボチャカウンタ大,Pumpkin Counter L
四葉のクローバー傘,Lucky Clover Umbrella
マスター・バレクス,Guildmaster Barex
ルミナスギフト・青,Blue Luminous Gift
背離する魔幻の血統,Separation Phantom Family
ドワーフテーブル小,Dwarf Table S
足音切り替え検証庭,Footstep Switching
ヤドリギ広場　出口,Mistletoe Plaza Exit
正月ボーイカプセル,New Year Boy Toy
魔物管理人セモーナ,Monster Manager Semona
冒険ゼミ会員ベスノ,Adventurer Seminar Member Sheeno
お花畑に行きたい！,Go to the Flower Field!
灰マスク猫カプセル,Ash Mask Cat Toy
バイコーンプリズム,Bicorn Prism
果てなき夢の芸人道,Dream of Entertaining
メディカルデバイス,Medical Device
シュタール鉱野の木,Stahl Minefield Tree
スマイリー・キラー,Smiley Killer
オブジェクト座標093,Object Coordinates 093
しゃしょうぽろっく,Conductor Pollock
しぐさ書・タロット,Tarot
オブジェクト座標105,Object Coordinates 105
オブジェクト座標282,Object Coordinates 282
ヘイズバットの分身,Avatar of Haze Bat
伝説の三悪魔練習札,Legendary Evils Tag
メレアーデキッチン,Mereade Kitchen
スノーベルプリズム,Snow Bell Prism
ボルテージアックス,Voltage Axe
ウルベア魔神兵の像,Urbea Aztech Statue
しましまマフラー青,Blue Striped Scarf
ユシュカのこころ２,Yushka's Heart Lv2
レンガのお屋敷の柱,Brick House Pillar
ゼクレス城・宝物庫,Zechres Castle - Treasury
ピクシーチュニック,Pixie Tunic
ギュッとリゼロッタ,Lieselotte Arm Doll
メレアーデパンプス,Mereade Heels
オブジェクト座標014,Object Coordinates 014
大富豪協会員プゴル,Tycoon Club Member Pugol
バトエンコロシアム,Batoen Coliseum
Ｎ高女子のブレザー,N High Girl's Blazer
凶拳は天を超えるか,Evil Fist Crosses Heaven
しぐさ書・ひやかす,Tease
おいしく焼きしめて,Deliciously Roasted
超合金キラーマシン,Killing Machine Toy
クーちゃんふうせん,Ku Balloon
あそび商人ニャポー,Play Merchant Meowpaw
プリズニャン招き猫,Jailcat Figurine
猛将ギーグハンマー,Tyrant Clubber
王家の迷宮の滝・庭,Royal Maze Waterfall(G)
ネオンフラッシュ青,Neon Flash (Blue)
ディープギアマスク,Deep Gear Mask
預かり所バルバトゥ,Storage Barbatou
オブジェクト座標040,Object Coordinates 040
怨霊の憑いた戦士Ａ,Warrior With a Grudge A
ダーマ神官ネイシャ,Abbey Priest Neisha
行動時10%バイシオン,Oomph On Action 10%
夏の渚のショーパン,Summer Beach Shorts
預かり所・よろず屋,Depository/General Shop
学園女子のジャージ,Schoolgirl Jersey
匠のチャーハン・小,Small Fried Rice
バトエン屋コロペン,Batoen Shop Coropen
代理人ルーニアの像,Agent Runia Statue
妖精図書館のチェア,Fairy Library Chair
紅爆の暴奏将モグド,Blast General Burrows
オブジェクト座標173,Object Coordinates 173
感謝を求める者たち,Those Who Seek Gratitude
うんてんしちっちぇ,Driver Chiche
ボンボンヘアバンド,Pompom Hairband
ほこらの祭祀場・炎,Flame Shrine Ritual Ground
カフェラテスズラン,Latte Lily
アンノウンバスター,Unknown Buster
輝けるつるぎの伝説,Shining Sword Legend
ぬいぐるみを買いに,To Buy a Plushie
初級・呪文錬金の本,Beginner Spell
ナウマンコックの像,Naumanncook Statue
アマラーク城の噴水,Amarak Castle Fountain
セラフィぬいぐるみ,Seraphi Plushie
さいほう職人の看板,Sewing Sign
スイカのタライ・金,Gold Watermelon Basin
第９回ユシュカの像,9th Yushka Statue
第１１回パドレ像庭,11th Padre Statue (G)
千鳥格子のふりそで,Houndstooth Furisode
カジノ祭５ビンゴ銅,CasinoFest 5 Bingo Brnz
コンシェルジュ０７,Concierge 07
ドルタムのこころ５,Doltam's Heart Lv5
第３回セラフィの像,3rd Seraphi Statue
オブジェクト座標054,Object Coordinates 054
パーティーの招待状,Party Invitation
どうぐ射程距離延長,Item Range Boost
名もなき草原への道,Road to Nameless Field
オブジェクト座標166,Object Coordinates 166
万魔の塔・一の災壇,Banma Tower - 1st Platform
スライダークスーツ,Nemeslime Suit
ハロウィン衣装券Ⅶ,Halloween Voucher Ⅶ
黒い影の正体の写真,Shadow's True Form Photo
アローンギフト・黒,Black Alone Gift
ピクニックダストン,Duston Picnic
リシアの新作アクセ,Lycia's New Accessory
討伐隊員ライヴァス,Strike Force Laivas
クロッシュウェア下,Bell Leggings
三姉妹人形・庭用橙,Orange 3 Sis. Doll (G)
オブジェクト座標079,Object Coordinates 079
千里の名馬プリズム,1000 Mile Horse Prism
シスター・ニルーナ,Sister Nirna
（ラッキーフロア）, (Lucky Floor)
ムーンバニーブレス,Moon Bunny Bracelets
ダンディタキシード,Dandy Tuxedo
カレヴァン捜索願い,Kalevan Search Request
はじゃのよろいどう,Bronze Champ Armor
ウェディの人形・男,Weddie Doll (M)
スライムレース印章,Slime Race Stamps
バナナのソファ・青,Green Banana Sofa
ミステリドールの書,Pocus Poppet Book
ウェディングうさぎ,Wedding Rabbit
ゴージャスティアラ,Gorgeous Tiara
おとぎの森カチーフ,Fairy Forest Kerchief
新七不思議コン・銀,Seven Wonders Silver
タンブラークロッグ,Tumbler Shoes
ダークファンタズマ,Shadeshifter
夢の秘密工場の木柵,Dream Factory Wood Fence
ほわいとたきしーど,White Tuxedo
ハンマー屋トカチャ,Hammer Shop Tokacha
リボンヘッドドレス,Ribbon Headdress
クモの巣カーペット,Spider Web Carpet
マキュリのキッチン,Makyuri Kitchen
あくま神官の像・庭,Wrecktor Statue (G)
きりさきピエロ・強,Vicious Prickly Prankster
ドラグーングリーブ,Dragoon Greaves
おもちゃの草原・雪,Toy Grass Field (Snow)
ミューズ海岸への道,Road to Muse Coast
みちびきのプチ香水,Guidance Perfume S
プラチナ錬金ツボ小,Platinum Jar S
ムニエカの町への道,Road to Munieka
エレガントに猛毒を,Elegantly Venomous
ニニエルザグローブ,Ninierza Gloves
キィンベルのぼうし,Kimbel Hat
マイタウン採掘地区,My Town Mining District
ブライダルグローブ,Bridal Gloves
王宮のバスタブ・赤,Red Royal Bathtub
ダンディサングラス,Aviator Sunglasses
つみきでハッピー！,Happy with Blocks!
パピヨンポスト・幻,Phantom Papillon Mailbox
？？？？からの小包,Parcel from ????
デビルアーマー・強,Vicious Harmour
よろず屋ドロッジェ,General Shop Drogger
ユーライザの便せん,Yuliza Paper
カブリオレプリズム,Cabriolet Prism
古グランゼドーラ城,Old Gran Zedora Castle
スライムトレイ物語,Slime Shield Story
ブルラトスの発着場,Buratos' Landing
プラコン用のカップ,Private Concierge Cup
スライム強スリッパ,Vicious Slime Slippers
メス三毛猫スーツⅠ,Calico Cat Suit (F) Ⅰ
オブジェクト座標238,Object Coordinates 238
大地の大竜玉の破片,Earthwyrm's Jewel Shard
レーナム緑野の木柵,Lenam Fields Wood Fence
男性白波柄のゆかた,White Wave Yukata (M)
魔物管理人スーディ,Monster Manager Sudy
ジュリアンテのムチ,Juliante's Whip
アンノウンアックス,Unknown Axe
おばけのいしょう２,Ghost Costume 2
プラコンドレス・赤,Red Dress
みならいあくま・祖,Ancestral Winkster
ハロウィン衣装券Ⅲ,Halloween Voucher Ⅲ
ホワイトパンプキン,White Pumpkin
オブジェクト座標191,Object Coordinates 191
ミニポニテエクステ,Mini Ponytail Extension
アイスゴーレムたち,Glacial Golem and co.
モチつき「つき手」,Pound Mochi "Pounder"
リンカサークレット,Linka's Circlet
サニーアンクレット,Sunny Anklet
オトシゴスティック,Seahorse Stick
ナルビア民家のラグ,Nalbia House Rug
アスバルぬいぐるみ,Asbal Plushie
おもちゃのトンネル,Toy Tunnel
ウォータースライダ,Waterslider
マダムの店のソファ,Madame's Shop Sofa
ライトニングダガー,Thunderstorm Skean
第１２回パドレ像庭,12th Padre Statue (G)
光のフライパンの本,Light Frypan Book
ハクオウのこころ６,Hakuo's Heart Lv6
特製やきにくセット,Deluxe Grilled Meat Set
ステージジャンパー,Stage Jumper
Ｖロンのベッド・赤,Red Vron Bed
武爪遊戯・断罪の章,Judgement Katar Book
オブジェクト座標031,Object Coordinates 031
ポルテ制御用・執行,Porte Control
エンタシスマンの書,Prancing Pillar Book
つりしのいしょうⅡ,Angler's Costume Ⅱ
悪霊の神々強カード,Apex Evil Trinity Card
ドワーフのあいさつ,Dwarf Greeting
庭用ネオン・ファン,Neon Fan (G)
アンノウンウィップ,Unknown Whip
アンルシアパラソル,Anlucia Umbrella
はぐれメタル浮き輪,Liquid Metal Floatie
壁かけ忌まわしき絵,Abominable Painting
魔物管理人ティーヤ,Monster Manager Tiya
フューチャーハット,Future Hat
リーフシードラゴン,Leafy Seadragon
天宮騎士のよろい下,Sky Knight Bottom
メレアーデパラソル,Mereade Umbrella
ばくだんいわ便せん,Rockbomb Paper
おもちゃのサーカス,Toy Circus
しぐさ書・決め左前,Decisive Pose L. Front
聖王のつるぎの壁画,Dryspell Sword Book
アンルシアキッチン,Anlucia Kitchen
ほこらの祭祀場・嵐,Storm Shrine Ritual Ground
ディエゴからの試練,Trials From Diego
ＤＱＸショップ印章,DQX Shop Stamps
ドワチャッカの秘宝,Dwachakka's Treasure
シスター・プリミン,Sister Purimin
しぐさ書・恋の魔法,Heart Magic
ベルセルクブレード,Mad Warrior's Blade
しぐさ書・そうめん,Noodles Trick
魔物管理人トゥフラ,Monster Manager Tufura
ゲルニック将軍の杖,Hootingham-Gore's Staff
錬金術は時を超えて,Alchemy Transcends Time
スパングルグローブ,Spangled Gloves
魔物管理人ペコリア,Monster Manager Pekoria
ガールモッズコート,Girl Mod Coat
エステラのこころ７,Estella's Heart Lv7
四葉透かし細工の壁,Four-Leaf Wall
ネビュラスレプリカ,Nebulous Replica
うさみみギフト・白,White Rabbit Ears Gift
予言のサークレット,Circlet of Prophecy
大富豪なりきり宝箱,Tycoon Treasure Chest
旧ネクロデアの石碑,Old Necrodea Monument
まもの使いのくつ２,Monster Master Shoes 2
花束交換屋ププリン,Bouquet Shop Pupurin
パピヨンツリー・夢,Dream Papillon Tree
うんてんしでっかー,Driver Decker
キーたんのブローチ,Keytan Brooch
ポーズ書・キュート,Cute Pose
ブチ猫・双カプセル,Spotted Cat Twin Toy
リボンスターの服上,Star Ribbon Top
ラディカルシールド,Radical Shield
東洋風透かし窓・雅,Chic Orient Window
オス三毛猫スーツⅠ,Calico Cat Suit (M) Ⅰ
スポットライト・庭,Spotlight (G)
こあくまのネイル術,Infernails Technique
スライダーククロー,Nemeslime Claws
偽りのレンダーシア,False Lendersia
竜族人形女のライト,Nadravian Doll Light(F)
帝国の闇サンタたち,The Yuleish Empire
３連発花火・緑赤青,3 Fireworks GRB
第１の試練参加パス,First Trial Entry Pass
住宅素材屋ムントン,Housing Materials Munton
ドラゴンキッズ・強,Vicious Small Fry
魔技師ベストセット,Technomancer Outfit
スライム柄彫刻の柱,Slime Carved Pillar
ライトニングソード,Thunderstorm Sword
スライムタワー２段,Slime Stack Stage 2
オブジェクト座標279,Object Coordinates 279
ライガークラッシュ,Wild Animaul
クールスターセット,Cool Star Outfit
しぐさ書・たてごと,Harp
オブジェクト座標037,Object Coordinates 037
蒼穹兵団のよろい下,Azure Corps Leggings
家具屋・旅人バザー,Indoor Furniture Shop/Traveler's Bazaar
空が紅く染まるとき,When the Sky Turns Red
ハスの花ランプ・緑,Green Lotus Lamp
旅芸人の衣装セット,Minstrel Outfit
荘厳な神殿の便せん,Majestic Abbey Paper
プラネタリウム・緑,Green Planetarium
第１２回ヒューザ像,12th Hyuza Statue
ゼニアス調査録・銀,Silver Zeniath Zoomer
筆頭研究員のブーツ,Top Researcher Boots
ゼレスタイトの大盾,Celestite Greatshield
まもの使いのブレス,Monster Master Bangles
喪心獣ゾンテドール,Mourning Beast Zontedor
スターリーシールド,Starry Shield
メロディアシューズ,Melody Shoes
タリスマンの守護者,Guardian of the Talisman
第１３回ラウル像庭,13th Rahul Statue (G)
冥氷竜ジェロドーラ,Jerodora, Icy Dark Dragon
茶柴モダンカプセル,Hip Brown Shiba Toy
カラス神楽の装束Ⅰ,Crow Dance Costume Ⅰ
強・タロットメダル,Apex Tarot Medal
ちびっこ竜族ポーチ,Nadravian Kids Pouch
セーリアぬいぐるみ,Celia Plushie
うつしよの竜箱・改,Worldly Dragon Box+
オブジェクト座標182,Object Coordinates 182
アシュレイの髪飾り,Ashley's Hairpin
アズ・フーラズーラ,Azu Fluzula
罪深きバラのように,Like a Sinful Rose
アンガーギフト・銀,Silver Angry Gift
銀の錬金ランプの本,Silver Lamp Book
しぐさ書・紅葉隠れ,Hidden in Leaves Trick
ガーディアンの資格,Guardian Qualification
妖精の隠れ家の石壁,Fairy Lair Stone Wall
リボントークハット,Ribbon Toque
しぐさ書・怒り心頭,Furious
オブジェクト座標207,Object Coordinates 207
第８回釣りコン・金,8th Fish Contest Gold
プクリポカウンタ大,Pukulipo Counter L
ドラパンクシューズ,Dracky Punk Shoes
福笑いのラグ・くち,Fukuwarai Mouth Rug
ラベンダースズラン,Lavender Lily
カジノ祭６ビンゴ銀,CasinoFest 6 Bingo Silver
魔瘴魂グウィネーロ,Miasma Soul Gwinero
祈願の神殿の飾り棚,Gratitemple Shelf
ヤシの葉の便利な壁,Palm Leaf Wall
ベビーピンクダリア,Light Pink Dahlia
ピュアスノーリリィ,Pure Snow Lily
星辰武王の最終試練,Star Warrior's Last Trial
プラネタリウム・赤,Red Planetarium
オブジェクト座標217,Object Coordinates 217
しゅうれん用リスト,Training Wristbands
スライムのオーブン,Slime Oven
オブジェクト座標274,Object Coordinates 274
古レビュール街道北,Old Reviewle Highway North
燃えるロマンの宝石,Jewel of Burning Romance
スライムナイトの書,Slime Knight Book
ゴールドマンＸ６号,Gold Golem X 6
オブジェクト座標081,Object Coordinates 081
チャーロンへの荷物,Baggage to Charon
しっこくのターバン,Macabre Turban
オブジェクト座標097,Object Coordinates 097
ゆらゆら牛さん・黄,Yellow Rocking Ox
オブジェクト座標272,Object Coordinates 272
オブジェクト座標140,Object Coordinates 140
タイタス号の望遠鏡,Titus Telescope
パッチ柄ベッド・青,Blue Patch Bed
強・ボーンズメダル,Apex Bones Medal
ドランド平原への道,Road to Drand Plains
星座の導き・かに座,A Crabby Constellation
さまようよろい・強,Vicious Restless Armour
ネロドス・シャドウ,Nerodos' Shadow
サーカスハウスの壁,Circus House Wall
トレジャーコート上,Treasure Coat Top
防衛魔神兵０５１号,Aztech Guard No. 051
ギュッとアンルシア,Anlucia Arm Doll
お姫様のタンス・橙,Princess Wardrobe
シュバリエメイル下,Chevalier Mail Bottom
ピヨちゃんＴシャツ,Chick T-Shirt
グレースギフト・紺,Blue Grace Gift
スピリットフレイム,Spirit Flame
ふわふわふうせん赤,Floating Red Balloon
オブジェクト座標039,Object Coordinates 039
モダンローズドレス,Modern Rose Dress
ユニコーンプリズム,Unicorn Prism
チョコレートのラグ,Chocolate Rug
妖精の女王ドレス上,Fairy Queen Upper Dress
オスクトルローブ上,Oscutor Robe Top
バタフライトップス,Butterfly Top
プラコン用のほうき,Private Concierge Broom
アーイシャの道具箱,Aisha's Toolbox
ふわふわ雲のベッド,Fluffy Cloud Bed
プリマベーラピアス,Primavera Earrings
アマラーク城のラグ,Amarak Castle Rug
エージェントマスク,Agent Mask
キンスラ王冠ランプ,King Slime Crown Lamp
オブジェクト座標058,Object Coordinates 058
ネオンフラッシュ緑,Neon Flash (Green)
さはらこーとせっと,Sahara Outfit
冒険ゼミ会員ベスエ,Adventurer Seminar Member Shea
しろへびのぬけがら,White Snake Husk
バトエンランチャー,Batoen Launcher
キュウサイポイント,Res-Cu Points
イカしたＴシャツ黄,Yellow Cool T-Shirt
デスマシーンカード,Slaughtomaton Card
炎帝のいくさ装束上,Fire God Shirt
マジカル姫ゆかた上,Magical Yukata Top
ハートガール兵隊服,Heart Soldier Uniform (F)
スタンドマイク・庭,Microphone Stand (G)
ハルファスの大紋章,Halphas Sigil
清廉天使のスーツ下,Honest Angel Pants
第１４回マローネ像,14th Marone Statue
未完の風穴の研究室,Undone Windy Cave Lab
ウサギ魔物の装束上,Rabbit Monster Shirt
オブジェクト座標120,Object Coordinates 120
おうち用花畑のラグ,Flower Field Rug
エアボードプリズム,Airboard Prism
テスト剣モデルなし,Test Sword Model Not OK
イグナイトメイル上,Ignite Mail Top
タイタス号の飾り棚,Titus Shelf
カボチャカーペット,Pumpkin Carpet
ランドン山脈への道,Road to Landon Mountains
オブジェクト座標171,Object Coordinates 171
めざましハンドベル,Alarm Clock Bell
赤キノコのテーブル,Red Mushroom Table
白銀獣ロムドゴーグ,Silver Beast Romdogog
