アルファ用アルウェ王妃の別荘跡(子供たちの隠れ家内部Test),Queen Alwe's Villa Ruins for Alpha (Test Inside Children's Hideout)
どらごんくえすとえいとしゅじんこうのいしょう,DQⅧ Hero Costume
バトル班用テストマップ（いにしえのゼルメア）,Team Battle Map Test (Ancient Zelmea)
このマップは モンスターから逃げられません。,You can't run from monsters on this map.
マッチングテストステージ（同期後移動用）,Match test stage (for moving beat testing)
　　　～モンスター討伐隊隊員からの依頼～,         Monster Strike Force Request
マッチングテストステージ（同期テスト用）,Match test stage (for sync testing)
リャナ荒涼地帯-ねじれたる異形の大地 入口,Lyana Desolate - Twisted Terrane Entry
グランゼドーラ領-グランゼドーラ王国 入口,Gran Zedora Territory - Gran Zedora Kingdom Entry
必殺チャージ時 バイキルトとピオラ2段階,Oomphle & Accelerate x2 On Special
メルサンディ穀倉帯-さびれたほこら 入口,Melsandy Millfields - Deserted Shrine Entry
アラハギーロ地方-アラハギーロ王国 入口,Al-Ahagiro Region - Kingdom of Al-Ahagiro Entry
アラハギーロ地方-モンスター格闘場 入口,Al-Ahagiro Region - Monster Arena Entry
メルサンディ穀倉帯-メルサンディ村 入口,Melsandy Millfields - Melsandy Village Entry
メルサンディ穀倉帯-こもれびの広場 入口,Melsandy Millfields - Sunbeam Square Entry
こうげき力上昇時 特技のダメージ +20<ban>,Skill Dmg. +20 When Attack ↑ (PvP×)
季節イベント「オ月見」　コンパニオン,Seasonal Event "Moon View" Companion
季節イベント「お月見」　コンパニオン,Seasonal Event "Moon View" Companion
ぷらこんだんせいようそくたいむらさき,Purple Ceremony Gown
バトル班用テストマップ（ムスト廃墟）,Team Battle Map Test (Musuto Ruins)
アラハギーロ地方-ムルードの岩山 入口,Al-Ahagiro Region - Murudo Mountain Entry
アラハギーロ地方-日除けのほら穴 入口,Al-Ahagiro Region - Sunshade Cave Entry
メルサンディ穀倉帯-メルン水車郷 入口,Melsandy Millfields - Melun Watermill Entry
神代過ぎ～　春の桜よ　無為に咲く～,Past ages divine, the spring blossoms bloom, waiting idly by...
ぷらこんすくーるせいふくおとこしろ,White School Uniform (M)
ぷらこんすくーるせいふくおとこちゃ,Brown School Uniform (M)
ぷらこんすくーるせいふくおんなこん,Blue School Uniform (F)
ぷらこんだんせいようそくたいみどり,Green Ceremony Gown
ぷらこんすくーるせいふくおんなしろ,White School Uniform (F)
しかし　持ち物が　いっぱいだった！,But you're carrying too many things!
ぷらこんすくーるせいふくおとここん,Blue School Uniform (M)
ぷらこんすくーるせいふくおとこくろ,Black School Uniform (M)
ぷらこんすくーるせいふくおとこあか,Red School Uniform (M)
受けた属性ダメージの 10%ＨＰ回復<ban>,10% Attribute Damage Taken As HP (PvP×)
ルファ神殿エントランス（オープン）,Rufa Temple - Entry (Open)
ぷらこんすくーるせいふくおんなあか,Red School Uniform (F)
ぷらこんすくーるせいふくおんなちゃ,Brown School Uniform (F)
ぷらこんすくーるせいふくおんなくろ,Black School Uniform (F)
コニウェア平原-ココラタの浜辺 入口,Coniware Plain - Cocolata Beach Entry
リャナ荒涼地帯-ソーラリア峡谷 入口,Lyana Desolate - Solaria Canyon Entry
アルファ用井戸(ダンダダ団のアジト),Well for Alpha (Robbin' 'Ood Gang HQ)
バトル班用テストマップ(ツスクル）,Team Battle Map Test (Tsuskuru)
ぷらこんじょせいしのびのふくくろ,Black Women's Ninja Suit
あすふぇるどがくえんがくせいふく,Asfeld Academy Uniform
ぷらこんじょせいしのびのふくこん,Navy Women's Ninja Suit
ぷらこんじょせいみこふくむらさき,Purple Priestess Dress
じょせいぷらこんふくあいすぶるー,Ice Blue Clothes (F)
ぷらこんだんせいようみどりさんた,Green Men's Santa Suit
ぷらこんじょせいしのびのふくあか,Red Women's Ninja Suit
ぷらこんだんせいようそくたいあお,Blue Ceremony Gown
ぷらこんじょせいしのびのふくもも,Pink Women's Ninja Suit
足元エフェクト（おしおきアタック,Something Effect
ぷらこんだんせいしのびのふくあお,Blue Men's Ninja Suit
エフェクトイメージさん（１０個）,Mr. Effect Image (10)
ぷらこんだんせいしのびのふくちゃ,Tea Men's Ninja Suit
ぷらこんじょせいむらさきふりそで,Purple Women's Kimono
だんせいぷらこんふくみすとぐれー,Mist Gray Clothes (M)
ぷらこんだんせいしのびのふくこん,Navy Men's Ninja Suit
じょせいぷらこんふくみっどないと,Midnight Clothes (F)
ぷらこんじょせいしのびのふくあお,Blue Women's Ninja Suit
ぷらこんだんせいようそくたいちゃ,Tea Ceremony Gown
だんせいぷらこんふくみっどないと,Midnight Clothes (M)
だんせいぷらこんふくだーくぐれー,Dark Gray Clothes (M)
ぷらこんだんせいしのびのふくくろ,Black Men's Ninja Suit
プンスコのテーブル＆ティーセット,Punsuko's Table & Tea Set
バトル班用テストマップ（獅子門）,Team Battle Map Test (Lion Gate)
ぷらこんだんせいしのびのふくあか,Red Men's Ninja Suit
ぷらこんだんせいようそくたいはい,Ash Ceremony Gown
ぷらこんじょせいようみどりさんた,Green Women's Santa Suit
セレドット山道-ベリルのほら穴 前,Celedot Mountain Pass - Beryl Den
マデ島＆エテーネ王宮（4.5CS専用）,Made Isle & Ethene Royal Manor (4.5CS only)
レビュール街道北-海風の洞くつ 前,Reviewle Highway North - Seabreeze Cave
リンジャハル海岸-教会シスター 前,Linjahar Coast - Church Sister
必殺チャージ時 チャージ時間 -10秒,Charge Time -10 sec. On Special
リンジャハル海岸-リンジャの塔 前,Linjahar Coast - Linja Tower
追憶の世界-アルウェ王妃の別荘跡,World of Remembrance-The Ruins of Queen Alwe
死亡時 50%でこうげき力上昇が残る,Undying Attack Boost 50%
プログラマー用負荷検証ステージ3,Loading Programmer Verification Stage 3
プログラマー用負荷検証ステージ2,Loading Programmer Verification Stage 2
プログラマー用負荷検証ステージ1,Loading Programmer Verification Stage 1
プログラマー用負荷検証ステージ4,Loading Programmer Verification Stage 4
プログラマー用負荷検証ステージ5,Loading Programmer Verification Stage 5
ぷらこんじょせいようあかあろは,Red Women's Aloha
ぷらこんじょせいようももあろは,Pink Women's Aloha
はなかりゅうどのころもむらさき,Purple Flower Hunter Outfit
壊れたアストルティアのコンパス,Broken Astoltia Compass
ハロウィンクイズ解答ウェディ７,Halloween Quiz Answer Weddie 7
ぷらこんじょせいようももさんた,Pink Women's Santa Suit
魔天の勇者＆聖夜の破壊者・雪組,Festive Hero & Holy Night Wrecker Snow Team
ぷらこんこどもようみずぎせっと,Children's Swimsuit
ぷらこんだんせいようももあろは,Pink Men's Aloha
\s\m\eは　コインをなげた。　→　,\s\m\e flips a coin. → The coin lands on !
ぷらこんじょせいようくろさんた,Black Women's Santa Suit
ぷらこんじょせいようしろあろは,White Women's Aloha
扉は　かたく　閉ざされている。,The door is tightly closed.
\s\m\eは　カードを引いた。　→　,\s\m\e draws a card. → They draw the !
ぼうえいぐんのせいふくむらさき,Purple Defense Force Suit
ぷらこんだんせいようあおあろは,Blue Men's Aloha
ハロウィンクイズ解答ウェディ１,Halloween Quiz Answer Weddie 1
ぷらこんじょせいようしろさんた,White Women's Santa Suit
ぷらこんだんせいようくろさんた,Black Men's Santa Suit
ハロウィンクイズ解答ウェディ４,Halloween Quiz Answer Weddie 4
ぷらこんだんせいようしろさんた,White Men's Santa Suit
魔天の勇者＆聖夜の破壊者・闇組,Festive Hero & Holy Night Wrecker Dark Team
\s\m\eは　ダイスをふった。　→　,\s\m\e rolls a die. → !
ハロウィンクイズ解答ウェディ２,Halloween Quiz Answer Weddie 2
ぼうえいぐんのせいふくはいいろ,Gray Defense Force Suit
ぷらこんじょせいみこふくみどり,Green Priestess Dress
ぷらこんじょせいようあかさんた,Red Women's Santa Suit
30%の確率で受けたダメージ10%反射,30% Chance to Reflect 10% Damage
じょせいぷらこんふくさんせっと,Sunset Clothes (F)
豪魔将ベリンダ＆豪魔将ブレンダ,Generals Belinda & Brenda
ぷらこんじょせいようあおあろは,Blue Women's Aloha
ハロウィンクイズ解答ウェディ６,Halloween Quiz Answer Weddie 6
ぷらこんだんせいようももさんた,Pink Men's Santa Suit
ハロウィンクイズ解答ウェディ３,Halloween Quiz Answer Weddie 3
ハロウィンクイズ解答ウェディ５,Halloween Quiz Answer Weddie 5
ぷらこんだんせいはかまむらさき,Purple Men's Hakama
ゴリウスの怨霊＆魔道士キルギル,Gorius' Vengeance & Wizard Kirgyl
ぷらこんだんせいようしろあろは,White Men's Aloha
えるどなしんのしょうぞくせっと,Eldona's Outfit
ぷらこんだんせいようあかさんた,Red Men's Santa Suit
モンセロ温泉峡-中央のやぐら 前,Moncello Spring Gorge - Central Scaffold
両手剣の単体特技のダメージ +500,Single Target Greatsword Skills +500
リャナ荒涼地帯-くずれた灯台 前,Lyana Desolate - Collapsed Lighthouse
レビュール街道南-三門の関所 前,Reviewle Highway South - Three Way Gate
ジャイラ密林-クドゥスの泉 入口,Jyra Jungle - Kudus Spring Entry
セレドット山道-セレドの町 入口,Celedot Mountain Pass - Town of Celed Entry
コニウェア平原-教会シスター 前,Coniware Plain - Church Sister
リャナ荒涼地帯-滝を臨む集落 前,Lyana Desolate - Waterfall Village
ドラクロン山地-竜守りの小屋 前,Draklon Mountains - Dragon Guard's Hut
デフェル荒野-不思議の魔塔 入口,Defel Desert - Mysterious Tower Entry
ムニエカの深層・隠し通路 入口,Munieka Depths - Secret Passage Entry
テンション時のダメージ +100<ban>,Damage During Tension +100 (PvP×)
アルファ用追憶の世界 別荘跡編,World of Recollection for Alpha Villa Ruins
会心と暴走時のダメージ +100<ban>,Critical/Haywire Damage +100 (PvP×)
戦いで 魔物に狙われにくくなる,Less likely to be targeted in battle
こうげき魔力とかいふく魔力 +10,Magical Might/Mending +10
フォークに刺さったパンケーキ,Pancakes Stuck in a Fork
チームゆく年くる年　２０２０,Team New Year 2020
チームゆく年くる年　２０１７,Team New Year 2017
ぼうえいぐんのせいふくみどり,Green Defense Force Suit
ぷらこんすいーとふくだいだい,Orange Sweet Clothes
チームゆく年くる年　２０１９,Team New Year 2019
ぷらこんしゃわーよういしょう,Shower Outfit
行動時 5%でバイシオンとスカラ,Oomph & Buff On Action 5%
チームゆく年くる年　２０２４,Team Twenty Twenty Four
ぷらこんじょせいくろふりそで,Black Women's Kimono
ハロウィンクイズ解答エルフ３,Halloween Quiz Answer Elf 3
闇に唄う氷にまぎれし聖なる者,Frozen Sacred Singer
巨人コアを守るジア・クトたち,Defenders of the Core
攻撃時10%で会心と暴走率アップ,Critical/Haywire Boost Attack 10%
チームゆく年くる年　２０２６,Team Twenty Twenty Six
ぷらこんおとこぱんぷきんふく,Men's Pumpkin Clothes
ぷらこんじょせいももふりそで,Pink Women's Kimono
チームゆく年くる年　２０２３,Team New Year 2023
あすふぇるどがくえんふゆふく,Asfeld Academy Winter Wear
あすふぇるどがくえんなつふく,Asfeld Academy Summer Wear
ハロウィンクイズ解答エルフ６,Halloween Quiz Answer Elf 6
ハロウィンクイズ解答エルフ１,Halloween Quiz Answer Elf 1
ぷらこんじょせいあかふりそで,Red Women's Kimono
ぷらこんじょせいみこふくあお,Blue Priestess Dress
魔天の勇者＆キラークリスマス,Festive Hero & Christmas Killing Machine
ぷらこんきゅーぴっどむらさき,Purple Cupid
はなかりゅうどのころもみどり,Green Flower Hunter Outfit
チームゆく年くる年　２０２２,Team New Year 2022
ＤＱⅧしゅじんこうのいしょう,DQⅧ Hero Costume
ラダ・ガートたちに連絡を取る,Contact Lada Gart's Group
チームゆく年くる年　２０１８,Team New Year 2018
だんせいしらなみがらのゆかた,White Wave Yukata (M)
ぷらこんおとこどらきゅらふく,Men's Dracula Costume
じょせいぷらこんふくむらさき,Purple Clothes (F)
ハロウィンクイズ解答エルフ２,Halloween Quiz Answer Elf 2
はなかりうどのころもむらさき,Purple Flower Hunter Outfit
わかむしゃのかっちゅうせっと,Young Warrior Armor Set
行動時 7%でバイシオンとピオラ,Oomph & Accelerate On Action 7%
ぷらこんじょせいみこふくあか,Red Priestess Dress
はるかぜおうえんだんいしょう,Spring Cheer Team Outfit
魔人エンラージャ＆ムッチーノ,Enraja the Genie & Muccino
ぷらこんだんせいようあかろは,Red Men's Aloha
集合ギミック / 全体エフェクト,Some gimmick or effect idk
ぷらこんじょせいようきあろは,Yellow Women's Aloha
チームゆく年くる年　２０２５,Team Twenty Twenty Five
ハロウィンクイズ解答エルフ５,Halloween Quiz Answer Elf 5
ぷらこんじょせいしろふりそで,White Women's Kimono
ぷらこんおんなぱんぷきんふく,Women's Pumpkin Clothes
ぷらこんおんなどらきゅらふく,Women's Dracula Costume
ハロウィンクイズ解答エルフ４,Halloween Quiz Answer Elf 4
ハロウィンクイズ解答エルフ７,Halloween Quiz Answer Elf 7
ヴァレリアの仮面（割れる前）,Valeria's Unbroken Mask
チームゆく年くる年　２０２１,Team New Year 2021
ぷらこんだんせいようきあろは,Yellow Men's Aloha
どるわーむけんきゅういんふく,Dolworm Research Suit
行動時 5%でバイシオンとピオラ,Oomph & Accelerate On Action 5%
ぷらこんじょせいみこふくもも,Pink Priestess Dress
嵐魔ウェンリルとアクラガレナ,Wenrir the Storm & Akragarena
じょせいしらなみがらのゆかた,White Wave Yukata (F)
グランゼドーラ領-見張り塔 前,Gran Zedora Territory - Watchtower Front
ロヴォス高地-教会シスター 前,Rovos Highlands - Church Sister
ジャイラ密林-大樹の根元 入口,Jyra Jungle - Big Tree Root Entry
モンセロ温泉峡-南のやぐら 前,Moncello Spring Gorge - South Scaffold
モンセロ温泉峡-管理人小屋 前,Moncello Spring Gorge - Caretaker's Hut
デフェル荒野-教会シスター 前,Defel Desert - Church Sister
銃撃時2%でターンを消費しない,Free Turn When Shooting 2%
コニウェア平原-三門の関所 前,Coniware Plain - Three Way Gate
モンセロ温泉峡-ご神体の間 前,Moncello Spring Gorge - Hall of Worship
モンセロ温泉峡-北のやぐら 前,Moncello Spring Gorge - North Scaffold
デフェル荒野-ピラミッド 入口,Defel Desert - Pyramid Entry
毒時にタナトスのダメージ +150,Vicitimiser to Poisoned Foes +150
行動時 5%でチャージ時間 -10秒,Charge Time -10 sec. On Action 5%
攻撃時 5%でチャージ時間 -10秒,Charge Time -10 sec. Attack 5%
リンジャハル海岸-高台の遺跡,Linjahar Coast - Hilltop Ruins
セレドット山道-滝見の吊り橋,Celedot Mountain Pass - Fallsview Bridge
追憶の世界-キラキラ大風車塔,World Of Remembrance-Windmill Tower
炎・土・闇属性のダメージ +5%,Fire & Earth & Dark Damage +5%
ぷらこんえんじぇるふくあお,Blue Angel Clothes
アスフェルド学園女性用夏服,Asfeld Summer Uniform (F)
男性プラコン服ミッドナイト,Midnight Clothes (M)
魔物商人＆商品ナンバー１３,Monster Merchant & Item Number 13
清き風吹き　草木は芽吹く～,Pure winds blown and trees grown, budding green as the breeze is thrown
だんせいぷらこんふくえんじ,Red Clothes (M)
ハロウィンクイズ解答プク４,Halloween Quiz Answer Puku 4
ドラゴンクエストＸショップ,Dragon Quest X Shop
戦闘中常時マホトラのころも,Magic Cloak Always Active
ぷらこんだんせいはかまあお,Blue Men's Hakama
ハロウィンクイズ解答ドワ５,Halloween Quiz Answer Dwarf 5
ハロウィンクイズ解答ヒト７,Halloween Quiz Answer Human 7
ハロウィンクイズ解答プク２,Halloween Quiz Answer Puku 2
ハロウィンクイズ解答ドワ４,Halloween Quiz Answer Dwarf 4
だるめしあんがーるいしょう,Dalmatian Outfit (F)
ぷらこんだんせいはかまこん,Navy Blue Men's Hakama
ハロウィンクイズ解答オガ３,Halloween Quiz Answer Ogre 3
ハロウィンクイズ解答オガ６,Halloween Quiz Answer Ogre 6
ぷらこんおしゃれみずぎあお,Blue Snazzy Swimsuit
砂の都ファラザードへの出口,Exit to Farazard
ぷらこんいけてるみずぎあか,Red Cool Swimsuit
ぷらこんいけてるみずぎしろ,White Cool Swimsuit
ゆうべはおたのしみでしたね,Rooming with a Gamer Gal
ハロウィンクイズ解答プク３,Halloween Quiz Answer Puku 3
ぼうえいぐんのせいふくあか,Red Defense Force Suit
ハロウィンクイズ解答オガ７,Halloween Quiz Answer Ogre 7
ハロウィンクイズ解答プク６,Halloween Quiz Answer Puku 6
ぷらこんえんじぇるふくくろ,Black Angel Clothes
未開のジャングル地区への道,Road to Savage Jungle
2.0%でターンを消費しない<ban>,Free Turn 2% (PvP×)
だんせいぷらこんふくぴんく,Pink Clothes (M)
ぷらこんいけてるみずぎくろ,Black Cool Swimsuit
ぷらこんぱてぃしえふくしろ,White Pastry Chef Suit
古グランゼドーラ領への出口,Exit to Old Gran Zedora Territory
ぷらこんえんじぇるふくもも,Pink Angel Clothes
ハロウィンクイズ解答プク５,Halloween Quiz Answer Puku 5
らんぷれんきんれんしゅうぎ,Lamp Alchemy Training Wear
行動時 3%でテンションアップ,Tension On Action 3%
だるめしあんぼーいいしょう,Dalmatian Outfit (M)
はなかりうどのころもみどり,Green Flower Hunter Outfit
ぷらこんぱてぃしえふくあお,Blue Pastry Chef Suit
ドルボ用マネキンドワーフ用,For Dwarf Mannequin For Dolboard
ぷらこんぱてぃしえふくあか,Red Pastry Chef Suit
ぼうえいぐんのせいふくきん,Gold Defense Force Suit
ぷらこんだんせいはかまくろ,Black Men's Hakama
ハロウィンクイズ解答ヒト５,Halloween Quiz Answer Human 5
ランドン山脈山頂付近への道,Road to Landon Summit Area
からすかぐらのしょうぞくⅠ,Crow Dance Costume Ⅰ
男性プラコン服ミストグレー,Mist Gray Clothes (M)
ハロウィンクイズ解答ドワ１,Halloween Quiz Answer Dwarf 1
アスフェルド学園男性用夏服,Asfeld Summer Uniform (M)
ムストの町・風車へのはしご,Morst - Ladder to the Windmill
ぷらこんだんせいはかましろ,White Men's Hakama
１００万ゴールドの入った袋,1 Million Gold Bag
よわいこころ＆ずるいこころ,The Weak and Cunning Hearts
ハロウィンクイズ解答オガ４,Halloween Quiz Answer Ogre 4
はなかりゅうどのころもあか,Red Flower Hunter Outfit
ぷらこんおしゃれみずぎくろ,Black Snazzy Swimsuit
ハロウィンクイズ解答プク７,Halloween Quiz Answer Puku 7
イルーシャのスケッチブック,Illusia's Sketchbook
からすかぐらのしょうぞくⅡ,Crow Dance Costume Ⅱ
ハロウィンクイズ解答オガ１,Halloween Quiz Answer Ogre 1
女性プラコン服ミッドナイト,Midnight Clothes (F)
アスフェルド学園女性用水着,Asfeld Swimwear (F)
ハロウィンクイズ解答プク１,Halloween Quiz Answer Puku 1
行動時 5%でテンションアップ,Tension On Action 5%
ぷらこんおしゃれみずぎしろ,White Snazzy Swimsuit
ハロウィンクイズ解答オガ２,Halloween Quiz Answer Ogre 2
はなかりゅうどのころもあお,Blue Flower Hunter Outfit
ハロウィンクイズ解答ヒト２,Halloween Quiz Answer Human 2
ぼうえいぐんのせいふくこん,Blue Defense Force Suit
ぷらこんぱてぃしえふくもも,Pink Pastry Chef Suit
ハロウィンクイズ解答ヒト３,Halloween Quiz Answer Human 3
ハロウィンクイズ解答ドワ７,Halloween Quiz Answer Dwarf 7
ハロウィンクイズ解答ドワ２,Halloween Quiz Answer Dwarf 2
ドルボ用マネキンニンゲン用,For Human Mannequin For Dolboard
ハロウィンクイズ解答オガ５,Halloween Quiz Answer Ogre 5
ドルボ用マネキンウェディ用,For Weddie Mannequin For Dolboard
フラワーガーデン地区への道,Road to Flower Garden District
女性プラコン服アイスブルー,Ice Blue Clothes (F)
古レビュール街道北への出口,Exit to Old Reviewle Highway North
男性プラコン服ダークグレー,Dark Gray Clothes (M)
ハロウィンクイズ解答ドワ３,Halloween Quiz Answer Dwarf 3
アルムゴーグ＆ロムドゴーグ,Armogog & Romdogog
ぷらこんいけてるみずぎあお,Blue Cool Swimsuit
とうばつたいこうほうきょく,Strike Force Bureau
ハロウィンクイズ解答ヒト１,Halloween Quiz Answer Human 1
ハディン地下洞くつへの出口,Exit to Hadine Cavern
ぷらこんおしゃれみずぎもも,Pink Snazzy Swimsuit
3.0%でターンを消費しない<ban>,Free Turn 3% (PvP×)
キュロンイーターの巣への道,Path to Kyuroneater's Nest
アスフェルド学園男性用水着,Asfeld Swimwear (M)
じょせいぷらこんふくぴんく,Pink Clothes (F)
未完のドラクロン山地への道,Road to Undone Draklon Mountains
ぷらこんえんじぇるふくあか,Red Angel Clothes
未完のモンセロ温泉峡への道,Road to Undone Moncello Spring Gorge
ぷらこんえんじぇるふくしろ,White Angel Clothes
スターキメラから取った羽根,Cosmic Chimaera Feather
ハロウィンクイズ解答ヒト４,Halloween Quiz Answer Human 4
必殺チャージ時 身かわし +10%,Dodge +10% On Special Charge
イア・タア　シンパッ・ケウ,E-yis, aneu dish cubrey
未来への扉とまどろみの少女,The Door to the Future & the Slumbering Girl
デスディオ暗黒荒原への出口,Exit to Deathdio Darklands
『おうちでついてクン設定』,"House Pet Settings"
ハロウィンクイズ解答ドワ６,Halloween Quiz Answer Dwarf 6
ムストの町・教会跡への出口,Exit to Morst - Church Ruins
ハロウィンクイズ解答ヒト６,Halloween Quiz Answer Human 6
壊れたハイハイジャンプさん,Broken Mr. High High Jump
ぷらこんおしゃれみずぎあか,Red Snazzy Swimsuit
ぷらこんいけてるみずぎもも,Pink Cool Swimsuit
『ついてクンをひっこめる』,"Remove Pet"
じょせいぷらこんふくえんじ,Red Clothes (F)
ルクスガルン大空洞への亀裂,Crevice to Luxgarn Caverns
ドルボ用マネキンプクリポ用,For Pukulipo Mannequin For Dolboard
チャンス特技発生率 +1.0%<ban>,Chance Trigger Rate +1% (PvP×)
炎属性の呪文のダメージ +100,Fire Spell Damage +100
眠り時に呪文のダメージ +50%,Spell Damage to Asleep Foes +50%
氷耐性低下時のダメージ +100,Ice Vulnerability Damage +100
テンション時のダメージ +300,Damage During Tension +300
受けるダメージを10軽減する,Damage Taken -10
ワルド水源-湖上の休息所 前,Wald Headwaters - Lake Retreat
ロヴォス高地-ゼドラ洞 入口,Rovos Highlands - Zedra Cave Entry
5000年の旅路 遥かなる故郷へ,5000 Year Journey to a Faraway Hometown
ビンゴすごろくホール 入口,Bingo & Sugoroku Hall Entry
宇宙船・立入禁止区画 出口,Spacecraft - Restricted Area Exit
デス・ジャンクション 入口,Death's Juncture Entry
湖の小島・神のまなこ 出口,Lake Islet - The All-seeing Eye Exit
味方死亡時 20%でバイシオン,Oomph If Ally Dies 20%
アストルティア博物館 出口,Astoltia Museum Exit
からすかぐらのしょうぞく1,Crow Dance Costume Ⅰ
土属性の呪文のダメージ +5%,Earth Spell Damage +5%
モリナラ地下洞・深淵 入口,Molinara Underground Abyss Entry
レビュール街道北-谷合の森,Reviewle Highway North - Veil of the Vale
プログラマー検証ステージ6,Programmer Verification Stage 6
アストルティア博物館 入口,Astoltia Museum Entry
プログラマー検証ステージ5,Programmer Verification Stage 5
スイーツゾーン控え室 入口,Sweets Zone Waiting Room Entry
古グランゼドーラ王国 入口,Old Gran Zedora Kingdom Entry
瀕死時 15%こうげき力 +60<ban>,Near-Death Attack +60 15% (PvP×)
プログラマー検証ステージ4,Programmer Verification Stage 4
キュロンイーターの巣 出口,Kyuroneater's Nest Exit
ビンゴすごろくホール 出口,Bingo & Sugoroku Hall Exit
宇宙船・立入禁止区画 入口,Spacecraft - Restricted Area Entry
モリナラ地下洞・深淵 出口,Molinara Underground Abyss Exit
オルセコ闘技城・舞台 入口,Orseco Combastle - Stage Entry
エピステーサ底なし穴 出口,Epistesa Chasm Exit
