アルファ用アルウェ王妃の別荘跡(子供たちの隠れ家内部Test),Queen Alwe's Villa Ruins for Alpha (Test Inside Children's Hideout)
バトル班用テストマップ（いにしえのゼルメア）,Team Battle Map Test (Ancient Zelmea)
どらごんくえすとえいとしゅじんこうのいしょう,DQⅧ Hero Costume
このマップは モンスターから逃げられません。,You can't run from monsters on this map.
　　　～モンスター討伐隊隊員からの依頼～,         Monster Strike Force Request
マッチングテストステージ（同期テスト用）,Match test stage (for sync testing)
マッチングテストステージ（同期後移動用）,Match test stage (for moving beat testing)
リャナ荒涼地帯-ねじれたる異形の大地 入口,Lyana Desolate Area - Twisted Deformed Earth Entry
グランゼドーラ領-グランゼドーラ王国 入口,Gran Zedora Territory - Gran Zedora Kingdom Entry
メルサンディ穀倉帯-さびれたほこら 入口,Melsandy Millfields - Deserted Shrine Entry
アラハギーロ地方-モンスター格闘場 入口,Al-Ahagiro Region - Monster Arena Entry
メルサンディ穀倉帯-メルサンディ村 入口,Melsandy Millfields - Melsandy Village Entry
メルサンディ穀倉帯-こもれびの広場 入口,Melsandy Millfields - Sunbeam Square Entry
アラハギーロ地方-アラハギーロ王国 入口,Al-Ahagiro Region - Kingdom of Al-Ahagiro Entry
ぷらこんだんせいようそくたいむらさき,Purple Ceremony Gown
季節イベント「オ月見」　コンパニオン,Seasonal Event "Moon View" Companion
バトル班用テストマップ（ムスト廃墟）,Team Battle Map Test (Musuto Ruins)
季節イベント「お月見」　コンパニオン,Seasonal Event "Moon View" Companion
アラハギーロ地方-ムルードの岩山 入口,Al-Ahagiro Region - Murudo Mountain Entry
メルサンディ穀倉帯-メルン水車郷 入口,Melsandy Millfields - Melun Watermill Entry
アラハギーロ地方-日除けのほら穴 入口,Al-Ahagiro Region - Sunshade Cave Entry
ぷらこんすくーるせいふくおんなこん,Blue School Uniform (F)
ルファ神殿エントランス（オープン）,Rufa Temple - Entry (Open)
ぷらこんすくーるせいふくおとこちゃ,Brown School Uniform (M)
神代過ぎ～　春の桜よ　無為に咲く～,Past ages divine, the spring blossoms bloom, waiting idly by...
ぷらこんすくーるせいふくおとこしろ,White School Uniform (M)
ぷらこんすくーるせいふくおんなちゃ,Brown School Uniform (F)
ぷらこんすくーるせいふくおんなあか,Red School Uniform (F)
ぷらこんすくーるせいふくおとこあか,Red School Uniform (M)
ぷらこんすくーるせいふくおんなしろ,White School Uniform (F)
ぷらこんすくーるせいふくおとここん,Blue School Uniform (M)
しかし　持ち物が　いっぱいだった！,But you're carrying too many things!
ぷらこんすくーるせいふくおんなくろ,Black School Uniform (F)
ぷらこんだんせいようそくたいみどり,Green Ceremony Gown
受けた属性ダメージの 10%ＨＰ回復<ban>,10% Attribute Damage Taken As HP (PvP×)
ぷらこんすくーるせいふくおとこくろ,Black School Uniform (M)
コニウェア平原-ココラタの浜辺 入口,Coniware Plain - Cocolata Beach Entry
リャナ荒涼地帯-ソーラリア峡谷 入口,Lyana Desolate Area - Solaria Canyon Entry
アルファ用井戸(ダンダダ団のアジト),Well for Alpha (Robbin' 'Ood Gang HQ)
バトル班用テストマップ(ツスクル）,Team Battle Map Test (Tsusukuru)
ぷらこんじょせいしのびのふくあか,Red Women's Ninja Suit
ぷらこんじょせいむらさきふりそで,Purple Women's Kimono
だんせいぷらこんふくみっどないと,Midnight Clothes (M)
ぷらこんだんせいしのびのふくちゃ,Tea Men's Ninja Suit
ぷらこんだんせいしのびのふくくろ,Black Men's Ninja Suit
ぷらこんじょせいみこふくむらさき,Purple Priestess Dress
あすふぇるどがくえんがくせいふく,Asfeld Academy Uniform
ぷらこんだんせいようそくたいあお,Blue Ceremony Gown
エフェクトイメージさん（１０個）,Mr. Effect Image (10)
ぷらこんだんせいようそくたいはい,Ash Ceremony Gown
プンスコのテーブル＆ティーセット,Punsuko's Table & Tea Set
だんせいぷらこんふくみすとぐれー,Mist Gray Clothes (M)
ぷらこんだんせいしのびのふくこん,Navy Men's Ninja Suit
じょせいぷらこんふくみっどないと,Midnight Clothes (F)
ぷらこんじょせいしのびのふくあお,Blue Women's Ninja Suit
ぷらこんじょせいしのびのふくくろ,Black Women's Ninja Suit
バトル班用テストマップ（獅子門）,Team Battle Map Test (Lion Gate)
ぷらこんだんせいようみどりさんた,Green Men's Santa Suit
ぷらこんだんせいようそくたいちゃ,Tea Ceremony Gown
だんせいぷらこんふくだーくぐれー,Dark Gray Clothes (M)
ぷらこんじょせいようみどりさんた,Green Women's Santa Suit
ぷらこんじょせいしのびのふくもも,Pink Women's Ninja Suit
じょせいぷらこんふくあいすぶるー,Ice Blue Clothes (F)
ぷらこんだんせいしのびのふくあお,Blue Men's Ninja Suit
ぷらこんじょせいしのびのふくこん,Navy Women's Ninja Suit
ぷらこんだんせいしのびのふくあか,Red Men's Ninja Suit
セレドット山道-ベリルのほら穴 前,Celedot Mountain Pass - Beryl Den
レビュール街道北-海風の洞くつ 前,Reviewle Highway North - Seabreeze Cave
リンジャハル海岸-リンジャの塔 前,Linjahar Coast - Linja Tower
リンジャハル海岸-教会シスター 前,Linjahar Coast - Church Sister
マデ島＆エテーネ王宮（4.5CS専用）,Made Isle & Ethene Royal Manor (4.5CS only)
必殺チャージ時 チャージ時間-10秒,Charge Time -10 sec. On Special
プログラマー用負荷検証ステージ3,Loading Programmer Verification Stage 3
プログラマー用負荷検証ステージ1,Loading Programmer Verification Stage 1
プログラマー用負荷検証ステージ2,Loading Programmer Verification Stage 2
プログラマー用負荷検証ステージ4,Loading Programmer Verification Stage 4
プログラマー用負荷検証ステージ5,Loading Programmer Verification Stage 5
追憶の世界-アルウェ王妃の別荘跡,World of Remembrance-The Ruins of Queen Alwe
ぷらこんだんせいようももあろは,Pink Men's Aloha
\s\m\eは　ダイスをふった。　→　,\s\m\e rolls a die. → It's a !
ぷらこんじょせいみこふくみどり,Green Priestess Dress
ぷらこんじょせいようくろさんた,Black Women's Santa Suit
ハロウィンクイズ解答ウェディ１,Halloween Quiz Answer Weddie 1
ぷらこんだんせいようしろさんた,White Men's Santa Suit
ぷらこんじょせいようあかさんた,Red Women's Santa Suit
豪魔将ベリンダ＆豪魔将ブレンダ,Generals Belinda & Brenda
ゴリウスの怨霊＆魔道士キルギル,Gorius' Vengeance & Wizard Kirgyl
えるどなしんのしょうぞくせっと,Eldona's Outfit
魔天の勇者＆聖夜の破壊者・闇組,Demon Sky Hero & Holy Night Wrecker Dark Team
ぷらこんだんせいようくろさんた,Black Men's Santa Suit
\s\m\eは　コインをなげた。　→　,\s\m\e flips a coin. → The coin lands on !
\s\m\eは　カードを引いた。　→　,\s\m\e draws a card. → They drew the !
ハロウィンクイズ解答ウェディ４,Halloween Quiz Answer Weddie 4
ぷらこんじょせいようしろあろは,White Women's Aloha
扉は　かたく　閉ざされている。,The door is tightly closed.
ぼうえいぐんのせいふくはいいろ,Gray Defense Force Suit
魔天の勇者＆聖夜の破壊者・雪組,Demon Sky Hero & Holy Night Wrecker Snow Team
ぷらこんじょせいようしろさんた,White Women's Santa Suit
ハロウィンクイズ解答ウェディ３,Halloween Quiz Answer Weddie 3
ぷらこんじょせいようあかあろは,Red Women's Aloha
ぷらこんじょせいようももあろは,Pink Women's Aloha
ハロウィンクイズ解答ウェディ２,Halloween Quiz Answer Weddie 2
ぷらこんだんせいはかまむらさき,Purple Men's Hakama
ぼうえいぐんのせいふくむらさき,Purple Defense Force Suit
30%の確率で受けたダメージ10%反射,30% Chance to Reflect 10% Damage
ぷらこんじょせいようあおあろは,Blue Women's Aloha
ぷらこんだんせいようももさんた,Pink Men's Santa Suit
ぷらこんだんせいようあかさんた,Red Men's Santa Suit
ぷらこんだんせいようあおあろは,Blue Men's Aloha
ぷらこんじょせいようももさんた,Pink Women's Santa Suit
ぷらこんだんせいようしろあろは,White Men's Aloha
ハロウィンクイズ解答ウェディ５,Halloween Quiz Answer Weddie 5
ハロウィンクイズ解答ウェディ６,Halloween Quiz Answer Weddie 6
ぷらこんこどもようみずぎせっと,Children's Swimsuit
壊れたアストルティアのコンパス,Broken Astoltia Compass
じょせいぷらこんふくさんせっと,Sunset Clothes (F)
はなかりゅうどのころもむらさき,Purple Flower Hunter Outfit
ハロウィンクイズ解答ウェディ７,Halloween Quiz Answer Weddie 7
会心と暴走時魔物にダメージ +100,Critical & Haywire Damage +100
リャナ荒涼地帯-くずれた灯台 前,Lyana Desolate Area - Collapsed Lighthouse
リャナ荒涼地帯-滝を臨む集落 前,Lyana Desolate Area - Waterfall Village
セレドット山道-セレドの町 入口,Celedot Mountain Pass - Town of Celed Entry
ドラクロン山地-竜守りの小屋 前,Draklon Mountains - Dragon Guard's Hut
モンセロ温泉峡-中央のやぐら 前,Moncello Spring Gorge - Central Scaffold
レビュール街道南-三門の関所 前,Reviewle Highway South - Three Way Gate
ジャイラ密林-クドゥスの泉 入口,Jyra Jungle - Kudus Spring Entry
コニウェア平原-教会シスター 前,Coniware Plain - Church Sister
デフェル荒野-不思議の魔塔 入口,Defel Desert - Mysterious Tower Entry
アルファ用追憶の世界 別荘跡編,World of Recollection for Alpha Villa Ruins
こうげき魔力とかいふく魔力 +10,Magical Might/Mending +10
戦いで 魔物に狙われにくくなる,Less likely to be targeted in battle
テンション時魔物にダメージ+100,Damage During Tension +100
ぷらこんおんなぱんぷきんふく,Women's Pumpkin Clothes
あすふぇるどがくえんふゆふく,Asfeld Academy Winter Wear
魔人エンラージャ＆ムッチーノ,Enraja the Genie & Muccino
ぷらこんしゃわーよういしょう,Shower Outfit
行動時 5%でバイシオンとスカラ,Oomph & Buff On Action 5%
あすふぇるどがくえんなつふく,Asfeld Academy Summer Wear
はるかぜおうえんだんいしょう,Spring Cheer Team Outfit
チームゆく年くる年　２０１９,Team New Year 2019
ぷらこんじょせいようきあろは,Yellow Women's Aloha
ぷらこんじょせいみこふくもも,Pink Priestess Dress
チームゆく年くる年　２０２３,Team New Year 2023
チームゆく年くる年　２０２１,Team New Year 2021
チームゆく年くる年　２０２２,Team New Year 2022
チームゆく年くる年　２０２４,Team Twenty Twenty Four
じょせいぷらこんふくむらさき,Purple Clothes (F)
フォークに刺さったパンケーキ,Pancakes Stuck in a Fork
チームゆく年くる年　２０１８,Team New Year 2018
ぷらこんおとこどらきゅらふく,Men's Dracula Costume
ぷらこんだんせいようきあろは,Yellow Men's Aloha
ぷらこんじょせいももふりそで,Pink Women's Kimono
ヴァレリアの仮面（割れる前）,Valeria's Unbroken Mask
ぷらこんじょせいみこふくあか,Red Priestess Dress
闇に唄う氷にまぎれし聖なる者,Frozen Sacred Singer
巨人コアを守るジア・クトたち,Defenders of the Core
チームゆく年くる年　２０２０,Team New Year 2020
ハロウィンクイズ解答エルフ６,Halloween Quiz Answer Elf 6
ぷらこんだんせいようあかろは,Red Men's Aloha
チームゆく年くる年　２０２５,Team New Year 2025
ハロウィンクイズ解答エルフ２,Halloween Quiz Answer Elf 2
どるわーむけんきゅういんふく,Dolworm Research Suit
ＤＱⅧしゅじんこうのいしょう,DQⅧ Hero Costume
ぷらこんじょせいあかふりそで,Red Women's Kimono
じょせいしらなみがらのゆかた,White Wave Yukata (F)
ぷらこんじょせいみこふくあお,Blue Priestess Dress
はなかりうどのころもむらさき,Purple Flower Hunter Outfit
だんせいしらなみがらのゆかた,White Wave Yukata (M)
ハロウィンクイズ解答エルフ４,Halloween Quiz Answer Elf 4
魔天の勇者＆キラークリスマス,Demon Sky Hero & Christmas Killing Machine
ハロウィンクイズ解答エルフ１,Halloween Quiz Answer Elf 1
ぷらこんおとこぱんぷきんふく,Men's Pumpkin Clothes
チームゆく年くる年　２０１７,Team New Year 2017
ぷらこんじょせいしろふりそで,White Women's Kimono
わかむしゃのかっちゅうせっと,Young Warrior Armor Set
ハロウィンクイズ解答エルフ５,Halloween Quiz Answer Elf 5
ラダ・ガートたちに連絡を取る,Contact Lada Gart's Group
行動時 5%でバイシオンとピオラ,Oomph & Accelerate On Action 5%
行動時 7%でバイシオンとピオラ,Oomph & Accelerate On Action 7%
ぼうえいぐんのせいふくみどり,Green Defense Force Suit
ハロウィンクイズ解答エルフ３,Halloween Quiz Answer Elf 3
はなかりゅうどのころもみどり,Green Flower Hunter Outfit
嵐魔ウェンリルとアクラガレナ,Wenrir the Storm & Akragarena
ぷらこんじょせいくろふりそで,Black Women's Kimono
ぷらこんおんなどらきゅらふく,Women's Dracula Costume
ぷらこんきゅーぴっどむらさき,Purple Cupid
ハロウィンクイズ解答エルフ７,Halloween Quiz Answer Elf 7
ぷらこんすいーとふくだいだい,Orange Sweet Clothes
コニウェア平原-三門の関所 前,Coniware Plain - Three Way Gate
モンセロ温泉峡-北のやぐら 前,Moncello Spring Gorge - North Scaffold
ロヴォス高地-教会シスター 前,Rovos Highlands - Church Sister
ジャイラ密林-大樹の根元 入口,Jyra Jungle - Big Tree Root Entry
モンセロ温泉峡-管理人小屋 前,Moncello Spring Gorge - Caretaker's Hut
デフェル荒野-ピラミッド 入口,Defel Desert - Pyramid Entry
モンセロ温泉峡-南のやぐら 前,Moncello Spring Gorge - South Scaffold
グランゼドーラ領-見張り塔 前,Gran Zedora Territory - Watchtower Front
モンセロ温泉峡-ご神体の間 前,Moncello Spring Gorge - Hall of Worship
デフェル荒野-教会シスター 前,Defel Desert - Church Sister
セレドット山道-滝見の吊り橋,Celedot Mountain Pass - Fallsview Bridge
炎・土・闇の攻撃ダメージ +5%,Fire/Earth/Dark Damage +5%
リンジャハル海岸-高台の遺跡,Linjahar Coast - Hilltop Ruins
追憶の世界-キラキラ大風車塔,World Of Remembrance-Windmill Tower
ムストの町・教会跡への出口,Exit to Morst - Church Ruins
ハロウィンクイズ解答プク５,Halloween Quiz Answer Puku 5
ぷらこんおしゃれみずぎくろ,Black Snazzy Swimsuit
だるめしあんぼーいいしょう,Dalmatian Outfit (M)
だんせいぷらこんふくぴんく,Pink Clothes (M)
ドルボ用マネキンプクリポ用,For Pukulipo Mannequin For Dolboard
ドルボ用マネキンウェディ用,For Weddie Mannequin For Dolboard
じょせいぷらこんふくえんじ,Red Clothes (F)
行動時 5%でテンションアップ,Tension On Action 5%
砂の都ファラザードへの出口,Exit to Farazard
だるめしあんがーるいしょう,Dalmatian Outfit (F)
ぷらこんえんじぇるふくしろ,White Angel Clothes
からすかぐらのしょうぞくⅠ,Crow Dance Costume Ⅰ
男性プラコン服ミッドナイト,Midnight Clothes (M)
『ついてクンをひっこめる』,"Remove Pet"
イア・タア　シンパッ・ケウ,E-yis, aneu dish cubrey
ハロウィンクイズ解答プク７,Halloween Quiz Answer Puku 7
ぷらこんいけてるみずぎしろ,White Cool Swimsuit
壊れたハイハイジャンプさん,Broken Mr. High High Jump
女性プラコン服ミッドナイト,Midnight Clothes (F)
ハロウィンクイズ解答ヒト７,Halloween Quiz Answer Human 7
ハロウィンクイズ解答ドワ２,Halloween Quiz Answer Dwarf 2
未完のモンセロ温泉峡への道,Road to Undone Moncello Spring Gorge
ハロウィンクイズ解答ドワ７,Halloween Quiz Answer Dwarf 7
ハロウィンクイズ解答オガ７,Halloween Quiz Answer Ogre 7
行動時 5%でチャージ時間-10秒,Charge Time -5 sec. On Action 5%
清き風吹き　草木は芽吹く～,Pure winds blown and trees grown, budding green as the breeze is thrown
アルムゴーグ＆ロムドゴーグ,Armogog & Romdogog
男性プラコン服ミストグレー,Mist Gray Clothes (M)
男性プラコン服ダークグレー,Dark Gray Clothes (M)
ハロウィンクイズ解答ヒト６,Halloween Quiz Answer Human 6
アスフェルド学園女性用水着,Asfeld Swimwear (F)
ぷらこんだんせいはかましろ,White Men's Hakama
ぷらこんおしゃれみずぎもも,Pink Snazzy Swimsuit
ゆうべはおたのしみでしたね,Rooming with a Gamer Gal
ハディン地下洞くつへの出口,Exit to Hadine Cavern
ハロウィンクイズ解答プク３,Halloween Quiz Answer Puku 3
はなかりゅうどのころもあか,Red Flower Hunter Outfit
女性プラコン服アイスブルー,Ice Blue Clothes (F)
未開のジャングル地区への道,Road to Savage Jungle
ハロウィンクイズ解答ドワ１,Halloween Quiz Answer Dwarf 1
だんせいぷらこんふくえんじ,Red Clothes (M)
ぷらこんいけてるみずぎあか,Red Cool Swimsuit
スターキメラから取った羽根,Cosmic Chimaera Feather
ハロウィンクイズ解答ヒト４,Halloween Quiz Answer Human 4
ハロウィンクイズ解答プク１,Halloween Quiz Answer Puku 1
ハロウィンクイズ解答オガ４,Halloween Quiz Answer Ogre 4
ぷらこんえんじぇるふくもも,Pink Angel Clothes
行動時 3%でテンションアップ,Tension On Action 3%
ぷらこんえんじぇるふくあか,Red Angel Clothes
らんぷれんきんれんしゅうぎ,Lamp Alchemy Training Wear
ぷらこんえんじぇるふくくろ,Black Angel Clothes
ぷらこんぱてぃしえふくもも,Pink Pastry Chef Suit
デスディオ暗黒荒原への出口,Exit to Deathdio Darklands
はなかりゅうどのころもあお,Blue Flower Hunter Outfit
ドルボ用マネキンドワーフ用,For Dwarf Mannequin For Dolboard
ハロウィンクイズ解答オガ６,Halloween Quiz Answer Ogre 6
ぼうえいぐんのせいふくきん,Gold Defense Force Suit
ハロウィンクイズ解答プク６,Halloween Quiz Answer Puku 6
ハロウィンクイズ解答ドワ４,Halloween Quiz Answer Dwarf 4
ぷらこんおしゃれみずぎあお,Blue Snazzy Swimsuit
はなかりうどのころもみどり,Green Flower Hunter Outfit
フラワーガーデン地区への道,Road to Flower Garden District
ハロウィンクイズ解答ヒト５,Halloween Quiz Answer Human 5
アスフェルド学園女性用夏服,Asfeld Summer Uniform (F)
ハロウィンクイズ解答オガ５,Halloween Quiz Answer Ogre 5
『おうちでついてクン設定』,"House Pet Settings"
ハロウィンクイズ解答ヒト２,Halloween Quiz Answer Human 2
ぼうえいぐんのせいふくこん,Blue Defense Force Suit
ぷらこんだんせいはかまあお,Blue Men's Hakama
ぷらこんぱてぃしえふくしろ,White Pastry Chef Suit
ランドン山脈山頂付近への道,Road to Landon Summit Area
ぷらこんおしゃれみずぎあか,Red Snazzy Swimsuit
未完のドラクロン山地への道,Road to Undone Draklon Mountains
ハロウィンクイズ解答オガ２,Halloween Quiz Answer Ogre 2
ハロウィンクイズ解答オガ１,Halloween Quiz Answer Ogre 1
からすかぐらのしょうぞくⅡ,Crow Dance Costume Ⅱ
ハロウィンクイズ解答オガ３,Halloween Quiz Answer Ogre 3
ぷらこんだんせいはかまこん,Navy Blue Men's Hakama
ぷらこんいけてるみずぎもも,Pink Cool Swimsuit
ぷらこんおしゃれみずぎしろ,White Snazzy Swimsuit
アスフェルド学園男性用水着,Asfeld Swimwear (M)
ハロウィンクイズ解答プク２,Halloween Quiz Answer Puku 2
アスフェルド学園男性用夏服,Asfeld Summer Uniform (M)
ハロウィンクイズ解答ヒト１,Halloween Quiz Answer Human 1
ハロウィンクイズ解答ドワ３,Halloween Quiz Answer Dwarf 3
ハロウィンクイズ解答ドワ５,Halloween Quiz Answer Dwarf 5
ルクスガルン大空洞への亀裂,Crevice to Luxgarn Caverns
ハロウィンクイズ解答プク４,Halloween Quiz Answer Puku 4
ハロウィンクイズ解答ドワ６,Halloween Quiz Answer Dwarf 6
ぷらこんぱてぃしえふくあお,Blue Pastry Chef Suit
ぼうえいぐんのせいふくあか,Red Defense Force Suit
１００万ゴールドの入った袋,1 Million Gold Bag
とうばつたいこうほうきょく,Strike Force Bureau
ドラゴンクエストＸショップ,Dragon Quest X Shop
攻撃時 5%でチャージ時間-10秒,Charge Time -10s On Attack 5%
古レビュール街道北への出口,Exit to Old Reviewle Highway North
ぷらこんいけてるみずぎくろ,Black Cool Swimsuit
魔物商人＆商品ナンバー１３,Monster Merchant & Item Number 13
ぷらこんいけてるみずぎあお,Blue Cool Swimsuit
ムストの町・風車へのはしご,Morst - Ladder to the Windmill
古グランゼドーラ領への出口,Exit to Old Gran Zedora Territory
ドルボ用マネキンニンゲン用,For Human Mannequin For Dolboard
未来への扉とまどろみの少女,The Door to the Future & the Slumbering Girl
ぷらこんだんせいはかまくろ,Black Men's Hakama
ぷらこんえんじぇるふくあお,Blue Angel Clothes
じょせいぷらこんふくぴんく,Pink Clothes (F)
ぷらこんぱてぃしえふくあか,Red Pastry Chef Suit
イルーシャのスケッチブック,Illusia's Sketchbook
ハロウィンクイズ解答ヒト３,Halloween Quiz Answer Human 3
戦闘中常時マホトラのころも,Magic Cloak Always Active
受けるダメージを10軽減する,Damage Taken -10
必殺チャージ時 身かわし+10%,Dodge +10% On Special Charge
5000年の旅路 遥かなる故郷へ,5000 Year Journey to a Faraway Hometown
攻撃力上昇時特技ダメ+20<ban>,Skill Dmg. +20 When Attack ↑ (PvP×)
ロヴォス高地-ゼドラ洞 入口,Rovos Highlands - Zedra Cave Entry
ワルド水源-湖上の休息所 前,Wald Headwaters - Lake Retreat
プログラマー検証ステージ4,Programmer Verification Stage 4
とこしえの神殿楯の間 出口,Temple of Eternity Shield Room Exit
モリナラ地下洞・深淵 出口,Molinara Underground Abyss Exit
エピステーサ底なし穴 出口,Epistesa Chasm Exit
スライムレースホール 入口,Slime Race Hall Entry
プログラマー検証ステージ2,Programmer Verification Stage 2
スライムレースホール 出口,Slime Race Hall Exit
カルデア山道のアジト 入口,Chaldea Mountain Road Hideout Entry
スイーツゾーン控え室 出口,Sweets Zone Waiting Room Exit
受けるダメージを5軽減する,Damage Taken -5
プログラマー検証ステージ3,Programmer Verification Stage 3
プログラマー検証ステージ8,Programmer Verification Stage 8
プログラマー検証ステージ5,Programmer Verification Stage 5
宇宙船・立入禁止区画 出口,Spacecraft - Restricted Area Exit
からすかぐらのしょうぞく2,Crow Dance Costume Ⅱ
ビンゴすごろくホール 入口,Bingo & Sugoroku Hall Entry
バルメシュケの研究所 入口,Balmeschke's Laboratory Entry
古グランゼドーラ王国 入口,Old Gran Zedora Kingdom Entry
アストルティア博物館 出口,Astoltia Museum Exit
オルセコ闘技城・舞台 出口,Orseco Combat Castle - Stage Exit
とこしえの神殿楯の間 入口,Temple of Eternity Shield Room Entry
からすかぐらのしょうぞく1,Crow Dance Costume Ⅰ
ビンゴすごろくホール 出口,Bingo & Sugoroku Hall Exit
デス・ジャンクション 出口,Death Junction Exit
レビュール街道北-谷合の森,Reviewle Highway North - Veil of the Vale
プログラマー検証ステージ1,Programmer Verification Stage 1
プログラマー検証ステージ6,Programmer Verification Stage 6
味方死亡時 20%でバイシオン,Oomph If Ally Dies 20%
グランゼニスの試練場 出口,Gran Zenith's Trial Grounds Exit
ゼクレス城・魔導広場 出口,Zechres Castle - Magic Square Exit
ランプ錬金ギルド 地下１階,Lamp Alchemy Guild B1F
シガール町長の執務室 入口,Mayor Sigal's Office Entry
モリナラ地下洞・深淵 入口,Molinara Underground Abyss Entry
宇宙船・立入禁止区画 入口,Spacecraft - Restricted Area Entry
カルデア山道のアジト 出口,Chaldea Mountain Road Hideout Exit
スイーツゾーン控え室 入口,Sweets Zone Waiting Room Entry
エピステーサ底なし穴 入口,Epistesa Chasm Entry
アストルティア博物館 入口,Astoltia Museum Entry
開戦時 10%でヘヴィチャージ,Starting Heavy Charge 10%
ビタースイーツゾーン 出口,Bittersweets Zone Exit
オルセコ闘技城・舞台 入口,Orseco Combat Castle - Stage Entry
湖の小島・神のまなこ 出口,Lake Islet - The All-seeing Eye Exit
デス・ジャンクション 入口,Death Junction Entry
