消えることのない炎,Unquenchable Flames
ゴールデントーテム,Gem Jamboree
リボンスターアクセ,Star Ribbon Accessory
ゴスバニーモノクル,Goth Bunny Monocle
赤の巨人レドノフ強,Apex Red Giant Rednov
メレアーデの便せん,Mereade Paper
亡き王国に捧げる詩,Ode to a Departed Kingdom
異界獣ヘイズシナー,Haze Sinner, the Otherworldly
ビクトリーチップ竜,Dragon Victory Chip
フカフカのもみガラ,Fluffy Rice Husks
うさみみギフト・桃,Pink Rabbit Ears Gift
三毛猫スーツのヒゲ,Calico Cat Whiskers
ポーンのピース・黒,Black Pawn Piece
リリィアンヌバッグ,Lillian Bag
冬風マキシスカート,Winter Maxi Skirt
ギュメイ将軍練習札,Goresby-Purrvis Tag
金神の秘鳥将バオラ,Gold Bird General Baora
パレードコステイロ,Mardi Garb Feathers
防衛魔神兵０５２号,Aztech Guard No. 052
四葉のクローバー傘,Lucky Clover Umbrella
カンフージャケット,Kung Fu Jacket
極天女帝のサンダル,Sky Empress Sandals
オブジェクト座標096,Object Coordinates 096
預かり所ビッティス,Storage Bittis
リソルのフウキの証,Resol's SCC Emblem
アズラン大浴場の棚,Azlan Bathhouse Shelf
うんてんしちっちぇ,Driver Chiche
蘇りし魔軍師イッド,Risen Tactician Idd
プラチナクローの本,Platinum Claws Book
ストームグラス・庭,Storm Glass (G)
決めポーズ中央後列,Decisive Pose Back Row
紅殻魔スコルパイド,Scorpide, the Crimson Carapace
クールスターの服上,Cool Star Shirt
真・オノむそう・改,Axes of True Evil+
ダックスビル浮き輪,Splatypunk Floatie
りゅうおうアックス,True Dragonlord Axe
呪文ぼうそう率 +2.0%,Haywire Rate +2%
第４回討伐ＴＡ・金,4th Boss TA Gold
アイスダンス衣装券,Ice Dance Outfit Voucher
おおきなリボン黒桃,Black/Pink Ribbon L
モーモンスティック,Teeny Sanguini Wand
選定者ワルキュウリ,Selector Val-cu-rie
シスター・ディモス,Sister Deimos
ドミネウスの回顧録,Domineus' Memoir
ハスの花ランプ・緑,Green Lotus Lamp
サザミレ草原への道,Road to Sazamire Prairie
マデッサンスバッジ,Universagora Badge
歓迎会用テーブル１,Table for Welcome Party 1
ファンキータイツ上,Funky Vest
ゴールドマンＸ７号,Gold Golem X 7
魔法戦士団グローブ,Armamentalist Gloves
チョコレートリップ,Chocolate Tulip
フォーリオンへの扉,Gate to Fourion
オブジェクト座標111,Object Coordinates 111
ドラゴンスティック,Wyvern Wand
りょうりにんぴーら,Chef Peera
小型の四角い水そう,Square Aquarium S
ドワーフカウンタ小,Dwarf Counter S
壁かけ故郷の風景画,Hometown Painting
ブレイブギフト・紫,Purple Brave Gift
ピクニックアルウエ,Alwe Picnic
ドラパンクパーカー,Dracky Punk Hoodie
しぐさ書・スマイル,Best Smile
パッチ柄ベッド・青,Blue Patch Bed
第９回釣りコン・金,9th Fish Contest Gold
オブジェクト座標262,Object Coordinates 262
ギュッと白き導き手,Handy Horse Arm Doll
フォーリオン２印章,Fourion 2 Stamps
回転木馬のモビール,Carousel Mobile
神獣ゼナベスティア,Divine Beast Zenabestia
三姉妹人形・庭用青,Blue 3 Sisters Doll (G)
第２回カンダタの像,2nd Robbin' 'Ood Statue
レーナム緑野の木Ａ,Lenam Fields Tree A
ミイラエルフ人形男,Mummy Elf Doll (M)
第７回釣りコン・銀,7th Fish Contest Silver
メネトの資材置き場,Menet Depository
カミハルムイ渡し船,Kamiharmui Ferry
ポンポンベタの置物,Pom Pom Betta Ornament
究極邪教司祭メダル,Ultimate Aamon Medal
踊魔の霊符・花嫁雪,Snow Dancer Talisman
ドルワーム王国の扉,Dolworm Kingdom Door
大森林のレンジャー,Great Forest Ranger
古代武器図説・杖編,Book of Ancient Staves
レース受付係タータ,Race Receptionist Tarta
エテーネ軍の兵士Ａ,Ethene Army Soldier A
Ｎ高女子のスカート,N High Girl's Skirt
はんじゅくスライム,Soft Boiled Slime
オブジェクト座標261,Object Coordinates 261
泡雪のコートセット,Light Snow Outfit
予言者学園女学生靴,FTA Shoes (F)
武闘家ヤーン分身Ａ,Martial Artist Yarn Copy A
エンシェントワンド,Olde-Worlde Staffe
まごころ駅弁を君に,Sincere Lunch for You
ブレイブキャンディ,Brave Lollipop
クラッシュチェーン,Crusher Chain
ベラストル家の呪符,Belastre Amulet
ごうかなラグ大・赤,Red Fancy Rug L
がーるもっずこーと,Girl Mod Coat
宣伝コンテスト・金,Promo Contest Gold
メレアーデのお部屋,Mereade's Room
さんぞくウルフ・強,Vicious Ruff Ruffian
アンドレアルコイン,Rashaverak Coin
キャットリベリオ強,Apex Purrgatroyd
ミステリークッキー,Mystery Cookies
旅芸人ピュージュＩ,Minstrel Pyuju I
セレドの民家の外観,Celed House Exterior
聖湖ゼニートの壁泉,Zenit Wall Fountain
闘志に火をつけろ！,Fighting Spirit Ignited
愛と信頼の預かり所,Love and Trust Depository
ロードリーコサージ,Lordly Corsage
アンガーギフト・銀,Silver Angry Gift
カボチャカウンタ小,Pumpkin Counter S
南国の釣りざお・氷,Ice Tropic Fishing Rod
ピクニックラグアス,Raguas Picnic
レースのミニハット,Lace Mini Hat
おとぎの森カチーフ,Fairy Forest Kerchief
ジア・ルミナのコア,Dia Lumina Core
クロッシュシューズ,Bell Shoes
パンプキンシューズ,Pumpkin Shoes
ふたつ結びエクステ,Double Knot Extension
ウェットスーツ・金,Gold Wetsuit
サマーソルトクロー,Somersault Claw
踊魔の霊符・花嫁白,White Dancer Talisman
第２回カジノ祭・金,2nd Casino Fest Gold
第９回討伐ＴＡ・銀,9th Boss TA Silver
じゃんぼりぃの帽子,Janbori's Hat
りゅうおうの像・庭,Dragonlord Statue (G)
カラミティデーモン,Calamity Demon
モダンローズの手袋,Modern Rose Gloves
たゆたう水面投影機,Water Surface Projector
ルークのピース・白,White Rook Piece
金のキーエンブレム,Gold Key Emblem
パワーストーンマン,Power Stone Golem
オーガキングの盾扉,Testudogre Shield Door
ミドリフサアンコウ,Greenspot Anglerfish
常勝のよろいセット,Triumphant Armor Set
古レビュール街道南,Old Reviewle Highway South
神々のゆびわの破片,Ring of the Risen Shard
真・暗殺武器の歴史,True Assassin Weapons
キャロル姫ゆかた下,Carol Yukata Bottom
郵便局員ジョレミー,Postman Joremy
パピヨンベッド・幻,Phantom Papillon Bed
オブジェクト座標002,Object Coordinates 002
音符のテーブル・黒,Black Music Table
グレースギフト・赤,Red Grace Gift
プチゴレオンカード,Frail Goreham Card
ハチ駆除防護グラス,Bee Protection Glasses
オブジェクト座標102,Object Coordinates 102
ルミナスギフト・白,White Luminous Gift
ヒーリングドリーム,Healing Way
ルファ神殿・中央塔,Rufa Temple - Tower
シャインファイバー,Shiny Fibers
ダルメシアン衣装券,Dalmatian Outfit Voucher
ホーリークリスタル,Holy Crystal
特別タロットパック,Special Tarot Pack
モダンローズドレス,Modern Rose Dress
家用チームフラッグ,Team Flag
シスター・アマティ,Sister Amati
ヒストリカキッチン,Historica Kitchen
マイタウン草原地区,My Town Meadow District
ドルタムのこころ２,Doltam's Heart Lv2
アスバルぬいぐるみ,Asbal Plushie
ストロベリーチョコ,Strawberry Chocolate
オブジェクト座標124,Object Coordinates 124
ルクスガルン大空洞,Luxgarn Caverns
しぐさ書・バトル改,Better Battle Pose
オブジェクト座標181,Object Coordinates 181
ヴァレリアへの親書,Official Letter to Valeria
謎の幽霊列車の写真,Mystery Ghost Train Photo
七夕の吹き流し・星,Paper Star Streamers
オブジェクト座標050,Object Coordinates 050
グランゼドーラの母,Mother of Gran Zedora
純喫茶のカウンター,Cafe Counter
潜水服・デフォルト,Default Diving Suit
ウィンターゴーグル,Winter Goggles
ハートの食器棚・桃,Pink Heart Cupboard
ジェントルコート上,Gentleman's Coat
緑のほこらの洞くつ,Green Shrine Cave
アイスダンスのくつ,Ice Dance Shoes
オブジェクト座標130,Object Coordinates 130
破壊魔神兵０７１号,Aztech Guard No. 071
プリマベーラシール,Primavera Sticker
リボンスターの服上,Star Ribbon Top
レンタルドルボード,Rental Dolboard
妖炎魔女のドレス下,Fire Witch Lower Gown
しぐさ書・サクうま,Saku Uma
奇跡のフライパン小,Miracle Frypan S
音符のテーブル・彩,Color Music Table
ディバインメイル下,Divine Mail Bottom
イグナイトメイル上,Ignite Mail Top
イケてる歌詞カード,Cool Lyrics Card
カーディナルナイト,Cardinal Knight
夢見る男のお宝伝説,Dreamer's Treasure Legend
くろがねのよろい上,Darksteel Cuirass
洋ナシのベッド・青,Green Pear Bed
けんぽうぎの作り方,Tussler's Teachings
清廉天使のスーツ下,Honest Angel Pants
赤のキーエンブレム,Red Key Emblem
グレン駅の模型・雪,Glen Stn. Model (Snow)
キュートなイヌミミ,Cute Dog Ears
チュピちゃんのネジ,Chupie's Screw
エージェントブーツ,Agent Boots
マグマの杖のレシピ,Magma Staff Recipe
きまぐれカギしっぽ,Silly Cat Tail
お姫様の食器棚・橙,Princess Cupboard
難民キャンプへの道,Road to Refugee Camp
クルーガーグローブ,Kluger Gloves
ティルツキンの馬車,Tiltzkin's Wagon
学園女子のエプロン,Schoolgirl Apron
キラークリムソード,Crimson Killing Sword
幻界のゆびわの破片,Phantom Ring Shard
ガタラアームズの旗,Gatara Arms Banner
ゴシック調のベッド,Gothic Bed
クロッシュグローブ,Bell Gloves
大いなる砂漠の象徴,Symbol of the Great Desert
マイタウン古代地区,My Town Ancient District
北の渡し守べニーズ,North Ferryman Benize
肖像画「学究の徒」,"Academic" Portrait
お花畑に行きたい！,Go to the Flower Field!
カジノバニーヒール,Casino Bunny Heels
アンティーク扇風機,Antique Electric Fan
ロードリーグローブ,Lordly Gloves
ダーマ神殿のテント,Alltrades Abbey Tent
バージニアステッキ,Virginia Stick
メタスラのチェスト,Metal Slime Chest
りゅうおうハンマー,True Dragonlord Hammer
ＤＱＸショップ印章,DQX Shop Stamps
ふわふわ雲プリズム,Fluffy Cloud Prism
キューベルトの楽譜,Kyubert's Sheet Music
オブジェクト座標257,Object Coordinates 257
祭具・星天の衣折紙,Starry Sky Robe Origami
カーニバルコーデⅠ,Carnival Outfit Ⅰ
王国の悪夢・洞くつ,Kingdom of Terror - Cave
野いちごボンネット,Wild Strawberry Bonnet
魔物管理人アゼルル,Monster Manager Azerul
オブジェクト座標026,Object Coordinates 026
しましまマフラー赤,Red Striped Scarf
オブジェクト座標184,Object Coordinates 184
タータンマフラー赤,Red Tartan Scarf
プラコン・黒い唐傘,Black Paper Umbrella
ビクトリーチップ菜,Vegetable Victory Chip
アンノウンショット,Unknown Bow
エゼソル峡谷への道,Road to Ezesol Canyon
ガイアファンタジア,Gaia Fantasia
シスター・メイデル,Sister Maidel
ＤＱＸ５周年の御旗,5th Anniversary Flag
シュバルツシュルト,Schwarzchuld
燃えるロマンの宝石,Jewel of Burning Romance
未完のラゼアの風穴,Undone Lazea Wind Cave
学園の生徒会室の棚,School Council Shelf
ヘルヴェルトランプ,Helvel Cards
てつのよろいセット,Iron Armor Set
パールキャスケット,Pearl Cap
オブジェクト座標116,Object Coordinates 116
あいじょうオムレツ,Affection Omelet
作ろう！てつよろい,Let's Make Iron Armor!
シーグリーンダリア,Sea Green Dahlia
天稟の祭壇の守護者,Guardian of Aptitude
ゲルト・勇気の儀式,Gert・Ritual of Courage
ジーガンフのうちわ,Jiganf Fan
スライダークメット,Nemeslime Helmet
壁画に刻まれた歴史,Engraved in History
武器屋の家の設計図,Weapon Shop Blueprint
水のはごろもセット,Flowing Outfit
ふんさいのおおなた,Heavy Hatchet
ドラゴンキッズの書,Small Fry Book
ヒールカルボナーラ,Heal Carbonara
カムバックお月様！,Comeback Moon!
エージェントの服下,Agent Coat Bottom
オブジェクト座標088,Object Coordinates 088
ウェットスーツ・白,White Wetsuit
エテーネ王宮の鏡台,Ethene Royal Vanity
悪霊の神々強カード,Apex Evil Trinity Card
ハロウィン衣装券Ⅵ,Halloween Voucher Ⅵ
燃えるほのおの凱歌,Triumph of Flames
万魔の塔・三の災壇,Banma Tower - 3rd Platform
茶柴ピュアカプセル,Pure Brown Shiba Toy
オブジェクト座標196,Object Coordinates 196
キレキレなニッパー,Sharp Clippers
ゴレオン将軍の鉄球,Goreham-Hogg's Flail
ライトニングシール,Lightning Sticker
ファーラット浮き輪,Feralball Floatie
古代魔術のながぐつ,Ancient Magic Boots
ホイミントドレス上,Heal Mint Blouse
アグラニ風たいまつ,Agrani-Style Brazier
白猫オッドカプセル,Odd White Cat Toy
オブジェクト座標142,Object Coordinates 142
プラコンドレス・黒,Black Dress
オブジェクト座標018,Object Coordinates 018
うさみみギフト・赤,Red Rabbit Ears Gift
極天女帝の浮遊椅子,Sky Empress' Floating Chair
エフェクト用ダミー,Dummy Effect
ダイナーズボン衣装,Diner Trousers Outfit
職やりなおしの宝珠,Resetta Stone
そのオノは星を断つ,Go and Axe the Stars
異界滅神ジャゴヌバ,Jagonuba, the Otherworldly Destroyer
スパングルグローブ,Spangled Gloves
フェルアバの大洞穴,Felaba Depths
追憶の武器鍛冶職人,Weaponsmith of Remembrance
幻想画「一喜一憂」,Fantasy Art "Hope and Fear"
はじめての防具鍛冶,Amateur Armorsmithing
オブジェクト座標123,Object Coordinates 123
苺お菓子の間仕切り,Berry Sweet Partition
ハイクラスシューズ,High Class Shoes
パピヨンチェア・幻,Phantom Papillon Chair
キューブレジデンス,Cube Residence
おしゃれな水着・黄,Yellow Snazzy Swimsuit
福まねきのタヌキ像,Good Luck Tanuki Statue
銀のさいほう針の本,Silver Needle Book
アクエリアスガード,Shield of Aquarius
オブジェクト座標105,Object Coordinates 105
ラダトームのよろい,Tantegel Armor
イナミノ街道の木Ｂ,Inamino Highway Tree B
闇の大魔王ローブ下,Archfiend's Lower Robe
水の領界の室内噴水,Water Realm Fountain
プチドン・モグーラ,Frail Don Mole
特製やきにくセット,Deluxe Grilled Meat Set
白霜の流氷野への道,Road to Frosty Floes
お正月ザンクローネ,New Year Zankrone
ヒューザのこころ１,Hyuza's Heart Lv1
魔塔の青い炎の台座,Blue Tower Flame
断罪のジャマダハル,Judgement Katar
白雲の烈翼将ヤヌビ,White Cloud General Yanubi
大魔王城１階のカギ,Demon Lord's Castle 1F Key
奇跡の鍛冶ハンマー,Miracle Hammer
果てなき夢の芸人道,Dream of Entertaining
マジカルスティック,Pixie Stick
コマンダーコート上,Commander Coat Top
花咲ける木工職人道,The Woodworker's Way
森のこびとの切り株,Forest Dwarf Stump
プラコンスーツ・青,Blue Suit
オブジェクト座標057,Object Coordinates 057
ロードリーローブ上,Lordly Robe
コロシアムエントリ,Coliseum Entry
ぼーいもっずこーと,Boy Mod Coat
スノーボールンたち,Snowballon and co.
アリアハンかんむり,Aliahan Circlet
姉神封印神殿　出口,Goddess Seal Temple Exit
メタスラの間仕切り,Metal Slime Partition
必殺チャージ率 +1.0%,Special Charge Rate +1%
カジノ祭５ビンゴ銅,CasinoFest 5 Bingo Brnz
水色チューリップ傘,Blue Tulip Umbrella
初心者用スティック,Beginner's Wand
マイタウン水没地区,My Town Submerged District
ビーナスのほほえみ,Venus' Smile
セクシードレッサー,Sexy Vanity
ウィリーデブレード,Vilide Blade
マスター・バレクス,Guildmaster Barex
鋼鉄巨兵のタトゥー,Iron Giant Tattoo
クリムゾンメイル下,Crimson Mail Bottom
オブジェクト座標215,Object Coordinates 215
シルフウィング・白,White Sylph Wings
キングヒドラ練習札,King Hydra Tag
メリクリギフト・桃,Pink Christmas Gift
魔瘴魂グウィネーロ,Miasma Soul Gwinero
パインのドレッサー,Pineapple Vanity
オブジェクト座標166,Object Coordinates 166
トポルのクラムパイ,Topol Crumb Pie
セクシーギフト・白,White Sexy Gift
マーメイドバスタブ,Mermaid Bathtub
オブジェクト座標194,Object Coordinates 194
第１２回ラウル像庭,12th Rahul Statue (G)
届け！　ありがとう,Thanks for Delivery!
マリン調のキッチン,Marine Kitchen
お姫様間仕切り・桃,Pink Princess Partition
夜の神殿☆探検手帳,Temple of Night Notebook
オブジェクト座標176,Object Coordinates 176
プラズマリムーバー,Plasma Remover
ペンダントを追って,Follow the Pendant
ハクオウのこころ５,Hakuo's Heart Lv5
壁かけマイユ肖像画,Maille Portrait
シルエット・ナイト,Silhouette Knight
アスバルのこころ２,Asbal's Heart Lv2
疾風のサザンクロス,Gale of the Southern Cross
ゴージャスクッキー,Gorgeous Cookies
ベストゼレスタイト,Best Celestite
タータンハンチング,Tartan Hunting Cap
ゴブル砂漠東への道,Road to Goble Desert East
野いちごバスケット,Wild Strawberry Basket
エイルのスティック,Eir's Wand
メロディアトップス,Melody Top
レインボーリキッド,Rainbow Liquid
王宮のキッチン・青,Blue Royal Kitchen
プラコンぐるみ・黒,Black Clothing
ほわいとたきしーど,White Tuxedo
ヒストリカのうちわ,Historica Fan
ギュッとチュラリス,Chularis Arm Doll
本当にあった降魔術,Art of Demon Conquering
三毛ねこの便利な壁,Calico Cat Wall
壁かけロトのつるぎ,Erdrick's Sword Mount
オブジェクト座標044,Object Coordinates 044
赤キノコのテーブル,Red Mushroom Table
オブジェクト座標193,Object Coordinates 193
アマラーク城への道,Road to Amarak Castle
竜と生きるは竜術士,A Dragomancer's Life
オブジェクト座標278,Object Coordinates 278
ラッキーチケット銀,Silver Lucky Ticket
バトルパッツァ・小,Small Battle Pazza
シルエット・DQ1欠番,Silhouette DQ1 Missing #
ドワーフの人形・女,Dwarf Doll (F)
ファラスのうであて,Faras' Armguards
ビビッド・グリーン,Vivid Green
スライダークグラブ,Nemeslime Gloves
深碧の魔壊将ブラゴ,Green Wreck General Brago
アスバルのこころ７,Asbal's Heart Lv7
三毛猫・双カプセル,Calico Cat Twin Toy
オブジェクト座標073,Object Coordinates 073
アニメ塗りフィルム,Anime Paint Film
紫水晶のカーペット,Amethyst Carpet
しましまマフラー青,Blue Striped Scarf
ローラ姫のティアラ,Gwaelin's Tiara
天宮騎士のグリーブ,Sky Knight Greaves
海賊なりきりたき火,Pirate Campfire
ブオーンとナドラガ,Bjorn and Nadraga
ダーマ神殿の荷馬車,Alltrades Abbey Wagon
オブジェクト座標274,Object Coordinates 274
しぐさ書・リュート,Play Lute
オブジェクト座標212,Object Coordinates 212
高機能錬金食品の本,Efficient Alchemy Food Book
しぐさ書・雪の魔法,Snow Magic
青年貴族のコート上,Nobleman's Coat Top
まどうしのころも下,Wizard's Robe Bottom
バスルームのチェア,Bathroom Chair
ベラストル家の彫像,Belastre Sculpture
景品交換所リーニャ,Prize Exchange Linya
バトエンジャーの像,Batoenger Statue
ランカーキャップⅡ,Ranker Cap Ⅱ
さまようよろいの書,Restless Armour Book
トンボ柄のじんべい,Dragonfly Jinbei
しゃしょうやまびこ,Conductor Yamabiko
マタドールスーツ上,Matador Suit Top
ナイトフィーバー緑,Night Fever (Green)
すごろく案内係アミ,Sugoroku Guide Amy
ハニーパーティー！,Honey Party!
三姉妹人形・庭用黄,Yellow 3 Sis. Doll (G)
ドベルニッチの写真,Dobernitch Photo
ジョイフルショコラ,Joyful Chocolate
ザードの尖塔・２階,Zard Spire 2F
ふわふわトラちゃん,Floaty Traeie
しぐさ書・たこ焼き,Takoyaki
シュバリエメイル上,Chevalier Mail Top
第１２回リソル像庭,12th Resol Statue (G)
おとぎの森グローブ,Fairy Forest Gloves
ごうかなラグ中・緑,Green Fancy Rug M
タッツィぬいぐるみ,Tazzi Plushie
レーンの村のアーチ,Rane Village Arch
スライムの間仕切り,Slime Partition
メカニックスーツ下,Mechanic Suit Bottom
トレジャーキャップ,Treasure Cap
グレゴールの洞くつ,Gregor Cavern
トレジャーグローブ,Treasure Gloves
ハスの花ランプ・赤,Red Lotus Lamp
オブジェクト座標015,Object Coordinates 015
エステラのこころ４,Estella's Heart Lv4
表情の書・ドヤがお,Smug
スタジアムキャップ,Stadium Cap
ゆめみの天箱タンス,Dreamy Sky Wardrobe
魔女シュガーのムチ,Witch Sugar's Whip
シルエット・犬・白,White Silhouette Dog
カプサイナイトの服,Capsai Knight's Clothes
フォーチュンブーツ,Fortune Boots
ゾンビブラザーズＡ,Zombie Brother A
戦士のよろいセット,Warrior Armor Set
闇の辺獄への昇降機,Elevator to Dark Edge
花狩人のころも・青,Blue Flower Hunter Outfit
しぐさ書・おそなえ,Offering
まけんしのレイピア,Fizzle Foil
時の指針書レプリカ,Time Guidebook Replica
血潮の浜辺への出口,Exit to Bloody Beach
トロピカルジュース,Tropical Juice
キューブライト・庭,Cube Light (G)
第１回討伐ＴＡ・銀,1st Boss TA Silver
クリムゾンウィング,Crimson Wings
氷の領界のテーブル,Ice Realm Table
オルセコ高地への道,Road to Orseco Highlands
オブジェクト座標234,Object Coordinates 234
初級魔法戦士のくつ,Novice ARM Shoes
邪将トロルバッコス,General Gladiator Troll
ゆめにゅうどうの枕,Napir's Pillow
オブジェクト座標139,Object Coordinates 139
イルシームトランプ,Ilseem Deck
第３回カジノ祭・金,3rd Casino Fest Gold
魔物シールド勲章券,Shield Medal Ticket
くろがねのよろい下,Darksteel Faulds
オブジェクト座標220,Object Coordinates 220
とうめいイレイザー,Transparent Eraser
聖湖ゼニートの暖炉,Zenit Hearth
キューピッド衣装券,Cupid Costume Ticket
キング・カカオの実,King Cacao Fruit
守護天使のガーベラ,Guardian Angel's Gerbera
スノーハーブの花実,Snow Herb Flowers
紫のキーエンブレム,Purple Key Emblem
神具解放の審問宮１,Relic's Reliquary 1
真紅の殺人機械たち,Crimson Killing Machines
ロードリーローブ下,Lordly Skirt
深い森の修道院の柱,Monastery Pillar
ウェディカウンタ大,Weddie Counter L
フローラルダンディ,Floral Dandy
郵便局員ポエーツォ,Postman Poezzo
サーカステントの扉,Circus Tent Door
ヤングガイアコイン,Young Gaia Coin
アンノウンステッキ,Unknown Wand
さざなみギフト・桃,Pink Ripples Gift
シャーマンアックス,Heedoovoodoo Axe
門より出でし者たち,Dwellers from the Gate
獄獣のケープセット,Hell Beast Outfit
オブジェクト座標268,Object Coordinates 268
はくばのおうじの像,Prince Harming Statue
エンシェントククリ,Olde-Worlde Knife
降魔のサークレット,Demonfel Circlet
東洋風透かし窓・雅,Chic Orient Window
オブジェクト座標195,Object Coordinates 195
第９回クマリスの像,9th Kumaris Statue
スカーレットグラス,Scarlet Glasses
マジカルな便利な壁,Magical Wall
労働魔神機０３７号,Aztech Labor Mech No. 037
ギュメイ将軍の太刀,Goresby-Purrvis' Sword
妖炎魔女のグローブ,Fire Witch Gloves
茶トラ太猫カプセル,Fat Brown Tabby Toy
竜将のよろいセット,Dragon General Armor Set
ヤマネコヘアバンド,Wildcat Hairband
ショコラなシューズ,Chocolate Shoes
パラソルスティック,Jolly Brolly
アンルシアのうちわ,Anlucia Fan
緑キノコのテーブル,Green Mushroom Table
オブジェクト座標066,Object Coordinates 066
シュバリエグローブ,Chevalier Gloves
ヴァレリアパラソル,Valeria Umbrella
水晶の小物の作り方,Making Crystal Decor
メルサンディ穀倉帯,Melsandy Millfields
ポセイドンバスタブ,Poseidon Bathtub
オブジェクト座標019,Object Coordinates 019
オブジェクト座標185,Object Coordinates 185
プラコン蝶々セット,Butterfly Set
本棚付きの大きな壁,Bookshelf Wall L
オブジェクト座標192,Object Coordinates 192
エージェントグラブ,Agent Gloves
動くモンスター印章,Animated Monster Stamps
ドラゴンクローの書,Dragon Claws Book
リンクスのオフィス,Lynx's Office
シルエット・猫・白,White Silhouette Cat
あくまのいしょう３,Imp Costume 3
ピクニックダストン,Duston Picnic
スコアアタック銅赤,Score Attack Bronze
グリンガムのレシピ,Gringham Whip Recipe
スターリーキャップ,Starry Cap
シュメリアブラウス,Sumeria Blouse
植物学者の置きかご,Botanist Cage
ウェディの人形・男,Weddie Doll (M)
ゆめみの竜箱タンス,Dreamy Dragon Wardrobe
まどうしのころも上,Wizard's Robe Top
フリーズギフト・灰,Ash Freeze Gift
オブジェクト座標175,Object Coordinates 175
小悪魔王子の短パン,Devil Prince's Shorts
紫炎の滅機将シュバ,Purple Ruin General Shuba
