第２回釣りコン・金,2nd Fish Contest Gold
攻撃時10%暴走アップ,Haywire Up On Attack 10%
しぐさ書・だいこん,Emote "Daikon"
オブジェクト座標030,Object Coordinates 030
しぐさ書・かんおけ,Emote "Coffin"
リボンヘッドドレス,Ribbon Headdress
魔塔の青宝石付き壁,Blue Tower Jeweled Wall
ごうかな花びん・赤,Red Fancy Vase
パピヨンドーム・幻,Phantom Papillon Dome
星くずの灯ろう・紫,Purple Stardust Lantern
オブジェクト座標107,Object Coordinates 107
ウェットスーツ・赤,Red Wetsuit
リポちゃんふうせん,Lipo Balloon
表情の書・わくわく,Expression "Excited"
オブジェクト座標290,Object Coordinates 290
影の深底への昇降機,Elevator to Shadowy Deeps
しぐさ書・シャワー,Emote "Shower"
ザ・キャッツメダル,The Cats Medal
小さな英雄はちがね,Little Hero's Headband
強・キャッツメダル,Apex Cats Medal
タイタス号の望遠鏡,Titus Telescope
千輪菊花火・赤黄桃,Red/Yel./Pink Fireworks
妖魔のまなざし事件,The Demon's Gaze Incident
結界の守護者カード,Barrier Guardians Card
ウェットスーツ・白,White Wetsuit
死霊姫ヤサギリたち,Dead Princess Yasagil
舞い手のヘアバンド,Performer's Hairband
ファラスのうであて,Faras' Armguards
いっぱつのてぶくろ,One Shot Gloves
聖夜のエントランス,Holy Night Entrance
防衛魔神兵０５３号,Aztech Guard No. 053
くらげドレスセット,Jellyfish Dress Set
ＭＰ消費しない率+4%,MP Saver +4%
雑貨屋さんの屋根茶,Brown Shop Roof
オブジェクト座標278,Object Coordinates 278
お姫様キッチン・桃,Pink Princess Kitchen
ももんじゃプリズム,Platypunk Prism
グリーターデーモン,Greeter Daemon
クイーン釜プリズム,Queen Pot Prism
プチドラゴンガイア,Frail Gaia Dragon
アスバルのこころ２,Asbal's Heart Lv2
採掘現場地区への道,Road to Mining Site
アルウェーン管理棟,Alweyn Admin Building
しぐさ書・たけのこ,Emote "Bamboo Shoot"
魔瘴石のネックレス,Miasmite Necklace
ギュッとスライム強,Vicious Slime Arm Doll
第２回カジノ祭・銀,2nd Casino Fest Silver
再しぐさ書・ピース,Emote "Peace" v2
ＤＱＸショップ印章,DQX Shop Stamps
チームアジトの外観,Team Hideout Exterior
お姫様オーブン・桃,Pink Princess Oven
ハロウィン衣装券Ⅵ,Halloween Costume Tkt Ⅵ
妖炎魔女のパンプス,Fire Witch Shoes
あやかしの魔弓伝説,Apparition Bow Legend
レジェンズフラッグ,Legends Flag
オブジェクト座標112,Object Coordinates 112
しぐさ書・ガクブル,Emote "Tremble"
黒パールコンパクト,Black Pearl Compact
クロッシュシューズ,Bell Shoes
キラーマジンガの剣,Uberkilling Sword
秘宝のガーディアン,Treasure Hunter Mech
クラッシュチェーン,Crusher Chain
新春虎の子のお年玉,New Year Gift of the Tiger
ルミナスギフト・桜,Pink Luminous Gift
魔物三度笠チケット,Sandogasa Ticket
しぐさ書・空気イス,Emote "Air Chair"
ダンシングライト紫,Dancing Light (Purple)
ウイングエッジの本,Razor-Wing Book
レンジャー協会本部,Ranger Association HQ
フューリーブレード,Fury Blade
ピンクダマスクの柱,Pink Damask Pillar
焼きたてパンセット,Fresh Baked Bread Set
天ツ風の原への出口,Exit to Howling Highlands
表層・サフィア宙橋,Surface - Saphia Bridge
エルドナ神のぞうり,Eldona's Sandals
星のおうぎのレシピ,Stellar Fan Recipe
シルエット・五種族,Silhouette 5 Tribes
ヒューザのこころ１,Hyuza's Heart Lv1
デビルアーマー・強,Vicious Harmour
サマーなカンカン帽,Summer Can-Can Hat
アームライオン・強,Vicious Hellion
タホドラキーぼうし,Drackmage Hat
ごうかな食器棚・緑,Green Fancy Cupboard
王宮の魔法戦士たち,Royal Palace Armamentalist
若手芸人のバンダナ,Young Talent Bandana
ピクニックパルミオ,Palmio Picnic
水の領界のかがり火,Water Realm Brazier
クロスペンデュラム,Cross Pendulum
イカしたＴシャツ黄,Yellow Cool T-Shirt
はんじゅくスライム,Soft Boiled Slime
赤熱の荒野への出口,Exit to Red Hot Desert
タータンハンチング,Tartan Hunting Cap
フォステイルソファ,Fostail Sofa
試みの荒野への出口,Exit to Wilderness of Trials
洋ナシのベッド・青,Green Pear Bed
ザンクローネソファ,Zankrone Sofa
オブジェクト座標186,Object Coordinates 186
支援魔神機０２５号,Aztech Support Mech No. 025
ゼドラ王国服モブ１,Zedra Royal Clothes Mob 1
オラクルギフト・桃,Pink Oracle Gift
護りの盾のグローブ,Gloves of Protection
マリン調のオーブン,Marine Oven
スコアアタックボス,Score Attack Boss
スコーピオンテイル,Scorpion Tail
ウサぐるみ衣装券Ⅲ,Rabbit Costume Ticket Ⅲ
ザードの尖塔・６階,Zard Spire 6F
さとりのころもの書,Clarity Outfit Book
うさみみソルジャー,Rabbit Soldier
あやしいテーブル大,Suspicious Table L
イチゴのクッション,Strawberry Cushion
オブジェクト座標085,Object Coordinates 085
真・幻界諸侯練習札,True Dread Fiends Tag
王宮の間仕切り・青,Blue Royal Partition
ビクトリーチップ青,Blue Victory Chip
しぐさ書・からあげ,Emote "Fried Chicken"
真・魔幻宮殿の篝火,Demon Palace Flame
しゅうれん用ブーツ,Training Boots
モダンローズドレス,Modern Rose Dress
ダイナースニーカー,Diner Sneakers
モダンバニースーツ,Modern Bunny Suit
夜宴館の目玉つき扉,Banquet Door with Eye
ボルテージアックス,Voltage Axe
ステージチュチュ上,Stage Tutu Top
コンシェルジュ０２,Concierge 02
星石に隠された秘密,Secret in the Meteorite
オブジェクト座標094,Object Coordinates 094
ギガントヒルズ・強,Vicious Drakularge
ドミネウス邸のイス,Domineus Mansion Chair
ポセイドンオブジェ,Poseidon Curio
テント風の家の外観,Tent House Exterior
郵便局員エッキョウ,Postman Ekkyo
りょうりにんめるる,Chef Merle
シルバリヌスのツボ,Silverine Pot
アイスダンス衣装券,Ice Dance Outfit Ticket
シュバリエメイル下,Chevalier Mail Bottom
ハングリーハンター,Hungry Hunter
青のほこらの洞くつ,Blue Shrine Cave
アイスダンスズボン,Ice Dance Pants
モッズコート衣装券,Mod Coat Costume Ticket
凶拳は天を超えるか,Evil Fist Crosses Heaven
アンドレアルカード,Rashaverak Card
プラコンスーツ・青,Blue Suit
超おたから花ルビー,Ruby Treasure Flower
オブジェクト座標159,Object Coordinates 159
王宮のキッチン・赤,Red Royal Kitchen
いたずらウサギの畑,Naughty Rabbit Field
ラッキーマシュマロ,Lucky Marshmallows
黒柴モダンカプセル,Hip Black Shiba Toy
黄金のみたらし団子,Golden Mitarashi Dango
森林警備隊グローブ,Forest Ranger Gloves
モダンバニーフレア,Modern Bunny Skirt
純真天使のドレス上,Pure Angel Dress Top
暗黒大樹の番人たち,Dark Tree Guardians
アジサイじんべい下,Hydrangea Jinbei Bottom
ハートの兵隊の服下,Heart Soldier Pants
シャーマンシールド,Heedoovoodoo Shield
大きなお花のベッド,Large Flower Bed
タービア草原への道,Road to Turbia Meadows
おどるほうせきたち,Goodybags
パドレ救出大作戦！,Padre Rescue Operation!
消えることのない炎,Unquenchable Flames
フカフカのもみガラ,Fluffy Rice Husks
ふわあまアーモンド,Soft Almond
ゴールドマンＭＡＸ,Gold Golem MAX
はじゃのろーぶきん,Gold Champ Robe
メタスラのバスタブ,Metal Slime Bathtub
パンプキンポンチョ,Pumpkin Poncho
シュバリエメイル上,Chevalier Mail Top
道具鍛冶職人の選択,Toolsmith's Choice
ドラグーンメイル上,Dragoon Mail Top
青色サイネリアの傘,Blue Cineraria Umbrella
レトロなポスト・赤,Red Retro Mailbox
氷の領界の光る結晶,Ice Realm Glow Crystal
ビクトリーチップ刻,Time Victory Chip
神具解放の審問宮２,Sanctuary of Divine Relics 2
ロイヤルマシュマロ,Royal Marshmallows
ミイラエルフ人形女,Mummy Elf Doll (F)
メレアーデウィッグ,Mereade Wig
あくまのいしょう３,Imp Costume 3
花狩人の衣装券・緑,Green Flower Hunter Tkt
トーマ青年の剣鞘無,Sword Unsheathed Toma
お花のパーカー水着,Flower Hoodie Swimsuit
キュートなイヌミミ,Cute Dog Ears
ちっちゃな恋の物語,A Tale of Tiny Love
魔物管理人のぼうし,Monster Manager Cap
オブジェクト座標220,Object Coordinates 220
ゴールデンアロワナ,Golden Arowana
ヴァンガードハット,Vanguard Hat
獣魔ローガストの像,Logast Statue
アンチイエローバー,Anti-Yellow Bar
プラコンスーツ・白,White Suit
マリンスライム・強,Vicious Seaslime
プティラグアスの像,Petit Raguas Statue
踊り神ボニータ左羽,Dance God Bonita Left Wing
フリルスイムパンツ,Frill Swim Trunks
紫水晶のテーブル小,Amethyst Table S
青狼鬼グルバレイダ,Grubareyda, the Blue Wolf
スカーレットコート,Scarlet Coating
中層・サフィア宙橋,Middle - Saphia Bridge
ウェディングチェア,Wedding Chair
ハイクラススーツ上,High Class Suit Top
メタスラボスメダル,Metal Slime Boss Medal
しぐさ書・メタキン,Emote "Metal King"
しょうじょたんてい,Girl Sleuth
蘇りしバサグランデ,Risen Bogan
モーモンのランタン,Teeny Sanguini Lantern
ドレスを追い求めて,In Pursuit of the Dress
大型の四角い水そう,Square Aquarium L
ランドン山脈への道,Road to Landon Mountains
予言者学園女学生靴,FTA Shoes (F)
取りよせ商ドロフィ,Collection Merchant Dorofi
格闘場・闘いの広間,Arena - Monstrous Pit
ポセイドンチェスト,Poseidon Chest
ハートのオルゴール,Heart Music Box
扉つきアーチ型の壁,Arched Wall with Door
旅芸人ピュージュＪ,Minstrel Pyuju J
童話の街並みの街灯,Fairy-Tale Lamppost
チョコっとシューズ,Choco Shoes
ビクトリーボックス,Victory Box
ブレスドガナッシュ,Blessed Ganache
入学案内係フラッセ,Admissions Guide Flasse
アクロバットスター,Rough 'n' Tumble
新作家具屋ハズカム,New Indoor Furniture Shop Hazcam
アスバルのこころ５,Asbal's Heart Lv5
小悪魔王子ステッキ,Devil Prince's Stick
タコヤキメットの像,Takopot Statue
ダラズ採掘場への道,Road to Daraz Quarry
スーパースターの証,Noscar
サーカステントの家,Circus Tent House
強戦士の聖域・前室,Warrior's Sanctuary - Gate
いしにんぎょう・強,Vicious Dirty Dogu
うつしよの金箱・改,Worldly Gold Box+
天使人形ルーミリア,Angel Doll Lumeria
ゴーレムぬいぐるみ,Golem Plushie
オブジェクト座標073,Object Coordinates 073
ニューＶロンコイン,New Vron Coin
ネオン・縦メーター,Neon Vertical Meter
ゴレオン将軍コイン,Goreham-Hogg Coin
紫電とどろく時は今,Purple Lightning Time
勇者と盟友の肖像画,Hero and Ally Portrait
全職かいふく魔力+20,Magical Mending +20
オブジェクト座標190,Object Coordinates 190
カジノ祭６ビンゴ銀,CasinoFest 6 Bingo Silver
Ｓジェネラルカード,Shogum Card
ウィザード鏡台・白,White Wizard Vanity
花咲ける木工職人道,The Woodworker's Way
攻撃時10%で魔導の書,Magic Book Attack 10%
オブジェクト座標016,Object Coordinates 016
筆頭研究員のブーツ,Top Researcher Boots
たれ灰太猫カプセル,Fat Lazy Ash Cat Toy
レーンの村のアーチ,Rane Village Arch
ぬいぐるみ屋ビスカ,Plushie Shop Bisca
オルファの丘への道,Road to Orpha Hill
栄光の騎士道指南書,Glorious Chivalry Guide
プチドン・モグーラ,Frail Don Mole
アスバルのこころ３,Asbal's Heart Lv3
ふかふかないしょう,Hatching Outfit
ドラゴンクローの書,Dragon Claws Book
オブジェクト座標147,Object Coordinates 147
ディバイングローブ,Divine Gloves
まめに働く天使たち,Diligent Angels
スイゼン湿原への道,Road to Suizen Marsh
かっぱえび家の甲羅,Kappa Ebisen Shell
魔幻園マデッサンス,Demon Park Madessaince
ガーデニングセット,Gardening Set
レーナム緑野の木柵,Lenam Fields Wood Fence
ギュッとウシぐるみ,Cow Arm Doll Plush
降魔のサークレット,Demonfel Circlet
ポーズ書・釣り仙人,Pose "Fish Hermit"
ギュッとリルチェラ,Lilcherat Arm Doll
オブジェクト座標266,Object Coordinates 266
闇芸人ルルルリーチ,Relulu
異界将軍ゲルニック,Hootingham-Gore, the Otherworldly
ドラゴンキッズ・強,Vicious Small Fry
キラーマシンヘルム,Killing Machine Helm
Ｖジャンプの仮面改,V Jump Mask v2
モーモンぬいぐるみ,Teeny Sanguini Plushie
キューピッドの噴水,Cupid Fountain
初級魔法戦士グラブ,Novice ARM Gloves
クリスマスレンタ頭,Christmas Rental Head
打ち上げ柳花火・赤,Red Willow Firework
オブジェクト座標158,Object Coordinates 158
おそうじ童子のこん,Sweepy Samurai Rod
カボチャのキッチン,Pumpkin Kitchen
色飾りタイルの本棚,Color Tile Bookshelf
ヴィスタリア姫の机,Princess Vistaria Desk
オブジェクト座標261,Object Coordinates 261
アシュレイトランプ,Ashley Cards
オブジェクト座標246,Object Coordinates 246
ヒールカルボナーラ,Heal Carbonara
オブジェクト座標161,Object Coordinates 161
お祝い１０連発花火,10 Celebratory Fworks
メタスラの間仕切り,Metal Slime Partition
アンティーク風の柱,Antique Pillar
正しくて優しい強さ,Just and Gentle Strength
幻界の四諸侯練習札,Dread Fiends Tag
ゼブラパーカー水着,Zebra Hoodie Swimsuit
ヴァンガードグラブ,Vanguard Gloves
サジェのオルゴール,Sajay Music Box
まのギフトボックス,Demon Gift Box
フューチャースーツ,Future Suit
スライムのチェスト,Slime Chest
謎の生き人形の写真,Mystery Lively Doll Photo
ひとくいドールたち,Man-Eating Dolls
オブジェクト座標076,Object Coordinates 076
学園の生徒会室の棚,School Council Shelf
セルケトのブローチ,Serket's Brooch
オブジェクト座標202,Object Coordinates 202
天宮騎士のよろい下,Sky Knight Bottom
アンノウンハンマー,Unknown Hammer
コマンダーコート上,Commander Coat Top
シュガーナイトの服,Sugar Knight's Clothes
魔瘴魂ゼノドラゴン,Miasma Soul Xenodragon
メレアーデキッチン,Mereade Kitchen
マジックルーレット,Magic Roulette
タコメットの釣り傘,Octopot Umbrella
ポーリアにおまかせ,Leave it to Paulia
ランカーキャップⅠ,Ranker Cap Ⅰ
エレメントブースト,In the Element
ゆめみの闇箱タンス,Dreamy Dark Wardrobe
おまじない師プポペ,Charmer Pupope
ヴィーラのころも下,Vila's Garment Bottom
ダミーうでＥ００１,Dummy Hand E001
グレイツェルソファ,Gretzel Sofa
プラチナ錬金ランプ,Platinum Alchemy Lamp
天駆ける冒険者たち,Soaring Adventures
ほこらの祭祀場・闇,Dark Shrine Ritual Ground
偽りのレンダーシア,False Lendersia
星花火モビール・庭,Star Fworks Mobile (G)
人面樹ぬいぐるみ小,Treeface Plushie S
代理人レレッポの像,Agent Releppo Statue
カースドシャワー用,Cursed Shower
プチデビルスーツ下,Petit Devil Pants
賢者のころもセット,Sage Outfit
ユシュカのこころ７,Yushka's Heart Lv7
ハロウィン衣装券Ⅳ,Halloween Costume Tkt Ⅳ
キラーマシン便せん,Killing Machine Paper
竜の頭の石像の写真,Dragon Head Statue Photo
マスターの一番弟子,Master's Top Disciple
オブジェクト座標282,Object Coordinates 282
ビクトリーチップ闇,Dark Victory Chip
花狩人のころも・黄,Yellow Flower Hunter Outfit
チームおにごっこ帽,Team Tag Cap
バトマスアーマー上,Battlemaster Chest
ヴァルハラグローブ,Valhalla Gloves
大森林のレンジャー,Great Forest Ranger
ダイナーズボン衣装,Diner Trousers Outfit
ナイトメアファング,Nightmare Fang
アンノウンシールド,Unknown Shield
きらめく星の贈り物,Twinkling Star's Gift
ストームタルト・小,Small Storm Tart
花菱模様のノンラー,Floral Pattern Non La
ピッカピカのレンズ,Sparkling Lens
黒衣の剣士のブーツ,Dark Swordsman Boots
ナルビア武器屋の槍,Nalbia Shop Spear
ドルワーム研究員服,Dolworm Research Suit
エンゼルスラネオン,Angel Slime Neon Sign
おめかしＶチケット,Dress-up V Ticket
初級・魔力錬金の本,Beginner Magic Power
メデューサウィッグ,Medusa Wig
リソルのおまねキー,Resol's Copied Key
オブジェクト座標183,Object Coordinates 183
アイスダンスのくつ,Ice Dance Shoes
第４回釣りコン・金,4th Fish Contest Gold
古グランゼドーラ領,Old Gran Zedora Territory
グレースギフト・桃,Pink Grace Gift
吊るし潜水艦ライト,Submarine Hanging Light
ふわふわジョニール,Fluffy Joneal
ドット階段柄のラグ,Stairs Rug
闇の領界の有毒植物,Dark Realm Toxic Plant
武爪遊戯・断罪の章,Judgement Katar Book
花狩人のころも・緑,Green Flower Hunter Outfit
発信機イヤリング型,Earring Type Transmitter
ブロンズブーメラン,Bronze Boomerang
チョコファウンテン,Choco Fountain
ウィキッドスーツ下,Wicked Suit Bottom
カルデア山道の横穴,Chaldea Mountain Road Cave
レラージェアックス,Leraje Axe
ソルシエールの服下,Sorciere's Bottoms
偽りのエテーネの島,False Ethene Island
Ｖジャンプベレー改,V Jump Beret v2
マスター・クレップ,Guildmaster Krepp
星辰武王の最終試練,Star Warrior's Last Trial
ごうかな食器棚・赤,Red Fancy Cupboard
シビュラスティック,Sibyl Stick
サイクロンアッパー,Air Raiser
ファフニルメイル下,Fafnir Mail Bottom
コタツでメレアーデ,Mereade Kotatsu
オブジェクト座標170,Object Coordinates 170
しぐさ書・ガリバー,Emote "Gulliver Hand"
オブジェクト座標035,Object Coordinates 035
紫水晶のテーブル大,Amethyst Table L
始源の歌姫のドレス,First Diva's Dress
スノースターリボン,Snowstar Ribbon
花菱模様のアオザイ,Floral Pattern Ao Dai
メタル天馬プリズム,Metal Tantamount Prism
ヴァルハラメイル上,Valhalla Mail Top
フォンデュフォーク,Fromage Fray Fork
セーラススティック,Selas Wand
スイゼン湿原の木Ａ,Suizen Marsh Tree A
氷の魔王のスーツ下,Ice Demon Suit Bottom
ウィリーデショット,Vilide Shot
レッドブレイクグミ,Red Break Gummy
庭用ハロウィンの墓,Halloween Tombstone (G)
ケキちゃんカプセル,Cakey Toy
行動時20%バイシオン,Oomph On Action 20%
オブジェクト座標019,Object Coordinates 019
カジノバニーヒール,Casino Bunny Heels
ボトルシップの置物,Ship in a Bottle
男性もみじのゆかた,Maple Yukata (M)
エターナルガーデン,Eternal Garden
聖者のほういセット,Saint's Outfit
ラダトームのつるぎ,Tantegel Sword
妖炎魔女のグローブ,Fire Witch Gloves
ターボル峡谷への道,Road to Tabor Gorge
タウン案内係カーサ,Town Guide Casa
光の錬金ランプの本,Light Alch Lamp Book
ゆめみの金箱タンス,Dreamy Gold Wardrobe
ロードリーローブ下,Lordly Robe Bottom
ヤングガイアコイン,Young Gaia Coin
ゴーレムのきぐるみ,Golem Costume
マッドルーパー・強,Vicious Axolotl
ユシュカぬいぐるみ,Yushka Plushie
オブジェクト座標060,Object Coordinates 060
異界獣ヘイズバット,Haze Bat, the Otherworldly
さざなみギフト・桃,Pink Ripples Gift
切り替わり物干し台,Switchable Clothesline
プラチナ錬金ツボ小,Platinum Alch Pot S
花狩人のころも・紫,Purple Flower Hunter Outfit
レグルの記憶の結晶,Regul's Memory Crystal
はじゃのよろいぎん,Silver Champ Armor
セピアのアイリ人形,Sepia Aili Doll
ジェスタースーツ下,Jester Suit Bottom
エルボブ像白グレー,W/G Eltona Bobtail St.
バットエンドのラグ,Bato-End Rug
おうち用野道のラグ,Field Path Rug
第９回ラグアスの像,9th Raguas Statue
夢のスティック物語,Fantastick Story
オブジェクト座標010,Object Coordinates 010
暴君バサグランデ強,Apex Tyrant Bogan
スウィートビキニ白,White Sweet Bikini
樹天の里へのはしご,Ladder to Treetop Town
せいどうのよろい上,Bronze Armor Top
とうめいイレイザー,Transparent Eraser
サラムのブーメラン,Salam's Boomerang
海底デイジーの花束,Undersea Daisy Bouquet
赤のほこらの洞くつ,Red Shrine Cave
第７回釣りコン・銅,7th Fish Contest Bronze
ダンサーヘアバンド,Dance Hairband
福まねきのタヌキ像,Good Luck Tanuki Statue
神託のローブセット,Oracle Outfit
小辛翼竜バードアイ,Hot Pterosaur
キャット・リベリオ,Purrgatroyd
フルーツバスケット,Fruit Basket
城主ダストンチェア,Duston Chair
ワラタローカプセル,Warataro Toy
ウィザードバス・白,White Wizard Bath
ドワチャッカの秘宝,Dwachakka's Treasure
幸せのご近所バトン,Happy Neighborhood Baton
ごうかなベッド・緑,Green Fancy Bed
エステラのこころ３,Estella's Heart Lv3
スピリットフレイム,Spirit Flame
壁かけフウラ肖像画,Fuura Portrait
オブジェクト座標038,Object Coordinates 038
お庭用グリッドラグ,Grid Rug (G)
伝説の防具を求めて,Wish for Legendary Armor
封印危機対策委員会,Sealing Crisis Committee
チョッピ荒野の木Ｂ,Choppi Wilderness TreeB
地獄のトリコロール,Tricolor of Hell
お正月ザンクローネ,New Year Zankrone
異界獣ヘイズバイオ,Haze Bio, the Otherworldly
ラディカルシールド,Radical Shield
スラタワーステッキ,Slime Stack Stick
カボチャテーブル小,Pumpkin Table S
聖銀のどくろあらい,Sacred Silver Haardvark
黒のキーエンブレム,Black Key Emblem
スライム柄の浮き輪,Slime Pattern Floatie
ホイミントドレス上,Heal Mint Blouse
アシッドクリスタル,Acid Crystal
トーテムぬいぐるみ,Totem Plushie
師団長の七つの教訓,Commander's Lessons
白蛇のこんの作り方,Make a White Snake Rod
レモンスライムの柱,Lemon Slime Pillar
メレアーデの便せん,Mereade Paper
白パールコンパクト,White Pearl Compact
ゴージャスクッキー,Gorgeous Cookies
エンタシスマン・強,Vicious Prancing Pillar
メタスラの大剣の本,Metal Gooreatsword Book
ハンマー屋トカチャ,Hammer Shop Tokacha
キラキラねこまどう,Glittering Meowgician
ハスの花ランプ・緑,Green Lotus Lamp
鉄巨兵ダイダルモス,Iron Giant Daedalmos
壁かけ忌まわしき絵,Abominable Painting
ゼドラ王国服モブ７,Zedra Royal Clothes Mob 7
ライガークラッシュ,Wild Animaul
ミッドナイトの花束,Midnight Bouquet
景品交換所マディア,Prize Exchange Madia
ほこらの祭祀場・氷,Ice Shrine Ritual Ground
薬草戦士と豊かな土,Herbal Warrior & Rich Soil
オブジェクト座標279,Object Coordinates 279
しぐさ書・まぶしい,Emote "Dazzling"
オーガお花見セット,Ogre Cherry Picnic
三毛猫スーツ衣装券,Calico Cat Suit Ticket
見覚えのあるドレス,Familiar Dress
オブジェクト座標079,Object Coordinates 079
領界調査バインダー,Realm Survey Binder
ヴァルハラグリーブ,Valhalla Greaves
オブジェクト座標273,Object Coordinates 273
スライダークコイン,Nemeslime Coin
マジックファンの本,Magic Fan Book
マスカレイドブーツ,Masquerade Boots
ミラーガントレット,Mirror Gauntlets
はいくらすいしょう,High Class Outfit
ギルガランのピアス,Gilgaran's Earrings
クラシカルトップス,Classical Top
守護天使のガーベラ,Guardian Angel's Gerbera
パンジーのビスチェ,Pansy Bustier
歌詠みのヘアバンド,Poet's Hairband
ドワーフカウンタ小,Dwarf Counter S
チョッピ荒野への道,Road to Choppi Wilderness
精霊王のクローク上,Faerie King Cloak
第９回クマリスの像,9th Kumaris Statue
超天遊戯－死の書－,Chosen's Teachings Book 4
暗黒の魔人強カード,Apex Ruin Card
じゃんぼりぃの帽子,Janbori's Hat
ビクトリーチップ銅,Copper Victory Chip
おとぎの森スカート,Fairy Forest Skirt
おとぎの森ブラウス,Fairy Forest Blouse
おうち用水辺のラグ,Waterside Rug
自立型サンドバッグ,Standing Punching Bag
金のチキ坊カプセル,Golden Chickibo Toy
ウィキッドスタッフ,Wicked Staff
夏の恋は泡のごとく,Summer Love, Like a Bubble
前ウェーブつけ毛Ａ,Front Wavy Hairpiece A
ふっかつのじゅもん,Spell of Restoration
しぐさ書・あらまあ,Emote "Oh My!"
マリン調のバスタブ,Marine Bathtub
オブジェクト座標100,Object Coordinates 100
しぐさ書・グレドラ,Emote "Great Dragon"
レインスカート・白,White Rain Skirt
第３回アルウェの像,3rd Alwe Statue
ランカーキャップⅢ,Ranker Cap Ⅲ
プラコンドレス・青,Blue Dress
オブジェクト座標288,Object Coordinates 288
伝説の三悪魔練習札,Legendary Evils Tag
ふたつ結びエクステ,Double Knot Extension
スタジアムシューズ,Stadium Shoes
オーガＧＰプリズム,Ogre GP Prism
しぐさ書・お祝い黄,Emote "Celebrate Ylw."
ティンクルカプセル,Tinkle Toy
燃えるロマンの宝石,Jewel of Burning Romance
第９回ハクオウの像,9th Hakuo Statue
サニーアンクレット,Sunny Anklet
