ウェディチェスト,Weddie Chest
親分ザメの浮き輪,Boss Shark Floatie
ズワイガニファン,Snow Crab Fan
フォレストドラゴ,Lumbering Lizard
メタスラのベッド,Metal Slime Bed
プチテンタコルス,Frail Abyssal Octopot
深遠なるぱふぱふ,Profound Puff-puff
ラン錬作業ベスト,Lamp Alchemist's Vest
アメジストの置物,Amethyst Ornament
クリスマスライブ,Christmas Live
しぐさ書・ギター,Play Guitar
邪神ヤファギル戒,Yaphagil, the Precept
ブレイクスタイル,Break Style
高価なゴブレット,Expensive Goblet
フサフサの白ヒゲ,Fluffy White Mustache
バドリー岩石地帯,Budley Rock Zone
パワフルニンニク,Powerful Garlic
マダムの店の緞帳,Madame's Shop Curtain
大地の竜玉の破片,Earthwyrm's Eye Shard
魔天匠レスヘヴン,Master Les Haven
案内係ノレイジャ,Guide Noreija
サメきぐるみ・青,Blue Sharksuit
ハリケーンエッジ,Blusterang
ふういんのダンス,Dance of Sealing
カルサドラ溶岩洞,Calsadora Pyroduct
闇騎士のよろい下,Dark Knight Lower Armor
スラタワーパンツ,Slime Stack Bottom
トランプグローブ,Tycoon Gloves
ヒューザトランプ,Hyuza Cards
ヴァイパーコート,Viper Coat
かしのブーメラン,Birchwood Boomerang
強者賞トロフィー,Strongman Trophy
ハルファスの紋章,Halphas Crest
ゴールドデーモン,Gold Daemon
しびれくらげ１８,Man o' War 18
ランプ錬金職人帽,Lamp Alchemist's Hat
スライムベスラグ,She-Slime Rug
王国の見張り塔前,Kingdom Watchtower
ゴスバニーパンツ,Goth Bunny Pants
白木のパーティ机,Plain Party Table
ヴァース山林地帯,Verse Mountain Forest Area
竜将アンテロたち,Dragon General Antelo
劇場職員ディガロ,Staff Digaro
シスター・トルテ,Sister Torte
甘いシロップビン,Sweet Syrup Bottle
カンフードレス下,Kung Fu Dress Bottom
タダ土地チケット,Free Plot Ticket
ファラオ・ニビス,Pharaoh Nibis
ハロふわホイミン,Halloween Healie
転送係エグバート,Transfer Agent Egbert
防衛軍の制服・金,Gold Defense Force Suit
魔勇者アンルシア,Anlucia, Hero of Evil
合唱隊のシューズ,Choir Shoes
アズラン宿屋の家,Azlan Inn House
不滅の闘士のオノ,Axe of the Immortal
ダル・ジャムール,Dar Jamal
よろず屋ヤップイ,General Shop Yapui
とこなつシューズ,Summer Shoes
札強化屋ラベロー,Card Enhancer Rabero
クマリスのブーツ,Kumaris' Boots
色見本・やまぶき,Golden Yellow Swatch
シスター・パパラ,Sister Papala
どくろあらい・強,Vicious Haardvark
デスマスグローブ,Death Master Gloves
魔物管理人メリュ,Monster Manager Meryu
はじまりの地の木,Land of Beginnings Tree
スタジアムリスト,Stadium Wristbands
学長マスカレイド,School President Masquerade
ギュッとウリボー,Wild Boar Arm Doll
鉱石の燭台ランプ,Ore Candlestick lamp
魔天海フォルネー,Sky Ocean Folnay
栄光のローブ・金,Gold Glory Robe
魔幻都市の便せん,Phantom City Paper
旬の黄金本マグロ,Seas. Gold Bluefin Tuna
ヤマカミヌの木簡,Yamakaminu Wood Letter
ほのおのグリーブ,Flame Greaves
エテーネルリング,Ethenel Ring
極天女帝のぼうし,Sky Empress Hat
星石のハルバード,Meteorite Halberd
赤宝箱のチェスト,Red Treasure Chest
究明者のグローブ,Research Gloves
カボチャランタン,Pumpkin Lantern
オレンジと白の傘,Orange/White Umbrella
ビーナスステップ,Venus Step
リンベリィのくつ,Linberry's Shoes
星空のベッド・青,Blue Starry Bed
天使の弓のレシピ,Angel's Bow Recipe
ＣＭ用ウェディ１,Weddie For CM 1
ハンモックベッド,Hammock Bed
参の式修了の陽符,Yang III Completion Charm
しょこらなどれす,Chocolate Dress
ボイスレコーダー,Voice Recorder
荒波サーフパンツ,Rough Sea Surf Shorts
出張購買員パタタ,Team Supplier Patata
赤い金魚と金魚鉢,Red Goldfish in Bowl
ウィンターブーツ,Winter Boots
カムシカカプセル,Azlantelope Prism
オジャロスの部屋,Ojalos's Room
３段ブロック・赤,Red 3-Step Block
壁かけ四季の丸窓,4 Seasons Round Window
奇門遁甲の式・壱,1st Divination Ceremony
第３回魔勇者の像,3rd Evil Hero Statue
デビルンチャーム,Devil's Delight
あったかセラフィ,Warm Seraphi
キュルルのポスト,Kyururu Mailbox
東洋風ベッド・華,Floral Orient Bed
こげ茶猫カプセル,Olive Cat Toy
丸いランタンの木,Round Lantern Tree
ウェディ風アーチ,Weddie-Style Arch
プリンセスニャン,Princess Cat
アスバルへの親書,Official Letter to Asbal
女神ルティアナ像,Lutiana Statue
ダークネビュラス,Dark Nebulus
セラフィの便せん,Seraphi Paper
複数魚水そう・小,Multi-Fish Aquarium S
バレットハンマー,Bullet Hammer
パピヨンクラウン,Papillon Crown
レオパードビキニ,Leopard Bikini
幻界闘士のゆびわ,Phantom Fighter Ring
グランゼドーラ城,Gran Zedora Castle
悪意の源への通路,Path to the Source of Malice
ノクトルグローブ,Nocturne Gloves
サバイバルスキル,Ruggedness skill
ランドインパクト,Crackerwhack
キャプテンの眼帯,Captain's Eyepatch
シールドブレイク,Shattershield
ファラスのズボン,Faras' Pants
せいどうのつるぎ,Bronze Sword
つりしのいしょう,Angler's Costume
セラフィのうちわ,Seraphi Fan
Ⅱ‐スペーディオ,Ⅱ‐Wulfspade
バラレースはかま,Rose Lace Hakama
預かり所パリュス,Storage Paruse
トライドグローブ,Battle-born Gloves
エテーネルスープ,Ethenel Soup
クロックアッパー,Overclocker
カエルパーカー下,Frog Shorts
預かり所ヤムジク,Storage Yamujiku
破砕将のハンマー,Crush General's Hammer
トレジャーデモン,Treasure Demon
ウルベア地下遺跡,Ruins of Urbea
友情の彫像の写真,Friendship Sculpture Photo
ジングルガーター,Jingle Garter
しょうにんかりま,Merchant Karima
ヴァルハラの館へ,To Valhalla Hall
お姉さまの髪飾り,Debora's Flowers
棺桶クローゼット,Coffin Closet
原始獣のコート上,Primal Beast Coat
ドラパンクネイル,Dracky Punk Nails
メロディアセット,Melody Outfit
魔獣ネロスゴーグ,Demon Beast Nerosugog
あたまリボン桃券,Pink Head Ribbon Ticket
グロリアス衣装券,Glorious Outfit Voucher
カツオの山賊焼き,Grilled Skipjack Tuna
アラビアン衣装券,Arabian Outfit Voucher
フローズンバード,Icebird Throw
魔瘴魂オジャロス,Miasma Soul Ojalos
リドのタリスマン,Lido's Talisman
紫獅鬼バイロゼオ,Byrozeo, the Purple Lion
きれいな釣りざお,Beautiful Fishing Rod
凶拳暴鬼ダルカス,Darkas
ローズプリンセス,Rose Princess
乱破の忍び装束上,Spy's Ninja Top
預かり所サクニナ,Storage Sakunina
レジェンズエッジ,Legends Edge
壁かけ紋章旗・剣,Sword Wall Banner
お菓子のチェスト,Sweet Chest
パラディンの心得,Tips for Paladins
神光放つツメの書,Holy Light Claws Book
イーギュアの大牙,Rapscallion's Fang
ロードリーブーツ,Lordly Boots
みかづきプリズム,Crescent Moon Prism
ジャングル風の壁,Jungle-Style Wall
イルーシャの部屋,Illusia's Room
魔法戦士団サロン,Armamentalist Corps
青地にうろこ紋傘,Blue Scaled Umbrella
サイドヘアリボン,Side Hair Ribbons
アマラーク城下町,Amarak Castle Town
暗黒大樹の守り人,Guardian of the Dark Tree
フルーツの便せん,Fruit Paper
機神の眼甲の破片,Mechanical Eye Shard
マジカルスーツ上,Magical Suit Top
プラチナ錬金ツボ,Platinum Pot
星拳士シャドポン,Starfighter Shadowpon
コルセアマント上,Corsair Cloak
ときめく砂糖菓子,Sugar Candy
超暴走魔法陣・零,Uber Ring of Ruin
マーチングブーツ,Marching Boots
ダイコンのタンス,Daikon Wardrobe
禍乱の竜アンテロ,Antelo, Dragon of Turmoil
オアシスの隊商宿,Oasis Caravan
プチデビルハット,Petit Devil Hat
天命のつるぎの書,Sword of Judgment Book
そして審判が下る,Then, Judgment Comes
ハートのイス・黄,Yellow Heart Chair
しぐさ書・のぞく,Peek
第３回リーネの像,3rd Renee Statue
オパールの食器棚,Opal Cupboard
ブルービックバン,Blue Big Bang
想いを針にこめて,Put Thoughts in a Needle
カボチャの食器棚,Pumpkin Cupboard
シスター・モンテ,Sister Monte
ツインアンテナＣ,Twin Antenna C
黒いバラの花びら,Black Rose Petal
マイスターハット,Meister Hat
ヴォルカドラゴン,Volcanic Dragon
バラモス強カード,Apex Baramos Card
紫イモのテーブル,Purple Yam Table
はにわにんぎょう,Clay Mannequin
プラズマスカット,Plasma Cut
丸小紋のはかま上,Circle Hakama Top
神秘のゴブレット,Mystic Goblet
音符のベッド・彩,Color Music Bed
トーテムクラウン,Totem Crown
忘れられし王の間,Forgotten King's Room
新作家具屋クレプ,New Indoor Furniture Shop Crepe
とんぼ玉プリズム,Glass Bead Prism
フォーマルスーツ,Formal Suit
つんつくカージェ,Bluecumber
武器屋ボーディス,Weapon Shop Bodis
レース屋ヒキシオ,Race Registrar Hikishio
預かり所ボルリラ,Storage Borrilla
ディバインスペル,Anathematise
どくやずきん・祖,Ancestral Bodkin Fletcher
よろず屋リューロ,General Shop Ryuro
ゴクラクギョ・赤,Red Betta
魔の波動を調べる,Examine Demonic Waves
キラーなピッケル,Maniacal Mole Pickaxe
グレンドラゴニア,Glendragonia
アスバルのズボン,Asbal's Pants
防衛軍のインカム,Defense Force Intercom
記念大王スライム,Commemorative King Slime
魔物管理人ジラー,Monster Manager Jira
スマッシュポテト,Mashed Potatoes
じごくのもんばん,Grim Keeper
魔人の勲章の破片,Ruin's Medal Shard
中心核の間への扉,Door to Core Chamber
ドルステーション,Dol Station
時元神キュロノス,Kyuronos, Ruler of Time
ピクシーシューズ,Pixie Shoes
魚交換員ポップイ,Fish Exchange Popui
もこふわパジャマ,Fluffy Pyjamas
ガーデンシューズ,Garden Shoes
スノードーム・銀,Silver Snow Globe
ししおどしセット,Scaredeer Set
獄水鬼ヴァーテル,Waterkeeper Vater
ファラスカプセル,Faras Toy
ガタラ原野への道,Road to Gatara Fields
ハラッヘリンの像,Meat Imp Statue
白猫のワンピース,White Cat Dress
シスター・ルルア,Sister Lulua
ハロウィンアーチ,Halloween Arch
黒猫のスウェット,Black Cat Sweatshirt
スライム露天風呂,Slime Outdoor Bath
住宅素材屋ツイナ,Housing Materials Tuina
ティプローネ光花,Tiplone Light Flower
めいふのばんにん,Hellbound Heretic
オオカミアタック,Wolf Whistle
整備士のてぶくろ,Technician's Gloves
カレイドスコープ,Kaleidoscope
マーガレットの傘,Marguerite Umbrella
道具鍛冶作業着上,Toolsmith's Vest
ネコ姫の観葉植物,Cat Princess Plant
和風の５色ランプ,Japanese 5 Color Lamp
闇司祭長ユルイゲ,Yuruige
レース屋ミチシオ,Race Registrar Michishio
邪神ヤファギル封,Yaphagil, the Seal
カプサイせんべい,Capsai Rice Cracker
ルビーのサンダル,Ruby's Sandals
エステラキッチン,Estella Kitchen
にわとりプリズム,Chicken Prism
Ⅲ‐ディアノーグ,Ⅲ‐Diamagon
黒猫のブーメラン,Black Cat Boomerang
ラヴィアンローズ,Rose Spectaculars
くさりのあみぐつ,Chain Boots
ラン錬作業ズボン,Lamp Alchemist's Pants
ＣＭ用ウェディ２,Weddie For CM 2
チャンスコマンド,Chance command
アラモンドの植木,Alamond Plant
劇場案内係タシア,Usher Tashia
行動時 5%でバーハ,Insulate On Action 5%
フライングスター,Flying Star
パープルエッグ２,Purple Egg 2
シルエット・記号,Silhouette Sign
スライムＴシャツ,Slime T-Shirt
壱の式修了の陽符,Yang I Completion Charm
ギガンテス便せん,Gigantes Paper
デュエルキャップ,Duel Cap
救助された侍女Ａ,Relief Maid A
ふしぎなイレモン,Mysterious Lemon
ネオンフラッシュ,Neon Flash
ファーベルの父親,Fabel's Father
きせきの釣りざお,Miracle Fishing Rod
ダラリア砂岩遺跡,Daleria Sandstone Ruins
ネグールドラゴン,Nezure Dragon
海賊と海神の秘宝,A Pirate's Treasure
奇跡のフライパン,Miracle Frypan
シスター・イグニ,Sister Iguni
よろず屋カエマン,General Shop Kaeman
闇の大魔王の滅角,Archfiend's Horns
個性的なＴシャツ,Eccentric T-shirt
ポケットねぶくろ,Pocket Sleeping Bag
ドルワーム水晶宮,Crystal Palace
王国軍司令部の盾,Royal Army Shields
釣り鐘守りの日記,Bell Keeper's Diary
預かり所トッケロ,Storage Tokkero
ショップポイント,Shop Points
ソフトクリーム傘,Ice Cream Umbrella
あくむにゅうどう,Nightmare Nomad
ツインアンテナＢ,Twin Antenna B
封印のかかった本,Sealed Book
バスターウィップ,Scourge Whip
えきいんぼうまん,Attendant Bowma
チェイサーアーム,Chaser Armguards
シュメリアの写真,Photo of Sumeria
しぐさ書・お弁当,Lunch Box
ツインクルタクト,Twinkle Little Staff
パワフルステーキ,Powerful Steak
スクールブレザー,School Blazer
リッシュウの手紙,Rishu's Letter
魔物管理人アイミ,Monster Manager Aimi
ほしくずのつるぎ,Stardust Sword
マローネトランプ,Marone Deck
お寿司スライム帽,Sushi Slime Hat
ポルテのグルめも,Porte's Gourmemo
スレア海岸への道,Road to Surea Coast
壁画管理ペコリア,Mural Management Pekoria
しょくにんききな,Crafter Kikina
若者の家ペコリア,Youth House Pekoria
マーメイドパレオ,Mermaid Pareo
２段ブロック・赤,Red 2-Step Block
凍れる時獄の秘法,Art of Frozen Time
人食い火竜練習札,Tatsunaga Tag
メラゴースト・塔,Tower Firespirit
魔法戦士団ブーツ,Armamentalist Boots
ツボ錬金設備・庭,Pot Alchemy Facility(G)
チルタイムソファ,Chill Out Sofa
古とこしえの神殿,Ancient Temple of Eternity
ピクニックアサヒ,Asahi Picnic
ネタ「たけのこ」,Bamboo Shoot Trick
中型魔神機開発部,Medium Aztech Development
水竜ギルギッシュ,Gilgish
花華メイドの下駄,Flower Maid Geta
バトエンフラッグ,Batoen Flag
雪原のアノラック,Snowfield Anorak
マーメイド仕切り,Mermaid Partition
ショコラな衣装券,Chocolate Outfit Voucher
はしゃのオノの書,Conqueror's Axe Book
レース屋ツキカゲ,Race Registrar Tsukikage
ザイナー衛士団長,Guard Commander Zeiner
しっくごすせっと,Chic Goth Outfit
ドミネウスの部屋,Domineus' Room
ガテリア式真空管,Gateria Vacuum Tube
バトルチョーカー,Dogged Collar
ディバインソード,Divine Sword
ドルワーム王国駅,Dolworm Kingdom Station
ブチ太猫カプセル,Fat Spotted Cat Toy
鬼嫁への罪滅ぼし,Destroy the Devil's Wife
スターリーブーツ,Starry Boots
マーチングズボン,Marching Trousers
あるある川柳・金,Haiku Gold
カイザードラゴン,Royal Reptile
グランゼドーラ門,Gran Zedora Gate
メタブラチケット,Metal Medley Ticket
ジャックのカード,Jack Card
テンシノコシカケ,Celestool
景品交換所シリン,Prize Exchange Shirin
しびれくらげ１５,Man o' War 15
ピリからペッパー,Hot Stuff
壁かけ桜の飾り棚,Cherry Blossom Shelf
煙霧の谷への出口,Exit to Misty Valley
始源の歌姫セット,First Diva's Outfit
カンフーキャップ,Kung Fu Cap
お茶屋のパラソル,Teahouse Umbrella
大魔王のお召し物,Apparel for a Demon Lord
ぬすっとウサギ？,Robber Rabbit?
レグナード変異体,Variant Regnad
プリズニャンの書,Jailcat Book
マンモスドラキー,Gargantuan Dracky
郵便局員カンココ,Postman Kancoco
ドワーフ市民くつ,Dwarf Citizen Shoes
聖守護者のつるぎ,Sentinel's Sword
ベリアル強メダル,Apex Belial Medal
ゴードンハンマー,Mega Moai Hammer
シスター・ソリヤ,Sister Solya
ライトニング無頼,Lightning Unreliable
竜界を継ぐ者たち,Heirs of the Dragon Realm
ステューデントＧ,Student G
シュパルトクロー,Rift Claws
小型の球体水そう,Spherical Aquarium S
エンゼルショット,Angel Shot
討伐隊員シーナン,Strike Force Sinan
帽子係アンジュー,Hat Clerk Anju
ドラポヨモニター,Tubby Dracky Monitor
初期プクリポ男性,Initial Pukulipo Male
臨時大使カヤカリ,Temp Ambassador Kayakari
ふっくらにんにく,Plump Garlic
ある魔術師の悔恨,Magician's Regret
花透かし細工の壁,Floral Wall
鉱物生命体の弾丸,Life Mineral Bullet
ディバインヘルム,Divine Helm
第３回フウラの像,3rd Fuura Statue
スカラベーダーズ,Scaravaders
マーチングパンツ,Marching Pants
セラフィゴーグル,Seraphi Goggles
ウィリーデファン,Vilide Fan
ウェディバスタブ,Weddie Bathtub
中央地区ペコリア,Central Area Pekoria
ナジーンカプセル,Najinn Toy
シスター・ミペカ,Sister Mipeka
交換屋メリーポコ,Exchange Shop Meripoko
栄光のローブ・銀,Silver Glory Robe
ドラゴンシールド,Dragon Shield
Ｔカバーな海パン,T-Shirt Swim Trunks
ウェスタンブーツ,Western Boots
アサシングローブ,Assassin Gloves
コンキスタグール,Conquistador Ghoul
童話ゆうわくの弓,Fuddling Fairy Tales
大魔王のグローブ,Demon Lord's Gloves
レースの観客１２,Race Spectator 12
防砂ダム・展望台,Sand Dam Observatory
パンジーのリスト,Pansy Bangles
武器屋バーニジア,Weapon Shop Banijia
プレミアムな金箔,Premium Gold Leaf
邪精霊マガツカゼ,Magatsukaze, the Wicked Wind
モダンな囲みヒゲ,Modern Full Beard
ネオン・メーター,Neon Meter
プスゴンのおたま,Pusgon Ladle
剥きかけりんご右,Right Peeled Apple
転生出現率アップ,Rarefied Encounter Boost
種族神像ウェディ,Weddie Tribal Statue
テラシナーラの像,Bulbergine Statue
くさりかたびら上,Chain Mail Top
ドワチャカオイル,Dwachakka Oil
ルビスのローブ下,Rubiss' Robe Bottom
打ち上げ花火・紫,Fireworks Launcher (P)
キナリ猫カプセル,Kinari Cat Toy
魔導将軍のゆびわ,Mage General Ring
ジュアロとゾデラ,Juaro and Zodera
魔塔研究家マディ,Tower Researcher Maddy
古代文字解読辞典,Ancient Lexicon
ゴクラクギョ・青,Blue Betta
ヘヴィーグローブ,Heavy Gloves
チョコボのぼうし,Chocobo Hat
パンドラチェスト,Pandoradrobe
レジェンズファン,Legends Fan
うごめくモノたち,Wiggling Things
はじめての木工術,Would-Be Woodworking
はぐれモグラの舌,Stray Mole's Tongue
レジェンズソード,Legends Sword
ウルフキャンディ,Wolf Lollipop
便せん屋ライジー,Stationery Shop Raiji
道具購買員ユシエ,Item Supplier Yushie
シャークウェア下,Lower Sharkwear
アイドルスーツ上,Idol Shirt
ダーマ神殿の看板,Alltrades Abbey Sign
アルファ用銀の丘,Silver Hill for Alpha
住宅素材屋コイズ,Housing Materials Koizu
おくびょうな白猫,Cowardly White Cat
竜族の里のベッド,Nadravian's Rest Bed
春風応援ソックス,Spring Cheer Socks
星夜のローファー,Starry Night Loafers
ドルワーム兵士１,Dolworm Soldier 1
じんめんじゅ・強,Vicious Treeface
シスター・ペッス,Sister Pess
アンテイクトーク,Antique Toque
昏冥庫パニガルム,Panigalm's Abyss Vault
星降りのローブ下,Starry Robe Bottom
フォースブレード,Force Blade
はがねのかなづち,Steel Hammer
ブラックゴースト,Black Ghost Knifefish
タンブラーボトム,Tumbler Pants
盆踊りフウラ・庭,Festival Dance Fuura(G)
魔天剛アロゲイル,Arogeil, Strength of Evil
いっせいこうげき,All-out Attack
魔因細胞のかけら,Demon Cell Fragment
お菓子のオーブン,Sweet Oven
ミイラ男の衣装３,Mummy Boy Costume 3
おとぎの森ボレロ,Fairy Forest Bolero
ルビーのロザリオ,Ruby Rosary
案内係ディアマン,Guide Diamond
悪しき水の洞くつ,Foulwater Cave
キリングエナジー,Killing Energy
カボチャ間仕切り,Pumpkin Partition
メデューサスーツ,Medusa Suit
スライムウィップ,Slime Whip
ペコリア・オメガ,Pekoria Omega
よろず屋ゴーツク,General Shop Gotsuku
クラウンシューズ,Clown Shoes
迅雷の丘への出口,Exit to Thundering Hills
しゃしょうぱーり,Conductor Pari
アクロニウム鉱石,Acronium Ore
霊剣セレンナイト,Sword of Selenite
アメジストの衝撃,A Smash of Purple
天使の翼プリズム,Angel Wings Prism
モーモンのゆかた,Teeny Sanguini Yukata
アリアハンマント,Aliahan Cape
ルビーのドレス下,Ruby's Dress Bottom
クルーガーブーツ,Kluger Boots
エビルソーサラー,Evil Sorcerer
魔獣サルファバル,Demon Beast Sulphubal
機巧研究所の写真,Photo of the Mechanica
白ゴシック柄の壁,White Gothic Wall
オーガの人形・男,Ogre Doll (M)
星落ちる谷への道,Road to Starfall Valley
ファントムマスク,Phantom Mask
デンジャーランス,Danger Lance
ステラトルネード,Stella Tornado
さみだれ突き・零,Multithrust+
シャコガイの大盾,Giant Clam Greatshield
シスター・ローネ,Sister Rone
ホイップゴースト,Whipped Scream
幸運を呼ぶサロン,Lucky Salon
シスター・サーラ,Sister Sarah
辺境警備隊兵士Ｂ,Frontier Guard Soldier B
レンダーシア上空,Lendersia Skies
きら星のドレス上,Twinkling Dress
スカウトアタック,Scout Strike
ふわふわ雲の本棚,Fluffy Cloud Bookshelf
ティンクルバトン,Twirl Baton
レース刺繍の日傘,Embroidered Umbrella
かいぞくウーパー,Salamarauder
便せん屋ハジカミ,Stationery Shop Hajikami
エビルキュビズム,Evil Cubism
禁忌の幻影神・封,Sealing Phantom
ごうけつの便せん,Great Hero Paper
フォーリンスター,Fallen Star
釣りざお作成入門,Fishing Rod Creation
ひらめきのゆびわ,Sorcerer's Stone
超かがやきの樹液,Super Sparkly Sap
ヤーン　涙の鉄拳,Yarn, Iron Fist of Tears
バルザックゾンビ,Zombie Baalzack
ゴシックビスチェ,Gothic Bustier
レプリカ加工ロボ,Replica Processor
カエルパーカー上,Frog Hoodie
メルサンディ印章,Melsandy Stamps
エンゼルアックス,Angel Axe
ちょこっとすーつ,Choco Suit
魔法戦士団ハット,Armamentalist Hat
セレモニーロッド,Ceremony Rod
バイキングソウル,Viking Soul
飛竜のタマゴ割れ,Broken Dragon Egg
エルフテーブル小,Elf Table S
お姫様の本棚・橙,Princess Bookshelf
たゆたう瑞雲の詩,Poem of Floating Clouds
セイクリッドボウ,Sacred Shot
カボチャステッキ,Pumpkin Stick
紫水晶のオーブン,Amethyst Oven
兵士の荷物ぶくろ,Soldier's Luggage Bag
ドラゴン花火・紫,Purple Dragon Firework
オルフェア地方西,Orphea Region West
タンクハンバーグ,Tank Hamburger
レンドアのベッド,Lendor Bed
建物屋ペルホネン,Building Shop Pelhonen
スライムの便せん,Slime Paper
ワルド水源への道,Road to Wald Headwaters
ドラゴン花火・緑,Green Dragon Firework
道具屋リスキュー,Item Shop Riskyu
レオン・ビュブロ,Leon Byblo
スチームグローブ,Steam Gloves
案内係ピューリィ,Guide Pury
ブラッディヘッド,Bloody Horns
ももんじゃフード,Platypunk Hood
ナンナのこころ２,Nanna's Heart Lv2
こんらんのダンス,Dance of Confusion
陽の試練壱・陽炎,Yang Trial I - Yang Haze
セピアンフリル上,Sepian Shirt
悪霊の神々カード,Evil Trinity Card
かいしんバーガー,Critical Burger
ボロボロのリボン,Tattered Ribbon
想いを花に込めて,Thoughts Into Flowers
砂丘のカーペット,Sand Dune Carpet
バンデッドボトム,Brigand's Bottom
とうぞくぼんがす,Thief Bongas
ハンギングベッド,Hanging Bed
星の職人道具絵巻,Starry Craftsman Book
スターダムブレス,Stardom Bracelets
よろず屋ポナック,General Shop Ponak
しぐさ書・ベース,Play Bass
クルヴィダの王冠,Kuruvida's Crown
ハイキングベレー,Hiking Beret
王家のナイフ全集,Nobleman's Knife Set
栄光のローブ・銅,Bronze Glory Robe
口調の書・オレ様,Tone Book - Tsundere
白木のテーブル大,Plain Table L
邪神ヴァニタトス,Dark Deity Vanitatos
異界将軍ギュメイ,Goresby-Purrvis, the Otherworldly
ふるぼけたタライ,Worn-out Washbasin
たいやきプリズム,Taiyaki Prism
グランプリレシピ,Grand Prix Recipe
シンイのこころ５,Shini's Heart Lv5
マカロンプリズム,Macaron Prism
臨時大使ペリレネ,Temp Ambassador Palileo
名探偵のグローブ,Sleuth's Gloves
忍び寄る闇の足音,Creeping Dark Footsteps
ゴシックコート下,Gothic Coat Bottom
神光放つムチの書,Holy Light Whip Book
バルディスタ工兵,Valdistan Engineer
エレガントココア,Elegant Cocoa
ベホマズン便せん,King Cureslime Paper
時の妖精カプセル,Time Fairy Toy
よろず屋ピッペル,General Shop Pippel
グランゼニスの剣,Gran Zenith Sword
魚交換員ポッツァ,Fish Exchange Pozza
スチームオーブン,Steam Oven
ブラッディ・ゼア,Bloody Maize
レオパードハット,Leopard Hat
レースの観客１５,Race Spectator 15
古びた糸とじの書,Old Thread-Bound Book
ユーススニーカー,Youth Sneakers
青嵐のおうぎ絵巻,Tempest Fan Book
ぬいぐるみ竜族男,Dragon Plushie (M)
クッキーの便せん,Cookie Paper
精霊を喰らうもの,Devourer of Spirits
マーブルステッキ,Marble Wand
