祭具・星天の衣折紙,Starry Sky Robe Origami
ミイラエルフ人形男,Mummy Elf Doll (M)
ごーれむのきぐるみ,Golem Costume
ピンクダマスクの柱,Pink Damask Pillar
ターン消費しない+2%,Free Turn +2%
シスター・デリアン,Sister Derian
ガーデンスーツ衣装,Garden Suit Outfit
ギュッとルナナの箱,Lunana Arm Doll Box
姉神封印神殿　出口,Goddess Seal Temple Exit
プクリポの人形・女,Pukulipo Doll (F)
ドラゴンソルジャー,Tyrantosaurus
海底デイジーの花束,Undersea Daisy Bouquet
第１１回ナジーン像,11th Najinn Statue
警備魔神兵０４５号,Aztech Guard No. 045
プラコンドレス・赤,Red Dress
コンシェルジュ０４,Concierge 04
バンデッドチェイン,Brigandine
古代魔術のながぐつ,Ancient Magic Boots
スライムエンペラー,Emperor Slime
川辺の休憩所への道,Path to Riverside Rest Area
魔瘴魂ゼノドラゴン,Miasma Soul Xenodragon
バトルマスターの影,Battlemaster's Shadow
青のほこらの洞くつ,Blue Shrine Cave
ふわふわセサミパン,Fluffy Sesame Bread
プチデビルグローブ,Petit Devil Gloves
はがねのブーメラン,Soarin' Steel
やりなおしの無限石,Infinite Repeatstone
夢のスティック物語,Fantastick Story
ギュッとリルチェラ,Lilcherat Arm Doll
武器防具屋マシスタ,Weapon & Armor Shop Masista
荘厳な竜のふりそで,Majestic Dragon Kimono
アクセルギアの破片,Mechanical Monocle Shard
ウォータースライダ,Waterslider
防衛魔神兵０５６号,Aztech Guard No. 056
蒼穹兵団のよろい下,Azure Corps Leggings
イルシームのうちわ,Ilseem Fan
おしゃれな水着・赤,Red Snazzy Swimsuit
オブジェクト座標128,Object Coordinates 128
はじゃのよろいぎん,Silver Champ Armor
酒場の庭オルゴール,Tavern Music Box (G)
チョコレートのラグ,Chocolate Rug
パドレ救出大作戦！,Padre Rescue Operation!
決めポーズ中央前列,Decisive Pose Front Row
若手芸人のてぶくろ,Young Talent Gloves
スライムヘッドホン,Slime Headphones
オブジェクト座標079,Object Coordinates 079
はやぶさのツメの書,Crow's Claws Book
ロードリーローブ上,Lordly Robe Top
エンパイアブレード,Legate's Blade
ラブリースティック,Fond Wand
決めポーズ中央後列,Decisive Pose Back Row
ナイトのピース・黒,Black Knight Piece
真・幻界諸侯カード,True Dread Fiends Card
スカイブルーの花束,Sky Blue Bouquet
赤バラのドレッサー,Red Rose Vanity
サーマリ高原の木Ｂ,Samary Plateau Tree B
パンプキンポンチョ,Pumpkin Poncho
サボテンダーポーズ,Cactuar Pose
キングに夜露死苦！,Night to the King!
プラチナソードの本,Platinum Sword Book
発信機イヤリング型,Earring Type Transmitter
パッチ柄ベッド・青,Blue Patch Bed
オブジェクト座標121,Object Coordinates 121
おとぎの森シューズ,Fairy Forest Shoes
王宮のキッチン・赤,Red Royal Kitchen
万魔の塔・五の災壇,Banma Tower - 5th Platform
すごろく案内係アミ,Sugoroku Guide Amy
しゃしょうやまびこ,Conductor Yamabiko
呪文のためのナイフ,Knife for Spells
マリンバックシャン,Marine Derriere
きせきの釣り人列伝,Miracle Angler Book
わかめをたたえよ！,Praise the Seaweed!
レジェンドチケット,Legend Ticket
メロディアシューズ,Melody Shoes
第９回ユシュカの像,9th Yushka Statue
野いちごバスケット,Wild Strawberry Basket
スラサポ屋スラベル,Slime Spirit Shop Slimebell
オブジェクト座標106,Object Coordinates 106
アスバルのこころ４,Asbal's Heart Lv4
エステラのこころ３,Estella's Heart Lv3
ハートのベンチ・黄,Yellow Heart Bench
オブジェクト座標273,Object Coordinates 273
虹のプラネタリウム,Rainbow Planetarium
ミステリークッキー,Mystery Cookies
絶念のアウルモッド,Aurmod the Forlorn
ランガーオ村の王者,Champion of Langao Village
ゴールドモンスター,Gold Monster
深い森の邸宅の屋根,Forest Manor Roof
プチグラコスカード,Frail Gracos Card
しぐさ書・あらまあ,Emote "Oh My!"
シャボンのオブジェ,Bubble Curio
コルット地方への道,Road to Colt Region
レーナム緑野の木Ｃ,Lenam Fields Tree C
ゴールドマンＸ８号,Gold Golem X 8
トーテムぬいぐるみ,Totem Plushie
魔天兵ゴルドーたち,Evil Soldier Goldo and co.
ともしびこぞう提灯,Wickerman Paper Lantern
黒紫チューリップ傘,Blk/Prp. Tulip Umbrella
闇朱の破砕将ボーガ,Red Crush General Boga
持ち主不明のチョコ,Unclaimed Chocolate
シスター・アナベル,Sister Annabel
栄光の騎士道指南書,Glorious Chivalry Guide
キャットリベリオ強,Apex Purrgatroyd
チュピちゃんのネジ,Chupie's Screw
赤のキーエンブレム,Red Key Emblem
ＭＰ消費しない率+2%,MP Saver +2%
ユーライザの便せん,Yuliza Paper
ウィキッドスーツ下,Wicked Suit Bottom
楽将バトルシェイカ,Tyrant Maracaraider
第２回釣りコン・金,2nd Fish Contest Gold
ワラタローカプセル,Warataro Toy
ジョイフルショコラ,Joyful Chocolate
アンティーク風の柱,Antique Pillar
ルネッサンステッキ,Renaissance Wand
スーパースターの証,Noscar
ガーデン花火台・青,Blue Fireworks Stand(G)
カジノ祭３ビンゴ銅,CasinoFest 3 Bingo Brnz
つりしのいしょうⅡ,Angler's Costume Ⅱ
ワイルドジャケット,Wild Jacket
パーティーの招待状,Party Invitation
プリマベーラピアス,Primavera Earrings
血潮の浜辺への出口,Exit to Bloody Beach
マイタウン湿原地区,My Town Marsh District
スノースターセット,Snowstar Outfit
さざなみギフト・赤,Red Ripples Gift
プラコン蝶々セット,Butterfly Set
タタリ御前の像・庭,Cursed Crooner Statue(G)
スチームカウンタ小,Steam Counter S
エンゼルスティック,Angel Wand
ふわふワルドラキー,Fluffy Evil Dracky
ルベランスティック,Ruberan Wand
マタドールシューズ,Matador Shoes
アスバルのこころ５,Asbal's Heart Lv5
白銀のフランベリー,Silver Flanberry
ごきげんクローバー,Cheery Clover
闇芸人ルルルリーチ,Relulu
パラソルスティック,Jolly Brolly
マジカルスティック,Pixie Stick
東洋風透かし窓・華,Floral Orient Window
シックゴスドレス上,Chic Goth Dress Top
白色チューリップ傘,White Tulip Umbrella
スマートローボード,Smart Lowboard
壁かけラウル肖像画,Rahul Portrait
エステラのこころ８,Estella's Heart Lv8
古代武器図説・杖編,Book of Ancient Staves
ギュッとウシぐるみ,Cow Arm Doll Plush
タイタニアステッキ,Butterfly Baton
ハロウィン衣装券Ⅲ,Halloween Voucher Ⅲ
ライトグレーダリア,Light Gray Dahlia
機工博士のコート下,Engineer's Lower Coat
エゼソル峡谷の木Ｂ,Ezesol Canyon Tree B
閃輝晶獣ザウザリィ,Crystalfiend Zauzari
エステラぬいぐるみ,Estella Plushie
魔物管理人ピョンル,Monster Manager Ponel
若武者の甲冑セット,Young Warrior Armor Set
ホイミントミュール,Heal Mint Shoes
ゼネシアのかんむり,Zenethia's Crown
いざ　ドラゴラム！,Now, Puff!
辛党はあきらめない,Spicy Never Give Up
とこなつヘアバンド,Summer Headband
ドルワーム王国の扉,Dolworm Kingdom Door
ポーンのピース・白,White Pawn Piece
ゆめみの金箱タンス,Dreamy Gold Wardrobe
紫電とどろく時は今,Purple Lightning Time
オブジェクト座標117,Object Coordinates 117
オブジェクト座標045,Object Coordinates 045
第８回ファラスの像,8th Faras Statue
オブジェクト座標009,Object Coordinates 009
プクリポカウンタ大,Pukulipo Counter L
まごころギフト・桃,Pink Heartfelt Gift
カンダタこぶんプー,Merry Man Pu
偽りのエテーネの島,False Ethene Island
チューザー地下空洞,Choozah Hollow
ヒューザのこころ９,Hyuza's Heart Lv9
きらめく星の贈り物,Twinkling Star's Gift
ビクトリーチップ青,Blue Victory Chip
バトエンジャーお面,Batoenger Mask
ピクニックパルミオ,Palmio Picnic
ＭＰ消費しない率+4%,MP Saver +4%
真・魔幻宮殿の篝火,Demon Palace Flame
さんぞくのサーベル,Bandit Blade
ナルビア宿屋のラグ,Nalbia Inn Rug
ブロンズブーメラン,Bronze Boomerang
リボンヘッドドレス,Ribbon Headdress
ナチュラル間仕切り,Natural Partition
レトロなポスト・赤,Red Retro Mailbox
メタスラぬいぐるみ,Metal Slime Plushie
深い森の邸宅の石壁,Forest Manor Stone Wall
オーガの町人ブーツ,Ogre Merchant Boots
大富豪協会員プゴル,Tycoon Club Member Pugol
キィンベルのぼうし,Kimbel Hat
古代武器図説・爪編,Book of Ancient Claws
オブジェクト座標078,Object Coordinates 078
ドルバイクプリズム,Dol-Bike Prism
シャークキングダム,Shark Kingdom
ブルートライデント,Blue Trident
伝説の三悪魔練習札,Legendary Evils Tag
カジノバニースーツ,Casino Bunny Suit
アクアマリンマリー,Aqua Marie
フューチャーブーツ,Future Boots
おばけのいしょう３,Ghost Costume 3
ぐりーんたきしーど,Green Tuxedo
アスバルのこころ８,Asbal's Heart Lv8
漆黒魔獣ナイダーク,Black Magic Beast Nydark
グランゼニス神の像,Gran Zenith Statue
ルミナスギフト・黄,Yellow Luminous Gift
模様入りしっくい壁,Pattern Plaster Wall
紅蓮のクイーンビー,Crimson Queen Bee
チョッピ荒野の木Ａ,Choppi Wilderness TreeA
会心まいしんラップ,Confidence Rap
マイタウン雲上地区,My Town The Cloudtops
オブジェクト座標228,Object Coordinates 228
メラゾーマやきそば,Kafrizz Fried Noodles
メリクリギフト・緑,Green Christmas Gift
攻撃時25%バイキルト,Oomphle On Attack 25%
プラコン用のほうき,Private Concierge Broom
オブジェクト座標080,Object Coordinates 080
プログラム用ダミー,Program Dummy
スターコートセット,Superstar Outfit
カラス神楽の装束Ⅱ,Crow Dance Costume Ⅱ
パピヨンソファ・夢,Dream Papillon Sofa
赤チェックの便せん,Red Checkered Paper
ローヌ風焼き肉弁当,Rhone-Style Grilled Bento
チェックのラグ・青,Blue Checkered Rug
ギーグハンマー・狂,Mad Giga Clubber
自由なるラ・テート,La Tate, the Free
プラコンスーツ・桃,Pink Suit
郵便局員エッキョウ,Postman Ekkyo
レーンの村の丸イス,Rane Village Stool
レジェンズアックス,Legends Axe
バンデッドグローブ,Brigand's Mitts
やみしばりの像・庭,Hellbound Horror St.(G)
モノクロームナイト,Monochromour
タッツィのお手伝い,Tazzi's Help
第３回釣りコン・銀,3rd Fish Contest Silver
アニメ塗りフィルム,Anime Paint Film
スパングルグローブ,Spangled Gloves
星空のチェスト・青,Blue Starry Chest
オブジェクト座標088,Object Coordinates 088
果てなき修練の末に,After Endless Training
バルディジニアの花,Valdia Zinnia Flowers
預かり所バルバトゥ,Storage Barbatou
スマートな水着・赤,Red Smart Swimsuit
カブリオレプリズム,Cabriolet Prism
トゥーンタウン地区,Toontown District
きぬのローブセット,Silk Outfit
バトルステーキ・小,Small Battle Steak
コケ玉の盆栽セット,Moss Ball Bonsai Set
オブジェクト座標073,Object Coordinates 073
ローズグレーダリア,Rose Gray Dahlia
魔想念ジェルザーク,Demonic Thought Gelzark
ベビタン竜族人形女,Imp Nadravian Doll (F)
コーヒーカップ・桃,Pink Coffee Set
木造御殿のアーチ壁,Wood Palace Arch Wall
キングスライム噴水,King Slime Fountain
創失を招くもの設置,Unmaking Placement
導きの風に技閃きて,Flash in the Guiding Wind
自由人の集落のイス,Freedom Village Chair
オブジェクト座標048,Object Coordinates 048
レンジャコート上２,Ranger Coat Top 2
オブジェクト座標207,Object Coordinates 207
ダンディオ団長の妻,Captain Dandio's Wife
黒レザーのテーブル,Black Leather Table
護りの盾アンルシア,Protector Anlucia
模様入りしっくい柱,Pattern Plaster Pillar
船長より愛を込めて,With Love From the Captain
ルファ神殿・中央塔,Rufa Temple - Tower
メレアーデのお部屋,Mereade's Room
天の川をつかまえて,Capture the Milky Way
マスター・ポシェル,Guildmaster Poshel
オブジェクト座標089,Object Coordinates 089
ゴールドマンＸ９号,Gold Golem X 9
ぷりんすたきしーど,Prince Tuxedo
ホワイトキュロット,White Culottes
オブジェクト座標016,Object Coordinates 016
ペロキャンプリズム,Lollipop Prism
壁かけロトのつるぎ,Erdrick's Sword Mount
小悪魔王子ステッキ,Devil Prince's Stick
マイタウン海辺の村,My Town Seaside Village
ポップスターの服上,Pop Star Top
オブジェクト座標005,Object Coordinates 005
ガルーダテンペスト,Garuda Tempest
おとぎの森カチーフ,Fairy Forest Kerchief
ケミカルポップ鏡台,Chemical Pop Vanity
職人道具をかかげる,Hold Up Crafting Tool
メガトンブラザーズ,Heavy Metal
ガタラ大山林への道,Road to Gatara Mountain Forest
呪われたシシカバブ,Cursed Shish Kebab
きのこ村のエプロン,Shroom Village Apron
しぐさ書・究極呪文,Emote "Ultimate Spell"
オブジェクト座標119,Object Coordinates 119
アスバルのこころ７,Asbal's Heart Lv7
アスフェルド大光章,Large Asfeld Medal
オブジェクト座標105,Object Coordinates 105
チームゆく年くる年,Team New Year
オブジェクト座標203,Object Coordinates 203
王宮のチェスト・赤,Red Royal Chest
ランプ錬金のうでわ,Lamp Alchemist's Cuffs
ポイズントリル・強,Vicious Poison Trill
予言者学園女学生服,FTA Uniform (F)
天の冒険者のグラブ,Divine Traveler Grips
おめかしＶチケット,Dress-up V Ticket
カルデア山道の横穴,Chaldea Mountain Road Cave
ザードの尖塔・３階,Zard Spire 3F
リシアの新作アクセ,Lycia's New Accessory
キャロル姫ゆかた下,Carol Yukata Bottom
マジックチャクラム,Magic Circle
エイルのスティック,Eir's Wand
僧兵のころもセット,Monk Warrior Outfit
うさみみギフト・黒,Black Rabbit Ears Gift
カボチャのキッチン,Pumpkin Kitchen
チェックのラグ・赤,Red Checkered Rug
ダイナーヘアドレス,Diner Headdress
灰マスク猫カプセル,Ash Mask Cat Toy
ガズバランのしるし,Gazbalan Badge
表層・サフィア宙橋,Surface - Saphia Bridge
アンドレアルカード,Rashaverak Card
新七不思議コン・銅,Seven Wonders Bronze
オブジェクト座標042,Object Coordinates 042
新七不思議コン・銀,Seven Wonders Silver
ハクオウのこころ５,Hakuo's Heart Lv5
クラシカルスカート,Classical Skirt
家具屋・旅人バザー,Indoor Furniture Shop/Traveler's Bazaar
黒柴クールカプセル,Cool Black Shiba Toy
まのギフトボックス,Demon Gift Box
しぐさ書・ジュエル,Emote "Jewel Shower"
ボディーガード強化,Bodyguard Boost
サメバーンプリズム,Sharkburn Prism
紫水晶のカーペット,Amethyst Carpet
オブジェクト座標276,Object Coordinates 276
輝け！　メダライト,Shine On! Medalite
ガーディアンブーツ,Guardian Boots
腐緑の呪老将ズタン,Green Curse General Zutan
未完のラゼアの風穴,Undone Lazea Wind Cave
スライムトレイ物語,Slime Shield Story
バレンタインココア,Valentine Cocoa
マデュライトの延板,Darkonium Plate
オブジェクト座標083,Object Coordinates 083
オブジェクト座標201,Object Coordinates 201
黄金の秘宝を探して,In Search of Gold Treasure
ストーンマンのツボ,Stone Golem Pot
ほのおのつるぎの書,Fire Blade Book
異界獣ヘイズシナー,Haze Sinner, the Otherworldly
りゅうおうアックス,True Dragonlord Axe
マジックスープ・小,Small Magic Soup
リベリオのきぐるみ,Purrgatroyd Costume
ゴーレムぬいぐるみ,Golem Plushie
炎うず巻く聖なる鳥,Fiery Holy Bird
１０周年のかんむり,10th Anniversary Crown
まじないしターバン,Fizzle-Proof Turban
月光スミレの花びら,Moonlight Violet Petal
チョコレートリップ,Chocolate Tulip
オブジェクト座標033,Object Coordinates 033
帝国の闇サンタたち,The Yuleish Empire
悲嘆のレイジバルス,Grieving Regibalus
オブジェクト座標281,Object Coordinates 281
オブジェクト座標145,Object Coordinates 145
キャット・リベリオ,Purrgatroyd
砂海のころもセット,Sand Sea Outfit
お祭りやぐら館の壁,Festival Wall
しおさいキャンディ,Salted Candy
天河のジャンビーヤ,Milky Way Jambiya
イケてる歌詞カード,Cool Lyrics Card
スマイリー・キラー,Smiley Killer
ゴルフメンズウェア,Golf Men's Wear
ハートの兵隊ぼうし,Heart Soldier Hat
ディープギアグラス,Deep Gear Glasses
記憶の風穴の研究室,Memory of Windy Cave Lab
妖精の女王のブレス,Fairy Queen Bracelets
猛る槌矛のガイオウ,Gaiou, Hammer and Pike
第２回ラグアスの像,2nd Raguas Statue
ミシュアの服上・真,True Mishua Dress Top
スイカさまの像・庭,Mr.Watermelon Statue(G)
夏の恋は泡のごとく,Summer Love, Like a Bubble
タイフーングローブ,Typhoon Gloves
第１０回ラウル像庭,10th Rahul Statue (G)
ファンキータイツ下,Funky Tights
オブジェクト座標212,Object Coordinates 212
たんすミミックの書,Wardrobe Mimic Book
マスター・バレクス,Guildmaster Barex
いしにんぎょう・強,Vicious Dirty Dogu
マーメイドチェスト,Mermaid Chest
フェアリードラゴン,Damselfly
カラミティスコルプ,Calamity Scorpion
ユーライザウィッグ,Yuliza Wig
ナイトメアファング,Nightmare Fang
防衛魔神兵０５４号,Aztech Guard No. 054
銀のさいほう針の本,Silver Needle Book
はやぶさの剣改の書,Uber Falcon Blade Book
ゴールドマンＸ４号,Gold Golem X 4
ハートのオルゴール,Heart Music Box
ガーデン花火台・黄,Ylw. Fireworks Stand(G)
マグマの杖のレシピ,Magma Staff Recipe
打ち上げ柳花火・赤,Red Willow Firework
グレースギフト・桃,Pink Grace Gift
マスター・ポーリア,Guildmaster Paulia
第９回ファラスの像,9th Faras Statue
オブジェクト座標137,Object Coordinates 137
ランプ錬金職人の神,Lamp Alchemist God
しぐさ書・もうそう,Emote "Swoon"
踊り神ボニータ右羽,Dance God Bonita Right Wing
自動人形ドミネウス,Automaton Domineus
イルミンズールの弓,Irminsul Bow
サニーアンクレット,Sunny Anklet
古代王族のバングル,Ancient Royal Bangles
竜と生きるは竜術士,A Dragomancer's Life
リンカサークレット,Linka's Circlet
ユシュカのこころ１,Yushka's Heart Lv1
オブジェクト座標000,Object Coordinates 000
オブジェクト座標149,Object Coordinates 149
くらげドレスセット,Jellyfish Dress Set
ごうかな食器棚・緑,Green Fancy Cupboard
攻撃時10%暴走アップ,Haywire Up On Attack 10%
スライダークカード,Nemeslime Card
蘇生時早詠みと祈り,Casting & Healing Savior
激辛トマトジュース,Super Hot Tomato Juice
クローバーシールド,Clover Shield
シーグリーンダリア,Sea Green Dahlia
魔物管理人ヒュリー,Monster Manager Huri
ろうがぼうの作り方,How to Make a Sadistick
しぐさ書・ひやかす,Emote "Tease"
獄辛党秘書ロシナゼ,Jail Knight Rozzinaze
髪飾りのデザイン画,Hairpin Design Sketch
オブジェクト座標018,Object Coordinates 018
しぐさ書・ぞうきん,Emote "Cleaning Cloth"
魔物シールド勲章券,Shield Medal Ticket
ランプ素材屋ナディ,Lamp Materials Nadi
タイタス号の天井扇,Titus Ceiling Fan
おどるほうせきの書,Goodybag Book
オブジェクト座標267,Object Coordinates 267
ギンガムマフラー黒,Black Gingham Scarf
シャインファイバー,Shiny Fibers
ワンダラーズベレー,Wanderers Beret
ベスキャンプリズム,She-Slime Candy Prism
おうち用水辺のラグ,Waterside Rug
スタジアムシューズ,Stadium Shoes
プチ魔犬レオパルド,Frail Evil Sir Leopold
メレアーデスカート,Mereade Skirt
りょうりにんかっぷ,Chef Cupp
幸せの妖精のたまご,Happy Fairy Eggs
スターの足置き・青,Blue Star Footrest
ゴーレムのきぐるみ,Golem Costume
ネタ「おたから袋」,Treasure Bag Trick
大富豪なりきり宝箱,Tycoon Treasure Chest
まおうのつかい・強,Vicious Demon-at-arms
クラウドブレイカー,Cloudbreaker
アブソリュートレイ,Absolute Beam
幻影のドミネウス邸,Domineus Illusion Mansion
格闘場・闘いの広間,Arena - Monstrous Pit
テスト剣モデルなし,Test Sword Model Not OK
ドルワーム研究ぐつ,Dolworm Research Shoes
エターナルガーデン,Eternal Garden
オブジェクト座標008,Object Coordinates 008
キッズ木馬プリズム,Rocking Small Fry Prism
リンクスのオフィス,Lynx's Office
応援お願いします！,Help me please!
壁かけシラナミの絵,Shiranami Portrait
緑キノコのテーブル,Green Mushroom Table
攻撃時25%暴走アップ,Haywire Up Attack 25%
スノースターリボン,Snowstar Ribbon
オブジェクト座標195,Object Coordinates 195
黒柴ピュアカプセル,Pure Black Shiba Toy
オブジェクト座標158,Object Coordinates 158
ごうかな花びん・緑,Green Fancy Vase
パピヨンチェア・夢,Dream Papillon Chair
リンベリィトランプ,Linberry Cards
しぐさ書・ひらめく,Emote "Inspire"
レトロなテレビ欠番,Retro TV Missing
オブジェクト座標124,Object Coordinates 124
創造神マデサゴーラ,Worldmaker Madesagora
青のキーエンブレム,Blue Key Emblem
ラッキーチケット銀,Silver Lucky Ticket
ウィザード鏡台・黒,Black Wizard Vanity
しぐさ書・線香花火,Emote "Sparkler"
いにしえの竜の伝承,Lore of the Ancient Dragon
シスター・エミーネ,Sister Emine
ビーナスのほほえみ,Venus' Smile
ディープギアマスク,Deep Gear Mask
お兄ちゃんへの手紙,Letter to Brother
しぐさ書・ネオン黄,Emote "Neon Yellow"
ふわふわ雲プリズム,Fluffy Cloud Prism
ナイトのピース・白,White Knight Piece
おみくじボックスⅢ,Fortune Box Ⅲ
Ｓジェネラル練習札,Shogum Tag
かっぱえび家の帽子,Shrimp Snack Hat
ブレイブギフト・白,White Brave Gift
深翠のピラー・内部,Deep Green Pillar - Inside
フリルスタービキニ,Frilled Star Bikini
おもちゃの草原・雪,Toy Grass Field (Snow)
クラゲの天井ライト,Jellyfish Ceiling Light
リンベリィのドレス,Linberry's Dress
マスター・アーリュ,Guildmaster Aryu
Ｖロンのタンス・赤,Red Vron Wardrobe
グレンの歴史４７巻,Glen History Volume 47
コロシアムバーガー,Coliseum Burger
おとぎの森グローブ,Fairy Forest Gloves
トゥーンのテーブル,Toon Table
メタスラボスメダル,Metal Slime Boss Medal
ナウマンコックの像,Naumanncook Statue
はじゃのよろいどう,Bronze Champ Armor
レンジャー協会本部,Ranger Association HQ
キャロルコサージュ,Carol Corsage
ビクトリーチップ冥,Hades Victory Chip
おいしく焼きしめて,Deliciously Roasted
モザイクガラスの柱,Mosaic Glass Pillar
レンジャーシャプカ,Ranger Shapka
アンルシア少女の剣,Anlucia Girl's Sword
レース受付係タータ,Race Receptionist Tarta
童話の街並みの門柱,Fairy-Tale Gatepost
白きヴェールの乙女,Maid of the White Veil
しぐさ書・お祝い赤,Emote "Celebrate Red"
チョコが詰まった袋,Chocolate Filled Bag
ヘヴィーアーマー下,Heavy Armor Bottom
オブジェクト座標051,Object Coordinates 051
天地雷鳴士の装束下,Druid Attire Bottom
夜の神殿☆探検手帳,Temple of Night Notebook
銀の錬金ランプの本,Silver Lamp Book
獣魔ローガストの像,Logast Statue
山盛りのキャンディ,Pile of Candy
せいどうのかなづち,Bronze Hammer
ゼニスの封宮　入口,Palace of Zenith Entry
きのこ村のブラウス,Shroom Village Blouse
オブジェクト座標026,Object Coordinates 026
聖湖ゼニート　入口,Zenit, the Sacred Lake Entry
オブジェクト座標277,Object Coordinates 277
オブジェクト座標138,Object Coordinates 138
まがまがしいキノコ,Ominous Mushroom
かたりべのてぶくろ,Storyteller's Gloves
ガナドールグローブ,Victor Bracers
カムバックお月様！,Comeback Moon!
謎の生き人形の写真,Mystery Lively Doll Photo
幻界の四諸侯練習札,Dread Fiends Tag
黒鳥のサークレット,Blackbird Circlet
３連発花火・赤青緑,3 Fireworks RBG
マデュライトルアー,Darkonium Lure
プレゼントチケット,Present Ticket
ハクオウのこころ７,Hakuo's Heart Lv7
おばけキャンドル強,Vicious Wax Murderer
猛将ギーグハンマー,Tyrant Clubber
表情の書・わくわく,Expression "Excited"
オブジェクト座標167,Object Coordinates 167
アイスダンスグラブ,Ice Dance Gloves
大森林のレンジャー,Great Forest Ranger
天宮騎士のよろい上,Sky Knight Armor
魔瘴魂グウィネーロ,Miasma Soul Gwinero
グランゼドーラの母,Mother of Gran Zedora
お菓子のテーブル大,Sweet Table L
ビッグホルンの復活,The Return of the Big Horn
騎神のよろいセット,Knight God Armor Set
カンフーガール衣装,Kung Fu Girl Costume
第１０回プクラス像,10th Pukulas Statue
灰キツネ猫カプセル,Ash Fox Cat Toy
アルウェーン管理棟,Alweyn Admin Building
