ファータティアラ,Fata Tiara
朽ちた遺跡の宝箱,Ruin Treasure Chest
魔の試練・第３層,Demon Trials - L3
ネコミイラ衣装Ⅰ,Cat Mummy Costume Ⅰ
じごくのもんばん,Grim Keeper
人食い火竜練習札,Tatsunaga Tag
しょうにんでんな,Merchant Denna
モスグリリュック,Moss Green Backpack
魔塔紹介人パイク,Tower Introducer Pike
カボチャのガゼボ,Pumpkin Gazebo
オーガカウンタ大,Ogre Counter L
魚交換員パパルパ,Fish Exchange Papalupa
七夕・雨斬りの書,Festival Rain Slayer
光のオーナメント,Light Ornament
トンブレロ貯金箱,Ham Shamwitch Pig Bank
神光放つツメの書,Holy Light Claws Book
シャコガイの大盾,Giant Clam Greatshield
東洋風タンス・華,Floral Orient Wardrobe
いきのいいサザエ,Very Fresh Turban Shell
ハヌマーン強軍団,Apex Nemean Army
預かり所シーラナ,Storage Shirana
魔想念ローガスト,Demonic Thought Logast
ギュッとアスバル,Asbal Arm Doll
パルミオトランプ,Palmio Cards
バグド王のパンツ,King Bagudo's Shorts
めっとなしすーつ,Helmetless Suit
交換屋メリーポコ,Exchange Shop Meripoko
黎明の霊堂への扉,Door to Mausoleum of Daybreak
いたずらバーティ,Buttre the Bad
ライトスティック,Light Stick
ファラオ・ヘルマ,Pharaoh Herma
水のはごろも物語,Flowing Dress Story
ストームフォース,Gale Fource
２階への転送装置,Transporter to 2F
ナチュラルベッド,Natural Bed
薬剤設備・庭欠番,Medicinal Facility (G)
超錬金ランプの本,Super Lamp Book
りゅうおうエッジ,True Dragonlord Edge
魚交換員ビンチュ,Fish Exchange Bincho
フラウスショット,Flaus Bow
にじいろの色鉛筆,Rainbow Colored Pencil
ふしぎなドロドロ,Odd Clod
メイジももんじゃ,Crack-Billed Platypunk
特技の射程距離+2m,Skill Range +2m
へんげのステッキ,Mod Rod
アラハギーロ地方,Al-Ahagiro Region
ジュレー島の木Ｂ,Jule Island Tree B
招かれざる者たち,The Uninvited
ユーライザのメモ,Yuliza's Note
パッションパレオ,Passion Pareo
ガテリア式動力源,Gateria Power Source
マザー・リオーネ,Mother Lione
うさぎの和タンス,Rabbit Wardrobe
モーモンゆず風呂,T. Sanguini Yuza Bath
海魔の眼甲の破片,Nacreous Necromonocle Shard
おばけキノコ・祖,Ancestor Funghoul
パピリオグローブ,Papilio Gloves
ポセイドンベッド,Poseidon Bed
第１１回ルミナ像,11th Lumina Statue
観測者モルフェス,Observer Morpheus
時の妖精カプセル,Time Fairy Toy
おしえてデーモン,Tell Me, Demon
壁かけ穴ミイラ男,Mummy Boy Hole
めんこ屋チャガン,Pogs Shop Chagan
ブルーファルコン,Blue Falcon
童話の街並みの塀,Fairy-Tale Fence
手編みのシューズ,Hand-Knit Boots
星空のソファ・青,Blue Starry Sofa
陰陽博士のぼうし,Yin-Yang Hat
タータンスーツ上,Tartan Suit Top
エアカープリズム,Air Car Prism
壁かけＤＱⅢの絵,DQⅢ Painting
預かり所シラクモ,Storage Shirakumo
ルシェンダの武器,Lushenda's Weapon
オジャロスの部屋,Ojalos's Room
魔犬の仮面の破片,Demon Dog Mask Shard
パッチ柄ラグ・桃,Pink Patch Rug
ラズバーンの怨霊,Razburn's Ghost
遊び人のてぶくろ,Gadabout Gloves
アラビアン衣装券,Arabian Outfit Voucher
市松模様のはかま,Checkered Hakama
財宝のつまった箱,Full Treasure Box
灰三毛猫カプセル,Ash Calico Cat Toy
オレンジのパーツ,Orange Part
スペシャルランチ,Special Lunch
ネオン・メーター,Neon Meter
ビジューなビキニ,Bijou Bikini
カジュアルブレス,Casual Bracelet
白亜の王城・１階,Chalky Castle 1F
花透かし細工の壁,Floral Wall
大戦鬼のグリーブ,War Demon's Greaves
ホンワカ羽毛の束,Snuggly Feather Bundle
ベホイムスライム,Sootheslime
アビスセーラー上,Abyss Shirt
預かり所メビータ,Storage Mebita
グランマーズの館,Madame Luca's House
カプレーゼタクト,Fromage Flay Wand
出張大使ポミリン,Ambassador Pomirin
グロリアススーツ,Glorious Suit
バケーロの子分Ｂ,Bakero's Henchman B
預かり侍女アトリ,Storage Maid Atori
ガートラント城駅,Gartlant Castle Station
どうぐやはんちゃ,Item Shop Hancha
桜モダンスーツ下,Cherry Modern Pants
メタルスライム強,Apex Metal Slime
エルダードラゴン,Elder Dragon
ベビーサタンの書,Imp Book
コイン屋ペピール,Coin Shop Pepeelu
春風チアーズ衣装,Spring Cheer Outfit
はがねのよろい上,Steel Armor Top
イルーシャのくつ,Illusia's Shoes
カエルパーカー下,Frog Shorts
とびきりスパイス,Superb Spice
防衛軍の制服・赤,Red Defense Force Suit
丁目水没遺跡地区,Block Submerged Ruins
デュークアックス,Aristocrat's Axe
古びた糸とじの書,Old Thread-Bound Book
ヴァレリアの仮面,Valeria's Mask
有翼人のサンダル,Winged One's Sandals
預かり所キーラル,Storage Keeral
オーシャングラス,Ocean Glasses
古びたペンダント,Old Pendant
もこもこスカート,Fluffy Skirt
マジカル姫ハット,Magical Hat
リュートを奏でる,Play Lute
キャプテンの部屋,Captain's Room
リザードファッツ,Frou-Frou
みかがみの盾の本,Silver Shield Book
幸運を呼ぶサロン,Lucky Salon
童話の街並みの柱,Fairy-Tale Pillar
ネレウスシールド,Nereus Shield
ファラオプリズム,Pharaoh Prism
羅刹王バラシュナ,Varashna, the Sinful Spirit
エピソード依頼帳,Episode Request Book
全身全霊斬り・改,Unbridled Blade+
ごうかなツボ・緑,Green Fancy Pot
じごくのおくり火,Lava Lampling
黒鳥のチュチュ上,Blackbird Tutu Top
月のローブの秘密,Moon Robe's Secret
ポセイドン仕切り,Poseidon Partition
アズラン温泉旅情,Azlan Hot Spring Travels
おおぞらの便せん,Clear Sky Paper
魔天剛アロゲイル,Arogeil, Strength of Evil
手裏剣アイパッチ,Shuriken Eyepatch
カプリコルランス,Capricor Lance
中型の球体水そう,Spherical Aquarium M
常闇のスティック,Everdark Wand
プラチナグリーブ,Platinum Greaves
ぽかぽかマフラー,Warm Scarf
パンジーのズボン,Pansy Pants
レースの観客１０,Race Spectator 10
ウェディングベル,Wedding Bell
おおとろの切り身,Tuna Belly
ギュッとソーミャ,Somya Arm Doll
ウルベア地下帝国,The Urbea Empire
うごく箱舟号・雪,Moving Ark (Snow)
究明者のグローブ,Research Gloves
全職みのまもり+20,Resilience +20
わだつみのしずく,Abyss Droplets
打ち上げ花火・赤,Red Firework
ウルタのコート上,Ulta Coat Top
トレーニー育成帳,Trainee's Logbook
ナスビぬいぐるみ,Woebergine Plushie
DQ3ゆうしゃぞーま,DQ3 Hero, Zoma
水の領界のガゼボ,Water Realm Gazebo
決めポーズ右前列,Decisive Pose R Front
案内係ロマンツェ,Guide Romanze
素材屋ミルフィプ,Material Shop Mirfpu
ヒューザの便せん,Hyuza Paper
地底湖の洞くつ前,Underground Lake Cave
ミシュアのブーツ,Mishua Boots
清涼スイムワンピ,Cool Swim Dress
武勲の城の金箔壁,Valor Castle Foil Wall
悪魔王の同族狩り,Hunting Devil's Family
第３回フウラの像,3rd Fuura Statue
パピヨンウィング,Papillon Wings
スカラベーダーズ,Scaravaders
スピードアップ床,Speed Up Floor
魚交換員プトゥン,Fish Exchange Putun
あやしい間仕切り,Suspicious Partition
妖精たちのポルカ,Brownie Boost
白亜の博物館の窓,Chalk Museum Window
春の和菓子セット,Japanese Sweets Set
ポイポイ商会倉庫,Poi Poi Company Storage
てくてくスライム,Slime Knight
新作家具屋クレプ,New Indoor Furniture Shop Crepe
ゾンビキラーの本,Zombiesbane Book
初期ドワーフ女性,Initial Dwarf Female
エルフの人形・男,Elf Doll (M)
正統派盆栽セット,Orthodox Bonsai Set
オルフェア住宅村,Orphea Residences
ジア・クリスタル,Dia Crystal
ネレウスハンマー,Nereus Hammer
陰の試練壱・陰霊,Yin Trial I - Yin Spirit
らいだーすすーつ,Riders Suit
音符のベンチ・黒,Black Music Bench
ドルタムトランプ,Doltam Cards
ピンキーパンサー,Pink Sabrecat
キナリ猫カプセル,Kinari Cat Toy
世界一クイック伝,World's Quickest Legend
ルミナスウィング,Luminous Wings
ミラクルコート上,Miracle Coat Top
シスター・リコラ,Sister Ricola
テストメット無し,Helmetless Test
スラタワー便せん,Slime Stack Paper
家出したスラルド,Runaway Goomerald
スターリーリスト,Starry Wristbands
一本角のあやかし,One-horned Ghost
さめきぐるみあお,Blue Shark Suit
トポルの蝶々かご,Topol Butterfly Basket
ルイーダチケット,Patty Ticket
ポイズンスケイル,Serpentscale Skean
しぐさ書・天灯青,Emote "Blue Lantern"
リザードマン・強,Vicious Mandrake Major
クマチャンコート,Beary Cute Coat
ウェディバスタブ,Weddie Bathtub
らくらくスコップ,E-Z Shovel
ジア・クルヴィダ,Dia Kuruvida
レジェンズガード,Legends Guard
プラコン用編み物,Private Concierge Knitting
アンノウンソード,Unknown Sword
迅雷の丘への出口,Exit to Thundering Hills
マーチングセット,Marching Outfit
プチヒドラカード,Frail Hydra Card
グレン領西への道,Road to Glen West
ジェルソルジャー,Gel Soldier
シーサイドソファ,Seaside Sofa
聖王のブーメラン,Dryspell Boomerang
王宮のベッド・青,Blue Royal Bed
形見のオルゴール,Keepsake Music Box
つりしのいしょう,Angler's Costume
壁かけおばけの窓,Haunted Window
シスター・イオリ,Sister Iori
航海冒険かきわり,Voyage Backdrop
文官レジドの手記,Resid's Note
クレセントエッジ,Razer-Wing
東洋風飾り棚・華,Floral Orient Shelf
あいんすりったー,Eins Ritter
学園女子の夏服上,Schoolgirl Summer Top
記憶のパドレア邸,Memory of Padrea Mansion
ウェディ間仕切り,Weddie Partition
ムーディーベッド,Moody Bed
ハイキングベレー,Hiking Beret
セクシーテーブル,Sexy Table
木造御殿のタイル,Wood Palace Tile
カボチャ間仕切り,Pumpkin Partition
名探偵のコート下,Sleuth's Coat Bottom
グレートグリーブ,Great Greaves
ズッキーニャ・祖,Ancestor Cruelcumber
パピヨンドレス下,Papillon Dress Bottom
郵便局員ケパルト,Postman Kepart
悠久の時を超えて,Beyond the Bounds of Time
アンノウンサイズ,Unknown Scythe
道具鍛冶作業着上,Toolsmith's Vest
ウェディの便せん,Weddie Paper
ぶれいくすたいる,Break Style
弐の五声は呼の声,Second of 5 Voices Call
魔衛隊士のかぶと,Demon Guard Helmet
こいするちゅちゅ,Tutu in Love
かなしきりかるど,Sad Ricardo
便せん屋ヤマブキ,Stationery Shop Yamabuki
黄金の飾り両手剣,Gold Ornament Grtsword
サンダーシャウト,Hellbound Hair-Raiser
まもの使いの服２,Monster Master Suit 2
こぞうバックラー,Leery Buckler
レシピ屋ペリンタ,Recipe Shop Perinta
アズラン宿屋の扉,Azlan Inn Door
シンプルＴシャツ,Simple T-Shirt
必殺チャージ率+1%,Special Charge Rate +1%
ソレイユバンドゥ,Sunflower Band
ザハディガル岩峰,Zahadigal Pinnacle
ルティチャビ像白,White Astolti Chubby St.
デザートランナー,Parched Peckerel
スタジアムリスト,Stadium Wristbands
水鳥のいる池・庭,Bird Pond (G)
冥獣王ネルゲル強,Apex Netherfiend Nergel
転職神官ハクドウ,Vocation Priest Hakudo
ハンタースーツ上,Hunter Suit Top
水晶のテーブル大,Crystal Table L
スチームバスタブ,Steam Bathtub
ホースデビル・強,Vicious Gamigin
レースの観客１６,Race Spectator 16
ゴクラクギョ・黒,Black Betta
戦神の箱＋５・改,War God's Box +5 v2
リィンカネ便せん,Re[in]carnation Paper
アンノウンファン,Unknown Fan
地縛霊は泣き虫？,Are Ghosts Crybabies?
パニガルム探査券,Panigalm Explore Ticket
大きなお菓子の柱,Big Sweets Pillar
ジャングルの岩壁,Jungle Rock Wall
ロトのしるしの旗,Erdrick's Emblem Banner
壁かけお正月飾り,New Year Wall Decor
氷のシャンデリア,Ice Chandelier
アイスダンス衣装,Ice Dance Outfit
ヴェリナード王国,Verinard Kingdom
ゴクラクギョ・白,White Betta
魔天鋼バルバトン,Balbaton, Steel of Evil
もぐらのスコップ,Mischievous Mole Shovel
古代文字解読辞典,Ancient Lexicon
まほうのせいすい,Magic Water
素材屋コロレッド,Material Shop Coroled
シールドアタック,Blockenspiel
宿屋ナイトグッド,Innkeeper Nightgood
マジカルチケット,Magical Ticket
グングンのびーる,Rapid Fertilizer
コルシュール大臣,Minister Corsur
パトローネ調査員,Detective Patrone
大地の竜玉の破片,Earthwyrm's Eye Shard
せんすいふくあお,Blue Diving Suit
おむつっこりの像,Bushy Baby Statue
セラフィのポスト,Seraphi Mailbox
レース屋ミチシオ,Race Registrar Michishio
師団長のよろい上,Commander Armor
ＣＭ用ウェディ４,Weddie For CM 4
オオカミアタック,Wolf Whistle
ウルベア地下遺跡,Ruins of Urbea
ごうかなイス・緑,Green Fancy Chair
預かり所ボリバル,Storage Boliver
ゆりかごの語り部,Storyteller of the Cradle
エレガントブレス,Elegant Bracelets
プチガイアカード,Frail Gaia Card
オーナーの館１階,Owner's Mansion 1F
旅人の優雅な日常,Graceful Traveler Life
BGMテスト同期部屋,BGM sync test room
DQ3賢者男　ゾーマ,DQ3 Sage (M), Zoma
タンブラーリスト,Tumbler Bangles
お姫様の本棚・橙,Princess Bookshelf
シスター・イグニ,Sister Iguni
ノートの切れはし,Scrap Paper
クリナップロッド,Cleanup Club
大地の箱舟　１幕,Ark of the Earth Act 1
カミルのローブ下,Kamil's Robe Bottom
白木のテーブル大,Plain Table L
フォーリオン外郭,Outer Fourion
悪夢の追っ手たち,Nightmare Persuers
異界アスタルジア,Astalgia
ある孤児が見た空,Orphan's View of the Sky
スイの塔への出口,Exit to Sui Tower
シンイのこころ７,Shini's Heart Lv7
お宝に魅せられて,Fascinated by Treasure
しびれくらげ１９,Man o' War 19
立派なレンガの柱,Fine Brick Pillar
こげ茶猫カプセル,Olive Cat Toy
ピクシーキャップ,Pixie Cap
トモガラのお願い,Tomogara's Request
聖賢者のローブ上,Holy Sage Robe Top
てんとうスカラベ,Spotted Scarab
預かり所アスケン,Storage Asuken
銀の錬金ランプ小,Silver Lamp S
表情の書・ねがお,Expression "Sleepy"
預かり所ラヴィア,Storage Lavia
ドミネウスの部屋,Domineus' Room
リルチェラソファ,Lilcherat Sofa
ランドインパクト,Crackerwhack
便せん屋マツリカ,Stationery Shop Matsurika
凶将バリクナジャ,General Togrus Maximus
しんごんのじゅず,Rosary
テルドミールたち,Upover Rider and co.
マジェスタブーツ,Majesta Boots
魔法使いのズボン,Mage Pants
シーサイドベッド,Seaside Bed
しぐさ書・苦笑い,Emote "Bitter"
ダークネビュラス,Dark Nebulus
じんめんじゅ・強,Vicious Treeface
魚交換員ポポヘプ,Fish Exchange Popohepu
聖夜に燃ゆる聖火,Fire Burns on Holy Night
出張購買員ガダン,Team Vendor Agent Gadan
やいばのグリーブ,Spiked Greaves
もこもこセーター,Fluffy Sweater
荒ぶる王子のオノ,Princely Axe
勝利の彫像の写真,Victory Sculpture Photo
フローズンバード,Icebird Throw
門より出でし魔獣,Beast from the Gate
口調の書・能天気,Tone Book - Easygoing
聖王の大盾の壁画,Dryspell Grtshd Book
荒ぶる魔王の痛み,Pain of the Demon King
おうち用川のラグ,River Rug
プクリポ風アーチ,Pukulipo-Style Arch
銀の鍛冶ハンマー,Silver Hammer
アグラニに潜む影,Shadow Lurking in Agrani
道具屋チャーロン,Item Shop Charon
デーモンバスター,Demonsbane
ダフィアのお守り,Daphea's Amulet
コルセアマント下,Corsair Pants
真のエテーネの島,True Ethene Island
ゴダ神殿への入口,Entry to Goda Temple
別離の剣器・全霊,Parting Blade of the Soul
ライトバックラー,Light Shield
ケイトのうであて,Kate's Armguards
わふうしょうぞく,Breezy Wear
お姫様食器棚・桃,Pink Princess Cupboard
しびれくらげ２５,Man o' War 25
預かり所グログス,Storage Gulgus
ホーリーカロット,Holy Headwear
ファリネのチョコ,Farine's Chocolate
はがねのグリーブ,Steel Greaves
アークデーモンＢ,Archdemon B
紹介人グリゼット,Introducer Glisette
チョコっと衣装券,Choco Costume Ticket
グレン風たいまつ,Glen-Style Brazier
グリンガムのムチ,Gringham Whip
ウルタのコート下,Ulta Coat Bottom
ベホマズン便せん,King Cureslime Paper
ゴールデンコーン,24-Carrot Bunicorn
ウェナーフェイス,Wena Face
初任務はモリナラ,Molinara First Mission
ハロウィン衣装券,Halloween Voucher
むげんの弓の物語,Purblind Bow Story
５００年前の地図,Map of 500 Years Ago
芯層・ルビン宙橋,Core - Rubin Bridge
防衛軍の制服・紺,Blue Defense Force Suit
リベホイミパフェ,Remidheal Parfait
ふわふわモーモン,Fluffy Teeny Sanguini
便せんは芸術だ！,Paper is an Art
笹と流線のゆかた,Bamboo Yukata
天使の弓のレシピ,Angel's Bow Recipe
よろず屋ピンドフ,General Shop Pindoff
真のレンダーシア,True Lendersia
メルサンにんじん,Melsan Carrot
シャイニーメロン,Shiny Melon
風車塔のほほえみ,Windmill Tower's Smile
ブランウッドの束,Branwood Bundle
ボロボロの魔神兵,Tattered Demon Soldier
しぐさ書・ビート,Emote "R n' B"
月のローブセット,Moon Outfit
ピクニックラウル,Rahul Picnic
シルエット・庭草,Silhouette Grass (G)
学園の教室の教壇,School Classroom Podium
苺お菓子のタンス,Berry Sweet Wardrobe
マリーンの宝石袋,Malynn's Jewel Bag
プラコン美容院券,Beauty Salon Ticket
きょくげいスキル,Litheness skill
夢の王国ドレス上,Dream Kingdom Shirt
くさった死体・強,Vicious Walking Corpse
リリオルを探せ！,Find Lyriol!
チャンスコマンド,Chance command
祈願の神殿の金庫,Gratitemple Safe
素材屋・コイン屋,Material Shop/Coin Shop
さみだれ突き・零,Multithrust+
第１１回ラウル像,11th Rahul Statue
まもの使いハウス,Monster Master House
帝国三将軍練習札,Triumgorate Tag
トーテムサンダル,Totem Sandals
ラニアッカ断層帯,Raniakka Fault Zone
クイーンのカード,Queen Card
ゾーマ　ソウリョ,Zoma, Priest
ブラッディヘッド,Bloody Horns
預かり所スリーズ,Storage Sleaze
機工博士のぼうし,Engineer's Hat
密林の暴獣ザベス,Jungle Beast Zabeth
お菓子な武器大全,Candy Weapon Compendium
なけなしのおかね,Bag with Little Money
スターリーブーツ,Starry Boots
絆のエンブレム改,Uber Bonding Emblem
悪しき水の洞くつ,Foulwater Cave
たたきモグラの像,Mashing Mole Statue
カスタム屋プポル,Custom Shop Pupol
マーブルステッキ,Marble Wand
ヘルヴェルの上司,Helvel's Superior
ふわふわメンダコ,Fluffy Flapjack Octopus
銀河のかみかざり,Galaxy Hair Ornament
ボンボントップス,Pompom Top
取引商フィーリア,Trader Philia
管理人マルリーヌ,Caretaker Marlene
みつあみエクステ,Braid Extension
アビスキャンディ,Abyss Lollipop
魔物管理人レジエ,Monster Manager Regie
ガナドールブーツ,Victor Boots
ロイヤルミミック,Royal Mimic
奇跡の万能ぶくろ,Miracle All-Purpose Bag
ツイストサイダー,Twist Cider
ジア燃石生産場１,Diatite Production Plant 1
ツボ錬金設備・庭,Pot Alchemy Facility(G)
星夜を待ちながら,Waiting for the Stars
ギガスクラッパー,Giga Scrapper
ふわふわモーグリ,Fluffy Moogle
ライトタルト・小,Small Light Tart
療養地区の移動台,Medical District Platform
巨象のフライパン,Naumanncook's Frypan
マホトラのころも,Magic Cloak
暴走したコウリン,Berserk Kourin
魔物管理人モモノ,Monster Manager Sanguino
ドラゴンクロー改,Uber Dragon Claws
しびれくらげ０４,Man o' War 04
極天女帝のぼうし,Sky Empress Hat
世界樹のよろい下,Yggdrasil Armor Bottom
鍛冶素材屋タブロ,Smithing Materials Tablo
邪神ヤファギル封,Yaphagil, the Seal
郵便局員ブノワト,Postman Bunwato
イプチャルの鉱石,Yppchal's Ore
超かがやきの樹液,Super Sparkly Sap
キュルル花火・黄,Yellow Kyururu Firework
高貴な紋付はかま,Noble Crest Hakama
マジカルクラウン,Magical Crown
氷結らんげき・改,Crushed Ice+
住宅素材屋セスタ,Housing Materials Cesta
アサガオのアーチ,Morning Glory Arch
ヴァルハラの館へ,To Valhalla Hall
パティシエの服下,Pastry Chef Bottom
聖王のオノの壁画,Dryspell Axe Book
ピクニックアサヒ,Asahi Picnic
おくびょうな白猫,Cowardly White Cat
ストリートパンツ,Street Pants
ガーデンパンプス,Garden Pumps
デスマスターの証,Death Certificate
トリックランタン,Trick Lantern
白亜の博物館の塀,Chalk Museum Fence
しぐさ書・お弁当,Emote "Lunch Box"
アツアツグラタン,Piping Hot Gratin
たまねぎスライム,Onion Slime
グレイブディガー,Grave Digger
壁かけ団子花飾り,Dumpling Floral Decor
アリアハンブーツ,Aliahan Boots
よろず屋ポロペン,General Shop Poropen
フライングスター,Flying Star
星型ランタンの木,Star Lantern Tree
古強者のよろい上,Veteran's Cuirass
てれぱすたいつⅡ,Telepath Tights Ⅱ
武器屋バーニジア,Weapon Shop Banijia
ピクシーシューズ,Pixie Shoes
ダークレアリズム,Dark Realism
シスター・モンテ,Sister Monte
光の郷フィネトカ,Finetka
ジュレット住宅村,Julet Residences
なかまモンスター,fellow monster
ハクオウフェイク,Hakuo Fake
Ⅰ‐スペーディオ,Ⅰ‐Wulfspade
ガーディアンの証,Protector's Pin
りゅうおうソード,Dragonlord Sword
ひとくいばこ・祖,Ancestor Cannibox
スラシャボンの像,Liq. Soap Slime Statue
カメさまカプセル,Galapagod Toy
ギュッと時の化身,Tockle Arm Doll
ピクニックカミル,Kamil Picnic
ぷりんせすどれす,Princess Dress
ブレイブクリーム,Brave Cream
マローネトランプ,Marone Deck
エテーネの服一式,Ethene Clothes Set
不死の幻影のオノ,Immortal Phantom Axe
便せん屋イトクリ,Stationery Shop Itokuri
ツインアンテナＢ,Twin Antenna B
料理屋クレッセル,Server Kressel
大会係員ブルバー,Event Staff Bruba
預かり所ヤーディ,Storage Yadi
疾き盗賊のブーツ,Erik's Boots
クリスタルクロー,Crystal Claws
青色パンジーの傘,Blue Pansy Umbrella
マリン調のベッド,Marine Bed
アスフェルド学園,Asfeld Academy
ショコラなブレス,Cholocate Bracers
絶牙の白獅子たち,White Fang Lions
こわれたスロット,Broken Slot Machine
よろず屋ヒャッカ,General Shop Hyakka
おうち用青空天井,Blue Sky Ceiling
管理人アチュリン,Caretaker Achurin
預かり所ネージュ,Storage Neige
レースの観客２９,Race Spectator 29
アルテミスの恵み,Artemis' Blessing
ヘルガーディアン,Hell's Gatekeeper
鋼殻のトロフィー,Steel Shell Trophy
BGMテストボス部屋,BGM boss test room
笑う地獄の大公爵,Duke of Hell Laughing
バシっ娘ルンリィ,Bazoom Girl Lunry
預かり所エパニエ,Storage Epanie
りゅうおうワンド,True Dragonlord Staff
ダマスク模様の壁,Damask Pattern Wall
ビーナスのなみだ,Venus' Tear
新エテーネの脚帯,New Ethene Gaiters
プリーストナイト,Priest Knight
武器鍛冶作業着下,Weaponsmith's Apron
カラミティキング,Calamity King
さびたペンダント,Rusty Pendant
ラブリークッキー,Lovely Cookies
アシッドテンプル,Acid Temple
鋼鉄巨兵のピアス,Steel Giant Earring
コーラルディモス,Coral Dimos
輝天のスティック,Sky Wand
かばうの性能変化,Chopping Block
カミハルムイ領北,Kamiharmui North
ペロリンステッキ,Lolly Stick
黄昏の詩人の楽譜,Twilight Poet's Score
怪盗ポイックリン,Phantom Thief Poiclin
静かなる湿原地区,Quiet Marshlands
飛竜の巣のベッド,Flying Dragon Nest Bed
コバルト池のカギ,Cobalt Pond Key
ノコギリエイ・黄,Yellow Sawfish
ドラグーンソード,Dragoon Sword
ミラクルスライム,Miracle Slime
カラフルチケット,Colorful Ticket
グランゼドーラ駅,Gran Zedora Station
ファラスのズボン,Faras' Pants
おっかけパンサー,Chasing Panther
くさりかたびら下,Chain Mail Bottom
リウ老師の探知機,Master Liu's Locator
イーギュアの大牙,Rapscallion's Fang
ネタ「かんおけ」,Coffin Trick
預かり所パルーラ,Storage Parula
どうぐやえいなる,Item Shop Einar
矢文のポスト・青,Blue Arrow Mailbox
キング釜プリズム,King Pot Prism
魔元帥ゼルドラド,Marshal Zeldrad
クロッコの全財産,Crocco's Belongings
ホイミントブーツ,Heal Mint Boots
レースの観客２０,Race Spectator 20
人食い火竜コイン,Tatsunaga Coin
マスター・リリム,Guildmaster Lilim
邪神ヴァニタトス,Dark Deity Vanitatos
ふわふわホホジロ,Fluffy Shark
神獣アマカムシカ,Amazlantelope
ふわふわコウリン,Fluffy Kourin
念晶錬磨場・中級,Telecrystal Refinery - Intermediate
花柄モダンはかま,Modern Floral Hakama
白いヴェールの女,White Veiled Woman
ファラストランプ,Faras Cards
交換屋クラリッサ,Exchange Shop Clarissa
