ゴクラクギョ・白,White Betta
氷の領界のベッド,Ice Realm Bed
パペットマン・強,Vicious Magic Marionette
ストレッチかばん,Stretchy Bag
ファイアブレイク,Fire Break
クラシック風の壁,Classic Wall
ブチブタカプセル,Spotted Pig Toy
赤組のたいそう着,Red Team Track Suit
デュークアックス,Aristocrat's Axe
ヒュプノスハント,Persecutter
ヴァースのほら穴,Verse Cave
真実に気づいた男,Man Who Realized Truth
ドラパンクネイル,Dracky Punk Nails
中型魔神機開発部,Medium Aztech Development
ふくめんうさぎ２,Masked Rabbit 2
プリズニャン・強,Vicious Jailcat
雪だるまつきの畑,Snowman Field
フルムーンチェア,Full Moon Chair
海のとける洞くつ,Sea Melting Cave
大型の丸い水そう,Round Aquarium L
大魔王のグローブ,Demon King Gloves
しあわせの玉手箱,Happiness Jewelry Box
三毛猫のグローブ,Calico Cat Gloves
あこがれの盗賊王,Longing for a Thief King
ロイヤルグローブ,Royal Gloves
暗黒の魔人コイン,Ruin Coin
しぐさ書・ねる２,Emote "Sleep 2"
合唱隊のニーハイ,Choir Knee-Highs
ネタ「キンスラ」,King Slime Trick
ウェディのパレオ,Weddie Pareo
ラグアストランプ,Raguas Cards
夕焼け雲のタンス,Sunset Cloud Wardrobe
壁画管理ペコリア,Mural Management Pekoria
ムーディーライト,Moody Light
しびれくらげ０６,Man o' War 06
預かり所ニノヤズ,Storage Ninoyazu
男性プラコン服白,White Clothes (M)
矢文のポスト・緑,Green Arrow Mailbox
ベスのカレーパン,She-Slime Curry Bread
ファラザード兵Ｂ,Farazard Soldier B
ほっとヘッドホン,Soft Headphones
Ⅰ‐ディアノーグ,Ⅰ‐Diamagon
キュララな夏休み,Kyurara Summer Holiday
闇騎士のグローブ,Dark Knight Gloves
ゾーマ　ケンジャ,Zoma, Sage
ピクニックアサヒ,Asahi Picnic
妖精変身ステッキ,Fairy Makeover Wand
しぐさ書・指さす,Emote "Point"
賢者セレディーネ,Sage Celedine
ガートラント城駅,Gartlant Castle Station
クエド丘陵への道,Road to Kuedo Hill
預かり所ニューネ,Storage Newne
パティシエの帽子,Pastry Chef Hat
ドラゴンステップ,Dragon Step
ウェナールピアス,Wenal Earrings
ファータウィング,Fata Wings
ゴシックコート上,Gothic Coat Top
まわりにチャット,Nearby Chat
フェザーマジック,Feather Magic
タイタス号の積荷,Titus Cargo
壁かけ穴ミイラ男,Mummy Boy Hole
さいほう設備・庭,Sewing Facility (G)
男性花柄のゆかた,Men's Floral Yukata
プクリポチェスト,Pukulipo Chest
やみのしょくだい,Sconstrosity
古代魔術のぼうし,Ancient Magic Hat
ポイズンスケイル,Serpentscale Skean
ヤマカミヌの木簡,Yamakaminu Wood Letter
トランプスカート,Tycoon Skirt
住宅素材屋ニーノ,Housing Materials Nino
ぴえろいしょうⅠ,Clown Costume Ⅰ
ストライプゆかた,Striped Yukata
魔人エンラージャ,Genie Enraja
木の葉のよろい下,Foliage Armor Bottom
マザー・リオーネ,Mother Lione
ハンターグローブ,Hunter Gloves
エンジョイダンス,Enjoy Dance
ピクシーシューズ,Pixie Shoes
レシピ屋ユシレピ,Recipe Shop Yusirepi
スノースティック,Snow Stick
チェーンジーンズ,Chain Jeans
ディバインランス,Divine Lance
出張大使ポミリン,Ambassador Pomirin
不死の幻影のオノ,Immortal Phantom Axe
オノでエキサイト,Excite With an Axe
預かり所パーシリ,Storage Pashiri
カボチャのガゼボ,Pumpkin Gazebo
アクロバットの像,Acro Bat Statue
ライダーグローブ,Rider Gloves
海賊なりきり財宝,Pirate Treasure
ホワイトホイップ,White Chocolate Whisp
シグナルウィング,Wing Signal
ゴスバニーシール,Goth Bunny Sticker
模様入り木板の柱,Patterned Wood Pillar
とこなつハッピ下,Summer Skirt
春風の吹く日まで,When a Spring Wind Blows
心をつなぐ初仕事,First Job, Connect Minds
ウルベア魔神兵強,Apex Urbea Aztech
タータンスーツ下,Tartan Suit Bottom
勇者姫アンルシア,Hero Anlucia
アイドルスーツ下,Idol Pants
ブレイブストーン,Brave Stone
丁目採掘現場地区,Block Mining Site
よろず屋パサンタ,General Shop Pasanta
時獄獣キュロノス,Kyuronos, Beast of Time
道化師のグローブ,Buffoon's Gloves
フラワーウィング,Flower Wings
ルティショー像茶,Tea Astolti Short St.
風車塔のほほえみ,Windmill Tower's Smile
シャイニングボウ,Shining Shot
一本角のあやかし,One-horned Ghost
紫水晶のキッチン,Amethyst Kitchen
アンノウンサイズ,Unknown Scythe
今年のブレス対策,Breath Countermeasures
福笑いのラグ・目,Fukuwarai Eye Rug
ザハディガル岩峰,Zahadigal Rock Peak
錬金強化屋アーク,Alchemy Enhancement Shop Arc
波間に消えた記憶,Memory Lost in the Waves
家出したスープル,Runaway Slurple
氷のシャンデリア,Ice Chandelier
ルベランアックス,Ruberan Axe
チェイサーバンド,Chaser Headband
ふくろう観察日記,Owl Observation Diary
ドッグラマッコイ,Dogjamas
ガズバランの牙Ｂ,Gazbalan's Fang B
秘密の部屋・倉庫,Secret Room - Storage
若き彫刻家の才能,Young Sculptor's Talent
貢献賞トロフィー,Contribution Trophy
特技の射程距離+2m,Skill Range +2m
竜のうろこの破片,Dragon Scale Shard
闇の領界のアーチ,Dark Realm Arch
しぐさ書・自撮り,Emote "Selfie"
ＶＩＰライセンス,VIP License
ファラザード兵Ａ,Farazard Soldier A
大型魔神機開発部,Large Aztech Development
もみじこぞう・強,Vicious Leafy Larrikin
グレモリーの紋章,Gremory Crest
大理石の置き時計,Marble Table Clock
大会係員ブルバー,Event Staff Bruba
プリティリュック,Pretty Backpack
はじめてのドレス,My First Dress
グランマーズの門,Madame Luca's Gate
ダイバーゴーグル,Diver Goggles
マーブルステッキ,Marble Wand
シュメリアヒール,Sumeria Heels
スライムチケット,Slime Ticket
カルサドラの風穴,Calsadora Wind Cave
便せん屋ヒメウズ,Stationery Shop Himeuzu
ブラバニクイーン,Dark Hare
デルクロアの研究,Delcroix's Research
預かり所トッケロ,Storage Tokkero
ハッピーくじ印章,Happy Lottery Stamp
マジカルドレス下,Magical Dress Bottom
おもちゃの池・雪,Toy Pond (Snow)
大地の箱舟　終幕,Ark of the Earth End Act
ドラゴンチケット,Dragon Ticket
素材屋ミルフィプ,Material Shop Mirfpu
マーメイドパレオ,Mermaid Pareo
ルビーのドレス上,Ruby's Dress Top
ジャンボトマト２,Jumbo Tomato 2
案内係ロマンツェ,Guide Romanze
笹と流線のゆかた,Bamboo Yukata
真夜中プリズラン,Midnight Jailrun
マッピング計測器,Mapping Instrument
魔女の長日傘・青,Blue Witch Day Umbrella
管理人マルリーヌ,Caretaker Marlene
預かり所クローブ,Storage Clove
常時呪文暴走率+2%,Haywire Rate +2%
ピコのヘアアクセ,Pico's Hair Accessory
魔盗鬼チャムール,Devilish Thief Chamour
預かり所トゥーブ,Storage Toube
クリスマスライブ,Christmas Live
マーメイド仕切り,Mermaid Partition
女王たちきりバチ,Queen Buzzbee
ナジーンカプセル,Nazine Toy
マスター・ラセド,Guildmaster Rasedo
「此岸」の展示室,"Coastal" Exhibit Room
妖精の隠れ家の塀,Fairy Lair Fence
リンカのグローブ,Linka's Gloves
アデリーカプセル,Adelie Penguin Toy
レースの観客０４,Race Spectator 04
しょうにんぼった,Merchant Botta
DQ3賢者女　ゾーマ,DQ3 Sage (F), Zoma
武勲の城の庭園灯,Valor Castle Light (G)
アンルシアソファ,Anlucia Sofa
かんだたみならい,Robbin' 'Ood Amateur
ワイルドシューズ,Wild Shoes
強化屋スコルピィ,Boost Shop Scorpi
釣り鐘守りの日記,Bell Keeper's Diary
悪神の心域２印章,Fiend's Heartlands 2 Stamp
インテリサンダル,Scholar's Sandals
子供の家ペコリア,Child House Pekoria
素材屋看板と敷物,Material Shop Sign and Floor
ファンキーヘッド,Funky Hair Ornament
フラワーサンダル,Flower Sandals
ハンモックベッド,Hammock Bed
１階への転送装置,Transporter to 1F
ホワイトジャッジ,White Judge
道具鍛冶作業着下,Toolsmith's Apron
しぐさ書・身支度,Emote "Get Ready"
魔想念ガルドドン,Demonic Thought Gardodon
小さな民家の模型,Small House Model
シスター・ニニカ,Sister Ninika
悪霊の仮面の破片,Evil Spirit Mask Shard
メカニックブーツ,Mechanic Boots
ザイナー衛士団長,Guard Commander Zeiner
道具屋ポッピーナ,Item Shop Poppina
魔天士ダンタール,Sky Sorcerer Dantal
ウェディ秘書モブ,Weddie Secretary Mob
バンデッドブーツ,Brigand's Boots
バラのスティック,Rose Wand
妖精のトンガリ靴,Fairy Shoes
パルミオの研究所,Palmio's Laboratory
ディバインヘルム,Divine Helm
ピリからペッパー,Hot Stuff
エンゼルショット,Angel Shot
放送局員ドラビー,Broadcaster DV
しびれくらげ０９,Man o' War 09
フォースシールド,Force Shield
ジャングルリップ,Jungle Tulip
魚交換員ポッツァ,Fish Exchange Pozza
シスター・イオリ,Sister Iori
レンダーシア内海,Lendersia Inland Sea
案内係エリーシェ,Guide Elishe
竜王のツメの伝説,Dragonlord Claws Legend
郵便局員モルーゼ,Postman Morusei
東洋風ベッド・雅,Chic Orient Bed
絆のエンブレム極,Apex Bonding Emblem
カジノオルゴール,Casino Music Box
シスター・ミペカ,Sister Mipeka
合唱隊のスモック,Choir Smock
ドラゴンクロー絶,Apex Dragon Claws
マスカットの花束,Muscat Bouquet
シーサイドランプ,Seaside Lamp
脱・辺境ドリーム,Unremote Dream
プチ伝説の三悪魔,Frail Legendary Evils
ぶれいくすたいる,Break Style
水晶のカウンタ小,Crystal Counter S
下級亡霊兵士たち,Lowly Spirit Soldiers
ふくびき魔法ビン,Lottery Flask
竜術士のグローブ,Dragomancer Gloves
コルセアマント下,Corsair Pants
ピンクタイフーン,Pink Typhoon
ある孤児が見た空,Orphan's View of the Sky
グリーンアロワナ,Green Arowana
ウルフキャンディ,Wolf Lollipop
楽しい扇の作り方,Fun Fan Making
カエルの置物・庭,Frog Ornament (G)
ベルヴァインの森,Belvain Forest
メレアーデの部屋,Mereade's Room
魂を刈り取る天使,Angel Who Reaps Souls
黄色パンジーの傘,Yellow Pansy Umbrella
謎の夢幻郷の写真,Mystery Dream City Photo
ギルガランのくつ,Gilgaran's Shoes
ごうかなイス・緑,Green Fancy Chair
武器鍛冶作業着上,Weaponsmith's Top
レース刺繍の日傘,Embroidered Umbrella
茶ブチ猫カプセル,Tea Spotted Cat Toy
あやしいかげ・強,Vicious Shade
預かり侍女アトリ,Storage Maid Ally
ごうかな玉座・緑,Green Fancy Throne
神光放つ短剣の書,Holy Light Dagger Book
世界樹のよろい下,Yggdrasil Armor Bottom
ヘルゲゴーグ・烈,Reinforced Helgegog
ファーグスオイル,Fargus Oil
カイトバックラー,Kite Buckler
ベビタングローブ,Imp Gloves
シックゴスセット,Chic Goth Outfit
じんめんじゅの像,Treeface Statue
オーフィーヌ海底,Orfine Seabed
トナカイシューズ,Reindeer Boots
せんすいふくあか,Red Diving Suit
深淵をのぞくもの,Look Into The Abyss
祈願の神殿の金庫,Gratitemple Safe
はがねのかなづち,Steel Hammer
天ツ風の原への道,Road to Howling Highlands
中腹への道　出口,Path to Halfway Exit
シスター・マキリ,Sister Makiri
奈落いざなう棺桶,Coffin to the Abyss
灰ねこの便利な壁,Ash Cat Wall
ネブラ用とうめい,Transparent for Nebula
まんじゅシャモン,Shamanju
白亜の博物館の塀,Chalk Museum Fence
ミスターガリック,Garish Garlic
魔物管理人シュン,Monster Manager Shuna
タウルスハンマー,Taurus Hammer
レースの観客１２,Race Spectator 12
小型の和風水そう,Japanese Aquarium S
超高性能スコップ,Ultra High Power Shovel
敵を倒すとためる,Tension On Enemy Defeat
しゃしょうばぎー,Conductor Bagy
酒場のオルゴール,Tavern Music Box
中枢へ向かう通路,Passage to Core
マーメイドハープ,Lorelei's Harp
バッジ交換券・光,Light Badge Ticket
ガートラント兵５,Gartlant Soldier 5
ユシュカカプセル,Yushka Toy
景品交換所コルナ,Prize Exchange Koruna
カジュアルブレス,Casual Bracelet
太陽の斧を求めて,Seeking Apollo's Axe
三闘キノコの胞子,Funguy Spores
シグナルクラウン,Crown Signal
魚交換員ピペッタ,Fish Exchange Pipetta
装飾具屋ピッタン,Decoration Shop Pittan
プクレットの桃花,Pink Pukulet Flowers
シュメリアピアス,Sumeria Earrings
初心者用の片手剣,Beginner's Sword
大魔王顔壁への道,Road to The Faces of Evil
黒夜叉のよろい上,Black Bane Armor
ウィンターブーツ,Winter Boots
学園女子の夏服上,Schoolgirl Summer Top
オーロラパウダー,Aurora Powder
たったひとつの絆,Only One Bond
グレイナル叙事詩,Epic of Greygnarl
聖王の大盾の壁画,Dryspell Grtshd Book
レースの観客２１,Race Spectator 21
転送係エグバート,Transfer Agent Egbert
スチームスーツ上,Steam Suit Top
カリスマクリーム,Charisma Cream
ラッカラン住宅村,Luckland Residences
工匠神のむねあて,Crafting God's Top
カイザードラゴン,Royal Reptile
キナリ猫カプセル,Kinari Cat Toy
お菓子のオーブン,Sweet Oven
魚交換員パパルパ,Fish Exchange Papalupa
古代王族のベスト,Ancient Royal Vest
よろず屋リューロ,General Shop Ryuro
バケットウィッグ,Bucket Wig
しびれくらげ２５,Man o' War 25
ゴクラクギョ・青,Blue Betta
住宅素材屋ペペプ,Housing Materials Pepepu
グレン風たいまつ,Glen-Style Brazier
デュエルキャップ,Duel Cap
パラディンの伝説,Legend of Paladin
聖騎士のグリーブ,Holy Knight Greaves
ポポラパの最深部,Popolapa Depths
次期天使長の行方,Find The Next Archangel
はるかなる釣り道,Faraway Fishing Path
ホイミントブーツ,Heal Mint Boots
ストリートリスト,Street Wristbands
にじいろの布きれ,Technicolor Dreamcloth
パンドラチェスト,Pandoradrobe
アンノウンファン,Unknown Fan
紫色パンジーの傘,Purple Pansy Umbrella
ボロボロの指針書,Tattered Guidebook
ワイルドバングル,Wild Bangles
今そこにいる辛党,Now That's a Spicy Party
シーサイドソファ,Seaside Sofa
療養地区の移動台,Medical Area Platform
みかづきプリズム,Crescent Moon Prism
ジュエルシャワー,Jewel Shower
よろこびの玉手箱,Joyful Jewelry Box
あるへいしちょう,Soldier To Be
森林警備隊ブーツ,Forest Ranger Boots
星の職人道具絵巻,Starry Craftsman Book
ダッフルグローブ,Duffel Gloves
光のさいほう針小,Light Sew Needle S
聖女に守られし盾,Saint Protected Shield
レースの観客２７,Race Spectator 27
戦神の箱＋４・改,War God's Box +4 v2
オス三毛猫スーツ,Calico Cat Suit (M)
魔法戦士団制服２,Armamentalist Uniform 2
デスマスの礼服下,Death Master Bottom
ＣＭ用ウェディ１,Weddie For CM 1
ボロボロのリボン,Tattered Ribbon
スチームイス・赤,Red Steam Chair
七夕・雲払いの書,Festival Cloud Sweeper
えきいんぼうまん,Attendant Bowma
星空のベッド・紫,Purple Starry Bed
イルーシャのペン,Irusha's Pen
おおとろの切り身,Tuna Belly
第８回パドレの像,8th Padre Statue
チャージ時間-15秒,Charge Time -15 sec.
寒鬼団長アレル樹,Cold Demon Tree Alleru
あやしいバスタブ,Suspicious Bathtub
ライダース衣装券,Rider Outfit Ticket
建物屋ペルホネン,Building Shop Pelhonen
プリンセスドレス,Princess Dress
特技の範囲距離+1m,Skill Range +1m
へびのおうぎの本,Cobra Fan Book
魚交換員ビンチュ,Fish Exchange Bincho
春風応援スカート,Spring Cheer Skirt
スイの塔への出口,Exit to Sui Tower
ホイミントバンド,Heal Mint Headband
ヴァルハラの館へ,To Valhalla Hall
ミステリーチョコ,Mystery Chocolate
クリスマスツリー,Christmas Tree
ドラゴン花火・青,Blue Dragon Firework
魚交換員ペコリア,Fish Exchange Pekoria
オーロラウンダー,Aurorarounder
海冥主メイヴの像,Meiv Statue
それは誰がために,To Whom it May Concern
３段ブロック・赤,Red 3-Step Block
お祝いクラッカー,Celebration Popper
エメラルドリリィ,Emerald Lily
弐の式修了の陰符,Yin II Completion Charm
（だいじなもの）, (Key Item)
殺りくのグレボス,Killer Grevos
ネタ「スライム」,Slime Trick
ドラグーンランス,Dragoon Lance
ブレイクスタイル,Break Style
ホーリーローブ下,Holy Robe Bottom
転職神官ハクドウ,Vocation Priest Hakudo
エステラの便せん,Estella Paper
ルベランシールド,Ruberan Shield
トーテムサンダル,Totem Sandals
預かり所グルバン,Storage Gureban
エルボブ像グレー,Gray Eltona Bobtail St.
地底湖の洞くつ前,Underground Lake Cave
結界の守護者たち,Guardians of the Barrier
マジカル姫ぞうり,Magical Sandals
スウィートビキニ,Sweet Bikini
キリングエナジー,Killing Energy
預かり所マノリタ,Storage Manorita
武勲の城のタイル,Valor Castle Tile
クエスト代行受付,Quester's Behest
合唱隊のシューズ,Choir Shoes
びようしぱぱーな,Hairdresser Papana
ステューデントＳ,Student S
スカウト率アップ,Scout Rate Up
磁気式図書購入札,Magnet Book Purchase Tag
マスカルポンポン,Mascarponpon
じごくのたまねぎ,Brimstone Bulb
ドラゴン花火・緑,Green Dragon Firework
ぬすっとウサギ？,Robber Rabbit?
アサシンエミュー,Peckerel
パタプラのうきわ,Patapula's Floatie
手裏剣アイパッチ,Shuriken Eyepatch
セラフィＴシャツ,Seraphi T-Shirt
スライムベスラグ,She-Slime Rug
ブラニック採石場,Branick Quarry
武器鍛冶職人の道,The Weaponsmith's Way
メタスラチャイム,Metal Slime Chime
新兵支給むねあて,Recruit Breastplate
試練のケモノたち,Trial Beasts
丸型のトピアリー,Round Topiary
セラフィトランプ,Seraphi Cards
凍れる時獄の秘法,Art of Frozen Time
かたりべのブーツ,Storyteller's Boots
アルミラージの像,Spiked Hare Statue
ファラオプリズム,Pharaoh Prism
ガメゴンのこうら,Wyrtle Shell
壁かけ管理棟の窓,Admin Building Window
ナドラダイト鉱石,Nadradite
クオードのコート,Quard's Coat
強酸性の間　入口,Strong Acidity Entry
オパールのベッド,Opal Bed
新作家具屋モルド,New Furniture Shop Mordo
レシピ屋ルセット,Recipe Shop Ruseto
学園ゴシップ新聞,Academy Gossip News
魔塔銀行屋ボクス,Tower Banker Bokks
ボイスレコーダー,Voice Recorder
はじめてのルーペ,Beginner's Loupe
弱酸性の間　入口,Weak Acidity Entry
トナカイスーツ券,Reindeer Suit Ticket
魔法使いのぼうし,Mage Hat
聖使者キルパッポ,Holy Messenger Kilpappo
カボチャの食器棚,Pumpkin Cupboard
若者の家ペコリア,Youth House Pekoria
よろず屋ヤップイ,General Shop Yapui
ニンジンのタンス,Carrot Wardrobe
預かり所ディーズ,Storage Diz
イカダ風の座椅子,Raft-Style Legless Seat
ラニアッカ断層帯,Raniakka Fault Zone
中腹への道　入口,Path to Halfway Entry
ベルトロの部下Ｂ,Bertro Subordinate B
東洋風タンス・雅,Chic Orient Wardrobe
パティシエの服下,Pastry Chef Bottom
バンデッドバンド,Brigand's Band
形見のオルゴール,Keepsake Music Box
タイタス号のタル,Titus Barrel
壁かけおばけの窓,Haunted Window
デバフクリスタル,Debuff Crystal
シスター・トニア,Sister Tonia
ネタ「そうめん」,Noodles Trick
ゾーマ　ユウシャ,Zoma, Hero
三闘士のハンマー,Hammer of the Triad
キュルル花火・黄,Yellow Kyururu Firework
ライトニング無頼,Lightning Unreliable
感謝のエネルギー,Gratitude Energy
バルディアメタル,Valdia Metal
オニグモの盾の本,Spider Shield Book
ドラゴンベスト下,Dragon Pants
暴君バサグランデ,Tyrant Bogan
ふくめんうさぎ３,Masked Rabbit 3
ブルービックバン,Blue Big Bang
ロイヤルミミック,Royal Mimic
正統派盆栽セット,Orthodox Bonsai Set
美容師たちの祭典,Hairdresser Festival
パティシエのくつ,Pastry Chef Shoes
ドワーフ風アーチ,Dwarf-Style Arch
ふわふわ雲のラグ,Fluffy Cloud Rug
カエルパーカー下,Frog Shorts
ぶっちズキーニャ,Zumeanie
道具屋リーフィヤ,Item Shop Leafia
レシピ屋ペリンタ,Recipe Shop Perinta
みやびな飾り扇子,Elegant Decor Fan
バトエンフラッグ,Batoen Flag
時の車掌ゼーベス,Conductor of Time, Zebes
グランプリレシピ,Grand Prix Recipe
学園男子の海パン,Schoolboy Trunks
スターリーハット,Starry Hat
グロリアスブーツ,Glorious Boots
ロトのオルゴール,Erdrick Music Box
チェルシーの写真,Photo of Chelsea
しぐさ書・決め右,Emote "Pose Right"
ブラッドエイプス,Blood Apes
マスターシューズ,Master Shoes
エルダードラゴン,Elder Dragon
便せん屋イトクリ,Stationery Shop Itokuri
がうがうグローブ,Bow-Wow Gloves
魔物管理人レジエ,Monster Manager Regie
ドラキュラパーツ,Dracula Parts
コッケンの乗る棒,Kokken's Riding Crop
クリスマスライム,Christmas Slime
ギガンテス便せん,Gigantes Paper
ヴォルカドラゴン,Volcanic Dragon
ドミネウス王の杖,King Domineus' Staff
ももんじゃブーツ,Platypunk Boots
バカンウグレ遺跡,Bakanugure Ruins
ギーグハンマー強,Apex Giga Clubber
道具屋チャーロン,Item Shop Charon
エルフプランター,Elf Planter
夢占い師の水晶玉,Dreamer's Crystal Ball
エビルキュビズム,Evil Cubism
びっくりボックス,Trap Box
バラモスブロス強,Apex Soul of Baramos
飛竜のタマゴ割れ,Broken Flying Dragon Egg
水のサークレット,Flowing Circlet
キューピッド衣装,Cupid Costume
魔改造クリムゾン,Modified Crimson
ガーデンパンプス,Garden Pumps
惨禍の迷路への道,Path to Disaster's Maze
レースの観客０６,Race Spectator 06
素材屋のぼうし紅,Red Material Shop Cap
プチスライダーク,Frail Nemeslime
しぐさ書・つまむ,Emote "Picked Up"
ぬいぐるみ屋ウー,Plushie Shop Woo
ピクニックラウル,Raul Picnic
ビーストウィップ,Beastly Bullwhip
アンノウンクロー,Unknown Claws
管理端末Ｑ４８４,Management Terminal Q484
レビュールマリー,Reviewle Marie
フォーマルドレス,Formal Dress
グラコスの像・庭,Gracos Statue (G)
妖炎魔女の髪飾り,Fire Witch Hairpin
学園の教室のイス,School Classroom Chair
お正月の便利な壁,New Year Wall
えきいんぺいんず,Attendant Penzu
スノードーム・銀,Silver Snow Globe
紹介人ブルーレス,Introducer Blueleth
ゴールデンリング,Golden Ring
ラウルのグローブ,Raul's Gloves
住宅素材屋セスタ,Housing Materials Cesta
２階への転送装置,Transporter to 2F
カボチャチェスト,Pumpkin Chest
月うさぎのランプ,Moon Rabbit Lamp
フォトライフ・銅,Photo Life Bronze
エレガントヒール,Elegant Heels
あたまリボン茶券,Tea Head Ribbon Ticket
迅雷の丘への出口,Exit to Thundering Hills
ゲノミーキャップ,Crankiid Cap
バラのコサージュ,Rose Corsage
魚交換員ターラタ,Fish Exchange Tarata
スキップ係オウカ,Skipper Ouka
便せん屋ウィット,Stationery Shop Uito
さめきぐるみあお,Blue Shark Suit
めいたんていけち,Sleuth Kechi
サバ太猫カプセル,Fat Gray Cat Toy
怪蟲の広場の階下,Insect Square Lower
たちきりエリート,Buzzbeelite
ギュッとプオーン,Rebjorn Arm Doll
アラハギーロ城内,Al-Ahagiro Castle
観戦案内ヴェルト,Watch Guide Velt
スターダムスーツ,Stardom Suit
究明者のコート上,Research Coat Top
聖守護者のゆびわ,Sentinel's Ring
バトルシェイカー,Maracaraider
プスゴンステッキ,Pusgon Cane
しょうにんまっか,Merchant Macca
デンジャーランス,Danger Lance
ギルガランの服下,Gilgaran's Trousers
郵便局員ピティカ,Postman Pitica
ザンクローネの像,Zankrone Statue
主神グランゼニス,Gran Zenith
テレパスタイツⅡ,Telepath Tights Ⅱ
アンノウンダーク,Unknown Dirk
怪魔鳥バトロウス,Monstrous Bird Batros
モーモンゆず風呂,T. Sanguini Yuza Bath
星夜の長てぶくろ,Starry Night Long Gloves
カンフーパンプス,Kung Fu Pumps
防衛軍の制服・金,Gold Defense Force Suit
ふっくらにんにく,Plump Garlic
ブルーマリッジ島,Blue Marriage Island
シャコガイの大盾,Giant Clam Greatshield
スレア海岸の大樹,Surea Coast Large Tree
シンイのこころ６,Shini's Heart Lv. 6
フェンサーハット,Fencing Hat
インテリローブ上,Scholar's Robe Top
冒険の書のベッド,Adventure Log Bed
ドラグーンソード,Dragoon Sword
さめきぐるみあか,Red Shark Suit
カフェラテの花束,Latte Bouquet
しぐさ書・決め左,Emote "Pose Left"
アルゴンズポーチ,Argon Pouch
エルダーフレイム,Old Flame
預かり所ヘギンツ,Storage Hegints
デモンマウンテン,Demon Mountain
フルーツの便せん,Fruit Paper
渡し守アリーモス,Ferryman Alimos
サイドワインダー,Sidewinder
口調の書・オレ様,Tone Book - Tsundere
キャプテンハット,Captain's Hat
冬来たりなば……,Winter Comes...
武器防具屋ソロリ,Weapon & Armor Shop Sorori
黄金の飾り片手剣,Gold Ornament Sword
