アルファ用アルウェ王妃の別荘跡(子供たちの隠れ家内部Test),Queen Alwe's Villa Ruins for Alpha (Test Inside Children's Hideout)
バトル班用テストマップ（いにしえのゼルメア）,Team Battle Map Test (Ancient Zelmea)
どらごんくえすとえいとしゅじんこうのいしょう,DQⅧ Hero Costume
このマップは モンスターから逃げられません。,You can't run from monsters on this map.
マッチングテストステージ（同期後移動用）,Match test stage (for moving beat testing)
　　　～モンスター討伐隊隊員からの依頼～,         Monster Strike Force Request
マッチングテストステージ（同期テスト用）,Match test stage (for sync testing)
グランゼドーラ領-グランゼドーラ王国 入口,Gran Zedora Territory - Gran Zedora Kingdom Entry
リャナ荒涼地帯-ねじれたる異形の大地 入口,Lyana Desolate Area - Twisted Deformed Earth Entry
メルサンディ穀倉帯-メルサンディ村 入口,Melsandy Millfields - Melsandy Village Entry
メルサンディ穀倉帯-さびれたほこら 入口,Melsandy Millfields - Deserted Shrine Entry
アラハギーロ地方-アラハギーロ王国 入口,Al-Ahagiro Region - Kingdom of Al-Ahagiro Entry
メルサンディ穀倉帯-こもれびの広場 入口,Melsandy Millfields - Sunbeam Square Entry
アラハギーロ地方-モンスター格闘場 入口,Al-Ahagiro Region - Monster Arena Entry
ぷらこんだんせいようそくたいむらさき,Purple Ceremony Gown
バトル班用テストマップ（ムスト廃墟）,Team Battle Map Test (Musuto Ruins)
季節イベント「お月見」　コンパニオン,Seasonal Event "Moon View" Companion
季節イベント「オ月見」　コンパニオン,Seasonal Event "Moon View" Companion
アラハギーロ地方-ムルードの岩山 入口,Al-Ahagiro Region - Murudo Mountain Entry
メルサンディ穀倉帯-メルン水車郷 入口,Melsandy Millfields - Melun Watermill Entry
アラハギーロ地方-日除けのほら穴 入口,Al-Ahagiro Region - Sunshade Cave Entry
ぷらこんすくーるせいふくおんなちゃ,Brown School Uniform (F)
ぷらこんすくーるせいふくおとこあか,Red School Uniform (M)
ぷらこんだんせいようそくたいみどり,Green Ceremony Gown
ぷらこんすくーるせいふくおんなくろ,Black School Uniform (F)
ぷらこんすくーるせいふくおんなこん,Blue School Uniform (F)
ぷらこんすくーるせいふくおとここん,Blue School Uniform (M)
ぷらこんすくーるせいふくおとこちゃ,Brown School Uniform (M)
ぷらこんすくーるせいふくおんなしろ,White School Uniform (F)
神代過ぎ～　春の桜よ　無為に咲く～,Past ages divine, the spring blossoms bloom, waiting idly by...
ぷらこんすくーるせいふくおとこくろ,Black School Uniform (M)
ルファ神殿エントランス（オープン）,Rufa Temple - Entry (Open)
ぷらこんすくーるせいふくおとこしろ,White School Uniform (M)
ぷらこんすくーるせいふくおんなあか,Red School Uniform (F)
コニウェア平原-ココラタの浜辺 入口,Coniware Plain - Cocolata Beach Entry
リャナ荒涼地帯-ソーラリア峡谷 入口,Lyana Desolate Area - Solaria Canyon Entry
アルファ用井戸(ダンダダ団のアジト),Well for Alpha (Robbin' 'Ood Gang HQ)
バトル班用テストマップ(ツスクル）,Team Battle Map Test (Tsusukuru)
ぷらこんじょせいしのびのふくもも,Pink Women's Ninja Suit
ぷらこんだんせいしのびのふくちゃ,Tea Men's Ninja Suit
じょせいぷらこんふくあいすぶるー,Ice Blue Clothes (F)
ぷらこんじょせいしのびのふくあお,Blue Women's Ninja Suit
ぷらこんじょせいみこふくむらさき,Purple Priestess Dress
ぷらこんじょせいようみどりさんた,Green Women's Santa Suit
ぷらこんだんせいようそくたいちゃ,Tea Ceremony Gown
プンスコのテーブル＆ティーセット,Punsuko's Table & Tea Set
バトル班用テストマップ（獅子門）,Team Battle Map Test (Lion Gate)
あすふぇるどがくえんがくせいふく,Asfeld Academy Uniform
ぷらこんじょせいしのびのふくくろ,Black Women's Ninja Suit
だんせいぷらこんふくみすとぐれー,Mist Gray Clothes (M)
ぷらこんじょせいむらさきふりそで,Purple Women's Kimono
ぷらこんじょせいしのびのふくこん,Navy Women's Ninja Suit
じょせいぷらこんふくみっどないと,Midnight Clothes (F)
だんせいぷらこんふくだーくぐれー,Dark Gray Clothes (M)
だんせいぷらこんふくみっどないと,Midnight Clothes (M)
ぷらこんだんせいようそくたいはい,Ash Ceremony Gown
ぷらこんじょせいしのびのふくあか,Red Women's Ninja Suit
ぷらこんだんせいようそくたいあお,Blue Ceremony Gown
ぷらこんだんせいしのびのふくあか,Red Men's Ninja Suit
ぷらこんだんせいようみどりさんた,Green Men's Santa Suit
ぷらこんだんせいしのびのふくこん,Navy Men's Ninja Suit
ぷらこんだんせいしのびのふくあお,Blue Men's Ninja Suit
ぷらこんだんせいしのびのふくくろ,Black Men's Ninja Suit
マデ島＆エテーネ王宮（4.5CS専用）,Made Isle & Ethene Royal Manor (4.5CS only)
リンジャハル海岸-教会シスター 前,Linjahar Coast - Church Sister
セレドット山道-ベリルのほら穴 前,Celedot Mountain Pass - Beryl Den
レビュール街道北-海風の洞くつ 前,Reviewle Highway North - Seabreeze Cave
リンジャハル海岸-リンジャの塔 前,Linjahar Coast - Linja Tower
攻撃力上昇時特技ダメ+20(試合無効),Skill Dmg. While Atk. ↑ +20 (PvP×)
プログラマー用負荷検証ステージ3,Loading Programmer Verification Stage 3
追憶の世界-アルウェ王妃の別荘跡,World of Remembrance-The Ruins of Queen Alwe
プログラマー用負荷検証ステージ2,Loading Programmer Verification Stage 2
プログラマー用負荷検証ステージ1,Loading Programmer Verification Stage 1
プログラマー用負荷検証ステージ4,Loading Programmer Verification Stage 4
受けた属性ダメージの 10%ＨＰ回復,10% Attribute Damage Taken As HP
プログラマー用負荷検証ステージ5,Loading Programmer Verification Stage 5
ぷらこんこどもようみずぎせっと,Children's Swimsuit
ゴリウスの怨霊＆魔道士キルギル,Gorius' Vengeance & Wizard Kirgyl
ぷらこんじょせいようももあろは,Pink Women's Aloha
ぷらこんじょせいようしろあろは,White Women's Aloha
ぷらこんじょせいようあかさんた,Red Women's Santa Suit
じょせいぷらこんふくさんせっと,Sunset Clothes (F)
ぷらこんじょせいようあかあろは,Red Women's Aloha
ぷらこんだんせいようももあろは,Pink Men's Aloha
ぷらこんじょせいようしろさんた,White Women's Santa Suit
ぷらこんだんせいようあおあろは,Blue Men's Aloha
えるどなしんのしょうぞくせっと,Eldona's Outfit
ぷらこんだんせいはかまむらさき,Purple Men's Hakama
ぷらこんだんせいようももさんた,Pink Men's Santa Suit
はなかりゅうどのころもむらさき,Purple Flower Hunter Outfit
ぷらこんだんせいようしろあろは,White Men's Aloha
30%の確率で受けたダメージ10%反射,30% Chance to Reflect 10% Damage
壊れたアストルティアのコンパス,Broken Astoltia Compass
\s\m\eは　ダイスをふった。　→　,\s\m\e rolls a die. → It's a !
瀕死時 15%こうげき力+60(試合無効),Attack +60 On Death 15% (PvP×)
ぷらこんだんせいようしろさんた,White Men's Santa Suit
\s\m\eは　コインをなげた。　→　,\s\m\e flips a coin. → The coin lands on !
ぷらこんじょせいようくろさんた,Black Women's Santa Suit
味方死亡時 50%でためる(試合無効),Tension Revenge 50% (PvP×)
扉は　かたく　閉ざされている。,The door is tightly closed.
ぷらこんじょせいようももさんた,Pink Women's Santa Suit
ぷらこんだんせいようあかさんた,Red Men's Santa Suit
魔天の勇者＆聖夜の破壊者・雪組,Demon Sky Hero & Holy Night Wrecker Snow Team
ぼうえいぐんのせいふくはいいろ,Gray Defense Force Suit
ぼうえいぐんのせいふくむらさき,Purple Defense Force Suit
魔天の勇者＆聖夜の破壊者・闇組,Demon Sky Hero & Holy Night Wrecker Dark Team
瀕死時 20%こうげき力+60(試合無効),Attack +60 On Death 20% (PvP×)
ぷらこんじょせいようあおあろは,Blue Women's Aloha
ぷらこんだんせいようくろさんた,Black Men's Santa Suit
ぷらこんじょせいみこふくみどり,Green Priestess Dress
\s\m\eは　カードを引いた。　→　,\s\m\e draws a card. → They drew the !
豪魔将ベリンダ＆豪魔将ブレンダ,Generals Belinda & Brenda
ドラクロン山地-竜守りの小屋 前,Draklon Mountains - Dragon Guard's Hut
会心と暴走時魔物にダメージ +100,Critical/Haywire Damage +100
コニウェア平原-教会シスター 前,Coniware Plain - Church Sister
モンセロ温泉峡-中央のやぐら 前,Moncello Spring Gorge - Central Scaffold
リャナ荒涼地帯-くずれた灯台 前,Lyana Desolate Area - Collapsed Lighthouse
レビュール街道南-三門の関所 前,Reviewle Highway South - Three Way Gate
リャナ荒涼地帯-滝を臨む集落 前,Lyana Desolate Area - Waterfall Village
ジャイラ密林-クドゥスの泉 入口,Jyra Jungle - Kudus Spring Entry
セレドット山道-セレドの町 入口,Celedot Mountain Pass - Town of Celed Entry
敵を倒すと 3%でためる(試合無効),Tension On Enemy Defeat 3% (PvP×)
デフェル荒野-不思議の魔塔 入口,Defel Desert - Mysterious Tower Entry
行動時 2%で聖女の守り(試合無効),Alma Mater On Action 2% (PvP×)
戦いで 魔物に狙われにくくなる,Less likely to be targeted in battle
アルファ用追憶の世界 別荘跡編,World of Recollection for Alpha Villa Ruins
こうげき魔力とかいふく魔力 +10,Magical Might/Mending +10
テンション時魔物にダメージ+100,Damage During Tension +100
ＤＱⅧしゅじんこうのいしょう,DQⅧ Hero Costume
ぷらこんおんなぱんぷきんふく,Women's Pumpkin Clothes
巨人コアを守るジア・クトたち,Defenders of the Core
はなかりうどのころもむらさき,Purple Flower Hunter Outfit
チームゆく年くる年　２０２１,Team New Year 2021
はなかりゅうどのころもみどり,Green Flower Hunter Outfit
はるかぜおうえんだんいしょう,Spring Cheer Team Outfit
じょせいしらなみがらのゆかた,White Wave Yukata (F)
だんせいしらなみがらのゆかた,White Wave Yukata (M)
チームゆく年くる年　２０２０,Team New Year 2020
ぷらこんじょせいみこふくもも,Pink Priestess Dress
闇に唄う氷にまぎれし聖なる者,Frozen Sacred Singer
ぷらこんじょせいしろふりそで,White Women's Kimono
ぷらこんじょせいあかふりそで,Red Women's Kimono
ぷらこんじょせいようきあろは,Yellow Women's Aloha
フォークに刺さったパンケーキ,Pancakes Stuck in a Fork
ぷらこんきゅーぴっどむらさき,Purple Cupid
チームゆく年くる年　２０２３,Team New Year 2023
ぷらこんだんせいようあかろは,Red Men's Aloha
ぷらこんじょせいみこふくあお,Blue Priestess Dress
ぷらこんすいーとふくだいだい,Orange Sweet Clothes
ヴァレリアの仮面（割れる前）,Valeria's Unbroken Mask
ぷらこんおんなどらきゅらふく,Women's Dracula Costume
チームゆく年くる年　２０２２,Team New Year 2022
2.0%でターン消費なし(試合無効),Free Turn 2% (PvP×)
チームゆく年くる年　２０１８,Team New Year 2018
魔天の勇者＆キラークリスマス,Demon Sky Hero & Christmas Killing Machine
ぷらこんおとこぱんぷきんふく,Men's Pumpkin Clothes
じょせいぷらこんふくむらさき,Purple Clothes (F)
ぷらこんじょせいももふりそで,Pink Women's Kimono
わかむしゃのかっちゅうせっと,Young Warrior Armor Set
あすふぇるどがくえんなつふく,Asfeld Academy Summer Wear
あすふぇるどがくえんふゆふく,Asfeld Academy Winter Wear
チームゆく年くる年　２０１９,Team New Year 2019
ぷらこんじょせいくろふりそで,Black Women's Kimono
ぷらこんおとこどらきゅらふく,Men's Dracula Costume
3.0%でターン消費なし(試合無効),Free Turn 3% (PvP×)
どるわーむけんきゅういんふく,Dolworm Research Suit
ぼうえいぐんのせいふくみどり,Green Defense Force Suit
行動時 5%でバイシオンとピオラ,Oomph & Accelerate On Action 5%
魔人エンラージャ＆ムッチーノ,Genie Enraja & Muccino
ぷらこんしゃわーよういしょう,Shower Outfit
チームゆく年くる年　２０１７,Team New Year 2017
ラダ・ガートたちに連絡を取る,Contact Lada Gart's Group
ぷらこんだんせいようきあろは,Yellow Men's Aloha
ぷらこんじょせいみこふくあか,Red Priestess Dress
行動時 5%でバイシオンとスカラ,Oomph & Buff On Action 5%
チームゆく年くる年　２０２４,Team Twenty Twenty Four
嵐魔ウェンリルとアクラガレナ,Wenrir the Storm & Akragarena
ジャイラ密林-大樹の根元 入口,Jyra Jungle - Big Tree Root Entry
デフェル荒野-ピラミッド 入口,Defel Desert - Pyramid Entry
コニウェア平原-三門の関所 前,Coniware Plain - Three Way Gate
モンセロ温泉峡-管理人小屋 前,Moncello Spring Gorge - Caretaker's Hut
モンセロ温泉峡-北のやぐら 前,Moncello Spring Gorge - North Scaffold
デフェル荒野-教会シスター 前,Defel Desert - Church Sister
モンセロ温泉峡-ご神体の間 前,Moncello Spring Gorge - Hall of Worship
モンセロ温泉峡-南のやぐら 前,Moncello Spring Gorge - South Scaffold
グランゼドーラ領-見張り塔 前,Gran Zedora Territory - Watchtower Front
ロヴォス高地-教会シスター 前,Rovos Highlands - Church Sister
リンジャハル海岸-高台の遺跡,Linjahar Coast - Hilltop Ruins
セレドット山道-滝見の吊り橋,Celedot Mountain Pass - Fallsview Bridge
炎・土・闇の攻撃ダメージ +5%,Fire/Earth/Dark Damage +5%
追憶の世界-キラキラ大風車塔,World Of Remembrance-Windmill Tower
とうばつたいこうほうきょく,Strike Force Bureau
はなかりうどのころもみどり,Green Flower Hunter Outfit
はなかりゅうどのころもあお,Blue Flower Hunter Outfit
ぷらこんぱてぃしえふくあお,Blue Pastry Chef Suit
らんぷれんきんれんしゅうぎ,Lamp Alchemy Training Wear
ドルボ用マネキンニンゲン用,For Human Mannequin For Dolboard
女性プラコン服アイスブルー,Ice Blue Clothes (F)
男性プラコン服ミストグレー,Mist Gray Clothes (M)
特技のダメージ +15(試合無効),Skill Damage +15 (PvP×)
ぷらこんいけてるみずぎもも,Pink Cool Swimsuit
からすかぐらのしょうぞくⅠ,Crow Dance Costume Ⅰ
アスフェルド学園男性用水着,Asfeld Swimwear (M)
だんせいぷらこんふくぴんく,Pink Clothes (M)
からすかぐらのしょうぞくⅡ,Crow Dance Costume Ⅱ
ぷらこんいけてるみずぎあお,Blue Cool Swimsuit
ぷらこんおしゃれみずぎあか,Red Snazzy Swimsuit
ぷらこんおしゃれみずぎあお,Blue Snazzy Swimsuit
ぷらこんおしゃれみずぎくろ,Black Snazzy Swimsuit
砂の都ファラザードへの出口,Exit to Farazard
ドルボ用マネキンウェディ用,For Weddie Mannequin For Dolboard
ぷらこんぱてぃしえふくしろ,White Pastry Chef Suit
『おうちでついてクン設定』,"House Pet Settings"
『ついてクンをひっこめる』,"Remove Pet"
ぷらこんだんせいはかまこん,Navy Blue Men's Hakama
戦闘中常時マホトラのころも,Magic Cloak Always Active
じょせいぷらこんふくぴんく,Pink Clothes (F)
男性プラコン服ダークグレー,Dark Gray Clothes (M)
ぷらこんだんせいはかまくろ,Black Men's Hakama
だんせいぷらこんふくえんじ,Red Clothes (M)
ぷらこんぱてぃしえふくあか,Red Pastry Chef Suit
男性プラコン服ミッドナイト,Midnight Clothes (M)
ムストの町・教会跡への出口,Exit to Morst - Church Ruins
ぷらこんえんじぇるふくあか,Red Angel Clothes
行動時 3%でテンションアップ,Tension On Action 3%
女性プラコン服ミッドナイト,Midnight Clothes (F)
じょせいぷらこんふくえんじ,Red Clothes (F)
ムストの町・風車へのはしご,Morst - Ladder to the Windmill
ぷらこんだんせいはかまあお,Blue Men's Hakama
ぷらこんえんじぇるふくくろ,Black Angel Clothes
ぼうえいぐんのせいふくきん,Gold Defense Force Suit
ぷらこんいけてるみずぎくろ,Black Cool Swimsuit
ランドン山脈山頂付近への道,Road to Landon Mountains Summit
未完のドラクロン山地への道,Road to Undone Draklon Mountains
未完のモンセロ温泉峡への道,Road to Undone Moncello Spring Gorge
だるめしあんぼーいいしょう,Dalmatian Outfit (M)
１００万ゴールドの入った袋,1 Million Gold Bag
ドルボ用マネキンプクリポ用,For Pukulipo Mannequin For Dolboard
清き風吹き　草木は芽吹く～,Pure winds blown and trees grown, budding green as the breeze is thrown
はなかりゅうどのころもあか,Red Flower Hunter Outfit
ぷらこんえんじぇるふくあお,Blue Angel Clothes
だるめしあんがーるいしょう,Dalmatian Outfit (F)
特技のダメージ +20(試合無効),Skill Damage +20 (PvP×)
フラワーガーデン地区への道,Road to Flower Garden District
特技のダメージ +10(試合無効),Skill Damage +10 (PvP×)
イルーシャのスケッチブック,Irusha's Sketchbook
ぷらこんぱてぃしえふくもも,Pink Pastry Chef Suit
ドラゴンクエストＸショップ,Dragon Quest X Shop
ぷらこんえんじぇるふくもも,Pink Angel Clothes
攻撃時 5%でチャージ時間-10秒,Charge Time -10s On Attack 5%
スターキメラから取った羽根,Cosmic Chimaera Feather
ぷらこんおしゃれみずぎしろ,White Snazzy Swimsuit
アルムゴーグ＆ロムドゴーグ,Armogog & Romdogog
ぼうえいぐんのせいふくあか,Red Defense Force Suit
ぷらこんいけてるみずぎあか,Red Cool Swimsuit
ハディン地下洞くつへの出口,Exit to Hadine Cavern
古レビュール街道北への出口,Exit to Old Reviewle Highway North
壊れたハイハイジャンプさん,Broken Mr. High High Jump
イア・タア　シンパッ・ケウ,E-yis, aneu dish cubrey
ぷらこんえんじぇるふくしろ,White Angel Clothes
ルクスガルン大空洞への亀裂,Crevice to Luxgarn Caverns
アスフェルド学園女性用夏服,Asfeld Summer Uniform (F)
ぷらこんおしゃれみずぎもも,Pink Snazzy Swimsuit
アスフェルド学園女性用水着,Asfeld Swimwear (F)
ぷらこんだんせいはかましろ,White Men's Hakama
ぷらこんいけてるみずぎしろ,White Cool Swimsuit
未来への扉とまどろみの少女,The Door to the Future & the Slumbering Girl
未開のジャングル地区への道,Road to Savage Jungle
古グランゼドーラ領への出口,Exit to Old Gran Zedora Territory
ぼうえいぐんのせいふくこん,Blue Defense Force Suit
行動時 5%でテンションアップ,Tension On Action 5%
アスフェルド学園男性用夏服,Asfeld Summer Uniform (M)
ドルボ用マネキンドワーフ用,For Dwarf Mannequin For Dolboard
魔物商人＆商品ナンバー１３,Monster Merchant & Item Number 13
ロヴォス高地-ゼドラ洞 入口,Rovos Highlands - Zedra Cave Entry
5000年の旅路 遥かなる故郷へ,5000 Year Journey to a Faraway Hometown
ワルド水源-湖上の休息所 前,Wald Headwaters - Lake Retreat
　(フォース無効・試合無効),　(Fource×/PvP×)
受けるダメージを10軽減する,Damage Taken -10
必殺チャージ時 身かわし+10%,Dodge +10% On Special Charge
シガール町長の執務室 入口,Mayor Sigal's Office Entry
プログラマー検証ステージ1,Programmer Verification Stage 1
湖の小島・神のまなこ 出口,Lake Islet - Eyes of God Exit
スイーツゾーン控え室 入口,Sweets Zone Waiting Room Entry
味方死亡時 20%でバイシオン,Oomph If Ally Dies 20%
とこしえの神殿楯の間 出口,Temple of Eternity Shield Room Exit
プログラマー検証ステージ3,Programmer Verification Stage 3
デス・ジャンクション 入口,Death Junction Entry
スイーツゾーン控え室 出口,Sweets Zone Waiting Room Exit
開戦時 10%でヘヴィチャージ,Starting Heavy Charge 10%
ゼクレス城・魔導広場 出口,Zechres Castle - Magic Square Exit
オルセコ闘技城・舞台 出口,Orseco Combat Castle - Stage Exit
ランプ錬金ギルド 地下１階,Lamp Alchemy Guild B1F
ビンゴすごろくホール 入口,Bingo/Sugoroku Hall Entry
プログラマー検証ステージ2,Programmer Verification Stage 2
カルデア山道のアジト 出口,Chaldea Mountain Road Hideout Exit
受けるダメージを5軽減する,Damage Taken -5
古グランゼドーラ王国 入口,Old Gran Zedora Kingdom Entry
スライムレースホール 入口,Slime Race Hall Entry
ビンゴすごろくホール 出口,Bingo/Sugoroku Hall Exit
湖の小島・神のまなこ 入口,Lake Islet - Eyes of God Entry
からすかぐらのしょうぞく2,Crow Dance Costume Ⅱ
プログラマー検証ステージ4,Programmer Verification Stage 4
モリナラ地下洞・深淵 出口,Molinara Underground Abyss Exit
プログラマー検証ステージ5,Programmer Verification Stage 5
宇宙船・立入禁止区画 入口,Spacecraft - Restricted Area Entry
からすかぐらのしょうぞく1,Crow Dance Costume Ⅰ
オルセコ闘技城・舞台 入口,Orseco Combat Castle - Stage Entry
カルデア山道のアジト 入口,Chaldea Mountain Road Hideout Entry
スライムレースホール 出口,Slime Race Hall Exit
ビタースイーツゾーン 出口,Bittersweets Zone Exit
宇宙船・立入禁止区画 出口,Spacecraft - Restricted Area Exit
とこしえの神殿楯の間 入口,Temple of Eternity Shield Room Entry
エピステーサ底なし穴 出口,Epistesa Bottomless Pit Exit
リンジャハル海岸-海岸遺跡,Linjahar Coast - Coast Ruins
アストルティア博物館 入口,Astoltia Museum Entry
レビュール街道北-谷合の森,Reviewle Highway North - Veil of the Vale
プログラマー検証ステージ6,Programmer Verification Stage 6
アストルティア博物館 出口,Astoltia Museum Exit
プログラマー検証ステージ8,Programmer Verification Stage 8
モリナラ地下洞・深淵 入口,Molinara Underground Abyss Entry
デス・ジャンクション 出口,Death Junction Exit
ゼクレス城・魔導広場 入口,Zechres Castle - Magic Square Entry
エピステーサ底なし穴 入口,Epistesa Bottomless Pit Entry
古グランゼドーラ領への道,Road to Old Gran Zedora Territory
まもの博士の研究レポート,Monster Doctor's Research
ママと私の魔法仕立て術！,Mom and Me Magic Tailoring
コルット地方で新種発見？,New Species in Colt Region?
ガーディアンメイルセット,Guardian Outfit
だんせいきんぎょのゆかた,Men's Goldfish Yukata
ぷらこんぱてぃしえふくき,Yellow Pastry Chef Suit
ウワサのどうぐかばん工房,Rumored Item Bag Workshop
お願いベントラーコイン！,Please Bentler Coin!
ガンバライオンの戦士たち,Warriors of Ganbalion
ぷらこんすいーとふくくろ,Black Sweet Clothes
ドルワーム水晶宮への出口,Exit to Dolworm Crystal Palace
じょせいきんぎょのゆかた,Women's Goldfish Yukata
幻の色違いを釣りあげろ！,Catch Phantom Colors!
ジャリムバハ砂漠への出口,Exit to Jyarimbaha Desert
始めよう！バラ色冒険生活,Begin! Rosy Adventure
集え！カボチャのもとに２,Gather Round the Pumpkin!2
華のウルフ道極めるっす！,Take the Flower Wolf Path!
レビュール街道北への出口,Exit to Reviewle Highway North
カンフージャケットセット,Kung Fu Jacket Set
丁目フラワーガーデン地区,Block Flower Garden District
プラコンスクール制服男黒,Black School Uniform (M)
愉快なオルフェアっ子たち,Joyful Orphea Children
オルフェア地方東への出口,Exit to Orphea Region East
ヴァンガードコートセット,Vanguard Outfit
ぷらこんきゅーぴっどしろ,White Cupid
ぷらこんおとこみいらふく,Men's Mummy Costume
ダイナースカートイショウ,Diner Skirt Outfit
プラコンスクール制服女白,White School Uniform (F)
だんせいはながらのゆかた,Men's Floral Yukata
テラスのキューピッドさん,Mr. Cupid on the Terrace
旅のお供に　超便利ツール,Useful Tool For Travelers
当選！メガルーラストーン,Winner! Mega Zoomstone
ダンダダ団カムバックです,Robbin' 'Ood Gang's Return
デカイ仕事受けるっしょ？,You'll Get a Big Job?
じょせいはながらのゆかた,Women's Floral Yukata
ナイトたちの血戦２０２０,Knights Bloody Battle 2020
かばんを持てない者たちへ,To Those With Full Bags
ショップポイントをもらう,Receive Shop Points
はーとがーるへいたいふく,Heart Soldier Uniform (F)
グランゼドーラ領への出口,Exit to Gran Zedora Territory
ワイルドジャケットセット,Wild Outfit
はるかぜちあーずいしょう,Spring Cheer Outfit
ライドオン　ドルボード！,Ride On, Dolboard!
ごめんなさいを言いたくて,I Want to Say I'm Sorry
