アルファ用アルウェ王妃の別荘跡(子供たちの隠れ家内部Test),Queen Alwe's Villa Ruins for Alpha (Test Inside Children's Hideout)
バトル班用テストマップ（いにしえのゼルメア）,Team Battle Map Test (Ancient Zelmea)
どらごんくえすとえいとしゅじんこうのいしょう,DQⅧ Hero Costume
このマップは モンスターから逃げられません。,You can't run from monsters on this map.
　　　～モンスター討伐隊隊員からの依頼～,         Monster Strike Force Request
マッチングテストステージ（同期テスト用）,Match test stage (for sync testing)
マッチングテストステージ（同期後移動用）,Match test stage (for moving beat testing)
グランゼドーラ領-グランゼドーラ王国 入口,Gran Zedora Territory - Gran Zedora Kingdom Entry
リャナ荒涼地帯-ねじれたる異形の大地 入口,Lyana Desolate Area - Twisted Deformed Earth Entry
アラハギーロ地方-モンスター格闘場 入口,Al-Ahagiro Region - Monster Arena Entry
アラハギーロ地方-アラハギーロ王国 入口,Al-Ahagiro Region - Kingdom of Al-Ahagiro Entry
メルサンディ穀倉帯-こもれびの広場 入口,Melsandy Millfields - Sunbeam Square Entry
メルサンディ穀倉帯-メルサンディ村 入口,Melsandy Millfields - Melsandy Village Entry
メルサンディ穀倉帯-さびれたほこら 入口,Melsandy Millfields - Deserted Shrine Entry
こうげき力上昇時 特技のダメージ +20<ban>,Skill Dmg. +20 When Attack ↑ (PvP×)
季節イベント「オ月見」　コンパニオン,Seasonal Event "Moon View" Companion
ぷらこんだんせいようそくたいむらさき,Purple Ceremony Gown
バトル班用テストマップ（ムスト廃墟）,Team Battle Map Test (Musuto Ruins)
季節イベント「お月見」　コンパニオン,Seasonal Event "Moon View" Companion
アラハギーロ地方-日除けのほら穴 入口,Al-Ahagiro Region - Sunshade Cave Entry
アラハギーロ地方-ムルードの岩山 入口,Al-Ahagiro Region - Murudo Mountain Entry
メルサンディ穀倉帯-メルン水車郷 入口,Melsandy Millfields - Melun Watermill Entry
ルファ神殿エントランス（オープン）,Rufa Temple - Entry (Open)
ぷらこんすくーるせいふくおんなこん,Blue School Uniform (F)
ぷらこんだんせいようそくたいみどり,Green Ceremony Gown
ぷらこんすくーるせいふくおんなあか,Red School Uniform (F)
ぷらこんすくーるせいふくおんなちゃ,Brown School Uniform (F)
ぷらこんすくーるせいふくおとこくろ,Black School Uniform (M)
神代過ぎ～　春の桜よ　無為に咲く～,Past ages divine, the spring blossoms bloom, waiting idly by...
受けた属性ダメージの 10%ＨＰ回復<ban>,10% Attribute Damage Taken As HP (PvP×)
ぷらこんすくーるせいふくおとこしろ,White School Uniform (M)
ぷらこんすくーるせいふくおとここん,Blue School Uniform (M)
ぷらこんすくーるせいふくおとこちゃ,Brown School Uniform (M)
しかし　持ち物が　いっぱいだった！,But you're carrying too many things!
ぷらこんすくーるせいふくおんなしろ,White School Uniform (F)
ぷらこんすくーるせいふくおとこあか,Red School Uniform (M)
ぷらこんすくーるせいふくおんなくろ,Black School Uniform (F)
アルファ用井戸(ダンダダ団のアジト),Well for Alpha (Robbin' 'Ood Gang HQ)
リャナ荒涼地帯-ソーラリア峡谷 入口,Lyana Desolate Area - Solaria Canyon Entry
コニウェア平原-ココラタの浜辺 入口,Coniware Plain - Cocolata Beach Entry
バトル班用テストマップ(ツスクル）,Team Battle Map Test (Tsuskuru)
プンスコのテーブル＆ティーセット,Punsuko's Table & Tea Set
バトル班用テストマップ（獅子門）,Team Battle Map Test (Lion Gate)
じょせいぷらこんふくあいすぶるー,Ice Blue Clothes (F)
ぷらこんだんせいようそくたいちゃ,Tea Ceremony Gown
ぷらこんじょせいみこふくむらさき,Purple Priestess Dress
ぷらこんじょせいしのびのふくあお,Blue Women's Ninja Suit
だんせいぷらこんふくみっどないと,Midnight Clothes (M)
ぷらこんじょせいしのびのふくくろ,Black Women's Ninja Suit
ぷらこんじょせいむらさきふりそで,Purple Women's Kimono
ぷらこんじょせいしのびのふくこん,Navy Women's Ninja Suit
ぷらこんだんせいようみどりさんた,Green Men's Santa Suit
ぷらこんだんせいしのびのふくあお,Blue Men's Ninja Suit
ぷらこんだんせいようそくたいはい,Ash Ceremony Gown
ぷらこんだんせいしのびのふくあか,Red Men's Ninja Suit
エフェクトイメージさん（１０個）,Mr. Effect Image (10)
じょせいぷらこんふくみっどないと,Midnight Clothes (F)
ぷらこんじょせいようみどりさんた,Green Women's Santa Suit
ぷらこんだんせいようそくたいあお,Blue Ceremony Gown
ぷらこんだんせいしのびのふくちゃ,Tea Men's Ninja Suit
だんせいぷらこんふくだーくぐれー,Dark Gray Clothes (M)
ぷらこんじょせいしのびのふくあか,Red Women's Ninja Suit
ぷらこんだんせいしのびのふくこん,Navy Men's Ninja Suit
ぷらこんだんせいしのびのふくくろ,Black Men's Ninja Suit
あすふぇるどがくえんがくせいふく,Asfeld Academy Uniform
ぷらこんじょせいしのびのふくもも,Pink Women's Ninja Suit
だんせいぷらこんふくみすとぐれー,Mist Gray Clothes (M)
レビュール街道北-海風の洞くつ 前,Reviewle Highway North - Seabreeze Cave
マデ島＆エテーネ王宮（4.5CS専用）,Made Isle & Ethene Royal Manor (4.5CS only)
リンジャハル海岸-教会シスター 前,Linjahar Coast - Church Sister
リンジャハル海岸-リンジャの塔 前,Linjahar Coast - Linja Tower
セレドット山道-ベリルのほら穴 前,Celedot Mountain Pass - Beryl Den
プログラマー用負荷検証ステージ4,Loading Programmer Verification Stage 4
必殺チャージ時 チャージ時間-10秒,Charge Time -10 sec. On Special
追憶の世界-アルウェ王妃の別荘跡,World of Remembrance-The Ruins of Queen Alwe
プログラマー用負荷検証ステージ5,Loading Programmer Verification Stage 5
プログラマー用負荷検証ステージ2,Loading Programmer Verification Stage 2
プログラマー用負荷検証ステージ1,Loading Programmer Verification Stage 1
プログラマー用負荷検証ステージ3,Loading Programmer Verification Stage 3
ぷらこんだんせいようももあろは,Pink Men's Aloha
ぷらこんじょせいようあかさんた,Red Women's Santa Suit
ハロウィンクイズ解答ウェディ３,Halloween Quiz Answer Weddie 3
扉は　かたく　閉ざされている。,The door is tightly closed.
\s\m\eは　カードを引いた。　→　,\s\m\e draws a card. → They draw the !
30%の確率で受けたダメージ10%反射,30% Chance to Reflect 10% Damage
魔天の勇者＆聖夜の破壊者・闇組,Demon Sky Hero & Holy Night Wrecker Dark Team
豪魔将ベリンダ＆豪魔将ブレンダ,Generals Belinda & Brenda
ぷらこんじょせいようももさんた,Pink Women's Santa Suit
\s\m\eは　ダイスをふった。　→　,\s\m\e rolls a die. → It's a !
ぷらこんだんせいようあかさんた,Red Men's Santa Suit
壊れたアストルティアのコンパス,Broken Astoltia Compass
ぷらこんじょせいみこふくみどり,Green Priestess Dress
ハロウィンクイズ解答ウェディ７,Halloween Quiz Answer Weddie 7
ぷらこんじょせいようしろさんた,White Women's Santa Suit
ぷらこんだんせいようももさんた,Pink Men's Santa Suit
ぷらこんじょせいようしろあろは,White Women's Aloha
ぷらこんだんせいようしろさんた,White Men's Santa Suit
ぷらこんだんせいはかまむらさき,Purple Men's Hakama
えるどなしんのしょうぞくせっと,Eldona's Outfit
ぷらこんだんせいようしろあろは,White Men's Aloha
ハロウィンクイズ解答ウェディ５,Halloween Quiz Answer Weddie 5
ハロウィンクイズ解答ウェディ１,Halloween Quiz Answer Weddie 1
ぷらこんじょせいようあかあろは,Red Women's Aloha
じょせいぷらこんふくさんせっと,Sunset Clothes (F)
ハロウィンクイズ解答ウェディ２,Halloween Quiz Answer Weddie 2
ぷらこんじょせいようくろさんた,Black Women's Santa Suit
ぼうえいぐんのせいふくはいいろ,Gray Defense Force Suit
ぷらこんだんせいようあおあろは,Blue Men's Aloha
ぷらこんこどもようみずぎせっと,Children's Swimsuit
ハロウィンクイズ解答ウェディ４,Halloween Quiz Answer Weddie 4
ぷらこんだんせいようくろさんた,Black Men's Santa Suit
ぷらこんじょせいようあおあろは,Blue Women's Aloha
ゴリウスの怨霊＆魔道士キルギル,Gorius' Vengeance & Wizard Kirgyl
魔天の勇者＆聖夜の破壊者・雪組,Demon Sky Hero & Holy Night Wrecker Snow Team
ぼうえいぐんのせいふくむらさき,Purple Defense Force Suit
はなかりゅうどのころもむらさき,Purple Flower Hunter Outfit
ハロウィンクイズ解答ウェディ６,Halloween Quiz Answer Weddie 6
\s\m\eは　コインをなげた。　→　,\s\m\e flips a coin. → The coin lands on !
ぷらこんじょせいようももあろは,Pink Women's Aloha
レビュール街道南-三門の関所 前,Reviewle Highway South - Three Way Gate
ジャイラ密林-クドゥスの泉 入口,Jyra Jungle - Kudus Spring Entry
モンセロ温泉峡-中央のやぐら 前,Moncello Spring Gorge - Central Scaffold
デフェル荒野-不思議の魔塔 入口,Defel Desert - Mysterious Tower Entry
ドラクロン山地-竜守りの小屋 前,Draklon Mountains - Dragon Guard's Hut
コニウェア平原-教会シスター 前,Coniware Plain - Church Sister
リャナ荒涼地帯-くずれた灯台 前,Lyana Desolate Area - Collapsed Lighthouse
セレドット山道-セレドの町 入口,Celedot Mountain Pass - Town of Celed Entry
リャナ荒涼地帯-滝を臨む集落 前,Lyana Desolate Area - Waterfall Village
戦いで 魔物に狙われにくくなる,Less likely to be targeted in battle
会心と暴走時のダメージ +100<ban>,Critical/Haywire Damage +100 (PvP×)
アルファ用追憶の世界 別荘跡編,World of Recollection for Alpha Villa Ruins
テンション時のダメージ +100<ban>,Damage During Tension +100 (PvP×)
こうげき魔力とかいふく魔力 +10,Magical Might/Mending +10
巨人コアを守るジア・クトたち,Defenders of the Core
チームゆく年くる年　２０２０,Team New Year 2020
行動時 7%でバイシオンとピオラ,Oomph & Accelerate On Action 7%
チームゆく年くる年　２０２４,Team Twenty Twenty Four
ぷらこんじょせいももふりそで,Pink Women's Kimono
ぷらこんきゅーぴっどむらさき,Purple Cupid
はなかりうどのころもむらさき,Purple Flower Hunter Outfit
チームゆく年くる年　２０２２,Team New Year 2022
ぷらこんじょせいみこふくあお,Blue Priestess Dress
じょせいしらなみがらのゆかた,White Wave Yukata (F)
ぷらこんすいーとふくだいだい,Orange Sweet Clothes
ぷらこんだんせいようきあろは,Yellow Men's Aloha
ぷらこんだんせいようあかろは,Red Men's Aloha
行動時 5%でバイシオンとスカラ,Oomph & Buff On Action 5%
ぷらこんじょせいしろふりそで,White Women's Kimono
ハロウィンクイズ解答エルフ１,Halloween Quiz Answer Elf 1
行動時 5%でバイシオンとピオラ,Oomph & Accelerate On Action 5%
ぷらこんおとこぱんぷきんふく,Men's Pumpkin Clothes
チームゆく年くる年　２０２３,Team New Year 2023
ぷらこんおんなどらきゅらふく,Women's Dracula Costume
ヴァレリアの仮面（割れる前）,Valeria's Unbroken Mask
あすふぇるどがくえんなつふく,Asfeld Academy Summer Wear
チームゆく年くる年　２０１９,Team New Year 2019
チームゆく年くる年　２０２１,Team New Year 2021
ぷらこんおんなぱんぷきんふく,Women's Pumpkin Clothes
ぷらこんじょせいようきあろは,Yellow Women's Aloha
ぷらこんじょせいみこふくもも,Pink Priestess Dress
嵐魔ウェンリルとアクラガレナ,Wenrir the Storm & Akragarena
ハロウィンクイズ解答エルフ７,Halloween Quiz Answer Elf 7
チームゆく年くる年　２０２５,Team New Year 2025
チームゆく年くる年　２０１７,Team New Year 2017
ハロウィンクイズ解答エルフ４,Halloween Quiz Answer Elf 4
どるわーむけんきゅういんふく,Dolworm Research Suit
チームゆく年くる年　２０１８,Team New Year 2018
魔人エンラージャ＆ムッチーノ,Enraja the Genie & Muccino
はるかぜおうえんだんいしょう,Spring Cheer Team Outfit
フォークに刺さったパンケーキ,Pancakes Stuck in a Fork
ハロウィンクイズ解答エルフ５,Halloween Quiz Answer Elf 5
ぷらこんおとこどらきゅらふく,Men's Dracula Costume
はなかりゅうどのころもみどり,Green Flower Hunter Outfit
ハロウィンクイズ解答エルフ６,Halloween Quiz Answer Elf 6
ぷらこんじょせいみこふくあか,Red Priestess Dress
ハロウィンクイズ解答エルフ３,Halloween Quiz Answer Elf 3
ぷらこんじょせいあかふりそで,Red Women's Kimono
闇に唄う氷にまぎれし聖なる者,Frozen Sacred Singer
わかむしゃのかっちゅうせっと,Young Warrior Armor Set
ぷらこんしゃわーよういしょう,Shower Outfit
ＤＱⅧしゅじんこうのいしょう,DQⅧ Hero Costume
魔天の勇者＆キラークリスマス,Demon Sky Hero & Christmas Killing Machine
ぷらこんじょせいくろふりそで,Black Women's Kimono
ぼうえいぐんのせいふくみどり,Green Defense Force Suit
じょせいぷらこんふくむらさき,Purple Clothes (F)
ラダ・ガートたちに連絡を取る,Contact Lada Gart's Group
あすふぇるどがくえんふゆふく,Asfeld Academy Winter Wear
だんせいしらなみがらのゆかた,White Wave Yukata (M)
ハロウィンクイズ解答エルフ２,Halloween Quiz Answer Elf 2
モンセロ温泉峡-北のやぐら 前,Moncello Spring Gorge - North Scaffold
コニウェア平原-三門の関所 前,Coniware Plain - Three Way Gate
デフェル荒野-教会シスター 前,Defel Desert - Church Sister
モンセロ温泉峡-ご神体の間 前,Moncello Spring Gorge - Hall of Worship
デフェル荒野-ピラミッド 入口,Defel Desert - Pyramid Entry
ジャイラ密林-大樹の根元 入口,Jyra Jungle - Big Tree Root Entry
ロヴォス高地-教会シスター 前,Rovos Highlands - Church Sister
モンセロ温泉峡-南のやぐら 前,Moncello Spring Gorge - South Scaffold
グランゼドーラ領-見張り塔 前,Gran Zedora Territory - Watchtower Front
モンセロ温泉峡-管理人小屋 前,Moncello Spring Gorge - Caretaker's Hut
セレドット山道-滝見の吊り橋,Celedot Mountain Pass - Fallsview Bridge
炎・土・闇の攻撃ダメージ +5%,Fire/Earth/Dark Damage +5%
追憶の世界-キラキラ大風車塔,World Of Remembrance-Windmill Tower
リンジャハル海岸-高台の遺跡,Linjahar Coast - Hilltop Ruins
ぼうえいぐんのせいふくあか,Red Defense Force Suit
ハロウィンクイズ解答オガ２,Halloween Quiz Answer Ogre 2
ドルボ用マネキンプクリポ用,For Pukulipo Mannequin For Dolboard
ぷらこんいけてるみずぎもも,Pink Cool Swimsuit
スターキメラから取った羽根,Cosmic Chimaera Feather
ぷらこんだんせいはかまあお,Blue Men's Hakama
戦闘中常時マホトラのころも,Magic Cloak Always Active
ぷらこんいけてるみずぎあお,Blue Cool Swimsuit
魔物商人＆商品ナンバー１３,Monster Merchant & Item Number 13
ドラゴンクエストＸショップ,Dragon Quest X Shop
男性プラコン服ダークグレー,Dark Gray Clothes (M)
からすかぐらのしょうぞくⅠ,Crow Dance Costume Ⅰ
男性プラコン服ミッドナイト,Midnight Clothes (M)
女性プラコン服ミッドナイト,Midnight Clothes (F)
はなかりゅうどのころもあか,Red Flower Hunter Outfit
ハロウィンクイズ解答プク２,Halloween Quiz Answer Puku 2
ハロウィンクイズ解答オガ１,Halloween Quiz Answer Ogre 1
清き風吹き　草木は芽吹く～,Pure winds blown and trees grown, budding green as the breeze is thrown
ハロウィンクイズ解答ドワ４,Halloween Quiz Answer Dwarf 4
ムストの町・教会跡への出口,Exit to Morst - Church Ruins
ハロウィンクイズ解答オガ４,Halloween Quiz Answer Ogre 4
ハロウィンクイズ解答オガ７,Halloween Quiz Answer Ogre 7
ハロウィンクイズ解答プク１,Halloween Quiz Answer Puku 1
だるめしあんがーるいしょう,Dalmatian Outfit (F)
古レビュール街道北への出口,Exit to Old Reviewle Highway North
ゆうべはおたのしみでしたね,Rooming with a Gamer Gal
アスフェルド学園男性用水着,Asfeld Swimwear (M)
はなかりゅうどのころもあお,Blue Flower Hunter Outfit
古グランゼドーラ領への出口,Exit to Old Gran Zedora Territory
じょせいぷらこんふくぴんく,Pink Clothes (F)
ハロウィンクイズ解答ドワ５,Halloween Quiz Answer Dwarf 5
ランドン山脈山頂付近への道,Road to Landon Summit Area
壊れたハイハイジャンプさん,Broken Mr. High High Jump
ドルボ用マネキンウェディ用,For Weddie Mannequin For Dolboard
イルーシャのスケッチブック,Illusia's Sketchbook
ドルボ用マネキンニンゲン用,For Human Mannequin For Dolboard
ぷらこんいけてるみずぎあか,Red Cool Swimsuit
キュロンイーターの巣への道,Path to Kyuroneater's Nest
アスフェルド学園女性用夏服,Asfeld Summer Uniform (F)
ハロウィンクイズ解答ドワ１,Halloween Quiz Answer Dwarf 1
らんぷれんきんれんしゅうぎ,Lamp Alchemy Training Wear
１００万ゴールドの入った袋,1 Million Gold Bag
アルムゴーグ＆ロムドゴーグ,Armogog & Romdogog
ぷらこんえんじぇるふくあか,Red Angel Clothes
ぼうえいぐんのせいふくこん,Blue Defense Force Suit
はなかりうどのころもみどり,Green Flower Hunter Outfit
ぼうえいぐんのせいふくきん,Gold Defense Force Suit
『おうちでついてクン設定』,"House Pet Settings"
ハロウィンクイズ解答プク３,Halloween Quiz Answer Puku 3
ぷらこんぱてぃしえふくもも,Pink Pastry Chef Suit
からすかぐらのしょうぞくⅡ,Crow Dance Costume Ⅱ
ハロウィンクイズ解答ヒト２,Halloween Quiz Answer Human 2
ハロウィンクイズ解答プク７,Halloween Quiz Answer Puku 7
ぷらこんいけてるみずぎしろ,White Cool Swimsuit
だんせいぷらこんふくえんじ,Red Clothes (M)
ハロウィンクイズ解答オガ６,Halloween Quiz Answer Ogre 6
だんせいぷらこんふくぴんく,Pink Clothes (M)
ぷらこんぱてぃしえふくあか,Red Pastry Chef Suit
ぷらこんぱてぃしえふくあお,Blue Pastry Chef Suit
ぷらこんえんじぇるふくあお,Blue Angel Clothes
ぷらこんえんじぇるふくくろ,Black Angel Clothes
行動時 5%でテンションアップ,Tension On Action 5%
未完のモンセロ温泉峡への道,Road to Undone Moncello Spring Gorge
ハロウィンクイズ解答ヒト７,Halloween Quiz Answer Human 7
砂の都ファラザードへの出口,Exit to Farazard
アスフェルド学園男性用夏服,Asfeld Summer Uniform (M)
ハロウィンクイズ解答プク５,Halloween Quiz Answer Puku 5
ハロウィンクイズ解答ヒト５,Halloween Quiz Answer Human 5
行動時 3%でテンションアップ,Tension On Action 3%
ぷらこんおしゃれみずぎしろ,White Snazzy Swimsuit
ルクスガルン大空洞への亀裂,Crevice to Luxgarn Caverns
ハロウィンクイズ解答オガ５,Halloween Quiz Answer Ogre 5
ハロウィンクイズ解答プク４,Halloween Quiz Answer Puku 4
ムストの町・風車へのはしご,Morst - Ladder to the Windmill
ぷらこんぱてぃしえふくしろ,White Pastry Chef Suit
女性プラコン服アイスブルー,Ice Blue Clothes (F)
ぷらこんだんせいはかまくろ,Black Men's Hakama
ハロウィンクイズ解答ドワ７,Halloween Quiz Answer Dwarf 7
ハロウィンクイズ解答ドワ２,Halloween Quiz Answer Dwarf 2
ハロウィンクイズ解答ヒト６,Halloween Quiz Answer Human 6
ぷらこんおしゃれみずぎあお,Blue Snazzy Swimsuit
ハロウィンクイズ解答ヒト４,Halloween Quiz Answer Human 4
未完のドラクロン山地への道,Road to Undone Draklon Mountains
ドルボ用マネキンドワーフ用,For Dwarf Mannequin For Dolboard
ぷらこんおしゃれみずぎあか,Red Snazzy Swimsuit
ぷらこんえんじぇるふくもも,Pink Angel Clothes
とうばつたいこうほうきょく,Strike Force Bureau
男性プラコン服ミストグレー,Mist Gray Clothes (M)
ハロウィンクイズ解答ヒト１,Halloween Quiz Answer Human 1
ハロウィンクイズ解答ヒト３,Halloween Quiz Answer Human 3
攻撃時 5%でチャージ時間-10秒,Charge Time -10s On Attack 5%
イア・タア　シンパッ・ケウ,E-yis, aneu dish cubrey
ぷらこんいけてるみずぎくろ,Black Cool Swimsuit
ハロウィンクイズ解答プク６,Halloween Quiz Answer Puku 6
未来への扉とまどろみの少女,The Door to the Future & the Slumbering Girl
ハロウィンクイズ解答オガ３,Halloween Quiz Answer Ogre 3
ぷらこんえんじぇるふくしろ,White Angel Clothes
ハロウィンクイズ解答ドワ６,Halloween Quiz Answer Dwarf 6
フラワーガーデン地区への道,Road to Flower Garden District
未開のジャングル地区への道,Road to Savage Jungle
ぷらこんおしゃれみずぎくろ,Black Snazzy Swimsuit
ぷらこんおしゃれみずぎもも,Pink Snazzy Swimsuit
行動時 5%でチャージ時間-10秒,Charge Time -5 sec. On Action 5%
アスフェルド学園女性用水着,Asfeld Swimwear (F)
じょせいぷらこんふくえんじ,Red Clothes (F)
だるめしあんぼーいいしょう,Dalmatian Outfit (M)
ぷらこんだんせいはかまこん,Navy Blue Men's Hakama
ぷらこんだんせいはかましろ,White Men's Hakama
ハディン地下洞くつへの出口,Exit to Hadine Cavern
ハロウィンクイズ解答ドワ３,Halloween Quiz Answer Dwarf 3
デスディオ暗黒荒原への出口,Exit to Deathdio Darklands
『ついてクンをひっこめる』,"Remove Pet"
ロヴォス高地-ゼドラ洞 入口,Rovos Highlands - Zedra Cave Entry
ワルド水源-湖上の休息所 前,Wald Headwaters - Lake Retreat
テンション時のダメージ +300,Damage During Tension +300
受けるダメージを10軽減する,Damage Taken -10
5000年の旅路 遥かなる故郷へ,5000 Year Journey to a Faraway Hometown
必殺チャージ時 身かわし+10%,Dodge +10% On Special Charge
グランゼニスの試練場 出口,Trial of Gran Zenith Exit
プログラマー検証ステージ3,Programmer Verification Stage 3
ランプ錬金ギルド 地下１階,Lamp Alchemy Guild B1F
受けるダメージを5軽減する,Damage Taken -5
異界アスタルジア深部 出口,Depths of Astalgia Exit
カルデア山道のアジト 出口,Chaldea Mountain Road Hideout Exit
デス・ジャンクション 入口,Death's Juncture Entry
湖の小島・神のまなこ 出口,Lake Islet - The All-seeing Eye Exit
アストルティア博物館 入口,Astoltia Museum Entry
ゼクレス城・魔導広場 入口,Zechres Castle - Square of Sorcery Entry
モリナラ地下洞・深淵 出口,Molinara Underground Abyss Exit
キュロンイーターの巣 出口,Kyuroneater's Nest Exit
瀕死時 20%こうげき力 +60<ban>,Near-Death Attack +60 20% (PvP×)
とこしえの神殿楯の間 入口,Temple of Eternity Shield Room Entry
宇宙船・立入禁止区画 出口,Spacecraft - Restricted Area Exit
プログラマー検証ステージ1,Programmer Verification Stage 1
バルメシュケの研究所 出口,Balmeschke's Laboratory Exit
レビュール街道北-谷合の森,Reviewle Highway North - Veil of the Vale
スライムレースホール 入口,Slime Race Hall Entry
プログラマー検証ステージ2,Programmer Verification Stage 2
シガール町長の執務室 入口,Mayor Sigal's Office Entry
からすかぐらのしょうぞく2,Crow Dance Costume Ⅱ
味方死亡時 20%でバイシオン,Oomph If Ally Dies 20%
プログラマー検証ステージ5,Programmer Verification Stage 5
ビンゴすごろくホール 出口,Bingo & Sugoroku Hall Exit
とこしえの神殿楯の間 出口,Temple of Eternity Shield Room Exit
古グランゼドーラ王国 入口,Old Gran Zedora Kingdom Entry
デス・ジャンクション 出口,Death's Juncture Exit
からすかぐらのしょうぞく1,Crow Dance Costume Ⅰ
スライムレースホール 出口,Slime Race Hall Exit
オルセコ闘技城・舞台 入口,Orseco Combat Castle - Stage Entry
キュロンイーターの巣 入口,Kyuroneater's Nest Entry
オルセコ闘技城・舞台 出口,Orseco Combat Castle - Stage Exit
スイーツゾーン控え室 出口,Sweets Zone Waiting Room Exit
湖の小島・神のまなこ 入口,Lake Islet - The All-seeing Eye Entry
エピステーサ底なし穴 出口,Epistesa Chasm Exit
アストルティア博物館 出口,Astoltia Museum Exit
モリナラ地下洞・深淵 入口,Molinara Underground Abyss Entry
ビタースイーツゾーン 出口,Bittersweets Zone Exit
ゼクレス城・魔導広場 出口,Zechres Castle - Square of Sorcery Exit
