レンジャーコート下,Ranger Coat Bottom
魔物管理人ティーヤ,Monster Manager Tiya
旅芸人ピュージュＦ,Minstrel Pyuju F
第２回クロウズの像,2nd Claws Statue
管理タブレット中古,Used Management Tablet
壁かけガタラ紋章旗,Gatara Wall Banner
オブジェクト座標066,Object Coordinates 066
ペコリア・アルファ,Pekoria Alpha
ハンマー屋トカチャ,Hammer Shop Tokacha
壁かけバラのリース,Rose Wall Wreath
ネタ「おたから袋」,Treasure Bag Trick
うんてんしでっかー,Driver Decker
パピヨンチェア・幻,Phantom Papillon Chair
オブジェクト座標256,Object Coordinates 256
ヴァレリアトランプ,Valeria Cards
りゅうおうハンマー,Dragonlord Hammer
カジノ祭５ビンゴ金,CasinoFest 5 Bingo Gold
セイレーンパレオ上,Siren's Pareo Top
天狐アマツカゼの旗,Amatsukaze Banner
グレゴールの洞くつ,Gregor Cavern
神具解放の審問宮１,Sanctuary of Divine Relics 1
エトワールグローブ,Etoile Gloves
オブジェクト座標004,Object Coordinates 004
ゲルト・勇気の儀式,Gert・Ritual of Courage
シスター・ビゴスラ,Sister Bigosla
ヴァンガードブーツ,Vanguard Boots
ドルワーム研究員帽,Dolworm Research Hat
ハニーポットチェア,Honey Pot Chair
極天女帝の浮遊椅子,Sky Empress' Floating Chair
ギガントヒルズ・強,Vicious Drakularge
ヒューザのこころ５,Hyuza's Heart Lv. 5
中級・魔力錬金の本,Intermediate Mag. Power
カウンターブースト,Counter Boost
戦場を舞うガルーダ,Garuda Dances In Battle
まのギフトボックス,Demon Gift Box
真・幻界諸侯練習札,True Dread Fiends Tag
支援魔神機０２５号,Aztech Support Mech No. 025
スライム柄彫刻の壁,Slime Carved Wall
セピアのトーマ人形,Sepia Toma Doll
スライムのバスタブ,Slime Bathtub
ソルシエールブーツ,Sorciere's Boots
ヒューザのこころ３,Hyuza's Heart Lv. 3
まおうの錬金ランプ,Demon King Alch Lamp
妖精の女王のブレス,Fairy Queen Bracelets
レジェンドチケット,Legend Ticket
金平糖モビール・庭,Candy Mobile (G)
氷の魔王イヤリング,Ice Demon Earrings
フェンサーミサンガ,Fencing Bracelets
砂漠の渇きを癒す者,Desert Thirst Quencher
イルミンズールの弓,Irminsul Bow
壁かけうさぎの御簾,Rabbit Curtain
レンジャーコート上,Ranger Coat Top
バトエンマニアの机,Batoenmania Desk
ＤＱＸ１０周年花火,DQX 10th Anni. Firework
モザイクガラスの柱,Mosaic Glass Pillar
しぐさ書・パレード,Emote "Parade Dance"
アルゴンキッズの像,Argon Fry Statue
奇跡のフライパン小,Miracle Fry Pan S
ムニエカ地方への道,Road to Munieka Region
ステンドグラスの柱,Stained Glass Pillar
しぐさ書・おびえる,Emote "Scared"
おうち用夕焼け天井,Sunset Ceiling
攻撃時25%バイキルト,Oomphle On Attack 25%
エステラのこころ９,Estella's Heart Lv. 9
トンブレソンブレロ,Ham Shamwitch Sombrero
ガナドールグローブ,Victor Bracers
ばくだん岩の像・庭,Rockbomb Statue (G)
ツリーは白銀に消ゆ,Tree's Disappearance
占術師マルグリット,Fortune Teller Margaret
スノースターグラブ,Snowstar Gloves
クロッシュグローブ,Bell Gloves
ゴールデンディスコ,Golden Disco
ウェスタンブラウス,Western Blouse
ネロドス・シャドウ,Nerodos' Shadow
ルークのピース・白,White Rook Piece
庭用ネオン・ハート,Neon Heart (G)
やまたのおろちたち,Orochi and co.
しぐさ書・決め右前,Emote "Pose R. Front"
ストロベリーチョコ,Strawberry Chocolate
キラパン黒プリズム,Dark Sabrecat Prism
ドリームエッセンス,Dream Essence
セラフィムウィング,Seraph Wings
住宅素材屋ピノッピ,Housing Materials Pinoppi
さんぞくのサーベル,Bandit Blade
ポップスターリボン,Pop Star Ribbon
魔塔の鉄の間仕切り,Tower Iron Partition
創造神マデサゴーラ,Worldmaker Madesagora
ほこらの祭祀場・炎,Flame Shrine Ritual Ground
グーシオンカプセル,Dark Pazuzu Toy
スイカのタライ・金,Gold Watermelon Basin
プラコンスーツ・桃,Pink Suit
ドラキーの写真立て,Dracky Frame
ザンクローネの心臓,Zankrone's Heart
アイスブルーダリア,Ice Blue Dahlia
つっぱりウルフの像,Ruff Wolf Statue
巨大風船青スライム,Big Blue Slime Balloon
エゼソル峡谷の木Ｂ,Ezesol Canyon Tree B
スライムナイト帽子,Slime Knight Hat
ビクトリーチップ青,Blue Victory Chip
タイタス号乗船パス,Titus Boarding Pass
スパイスカレー・小,Small Spicy Curry
タコメットの像・庭,Octopot Statue (G)
まがまがしいキノコ,Ominous Mushroom
ナチュラル吊り照明,Natural Hanging Light
シスター・デリアン,Sister Derian
超天遊戯－死の書－,Chosen's Teachings Book 4
第５回釣りコン・金,5th Fish Contest Gold
闘志に火をつけろ！,Fighting Spirit Ignited
大光の管制室への扉,Door to Pulse Control Room
正月ボーイカプセル,New Year Boy Toy
きじゅつしのぼうし,Illusionist's Hat
ガナドールスーツ下,Victor Pants
ゴシック調のベンチ,Gothic Bench
ブラッディグリーブ,Bloody Greaves
クイーン釜プリズム,Queen Pot Prism
黒曜の隕石孔への道,Road to Meteorite Hole
感謝を求める者たち,Those Who Seek Gratitude
はじめよう！杖作り,Starter Staff Making
ナイトマリーのタネ,Night Marie Seed
タロットパック・金,Gold Tarot Pack
究極邪教司祭練習札,Ultimate Aamon Tag
ＤＱⅧ主人公の衣装,DQⅧ Hero Costume
万魔の塔・二の災壇,Banma Tower - 2nd Platform
幻想画「一触即発」,Fantasy Art "Touch and Go"
オブジェクト座標171,Object Coordinates 171
強毒性ザラキール液,Toxic Zaraquil Liquid
しぐさ書・ひらめく,Emote "Inspire"
だいまどうのぼうし,Great Mage Hat
オブジェクト座標170,Object Coordinates 170
大きなお花のベッド,Large Flower Bed
旧ネクロデアの石碑,Old Necrodea Monument
ハクオウのこころ７,Hakuo's Heart Lv. 7
魔物管理人アゼルル,Monster Manager Azerul
ドミネウス邸のイス,Domineus Mansion Chair
きらめく星の贈り物,Twinkling Star's Gift
キューブライト・庭,Cube Light (G)
やりなおしの無限石,Infinite Repeatstone
バットエンドのラグ,Bato-End Rug
スーパーダーキズム,Super Darkism
第５回釣りコン・銅,5th Fish Contest Bronze
フリルのビキニ・赤,Red Frill Bikini
笹と流線じんべい下,Bamboo Jinbei Bottom
キーたんぬいぐるみ,Keytan Plushie
エステラのこころ６,Estella's Heart Lv. 6
イカしたＴシャツ黄,Yellow Cool T-Shirt
使い手をいやすオノ,Wielder-Healing Axe
シスター・メアリス,Sister Maris
どうぐ射程距離延長,Item Range Boost
キャットリベリオ強,Apex Purrgatroyd
ブチ猫・双カプセル,Spotted Cat Twin Toy
クマリスのブラウス,Kumaris' Blouse
預かり所シャーヤー,Storage Shayer
魔物管理人ポリッピ,Monster Manager Polippi
ビクトリーチップ銅,Copper Victory Chip
ポセイドンバスタブ,Poseidon Bathtub
ヴィーラのグローブ,Vila's Gloves
古代王族のターバン,Ancient Royal Turban
シスター・ニルーナ,Sister Nirna
スラライトステッキ,Slimelight Stick
オブジェクト座標265,Object Coordinates 265
リンクル地方への道,Road to Wrinkle Region
ダックスビル浮き輪,Splatypunk Floatie
チェックのスカート,Plaid Skirt
シスター・ヒーディ,Sister Heedy
ゴールデンライト緑,Golden Light (Green)
耐火性きんちゃく袋,Fireproof Bag
ジアクト軍の飛行艇,Dia Kut Army Airship
オグショー像こげ茶,Olive Ogreed Short St.
七夕の職人道具絵巻,Festival Craftsman Book
竜と剣の水玉便せん,Dragon Polka Dot Paper
エステラのこころ４,Estella's Heart Lv. 4
エージェントハット,Agent Hat
ダークペルシャの杖,Whiskamancer Staff
シックに着こなして,Wear it Chicly
まもりのペンダント,Adamant Pendant
三姉妹人形・庭用黄,Yellow 3 Sis. Doll (G)
ハクオウのこころ８,Hakuo's Heart Lv. 8
海沿いのヴィラの床,Seaside Villa Floor
青い翼のペンダント,Blue Wing Pendant
ちっちゃな恋の物語,A Tale of Tiny Love
運動会・白組衣装券,White Team Uniform Tkt
アンノウンステッキ,Unknown Wand
しぐさ書・バトル改,Emote "Battle" v2
花柄モダンふりそで,Modern Floral Kimono
ムーンバニーヘッド,Moon Bunny Head
リースのカーペット,Wreath Carpet
アクロバットスター,Rough 'n' Tumble
虹色のパーカー水着,Rainbow Hoodie Swimsuit
プチＳグレネーどり,Frail Bombird S
水底にたゆたうもの,Undersea Dwellers
プラコン男オバケ服,Men's Ghost Costume
ダンシングライト緑,Dancing Light (Green)
モダンローズの手袋,Modern Rose Gloves
悪夢のヤドリギ広場,Mistltoe Plaza of Nightmares
ポンポンベタ・白赤,White Pom Pom Betta
オブジェクト座標286,Object Coordinates 286
死闘！　山奥の秘湯,Fight! Mountain Hot Spring
オブジェクト座標160,Object Coordinates 160
道に迷いました……,I got lost...
しぐさ書・からあげ,Emote "Fried Chicken"
ギュメイ将軍練習札,Goresby-Purrvis Tag
しぐさ書・ネオン赤,Emote "Neon Red"
星くずプレートの柱,Stardust Plate Pillar
ドワーフ作業うでわ,Dwarf Work Bangles
トレジャーハント！,Treasure Hunt!
うるわしの浜辺地区,Beautiful Beach
魔道士キャロルギル,Wizard Kyrolgyl
オスクトルクラウン,Oscutor Crown
ギュッとメイヴの箱,Meiv Arm Doll Box
ガーデン花火台・緑,Grn. Fireworks Stand(G)
ギュッとウシぐるみ,Cow Arm Doll Plush
蚊帳つきフトン・紫,Purple Futon with Net
ジェスターキャップ,Jester Cap
スノーモンプリズム,Snow Sanguini Prism
サファイアのピアス,Sapphire Earrings
プラコンドレス・青,Blue Dress
ピンクほっぺシール,Pink Cheek Sticker
ファーラット浮き輪,Feralball Floatie
スカーレットコート,Scarlet Coating
エステラのこころ２,Estella's Heart Lv. 2
警備魔神兵０４９号,Aztech Guard No. 049
赤色チューリップ傘,Red Tulip Umbrella
オブジェクト座標270,Object Coordinates 270
巨商のころもセット,Rich Merchant Outfit
カボチャカウンタ小,Pumpkin Counter S
シスター・アニッタ,Sister Anitta
ヴィンテージの時計,Vintage Watch
ベスキャンプリズム,She-Slime Candy Prism
極天女帝のサンダル,Sky Empress Sandals
ハート気球のガゼボ,Heart Balloon Gazebo
海邪竜アビサルドン,Abyssaldon, Wicked Sea Dragon
三毛猫・双カプセル,Calico Cat Twin Toy
警備魔神兵０４４号,Aztech Guard No. 044
古代武器図説・杖編,Book of Ancient Staves
ゼレスタイトの大盾,Celestite Greatshield
からくりだいみょう,Bamboogieman
竜と生きるは竜術士,A Dragomancer's Life
潜水服・デフォルト,Default Diving Suit
苺お菓子のキッチン,Berry Sweet Kitchen
時の指針書レプリカ,Time Guidebook Replica
スノーボールンの像,Snowballon Statue
失われた時を探して,Searching for Lost Time
白色チューリップ傘,White Tulip Umbrella
しぐさ書・ウインク,Emote "Wink"
選定者ワルキュウリ,Selector Val-cu-rie
道具鍛冶職人の選択,Toolsmith's Choice
第２回カジノ祭・銅,2nd Casino Fest Bronze
ラベンダースズラン,Lavender Lily
チョコが詰まった袋,Chocolate Filled Bag
ローヌ風焼き肉弁当,Rhone-Style Grilled Bento
模様入りしっくい柱,Pattern Plaster Pillar
郵便局員ジェノール,Postman Gennault
旅人バザー・道具屋,Traveler's Bazaar/Item Shop
ラディカルシールド,Radical Shield
バズスイーツカフェ,Pazu Sweets Cafe
上級・魔力錬金の本,Advanced Magic Power
アウトドアテーブル,Outdoor Table
ライダージャケット,Rider Jacket
オブジェクト座標070,Object Coordinates 070
フラワーギフト券Ⅱ,Flower Gift Voucher Ⅱ
オブジェクト座標173,Object Coordinates 173
第２回ラグアスの像,2nd Raguas Statue
オブジェクト座標193,Object Coordinates 193
おどる宝石の像・庭,Goodybag Statue (G)
ヴァンガード冒険譚,Vanguard Adventure Tale
しぐさ書・ブレイク,Emote "Break"
あやしいテーブル大,Suspicious Table L
コケ玉の盆栽セット,Moss Ball Bonsai Set
オルッパ地下洞くつ,Orppa Underground Caves
マデュライトの延板,Darkonium Plate
呪われたシシカバブ,Cursed Shish Kebab
ランプ錬金設備・庭,Lamp Alch. Facility (G)
チョッピ荒野の木Ａ,Choppi Wilderness TreeA
竜族人形男のライト,Nadravian Doll Light(M)
オブジェクト座標187,Object Coordinates 187
雪だるまスライダー,Snowman Slide
シャーマニズム大全,Shamanism Encyclopedia
あさがお柄のゆかた,Bell Pattern Yukata
ゼニスの封宮　入口,Palace of Zenith Entry
ホイミントドレス上,Heal Mint Blouse
マスター・アーリュ,Guildmaster Aryu
メレアーデの便せん,Mereade Paper
勇気を奮い立たせて,Muster the Courage
超フライパン小の本,Super Fry Pan S Book
王国の悪夢・洞くつ,Kingdom of Terror - Cave
グレーリリィのタネ,Dark Gray Lily Seed
蘇りし魔軍師イッド,Risen Tactician Id
アンドレアルカード,Rashaverak Card
ドラゴンゾンビの像,Dragon Zombie Statue
オブジェクト座標251,Object Coordinates 251
ミストグレーの花束,Mist Gray Bouquet
作ろう！てつよろい,Let's Make Iron Armor!
アナザーハートの箱,Another Heart Box
ネオン・虹サークル,Neon Rainbow Circle
いにしえのゼルメア,Ancient Zelmea
星空のチェスト・青,Blue Starry Chest
全職かいふく魔力+20,Magical Mending +20
忍びのマフラー・紫,Purple Ninja Scarf
ビーナスのほほえみ,Venus' Smile
ツリーハウスの外観,Treehouse Exterior
ふしぎな燭台・赤色,Red Mystery Candlestick
チョコ神ぬいぐるみ,Choco-God Plushie
アスフェルド学園駅,Asfeld Academy Station
ドロまみれの新色！,New Muddy Color!
表層・サフィア宙橋,Surface - Saphia Bridge
ベジタブル家具の本,Veggie Furniture Book
はやてのキュロット,Agility Culottes
レーンの村の丸イス,Rane Village Stool
はじゃのろーぶどう,Bronze Champ Robe
クリティカルロッド,Critical Rod
ゴージャスクリーム,Gorgeous Cream
アイドルヘアバンド,Idol Hairband
あなたと私の弓作り,You and I Making a Bow
ポーンのピース・黒,Black Pawn Piece
クロスペンデュラム,Cross Pendulum
タロットパック・紫,Purple Tarot Pack
初級・呪文錬金の本,Beginner Spell
エテーネ軍の兵士Ｄ,Ethene Army Soldier D
ビリジアンカメリア,Virdian Camellia
まもの使いのブレス,Monster Master Bangle
オブジェクト座標137,Object Coordinates 137
全職さいだいＭＰ+20,Max MP +20
サニーアンクレット,Sunny Anklet
コンシェルジュ０６,Concierge 06
ごうかなグリル・赤,Red Fancy Grill
エンジェルウィング,Angel Wing
グレイツェルの大鍋,Gretzel's Cauldron
オブジェクト座標274,Object Coordinates 274
シグナルクローバー,Clover Signal
キラパン白プリズム,White Sabrecat Prism
イナミノ街道の木Ｃ,Inamino Highway Tree C
娯楽島ラッカラン駅,Luckland Island Station
経験値の古文書・小,Experience Scroll S
魔物三度笠チケット,Sandogasa Ticket
青年貴族のグローブ,Nobleman's Gloves
オブジェクト座標217,Object Coordinates 217
まもの使いずきん２,Monster Master Hood 2
おとぎの森エプロン,Fairy Forest Apron
プラコンスーツ・紺,Navy Blue Suit
ピクニックダストン,Duston Picnic
夢のアクセサリー箱,Dream Accessory Box
グロリアスグローブ,Glorious Gloves
パンパニーニノート,Panpanini's Notebook
しぐさ書・ミルク缶,Emote "Milk Can"
エキゾチックピアス,Exotic Earrings
ドルバイクプリズム,Dol-Bike Prism
王宮のイスと机の本,Royal Furniture Book
会心まいしんラップ,Confidence Rap
オブジェクト座標196,Object Coordinates 196
アンティーク風の壁,Antique Wall
ホイミントドレス下,Heal Mint Skirt
天使人形ルーミリア,Angel Doll Lumeria
オブジェクト座標207,Object Coordinates 207
オブジェクト座標116,Object Coordinates 116
ガメゴンレジェンド,Wonder Wyrtle
スライムエンペラー,Emperor Slime
光飾りタイルの鏡台,Light Tile Vanity
カボチャのキッチン,Pumpkin Kitchen
銀のキーエンブレム,Silver Key Emblem
錬金術は時を超えて,Alchemy Transcends Time
りゅうおうトランプ,Dragonlord Cards
南国スラムざぶとん,Tropical Slime Floormat
カプサイナイトの服,Capsai Knight's Clothes
労働魔神機０３８号,Aztech Labor Mech No. 038
ドワーフカウンタ小,Dwarf Counter S
第１１回パドレ像庭,11th Padre Statue (G)
エルフ人形の作り方,Making Elf Dolls
凱歌のガントレット,Valkyrie Gauntlets
レインスカート・青,Blue Rain Skirt
フラワーカンカン帽,Flower Can-Can Hat
ヴィーラのサンダル,Vila's Sandals
女性もみじのゆかた,Maple Yukata (F)
謎の生き人形の写真,Mystery Lively Doll Photo
オブジェクト座標046,Object Coordinates 046
虹のフェザーチップ,Rainbow Feather Chip
はじゃのよろいぎん,Silver Champ Armor
紅蓮のフランベリー,Bright Red Flanberry
ロードリーローブ上,Lordly Robe Top
さすらいのコート下,Errant Coat Bottom
中級・呪文錬金の本,Intermediate Spell
ナルビア民家のラグ,Nalbia House Rug
フォンデュの像・庭,Fromage Fray Statue (G)
ランプ素材屋ナディ,Lamp Materials Nadi
ヤドリギ広場　出口,Mistletoe Plaza Exit
激辛トマトジュース,Super Hot Tomato Juice
シスター・カナーテ,Sister Canate
ストリートバンダナ,Street Bandana
支援魔神機０２１号,Aztech Support Mech No. 021
しぐさ書・パンフ２,Emote "Pamphlet 2"
マジックチャクラム,Magic Circle
陰陽博士のてぶくろ,Ying-Yang Gloves
コンシェルジュ１０,Concierge 10
魔法のペンプリズム,Magic Pen Prism
スライダーククロー,Nemeslime Claws
花の生けられた花瓶,Vase with Flowers
表情の書・ドヤがお,Expression "Smug"
ドラグーンメイル上,Dragoon Mail Top
土地管理人リステア,Land Manager Listeah
盗賊のチュニック上,Thief Tunic
ゲルヘナ幻野への道,Road to Gerhena Field
フューチャーグラブ,Future Gloves
オブジェクト座標272,Object Coordinates 272
アンドレアルコイン,Rashaverak Coin
壁かけリソル肖像画,Resol Portrait
ゴールデンパペット,Gold-Plated Puppet
結界の守護者コイン,Barrier Guardians Coin
キラキラねこまどう,Glittering Meowgician
リーフシードラゴン,Leafy Seadragon
スノー柄の便利な壁,Snow Pattern Wall
ブラッドメイジたち,Blood Mages
大いなる危機の胎動,Great Crisis in Motion
エージェントマスク,Agent Mask
ガーディアンサラダ,Guardian Salad
メロディアスーツ上,Melody Suit Top
ライノス・ルージュ,Rouge Rhino
ハイビスコサージュ,Hibiscus Corsage
船長より愛を込めて,With Love From the Captain
蘇りし怪蟲アラグネ,Risen Araniad
呪われた大地への道,Road to Cursed Land
しぐさ書・オカリナ,Emote "Ocarina"
すいーとないしょう,Sweet Outfit
しぐさ書・雪だるま,Emote "Snowman"
銀の鍛冶ハンマー小,Silver Smith Hammer S
エゼソル峡谷の木Ｃ,Ezesol Canyon Tree C
果てなき修練の末に,After Endless Training
フォーリオン造成地,Fourion Worksite
ナゾの黒いかたまり,Black Lump of Mystery
チームおにごっこ帽,Team Tag Cap
ストームタルト・小,Small Storm Tart
ギガンテスカプセル,Gigantes Toy
妖精の女王ドレス上,Fairy Queen Upper Dress
プレゼントボックス,Present Box
おぞましき呪いの絵,Dreadful Cursed Drawing
ひかりサークレット,Shimmering Circlet
タウン案内係ポポコ,Town Guide Popoko
ごうかなタンス・赤,Red Fancy Wardrobe
ミニポニテエクステ,Mini Ponytail Extension
炎うず巻く聖なる鳥,Fiery Holy Bird
ウェスタンレイピア,Western Rapier
ガーディアンヘルム,Guardian Helm
預かり所バルバトゥ,Storage Barbatou
ウェディテーブル大,Weddie Table L
門より出でし者たち,Dwellers from the Gate
ヴァルハラメイル下,Valhalla Mail Bottom
バルディスタ遊撃兵,Valdista Attack Soldier
プリズニャンコタツ,Jailcat Kotatsu
マスカレイドブーツ,Masquerade Boots
ユシュカぬいぐるみ,Yushka Plushie
プラコン男ミイラ服,Men's Mummy Costume
防衛魔神兵０５９号,Aztech Guard No. 059
ハスの花ランプ・緑,Green Lotus Lamp
スライム強スリッパ,Vicious Slime Slippers
深い森の修道院の塀,Monastery Fence
黒猫オッドカプセル,Odd Black Cat Toy
ベラストル家のイス,Belastre Chair
銀のフェザーチップ,Silver Feather Chip
ネオンフラッシュ緑,Neon Flash (Green)
ナチュラルテーブル,Natural Table
パピヨンドーム・幻,Phantom Papillon Dome
か弱きスライムたち,Feeble Slime and co.
しぐさ書・たけのこ,Emote "Bamboo Shoot"
愛しのツボ錬金職人,Beloved Pot Alchemist
ニヒルなサングラス,Nihilistic Sunglasses
たびびとのリュック,Traveler's Backpack
プラコン男あくま服,Men's Imp Costume
アクセ購買員タリス,Accessory Buyer Tals
クローバーシールド,Clover Shield
お庭用グリッドラグ,Grid Rug (G)
ガラクタボックス４,Junk Box 4
サメバーンプリズム,Sharkburn Prism
オブジェクト座標257,Object Coordinates 257
ヒューザのこころ８,Hyuza's Heart Lv. 8
聖守護者のウィング,Sentinel's Wings
神具解放の審問宮２,Sanctuary of Divine Relics 2
フウラの肖像画・庭,Fuura Portrait (G)
こおりのやいばの書,Icicle Dirk Book
全職さいだいＨＰ+30,Max HP +30
深海にうごめくもの,Deep Sea Lurker
ごうかなラグ小・緑,Green Fancy Rug S
行動時25%早詠みの杖,Faster Caster On Action 25%
キューキョクＶロン,Ultimate Vron
灰三毛太猫カプセル,Fat Ash Calico Cat Toy
ガラクタボックス２,Junk Box 2
アンドレアル練習札,Rashaverak Tag
モダンローズヒール,Modern Rose Heels
ベラストル家の呪符,Belastre Amulet
パッチ柄ソファ・桃,Pink Patch Sofa
花狩人のころも・赤,Red Flower Hunter Outfit
ハート兵隊スカート,Heart Soldier Skirt
プラコンドレス・紺,Navy Blue Dress
しぐさ書・グレドラ,Emote "Great Dragon"
プンスコのソファー,Punsuko's Sofa
求道者の道着セット,Seeker's Outfit
スラベスぬいぐるみ,She-Slime Plushie
キャット・バルバド,Purrseidon
ホットな海パン・黒,Black Hot Trunks
赤のキーエンブレム,Red Key Emblem
人の域を超えた強者,Strong Beyond Human Limits
サファイアプリズム,Sapphire Prism
ホイミンぬいぐるみ,Healie Plushie
レプリカード発行証,Replicard Proof
白霜の流氷野への道,Road to Frosty Floes
オブジェクト座標113,Object Coordinates 113
スライムタワーの像,Slime Stack Statue
オブジェクト座標264,Object Coordinates 264
キャンディのピアス,Candy Earrings
りょうりにんすぷる,Chef Sprue
蝶とレースの便せん,Butterfly & Lace Paper
ドルワーム研究ぐつ,Dolworm Research Shoes
洗たくカゴのベッド,Laundry Basket Bed
オブジェクト座標131,Object Coordinates 131
タイフーンレザー上,Typhoon Leather Shirt
パワーストーンマン,Power Stone Golem
オブジェクト座標202,Object Coordinates 202
スノースター衣装上,Snowstar Dress Top
謎の飛行物体の写真,Mystery UFO Photo
メラゾーマやきそば,Kafrizz Fried Noodles
グレースギフト・赤,Red Grace Gift
姉神封印神殿　入口,Goddess Seal Temple Entry
オブジェクト座標267,Object Coordinates 267
レンダーヒルズ地区,Lender Hills District
プラチナフライパン,Platinum Fry Pan
ゴージャスウィップ,Gorgeous Whip
オブジェクト座標203,Object Coordinates 203
第１１回プクラス像,11th Pukulas Statue
オブジェクト座標085,Object Coordinates 085
砂塵の幻馬プリズム,Phantom Horse Prism
聖者のほういセット,Saint's Outfit
コンシェルジュ１４,Concierge 14
王宮魔術師ローブ上,Royal Mage Upper Robe
嵐の領界のテーブル,Storm Realm Table
ウィザードバス・黒,Black Wizard Bath
ゴールドマンＸ９号,Gold Golem X 9
プチゲルニック将軍,Frail Hootingham-Gore
エピステルシャの像,Epistelsia Statue
攻撃時10%でヘナトス,Blunt Attack 10%
切り替わり物干し台,Switchable Clothesline
ほこらの祭祀場・氷,Ice Shrine Ritual Ground
コイン販売所ユアン,Token Exchange Yuan
ミミックぬいぐるみ,Mimic Plushie
すざくの弓の秘伝書,Vermilion Bird Bow Book
バトルステーキ・小,Small Battle Steak
オブジェクト座標180,Object Coordinates 180
ビクトリーチップ闇,Dark Victory Chip
高機能錬金食品の本,Efficient Alchemy Food Book
表情の書・ウインク,Expression "Wink"
野いちごバスケット,Wild Strawberry Basket
小型のネオン水そう,Small Neon Aquarium
ファントムカチーフ,Phantom Kerchief
ナチュラル間仕切り,Natural Partition
キュルルぬいぐるみ,Kyururu Plushie
庭用ネオン・レター,Neon Letter (G)
オブジェクト座標034,Object Coordinates 034
花婿のサークレット,Groom's Circlet
