カボチャ間仕切り,Pumpkin Partition
シュガーシューズ,Sugar Shoes
パルカラス亡霊王,Ghost King Palkaras
イラッシャイマセ,Welcome
タイタス号の積荷,Titus Cargo
ライトスティック,Light Stick
おそうじ童子の像,Sweepy Samurai Statue
看板・ビックリ！,Sign - Exclamation!
ヘルジュラシック,Dragster
ギュッとアスバル,Asbal Arm Doll
星の職人道具絵巻,Starry Craftsman Book
護りの盾のブーツ,Boots of Protection
マイタウン権利証,My Town Deed
小型の球体水そう,Spherical Aquarium S
ふわふわクマノミ,Fluffy Clownfish
シーサイドチェア,Seaside Chair
カンダタの像・庭,Robbin' 'Ood Statue (G)
ゾンビブラザーズ,Zombie Brother
ウルベア地下帝国,Urbea Underground Empire
フェンサーブーツ,Fencing Boots
だいまどうのくつ,Great Mage Shoes
種族神像ウェディ,Weddie Tribal Statue
おうち用川のラグ,River Rug
しびれくらげ０６,Man o' War 06
奇跡の錬金ツボ小,Miracle Alch Pot S
小鳥のガゼボ・茶,Brown Small Bird Gazebo
防具屋アーニャー,Armor Shop Annya
預かり所エディス,Storage Edith
パンジーのズボン,Pansy Pants
うさぎのおまもり,Bunny Tail
ウェナールピアス,Wenal Earrings
紹介人グリゼット,Introducer Glisette
特技の射程距離+2m,Skill Range +2m
機神の眼甲の破片,Mechanical Eye Shard
ドリームチケット,Dream Ticket
学長マスカレイド,School President Masquerade
ＣＭ用プクリポ３,Pukulipo For CM 3
ホワイトマアモン,White Fudge Sludge
アウルスティック,Aur Wand
栄光に隠された闇,Darkness Hidden in Glory
ヨロイの幽霊さん,Mr. Yoroi's ghost
メレアーデの部屋,Mereade's Room
フェアリー衣装Ⅰ,Fairy Costume Ⅰ
ボーンファイター,Zombie Gladiator
ワイルドファング,Wild Fang
ハルファスの紋章,Halphas Crest
初期プクリポ女性,Initial Pukulipo Female
コポのポーチの箱,Kopo Pouch Box
兵士の荷物ぶくろ,Soldier's Luggage Bag
ティプローネ高地,Tiplone Highlands
ネタ「こまいぬ」,Foo Dog Trick
じごくのおくり火,Lava Lampling
ナイトスナイパー,Night Sniper
ジア・クルヴィダ,Dia Kuruvida
プラチナ木工刀小,Platinum Slick S
武器防具屋ソロリ,Weapon & Armor Shop Sorori
ネレウスアックス,Nereus Axe
魔塔銀行屋ボクス,Tower Banker Bokks
ポセイドン仕切り,Poseidon Partition
Ⅲ‐スペーディオ,Ⅲ‐Wulfspade
レースの観客１９,Race Spectator 19
マカイ・マカロン,Demon World Macarons
魚交換員ペコリア,Fish Exchange Pekoria
３段ブロック・赤,Red 3-Step Block
ぐんたいガニ・強,Vicious Crabid
天界のあるきかた,How to Walk the Heavens
ドラパンクパンツ,Dracky Punk Pants
レジェンズロッド,Legends Rod
魚交換員ターラタ,Fish Exchange Tarata
ランプ屋カランテ,Lamp Shop Carante
ファーグスオイル,Fargus Oil
ノワールウィング,Noir Wings
スターリースピア,Starry Spear
アリアハンマント,Aliahan Cape
ダイバーレギンス,Diver Leggings
あやしいかげ・強,Vicious Shade
ホワイトジャッジ,White Judge
エンゼルハンマー,Angel Hammer
ギーグハンマー強,Apex Giga Clubber
うつしよの境界地,World's Boundary
ノーブルコート下,Noble Coat Bottom
幻界闘士のゆびわ,Phantom Fighter Ring
サメきぐるみ・赤,Red Shark Suit
タロットテーブル,Tarot Table
こわれたスロット,Broken Slot Machine
よろず屋カエマン,General Shop Kaeman
堕天使エルギオス,Fallen Angel Corvus
パピヨンクラウン,Papillon Crown
みやびな打ち掛け,Elegant Wedding Kimono
ゲノミーキャップ,Crankiid Cap
いだいなてんさい,Great Genius
エルフのサンダル,Elf Sandals
オノ特技の範囲+2m,Axe Skill Range +2m
マリーンの宝石袋,Malynn's Jewel Bag
ベリアル強メダル,Apex Belial Medal
じょうりゅうせき,Distillastone
おうち用青空天井,Blue Sky Ceiling
天翼のイヤーカフ,Heavenly Wing Ear Cuffs
アリアハンブーツ,Aliahan Boots
よろず屋ゴーツク,General Shop Gotsuku
ゴシックグローブ,Gothic Gloves
おばけトマト軍団,Haunted Tomato Army
装飾具屋ピッタン,Decoration Shop Pittan
星天のペンダント,Starry Pendant
プテラノドン・強,Vicious Pteranodon
冒険スタンプ印章,Adventure Stamp
ダーマ神官アデラ,Abbey Priest Adela
ほっとイヤーマフ,Soft Earmuffs
中枢へ向かう通路,Passage to Core
みやげ屋ベニーア,Souvenir Shop Benia
ミシュアのブーツ,Mishua Boots
世界を肯定する者,The World Affirmer
東洋風ベンチ・雅,Chic Orient Bench
ゴクラクギョ・青,Blue Betta
ビンのテラリウム,Bottle Terrarium
青い金魚と金魚鉢,Blue Goldfish in Bowl
古強者のよろい下,Veteran's Faulds
アクロバットの像,Acro Bat Statue
おおとろの切り身,Tuna Belly
ふわふわホイミン,Fluffy Healie
プリズニャン・強,Vicious Jailcat
キャプテンドラゴ,Captain Drago
うろこのよろい下,Scale Armor Bottom
ファントムハック,Seeing Stars
帝国三将軍カード,Triumgorate Card
ヘルコンダクター,Hell Conductor
アイスタルト・小,Small Ice Tart
トライバルボトム,Tribal Bottom
レジェンズランス,Legends Lance
ギュメイカプセル,Goresby-Purrvis Toy
ラッキーチケット,Lucky Ticket
親分ザメの浮き輪,Boss Shark Floatie
風車の丘への出口,Exit to Windmill Way
すごろく魔法使い,Sugoroku Mage
シャンテキッチン,Shante Kitchen
エビルソーサラー,Evil Sorcerer
ドルタムの念晶鏡,Doltam's Telecrystal Mirror
エステラキッチン,Estella Kitchen
かばん工房の秘密,Bag Workshop's Secrets
代理人ハヤテの像,Agent Hayate Statue
ハートのロザリオ,Heart Rosary
メロディアヘッド,Melody Hair Ornaments
マッシュスライム,Slimeshroom
レースの観客１０,Race Spectator 10
黒ねこの便利な壁,Black Cat Wall
ポルネア山への道,Road to Polnea Mountain
カラフルチケット,Colorful Ticket
スチームバスタブ,Steam Bathtub
超錬金ランプの本,Super Alch Lamp Book
ドラゴン花火・緑,Green Dragon Firework
はがねのよろい上,Steel Armor Top
白猫のワンピース,White Cat Dress
カフェラテの花束,Latte Bouquet
夢の王国グローブ,Dream Kingdom Gloves
クッキングデビル,Cooking Devil
追想の王城・２階,Memory's Castle 2F
招かれざる者たち,The Uninvited
えにし紡いで……,Spinning Fate...
サフランローブ下,Saffron Robe Bottom
アメジストの置物,Amethyst Ornament
武器鍛冶グローブ,Weaponsmith's Gloves
ドラグーンヘルム,Dragoon Helm
第１０回ラウル像,10th Raul Statue
ウェディバスタブ,Weddie Bathtub
キラキラゴーレム,Glittering Golem
幻想蝶のウィング,Fantasy Butterfly Wings
ハッピーチケット,Happy Ticket
天蓋付きのベッド,Canopy Bed
ステューデントＢ,Student B
財宝のつまった箱,Full Treasure Box
預かり所グログス,Storage Gulgus
大きなお菓子の壁,Big Sweets Wall
幻界王の首かざり,Dreadful Necklace
しぐさ書・Ｖロン,Emote "Vron"
グラコスの像・庭,Gracos Statue (G)
よろいのきし召喚,Summon Knight Errant
カテドラルローブ,Cathedral Robe
ある船乗りの手記,Sailor's Memoir
夏のかき氷セット,Summer Shaved Ice Set
くさりかたびら上,Chain Mail Top
防具屋ピルフォン,Armor Shop Pilfon
カレイドスコープ,Kaleidoscope
グレンドラゴニア,Glendragonia
雪原のアノラック,Snowfield Anorak
邪神ヤファギル戒,Yaphagil, the Precept
弐の式修了の陰符,Yin II Completion Charm
ダークレアリズム,Dark Realism
メカニックフード,Mechanic Hood
３階への転送装置,Transporter to 3F
魔妖星プルタヌス,Demon Star Plutanus
グロリアスブーツ,Glorious Boots
華やかなふりそで,Lustrous Kimono
『だれでもＯＫ』,"Anyone is OK"
紹介人ウェダガン,Introducer Wedgan
ポセイドンチェア,Poseidon Chair
ヒュプノスハント,Persecutter
ベルトロの部下Ｂ,Bertro Subordinate B
ネタ「たけのこ」,Bamboo Shoot Trick
スライムショット,Slime Shot
預かり所ヤムジク,Storage Yamujiku
ガーデンスーツ上,Garden Suit Top
花と手紙のセット,Flower and Letter Set
プチ暗黒の魔造兵,Frail Dark Golem
次期天使長の行方,Find The Next Archangel
原始獣のシャプカ,Primal Beast Shapka
ファントムマスク,Phantom Mask
ルビーのドレス下,Ruby's Dress Bottom
スマイルリザード,Raptile
便せん屋ヒキワリ,Stationery Shop Hikiwari
破壊神シドーの像,Malroth Statue
メラゾ熱ワクチン,Kafrizz Fever vaccine
エトワールハット,Etoile Hat
トナカイシューズ,Reindeer Boots
風変わりな研究書,Eccentric Research
ぽかぽかマフラー,Warm Scarf
交換屋メリーポコ,Exchange Shop Meripoko
しぐさ書・ビート,Emote "Beat"
シルエット・記号,Silhouette Sign
たたきモグラの像,Mashing Mole Statue
くらげポンポン帽,Jellyfish Pom Pom Hat
スペシャルランチ,Special Lunch
スイートランタン,Sweet Lantern
保育地区ペコリア,Nursery Area Pekoria
ボスコイン無料券,Free Boss Coin Ticket
アンロックコード,Unlock Code
紫イモのテーブル,Purple Yam Table
破戒王ベルムド影,Sin King Bermud Shadow
ヒューザのポスト,Hyuza Mailbox
ルシェンダの武器,Lushenda's Weapon
ようせいのひだね,Lamplight
三姉妹の馬車・青,Blue 3 Sisters Carriage
星拳士シャドポン,Starfighter Shadowpon
ギュッと時の化身,Tockle Arm Doll
おおぞらの便せん,Clear Sky Paper
シスター・ミペカ,Sister Mipeka
景品交換所コルナ,Prize Exchange Koruna
氷の上のぬくもり,Warmth On the Ice
黄昏の詩人の楽譜,Twilight Poet's Score
こいするめりっさ,Melissa in Love
壁かけＤＱⅧの絵,DQⅧ Painting
ろうごくドーター,Prison Daughter
形見を取り返せ！,Take Back What's Yours!
魂を刈り取る天使,Angel Who Reaps Souls
セラフィキッチン,Seraphi Kitchen
ピクニックカミル,Kamil Picnic
閃手賞トロフィー,Athlight Trophy
ダイコンのタンス,Daikon Wardrobe
ポイズンリザード,Killer Gila
古き踊り子の伝説,Old Dancer's Legend
バトマスグローブ,Battlemaster Gloves
ブルームシールド,Bloom Shield
パッションパレオ,Passion Pareo
終わりを告げる者,The Doomsayer
覇者のローブ・銀,Silver Champ Robe
学園の校庭の砂場,Schoolyard Sandbox
ふわふわ雲のラグ,Fluffy Cloud Rug
ダンディグローブ,Dandy Gloves
景品交換所シリン,Prize Exchange Shirin
スプリングレザー,Spring Leather
国王コウリンの馬,King Kourin's Horse
わふうしょうぞく,Breezy Wear
ルティショー像茶,Tea Astolti Short St.
邪毒のウィーヌム,Poisonous Wienum
ブラッディ・ゼア,Bloody Zea
シスター・サテラ,Sister Satella
レースの観客２６,Race Spectator 26
カプリコルランス,Capricor Lance
とこなつバングル,Summer Bangles
究明者のコート上,Research Coat Top
しぐさ書・のぞく,Emote "Peek"
魔物管理人レベレ,Monster Manager Rebre
渡し守スーティー,Ferryman Sutei
音符のタンス・黒,Black Music Wardrobe
ガテリア式真空管,Gateria Vacuum Tube
ゼクレスの丸イス,Zechres Stool
パラディンガード,Knight Watch
オルフェアリーズ,Orphearies
預かり所サーニュ,Storage Sannu
ガテリア式動力源,Gateria Power Source
メタスラスカーフ,Metal Slime Scarf
道具屋ポッピーナ,Item Shop Poppina
エンゼルアックス,Angel Axe
昔ながらの扇風機,Classic Electric Fan
スウィ～ツランド,Sweetsland
メレアーデリスト,Mereade Wristbands
チェルシーの白衣,Chelsea's White Coat
はぐメタルーキー,Rookie Liquid Metal Slime
ゾーマ　ケンジャ,Zoma, Sage
預かり所ウロック,Storage Ulock
エアカープリズム,Air Car Prism
夜宴館プレミアム,Premium Banquet Hall
ハリケーンエッジ,Blusterang
ふわふわ雲のイス,Fluffy Cloud Chair
第１１回パドレ像,11th Padre Statue
ほっとするかばん,Comforting Bag
こんらんのダンス,Dance of Confusion
スレア海岸への道,Road to Surea Coast
絆のエンブレム極,Apex Bonding Emblem
素材屋ジョスリン,Material Shop Joslyn
ギャスモンハート,Buntzenberner Heart
ネタ「メタキン」,Metal King Trick
大魔王のお召し物,Great Demon King Apparel
タイタス号の小舟,Titus Ship
バブリン印の丸薬,Zepling Marked Pill
まもの使いずきん,Monster Master Hood
ブラッドスピアー,Barbarous Pole
ウイングタイガー,Missing Lynx
ドワチャカオイル,Dwachakka Oil
ランドインパクト,Crackerwhack
ノリまゆげシール,Eyebrows Sticker
惨禍の迷路への道,Path to Disaster's Maze
セラフィＴシャツ,Seraphi T-Shirt
ネレウスバスター,Nereus Buster
ほしくずのつるぎ,Stardust Sword
エレガントドレス,Elegant Dress
占い師たちの休日,Fortune Teller's Holiday
武勲の城の庭園灯,Valor Castle Light (G)
まよえるかるろす,Lost Carlos
真・やいばくだき,True Attack Attacker
若武者のよろい上,Young Warrior Cuirass
学園女子の夏服下,Schoolgirl Summer Skirt
みかわしオムレツ,Evasion Omelet
ニューＶロンの盾,New Vron Shield
しぐさ書・きのこ,Emote "Mushroom"
ふわふわネルゲル,Fluffy Nergel
クラウングローブ,Clown Gloves
もうどくブルース,Poisonous Blues
巨象のフライパン,Naumanncook's Fry Pan
時の化身クルッチ,Ickle the Tockle
レビュール菜の花,Reviewle Rapeseed
復讐の兄弟竜・改,Uber Vengeful Dragons
ラーの鏡くりぬき,Hollow Mirror of Ra
クルーガーブーツ,Kluger Boots
暗黒の魔人カード,Ruin Card
テルドミールたち,Overup Rider and co.
魔法戦士団制服２,Armamentalist Uniform 2
武刃将軍のゆびわ,Warrior General Ring
慟哭のフライパン,Wailing Fry Pan
レースの観客０５,Race Spectator 05
欠番ジェニャの卵,Missing # Jenya Egg
マジカルチケット,Magical Ticket
光の錬金ツボの本,Light Alch Pot Book
タイフーンブーツ,Typhoon Boots
ブルーマリッジ島,Blue Marriage Island
DQ3そうりょぞーま,DQ3 Priest, Zoma
太陽と月のアーチ,Sun and Moon Arch
参の五声は言の声,Third of 5 Voices Speak
スライムベス・祖,Ancestor She-Slime
ヴェリナード城駅,Verinard Castle Station
地下へつづく階段,Stairs to the Underworld
ガートラント兵５,Gartlant Soldier 5
レシピ屋ルペッタ,Recipe Shop Ruperta
まっちゃガーベラ,Matcha Gerbera
魚交換員ビコメチ,Fish Exchange Bikomechi
リリオルを探せ！,Find Lyriol!
ファータドレス上,Fata Dress Top
レギオングリーブ,Legion Greaves
暴走したコウリン,Berserk Kourin
バルディスタ印章,Valdista Stamp
武器屋バーニジア,Weapon Shop Banijia
ティプローネ光花,Tiplone Light Flower
アスバルのマント,Asbal's Cape
学園の教室の教壇,School Classroom Podium
リーネイヤリング,Renee Earrings
アインスリッター,Eins Ritter
お茶屋のパラソル,Teahouse Umbrella
パピヨングローブ,Papillon Gloves
フローズンバード,Icebird Throw
うすざくらダリア,Pale Pink Dahlia
シンプルシューズ,Simple Shoes
ドラキーの便せん,Dracky Paper
女学生のスカート,Schoolgirl Skirt
深淵をのぞくもの,Look Into The Abyss
超エッチなしたぎ,Really Robust Lingerie
マーチングコート,Marching Coat
ドルワーム兵士１,Dolworm Soldier 1
デリシャスカルビ,Delicious Ribs
ドルタムシールド,Doltam Shield
ほのおのグリーブ,Flame Greaves
銀の錬金ランプ小,Silver Alch Lamp S
黄金のパラディン,Golden Paladin
ルビーのサンダル,Ruby's Sandals
文官レジドの手記,Resid's Note
お待たせしました,Thanks for waiting!
レーザーユニット,Laser Unit
出張購買員サシモ,Team Vendor Agent Sashim
デスクローゼット,Mimicloset
占い師の丸型ラグ,Diviner Round Rug
シックゴスセット,Chic Goth Outfit
魔法使いのブーツ,Mage Boots
最後の神話の戦い,The Last Mythical Battle
ジュエルシャワー,Jewel Shower
天翼のエンブレム,Heavenly Emblem
記憶のパドレア邸,Memory of Padrea Mansion
スライム露天風呂,Slime Outdoor Bath
世界樹のよろい上,Yggdrasil Armor Top
カルサドラ大空洞,Calsadora Hollow
カンフーキャップ,Kung Fu Cap
レクタリスセット,Lectalis' Outfit
奇跡の木工刀の本,Miracle Slick Book
第９回カミルの像,9th Kamil Statue
すごろく魔法戦士,Sugoroku Armamentalist
つままれスラベス,Pinched She-Slime
ティンクルバトン,Twirl Baton
郵便局員ブノワト,Postman Bunwato
レース刺繍の日傘,Embroidered Umbrella
三姉妹のモビール,3 Sisters Mobile
ミリオンスマイル,Million Smile
シスター・ロロサ,Sister Lolosa
脱・辺境ドリーム,Unremote Dream
ペコリア・オメガ,Pekoria Omega
セラフィパラソル,Seraphi Umbrella
ツンドラハンマー,Tundra Hammer
りんねの大盾の書,Big Brain Drainer Book
えきいんあぼっと,Attendant Abbot
プレゼントリスト,Present List
滅亡の砂漠への道,Path to Desert of Doom
ウェディ風アーチ,Weddie-Style Arch
黒いレースの日傘,Black Lace Umbrella
第１２回ピコ像庭,12th Pico Statue (G)
シェンロンロッド,Xenlon Rod
最果ての地下遺跡,Deepest Depths
臨時大使ペリレネ,Temp Ambassador Palileo
スクアーロの写真,Squalo's Photo
銀のフライパン小,Silver Fry Pan S
クルヴィダの王冠,Kuruvida's Crown
ツボ錬金作業着上,Pot Alchemist's Clothes
メタルなプチ香水,Metal Perfume S
おみくじボックス,Fortune Box
バシルーラの起源,The Origins of Bazoom
ゆうたのリュック,Good Night Backpack
レクタリスの姿絵,Lectalis Portrait
夕焼け雲のタンス,Sunset Cloud Wardrobe
アルテミスの恵み,Artemis' Blessing
キングスパーキー,King Sparky
ヴォルカドラゴン,Volcanic Dragon
灰ねこの便利な壁,Ash Cat Wall
ザンクローネの本,Zankrone's Book
ウォーターサイド,Waterside
ハンマー作り入門,Hopeful Hammer Making
ルーンバックラー,Rune Buckler
案内係エムロード,Guide Emerald
黒曜のカウンタ小,Obsidian Counter S
ラガのタリスマン,Raga's Talisman
しびれくらげ１４,Man o' War 14
念晶錬磨場・初級,Telecrystal Refinery - Beginner
知の試練・第３層,Wisdom Trials - Level 3
ザンクローネパン,Zankrone Bread
立ちはだかる慈雨,Rain Stands in the Way
遊び人のてぶくろ,Gadabout Gloves
レプティリアたち,Reptilias
手数を増やすコツ,Tips to Increase Moves
おばけのいしょう,Ghost Costume
壁かけ紋章旗・盾,Shield Wall Banner
アンノウンクロー,Unknown Claws
預かり所コライユ,Storage Koraiu
ジャイラジャイラ,Jyra Jyra
紹介人アラーニャ,Introducer Aranya
魔天導ビブローン,Bibron, Way of Evil
スライムベス提灯,She-Slime Paper Lantern
パンプキンヘッド,Pumpkin Head
ぶるーたきしーど,Blue Tuxedo
たれ黒猫カプセル,Lazy Black Cat Toy
ファータウィング,Fata Wings
ぷりんせすどれす,Princess Dress
オファニムのカギ,Ofanim's Key
ドラキーのぼうし,Dracky Hat
リカバースナック,Recover Snack
メタスラのタンス,Metal Slime Wardrobe
立派なレンガの壁,Fine Brick Wall
超錬金ツボ小の本,Super Alch Pot S Book
魔の試練・第２層,Demon Trials - Level 2
ゲッチュ君の写真,Your Getchu Photo
ミステリーカカオ,Mystery Cacao
春風応援バイザー,Spring Cheer Visor
ネオン・パターン,Neon Pattern
静かなる湿原地区,Quiet Marshlands
クラッシュロッド,Crusher Rod
カジノオルゴール,Casino Music Box
ブラッディヘッド,Bloody Horns
魔人王ドミネウス,Demonic Domineus
ダイナースカート,Diner Skirt
天使の資料カード,Angel's Reference Card
ベジセルクの奏演,Cucumberserk's Act
ガーネットダリア,Garnet Dahlia
グレイトマーマン,Merderer
セラフィの便せん,Seraphi Paper
案内係エリーシェ,Guide Elishe
ルビーのドレス上,Ruby's Dress Top
よろず屋ガーディ,General Shop Gadi
ギルガランのくつ,Gilgaran's Shoes
たいようのおどり,Sun Dance
キジ太猫カプセル,Fat Brown Cat Toy
悪霊の神々カード,Evil Trinity Card
参加受付クライブ,Receptionist Clive
オルフェア白色花,White Orphea Flowers
ネタ「究極呪文」,Ultimate Spell Trick
ソーサリーリング,Sorcerer's Ring
けんぽうぎセット,Tussler's Outfit
プクランサフラン,Pukuland Saffron
お祝いクラッカー,Celebration Popper
モーモンのゆかた,Teeny Sanguini Yukata
ソレイユバンドゥ,Sunflower Band
カラミティキング,Calamity King
レースの観客０９,Race Spectator 09
バグド王のパンツ,King Bagudo's Shorts
野いちごスカート,Wild Strawberry Skirt
ケセランパセラン,Tufty Tot
大王イカのズボン,King Squid Pants
預かり所ゾゼルグ,Storage Zozelgu
リルチェラソファ,Lilcherat Sofa
怨霊の憑いた戦士,Warrior With a Grudge
カミルのローブ下,Kamil's Robe Bottom
ベビタンキャップ,Imp Hood
お菓子のチェスト,Sweet Chest
はぐメタチケット,Liquid Metal Ticket
育成受付係ブレダ,Training Reception Breda
汚れたペンダント,Dirty Pendant
マカロンプリズム,Macaron Prism
マーブルステッキ,Marble Wand
エックス君の像３,Mr. X Statue 3
ごうかな本棚・赤,Red Fancy Bookshelf
グレイナル叙事詩,Epic of Greygnarl
笑う地獄の大公爵,Duke of Hell Laughing
マルグリットの娘,Margaret's Daughter
ダストントランプ,Duston Cards
ごうかな玉座・緑,Green Fancy Throne
クラシック風の壁,Classic Wall
スイカのテーブル,Watermelon Table
預かり所ラヴィア,Storage Lavia
預かり所ペコリア,Storage Pekoria
トラップジャマー,Trap Jammer
ドラキーの像・庭,Dracky Statue (G)
モーモンのぼうし,Teeny Sanguini Hat
花模様の光るラグ,Floral Glowing Rug
月のサークレット,Moon Circlet
ユシュカトランプ,Yushka Cards
ギュッとワンワン,Dog Arm Doll
デルクロアの研究,Delcroix's Research
女性金魚のゆかた,Women's Goldfish Yukata
プチデビル衣装券,Petit Devil Costume Tkt
出張購買員ポレロ,Team Vendor Agent Polero
デスマスの礼服下,Death Master Bottom
ギュッとウリボー,Wild Boar Arm Doll
悪霊の仮面の破片,Evil Spirit Mask Shard
ホークブリザード,Snowbird
ミラクルクッキー,Miracle Cookies
炎光の勾玉の破片,Firelight Jewel Shard
メタスラチャイム,Metal Slime Chime
ミサイルユニット,Missile Unit
レギオングローブ,Legion Gloves
よろこびの玉手箱,Joyful Jewelry Box
審判の天使リスト,Angel of Judgment Bands
よろず屋スワーニ,General Shop Swani
月のローブの秘密,Moon Robe's Secret
異国の寺院の牡丹,Exotic Temple Peonies
渡し守ナーウェイ,Ferryman Naawei
カルベロビュート,Wizardly Whip
パンプキンハット,Pumpkin Hat
ゴーストプリズム,Ghost Prism
ドラゴンの便せん,Dragon Paper
超おたからのタネ,Super Treasure Seed
奇門遁甲の式・弐,2nd Divination Ceremony
切る前の玉子焼き,Uncut Omelet
ヨンゲ所長のカギ,Director Yong's Key
家出したスープル,Runaway Slurple
シャコガイの大盾,Giant Clam Greatshield
美容師プラティナ,Hairdresser Platina
くじゃくのおうぎ,Peacock Fan
オーブなプチ香水,Orb Perfume S
ファラザード印章,Farazard Stamp
エテーネルリング,Ethenel Ring
みやびな飾り扇子,Elegant Decor Fan
スライムの石の柱,Slime Stone Pillar
レインボーファン,Rainbow Fan
ポーズ書・クール,Pose "Cool"
童話の街並みの柱,Fairy-Tale Pillar
壁かけ管理棟の窓,Admin Building Window
シスター・イグニ,Sister Iguni
ましょううおたち,Salamanglers
ヴェリナード領北,Verinard North
ベルトロトランプ,Bertro Cards
まじないしのくつ,Fizzle-Proof Shoes
ドラゴンウィング,Dragon Wing
防衛軍の制服・Ｙ,Defense Force Suit Y
ピカレスクブーツ,Picaresque Boots
フォステイルの像,Fostail Statue
アスフェルド光章,Asfeld Medal
学生のローファー,School Loafers
キリカ草原への道,Road to Kirika Steppe
哀愁のパン耳伝説,Sorrow Bread Legend
トーテムクラウン,Totem Crown
踊り子のスカート,Dancer Skirt
壱の式修了の陽符,Yang I Completion Charm
シスター・ロッカ,Sister Lokka
ホワイトホイップ,White Chocolate Whisp
ベホマズン像・庭,King Cureslime St. (G)
郵便局員ピティカ,Postman Pitica
神都のオルゴール,Fourion Music Box
ブルーファルコン,Blue Falcon
フォレストドラゴ,Lumbering Lizard
バルザックゾンビ,Zombie Baalzack
盆踊りフウラ・庭,Festival Dance Fuura(G)
ダーマの神の清泉,Alltrades Spring
ファラオ・ナジャ,Pharaoh Naja
しゃっきりレタス,Luscious Lettuce
アークデーモンＢ,Archdemon B
勇者姫のウィッグ,Hero Princess Wig
ダークプラネット,Dark Planet
とうぞくぼんがす,Thief Bongas
マザー・ヨハンナ,Mother Johanna
聖天舎のテーブル,Monastery Table
魔物商人デイラー,Monster Merchant Dailer
プラチナメイル上,Platinum Mail Top
４色ポップコーン,Four-Color Popcorn
紋入りのレンガ壁,Crested Brick Wall
まよえるかみのれ,Lost Caminole
検証用家具１０２,Verification Decor 102
