まるこもんせっと,Circle Pattern Set
静かなる湿原地区,Quiet Marshlands
帝国三将軍練習札,Triumgorate Tag
フカき封じの水底,Ocean Floor
寒鬼団長アレル樹,Cold Demon Tree Alleru
ハロふわモーモン,Halloween T. Sanguini
時の妖精カプセル,Time Fairy Toy
ツインアンテナＡ,Twin Antenna A
カメさまカプセル,Galapagod Toy
スピードアップ床,Speed Up Floor
ぐろりあすすーつ,Glorious Suit
ケイオスブレード,Berserker's Blade
景品交換所コルナ,Prize Exchange Koruna
ミラクルブースト,Hurt Converter
王宮の食器棚・青,Blue Royal Cupboard
オジャロスの部屋,Ojalos's Room
異界アスタルジア,Astalgia
シャークサンダル,Shark Sandals
ピナヘトのおふだ,Pinahett's Amulet
タンポラゴラの像,Dandeligora Statue
語り継がれる真実,The Untold Truth
ふわふわ雲の本棚,Fluffy Cloud Bookshelf
マリン調のベッド,Marine Bed
みやびな飾り扇子,Elegant Decor Fan
飛行士のキャップ,Aviator's Cap
ガーデンシャワー,Garden Shower
大いなる闇の深淵,Abyss of the Great Darkness
ゾーマ　ソウリョ,Zoma, Priest
お姫様ベッド・桃,Pink Princess Bed
神墟ナドラグラム,Nadragram Shrine
リボンスターの服,Star Ribbon Outfit
サーチャーギフト,Searcher Gift
ミラクルチケット,Miracle Ticket
桜花のドレッサー,Cherry Blossom Vanity
ジャックの衣装２,Jack's Costume 2
いっぱつのよろい,One Shot Armor
女神ルティアナ像,Lutiana Statue
りゅうおうワンド,True Dragonlord Staff
えきいんしーどる,Attendant Shidoru
ベコン渓谷への道,Road to Becon Valley
ピクニックラウル,Rahul Picnic
バルディスタ要塞,Fortress Valdista
レース屋シャイラ,Race Registrar Shyla
アメジストの衝撃,A Smash of Purple
星型ランタンの木,Star Lantern Tree
名探偵のコート上,Sleuth's Coat Top
ステューデントＧ,Student G
カイザーアックス,Kaiser Axe
チャンスコマンド,Chance command
ローゼンニードル,Rosen Needle
ホイミントバンド,Heal Mint Headband
超錬金ツボ小の本,Super Pot S Book
神都のオルゴール,Fourion Music Box
お祝いシャワー虹,Celebration (Rainbow)
ナナホシのおうぎ,Seven Star Fan
飛竜のベストの書,Flying Dragon Book
夜宴館プレミアム,Premium Banquet Hall
武刃将軍のゆびわ,Warrior General Ring
ふわふわサンダル,Fluffy Sandals
大キジ猫カプセル,Big Brown Cat Toy
聖守護者のタクト,Sentinel's Baton
第１２回リソル像,12th Resol Statue
開祖の道着セット,Founder's Outfit
魔瘴魂オジャロス,Miasma Soul Ojalos
アンノウンスピア,Unknown Spear
クマチャンミトン,Beary Cute Mittens
よろず屋リューロ,General Shop Ryuro
三毛猫のグローブ,Calico Cat Gloves
ハートの本棚・黄,Yellow Heart Bookshelf
ピョンスロット卿,Sir Pyoncelot
カジュアルドレス,Casual Dress
てくてくスライム,Slime Knight
ネタ「メタキン」,Metal King Trick
ブルークリスタル,Blue Crystal
砂丘のカーペット,Sand Dune Carpet
ファータグローブ,Fata Gloves
ロイヤルミミック,Royal Mimic
めいふのばんにん,Hellbound Heretic
ルベランブレード,Ruberan Blade
タイタス号の積荷,Titus Cargo
ラグジュアルリム,Luxury Rim
マイレージメダル,Mileage Medal
ハイパーマカロン,Hyper Macaron
わだつみのしずく,Abyss Droplets
メガトンハンマー,Megaton Hammer
トコトコリゼルコ,Trotting Lieseluco
からあげパクパク,Eat Fried Chicken
ギュッとクラウン,Crown Arm Doll
攻城隊長ガンザン,Siege Captain Ganzan
トキワアカネの花,Red Ibis Flowers
ベルトロの部下Ａ,Bertro Subordinate A
キリングエナジー,Killing Energy
ウェディのズボン,Weddie Trousers
うろこのよろい下,Scale Leggings
ポイズンリザード,Killer Gila
ハヤブサ観察日記,Falcon Watcher's Diary
商品ナンバー１３,Item Number 13
たたきモグラの像,Mashing Mole Statue
カンフーシューズ,Kung Fu Shoes
シスター・アシラ,Sister Ashira
Ⅱ‐ディアノーグ,Ⅱ‐Diamagon
トポルのパラソル,Topol Umbrella
サイドヘアリボン,Side Hair Ribbons
黒夜叉のよろい上,Black Bane Armor
ダッフルグローブ,Duffel Gloves
ドルマ★レッスン,A Lesson in Zam
ユシュカトランプ,Yushka Cards
プクランサフラン,Pukuland Saffron
酒場主人のピアス,Tavernkeeper's Earrings
とこしえの語り部,Storyteller of Eternity
封鎖された研究室,Sealed Laboratory
原始獣のコート下,Primal Beast Leggings
預かり所イウマド,Storage Iwmad
白いレースの日傘,White Lace Umbrella
ロトのオルゴール,Erdrick Music Box
オパールの食器棚,Opal Cupboard
武勲の城の庭園灯,Valor Castle Light (G)
キラキラモーモン,Glittering T. Sanguini
もぐらのスコップ,Mischievous Mole Shovel
バルディスタ槍兵,Valdista Spearman
太陽の斧を求めて,Seeking Apollo's Axe
ようがんのカケラ,Lava Lump
知の試練・第２層,Wisdom Trials - L2
ほしくずのピアス,Stardust Earrings
妖精の隠れ家の塀,Fairy Lair Fence
紹介人ブルーレス,Introducer Blueleth
深遠なるぱふぱふ,Profound Puff-puff
スマートチェスト,Smart Chest
超暴走魔法陣・零,Uber Ring of Ruin
ラッカラン住宅村,Luckland Residences
アサガオのアーチ,Morning Glory Arch
オノ特技の範囲+2m,Axe Skill Range +2m
種族神像ウェディ,Weddie Tribal Statue
預かり所キャビネ,Storage Cabinay
ウサぐるみ衣装券,Rabbit Costume Ticket
黒夜叉のよろい下,Black Bane Legs
ナスビの本棚・白,Pale Eggplant Bookshelf
学園男子の海パン,Schoolboy Trunks
蒼天のソウラの絵,Soura Painting
シーサイドハウス,Seaside House
ファイアブレイク,Fire Break
反乱軍メンバー１,Rebel Army Member 1
実行委員リーベル,Executive Committee Ribel
レースの観客２１,Race Spectator 21
猫パンチ（右手）,Cat Punch (Right Hand)
大魔王候補者たち,Demon Lord Candidates
東洋風ランプ・雅,Chic Orient Hung Lamp
時の化身クルッチ,Ickle the Tockle
魚交換員パッピイ,Fish Exchange Pappi
マイスターハット,Meister Hat
モンシロウィング,White Butterfly Wings
ドラゴングローブ,Dragon Gloves
アルゴングレート,Great Argon Lizard
臨時大使カヤカリ,Temp Ambassador Kayakari
マスター・リリム,Guildmaster Lilim
ブルーナポレオン,Humphead Wrasse
トコトコロボ椅子,Trotting Robot Chair
バンデッドボトム,Brigand's Bottom
水神ギルギッシュ,Water God Gilgish
まどうしのぼうし,Wizard's Hat
がうがうグローブ,Bow-Wow Gloves
水晶のテーブル小,Crystal Table S
魔女の長日傘・青,Blue Witch Day Umbrella
ブリガンオーダー,Brigan Order
レジェンズロッド,Legends Rod
武器屋バーニジア,Weapon Shop Banijia
我らは自然と共に,We Are With Nature
魔神ジュリアンテ,Devil Juliante
氷と釣りのワルツ,Of Ice and Fishing
聖騎士のよろい上,Holy Knight Armor
リトライストーン,Retry Stone
黒もふ猫カプセル,Soft Black Cat Toy
不器用な魔法使い,The Incompetent Mage
エネルギー体・大,Large Energy Body
まじんのかなづち,Hela's Hammer
究明者のコート下,Research Coat Bottom
アインスリッター,Eins Ritter
エネルギー誘導球,Energy Guide Sphere
はじまりの地の木,Land of Beginnings Tree
げきりんのさとり,Inverse Insight
ビントンの陳情書,Vinton's Petition
紅葉のドレッサー,Autumn Leaf Vanity
たいようのおうぎ,Solar Fan
梅柄の長ざぶとん,Plum Blossom Floormat L
アンルシアソファ,Anlucia Sofa
レースの観客０４,Race Spectator 04
インテリのうでわ,Brainy Bracer
おみくじボックス,Fortune Box
住宅素材屋コイズ,Housing Materials Koizu
大地の箱舟　３幕,Ark of the Earth Act 3
赤キノコ栽培日記,Mushroom Diary
素材屋のぼうし紅,Red Material Shop Cap
陰の試練壱・陰霊,Yin Trial I - Yin Spirit
ふたりの近親憎悪,Their Kinship and Hatred
聖女に守られし盾,Saint Protected Shield
スチームバスタブ,Steam Bathtub
リィンのグローブ,Lynn's Gloves
双月のスティック,Double Moon Wand
ラガのタリスマン,Raga's Talisman
住宅素材屋ハクヒ,Housing Materials Hakuhi
破壊と創造の神々,The Creator and the Destroyer
イエローファット,Grand Yellow Belly
エビルキュビズム,Evil Cubism
はじめてのオフ会,A Face to Face First
サジェぬいぐるみ,Sajay Plushie
３０分キャンドル,30 Minute Candle
武器防具屋ソロリ,Weapon & Armor Shop Sorori
行動時 5%でスカラ,Buff On Action 5%
悪魔王の同族狩り,Hunting Devil's Family
ゼドラ集落の高台,Zedra Village Upper Area
ふわふわコウリン,Floaty Kourin
プチ幻界の四諸侯,Frail Dread Fiends
ドワーフ作業くつ,Dwarf Work Sandals
しょうかんスキル,Summoning skill
ファータドレス下,Fata Dress Bottom
郵便局員リアンナ,Postman Lianna
ジャングルの花束,Jungle Bouquet
パティシエの服下,Pastry Chef Bottom
ＣＭ用ウェディ１,Weddie For CM 1
模様入り木板の柱,Patterned Wood Pillar
ポセイドンランプ,Poseidon Lamp
踊り子のティアラ,Dancer Tiara
忘我のシシカバブ,Forgetful Shish Kebab
尖塔の守護鬼たち,Keeper of the Spire
カンダタの像・庭,Robbin' 'Ood Statue (G)
大魔王のグローブ,Demon Lord's Gloves
アリアハンブーツ,Aliahan Boots
壁かけ武器セット,Weapon Wall Set
ふわふわタツノコ,Floaty Seahorse
第３回フウラの像,3rd Fuura Statue
旅人の優雅な日常,Graceful Traveler Life
メタスラのタンス,Metal Slime Wardrobe
預かり所ティルダ,Storage Tilda
グランゼドーラ領,Gran Zedora Territory
トライバルトップ,Tribal Top
小さな英雄の肖像,Little Hero Portrait
クロブタカプセル,Black Pig Toy
オーガの人形・男,Ogre Doll (M)
ファータドレス上,Fata Dress Top
合唱隊のスモック,Choir Smock
しっくごすせっと,Chic Goth Outfit
ストリートベスト,Street Vest
ブチブタカプセル,Spotted Pig Toy
おおくちばし・強,Vicious Beakon
クルッチカプセル,Ickle Toy
シスター・ウナス,Sister Unasu
きら星のドレス上,Twinkling Dress
ソーシャルレンズ,Social Lens
フォースブレード,Force Blade
トモガラのお願い,Tomogara's Request
丸小紋のはかま下,Circle Hakama Bottom
ドラゴン花火・青,Blue Dragon Firework
カンフーキャップ,Kung Fu Cap
聖守護者のおうぎ,Sentinel's Fan
シャインステッキ,Shine Stick
実行委員エルスカ,Executive Committee Elska
壁かけ紋章旗・剣,Sword Wall Banner
壁かけ桜の飾り棚,Cherry Blossom Shelf
流れ着いた愛の詩,Drifted Away Love Poem
歌詠みのころも上,Poet's Attire Top
ギャルいミュール,Stellar Shoes
プラークラベーン,Giant Stingray
ローズフォーム下,Rose Form Bottom
しょうにんでんな,Merchant Denna
スラタワー便せん,Slime Stack Paper
DQ3賢者男　ゾーマ,DQ3 Sage (M), Zoma
霊剣セレンナイト,Sword of Selenite
モーモンゆず風呂,T. Sanguini Yuza Bath
レースの観客２５,Race Spectator 25
セレニティワンド,Staff of Serenity
ガチャコッコ・祖,Ancestor Clockwork Cuckoo
ハクオウトランプ,Hakuo Cards
ハッスル系範囲+5m,Hustle-type Range +5m
魔塔紹介人パイク,Tower Introducer Pike
特急メタル招待券,Express Metal Ticket
バラレースはかま,Rose Lace Hakama
アヌビスのアンク,Anubis' Ankh
預かり所カーリィ,Storage Karry
闇の領界のアーチ,Dark Realm Arch
記憶のパドレア邸,Memory of Padrea Mansion
アスバルパラソル,Asbal Umbrella
びようしいちじく,Hairdresser Ichijiku
ほっとヘッドホン,Soft Headphones
エルボブ像グレー,Gray Eltona Bobtail St.
風車塔のほほえみ,Windmill Tower's Smile
ダマスク模様の壁,Damask Pattern Wall
ガートラント城駅,Gartlant Castle Station
邪神バルサミコス,Dark Deity Balsamicos
あるある川柳・銀,Haiku Silver
おたからの花びら,Iridescent Petal
夢の王国グローブ,Dream Kingdom Gloves
シグナルウィング,Wing Signal
しぐさ書・うちわ,Emote "Fan"
よろず屋ヒャッカ,General Shop Hyakka
スターダムハット,Stardom Hat
ふわふわエンゼル,Floaty Angel Slime
魔物管理人メリュ,Monster Manager Meryu
パンプキンハット,Pumpkin Hat
防衛軍の制服・緑,Green Defense Force Suit
カンフースーツ下,Kung Fu Suit Bottom
果ての泉の孔雀姫,The Peacock Princess
ステューデントＲ,Student R
レクタリスの光輪,Lectalis' Halo
トポルのロウソク,Topol Candles
リッシュウの手紙,Rishu's Letter
過去からの訪問者,Visitors From the Past
グレイナル叙事詩,Epic of Greygnarl
取引商アルトゥナ,Trader Altuna
ミラクルスライム,Miracle Slime
シスターペコリア,Sister Pekoria
タロットテーブル,Tarot Table
クローバーのカギ,Clover Key
ギュッとソーミャ,Somya Arm Doll
バルディスタ印章,Valdista Stamps
エルフの人形・男,Elf Doll (M)
ベビーマジシャン,Blinkster
魔塔銀行屋ボクス,Tower Banker Bokks
よろこびの玉手箱,Joyful Jewelry Box
パッションパレオ,Passion Pareo
知の試練・第３層,Wisdom Trials - L3
ハイキングパンツ,Hiking Pants
マスカットリップ,Muscat Tulip
暴君の広場の階下,Tyrant Square Lower Floor
限定交換屋ポタン,Limited Exchange Shop Potan
エドアルドの部屋,Eduardo's Room
終幕の踊り子伝説,Dancer's End Act Legend
仮面バスター仮面,Maskmaster Mask
ニコニコな大冒険,Adventure With a Smile
カミハルムイの柵,Kamiharmui Fence
プクラスの研究室,Pukulas' Laboratory
マスターグレイト,Master Dragon
神光放つ大剣の書,Holy Light Blade Book
白鳥の弓の作り方,How to Make a Swan Bow
ルファ神殿への道,Road to Rufa Temple
参の式修了の陽符,Yang III Completion Charm
アリエススタッフ,Aries Staff
執行者ジブアジブ,Enforcer Jib-ajib
防衛軍の制服・Ｚ,Defense Force Suit Z
ガネーシャエビル,Evil Ganesh
猛火竜のウィング,Fire Dragon Wings
クリスタルゲージ,Crystal Gauge
トロルバッコス強,Apex Gladiator Troll
しぐさ書・土下座,Emote "Grovel"
神授の判定者たち,Judges of Divine Gifts
ドラゴンライダー,Dragon Rider
聖王の大盾の壁画,Dryspell Grtshd Book
ゲルト海峡への道,Road to Gert Strait
ティプローネ高地,Tiplone Highlands
水晶の壁掛け時計,Crystal Wall Clock
ナイフフィッシュ,Knifefish
パピヨンクラウン,Papillon Crown
アンドレアルの像,Rashaverak Statue
ピクニックチョメ,Clawde Picnic
しびれくらげ１３,Man o' War 13
邪眼の盾の作成術,Make an Evil-Eye Shield
小鳥のガゼボ・白,White Small Bird Gazebo
闇騎士のグリーブ,Dark Knight Greaves
釣り用ダミー宝箱,Fishing Treasure Chest
リンベリィのくつ,Linberry's Shoes
ポイポイ商会倉庫,Poi Poi Company Storage
グローリーココア,Glory Cocoa
黄昏の霊堂への扉,Door to Mausoleum of Dusk
ワグミカのソファ,Wagmika's Sofa
ドラゴンバスター,Wyrmfang
ごきげんなぼうし,Happy Hat
ドワーフ風アーチ,Dwarf-Style Arch
審判の天使のくつ,Angel of Judgment Shoes
キケンな取り引き,Risky Business
世界樹のよろい上,Yggdrasil Armor Top
ギュッとエステラ,Estella Arm Doll
マーチングコート,Marching Coat
朽ちた遺跡の寝台,Ruin Bed
魚交換員ピペッタ,Fish Exchange Pipetta
ウルベアの自販機,Urbea Vending Machine
アンテイクの世界,Antique World
むげんの弓の物語,Purblind Bow Story
ギーグハンマー強,Apex Giga Clubber
第３回リーネの像,3rd Renee Statue
ビリジアンの花束,Viridian Bouquet
黒いレースの日傘,Black Lace Umbrella
ウィキッドブレス,Wicked Braclets
魔元帥ゼルドラド,Marshal Zeldrad
魔塔研究家マディ,Tower Researcher Maddy
あるある川柳・銅,Haiku Bronze
棺桶クローゼット,Coffin Closet
カエルパーカー上,Frog Hoodie
執行獣ガンガブラ,Beastly Gangabra
はがねのよろい上,Steel Armor Top
モグふわベビタン,Fluffy Chef Imp
記憶の帝国技術庁,Memory of Empire Tech Agency
丁目採掘現場地区,Block Mining Site
プチデビルハット,Petit Devil Hat
ごうかなイス・緑,Green Fancy Chair
シスター・トニア,Sister Tonia
海底都市ルシュカ,Undersea City Ruska
らいだーすすーつ,Riders Suit
おすもっこりの像,Sumo Baby Statue
オーラチャーム青,Blue Aura Charm
ムーディーベッド,Moody Bed
魔改造クリムゾン,Modified Crimson
魔天士ダンタール,Sky Sorcerer Dantal
源世果フルポティ,Frooty Dracky
預かり所トッゴイ,Storage Togoi
国王コウリンの馬,King Kourin's Horse
シンイのこころ１,Shini's Heart Lv1
シャークウェア上,Upper Sharkwear
ブラックチャック,Dark Brownie
プチヒドラカード,Frail Hydra Card
マーブルステッキ,Marble Wand
ドール書・いのる,Doll Book "Pray"
釣り鐘守りの日記,Bell Keeper's Diary
壁かけ羽子板飾り,Hagoita Wall Decor
ファンシーチョコ,Fancy Chocolate
夏の渚の麦わら帽,Summer Beach Straw Hat
フォースシールド,Force Shield
新兵支給むねあて,Recruit Breastplate
ピクニックアサヒ,Asahi Picnic
キツネ猫カプセル,Fox Cat Toy
魔物管理人テナナ,Monster Manager Tenana
プチバズズカード,Frail Pazuzu Card
ランプ錬金職人帽,Lamp Alchemist's Hat
紫水晶のオーブン,Amethyst Oven
ネブラ用とうめい,Transparent for Nebula
子供の家ペコリア,Child House Pekoria
プレゼントリスト,Present List
天女のかみかざり,Celestial Maiden Ribbon
フットライト・庭,Footlight (G)
ツインクルタクト,Twinkle Little Staff
ポセイドンチェア,Poseidon Chair
金平糖ライト・桃,Pink Candy Light
氷の領界の丸イス,Ice Realm Round Chair
ゴマフビウミウシ,Sea Bunny
黄金のあらくれ像,Golden Toughie Statue
ドラムクラッシュ,Monster Masher
パピリオボトムス,Papilio Bottoms
アマリリスの笑顔,Amaryllis' Smile
にじいろの色鉛筆,Rainbow Colored Pencil
もうどくバルーン,Deadly Poison Balloon
時の王者のブーツ,Time Sovereign's Boots
帽子係アンジュー,Hat Clerk Anju
調理職人コック帽,Cook's Hat
クリスタルエッジ,Crystal Edge
バッジ交換券・虹,Rainbow Badge Ticket
星空のベッド・紫,Purple Starry Bed
グレートグリーブ,Great Greaves
トランプグローブ,Tycoon Gloves
クラシカルハット,Classical Hat
デスマスの礼服上,Death Master Shirt
打ち上げ花火・赤,Red Firework
パティシエの帽子,Pastry Chef Hat
未完のご神体の間,Undone Hall of Worship
ボーンのこんぼう,Zombie Gladiator Club
神殿レイダメテス,Reidametes Temple
ホーリーカロット,Holy Headwear
聖王のツメの壁画,Dryspell Claw Book
討伐隊員リャード,Strike Force Ryard
レース刺繍の日傘,Embroidered Umbrella
ヘヴィーグローブ,Heavy Gloves
バズカフェのラグ,Pazu Cafe Rug
ラキポルテソファ,Lycae & Porte Sofa
大型の丸い水そう,Round Aquarium L
ハイパーチケット,Hyper Ticket
便せん屋メビシェ,Stationery Shop Mebishe
郵便局員カンココ,Postman Kancoco
封印の守護者・左,Seal Guardian - Left
魔天鋼バルバトン,Balbaton, Steel of Evil
シールドブレイク,Shattershield
暴走したコウリン,Berserk Kourin
ひっさつのおうぎ,Critical Fan
ミイラ男の衣装３,Mummy Boy Costume 3
ドラムセット・庭,Drum Set (G)
レースの観客３２,Race Spectator 32
シスター・ララニ,Sister Rarani
ミニュアデスの盾,Minyades Shield
ネコ姫のスツール,Cat Princess Stool
つりしのいしょう,Angler's Costume
ストリートパンツ,Street Pants
ミステリーチョコ,Mystery Chocolate
あやしい大木の柱,Suspicious Tree Pillar
ペロリンステッキ,Lolly Stick
黒曜のカーペット,Obsidian Carpet
スライムのタンス,Slime Wardrobe
お宝の写真ケース,Treasure Photo Case
アンノウンダーク,Unknown Dirk
師団長のよろい上,Commander Armor
はしゃのオノの書,Conqueror's Axe Book
まほうの盾の秘密,Magic Shield Secret
しぐさ書・ねる３,Emote "Sleep 3"
バスルームの手桶,Bathroom Hand Bucket
聖天舎のテーブル,Monastery Table
レースの観客１６,Race Spectator 16
お菓子のオーブン,Sweet Oven
超パーティー仮面,Super Party Mask
ファラオ・ヘッド,Pharaoh's Head
魔の試練・第３層,Demon Trials - L3
オルストフの尻尾,Orstov's Tail
妖炎魔女の髪飾り,Fire Witch Hairpin
ピクニックグリエ,Grei Picnic
ミランのスケッチ,Milan's Sketch
せんすいふくあお,Blue Diving Suit
魔導将軍のゆびわ,Mage General Ring
強襲隊長シシオウ,Assault Captain Shishiou
マジンガ先生たち,Master Machines
死せる結晶の荒野,Dead Crystal Desert
Ｓキラーブレード,Trauminator Blade
てれぱすたいつⅠ,Telepath Tights Ⅰ
ウィッチシューズ,Witch's Shoes
ピクニックパドレ,Padre Picnic
手編みのセーター,Hand-Knit Sweater
ロリータキャップ,Lolita Cap
出張購買員パタタ,Team Vendor Agent Patata
ウィリーデクロー,Vilide Claws
家具＆庭具おきば,furniture storage
オセアノスの祈り,Full Fathom Prayer
マジカルスーツ上,Magical Suit Top
金のフェルマーク,Gold Fel Mark
エステラカプセル,Estella Toy
赤宝箱のチェスト,Red Treasure Chest
アビスセーラー下,Abyss Bottoms
まもの使いずきん,Monster Master Hood
知の試練・第１層,Wisdom Trials - L1
タイフーンブーツ,Typhoon Boots
荒波サーフパンツ,Rough Sea Surf Shorts
サフランローブ上,Saffron Robe Top
住宅素材屋ナナイ,Housing Materials Nanai
ブラックドラゴン,Black Dragon
パタプラのうきわ,Patapula's Floatie
レースの観客０１,Race Spectator 01
マカイ・マカロン,Demon Delights
王家のナイフ全集,Nobleman's Knife Set
くさりかたびら下,Chain Mail Bottom
グリゴリふれんず,Watcher Friends
謎の夢幻郷の写真,Mystery Dream City Photo
しびれくらげ０４,Man o' War 04
ファラザード兵Ｂ,Farazard Soldier B
１０分キャンドル,10 Minute Candle
クローバーハット,Clover Hat
飛竜の巣のベッド,Flying Dragon Nest Bed
魔想念ローガスト,Remnant of Logast
パピヨンドレス下,Papillon Dress Bottom
サウザンドダガー,Deft Dagger
賢者セレディーネ,Sage Celedine
機工博士の方程式,Engineer's Formula
若き彫刻家の才能,Young Sculptor's Talent
ムーディーライト,Moody Light
シーサイドタンス,Seaside Wardrobe
緑宝箱のチェスト,Green Treasure Chest
緑キノコのベッド,Green Mushroom Bed
悪神ラダ・ガート,Fiend Lada Gart
ダーマの神の清泉,Alltrades Spring
ゼネシアのころも,Zenethia's Garments
氷の魔王のブーツ,Ice Demon Boots
黄昏の詩人の舞台,Twilight Poet's Stage
天地雷鳴士のくつ,Druid Shoes
不滅の闘士のオノ,Axe of the Immortal
月のローブセット,Moon Outfit
ゴスバニーブーツ,Goth Bunny Boots
魚交換員ビンチュ,Fish Exchange Bincho
クリムゾンヘルム,Crimson Helm
バブリン印の丸薬,Zepling Marked Pill
景品交換所シリン,Prize Exchange Shirin
預かり所パリュス,Storage Paruse
エビルソーサラー,Evil Sorcerer
ミラクルボックス,Miracle Box
行動時10%魔力覚醒,Channel Anger Action 10%
便せん屋タマズサ,Stationery Shop Tamazusa
白亜の博物館の壁,Chalk Museum Wall
メカニックフード,Mechanic Hood
ラピスぬいぐるみ,Lapis Plushie
獄炎鬼アグニース,Firekeeper Agnis
キャプテンの部屋,Captain's Room
案内係ピューリィ,Guide Pury
パラディンの伝説,Legend of Paladin
ネヴァングリーブ,Nemain Greaves
ほくほく肉じゃが,Meat & Potatoes
ジュースの自販機,Juice Vending Machine
カラス神楽の羽根,Crow Dance Feathers
ピンクタイフーン,Pink Typhoon
便せん屋ライジー,Stationery Shop Raiji
とこなつバングル,Summer Bangles
奇跡のフライパン,Miracle Frypan
剥きかけりんご左,Left Peeled Apple
便せんは芸術だ！,Paper is an Art
初期ドワーフ女性,Initial Dwarf Female
クモさんお掃除棒,Spider Sweeping Stick
おうち用星空天井,Starry Sky Ceiling
あるへいしちょう,Soldier To Be
商人たちのテント,Merchants' Tents
男ならメガもり丼,Mega Rice Bowl Recipe
ヘルシーワッフル,Healthy Waffles
武神の道着セット,War God Outfit
漂流者キュレクス,Castaway Kyurex
ゴージャスココア,Gorgeous Cocoa
招かれざる者たち,The Uninvited
灼熱サーフパンツ,Scorching Surf Shorts
防衛軍の制服・Ｙ,Defense Force Suit Y
ムーディータンス,Moody Wardrobe
まよえるせしりお,Lost Cecilio
スマッシュポテト,Mashed Potatoes
氷のシャンデリア,Ice Chandelier
ソードブレイカー,Sword Breaker
銀のさいほう針小,Silver Needle S
プチグレネーどり,Frail Bombird
道具鍛冶ターバン,Toolsmith's Turban
ダーマ神殿のラグ,Alltrades Abbey Rug
森の井戸の地下洞,Underground Forest Well
レジェンズケース,Legends Case
ダイヤココナッツ,Diamond Coconut
おもちゃのテント,Toy Tent
バンデッドブーツ,Brigand's Boots
グレイトマーマン,Merderer
花婿のタキシード,Groom's Tuxedo
航海冒険かきわり,Voyage Backdrop
