ドラグーンアックス,Dragoon Axe
キューキョクＶロン,Ultimate Vron
桃果のフランベリー,Pink Flanberry
ミストグレーの花束,Mist Gray Bouquet
吊るし潜水艦ライト,Submarine Hanging Light
炎うず巻く聖なる鳥,Fiery Holy Bird
謎の飛行物体の写真,Mystery UFO Photo
吼えろ　トビアス！,Howl, Tobias!
ホワイトキュロット,White Culottes
バズカフェの飾り棚,Pazu Cafe Shelf
ウィリーデブレード,Vilide Blade
ルナナのぬいぐるみ,Lunana Plushie
しぐさ書・とまどう,Emote "Bewildered"
オブジェクト座標062,Object Coordinates 062
天の川モビール・白,White Milky Way Mobile
さすらいのコート上,Errant Coat Top
ひつじ雲をかぞえて,Counting Sheep Clouds
レンタルドルボード,Rental Dolboard
オブジェクト座標265,Object Coordinates 265
銀のフェザーチップ,Silver Feather Chip
護門将ゴウシルシャ,Protector General Goshylsa
ホーリージャミラス,Divine Jamirus
白蛇のこんの作り方,Make a White Snake Rod
ごきげんクローバー,Cheery Clover
オブジェクト座標261,Object Coordinates 261
オブジェクト座標270,Object Coordinates 270
漆黒の匪賊ギャレス,Black Bandit, Gareth
しゅうれん用バンド,Training Hairband
バトエンをかかげる,Raise Battle Pencil
オブジェクト座標043,Object Coordinates 043
ストームグラス・庭,Storm Glass (G)
だいまどうローブ下,Great Mage Lower Robe
金のチキ坊カプセル,Golden Chickibo Toy
マグノリアの花飾り,Magnolia Hair Decor
ガタラアームズの旗,Gatara Arms Banner
りょうりにんすぷる,Chef Sprue
スチーム食器棚・赤,Red Steam Cupboard
スタンドマイク・庭,Microphone Stand (G)
うるわしの浜辺地区,Beautiful Beach
古代魔術のながぐつ,Ancient Magic Boots
プラコンゴーレム服,Golem Costume
クールスターブーツ,Cool Star Boots
ピクニックワグミカ,Wagmika Picnic
マデュライトの延板,Darkonium Plate
マスター・ポーリア,Guildmaster Paulia
オブジェクト座標094,Object Coordinates 094
蚊帳つきフトン・黄,Yellow Futon with Net
壁かけフウラ肖像画,Fuura Portrait
カジノ祭５ビンゴ銅,CasinoFest 5 Bingo Brnz
土地管理人リステア,Land Manager Listeah
白バラのドレッサー,White Rose Vanity
騒演王ベイオウルフ,Chaotic King Beowulf
王太后の部屋のカギ,Queen's Room Key
魔神のムチのレシピ,Beelzebarb Recipe
シスター・サレーマ,Sister Salema
レーナム緑野の木Ａ,Lenam Fields Tree A
ラダトームのかぶと,Tantegel Helmet
小さな英雄のブーツ,Little Hero's Boots
ドラグーングリーブ,Dragoon Greaves
王都カミハルムイ北,Kamiharmui City North
パンプキングローブ,Pumpkin Gloves
真紅のダイヤモンド,Crimson Diamond
機工博士のコート下,Engineer's Lower Coat
労働魔神機０３８号,Aztech Labor Mech No. 038
カテドラル式加工法,Cathedral Style Process
オブジェクト座標057,Object Coordinates 057
道に迷いました……,I got lost...
お庭用グリッドラグ,Grid Rug (G)
良薬はキケンな香り,Good Medicine Smells Bad
パピヨンチェア・夢,Dream Papillon Chair
輝けるつるぎの伝説,Shining Sword Legend
オブジェクト座標141,Object Coordinates 141
ごうかな花びん・緑,Green Fancy Vase
星花火モビール・庭,Star Fworks Mobile (G)
オブジェクト座標157,Object Coordinates 157
たんすミミックの書,Wardrobe Mimic Book
閃輝晶獣ビルビギス,Crystalfiend Bilbigis
しぐさ書・お祝い緑,Emote "Celebrate Green"
マタドールスーツ下,Matador Suit Bottom
荒城の宝物殿への道,Path to Palace Treasury
プラコンぐるみ・黒,Black Clothing
ユシュカのこころ６,Yushka's Heart Lv6
宝珠のプチプチ香水,Jewel Perfume XS
風鈴のシャンデリア,Wind Chime Chandelier
謎の幽霊列車の写真,Mystery Ghost Train Photo
ポイズントリル・強,Vicious Poison Trill
闇の領界の有毒植物,Dark Realm Toxic Plant
ごうかなタンス・緑,Green Fancy Wardrobe
しぐさ書・スマイル,Emote "Best Smile"
ナチュラルチェスト,Natural Chest
古代オルセコの灯火,Old Orseco Light
ドラゴンゾンビの像,Dragon Zombie Statue
ユシュカのこころ５,Yushka's Heart Lv5
オルッパ地下洞くつ,Orppa Underground Caves
しぐさ書・からあげ,Emote "Fried Chicken"
メリクリギフト・赤,Red Christmas Gift
オブジェクト座標244,Object Coordinates 244
黄金のみたらし団子,Golden Mitarashi Dango
コマンダーコート上,Commander Coat Top
ベルヴァインの森東,Belvain Forest East
武爪遊戯・断罪の章,Judgement Katar Book
超天遊戯－壱の書－,Chosen's Teachings Book 1
第１回釣りコン・金,1st Fish Contest Gold
オス三毛猫スーツⅡ,Calico Cat Suit (M) Ⅱ
キャット・バルバド,Purrseidon
ネオン・縦メーター,Neon Vertical Meter
喪心獣ゾンテドール,Mourning Beast Zontedor
銀のさいほう針の本,Silver Needle Book
暴君バサグランデ強,Apex Tyrant Bogan
ディバインステッキ,Divine Stick
オブジェクト座標088,Object Coordinates 088
学園女子のジャージ,Schoolgirl Jersey
ウェディの人形・女,Weddie Doll (F)
オブジェクト座標285,Object Coordinates 285
どうぐ発動速度短縮,Faster Item Usage
うさみみギフト・桃,Pink Rabbit Ears Gift
暁天竜ランビリズマ,Lanbelysma, Dragon of Dawn
オブジェクト座標266,Object Coordinates 266
旅芸人ピュージュＩ,Minstrel Pyuju I
エトワールコート下,Etoile Coat Bottom
暗黒の魔人強メダル,Apex Ruin Medal
オブジェクト座標215,Object Coordinates 215
レーンの村の丸イス,Rane Village Stool
スライムのチェスト,Slime Chest
王宮の間仕切り・赤,Red Royal Partition
ローズグレーダリア,Rose Gray Dahlia
クロッシュシューズ,Bell Shoes
異国の寺院の庭用床,Exotic Temple Floor (G)
魔物管理人スーディ,Monster Manager Sudy
ブランドンビースト,Brandon's Beast
どこでもクラッカー,Anywhere Cracker
ゼドラ王国服モブ２,Zedra Royal Clothes Mob 2
ビクトリーチップ祭,Festival Victory Chip
プリンスタキシード,Prince Tuxedo
美と富と豊穣と幸運,Beauty, Wealth And Luck
ハクオウのこころ８,Hakuo's Heart Lv8
トロピカルテーブル,Tropical Table
深翠のピラー・内部,Deep Green Pillar - Inside
オブジェクト座標065,Object Coordinates 065
オブジェクト座標016,Object Coordinates 016
おてんば姫グローブ,Alena's Gloves
ゴールドマンＭＡＸ,Gold Golem MAX
エンドウマメのラグ,Pea Rug
ヴァリースタジアム,Valley Stadium
ふうまの盾の作り方,Make a Dampening Shield
死霊王ギスマイヤー,Spirit King Gismeyer
壊れた酒場の置き物,Broken Tavern Ornament
炎の領界の植物・小,Fire Realm Plant S
ビーチで大公演！？,Beach Performance!?
ふわふわ雲のライト,Fluffy Cloud Light
ファンキータイツ下,Funky Tights
サロン・フェリシア,Salon Felicia
ガナドールスーツ下,Victor Pants
旅芸人ピュージュＨ,Minstrel Pyuju H
ビクトリーチップ冥,Hades Victory Chip
ドラグーンバスター,Dragoon Buster
プチアーノン釣り傘,Khalamari Kid Umbrella
おいしく焼きしめて,Deliciously Roasted
タロットパック・紫,Purple Tarot Pack
バトエンマニアの机,Batoenmania Desk
サフィア宙橋への扉,Door to Saphia Bridge
オブジェクト座標248,Object Coordinates 248
庭用ハロウィンの墓,Halloween Tombstone (G)
聖なる王城の便せん,Holy Royal Castle Paper
王家の迷宮の滝・庭,Royal Maze Waterfall(G)
防衛魔神兵０５３号,Aztech Guard No. 053
キラークリムソード,Crimson Killing Sword
神技のベストセット,Divine Skill Outfit
スターリースタッフ,Starry Staff
降魔のサークレット,Demonfel Circlet
チェイサーレザー上,Chaser Leather Shirt
プクリポのあいさつ,Pukulipo Greeting
エンタシスマンの書,Prancing Pillar Book
スクアーロの写真３,Squalo's 3rd Photo
ごうかなグリル・赤,Red Fancy Grill
起源将ジェルザーク,Gelzark, General of Origin
オブジェクト座標195,Object Coordinates 195
遊び人のサングラス,Gadabout's Sunglasses
レモンスライムの壁,Lemon Slime Wall
にじいろフィッシュ,Threadfin Rainbowfish
ごうかなラグ小・赤,Red Fancy Rug S
超さいほう針小の本,Super Needle S Book
野いちごバスケット,Wild Strawberry Basket
天の川をつかまえて,Capture the Milky Way
ライトニングシール,Lightning Sticker
イナミノ街道の竹Ａ,Inamino Highway Bamboo
プオーンのツボ・庭,Rebjorn Pot (G)
すごろく景品係ミミ,Sugoroku Prize Clerk Mimi
マンマーカーペット,Momma Carpet
苺お菓子の間仕切り,Berry Sweet Partition
ガーディアンヘルム,Guardian Helm
ガーデンスーツ衣装,Garden Suit Outfit
ギュッとアオちゃん,Bluey Arm Doll
シルエット・猫・白,White Silhouette Cat
オブジェクト座標286,Object Coordinates 286
おばけのいしょう３,Ghost Costume 3
月に還る双子の物語,Tale of Two Moons
古代都市地区への道,Road to Ancient Suburb
青狼鬼グルバレイダ,Grubareyda, the Blue Wolf
ジュリアンテのムチ,Juliante's Whip
パラソルスティック,Jolly Brolly
第８回ヒューザの像,8th Hyuza Statue
中級・魔力錬金の本,Intermediate Mag. Power
旅芸人ピュージュＧ,Minstrel Pyuju G
ゆめみの闇箱タンス,Dreamy Dark Wardrobe
アンノウンシールド,Unknown Shield
うんてんしでっかー,Driver Decker
ロードリーコサージ,Lordly Corsage
耐火性きんちゃく袋,Fireproof Bag
ふわふわバニー・黄,Gold Fluffy Bunny Girl
紫のキーエンブレム,Purple Key Emblem
オブジェクト座標105,Object Coordinates 105
全職さいだいＨＰ+30,Max HP +30
天宮騎士のグリーブ,Sky Knight Greaves
シャイニーウィング,Shiny Wings
メタルスライムたち,Metal Slimes
ブランコ付きの庭木,Tree with Swing (G)
ドワーフカウンタ小,Dwarf Counter S
全職さいだいＨＰ+10,Max HP +10
エテーネのこしぬの,Ethene Loincloth
ウェディングケーキ,Wedding Cake
ランカーキャップⅢ,Ranker Cap Ⅲ
魔衛隊士のグリーブ,Demon Guard Greaves
歯車じかけの便せん,Gear Paper
サラムのブーメラン,Salam's Boomerang
スライムナイト帽子,Slime Knight Hat
ユーライザウィッグ,Yuliza Wig
オブジェクト座標280,Object Coordinates 280
バウギアベビーの像,Baby Earthwyrm Statue
花菱模様のアオザイ,Floral Pattern Ao Dai
渚のピチピチギャル,Trendy Beach Fashion
モッズコート衣装券,Mod Coat Costume Ticket
ディープギアグラス,Deep Gear Glasses
マスターを目指す者,One Who Aims to be Master
エステラのこころ７,Estella's Heart Lv7
聖地パサラン団子山,Sacred Pasaran Dango Mountain
レース受付係タータ,Race Receptionist Tarta
まめに働く天使たち,Diligent Angels
こおりのブーメラン,Winter's Wing
オーマイドリーム！,Oh My Dream!
大いなる砂漠の象徴,Symbol of the Great Desert
豪華なシャンデリア,Luxury Chandelier
バズカフェのアイス,Pazu Cafe Ice Cream
せいどうのよろい上,Bronze Armor Top
しっくいと和紙の壁,Plaster & Paper Wall
まんぷく丸の像・庭,Riceball Baby Statue(G)
緑の巨人グリモア強,Apex Green Giant Greemor
ウォータースライダ,Waterslider
試みの荒野への出口,Exit to Wilderness of Trials
ポールスターハット,North Star Hat
古代オルセコの祭壇,Old Orseco Altar
ザンクローネチェア,Zankrone Chair
ユシュカのこころ７,Yushka's Heart Lv7
黒衣の剣士キッチン,Dark Swordsman Kitchen
千輪菊花火・緑紫桃,Gr./Pur./Pink Fireworks
せいどうのかなづち,Bronze Hammer
プクリポのいいくつ,Pukulipo Fine Shoes
バスルームの洗面台,Bathroom Washbasin
おしゃれな水着・桃,Pink Snazzy Swimsuit
オブジェクト座標031,Object Coordinates 031
古代オルセコ闘技場,Old Orseco Arena
ノコギリエイソード,Sawfish Sword
竜の頭の石像の写真,Dragon Head Statue Photo
メタリックウィング,Metallic Wings
ヒストリカキッチン,Historica Kitchen
はぐれメタル浮き輪,Liquid Metal Floatie
アンノウンバスター,Unknown Buster
クロスペンデュラム,Cross Pendulum
聖王のナイフの壁画,Dryspell Knife Book
第９回ラウルの像庭,9th Rahul Statue (G)
ビッグビッグハット,Giga Sham Hatwitch
大いなる危機の胎動,Great Crisis in Motion
聖夜のエントランス,Holy Grand Lobby
黒衣の剣士のブーツ,Dark Swordsman Boots
アンルシアカプセル,Anlucia Toy
プレゼントチケット,Present Ticket
グレイツェルソファ,Gretzel Sofa
オブジェクト座標104,Object Coordinates 104
ギュメイ将軍の太刀,Goresby-Purrvis' Sword
第１１回パドレ像庭,11th Padre Statue (G)
オブジェクト座標275,Object Coordinates 275
ふしぎな燭台・赤色,Red Mysterious Candlestick
しぐさ書・ジュエル,Emote "Jewel Shower"
東洋風透かし窓・華,Floral Orient Window
第２回カジノ祭・金,2nd Casino Fest Gold
ぬすむ成功率アップ,Half-Inch Success Up
純喫茶のカウンター,Cafe Counter
ドラパンクシューズ,Dracky Punk Shoes
壁かけうさぎの御簾,Rabbit Curtain
スライムつむりの盾,Shell Slime Shield
イルーシャトランプ,Illusia Cards
アイスダンスのくつ,Ice Dance Shoes
プラコン用シャワー,Private Concierge Shower
プラコン女オバケ服,Women's Ghost Costume
ベルヴァインの森西,Belvain Forest West
フォーリオンへの扉,Gate to Fourion
黄金のピラー・内部,Golden Pillar - Interior
竜と生きるは竜術士,A Dragomancer's Life
ワンダーマシュマロ,Wonder Marshmallows
目覚めし五つの種族,Awakening of the Five Tribes
氷の領界の氷ライト,Ice Realm Light
ゆめみの金箱タンス,Dreamy Gold Wardrobe
シュバリエメイル上,Chevalier Mail Top
ジュラシックロイド,Jurassic Droid
シュパルトブレード,Rift Blade
ゴレオン将軍カード,Goreham-Hogg Card
第５回釣りコン・銀,5th Fish Contest Silver
ようせいのヤキソバ,Fairy Fried Noodles
サメバーンプリズム,Sharkburn Prism
本棚付きの大きな壁,Bookshelf Wall L
金平糖モビール・庭,Candy Mobile (G)
スライムの便せん２,Slime Paper 2
ぬすっとの服セット,Robber's Outfit
新春初ウリ冒険譚！,New Year First Adventure!
エージェントの服上,Agent Coat Top
大地の箱舟プリズム,Ark of the Earth Prism
コットンキャンディ,Cotton Candy
レンジャコート上２,Ranger Coat Top 2
純真天使のドレス下,Pure Angel Dress Bottom
やみしばりの像・庭,Hellbound Horror St.(G)
エンタシスマン・強,Vicious Prancing Pillar
ローヌ樹林帯への道,Road to Rhone Woodlands
結界の守護者練習札,Barrier Guardians Tag
ユシュカのこころ１,Yushka's Heart Lv1
カラス神楽の装束Ⅰ,Crow Dance Costume Ⅰ
コロシアム対戦終了,Coliseum Match End
雑貨屋さんの屋根茶,Brown Shop Roof
魔衛隊士のよろい上,Demon Guard Armor
からくりしょうぐん,Bamboolict
死へと導く獣の伝承,Beast That Leads to Death
星くずの灯ろう・黄,Yellow Stardust Lantern
ムーンバニーヘッド,Moon Bunny Head
第１１回ヒューザ像,11th Hyuza Statue
女性もみじのゆかた,Maple Yukata (F)
シルエット・犬・白,White Silhouette Dog
超合金キラーマシン,Killing Machine Toy
ミネアのオルゴール,Meena Music Box
きじゅつしのぼうし,Illusionist's Hat
ヴィスタリア姫の机,Princess Vistaria Desk
ネオンフラッシュ青,Neon Flash (Blue)
フューチャーブーツ,Future Boots
メタスラのキッチン,Metal Slime Kitchen
カンフースリッポン,Kung Fu Slip-Ons
取りよせ商ドロフィ,Collection Merchant Dorofi
植物学者の置きかご,Botanist Cage
ふわふワルドラキー,Fluffy Evil Dracky
月光スミレのランプ,Moonlight Violet Lamp
ナスビぬいぐるみ小,Woebergine Plushie S
かざぐるまのアーチ,Pinwheel Arch
しぐさ書・打成一片,Emote "Become One"
キング・カカオの実,King Cacao Fruit
小悪魔王子のマント,Devil Prince's Cloak
新春ドラキーアーチ,New Year Dracky Arch
スライムエンペラー,Emperor Slime
光の錬金ツボ小の本,Light Pot S Book
ほわいとたきしーど,White Tuxedo
アイスブルーダリア,Ice Blue Dahlia
セクシードレッサー,Sexy Vanity
スターコートセット,Superstar Outfit
庭用ネオン・ハート,Neon Heart (G)
鍛冶素材屋フウザム,Smithing Materials Fuzam
実装テストアトラス,Implementation Test Atlas
グランゼドーラの母,Mother of Gran Zedora
ゴローさん部屋着下,Goro Shorts
口調の書・甘えん坊,Tone Book - Spoiled
パンジーのサンダル,Pansy Sandals
ステーション機関室,Station Engine Room
タロットパック・金,Gold Tarot Pack
キンスラ王冠ランプ,King Slime Crown Lamp
ヒトデのブーメラン,Starfish Boomerang
自立型サンドバッグ,Standing Punching Bag
紫電とどろく時は今,Purple Lightning Time
樹天の里へのはしご,Ladder to Treetop Town
ブルートライデント,Blue Trident
ディカス団長のメモ,Commander Dicus' Note
ドット旅の扉柄ラグ,Travel Door Rug
ガタラ原野への出口,Exit to Gatara Fields
闇の領界のレリーフ,Dark Realm Relief
幻界の四諸侯コイン,Dread Fiends Coin
昔日のよろいセット,Ancient Armor Set
お姫様の食器棚・橙,Princess Cupboard
王軍師のよろいの本,Royal Soldier Gear Book
フカフカのもみガラ,Fluffy Rice Husks
おしゃれストリート,Fashion Street
おにのかなぼう物語,Marauder's Maul Story
プロディトスーツ下,Plaudit Suit Bottom
ネコ姫のドレッサー,Cat Princess Vanity
あかつきのメダイユ,Daybreak Medaille
ダークペルシャの杖,Whiskamancer Staff
大富豪協会員プゴル,Tycoon Club Member Pugol
常闇の竜レグナード,Everdark Dragon Regnad
おとぎの森グローブ,Fairy Forest Gloves
まもの導師グローブ,Monster Guru's Gloves
黒パールコンパクト,Black Pearl Compact
ブルーハートピアス,Blue Heart Earrings
苺お菓子のオーブン,Berry Sweet Oven
壁かけポプリリース,Potpourri Wall Wreath
初級・ＭＰ錬金の本,Beginner MP
オブジェクト座標245,Object Coordinates 245
スライムベスハウス,She-Slime House
マーメイドバスタブ,Mermaid Bathtub
古代オルセコの玉座,Old Orseco Throne
忍びのマフラー・紫,Purple Ninja Scarf
いたずらもぐら・強,Vicious Mischievous Mole
聖守護者のウィング,Sentinel's Wings
ポップスターの服上,Pop Star Top
フウラの肖像画・庭,Fuura Portrait (G)
オブジェクト座標096,Object Coordinates 096
ルコリアぬいぐるみ,Lucolia Plushie
セクシーギフト・黒,Black Sexy Gift
四葉透かし細工の壁,Four-Leaf Wall
ふわふわ雲のソファ,Fluffy Cloud Sofa
ガラスケースのカギ,Glass Case Key
ゴブル砂漠西への道,Road to Goble Desert West
超フライパン作成術,Super Frypan Book
チョコが詰まった袋,Chocolate Filled Bag
第３回カジノ祭・金,3rd Casino Fest Gold
かっぱえび家の帽子,Shrimp Snack Hat
オブジェクト座標144,Object Coordinates 144
しぐさ書・○を描く,Emote "Draw an O"
エンゼルフィッシュ,Angelfish
白ねこシャンデリア,White Cat Chandelier
ドルワームの紋章旗,Dolworm Banner
郵便局員ブリッシュ,Postman Blish
星空のチェスト・青,Blue Starry Chest
シルエット・鳥・白,White Silhouette Bird
ホイミントウェア下,Heal Mint Pants
スカイブルーの花束,Sky Blue Bouquet
ポーズ書・釣り仙人,Pose "Fish Hermit"
オブジェクト座標089,Object Coordinates 089
エテーネ王宮の鏡台,Ethene Royal Vanity
コロシアムキャップ,Coliseum Cap
茶トラ太猫カプセル,Fat Brown Tabby Toy
妖炎魔女のグローブ,Fire Witch Gloves
攻撃時に雷耐性低下,Thunder Resist Down Attack
ドワーフ作業ぼうし,Dwarf Work Hat
オグチャビ像こげ茶,Olive Ogreed Chubby St.
氷闇の月飾りの破片,Icy Dark Moon Shard
英雄はすべてを救う,A Hero Saves All
ノーブルギフト・黒,Black Noble Gift
旅芸人ピュージュＪ,Minstrel Pyuju J
ナイトフィーバー紫,Night Fever (Purple)
メラゾーマやきそば,Kafrizz Fried Noodles
空賊のシャツセット,Sky Pirate Outfit
デビルワインの花束,Devil Wine Bouquet
オブジェクト座標079,Object Coordinates 079
廃墟のドミネウス邸,Abandoned Domineus Mansion
フラワーギフト券Ⅱ,Flower Gift Voucher Ⅱ
トコトコわらし人形,Trotting Child Doll
シングルアンテナＢ,Single Antenna B
壁かけムーンライト,Moon Wall Light
カジノ祭６ビンゴ銅,CasinoFest 6 Bingo Bronze
ハートのタンス・桃,Pink Heart Wardrobe
ヒューザのこころ６,Hyuza's Heart Lv6
空飛ぶ円盤プリズム,Flying Saucer Prism
ランプ錬金設備・庭,Lamp Alch. Facility (G)
清廉天使のスーツ下,Honest Angel Pants
サーペントウィップ,Serpent Whip
シスター・ミシェル,Sister Michelle
ポーリアにおまかせ,Leave it to Paulia
水の領界のかがり火,Water Realm Brazier
偽りのレンダーシア,False Lendersia
天地雷鳴士の装束上,Druid Attire Top
たつじんのオノの本,Pro's Axe Book
壁かけのはめ殺し窓,Inset Windows
まおうのつかい・強,Vicious Demon-at-arms
プリズニャン招き猫,Jailcat Figurine
クリムゾングローブ,Crimson Gloves
ふんさいのおおなた,Heavy Hatchet
チョコレート便せん,Chocolate Paper
メディカルデバイス,Medical Device
小さな英雄グローブ,Little Hero's Gloves
聖王のつるぎの壁画,Dryspell Sword Book
悪夢のヤドリギ広場,Mistltoe Plaza of Nightmares
レモンスライムの柱,Lemon Slime Pillar
イケてる歌詞カード,Cool Lyrics Card
異国のレンガ館の壁,Exotic Brick Wall
学園男子のジャージ,Schoolboy Jersey
オレンジガーベラ傘,Orange Gerbera Umbrella
獣魔ローガストの像,Logast Statue
ホイミンぬいぐるみ,Healie Plushie
ゼドラ王国服モブ６,Zedra Royal Clothes Mob 6
スコアアタック銅赤,Score Attack Silver
ドット風ヒューザ像,Pixel Hyuza Statue
ルミナスギフト・黒,Black Luminous Gift
しぐさ書・星の魔法,Emote "Star Magic"
レンジャーシャプカ,Ranger Shapka
クールスターマイク,Cool Star Microphone
DQ1勇者たいまつなし,DQ1 Hero Without Torch
バトルマスターの影,Battlemaster's Shadow
デスパワーブースト,Death Power Boost
マーチンググローブ,Marching Gloves
とこしえの神殿広間,Temple of Eternity Hall
フリルスイムパンツ,Frill Swim Trunks
支援魔神機０２５号,Aztech Support Mech No. 025
前座芸人のバンダナ,Show Opener's Bandana
お花の鉢植え・家用,Flower Plant Pot
万魔の塔・四の災壇,Banma Tower - 4th Platform
おいしい料理セット,Delicious Meal Set
はじゃのろーぶきん,Gold Champ Robe
フォーリオン造成地,Fourion Worksite
セラフィムプリズム,Seraph Prism
しぐさ書・ひらめく,Emote "Inspire"
はぐくみギフト・燈,Light Nurturing Gift
クリムゾングレイブ,Crimson Glaive
イッショウの家の柱,Issho's House Pillar
エルドナ神の装束上,Eldona's Dress Top
エンシェントククリ,Olde-Worlde Knife
冥骸魔レギルラッゾ,Legirrazzo, the Crumbling Corpse
しぐさ書・リベリオ,Emote "Purrgatroyd"
青のキーエンブレム,Blue Key Emblem
オブジェクト座標180,Object Coordinates 180
ウィンターゴーグル,Winter Goggles
破天の防具鍛冶職人,Sky Shattering Armorsmith
きなこづちの像・庭,Honeyhood Statue (G)
小悪魔王子ステッキ,Devil Prince's Stick
メレアーデスカート,Mereade Skirt
異国の寺院のタイル,Exotic Temple Tile
ウェディテーブル大,Weddie Table L
音符のチェスト・黒,Black Music Chest
スライムナイトの像,Slime Knight Statue
銅のフェザーチップ,Copper Feather Chip
ランドンクーンの像,Landon Coon Statue
モダンバニータイツ,Modern Bunny Tights
スノーモンプリズム,Snow Sanguini Prism
レンタル花がら水着,Rental Floral Swimwear
ぶんぶんパニック！,Buzz Buzz Panic!
ふわふわトラちゃん,Fluffy Traeie
七夕の鍛冶ハンマー,Star Festival Hammer
うんてんしちっちぇ,Driver Chiche
アイゼルぬいぐるみ,Eisel Plushie
オブジェクト座標198,Object Coordinates 198
壁かけライト付き鏡,Wall Mirror with Light
古代王族のターバン,Ancient Royal Turban
ダンシングライト青,Dancing Light (Blue)
万魔の塔・一の災壇,Banma Tower - 1st Platform
天の冒険者のズボン,Divine Traveler Pants
エージェントハット,Agent Hat
すごろく案内係アミ,Sugoroku Guide Amy
勇気を奮い立たせて,Muster the Courage
スノースター衣装上,Snowstar Dress Top
ムーディーテーブル,Moody Table
潜水服・デフォルト,Default Diving Suit
オブジェクト座標191,Object Coordinates 191
リゼロッタトランプ,Lieselotte Cards
第９回ナジーンの像,9th Najinn Statue
盗賊のチュニック上,Thief Tunic
ウェットスーツ・金,Gold Wetsuit
行動時10%バイシオン,Oomph On Action 10%
セピアのアイリ人形,Sepia Aili Doll
小辛翼竜バードアイ,Hot Pterosaur
攻撃時25%バイキルト,Oomphle On Attack 25%
