希水晶のブーメラン,Quartz Boomerang
カンフージャケット,Kung Fu Jacket
果てなき修練の末に,After Endless Training
イチゴのクッション,Strawberry Cushion
赤点はもうヤバい！,Failing Marks are Bad!
お姫様オーブン・桃,Pink Princess Oven
レーンの村のアーチ,Rane Village Arch
しぐさ書・ツッコミ,Sobering Slap
お魚のパーカー水着,Fish Hoodie Swimsuit
スノースターブーツ,Snowstar Boots
ガーディアンヘルム,Guardian Helm
ファンシークリーム,Fancy Cream
タイタス号乗船パス,Titus Boarding Pass
魔物管理人グーボレ,Monster Manager Gubole
しぐさ書・あらまあ,Oh My!
天狐アマツカゼの旗,Amatsukaze Banner
パレードコステイロ,Mardi Garb Feathers
起源魔スコルパイド,Scorpide, Carapace of Origin
ノコギリエイソード,Sawfish Sword
エドアルド邸のイス,Eduardo's Chair
偽りのレンダーシア,False Lendersia
花婿のサークレット,Groom's Circlet
キングスライム・祖,Ancestral King Slime
小さな英雄のよろい,Little Hero's Armor
フライパン屋パオス,Frying Pan Shop Paos
スチームカウンタ小,Steam Counter S
ヴァルハラメイル上,Valhalla Mail Top
ガナドールスーツ上,Victor Shirt
ドレスを追い求めて,In Pursuit of the Dress
エルドナ神のぞうり,Eldona's Sandals
バージンロードラグ,Wedding Aisle Rug
ガウシア樹海への道,Road to Gaussia Woodlands
初心者用のハンマー,Beginner's Hammer
スターの足置き・青,Blue Star Footrest
アンノウンバスター,Unknown Buster
古代武器図説・爪編,Book of Ancient Claws
魔法使いの服セット,Mage Outfit
スライムナイト帽子,Slime Knight Hat
プチギュメイカード,Frail Goresby Card
預かり所・よろず屋,Depository/General Shop
緑のほこらの洞くつ,Green Shrine Cave
星雲のモビール・白,White Nebula Mobile
ゴールドマンＭＡＸ,Gold Golem MAX
クマリスのブラウス,Kumaris' Blouse
オブジェクト座標020,Object Coordinates 020
クールスターマイク,Cool Star Microphone
警備魔神兵０４２号,Aztech Guard No. 042
シスター・ファンナ,Sister Fanna
上級・呪文錬金の本,Advanced Spell
さとりのころもの書,Clarity Outfit Book
クルクルポシェット,Bag o' Books
ギュッとレグナード,Regnad Arm Doll
おやぶんのにがお絵,Boss' Portrait
どうぐ使いグローブ,Item Master Gloves
古代王族のボトムス,Ancient Royal Bottoms
ポンポンベタ・白赤,White Pom Pom Betta
グランドタイタス丼,Grand Titus Bowl
ワーニングな足ヒレ,Warning Flippers
若手芸人の服セット,Young Talent Outfit
防衛魔神兵０５２号,Aztech Guard No. 052
ヒエヒエなんです！,It's Freezing!
エンシェントククリ,Olde-Worlde Knife
第６回討伐ＴＡ・銅,6th Boss TA Bronze
機工博士のグローブ,Engineer's Gloves
試みの荒野への出口,Exit to Wilderness of Trials
オブジェクト座標219,Object Coordinates 219
たびびとのリュック,Traveler's Backpack
いざ　ドラゴラム！,Now, Puff!
ダークプラムの花束,Dark Plum Bouquet
オブジェクト座標199,Object Coordinates 199
砂海のころもセット,Sand Sea Outfit
ルミナスギフト・黄,Yellow Luminous Gift
ゼドラ王国服モブ１,Zedra Royal Clothes Mob 1
ともしびこぞう提灯,Wickerman Paper Lantern
スターリースタッフ,Starry Staff
あさがお柄のゆかた,Bell Pattern Yukata
ドワーフテーブル小,Dwarf Table S
ポイズントリル・強,Vicious Poison Trill
ブサカワぬいぐるみ,Ugly Plushie
デスマシーンメダル,Slaughtomaton Medal
マグノリアの花飾り,Magnolia Hair Decor
星座の導き・しし座,Constellations: Leo
キュロン湿原への道,Road to Kyuron Marshlands
フェンリルアタック,Fenrir Whistle
ミツバチパーカー下,Honeybee Shorts
カラフル花火台・青,Blue Fireworks Stand
パンプキンシューズ,Pumpkin Shoes
作りかけぬいぐるみ,Unfinished Plushie
あるイケメンの秘密,Secret to Being Handsome
大聖堂のオルゴール,Cathedral Music Box
マポレーナプリズム,Genie Sanguini Prism
りゅうおうブレード,True Dragonlord Blade
オブジェクト座標050,Object Coordinates 050
シスター・エレーヌ,Sister Elaine
将軍のゆびわの破片,General Ring Shard
トランク型のタンス,Suitcase-Style Wardrobe
シルフウィング・桃,Pink Sylph Wings
白亜の臨海都市地区,Chalky Waterfront
空賊のシャツセット,Sky Pirate Outfit
砂漠の渇きを癒す者,Desert Thirst Quencher
セクシーギフト・白,White Sexy Gift
森林警備隊グローブ,Forest Ranger Gloves
野いちごバスケット,Wild Strawberry Basket
メタスラボスメダル,Metal Slime Boss Medal
ゴールドマンＸ４号,Gold Golem X 4
労働魔神機０３１号,Aztech Labor Mech No. 031
シルエット・猫・白,White Silhouette Cat
ジアクト軍の飛行艇,Dia Kut Army Airship
リボンスターの服上,Star Ribbon Top
ふわふわトラちゃん,Floaty Traeie
スノースター衣装上,Snowstar Dress Top
創失のゴレオン将軍,Goreham-Hogg, the Unmade
楽将バトルシェイカ,Tyrant Maracaraider
蘇りし冥王ネルゲル,Risen Netherlord Nergel
ブルラトスの発着場,Buratos' Landing
ガーディアンサラダ,Guardian Salad
Ｓジェネラルコイン,Shogum Coin
アオちゃんカプセル,Bluey Toy
妖炎魔女のドレス下,Fire Witch Lower Gown
スライムタワーの像,Slime Stack Statue
バトルシェイカー強,Apex Maracaraider
黒柴モダンカプセル,Hip Black Shiba Toy
支援魔神機０２７号,Aztech Support Mech No. 027
オフビートなアイツ,That Offbeat Person
マイタウン古代地区,My Town Ancient District
スライムヘッドホン,Slime Headphones
エトワールコート下,Etoile Coat Bottom
ポーポラ地方への道,Road to Popola Region
ハルファスの大紋章,Halphas Sigil
リンベリィトランプ,Linberry Cards
グランゼドーラ兵Ａ,Gran Zedora Soldier A
プラチナ鍛冶ハンマ,Platinum Hammer
リボンスターのくつ,Star Ribbon Shoes
バルディスタ魔術兵,Valdistan Caster
メネトのカウンター,Menet Counter
ぬすっとの服セット,Robber's Outfit
オブジェクト座標212,Object Coordinates 212
ウェディテーブル大,Weddie Table L
マジカルじんべい上,Magical Jinbei Top
中型の四角い水そう,Square Aquarium M
旅芸人ピュージュＦ,Minstrel Pyuju F
ゼドラ王国服モブ９,Zedra Royal Clothes Mob 9
ベビタン竜族人形女,Imp Nadravian Doll (F)
エージェントマスク,Agent Mask
レジェンドチケット,Legend Ticket
とある老行者の試練,Trials of an Old Pilgrim
月光スミレのランプ,Moonlight Violet Lamp
ギュッとチュラリス,Chularis Arm Doll
ドラグーンメイル上,Dragoon Mail Top
ドラゴンクローの書,Dragon Claws Book
グレイスフルブーツ,Graceful Boots
軍馬の大剣の作り方,Great War Horse's Sword
炎の領界の植物・大,Fire Realm Plant L
スチームテーブル小,Steam Table S
第９回釣りコン・銀,9th Fish Contest Silver
お月様と雲のベッド,Moon and Cloud Bed
しぐさ書・ガリバー,Gulliver Hand
整理術は海を越えて,Sea the Art of Organizing
グレーブルーの花束,Gray-Blue Bouquet
デビルワインの花束,Devil Wine Bouquet
ヘパイトスのひだね,Hephaestus' Flame
武闘家ヤーン分身Ｃ,Martial Artist Yarn Copy C
ポールスターハット,North Star Hat
蝶とレースの便せん,Butterfly & Lace Paper
ふしぎな燭台・黄色,Yellow Mysterious Candlestick
グロリアスコートＷ,Glorious Coat and Wig
ホーリージャミラス,Divine Jamirus
黄赤チューリップ傘,Red/Ylw. Tulip Umbrella
オブジェクト座標052,Object Coordinates 052
シスター・ディモス,Sister Deimos
桃色チューリップ傘,Pink Tulip Umbrella
ドルワーム王国の扉,Dolworm Kingdom Door
メガルーラストーン,Mega Zoomstone
シャイニーウィング,Shiny Wings
叡聖のサークレット,Profound Circlet
ごうかな飾り棚・赤,Red Fancy Shelf
妖精図書館のチェア,Fairy Library Chair
オブジェクト座標053,Object Coordinates 053
防衛魔神兵０５９号,Aztech Guard No. 059
支配されし飛竜たち,The Dragon Rulers
うさぎエステラ人形,Rabbit Estella Doll
トンブレソンブレロ,Ham Shamwitch Sombrero
シングルアンテナＡ,Single Antenna A
第９回カミルの像庭,9th Kamil Statue (G)
竜の頭の石像の写真,Dragon Head Statue Photo
五線譜アーチネオン,Musical Neon Arch
警備魔神兵０４９号,Aztech Guard No. 049
必殺チャージ率 +1.0%,Special Charge Rate +1%
オブジェクト座標198,Object Coordinates 198
ムニエカ・隠し通路,Munieka - Secret Passage
魔女グレイツェル強,Apex Witch Gretzel
お正月ザンクローネ,New Year Zankrone
迷宮の主の間への道,Path to Boss
氷の領界のテーブル,Ice Realm Table
タイタス号の伝声管,Titus Voice Pipe
ウィリーデブレード,Vilide Blade
タコメットの釣り傘,Octopot Umbrella
バーベキューセット,Barbecue Set
オブジェクト座標027,Object Coordinates 027
しぐさ書・みちくさ,Detour
夏休みの絵日記・金,Gold Summer Break Diary
オブジェクト座標288,Object Coordinates 288
古代魔術のほうい下,Ancient Magic Bottom
ソルシエールグラブ,Sorciere's Gloves
ポーリアにおまかせ,Leave it to Paulia
求道者の道着セット,Seeker's Outfit
竜将のよろいセット,Dragon General Armor Set
ぷりんすたきしーど,Prince Tuxedo
王宮のバスタブ・青,Blue Royal Bathtub
スクアーロの写真３,Squalo's 3rd Photo
ゴッドジャグリング,God Juggling
モーモンスティック,Teeny Sanguini Wand
千里の名馬プリズム,1000 Mile Horse Prism
水底にたゆたうもの,Undersea Dwellers
マスカレイドマスク,Masquerade Mask
ギルガランのピアス,Gilgaran's Earrings
きまぐれカギしっぽ,Silly Cat Tail
バトエンジャーの像,Batoenger Statue
ドルタムのこころ１,Doltam's Heart Lv1
壁かけリベリオの絵,Purrgatroyd Portrait
クリティカルロッド,Critical Rod
黒パールコンパクト,Black Pearl Compact
妖精の隠れ家の石壁,Fairy Lair Stone Wall
ユシュカのこころ８,Yushka's Heart Lv8
星くずの灯ろう・黄,Yellow Stardust Lantern
極天女帝のサンダル,Sky Empress Sandals
魔想念レギルラッゾ,Remnant of Legirrazzo
燃えるほのおの凱歌,Triumph of Flames
オブジェクト座標275,Object Coordinates 275
Ｎ高女子のブレザー,N High Girl's Blazer
白蛇のこんの作り方,Make a White Snake Rod
シスター・プリミン,Sister Purimin
ベジセルク・サーガ,Cucumberserk Saga
シスター・ペポリス,Sister Pepolis
シール少年マツタケ,Sticker Boy Matsutake
小さな英雄はちがね,Little Hero's Headband
ガラクタボックス４,Junk Box 4
郵便局員ブリッシュ,Postman Blish
ふのギフトボックス,Dark Gift Box
古グランゼドーラ城,Old Gran Zedora Castle
マーメイドティアラ,Mermaid Tiara
ホーリーキャンディ,Holy Lollipop
天河のジャンビーヤ,Milky Way Jambiya
ジュレット民家の扉,Julet House Door
銀河のランプ錬金書,Galaxy Lamp Alch. Book
鍛冶素材屋フウザム,Smithing Materials Fuzam
海賊の戦闘服セット,Battle Pirate's Outfit
さざなみギフト・白,White Ripples Gift
しぐさ書・パレード,Parade Dance
紫電とどろく時は今,Purple Lightning Time
フラウススティック,Flaus Wand
レモスラのランタン,Lemon Slime Lantern
スマートな水着・赤,Red Smart Swimsuit
キングのピース・黒,Black King Piece
蘇生時バイキと覚醒,Attack & Magic Savior
壁かけマイユ肖像画,Maille Portrait
ストームグラス・庭,Storm Glass (G)
プラチナ鍛冶ハン小,Platinum Hammer S
リンクル地方への道,Road to Wrinkle Region
ふわふわアーケロン,Floaty Archelon
ゴールデンスライム,Gem Slime
スウィートビキニ黒,Black Sweet Bikini
ゴスバニートップス,Goth Bunny Tops
千輪菊花火・赤黄桃,Red/Yel./Pink Fireworks
ソルシエールハット,Sorciere's Hat
お菓子のテーブル小,Sweet Table S
忠節の騎馬プリズム,Loyal Horse Prism
カジノバニーリスト,Casino Bunny Wristbands
レインボーリキッド,Rainbow Liquid
キラパン黒プリズム,Dark Sabrecat Prism
ガラスケースのカギ,Glass Case Key
スチームカウンタ大,Steam Counter L
ユシュカのこころ１,Yushka's Heart Lv1
お姫様間仕切り・桃,Pink Princess Partition
七夕の鍛冶ハンマー,Star Festival Hammer
魔物管理人ドリアス,Monster Manager Dorias
ひとくいドールたち,Man-Eating Dolls
やりなおしの無限石,Infinite Repeatstone
マタドールシューズ,Matador Shoes
うさみみギフト・白,White Rabbit Ears Gift
グランゼニスの王冠,Gran Zenith's Crown
強戦士の聖域・前室,Book of Bosses - Lobby
パピヨンベッド・幻,Phantom Papillon Bed
ガード時80%でためる,Tension On Parry 80%
ウィザードバス・白,White Wizard Bath
ギュメイ将軍コイン,Goresby-Purrvis Coin
東洋風ついたて・華,Floral Orient Partition
銀のフェザーチップ,Silver Feather Chip
ビクトリーチップ刻,Time Victory Chip
ゆらゆら羊さん・紫,Purple Rocking Sheep
だいまどうローブ上,Great Mage Upper Robe
ほこらの祭祀場・嵐,Storm Shrine Ritual Ground
サリアスぬいぐるみ,Sarias Plushie
魔物管理人ピョンル,Monster Manager Ponel
星くずの灯ろう・紫,Purple Stardust Lantern
ヴァレリアカプセル,Valeria Toy
冥骸魔レギルラッゾ,Legirrazzo, the Crumbling Corpse
デスパワーブースト,Death Power Boost
エフェクト両手剣２,Greatsword Effect 2
スピリットブラスト,Spiritual Surge
ふっかふかマフラー,Soft Scarf
りょうりにんぼーら,Chef Bora
守護天使のガーベラ,Guardian Angel's Gerbera
大富豪なりきり宝箱,Tycoon Treasure Chest
第１回釣りコン・金,1st Fish Contest Gold
経験値の古文書・小,Experience Scroll S
リビングスタチュー,Sculpture Vulture
シルエット・ナイト,Silhouette Knight
タイフーンレザー下,Typhoon Leather Pants
住宅素材屋ポッポル,Housing Materials Poppol
追加クエダミー１０,not used
異界獣ヘイズバイオ,Haze Bio, the Otherworldly
ベラストル家の呪符,Belastre Amulet
しぐさ書・ペンペン,Spank
セレディーネの手紙,Celedine's Letter
武闘家ヤーン分身Ｂ,Martial Artist Yarn Copy B
第５回討伐ＴＡ・銀,5th Boss TA Silver
オレンジキャンディ,Orange Ice Pop
しぐさ書・グレープ,Grape Juice
ゆめみの天箱タンス,Dreamy Sky Wardrobe
ウパソルジャー・創,Created Wooper Trooper
コイン販売所イサラ,Token Exchange Isara
星座の導き・やぎ座,Star Guide・Capricorn
フリルスイムワンピ,Frill Swim Dress
黄チェックの便せん,Yellow Checkered Paper
しぐさ書・お祝い緑,Celebrate Green
スライムアンノウン,Slime Unknown
小鳥の止まり木の畑,Small Bird Perch Field
ミラクル武器の軌跡,Miracle Sword Book
しぐさ書・ひらめく,Inspire
サフィア宙橋への扉,Door to Saphia Bridge
廃墟のドミネウス邸,Abandoned Domineus Mansion
氷闇の月飾りの破片,Icy Dark Moon Shard
ガルーダテンペスト,Garuda Tempest
原初の炎（ランプ）,Origin Flame (Lamp)
光飾りタイルの本棚,Light Tile Bookshelf
ゴルフメンズウェア,Golf Men's Wear
しぐさ書・聞かざる,Don't Listen
ハクオウのこころ７,Hakuo's Heart Lv7
ガーディアンの資格,Guardian Qualification
スパングルグローブ,Spangled Gloves
鳥かごのポスト・黄,Yellow Birdcage Mailbox
アルゴンキッズの像,Argon Fry Statue
ロトのしるしの花火,Erdrick Emblem Firework
フューチャーハット,Future Hat
常闇の竜プクナード,Everdark Dragon Pukunad
第７回釣りコン・銀,7th Fish Contest Silver
ギュッとリゼロッタ,Lieselotte Arm Doll
きじゅつしのネタ帳,Illusionist's Notebook
テスト剣モデルなし,Test Sword Model Not OK
バナナのソファ・青,Green Banana Sofa
リーフ柄の便利な壁,Leaf Pattern Wall
アンテイクドレス下,Antique Skirt
壁かけライト付き鏡,Wall Mirror with Light
激辛トマトジュース,Super Hot Tomato Juice
スイカのタライ・金,Gold Watermelon Basin
アイリのぬいぐるみ,Aili Plushie
しましまマフラー赤,Red Striped Scarf
盗賊のチュニック下,Thief Pants
アンルシアカプセル,Anlucia Toy
ヘイズバットの分身,Avatar of Haze Bat
コンシェルジュ０７,Concierge 07
聖夜のエントランス,Holy Grand Lobby
きじゅつしのズボン,Illusionist's Pants
果たせなかった契り,Unfulfilled Promise
はくばのおうじの像,Prince Harming Statue
第８回討伐ＴＡ・銅,8th Boss TA Bronze
氷の魔王のスーツ下,Ice Demon Suit Bottom
しゅうれん用リスト,Training Wristbands
妖精の女王ウィング,Fairy Queen Wings
はじゃのよろいきん,Gold Champ Armor
真・幻界諸侯コイン,True Dread Fiends Coin
冒険ゼミ会員ベスミ,Adventurer Seminar Member Sheemi
サファイアプリズム,Sapphire Prism
チョコ神ぬいぐるみ,Choco-God Plushie
第１２回ラウル像庭,12th Rahul Statue (G)
ライトニングシール,Lightning Sticker
ヴァレリアへの親書,Official Letter to Valeria
しぐさ書・決め左前,Decisive Pose L. Front
いたスト・お店マス,Fortune Street - Shop
聖湖ゼニートの本棚,Zenith Bookshelf
デフェル荒野への道,Road to Defel Desert
ナドラガ教団大神殿,Sanctum of the Order
ソーミャ宛ての手紙,Letter to Somya
きじゅつしのぼうし,Illusionist's Hat
絶念のアウルモッド,Aurmod the Forlorn
クロスペンデュラム,Cross Pendulum
魔幻園マデッサンス,Universagora Studios
王宮のイスと机の本,Royal Furniture Book
女性もみじのゆかた,Maple Yukata (F)
強戦士の聖域・闘場,Book of Bosses - Arena
スカーレットグラス,Scarlet Glasses
飛竜の卵のスツール,Flying Dragon Egg Stool
ゆめみの金箱タンス,Dreamy Gold Wardrobe
レンガのお屋敷の塀,Brick House Fence
シスター・ユミール,Sister Yumir
シルバリヌスのツボ,Silverine Pot
じごくのネギボーズ,Brimstone Bud
レトロなテレビ欠番,Retro TV Missing
赤の巨人レドノフ強,Apex Red Giant Rednov
オルセコ高地への道,Road to Orseco Highlands
魔物シールド勲章券,Shield Medal Ticket
再しぐさ書・ピース,Peace Sign (Reprint)
大魔王マデサゴーラ,Demon Lord Madesagora
アイドルギフト・白,White Idol Gift
第９回討伐ＴＡ・銀,9th Boss TA Silver
ギルガランのうでわ,Gilgaran's Bangles
第８回ナラジアの像,8th Narasia Statue
はじめての武器鍛冶,Welcome Weaponsmithing
真・暗殺武器の歴史,True Assassin Weapons
パピヨンソファ・夢,Dream Papillon Sofa
オブジェクト座標062,Object Coordinates 062
クローバーＴシャツ,Clover T-Shirt
女性白波柄のゆかた,White Wave Yukata (F)
降魔のよろいセット,Demonfel Armor Set
ふわふわホミロット,Floaty Healix
オブジェクト座標049,Object Coordinates 049
エステラのこころ３,Estella's Heart Lv3
ももんじゃスカート,Platypunk Skirt
しぐさ書・たけのこ,Bamboo Shoot Trick
たつじんのオノの本,Pro's Axe Book
白いビーチパラソル,White Beach Umbrella
ハイクラススーツ上,High Class Suit Top
エージェントブーツ,Agent Boots
ルーキーのつなぎ下,Rookie Pants
古代オルセコの太鼓,Old Orseco Drum
氷の領界の氷ソファ,Ice Realm Sofa
サーマリ高原の木Ａ,Samary Plateau Tree A
赤の錬金石２０こ券,20 Red Gems Ticket
ふわふわ雲のソファ,Fluffy Cloud Sofa
ハロウィン衣装券Ⅶ,Halloween Voucher Ⅶ
ライバルズトランプ,Rivals Cards
レンジャー協会本部,Ranger Association HQ
暗黒大樹の番人たち,Dark Tree Guardians
しぐさ書・打成一片,Become One
プラコンスーツ・紺,Navy Blue Suit
天使人形ルーミリア,Angel Doll Lumeria
戦士のよろいセット,Warrior Armor Set
猛る槌矛のガイオウ,Gaiou, Hammer and Pike
景品交換所リーニャ,Prize Exchange Linya
ゲルト・勇気の儀式,Gert・Ritual of Courage
黒蛇鬼アクラガレナ,Akragarena
王宮のチェスト・青,Blue Royal Chest
きまぐれシマしっぽ,Silly Striped Tail
オブジェクト座標176,Object Coordinates 176
ルベランスティック,Ruberan Wand
ワイルドフォビズム,Wild Fauvism
じごくのドアボーイ,Hell's Bellboy
モダンローズビジュ,Modern Rose Bijou
魔物管理人トゥフラ,Monster Manager Tufura
ガーデニングセット,Gardening Set
ゴールドニャンの像,Gold Cat Statue
グランゼドーラの母,Mother of Gran Zedora
グレイツェルチェア,Gretzel Chair
イルーシャトランプ,Illusia Cards
赤色チューリップ傘,Red Tulip Umbrella
まのギフトボックス,Demon Gift Box
ルビーのかみかざり,Ruby's Hairpin
プチバラモスゾンビ,Frail Bones of Baramos
きょじんのハンマー,Giant's Hammer
苺お菓子のバスタブ,Berry Sweet Bathtub
とらんす一味ポーチ,Trans Gang Pouch
こおりのやいばの書,Icicle Dirk Book
くらげドレスセット,Jellyfish Dress Set
グレースギフト・緑,Green Grace Gift
アジサイ姫ゆかた下,Hydrangea Yukata Bottom
アームライオン・強,Vicious Hellion
運動会・赤組衣装券,Red Team Voucher
オブジェクト座標259,Object Coordinates 259
罪深きバラのように,Like a Sinful Rose
うんてんしでっかー,Driver Decker
まもの導師グローブ,Monster Guru's Gloves
賢者の杖クラッシュ,Sage's Staff Crash
古レビュール街道北,Old Reviewle Highway North
騒演王ベイオウルフ,Chaotic King Beowulf
ガートラント兵士Ｂ,Gartlant Soldier B
神々のゆびわの破片,Ring of the Risen Shard
フーたんのブローチ,Futan Brooch
ミニポニテエクステ,Mini Ponytail Extension
レッドガーベラの傘,Red Gerbera Umbrella
こあくまのネイル術,Infernails Technique
白夜に消えた運転士,Vanish in the Midnight Sun
短くなったロウソク,Shortened Candle
ハートの兵隊ぼうし,Heart Soldier Hat
旅芸人ピュージュＪ,Minstrel Pyuju J
さんぞくウルフ・強,Vicious Ruff Ruffian
アクロバーガー・小,Small Acro-Burger
ゼネシアのウィッグ,Zenethia Wig
ナイトフィーバー緑,Night Fever (Green)
警備魔神兵０４４号,Aztech Guard No. 044
財宝を守るドラゴン,Treasure Guard Dragon
マリーヌ神のしもべ,Servant of Marine
マジェスタスーツ上,Majesta Shirt
異界滅神ジャゴヌバ,Jagonuba, the Otherworldly Destroyer
マスカレイドグラブ,Masquerade Gloves
ビクトリーチップ銅,Bronze Victory Chip
かーにばるこーでⅠ,Carnival Outfit Ⅰ
ザグバン丘陵への道,Road to Zagban Hills
宣伝コンテスト・金,Promo Contest Gold
きりさきピエロ・強,Vicious Prickly Prankster
りょうりにんかっぷ,Chef Cupp
さすらいのコート上,Errant Coat Top
メロディアスーツ下,Melody Suit Bottom
イナミノ街道の木Ｂ,Inamino Highway Tree B
チョッピ荒野の木Ｃ,Choppi Wilderness TreeC
きまぐれ猫ドレス下,Silly Cat Skirt
第３回釣りコン・金,3rd Fish Contest Gold
第２回クロウズの像,2nd Claws Statue
演奏会２５夏視聴券,Summer Concert '25 Ticket
ドルボードの残がい,Dolboard Remains
オブジェクト座標250,Object Coordinates 250
天地雷鳴士の高みへ,The Heights of a Druid
レンジャーシャプカ,Ranger Shapka
ドラグーンメイル下,Dragoon Mail Bottom
くさった死体マスク,Walking Corpse Mask
しぐさ書・スライム,Slime Trick
ヒューザのこころ７,Hyuza's Heart Lv7
光とブレスの防ぎ方,Defend Light and Breath
アローンギフト・黒,Black Alone Gift
さいきょうのおとこ,Strong Man
ヴァンガードコート,Vanguard Coat
アシュレイの髪飾り,Ashley's Hairpin
いっかくウサギ・強,Vicious Bunicorn
おおきなリボン黒桃,Black/Pink Ribbon L
悪夢より来たるもの,The One From Nightmares
クリームつむりの像,Cream Slime Statue
灰ねこシャンデリア,Ash Cat Chandelier
セクシーギフト・黒,Black Sexy Gift
王者のマントセット,Sovereign's Armor Set
漆黒魔獣ナイダーク,Black Magic Beast Nydark
オーシャンキャンプ,Ocean Camp
ひかりのタクトの本,Glow Stick Book
ゴレオン将軍メダル,Goreham-Hogg Medal
ミラージュウィング,Mirage Wings
スノースターリボン,Snowstar Ribbon
ラッキーキャンディ,Lucky Lollipop
しましまマフラー青,Blue Striped Scarf
スノーガラスドーム,Snow Glass Dome
紅殻魔スコルパイド,Scorpide, the Crimson Carapace
ハクオウのこころ２,Hakuo's Heart Lv2
ホーリークリスタル,Holy Crystal
オブジェクト座標087,Object Coordinates 087
タータンマフラー赤,Red Tartan Scarf
異国の寺院の庭用床,Exotic Temple Floor (G)
ムーンバニーブーツ,Moon Bunny Boots
トポルのクラムパイ,Topol Crumb Pie
モチつき「つき手」,Pound Mochi "Pounder"
だいまどうのうでわ,Great Mage Bracelets
お菓子の国のお化け,Candy Country Ghost
ギュッとリィンの箱,Lynn Arm Doll Box
白柴クールカプセル,Cool White Shiba Toy
ポーンのピース・黒,Black Pawn Piece
キラパン白プリズム,White Sabrecat Prism
