レジェンズサイズ,Legends Scythe
フサフサの白ヒゲ,Fluffy White Mustache
木工素材屋ミヅキ,Woodworking Materials Mizuki
レシピ屋ペリンタ,Recipe Shop Perinta
破戒王ベルムド影,Shade of Bermud
ネレウスバスター,Nereus Buster
凶禍のフラウソン,Flauson the Wicked
シスター・リーリ,Sister Leely
我らは自然と共に,We Are With Nature
エンゼルスタッフ,Angel Staff
勇気の輝石交換券,Courage Augite Coupon
ブラックコンドル,Black Buzzard
トライバルトップ,Tribal Top
エンゼルウィップ,Angel Whip
テラシナーラの像,Bulbergine Statue
氷のシャンデリア,Ice Chandelier
ひまわりプリズム,Sunflower Prism
まよえるまるこす,Lost Marcos
ミラクルブースト,Hurt Converter
バカン山道への道,Road to Bakan Mountain Pass
ハヤブサ観察日記,Falcon Watcher's Diary
ふわふわクマノミ,Floaty Clownfish
大地の竜玉の破片,Earthwyrm's Eye Shard
ホイミントブーツ,Heal Mint Boots
シックゴスブーツ,Chic Goth Boots
ハロウィンメイン,Halloween Mein
白ゴシック柄の柱,White Gothic Pillar
丸窓つきの和風壁,Japanese Round Window Wall
ジングルモーモン,Jingly Sanguini
極天女帝プリズム,Sky Empress Prism
人形師のアトリエ,Dollmaker's Workshop
スイーツトロル強,Apex Sweet Troll
鉱石の燭台ランプ,Ore Candlestick lamp
しゃしょうばぎー,Conductor Bagy
トリットアーチズ,Trit Arches
初期プクリポ女性,Initial Pukulipo Female
ドラけしシャワー,Eraser Shower
ワンダークリーム,Wonder Cream
闇指揮者デリゲン,Dark Conductor Derigen
デュエルキャップ,Duel Cap
三闘士のハンマー,Hammer of the Triad
バトルシェイカー,Maracaraider
カプサイシューズ,Capsai Shoes
おもちゃの池・雪,Toy Pond (Snow)
木製ハニータンス,Wooden Honey Wardrobe
カンフーパンプス,Kung Fu Pumps
しぐさ書・ナイス,Nice
便せん屋キキョウ,Stationery Shop Kikyo
戦神の箱＋５・改,War Deity Box +5 v2
ミニュアデスの盾,Minyades Shield
検証用家具１０２,Verification Decor 102
メロンのチェスト,Melon Chest
くさりかたびら下,Chain Mail Bottom
荘厳な紋付はかま,Solemn Crest Hakama
３０分キャンドル,30 Minute Candle
太陽と月のアーチ,Sun and Moon Arch
アイドルスーツ下,Idol Pants
ラピスぬいぐるみ,Lapis Plushie
せんすいふくあお,Blue Diving Suit
世界樹のグリーブ,Yggdrasil Greaves
王軍師のグローブ,Royal Soldier Gloves
チューニングキー,Tuning Key
かいぞくウーパー,Salamarauder
預かり所シャルギ,Storage Shargi
展望台へのはしご,Lookout Ladder
ガズバランの牙Ｂ,Gazbalan's Fang B
白バラのチェスト,White Rose Chest
モッズヘッドホン,Mod Headphones
奇跡の木工刀の本,Miracle Slick Book
ダーマ神殿の壁泉,Alltrades Wall Fountain
若き彫刻家の才能,Young Sculptor's Talent
タコメッＴシャツ,Octopot T-Shirt
ホーリーローブ下,Holy Robe Bottom
パピリオアーマー,Papilio Armor
ハンタースーツ下,Hunter Suit Bottom
レースの観客２１,Race Spectator 21
ぴえろいしょうⅠ,Clown Costume Ⅰ
デリシャスオイル,Delicious Oil
帽子係アンジュー,Hat Clerk Anju
道具屋プティット,Item Shop Petit
ＦＦＸＩＶ２印章,FF XIV 2 Stamps
世界一クイック伝,World's Quickest Legend
イエローファット,Grand Yellow Belly
人面樹ぬいぐるみ,Treeface Plushie
星夜の長てぶくろ,Starry Night Long Gloves
スマートチェスト,Smart Chest
知の試練・第２層,Wisdom Trials - L2
しびれくらげ０１,Man o' War 01
蒼穹兵団のかぶと,Azure Corps Helmet
フォステイル広場,Fostail Square
パニガルム探査券,Panigalm Explore Ticket
郵便配達人バイグ,Mailman Baigu
ゴスバニーパンツ,Goth Bunny Pants
ファータグローブ,Fata Gloves
しぐさ書・お弁当,Lunch Box
ぶれいくすたいる,Break Style
タンクハンバーグ,Tank Hamburger
奇跡のフライパン,Miracle Frypan
聖王の大剣の壁画,Dryspell Blade Book
打ち上げ花火・橙,Fireworks Launcher (O)
交換屋フォーリィ,Exchange Shop Foley
郵便局員サユサラ,Postman Sayusara
プクリポソファ大,Pukulipo Sofa L
レース屋ヒキシオ,Race Registrar Hikishio
サバ太猫カプセル,Fat Gray Cat Toy
シスター・ラクト,Sister Lakuto
しびれくらげ２１,Man o' War 21
よろず屋ミガンス,General Shop Migans
ルシェンダの武器,Lushenda's Weapon
トロルバッコス強,Apex Gladiator Troll
クリスマスの暖炉,Christmas Fireplace
ほうおうのおうぎ,Phoenix Fan
ガブリエルのやり,Gabriel's Spear
預かり所ペイジー,Storage Page
スマートテーブル,Smart Table
ショッパーバッグ,Shopping Bag
シスター・カレン,Sister Karen
グレートハンマー,Great Hammer
天界のあるきかた,How to Walk the Heavens
れくたりすせっと,Lectalis' Outfit
ダイコンのタンス,Daikon Wardrobe
素材屋・コイン屋,Material Shop/Coin Shop
黒岩削り出しの壁,Black Rock Wall
レーザーユニット,Laser Unit
ケキちゃんハウス,Cakey House
エルフテーブル小,Elf Table S
サメきぐるみ・赤,Red Sharksuit
プチビッグな香水,Big Perfume S
ゴシックコート下,Gothic Coat Bottom
ブリキパイプの柱,Tin Plate Pipe Pillar
王国の見張り塔前,Kingdom Watchtower
商人たちのテント,Merchants' Tents
矢文のポスト・青,Blue Arrow Mailbox
スライム柄コタツ,Slime Kotatsu
ウェディのリスト,Weddie Bracers
出張購買員ポレロ,Team Supplier Polero
便せん屋ウィット,Stationery Shop Uito
壁かけ吊るし食材,Wall Hanging Food
中型の球体水そう,Spherical Aquarium M
討伐隊員ポッカラ,Strike Force Pokkara
ネコ姫の間仕切り,Cat Princess Partition
古強者のよろい上,Veteran's Cuirass
野いちごブラウス,Wild Strawberry Blouse
赤組のたいそう着,Red Team Track Suit
黒猫のスウェット,Black Cat Sweatshirt
レースの観客１２,Race Spectator 12
Ｖロンの本棚・赤,Red Vron Bookshelf
2015/2月分クエスト,Quest for 2015/02
知の試練・第３層,Wisdom Trials - L3
赤いエクササイズ,Red Exercise
武神の道着セット,War God Outfit
配達員パッテーラ,Deliverer Patella
チョコっとスーツ,Choco Suit
しびれくらげ１０,Man o' War 10
オーロラカメリア,Aurora Camellia
ブラックベジター,Scourgette
ツンドラハンマー,Tundra Hammer
夢と魔法のタクト,Dream and Magic Wand
スキップ係オウカ,Skipper Ouka
ウェスタンブーツ,Western Boots
おみくじボックス,Fortune Box
魔人の勲章の破片,Ruin's Medal Shard
フラワーギフト券,Flower Gift Voucher
トキワアカネの花,Red Ibis Flowers
ラーヴァドラゴン,Lava Hydra
みかわしオムレツ,Evasion Omelet
聖守護者のつるぎ,Sentinel's Sword
オーグリード大陸,Ogreed
縁日のお面屋さん,Festival Mask Shop
サイドヘアリボン,Side Hair Ribbons
紹介人ウェダガン,Introducer Wedgan
代理人ジェイダー,Agent Jayda
宿屋ナイトグッド,Innkeeper Nightgood
牡丹文のふりそで,Peony Kimono
子供の家ペコリア,Child House Pekoria
﻿ステージ管理人,Stage Manager
スライム帽子・白,White Slime Hat
かんだたげんすい,Robbin' 'Ood Marshal
手作りのロザリオ,Handmade Rosary
帝国三将軍カード,Triumgorate Card
東洋風飾り棚・雅,Chic Orient Shelf
昏冥庫パニガルム,Panigalm's Abyss Vault
シルエット・建物,Silhouette Building
シーサイドハウス,Seaside House
りゅうおうクロー,True Dragonlord Claws
ガタラ原野の木Ａ,Gatara Fields Tree A
拳聖の道着セット,Fist Saint Outfit
しぐさ書・天灯白,White Lantern
ヒュプノスハント,Persecutter
フォン・バルディ,Von Baldi
クラシカルハット,Classical Hat
ポケットねぶくろ,Pocket Sleeping Bag
タイタス号のタル,Titus Barrel
バルディアメタル,Valdia Metal
魔塔銀行屋ボクス,Tower Banker Bokks
クレセントダガー,Crescent Dagger
カンフードレス上,Kung Fu Dress Top
封じられた洞くつ,Sealed Cave
リィンカネ便せん,Re[in]carnation Paper
スライムの石の柱,Slime Stone Pillar
金平糖ライト・虹,Rainbow Candy Light
矢文のポスト・緑,Green Arrow Mailbox
オルストフの尻尾,Orstov's Tail
預かり所ガリュア,Storage Garua
守護天使の装束下,Guardian Angel Pants
銀河のかみかざり,Galaxy Hair Ornament
はやてのバンダナ,Agility Bandana
経験値の秘薬・小,Experience Elixir S
酒場主人のブレス,Tavernkeeper's Bangles
封印の守護者・右,Seal Guardian - Right
ケラコーナ原生林,Keracona Primeval
ウィリーデスピア,Vilide Spear
ダフィアのお守り,Daphea's Amulet
ファリネのチョコ,Farine's Chocolate
アサシングローブ,Assassin Gloves
シスター・リィト,Sister Lito
ホワイトパンサー,Silver Sabrecat
討伐隊員リャード,Strike Force Ryard
カムシカカプセル,Azlantelope Prism
寒鬼団長アレル樹,Cold Demon Tree Alleru
じごくのもんばん,Grim Keeper
シスター・マレレ,Sister Marelle
シャイニングボウ,Shining Shot
パンドラボックス,Pandora's Box
闇騎士のよろい下,Dark Knight Lower Armor
プラコン用編み物,Private Concierge Knitting
うらないしはっけ,F. Teller Hakke
デスマスグローブ,Death Master Gloves
ナナホシのおうぎ,Seven Star Fan
王国軍司令部の盾,Royal Army Shields
魔瘴狼イジャラン,Demoic Wolf Ijaran
盆踊りフウラ・庭,Festival Dance Fuura(G)
オーガのあいさつ,Ogre Greeting
手数を増やすコツ,Tips to Increase Moves
スプリングレザー,Spring Leather
スタンカのハンコ,Stanka's Stamp
まほうのよろい下,Magic Armor Bottom
塔のガーディアン,Tower Guardian
アンテイクトーク,Antique Toque
しびれくらげ２３,Man o' War 23
おすもっこりの像,Sumo Baby Statue
銀の錬金ランプ小,Silver Lamp S
ワンピースギフト,One-piece Gift
案内係エリーシェ,Guide Elishe
シルバーアックス,Silver Axe
ダイヤココナッツ,Diamond Coconut
天空のオルゴール,Zenithia Music Box
占い侍女ピクシス,Fortune Teller Maid Pixy
ハリケーンエッジ,Blusterang
初期ドワーフ女性,Initial Dwarf Female
究明者のコート下,Research Coat Bottom
シスター・レレノ,Sister Releno
便せん屋タマズサ,Stationery Shop Tamazusa
こげ茶猫カプセル,Olive Cat Toy
ガンコ職人の息子,A Stubborn Craftsman's Son
シマ柄のじんべい,Striped Jinbei
多勢賞トロフィー,Great Numbers Trophy
スクールブレザー,School Blazer
エナジーパウダー,Energy Powder
フラウスブレード,Flaus Blade
ゴーストプリズム,Ghost Prism
ごちそうターキー,Feast Turkey
ウィキッドヘルム,Wicked Helm
砂の都のテーブル,Sand City Table
ドラゴンステップ,Dragon Step
パペットマンの書,Magic Marionette Book
レクスルクスの楔,Lexlux Link
五大陸のモビール,Five Continents Mobile
魚交換員ピペッタ,Fish Exchange Pipetta
マイタウン権利証,My Town Deed
暗殺教本・毒殺編,The Poison Assassin
てくてくスライム,Slime Knight
ダンサーシューズ,Dance Shoes
手本書・たこ焼き,Takoyaki Manual
射手の服のレシピ,Archer Outfit Recipe
男性プラコン服白,White Clothes (M)
懐かしのゲーム機,Nostalgic Game Console
ティンクルバトン,Twirl Baton
証人ラディスオー,Keen Ladis
蒼天のソウラ印章,Souten no Soura Stamps
モグふわベビタン,Fluffy Chef Imp
じゃんけんチョキ,Scissors
マポレーナ便せん,Genie Sanguini Paper
シンイのこころ３,Shini's Heart Lv3
さらりとした樹液,Smooth Sap
花柄モダンはかま,Modern Floral Hakama
さいほう作業着上,Sewer's Clothes
魔物管理人スメメ,Monster Manager Sumeme
南の渡し守ハーリ,South Ferryman Hari
お菓子のチェスト,Sweet Chest
古グランゼドーラ,Old Gran Zedora
シンイのこころ７,Shini's Heart Lv7
フロートプラント,Floating Plant
サイドワインダー,Sidewinder
エネルギー体・小,Small Energy Body
パンジーのズボン,Pansy Pants
ふくめんうさぎ２,Masked Rabbit 2
時の化身クルッチ,Ickle the Tockle
パルカラス亡霊王,Ghost King Palkaras
やいばのグリーブ,Spiked Greaves
ナブレットソファ,Nablette Sofa
ほのおのよろい下,Flame Armor Bottom
ウルタ皇女の部屋,Princess Ulta's Room
ファントムダガー,Phantom Dagger
セラフィムのやり,Seraph's Spear
指先で触れる世界,World at Your Fingertips
黒猫のブーメラン,Black Cat Boomerang
ピクニックグリエ,Grei Picnic
シスター・ミペカ,Sister Mipeka
ユーススニーカー,Youth Sneakers
けんぽうぎセット,Tussler's Outfit
ダル・ジャムール,Dar Jamal
ストームフォース,Gale Fource
マーメイドトップ,Mermaid Top
ふわふわドラキー,Floaty Dracky
ハロふわホイミン,Halloween Healie
ハロウィン投影機,Halloween Projector
しぐさ書・天灯桃,Pink Lantern
しょうにんまっか,Merchant Macca
植物学者の鉢植え,Botanist Plant Pot
スイカのイス・黄,Yellow Watermelon Chair
ビジューな足ヒレ,Bijou Flippers
プチヒドラカード,Frail Hydra Card
りゅうおうの背景,True Dragonlord
禁忌の幻影神・戒,Precepting Phantom
魔物管理人オリー,Monster Manager Ori
ツボ錬金職人頭巾,Pot Alchemist's Cap
バンデッドボトム,Brigand's Bottom
求道者のてぶくろ,Seeker's Gloves
フリーズクランチ,Freeze Crunch
案内係ピューリィ,Guide Pury
壁かけＤＱⅢの絵,DQⅢ Painting
チャンスコマンド,Chance command
ラグアスキッチン,Raguas Kitchen
めろでぃあせっと,Melody Outfit
たけやりへいの書,Bambooligan Book
サメきぐるみ・桃,Pink Sharksuit
はぐれメタルの像,Liquid Metal Statue
あやしいチェスト,Suspicious Chest
武器鍛冶グローブ,Weaponsmith's Gloves
シルエット・庭草,Silhouette Grass (G)
ふかふかなキノコ,Soft Mushroom
エドアルドの人形,Eduardo's Doll
ランドインパクト,Crackerwhack
転送係エグバート,Transfer Agent Egbert
星降りのローブ上,Starry Robe Top
紅竜の兄弟の写真,Red Dragon Brothers Photo
ポセイドンソファ,Poseidon Sofa
本読みヒストリカ,Book Reading Historica
超暴走魔法陣・零,Uber Ring of Ruin
アインスリッター,Eins Ritter
１段ブロック・赤,Red Block
赤眼のギガンテス,Red-Eyed Gigantes
ジーガンフの写真,Jiganf Photo
ももんじゃケープ,Platypunk Cape
アスフェルド光章,Asfeld Medal
ふわふわ人魂・黄,Floaty Gold Wisp
ふわふわベビタン,Floaty Imp
初心者用のおうぎ,Beginner's Fan
アリアハンマント,Aliahan Cape
お好み焼き屋コン,Pancake Shop Kon
魔物管理人ジラー,Monster Manager Jira
フカき海の底で２,Bottom of Shark Sea 2
ドワーフの便せん,Dwarf Paper
ヴォイドアンカー,Anchor of Rancour
ディバインソード,Divine Sword
あたまリボン桃券,Pink Head Ribbon Ticket
魔法使いのブーツ,Mage Boots
うろこのよろい上,Scale Armor
お宝の写真ケース,Treasure Photo Case
鎧竜のトロフィー,Training Dragon Trophy
ガーデンシャワー,Garden Shower
ギガデンデロベー,Giga Dendelobe
悪神の心域２印章,Heartlands 2 Stamps
せんすいふくあか,Red Diving Suit
リンカのグローブ,Linka's Gloves
スイートランタン,Sweet Lantern
魔導将軍のゆびわ,Mage General Ring
じごくのおくり火,Lava Lampling
紫イモのテーブル,Purple Yam Table
リュートを奏でる,Play Lute
シィジャン兵士長,Captain Shijan
預かり所サクニナ,Storage Sakunina
討伐隊員ロナール,Strike Force Ronal
ヒョウモンダーク,Dark Octopot
ショックをうける,Received Shock
丸型のトピアリー,Round Topiary
釣り用ダミー宝箱,Fishing Treasure Chest
スイートウィッグ,Sweet Wig
あこがれの盗賊王,Longing for a Thief King
エナジーフォール,Magic Blast
王城の悪夢・２階,Nightmare's Castle 2F
ジュアロとゾデラ,Juaro and Zodera
神獣パチャティカ,Divine Beast Pachatika
ノクゼリアナイフ,Noxeria Knife
ヴァイパーブーツ,Viper Boots
たいようのおどり,Sun Dance
勇者姫アンルシア,Hero Anlucia
フォーリオンの空,Skies of Fourion
ザード遺跡への道,Road to Zard Ruins
執行者ジブアジブ,Enforcer Jib-ajib
アルゴンズポーチ,Argon Pouch
ガズバランの牙Ａ,Gazbalan's Fang A
もぐらのスコップ,Mischievous Mole Shovel
コポのポーチの箱,Kopo Pouch Box
紫水晶のオーブン,Amethyst Oven
ぎょうじゃのこん,Ascetic Rod
観戦案内ヴェルト,Watch Guide Velt
壁かけ紋章旗・盾,Shield Wall Banner
名探偵のシューズ,Sleuth's Shoes
DQ3賢者女　ゾーマ,DQ3 Sage (F), Zoma
人狼ウォルマード,Werewolf Wolmad
ドラゴン花火・青,Blue Dragon Firework
実行委員リーベル,Executive Committee Ribel
預かり所ボラデュ,Storage Boradu
あったかセラフィ,Warm Seraphi
毒竜討伐隊の記録,Serpentscale Skean Book
黒衣の剣士パドレ,Dark Swordsman Padre
イブニングコート,Evening Coat
モーモンのゆかた,Teeny Sanguini Yukata
ハロウィンタンス,Halloween Wardrobe
ギュッとソーミャ,Somya Arm Doll
ふわふわペコリア,Floaty Pekoria
デッドリーソード,Deadly Sword
みやびな打ち掛け,Elegant Wedding Kimono
ボーンのこんぼう,Zombie Gladiator Club
ウェディ秘書モブ,Weddie Secretary Mob
しょうにんぼちぼ,Merchant Bochi
モーモンの便せん,Teeny Sanguini Paper
フットライト・庭,Footlight (G)
禁忌の幻影神・封,Sealing Phantom
プラチナエンゼル,Platinum Angel
赤い屋根の家の壁,Red Roof House Wall
バルディスタ歩兵,Valdista Foot Soldier
聖王のオノの壁画,Dryspell Axe Book
ねこまどう便せん,Meowgician Paper
荘厳な竜のはかま,Majestic Dragon Hakama
ドラゴン花火・黄,Yellow Dragon Firework
しぐさ書・うちわ,Wave Fan
決めポーズ右前列,Decisive Pose R Front
魔天殻レメゲノン,Sky Shell Remegenon
ヤーン　涙の鉄拳,Yarn, Iron Fist of Tears
ステラトルネード,Stella Tornado
ツイストサイダー,Twist Cider
さめきぐるみきん,Gold Shark Suit
ゴスバニーブーツ,Goth Bunny Boots
決めポーズ左前列,Decisive Pose L Front
アルミラージの像,Spiked Hare Statue
白亜の博物館の塀,Chalk Museum Fence
忘我のシシカバブ,Forgetful Shish Kebab
モダンなあごヒゲ,Modern Beard
ゴクラクギョ・白,White Betta
アドミラルハット,Admiral's Hat
星空のタンス・紫,Purple Starry Wardrobe
モンスター討伐隊,Monster Strike Force
プリプリぎんなん,Plump Gingko Nut
竜のうろこの破片,Dragon Scale Shard
女神ルティアナ像,Lutiana Statue
ソポスのサンダル,Sophos Sandals
はかなき星に光を,Light on a Fleeting Star
しょうかんスキル,Summoning skill
サメきぐるみ・金,Gold Sharksuit
ダイナートップス,Diner Top
踊り子と願いごと,A Dancer and a Wish
小さな陶器の破片,Small Pottery Shard
ようがんのカケラ,Lava Lump
ギガモーモリーナ,Giga Sanguilina
シーサイドランプ,Seaside Lamp
クリスタルクロー,Crystal Claws
メンメ式万能パテ,Menme All-Purpose Putty
第１２回ラウル像,12th Rahul Statue
ローヌ樹林帯の草,Rhone Woodlands Grass
住宅素材屋ハクヒ,Housing Materials Hakuhi
ヤバい宝石の包み,Dangerous Gem Package
迅雷の丘への出口,Exit to Thundering Hills
預かり所ティーチ,Storage Tichi
マリン調の食器棚,Marine Cupboard
シトリンの足飾り,Citrine Anklet
ジュレー島の木Ｂ,Jule Island Tree B
赤い金魚と金魚鉢,Red Goldfish in Bowl
てんとうスカラベ,Spotted Scarab
氷の領界の丸イス,Ice Realm Round Chair
パピヨンウィング,Papillon Wings
ドルタムの念晶鏡,Doltam's Telecrystal Mirror
サンゴ礁かきわり,Coral Reef Backdrop
ドラキーの便せん,Dracky Paper
東洋風ベッド・雅,Chic Orient Bed
スカウトアタック,Scout Strike
天馬ファルシオン,Falchion
プチ伝説の三悪魔,Frail Legendary Evils
花びらチャーム桃,Pink Petal Charm
ヤドカシの像・庭,Draginn Statue (G)
出張大使ポミリン,Ambassador Pomirin
まもの使いの前進,Monster Master Growth
フラワーサンダル,Flower Sandals
魔改造クリムゾン,Modified Crimson
ゲノミーキャップ,Crankiid Cap
朽ちた遺跡の寝台,Ruin Bed
魚交換員ピッチョ,Fish Exchange Picho
ズワイガニファン,Snow Crab Fan
カジノレイド祭り,Casino Raid Festival
新兵支給むねあて,Recruit Breastplate
アワードキャップ,Award Cap
冷眠室ペコリアＣ,Cryogenics Pekoria C
東洋風ランプ・華,Floral Orient Hung Lamp
シックゴスセット,Chic Goth Outfit
男性金魚のゆかた,Men's Goldfish Yukata
グレイトライドン,Night Rider
奇門遁甲の式・参,3rd Divination Ceremony
超鍛冶ハンマー小,Super Hammer S
Ⅲ‐ディアノーグ,Ⅲ‐Diamagon
ガタラ原野の木Ｃ,Gatara Fields Tree C
白木のテーブル大,Plain Table L
攻城隊長ガンザン,Siege Captain Ganzan
プチゴレオン将軍,Frail Goreham-Hogg
プクラスの研究室,Pukulas' Laboratory
求道者のはちまき,Seeker's Headband
ガートラント兵３,Gartlant Soldier 3
出張購買員サシモ,Team Supplier Sashim
暗黒大樹のふもと,Foot of the Dark Tree
スレア海岸の大樹,Surea Coast Large Tree
郵便局員ツィサア,Postman Tsisa
預かり所スピーラ,Storage Spira
ドミネウスの部屋,Domineus' Room
メギストリス紫花,Megistris Flowers
ロードリーブーツ,Lordly Boots
魔法学園のブーツ,Magic Student Boots
ボスコイン優待券,Free Boss Coin Coupon
便せん屋ペコリア,Stationery Shop Pekoria
アビスセーラー上,Abyss Shirt
結界の守護者たち,Guardians of the Barrier
壁かけ管理棟の窓,Admin Building Window
プチデビル衣装券,Petit Devil Voucher
忘れられし王の間,Forgotten King's Room
グレモリーの紋章,Gremory Crest
清涼スイムワンピ,Cool Swim Dress
りんねの大盾の書,Big Brain Drainer Book
ガーデンスーツ下,Garden Suit Bottom
よろず屋ポナック,General Shop Ponak
女学生のブレザー,Schoolgirl Blazer
さとりのかんむり,Crown of Clarity
死せる結晶の荒野,Dead Crystal Desert
水槽アイテム１０,Aquarium Item 10
マジカルチケット,Magical Ticket
郵便局員マドゥン,Postman Madun
りゅうぐう王・塔,Tower Nessicure
ファンキーリスト,Funky Wristbands
ぬかどこスライム,Mouldy Slime
便せん屋ウツセミ,Stationery Shop Utsusemi
バラの刈り取り方,How to Cut Roses
ハンギングベッド,Hanging Bed
ボルカノハンマー,Volcano Hammer
ドラグーンソード,Dragoon Sword
かなしきだみあん,Sad Damien
手編みのシューズ,Hand-Knit Boots
参の五声は言の声,Third of 5 Voices Speak
案内係ラファーヌ,Guide Rafane
ファフニルブーツ,Fafnir Boots
天ツ風の原への道,Road to Howling Highlands
エテーネのつばさ,Ethene Wing
アンフィスバエナ,Amphisbaena
ギガンテス便せん,Gigantes Paper
あおざいいしょう,Ao Dai Outfit
売り子パナッピュ,Vendor Panapyu
ぶっちズキーニャ,Zumeanie
和風の５色ランプ,Japanese 5 Color Lamp
プクリポソファ小,Pukulipo Sofa S
みずたまドラゴン,Polka Dot Dragon
シナイジッチたち,Sinazitch and co.
フワフワわたアメ,Fluffy Cotton Candy
よろい武者の置物,Armor Warrior Ornament
破壊神フォロボス,Tyrannosaurus Wrecks
陽の試練壱・陽炎,Yang Trial I - Yang Haze
アンタッチャブル,Untouchable
水のサークレット,Flowing Circlet
攻撃時25%でぶきみ,Spooky Aura Attack 25%
よろず屋カエマン,General Shop Kaeman
みかがみの盾の本,Silver Shield Book
バンデッドブーツ,Brigand's Boots
先制攻撃率アップ,First Strike Rate Up
リゾートかきわり,Resort Backdrop
エネルギー誘導球,Energy Guide Sphere
女性花柄のゆかた,Women's Floral Yukata
預かり所ボルリラ,Storage Borrilla
テレパスタイツⅠ,Telepath Tights Ⅰ
武器屋ボーディス,Weapon Shop Bodis
ハイキングブーツ,Hiking Boots
トラキーの像・庭,Tracky Statue (G)
壁かけＤＱⅥの絵,DQⅥ Painting
ウサギパーカー上,Rabbit Hoodie
クルーガーハット,Kluger Hat
パニックキャノン,Gone Ballistic
イカ焼きプリズム,Fried Squid Prism
デバフクリスタル,Debuff Crystal
大魔王のグローブ,Demon Lord's Gloves
ライダーススーツ,Riders Suit
第９回カミルの像,9th Kamil Statue
灰ねこの便利な壁,Ash Cat Wall
まっちゃガーベラ,Matcha Gerbera
第１１回ケイト像,11th Kate Statue
木工刀よりも鋭く,Sharp Woodworking Knife
アイアンウィング,Flyin' Iron
ジャックのカード,Jack Card
旅芸人の衣装上２,Minstrel Shirt 2
プク姫様つきの畑,Puku Princess Field
ブロブフィッシュ,Blobfish
ゴールドシャワー,Gold Rush
便せん屋ヒキワリ,Stationery Shop Hikiwari
コルセアバンダナ,Corsair Bandana
しぐさ書・ねる２,Sleep 2
初任務はモリナラ,Molinara First Mission
夕焼け雲のベッド,Sunset Cloud Bed
剣王ガルドリオン,Sword King Gardlion
水玉模様のはかま,Polka Dot Hakama
ドリームチケット,Dream Ticket
アルテミスの恵み,Artemis' Blessing
代理人グラドマン,Agent Gladman
しぐさリスト選択,Emote List
