アルファ用アルウェ王妃の別荘跡(子供たちの隠れ家内部Test),Queen Alwe's Villa Ruins for Alpha (Test Inside Children's Hideout)
バトル班用テストマップ（いにしえのゼルメア）,Team Battle Map Test (Ancient Zelmea)
どらごんくえすとえいとしゅじんこうのいしょう,DQⅧ Hero Costume
このマップは モンスターから逃げられません。,You can't run from monsters on this map.
　　　～モンスター討伐隊隊員からの依頼～,         Monster Strike Force Request
マッチングテストステージ（同期テスト用）,Match test stage (for sync testing)
マッチングテストステージ（同期後移動用）,Match test stage (for moving beat testing)
グランゼドーラ領-グランゼドーラ王国 入口,Gran Zedora Territory - Gran Zedora Kingdom Entry
リャナ荒涼地帯-ねじれたる異形の大地 入口,Lyana Desolate - Twisted Terrane Entry
アラハギーロ地方-アラハギーロ王国 入口,Al-Ahagiro Region - Kingdom of Al-Ahagiro Entry
メルサンディ穀倉帯-メルサンディ村 入口,Melsandy Millfields - Melsandy Village Entry
メルサンディ穀倉帯-こもれびの広場 入口,Melsandy Millfields - Sunbeam Square Entry
必殺チャージ時 バイキルトとピオラ2段階,Oomphle & Accelerate x2 On Special
メルサンディ穀倉帯-さびれたほこら 入口,Melsandy Millfields - Deserted Shrine Entry
アラハギーロ地方-モンスター格闘場 入口,Al-Ahagiro Region - Monster Arena Entry
こうげき力上昇時 特技のダメージ +20<ban>,Skill Dmg. +20 When Attack ↑ (PvP×)
ぷらこんだんせいようそくたいむらさき,Purple Ceremony Gown
バトル班用テストマップ（ムスト廃墟）,Team Battle Map Test (Musuto Ruins)
季節イベント「オ月見」　コンパニオン,Seasonal Event "Moon View" Companion
季節イベント「お月見」　コンパニオン,Seasonal Event "Moon View" Companion
メルサンディ穀倉帯-メルン水車郷 入口,Melsandy Millfields - Melun Watermill Entry
アラハギーロ地方-日除けのほら穴 入口,Al-Ahagiro Region - Sunshade Cave Entry
アラハギーロ地方-ムルードの岩山 入口,Al-Ahagiro Region - Murudo Mountain Entry
ルファ神殿エントランス（オープン）,Rufa Temple - Entry (Open)
ぷらこんだんせいようそくたいみどり,Green Ceremony Gown
ぷらこんすくーるせいふくおんなちゃ,Brown School Uniform (F)
ぷらこんすくーるせいふくおとこしろ,White School Uniform (M)
ぷらこんすくーるせいふくおとこあか,Red School Uniform (M)
ぷらこんすくーるせいふくおんなしろ,White School Uniform (F)
ぷらこんすくーるせいふくおんなあか,Red School Uniform (F)
ぷらこんすくーるせいふくおんなこん,Blue School Uniform (F)
ぷらこんすくーるせいふくおとこくろ,Black School Uniform (M)
ぷらこんすくーるせいふくおとこちゃ,Brown School Uniform (M)
ぷらこんすくーるせいふくおんなくろ,Black School Uniform (F)
神代過ぎ～　春の桜よ　無為に咲く～,Past ages divine, the spring blossoms bloom, waiting idly by...
ぷらこんすくーるせいふくおとここん,Blue School Uniform (M)
しかし　持ち物が　いっぱいだった！,But you're carrying too many things!
受けた属性ダメージの 10%ＨＰ回復<ban>,10% Attribute Damage Taken As HP (PvP×)
コニウェア平原-ココラタの浜辺 入口,Coniware Plain - Cocolata Beach Entry
アルファ用井戸(ダンダダ団のアジト),Well for Alpha (Robbin' 'Ood Gang HQ)
リャナ荒涼地帯-ソーラリア峡谷 入口,Lyana Desolate - Solaria Canyon Entry
バトル班用テストマップ(ツスクル）,Team Battle Map Test (Tsuskuru)
ぷらこんだんせいようみどりさんた,Green Men's Santa Suit
ぷらこんだんせいしのびのふくちゃ,Tea Men's Ninja Suit
足元エフェクト（おしおきアタック,Something Effect
ぷらこんだんせいしのびのふくあか,Red Men's Ninja Suit
だんせいぷらこんふくみすとぐれー,Mist Gray Clothes (M)
ぷらこんだんせいようそくたいちゃ,Tea Ceremony Gown
だんせいぷらこんふくだーくぐれー,Dark Gray Clothes (M)
プンスコのテーブル＆ティーセット,Punsuko's Table & Tea Set
ぷらこんじょせいしのびのふくあか,Red Women's Ninja Suit
じょせいぷらこんふくみっどないと,Midnight Clothes (F)
ぷらこんじょせいしのびのふくあお,Blue Women's Ninja Suit
だんせいぷらこんふくみっどないと,Midnight Clothes (M)
バトル班用テストマップ（獅子門）,Team Battle Map Test (Lion Gate)
エフェクトイメージさん（１０個）,Mr. Effect Image (10)
ぷらこんじょせいしのびのふくこん,Navy Women's Ninja Suit
ぷらこんだんせいしのびのふくくろ,Black Men's Ninja Suit
ぷらこんだんせいようそくたいあお,Blue Ceremony Gown
あすふぇるどがくえんがくせいふく,Asfeld Academy Uniform
ぷらこんじょせいみこふくむらさき,Purple Priestess Dress
ぷらこんだんせいようそくたいはい,Ash Ceremony Gown
じょせいぷらこんふくあいすぶるー,Ice Blue Clothes (F)
ぷらこんじょせいようみどりさんた,Green Women's Santa Suit
ぷらこんじょせいしのびのふくくろ,Black Women's Ninja Suit
ぷらこんじょせいむらさきふりそで,Purple Women's Kimono
ぷらこんだんせいしのびのふくこん,Navy Men's Ninja Suit
ぷらこんじょせいしのびのふくもも,Pink Women's Ninja Suit
ぷらこんだんせいしのびのふくあお,Blue Men's Ninja Suit
リンジャハル海岸-教会シスター 前,Linjahar Coast - Church Sister
必殺チャージ時 チャージ時間 -10秒,Charge Time -10 sec. On Special
マデ島＆エテーネ王宮（4.5CS専用）,Made Isle & Ethene Royal Manor (4.5CS only)
レビュール街道北-海風の洞くつ 前,Reviewle Highway North - Seabreeze Cave
リンジャハル海岸-リンジャの塔 前,Linjahar Coast - Linja Tower
セレドット山道-ベリルのほら穴 前,Celedot Mountain Pass - Beryl Den
プログラマー用負荷検証ステージ2,Loading Programmer Verification Stage 2
死亡時 50%でこうげき力上昇が残る,Undying Attack Boost 50%
プログラマー用負荷検証ステージ3,Loading Programmer Verification Stage 3
プログラマー用負荷検証ステージ4,Loading Programmer Verification Stage 4
追憶の世界-アルウェ王妃の別荘跡,World of Remembrance-The Ruins of Queen Alwe
プログラマー用負荷検証ステージ1,Loading Programmer Verification Stage 1
プログラマー用負荷検証ステージ5,Loading Programmer Verification Stage 5
\s\m\eは　カードを引いた。　→　,\s\m\e draws a card. → They draw the !
ぼうえいぐんのせいふくはいいろ,Gray Defense Force Suit
ぼうえいぐんのせいふくむらさき,Purple Defense Force Suit
ぷらこんじょせいようももさんた,Pink Women's Santa Suit
はなかりゅうどのころもむらさき,Purple Flower Hunter Outfit
ぷらこんだんせいようももさんた,Pink Men's Santa Suit
ハロウィンクイズ解答ウェディ６,Halloween Quiz Answer Weddie 6
豪魔将ベリンダ＆豪魔将ブレンダ,Generals Belinda & Brenda
壊れたアストルティアのコンパス,Broken Astoltia Compass
ぷらこんじょせいようしろさんた,White Women's Santa Suit
ゴリウスの怨霊＆魔道士キルギル,Gorius' Vengeance & Wizard Kirgyl
ぷらこんだんせいようあおあろは,Blue Men's Aloha
ぷらこんじょせいようあかあろは,Red Women's Aloha
ぷらこんじょせいようあかさんた,Red Women's Santa Suit
ぷらこんこどもようみずぎせっと,Children's Swimsuit
ぷらこんじょせいみこふくみどり,Green Priestess Dress
\s\m\eは　ダイスをふった。　→　,\s\m\e rolls a die. → !
ハロウィンクイズ解答ウェディ２,Halloween Quiz Answer Weddie 2
ぷらこんだんせいようしろさんた,White Men's Santa Suit
魔天の勇者＆聖夜の破壊者・闇組,Festive Hero & Holy Night Wrecker Dark Team
ぷらこんじょせいようしろあろは,White Women's Aloha
ぷらこんじょせいようくろさんた,Black Women's Santa Suit
ぷらこんじょせいようあおあろは,Blue Women's Aloha
魔天の勇者＆聖夜の破壊者・雪組,Festive Hero & Holy Night Wrecker Snow Team
ハロウィンクイズ解答ウェディ１,Halloween Quiz Answer Weddie 1
えるどなしんのしょうぞくせっと,Eldona's Outfit
ぷらこんだんせいようしろあろは,White Men's Aloha
ぷらこんじょせいようももあろは,Pink Women's Aloha
ハロウィンクイズ解答ウェディ３,Halloween Quiz Answer Weddie 3
ぷらこんだんせいようくろさんた,Black Men's Santa Suit
ぷらこんだんせいようももあろは,Pink Men's Aloha
ハロウィンクイズ解答ウェディ５,Halloween Quiz Answer Weddie 5
ハロウィンクイズ解答ウェディ７,Halloween Quiz Answer Weddie 7
ハロウィンクイズ解答ウェディ４,Halloween Quiz Answer Weddie 4
\s\m\eは　コインをなげた。　→　,\s\m\e flips a coin. → The coin lands on !
ぷらこんだんせいようあかさんた,Red Men's Santa Suit
じょせいぷらこんふくさんせっと,Sunset Clothes (F)
ぷらこんだんせいはかまむらさき,Purple Men's Hakama
扉は　かたく　閉ざされている。,The door is tightly closed.
30%の確率で受けたダメージ10%反射,30% Chance to Reflect 10% Damage
デフェル荒野-不思議の魔塔 入口,Defel Desert - Mysterious Tower Entry
セレドット山道-セレドの町 入口,Celedot Mountain Pass - Town of Celed Entry
ジャイラ密林-クドゥスの泉 入口,Jyra Jungle - Kudus Spring Entry
レビュール街道南-三門の関所 前,Reviewle Highway South - Three Way Gate
モンセロ温泉峡-中央のやぐら 前,Moncello Spring Gorge - Central Scaffold
リャナ荒涼地帯-滝を臨む集落 前,Lyana Desolate - Waterfall Village
両手剣の単体特技のダメージ +500,Single Target Greatsword Skills +500
ドラクロン山地-竜守りの小屋 前,Draklon Mountains - Dragon Guard's Hut
コニウェア平原-教会シスター 前,Coniware Plain - Church Sister
リャナ荒涼地帯-くずれた灯台 前,Lyana Desolate - Collapsed Lighthouse
会心と暴走時のダメージ +100<ban>,Critical/Haywire Damage +100 (PvP×)
テンション時のダメージ +100<ban>,Damage During Tension +100 (PvP×)
戦いで 魔物に狙われにくくなる,Less likely to be targeted in battle
こうげき魔力とかいふく魔力 +10,Magical Might/Mending +10
アルファ用追憶の世界 別荘跡編,World of Recollection for Alpha Villa Ruins
ムニエカの深層・隠し通路 入口,Munieka Depths - Secret Passage Entry
ぷらこんおんなぱんぷきんふく,Women's Pumpkin Clothes
ヴァレリアの仮面（割れる前）,Valeria's Unbroken Mask
ぷらこんじょせいようきあろは,Yellow Women's Aloha
ぷらこんじょせいしろふりそで,White Women's Kimono
ぷらこんだんせいようきあろは,Yellow Men's Aloha
はるかぜおうえんだんいしょう,Spring Cheer Team Outfit
ハロウィンクイズ解答エルフ４,Halloween Quiz Answer Elf 4
ぷらこんじょせいみこふくあか,Red Priestess Dress
ハロウィンクイズ解答エルフ５,Halloween Quiz Answer Elf 5
ぷらこんおとこどらきゅらふく,Men's Dracula Costume
ラダ・ガートたちに連絡を取る,Contact Lada Gart's Group
はなかりうどのころもむらさき,Purple Flower Hunter Outfit
ＤＱⅧしゅじんこうのいしょう,DQⅧ Hero Costume
巨人コアを守るジア・クトたち,Defenders of the Core
チームゆく年くる年　２０２２,Team New Year 2022
魔天の勇者＆キラークリスマス,Festive Hero & Christmas Killing Machine
ぷらこんじょせいあかふりそで,Red Women's Kimono
ぷらこんおんなどらきゅらふく,Women's Dracula Costume
魔人エンラージャ＆ムッチーノ,Enraja the Genie & Muccino
ぷらこんだんせいようあかろは,Red Men's Aloha
どるわーむけんきゅういんふく,Dolworm Research Suit
ぼうえいぐんのせいふくみどり,Green Defense Force Suit
フォークに刺さったパンケーキ,Pancakes Stuck in a Fork
チームゆく年くる年　２０１８,Team New Year 2018
ぷらこんおとこぱんぷきんふく,Men's Pumpkin Clothes
わかむしゃのかっちゅうせっと,Young Warrior Armor Set
ぷらこんじょせいみこふくあお,Blue Priestess Dress
ぷらこんじょせいくろふりそで,Black Women's Kimono
はなかりゅうどのころもみどり,Green Flower Hunter Outfit
ぷらこんきゅーぴっどむらさき,Purple Cupid
ぷらこんしゃわーよういしょう,Shower Outfit
行動時 5%でバイシオンとピオラ,Oomph & Accelerate On Action 5%
集合ギミック / 全体エフェクト,Some gimmick or effect idk
攻撃時10%で会心と暴走率アップ,Critical/Haywire Boost Attack 10%
ぷらこんすいーとふくだいだい,Orange Sweet Clothes
ハロウィンクイズ解答エルフ１,Halloween Quiz Answer Elf 1
じょせいしらなみがらのゆかた,White Wave Yukata (F)
闇に唄う氷にまぎれし聖なる者,Frozen Sacred Singer
チームゆく年くる年　２０２５,Team Twenty Twenty Five
ハロウィンクイズ解答エルフ３,Halloween Quiz Answer Elf 3
チームゆく年くる年　２０１７,Team New Year 2017
行動時 5%でバイシオンとスカラ,Oomph & Buff On Action 5%
あすふぇるどがくえんなつふく,Asfeld Academy Summer Wear
だんせいしらなみがらのゆかた,White Wave Yukata (M)
あすふぇるどがくえんふゆふく,Asfeld Academy Winter Wear
ぷらこんじょせいみこふくもも,Pink Priestess Dress
ハロウィンクイズ解答エルフ６,Halloween Quiz Answer Elf 6
じょせいぷらこんふくむらさき,Purple Clothes (F)
チームゆく年くる年　２０２６,Team Twenty Twenty Six
ハロウィンクイズ解答エルフ２,Halloween Quiz Answer Elf 2
嵐魔ウェンリルとアクラガレナ,Wenrir the Storm & Akragarena
ハロウィンクイズ解答エルフ７,Halloween Quiz Answer Elf 7
チームゆく年くる年　２０２３,Team New Year 2023
チームゆく年くる年　２０１９,Team New Year 2019
行動時 7%でバイシオンとピオラ,Oomph & Accelerate On Action 7%
ぷらこんじょせいももふりそで,Pink Women's Kimono
チームゆく年くる年　２０２１,Team New Year 2021
チームゆく年くる年　２０２０,Team New Year 2020
チームゆく年くる年　２０２４,Team Twenty Twenty Four
グランゼドーラ領-見張り塔 前,Gran Zedora Territory - Watchtower Front
モンセロ温泉峡-北のやぐら 前,Moncello Spring Gorge - North Scaffold
モンセロ温泉峡-南のやぐら 前,Moncello Spring Gorge - South Scaffold
銃撃時2%でターンを消費しない,Free Turn When Shooting 2%
毒時にタナトスのダメージ +150,Vicitimiser to Poisoned Foes +150
モンセロ温泉峡-管理人小屋 前,Moncello Spring Gorge - Caretaker's Hut
ロヴォス高地-教会シスター 前,Rovos Highlands - Church Sister
コニウェア平原-三門の関所 前,Coniware Plain - Three Way Gate
デフェル荒野-ピラミッド 入口,Defel Desert - Pyramid Entry
デフェル荒野-教会シスター 前,Defel Desert - Church Sister
モンセロ温泉峡-ご神体の間 前,Moncello Spring Gorge - Hall of Worship
ジャイラ密林-大樹の根元 入口,Jyra Jungle - Big Tree Root Entry
攻撃時 5%でチャージ時間 -10秒,Charge Time -10 sec. Attack 5%
追憶の世界-キラキラ大風車塔,World Of Remembrance-Windmill Tower
行動時 5%でチャージ時間 -10秒,Charge Time -10 sec. On Action 5%
炎・土・闇属性のダメージ +5%,Fire & Earth & Dark Damage +5%
セレドット山道-滝見の吊り橋,Celedot Mountain Pass - Fallsview Bridge
リンジャハル海岸-高台の遺跡,Linjahar Coast - Hilltop Ruins
ドラゴンクエストＸショップ,Dragon Quest X Shop
女性プラコン服アイスブルー,Ice Blue Clothes (F)
ぷらこんだんせいはかまこん,Navy Blue Men's Hakama
ハロウィンクイズ解答オガ２,Halloween Quiz Answer Ogre 2
行動時 3%でテンションアップ,Tension On Action 3%
ぷらこんえんじぇるふくあか,Red Angel Clothes
ぷらこんおしゃれみずぎもも,Pink Snazzy Swimsuit
ぷらこんおしゃれみずぎしろ,White Snazzy Swimsuit
ぷらこんだんせいはかましろ,White Men's Hakama
キュロンイーターの巣への道,Path to Kyuroneater's Nest
らんぷれんきんれんしゅうぎ,Lamp Alchemy Training Wear
ハロウィンクイズ解答プク７,Halloween Quiz Answer Puku 7
ドルボ用マネキンニンゲン用,For Human Mannequin For Dolboard
未来への扉とまどろみの少女,The Door to the Future & the Slumbering Girl
ぷらこんえんじぇるふくもも,Pink Angel Clothes
ハロウィンクイズ解答オガ７,Halloween Quiz Answer Ogre 7
ハロウィンクイズ解答ヒト６,Halloween Quiz Answer Human 6
ぷらこんいけてるみずぎあお,Blue Cool Swimsuit
ぼうえいぐんのせいふくこん,Blue Defense Force Suit
ドルボ用マネキンドワーフ用,For Dwarf Mannequin For Dolboard
ハロウィンクイズ解答プク６,Halloween Quiz Answer Puku 6
ムストの町・教会跡への出口,Exit to Morst - Church Ruins
ハロウィンクイズ解答ドワ３,Halloween Quiz Answer Dwarf 3
古グランゼドーラ領への出口,Exit to Old Gran Zedora Territory
男性プラコン服ミストグレー,Mist Gray Clothes (M)
からすかぐらのしょうぞくⅠ,Crow Dance Costume Ⅰ
ドルボ用マネキンプクリポ用,For Pukulipo Mannequin For Dolboard
じょせいぷらこんふくえんじ,Red Clothes (F)
フラワーガーデン地区への道,Road to Flower Garden District
ハロウィンクイズ解答ヒト１,Halloween Quiz Answer Human 1
清き風吹き　草木は芽吹く～,Pure winds blown and trees grown, budding green as the breeze is thrown
ぷらこんぱてぃしえふくもも,Pink Pastry Chef Suit
ぷらこんえんじぇるふくあお,Blue Angel Clothes
ぷらこんおしゃれみずぎくろ,Black Snazzy Swimsuit
デスディオ暗黒荒原への出口,Exit to Deathdio Darklands
はなかりゅうどのころもあお,Blue Flower Hunter Outfit
男性プラコン服ミッドナイト,Midnight Clothes (M)
ハロウィンクイズ解答プク２,Halloween Quiz Answer Puku 2
必殺チャージ時 身かわし +10%,Dodge +10% On Special Charge
ハロウィンクイズ解答オガ６,Halloween Quiz Answer Ogre 6
ぷらこんぱてぃしえふくあお,Blue Pastry Chef Suit
アスフェルド学園男性用夏服,Asfeld Summer Uniform (M)
よわいこころ＆ずるいこころ,The Weak and Cunning Hearts
『ついてクンをひっこめる』,"Remove Pet"
ぼうえいぐんのせいふくあか,Red Defense Force Suit
3.0%でターンを消費しない<ban>,Free Turn 3% (PvP×)
ゆうべはおたのしみでしたね,Rooming with a Gamer Gal
ぷらこんだんせいはかまあお,Blue Men's Hakama
ハロウィンクイズ解答ドワ１,Halloween Quiz Answer Dwarf 1
ハロウィンクイズ解答ドワ７,Halloween Quiz Answer Dwarf 7
だんせいぷらこんふくえんじ,Red Clothes (M)
未完のドラクロン山地への道,Road to Undone Draklon Mountains
ぷらこんえんじぇるふくしろ,White Angel Clothes
ハロウィンクイズ解答ヒト５,Halloween Quiz Answer Human 5
ハロウィンクイズ解答プク４,Halloween Quiz Answer Puku 4
ランドン山脈山頂付近への道,Road to Landon Summit Area
未開のジャングル地区への道,Road to Savage Jungle
だるめしあんぼーいいしょう,Dalmatian Outfit (M)
はなかりうどのころもみどり,Green Flower Hunter Outfit
ぷらこんいけてるみずぎしろ,White Cool Swimsuit
ハロウィンクイズ解答ヒト３,Halloween Quiz Answer Human 3
ドルボ用マネキンウェディ用,For Weddie Mannequin For Dolboard
だるめしあんがーるいしょう,Dalmatian Outfit (F)
ルクスガルン大空洞への亀裂,Crevice to Luxgarn Caverns
2.0%でターンを消費しない<ban>,Free Turn 2% (PvP×)
ハロウィンクイズ解答プク１,Halloween Quiz Answer Puku 1
ハロウィンクイズ解答プク５,Halloween Quiz Answer Puku 5
ハロウィンクイズ解答ドワ４,Halloween Quiz Answer Dwarf 4
行動時 5%でテンションアップ,Tension On Action 5%
だんせいぷらこんふくぴんく,Pink Clothes (M)
ぼうえいぐんのせいふくきん,Gold Defense Force Suit
ぷらこんいけてるみずぎもも,Pink Cool Swimsuit
『おうちでついてクン設定』,"House Pet Settings"
男性プラコン服ダークグレー,Dark Gray Clothes (M)
戦闘中常時マホトラのころも,Magic Cloak Always Active
ぷらこんえんじぇるふくくろ,Black Angel Clothes
ハロウィンクイズ解答ヒト４,Halloween Quiz Answer Human 4
ハロウィンクイズ解答オガ３,Halloween Quiz Answer Ogre 3
ぷらこんぱてぃしえふくあか,Red Pastry Chef Suit
イア・タア　シンパッ・ケウ,E-yis, aneu dish cubrey
ぷらこんおしゃれみずぎあお,Blue Snazzy Swimsuit
ハロウィンクイズ解答オガ１,Halloween Quiz Answer Ogre 1
ハディン地下洞くつへの出口,Exit to Hadine Cavern
ぷらこんいけてるみずぎあか,Red Cool Swimsuit
ハロウィンクイズ解答ドワ２,Halloween Quiz Answer Dwarf 2
ぷらこんおしゃれみずぎあか,Red Snazzy Swimsuit
ぷらこんぱてぃしえふくしろ,White Pastry Chef Suit
ぷらこんだんせいはかまくろ,Black Men's Hakama
アスフェルド学園女性用夏服,Asfeld Summer Uniform (F)
ムストの町・風車へのはしご,Morst - Ladder to the Windmill
ハロウィンクイズ解答オガ４,Halloween Quiz Answer Ogre 4
ハロウィンクイズ解答プク３,Halloween Quiz Answer Puku 3
スターキメラから取った羽根,Cosmic Chimaera Feather
ぷらこんいけてるみずぎくろ,Black Cool Swimsuit
古レビュール街道北への出口,Exit to Old Reviewle Highway North
砂の都ファラザードへの出口,Exit to Farazard
とうばつたいこうほうきょく,Strike Force Bureau
アルムゴーグ＆ロムドゴーグ,Armogog & Romdogog
アスフェルド学園女性用水着,Asfeld Swimwear (F)
ハロウィンクイズ解答ヒト７,Halloween Quiz Answer Human 7
未完のモンセロ温泉峡への道,Road to Undone Moncello Spring Gorge
ハロウィンクイズ解答ドワ６,Halloween Quiz Answer Dwarf 6
ハロウィンクイズ解答ドワ５,Halloween Quiz Answer Dwarf 5
はなかりゅうどのころもあか,Red Flower Hunter Outfit
イルーシャのスケッチブック,Illusia's Sketchbook
ハロウィンクイズ解答ヒト２,Halloween Quiz Answer Human 2
魔物商人＆商品ナンバー１３,Monster Merchant & Item Number 13
女性プラコン服ミッドナイト,Midnight Clothes (F)
壊れたハイハイジャンプさん,Broken Mr. High High Jump
アスフェルド学園男性用水着,Asfeld Swimwear (M)
ハロウィンクイズ解答オガ５,Halloween Quiz Answer Ogre 5
１００万ゴールドの入った袋,1 Million Gold Bag
じょせいぷらこんふくぴんく,Pink Clothes (F)
からすかぐらのしょうぞくⅡ,Crow Dance Costume Ⅱ
眠り時に呪文のダメージ +50%,Spell Damage to Asleep Foes +50%
5000年の旅路 遥かなる故郷へ,5000 Year Journey to a Faraway Hometown
受けるダメージを10軽減する,Damage Taken -10
テンション時のダメージ +300,Damage During Tension +300
ワルド水源-湖上の休息所 前,Wald Headwaters - Lake Retreat
ロヴォス高地-ゼドラ洞 入口,Rovos Highlands - Zedra Cave Entry
氷耐性低下時のダメージ +100,Ice Vulnerability Damage +100
炎属性の呪文のダメージ +100,Fire Spell Damage +100
チャンス特技発生率 +1.0%<ban>,Chance Trigger Rate +1% (PvP×)
アストルティア博物館 出口,Astoltia Museum Exit
エピステーサ底なし穴 出口,Epistesa Chasm Exit
湖の小島・神のまなこ 出口,Lake Islet - The All-seeing Eye Exit
リンジャハル海岸-海岸遺跡,Linjahar Coast - Coast Ruins
プログラマー検証ステージ6,Programmer Verification Stage 6
湖の小島・神のまなこ 入口,Lake Islet - The All-seeing Eye Entry
レビュール街道北-谷合の森,Reviewle Highway North - Veil of the Vale
プログラマー検証ステージ5,Programmer Verification Stage 5
開戦時 10%でヘヴィチャージ,Starting Heavy Charge 10%
受けるダメージを5軽減する,Damage Taken -5
ランプ錬金ギルド 地下１階,Lamp Alchemy Guild B1F
アストルティア博物館 入口,Astoltia Museum Entry
とこしえの神殿楯の間 入口,Atrium of the Aegis Entry
スイーツゾーン控え室 入口,Sweets Zone Waiting Room Entry
ゼクレス城・魔導広場 出口,Zechres Castle - Square of Sorcery Exit
キュロンイーターの巣 出口,Kyuroneater's Nest Exit
味方死亡時 20%でバイシオン,Oomph If Ally Dies 20%
土属性の呪文のダメージ +5%,Earth Spell Damage +5%
異界アスタルジア深部 出口,Depths of Astalgia Exit
とこしえの神殿楯の間 出口,Atrium of the Aegis Exit
シガール町長の執務室 入口,Mayor Sigal's Office Entry
エピステーサ底なし穴 入口,Epistesa Chasm Entry
ゼクレス城・魔導広場 入口,Zechres Castle - Square of Sorcery Entry
