アルファ用アルウェ王妃の別荘跡(子供たちの隠れ家内部Test),Queen Alwe's Villa Ruins for Alpha (Test Inside Children's Hideout)
バトル班用テストマップ（いにしえのゼルメア）,Team Battle Map Test (Ancient Zelmea)
どらごんくえすとえいとしゅじんこうのいしょう,DQⅧ Hero Costume
このマップは モンスターから逃げられません。,You can't run from monsters on this map.
マッチングテストステージ（同期後移動用）,Match test stage (for moving beat testing)
マッチングテストステージ（同期テスト用）,Match test stage (for sync testing)
　　　～モンスター討伐隊隊員からの依頼～,         Monster Strike Force Request
リャナ荒涼地帯-ねじれたる異形の大地 入口,Lyana Desolate - Twisted Terrane Entry
グランゼドーラ領-グランゼドーラ王国 入口,Gran Zedora Territory - Gran Zedora Kingdom Entry
必殺チャージ時 バイキルトとピオラ2段階,Oomphle & Accelerate x2 On Special
アラハギーロ地方-モンスター格闘場 入口,Al-Ahagiro Region - Monster Arena Entry
メルサンディ穀倉帯-さびれたほこら 入口,Melsandy Millfields - Deserted Shrine Entry
メルサンディ穀倉帯-こもれびの広場 入口,Melsandy Millfields - Sunbeam Square Entry
アラハギーロ地方-アラハギーロ王国 入口,Al-Ahagiro Region - Kingdom of Al-Ahagiro Entry
メルサンディ穀倉帯-メルサンディ村 入口,Melsandy Millfields - Melsandy Village Entry
こうげき力上昇時 特技のダメージ +20<ban>,Skill Dmg. +20 When Attack ↑ (PvP×)
季節イベント「オ月見」　コンパニオン,Seasonal Event "Moon View" Companion
バトル班用テストマップ（ムスト廃墟）,Team Battle Map Test (Musuto Ruins)
季節イベント「お月見」　コンパニオン,Seasonal Event "Moon View" Companion
ぷらこんだんせいようそくたいむらさき,Purple Ceremony Gown
アラハギーロ地方-ムルードの岩山 入口,Al-Ahagiro Region - Murudo Mountain Entry
アラハギーロ地方-日除けのほら穴 入口,Al-Ahagiro Region - Sunshade Cave Entry
メルサンディ穀倉帯-メルン水車郷 入口,Melsandy Millfields - Melun Watermill Entry
神代過ぎ～　春の桜よ　無為に咲く～,Past ages divine, the spring blossoms bloom, waiting idly by...
ルファ神殿エントランス（オープン）,Rufa Temple - Entry (Open)
ぷらこんすくーるせいふくおんなくろ,Black School Uniform (F)
ぷらこんだんせいようそくたいみどり,Green Ceremony Gown
ぷらこんすくーるせいふくおとこちゃ,Brown School Uniform (M)
受けた属性ダメージの 10%ＨＰ回復<ban>,10% Attribute Damage Taken As HP (PvP×)
ぷらこんすくーるせいふくおんなしろ,White School Uniform (F)
ぷらこんすくーるせいふくおんなあか,Red School Uniform (F)
ぷらこんすくーるせいふくおとこくろ,Black School Uniform (M)
しかし　持ち物が　いっぱいだった！,But you're carrying too many things!
ぷらこんすくーるせいふくおとここん,Blue School Uniform (M)
ぷらこんすくーるせいふくおんなちゃ,Brown School Uniform (F)
ぷらこんすくーるせいふくおとこしろ,White School Uniform (M)
ぷらこんすくーるせいふくおとこあか,Red School Uniform (M)
ぷらこんすくーるせいふくおんなこん,Blue School Uniform (F)
リャナ荒涼地帯-ソーラリア峡谷 入口,Lyana Desolate - Solaria Canyon Entry
コニウェア平原-ココラタの浜辺 入口,Coniware Plain - Cocolata Beach Entry
アルファ用井戸(ダンダダ団のアジト),Well for Alpha (Robbin' 'Ood Gang HQ)
バトル班用テストマップ(ツスクル）,Team Battle Map Test (Tsuskuru)
ぷらこんじょせいようみどりさんた,Green Women's Santa Suit
ぷらこんだんせいしのびのふくくろ,Black Men's Ninja Suit
ぷらこんだんせいようみどりさんた,Green Men's Santa Suit
だんせいぷらこんふくみすとぐれー,Mist Gray Clothes (M)
足元エフェクト（おしおきアタック,Something Effect
ぷらこんじょせいしのびのふくあか,Red Women's Ninja Suit
ぷらこんだんせいしのびのふくあか,Red Men's Ninja Suit
ぷらこんだんせいしのびのふくこん,Navy Men's Ninja Suit
バトル班用テストマップ（獅子門）,Team Battle Map Test (Lion Gate)
ぷらこんだんせいようそくたいちゃ,Tea Ceremony Gown
あすふぇるどがくえんがくせいふく,Asfeld Academy Uniform
ぷらこんだんせいようそくたいはい,Ash Ceremony Gown
ぷらこんじょせいむらさきふりそで,Purple Women's Kimono
ぷらこんだんせいようそくたいあお,Blue Ceremony Gown
ぷらこんじょせいしのびのふくこん,Navy Women's Ninja Suit
じょせいぷらこんふくみっどないと,Midnight Clothes (F)
ぷらこんだんせいしのびのふくちゃ,Tea Men's Ninja Suit
プンスコのテーブル＆ティーセット,Punsuko's Table & Tea Set
エフェクトイメージさん（１０個）,Mr. Effect Image (10)
ぷらこんじょせいしのびのふくくろ,Black Women's Ninja Suit
ぷらこんじょせいみこふくむらさき,Purple Priestess Dress
だんせいぷらこんふくだーくぐれー,Dark Gray Clothes (M)
じょせいぷらこんふくあいすぶるー,Ice Blue Clothes (F)
だんせいぷらこんふくみっどないと,Midnight Clothes (M)
ぷらこんじょせいしのびのふくあお,Blue Women's Ninja Suit
ぷらこんだんせいしのびのふくあお,Blue Men's Ninja Suit
ぷらこんじょせいしのびのふくもも,Pink Women's Ninja Suit
リンジャハル海岸-リンジャの塔 前,Linjahar Coast - Linja Tower
マデ島＆エテーネ王宮（4.5CS専用）,Made Isle & Ethene Royal Manor (4.5CS only)
リンジャハル海岸-教会シスター 前,Linjahar Coast - Church Sister
必殺チャージ時 チャージ時間 -10秒,Charge Time -10 sec. On Special
セレドット山道-ベリルのほら穴 前,Celedot Mountain Pass - Beryl Den
レビュール街道北-海風の洞くつ 前,Reviewle Highway North - Seabreeze Cave
プログラマー用負荷検証ステージ3,Loading Programmer Verification Stage 3
追憶の世界-アルウェ王妃の別荘跡,World of Remembrance-The Ruins of Queen Alwe
プログラマー用負荷検証ステージ1,Loading Programmer Verification Stage 1
プログラマー用負荷検証ステージ4,Loading Programmer Verification Stage 4
死亡時 50%でこうげき力上昇が残る,Undying Attack Boost 50%
プログラマー用負荷検証ステージ5,Loading Programmer Verification Stage 5
プログラマー用負荷検証ステージ2,Loading Programmer Verification Stage 2
30%の確率で受けたダメージ10%反射,30% Chance to Reflect 10% Damage
\s\m\eは　ダイスをふった。　→　,\s\m\e rolls a die. → !
豪魔将ベリンダ＆豪魔将ブレンダ,Generals Belinda & Brenda
じょせいぷらこんふくさんせっと,Sunset Clothes (F)
ぷらこんじょせいようあかさんた,Red Women's Santa Suit
\s\m\eは　コインをなげた。　→　,\s\m\e flips a coin. → The coin lands on !
ぷらこんだんせいようあおあろは,Blue Men's Aloha
ぷらこんじょせいようももさんた,Pink Women's Santa Suit
ぷらこんだんせいようももさんた,Pink Men's Santa Suit
ぷらこんだんせいようしろあろは,White Men's Aloha
ぷらこんだんせいようしろさんた,White Men's Santa Suit
えるどなしんのしょうぞくせっと,Eldona's Outfit
ぷらこんじょせいようあかあろは,Red Women's Aloha
はなかりゅうどのころもむらさき,Purple Flower Hunter Outfit
ゴリウスの怨霊＆魔道士キルギル,Gorius' Vengeance & Wizard Kirgyl
ぷらこんだんせいようももあろは,Pink Men's Aloha
ぷらこんじょせいようあおあろは,Blue Women's Aloha
ぷらこんこどもようみずぎせっと,Children's Swimsuit
ハロウィンクイズ解答ウェディ４,Halloween Quiz Answer Weddie 4
扉は　かたく　閉ざされている。,The door is tightly closed.
ハロウィンクイズ解答ウェディ１,Halloween Quiz Answer Weddie 1
ぷらこんじょせいようくろさんた,Black Women's Santa Suit
ぼうえいぐんのせいふくはいいろ,Gray Defense Force Suit
壊れたアストルティアのコンパス,Broken Astoltia Compass
ぷらこんじょせいみこふくみどり,Green Priestess Dress
ぷらこんじょせいようしろさんた,White Women's Santa Suit
ぷらこんだんせいはかまむらさき,Purple Men's Hakama
ハロウィンクイズ解答ウェディ２,Halloween Quiz Answer Weddie 2
ぷらこんだんせいようくろさんた,Black Men's Santa Suit
魔天の勇者＆聖夜の破壊者・闇組,Festive Hero & Holy Night Wrecker Dark Team
ぼうえいぐんのせいふくむらさき,Purple Defense Force Suit
魔天の勇者＆聖夜の破壊者・雪組,Festive Hero & Holy Night Wrecker Snow Team
ぷらこんじょせいようももあろは,Pink Women's Aloha
ハロウィンクイズ解答ウェディ５,Halloween Quiz Answer Weddie 5
ぷらこんだんせいようあかさんた,Red Men's Santa Suit
\s\m\eは　カードを引いた。　→　,\s\m\e draws a card. → They draw the !
ぷらこんじょせいようしろあろは,White Women's Aloha
ハロウィンクイズ解答ウェディ３,Halloween Quiz Answer Weddie 3
ハロウィンクイズ解答ウェディ７,Halloween Quiz Answer Weddie 7
ハロウィンクイズ解答ウェディ６,Halloween Quiz Answer Weddie 6
モンセロ温泉峡-中央のやぐら 前,Moncello Spring Gorge - Central Scaffold
リャナ荒涼地帯-滝を臨む集落 前,Lyana Desolate - Waterfall Village
リャナ荒涼地帯-くずれた灯台 前,Lyana Desolate - Collapsed Lighthouse
ドラクロン山地-竜守りの小屋 前,Draklon Mountains - Dragon Guard's Hut
ジャイラ密林-クドゥスの泉 入口,Jyra Jungle - Kudus Spring Entry
セレドット山道-セレドの町 入口,Celedot Mountain Pass - Town of Celed Entry
デフェル荒野-不思議の魔塔 入口,Defel Desert - Mysterious Tower Entry
コニウェア平原-教会シスター 前,Coniware Plain - Church Sister
レビュール街道南-三門の関所 前,Reviewle Highway South - Three Way Gate
ムニエカの深層・隠し通路 入口,Munieka Depths - Secret Passage Entry
会心と暴走時のダメージ +100<ban>,Critical/Haywire Damage +100 (PvP×)
テンション時のダメージ +100<ban>,Damage During Tension +100 (PvP×)
こうげき魔力とかいふく魔力 +10,Magical Might/Mending +10
戦いで 魔物に狙われにくくなる,Less likely to be targeted in battle
アルファ用追憶の世界 別荘跡編,World of Recollection for Alpha Villa Ruins
チームゆく年くる年　２０１７,Team New Year 2017
ハロウィンクイズ解答エルフ１,Halloween Quiz Answer Elf 1
チームゆく年くる年　２０１９,Team New Year 2019
ぷらこんおとこどらきゅらふく,Men's Dracula Costume
巨人コアを守るジア・クトたち,Defenders of the Core
ハロウィンクイズ解答エルフ６,Halloween Quiz Answer Elf 6
ぷらこんすいーとふくだいだい,Orange Sweet Clothes
ぷらこんしゃわーよういしょう,Shower Outfit
ぷらこんおんなどらきゅらふく,Women's Dracula Costume
はなかりうどのころもむらさき,Purple Flower Hunter Outfit
じょせいしらなみがらのゆかた,White Wave Yukata (F)
チームゆく年くる年　２０２３,Team New Year 2023
ぷらこんだんせいようあかろは,Red Men's Aloha
ぷらこんじょせいあかふりそで,Red Women's Kimono
あすふぇるどがくえんふゆふく,Asfeld Academy Winter Wear
闇に唄う氷にまぎれし聖なる者,Frozen Sacred Singer
行動時 7%でバイシオンとピオラ,Oomph & Accelerate On Action 7%
ＤＱⅧしゅじんこうのいしょう,DQⅧ Hero Costume
ハロウィンクイズ解答エルフ３,Halloween Quiz Answer Elf 3
ぷらこんじょせいももふりそで,Pink Women's Kimono
ハロウィンクイズ解答エルフ５,Halloween Quiz Answer Elf 5
ぷらこんおんなぱんぷきんふく,Women's Pumpkin Clothes
ぷらこんだんせいようきあろは,Yellow Men's Aloha
チームゆく年くる年　２０２２,Team New Year 2022
チームゆく年くる年　２０２４,Team Twenty Twenty Four
チームゆく年くる年　２０１８,Team New Year 2018
ぼうえいぐんのせいふくみどり,Green Defense Force Suit
チームゆく年くる年　２０２５,Team New Year 2025
チームゆく年くる年　２０２１,Team New Year 2021
行動時 5%でバイシオンとスカラ,Oomph & Buff On Action 5%
チームゆく年くる年　２０２０,Team New Year 2020
魔人エンラージャ＆ムッチーノ,Enraja the Genie & Muccino
嵐魔ウェンリルとアクラガレナ,Wenrir the Storm & Akragarena
行動時 5%でバイシオンとピオラ,Oomph & Accelerate On Action 5%
だんせいしらなみがらのゆかた,White Wave Yukata (M)
ぷらこんじょせいみこふくもも,Pink Priestess Dress
魔天の勇者＆キラークリスマス,Festive Hero & Christmas Killing Machine
ハロウィンクイズ解答エルフ２,Halloween Quiz Answer Elf 2
ぷらこんおとこぱんぷきんふく,Men's Pumpkin Clothes
ぷらこんじょせいくろふりそで,Black Women's Kimono
集合ギミック / 全体エフェクト,Some gimmick or effect idk
フォークに刺さったパンケーキ,Pancakes Stuck in a Fork
ハロウィンクイズ解答エルフ７,Halloween Quiz Answer Elf 7
ラダ・ガートたちに連絡を取る,Contact Lada Gart's Group
あすふぇるどがくえんなつふく,Asfeld Academy Summer Wear
はなかりゅうどのころもみどり,Green Flower Hunter Outfit
じょせいぷらこんふくむらさき,Purple Clothes (F)
はるかぜおうえんだんいしょう,Spring Cheer Team Outfit
ぷらこんじょせいようきあろは,Yellow Women's Aloha
ぷらこんじょせいみこふくあお,Blue Priestess Dress
ハロウィンクイズ解答エルフ４,Halloween Quiz Answer Elf 4
ぷらこんじょせいみこふくあか,Red Priestess Dress
ぷらこんきゅーぴっどむらさき,Purple Cupid
わかむしゃのかっちゅうせっと,Young Warrior Armor Set
ヴァレリアの仮面（割れる前）,Valeria's Unbroken Mask
ぷらこんじょせいしろふりそで,White Women's Kimono
どるわーむけんきゅういんふく,Dolworm Research Suit
モンセロ温泉峡-北のやぐら 前,Moncello Spring Gorge - North Scaffold
デフェル荒野-教会シスター 前,Defel Desert - Church Sister
デフェル荒野-ピラミッド 入口,Defel Desert - Pyramid Entry
モンセロ温泉峡-ご神体の間 前,Moncello Spring Gorge - Hall of Worship
ロヴォス高地-教会シスター 前,Rovos Highlands - Church Sister
グランゼドーラ領-見張り塔 前,Gran Zedora Territory - Watchtower Front
ジャイラ密林-大樹の根元 入口,Jyra Jungle - Big Tree Root Entry
コニウェア平原-三門の関所 前,Coniware Plain - Three Way Gate
モンセロ温泉峡-南のやぐら 前,Moncello Spring Gorge - South Scaffold
モンセロ温泉峡-管理人小屋 前,Moncello Spring Gorge - Caretaker's Hut
銃撃時2%でターンを消費しない,Free Turn When Shooting 2%
リンジャハル海岸-高台の遺跡,Linjahar Coast - Hilltop Ruins
行動時 5%でチャージ時間 -10秒,Charge Time -10 sec. On Action 5%
セレドット山道-滝見の吊り橋,Celedot Mountain Pass - Fallsview Bridge
炎・土・闇の攻撃ダメージ +5%,Fire/Earth/Dark Damage +5%
追憶の世界-キラキラ大風車塔,World Of Remembrance-Windmill Tower
攻撃時 5%でチャージ時間 -10秒,Charge Time -10 sec. Attack 5%
ぷらこんだんせいはかまあお,Blue Men's Hakama
ぷらこんいけてるみずぎあお,Blue Cool Swimsuit
ランドン山脈山頂付近への道,Road to Landon Summit Area
ぷらこんおしゃれみずぎしろ,White Snazzy Swimsuit
ドルボ用マネキンプクリポ用,For Pukulipo Mannequin For Dolboard
ゆうべはおたのしみでしたね,Rooming with a Gamer Gal
ぷらこんいけてるみずぎあか,Red Cool Swimsuit
らんぷれんきんれんしゅうぎ,Lamp Alchemy Training Wear
ドルボ用マネキンニンゲン用,For Human Mannequin For Dolboard
清き風吹き　草木は芽吹く～,Pure winds blown and trees grown, budding green as the breeze is thrown
古グランゼドーラ領への出口,Exit to Old Gran Zedora Territory
ぷらこんおしゃれみずぎあお,Blue Snazzy Swimsuit
ハロウィンクイズ解答オガ５,Halloween Quiz Answer Ogre 5
イルーシャのスケッチブック,Illusia's Sketchbook
3.0%でターンを消費しない<ban>,Free Turn 3% (PvP×)
はなかりゅうどのころもあか,Red Flower Hunter Outfit
行動時 5%でテンションアップ,Tension On Action 5%
ぼうえいぐんのせいふくこん,Blue Defense Force Suit
ドラゴンクエストＸショップ,Dragon Quest X Shop
ハロウィンクイズ解答ヒト３,Halloween Quiz Answer Human 3
ぷらこんえんじぇるふくくろ,Black Angel Clothes
ハロウィンクイズ解答プク５,Halloween Quiz Answer Puku 5
ハロウィンクイズ解答ドワ１,Halloween Quiz Answer Dwarf 1
ムストの町・教会跡への出口,Exit to Morst - Church Ruins
ムストの町・風車へのはしご,Morst - Ladder to the Windmill
行動時 3%でテンションアップ,Tension On Action 3%
ハロウィンクイズ解答プク１,Halloween Quiz Answer Puku 1
ハロウィンクイズ解答プク２,Halloween Quiz Answer Puku 2
ハロウィンクイズ解答ドワ２,Halloween Quiz Answer Dwarf 2
ハロウィンクイズ解答オガ７,Halloween Quiz Answer Ogre 7
ぼうえいぐんのせいふくあか,Red Defense Force Suit
ハロウィンクイズ解答プク３,Halloween Quiz Answer Puku 3
ハロウィンクイズ解答ヒト１,Halloween Quiz Answer Human 1
古レビュール街道北への出口,Exit to Old Reviewle Highway North
ぷらこんえんじぇるふくもも,Pink Angel Clothes
ハロウィンクイズ解答ヒト４,Halloween Quiz Answer Human 4
ハロウィンクイズ解答プク６,Halloween Quiz Answer Puku 6
ハロウィンクイズ解答ドワ５,Halloween Quiz Answer Dwarf 5
砂の都ファラザードへの出口,Exit to Farazard
男性プラコン服ミッドナイト,Midnight Clothes (M)
ぷらこんぱてぃしえふくもも,Pink Pastry Chef Suit
アスフェルド学園男性用水着,Asfeld Swimwear (M)
男性プラコン服ミストグレー,Mist Gray Clothes (M)
キュロンイーターの巣への道,Path to Kyuroneater's Nest
ハロウィンクイズ解答オガ６,Halloween Quiz Answer Ogre 6
女性プラコン服アイスブルー,Ice Blue Clothes (F)
ハロウィンクイズ解答ヒト５,Halloween Quiz Answer Human 5
壊れたハイハイジャンプさん,Broken Mr. High High Jump
ハロウィンクイズ解答オガ２,Halloween Quiz Answer Ogre 2
じょせいぷらこんふくえんじ,Red Clothes (F)
だるめしあんぼーいいしょう,Dalmatian Outfit (M)
アスフェルド学園女性用水着,Asfeld Swimwear (F)
だんせいぷらこんふくえんじ,Red Clothes (M)
ぷらこんだんせいはかまこん,Navy Blue Men's Hakama
イア・タア　シンパッ・ケウ,E-yis, aneu dish cubrey
ぷらこんいけてるみずぎもも,Pink Cool Swimsuit
ハロウィンクイズ解答ヒト７,Halloween Quiz Answer Human 7
だるめしあんがーるいしょう,Dalmatian Outfit (F)
ぷらこんぱてぃしえふくしろ,White Pastry Chef Suit
ぷらこんぱてぃしえふくあお,Blue Pastry Chef Suit
ハロウィンクイズ解答プク４,Halloween Quiz Answer Puku 4
『ついてクンをひっこめる』,"Remove Pet"
女性プラコン服ミッドナイト,Midnight Clothes (F)
ぷらこんおしゃれみずぎあか,Red Snazzy Swimsuit
未完のドラクロン山地への道,Road to Undone Draklon Mountains
ぷらこんおしゃれみずぎくろ,Black Snazzy Swimsuit
ハロウィンクイズ解答オガ１,Halloween Quiz Answer Ogre 1
だんせいぷらこんふくぴんく,Pink Clothes (M)
ハロウィンクイズ解答ヒト２,Halloween Quiz Answer Human 2
１００万ゴールドの入った袋,1 Million Gold Bag
戦闘中常時マホトラのころも,Magic Cloak Always Active
ハロウィンクイズ解答ドワ４,Halloween Quiz Answer Dwarf 4
ぷらこんえんじぇるふくあか,Red Angel Clothes
未開のジャングル地区への道,Road to Savage Jungle
男性プラコン服ダークグレー,Dark Gray Clothes (M)
ぼうえいぐんのせいふくきん,Gold Defense Force Suit
ハロウィンクイズ解答ドワ３,Halloween Quiz Answer Dwarf 3
ぷらこんおしゃれみずぎもも,Pink Snazzy Swimsuit
アスフェルド学園男性用夏服,Asfeld Summer Uniform (M)
ハロウィンクイズ解答ヒト６,Halloween Quiz Answer Human 6
『おうちでついてクン設定』,"House Pet Settings"
ぷらこんだんせいはかまくろ,Black Men's Hakama
2.0%でターンを消費しない<ban>,Free Turn 2% (PvP×)
ぷらこんぱてぃしえふくあか,Red Pastry Chef Suit
ハロウィンクイズ解答ドワ６,Halloween Quiz Answer Dwarf 6
ハロウィンクイズ解答オガ４,Halloween Quiz Answer Ogre 4
ドルボ用マネキンウェディ用,For Weddie Mannequin For Dolboard
ぷらこんえんじぇるふくあお,Blue Angel Clothes
じょせいぷらこんふくぴんく,Pink Clothes (F)
はなかりゅうどのころもあお,Blue Flower Hunter Outfit
ドルボ用マネキンドワーフ用,For Dwarf Mannequin For Dolboard
フラワーガーデン地区への道,Road to Flower Garden District
とうばつたいこうほうきょく,Strike Force Bureau
ぷらこんいけてるみずぎしろ,White Cool Swimsuit
ハディン地下洞くつへの出口,Exit to Hadine Cavern
アルムゴーグ＆ロムドゴーグ,Armogog & Romdogog
未完のモンセロ温泉峡への道,Road to Undone Moncello Spring Gorge
はなかりうどのころもみどり,Green Flower Hunter Outfit
ハロウィンクイズ解答オガ３,Halloween Quiz Answer Ogre 3
からすかぐらのしょうぞくⅠ,Crow Dance Costume Ⅰ
ルクスガルン大空洞への亀裂,Crevice to Luxgarn Caverns
デスディオ暗黒荒原への出口,Exit to Deathdio Darklands
ぷらこんえんじぇるふくしろ,White Angel Clothes
ハロウィンクイズ解答プク７,Halloween Quiz Answer Puku 7
ハロウィンクイズ解答ドワ７,Halloween Quiz Answer Dwarf 7
魔物商人＆商品ナンバー１３,Monster Merchant & Item Number 13
からすかぐらのしょうぞくⅡ,Crow Dance Costume Ⅱ
ぷらこんだんせいはかましろ,White Men's Hakama
スターキメラから取った羽根,Cosmic Chimaera Feather
ぷらこんいけてるみずぎくろ,Black Cool Swimsuit
未来への扉とまどろみの少女,The Door to the Future & the Slumbering Girl
アスフェルド学園女性用夏服,Asfeld Summer Uniform (F)
テンション時のダメージ +300,Damage During Tension +300
受けるダメージを10軽減する,Damage Taken -10
5000年の旅路 遥かなる故郷へ,5000 Year Journey to a Faraway Hometown
ワルド水源-湖上の休息所 前,Wald Headwaters - Lake Retreat
チャンス特技発生率 +1.0%<ban>,Chance Trigger Rate +1% (PvP×)
ロヴォス高地-ゼドラ洞 入口,Rovos Highlands - Zedra Cave Entry
必殺チャージ時 身かわし+10%,Dodge +10% On Special Charge
異界アスタルジア深部 出口,Depths of Astalgia Exit
モリナラ地下洞・深淵 出口,Molinara Underground Abyss Exit
ビンゴすごろくホール 出口,Bingo & Sugoroku Hall Exit
カルデア山道のアジト 出口,Chaldea Mountain Road Hideout Exit
宇宙船・立入禁止区画 出口,Spacecraft - Restricted Area Exit
古グランゼドーラ王国 入口,Old Gran Zedora Kingdom Entry
瀕死時 15%こうげき力 +60<ban>,Near-Death Attack +60 15% (PvP×)
プログラマー検証ステージ3,Programmer Verification Stage 3
プログラマー検証ステージ5,Programmer Verification Stage 5
スイーツゾーン控え室 出口,Sweets Zone Waiting Room Exit
プログラマー検証ステージ8,Programmer Verification Stage 8
スライムレースホール 入口,Slime Race Hall Entry
スイーツゾーン控え室 入口,Sweets Zone Waiting Room Entry
バルメシュケの研究所 入口,Balmeschke's Laboratory Entry
ビタースイーツゾーン 出口,Bittersweets Zone Exit
オルセコ闘技城・舞台 入口,Orseco Combastle - Stage Entry
バルメシュケの研究所 出口,Balmeschke's Laboratory Exit
ビンゴすごろくホール 入口,Bingo & Sugoroku Hall Entry
アストルティア博物館 出口,Astoltia Museum Exit
宇宙船・立入禁止区画 入口,Spacecraft - Restricted Area Entry
キュロンイーターの巣 入口,Kyuroneater's Nest Entry
シガール町長の執務室 入口,Mayor Sigal's Office Entry
からすかぐらのしょうぞく2,Crow Dance Costume Ⅱ
からすかぐらのしょうぞく1,Crow Dance Costume Ⅰ
エピステーサ底なし穴 出口,Epistesa Chasm Exit
とこしえの神殿楯の間 出口,Temple of Eternity Shield Room Exit
ランプ錬金ギルド 地下１階,Lamp Alchemy Guild B1F
プログラマー検証ステージ1,Programmer Verification Stage 1
エピステーサ底なし穴 入口,Epistesa Chasm Entry
ゼクレス城・魔導広場 出口,Zechres Castle - Square of Sorcery Exit
リンジャハル海岸-海岸遺跡,Linjahar Coast - Coast Ruins
