セクシーライトの本,Sexy Light Book
オブジェクト座標246,Object Coordinates 246
全職さいだいＭＰ+10,Max MP +10
ライバルズトランプ,Rivals Cards
ふたつ結びエクステ,Double Knot Extension
サマーソルトクロー,Somersault Claw
うつしよの銅箱・改,Worldly Copper Box v2
ドラグーンメイル上,Dragoon Mail Top
鳥かごのポスト・黄,Yellow Birdcage Mailbox
レモスラのランタン,Lemon Slime Lantern
レクタリスのころも,Lectalis' Robe
護りの盾アンルシア,Protector Anlucia
自由人の集落への道,Road to Freedom Village
オブジェクト座標281,Object Coordinates 281
モダンローズビジュ,Modern Rose Bijou
オシリスのブローチ,Osiris' Brooch
ガートラント兵士Ｂ,Gartlant Soldier B
特別郵便局員レチカ,Special Postman Lechika
ポーポラ地方の木Ａ,Popola Region Tree A
シルバリヌスのツボ,Silverine Pot
天駆ける冒険者たち,Soaring Adventures
カンフーボーイ衣装,Kung Fu Boy Costume
コーヒーカップ・桃,Pink Coffee Set
どうぐ使いのぼうし,Item Master Hat
メタスラボスメダル,Metal Slime Boss Medal
エアボードプリズム,Airboard Prism
メカニックスーツ下,Mechanic Suit Bottom
ドワーフ市民ぼうし,Dwarf Citizen Hat
オブジェクト座標249,Object Coordinates 249
パンジーのビスチェ,Pansy Bustier
コンシェルジュ０９,Concierge 09
汚染源ヘドロヌーバ,Sludgeraker, Source of Pollution
限定交換屋セステル,Limited Exchange Shop Cestel
オレンジガーベラ傘,Orange Gerbera Umbrella
アリアハンかんむり,Aliahan Circlet
ガーディアンサラダ,Guardian Salad
千里の名馬プリズム,1000 Mile Horse Prism
ケキちゃんカプセル,Cakey Toy
敵の動きを止めて！,Stop enemy movement!
ハートの兵隊ぼうし,Heart Soldier Hat
聖地パサラン団子山,Sacred Pasaran Dango Mountain
しぐさ書・トランプ,Emote "Cards"
オブジェクト座標167,Object Coordinates 167
せんすいふくえーる,Cheer Diving Suit
ミラクル武器の軌跡,Miracle Sword Book
しっくいと木板の壁,Plaster & Wood Wall
エンパイアブレード,Legate's Blade
ケツァルコアトルス,Quetzalcoatlus
ギュッとフランジュ,Frange Arm Doll
オブジェクト座標062,Object Coordinates 062
ふわふわセサミパン,Fluffy Sesame Bread
オブジェクト座標123,Object Coordinates 123
武勲の城の一輪挿し,Valor Castle Vase
オブジェクト座標109,Object Coordinates 109
防衛魔神兵０５６号,Aztech Guard No. 056
オスクトルローブ下,Oscutor Robe Bottom
メタル出現率アップ,Metal Encounter Rate Up
はぐれメタル浮き輪,Liquid Metal Floatie
謎の幽霊列車の写真,Mystery Ghost Train Photo
ガラスケースのカギ,Glass Case Key
イッショウの家の柱,Issho's House Pillar
上級・魔力錬金の本,Advanced Magic Power
アイスダンスズボン,Ice Dance Pants
タンブラークロッグ,Tumbler Shoes
ルビーのかみかざり,Ruby's Hairpin
マスターを目指す者,One Who Aims to be Master
ボルネア山への出口,Exit to Bornea Mountain
召喚士リンジャーラ,Summoner Linjara
銀河のランプ錬金書,Galaxy Lamp Alch. Book
星座の導き・やぎ座,Star Guide・Capricorn
住宅素材屋ポッポル,Housing Materials Poppol
ディカス団長のメモ,Commander Dicus' Note
パッチ柄ベッド・青,Blue Patch Bed
ホワイトバックラー,White Shield
スコーピオンテイル,Scorpion Tail
銀のロザリオの破片,Silver Rosary Shard
スノーボールンたち,Snowballon and co.
幻想画「一喜一憂」,Fantasy Art "Hope and Fear"
レジェンズステッキ,Legends Wand
始源の歌姫のドレス,First Diva's Dress
ヤシの葉の便利な壁,Palm Leaf Wall
マイタウン農村地区,My Town Rural District
コアブラックの花束,Core Black Bouquet
クマチャンキャップ,Beary Cute Cap
ヤマカミヌ王の屋敷,Yamakaminu King's Abode
オブジェクト座標139,Object Coordinates 139
ミッドナイトの花束,Midnight Bouquet
メタスラのバスタブ,Metal Slime Bathtub
運動会・白組衣装券,White Team Uniform Tkt
壁かけシラナミの絵,Shiranami Portrait
ワンダーマシュマロ,Wonder Marshmallows
キングスライムの像,King Slime Statue
ベビタン竜族人形男,Imp Nadravian Doll (M)
バブスラジャムパン,Bubble Slime Jam Bread
機工博士のグローブ,Engineer's Gloves
古代都市地区への道,Road to Ancient Suburb
ウルベア魔神兵たち,Urbea Aztechs
特注キャットタワー,Custom-Made Cat Tower
ラッキー便せん４０,Lucky Paper 40
チェックのラグ・赤,Red Checkered Rug
取りよせ商ポルルプ,Collection Merchant Porrup
旅芸人ピュージュＨ,Minstrel Pyuju H
レジェンズブレード,Legends Blade
壁かけロトのつるぎ,Erdrick's Sword Mount
しぐさ書・ぞうきん,Emote "Cleaning Cloth"
ビクトリーボックス,Victory Box
シーサイドオブジェ,Seaside Curio
サイドカープリズム,Sidecar Prism
学者のころもセット,Academic Outfit
妖魔のまなざし事件,The Demon's Gaze Incident
プクリポカウンタ小,Pukulipo Counter S
シーザーレインボー,Rainbow Scissor
アンノウンステッキ,Unknown Wand
はやぶさのツメの書,Crow's Claws Book
しぐさ書・スマイル,Emote "Best Smile"
ハイビスコサージュ,Hibiscus Corsage
魔物管理人マビシア,Monster Manager Mabicia
ゴシック調のタンス,Gothic Wardrobe
たんけんかえるまん,Explorer Elman
フラワーの気球・緑,Green Flower Balloon
スターリーステッキ,Starry Stick
錬金術は時を超えて,Alchemy Transcends Time
モダンバニーブレス,Modern Bunny Bracelet
勇者と盟友の便せん,Hero & Ally Paper
白灰のピラー・内部,White Ash Pillar - Inside
ウェディカウンタ小,Weddie Counter S
プラコン男オバケ服,Men's Ghost Costume
フェアリードラゴン,Damselfly
厄魔ポヴァディウス,Evil Povadius
コマンダーキャップ,Commander Cap
シングルアンテナＡ,Single Antenna A
人面樹ぬいぐるみ小,Treeface Plushie S
グレイスフルコート,Graceful Coat
蒼穹兵団のグリーブ,Azure Corps Greaves
ダークキング変異体,Variant Dark King Slime
第２回カジノ祭・銅,2nd Casino Fest Bronze
打ち上げ柳花火・緑,Green Willow Firework
壊れた酒場の置き物,Broken Tavern Ornament
フラワーの気球・桃,Pink Flower Balloon
ペロキャンプリズム,Lollipop Prism
スターリースタッフ,Starry Staff
たれ灰太猫カプセル,Fat Lazy Ash Cat Toy
星雲のモビール・白,White Nebula Mobile
氷魔王の大矛・オノ,Ice Demon King Axe
クールスターセット,Cool Star Outfit
始源の歌姫の髪飾り,First Diva's Hairpin
ピクニックヒューザ,Hyuza Picnic
憎しみは時を超えて,Hatred is Timeless
リンクル地方への道,Road to Wrinkle Region
レッドローズのタネ,Red Rose Seed
鉄壁のよろいセット,Ironclad Armor Set
クイーン釜プリズム,Queen Pot Prism
スピリットフレイム,Spirit Flame
せかいじゅのしずく,Yggdrasil Dew
シーグリーンダリア,Sea Green Dahlia
ゴールドマンＸ４号,Gold Golem X 4
リーフシードラゴン,Leafy Seadragon
支援魔神機０２１号,Aztech Support Mech No. 021
フェザースティック,Winged Wand
海風の小分けぶくろ,Sea Breeze Sack
王宮のチェスト・赤,Red Royal Chest
かんだたしょうぐん,Robbin' 'Ood General
攻撃時15%で魔導の書,Magic Book Attack 15%
ギュッとリルチェラ,Lilcherat Arm Doll
司祭のほういセット,Pastor's Outfit
楽将バトルシェイカ,Music General Maracaraider
メタスラッＴシャツ,Metal Slime T-Shirt 2
あやしいカウンタ大,Suspicious Counter L
滅びの剣アンルシア,Anlucia, Sword of Perdition
聖王のつるぎの壁画,Dryspell Sword Book
こおりの杖のレシピ,Shiverstick Recipe
ビターチョコヌーバ,Dark Fudgeraker
空賊のシャツセット,Sky Pirate Outfit
おどるほうせきの書,Goodybag Book
エンゼルスラネオン,Angel Slime Neon Sign
かざぐるまのアーチ,Pinwheel Arch
ふのギフトボックス,Dark Gift Box
ヒューザのこころ１,Hyuza's Heart Lv. 1
書斎の筆記具セット,Study Writing Set
ウィキッドスタッフ,Wicked Staff
七夕の吹き流し・星,Paper Star Streamers
ごうかなグリル・赤,Red Fancy Grill
郵便局員エッキョウ,Postman Ekkyo
蘇生時早詠みと祈り,Casting & Healing Savior
ゴローさん部屋着上,Goro Shirt
裏ショコラチケット,Chocolate Ticket Back
スライムナイト・強,Vicious Slime Knight
吊るし潜水艦ライト,Submarine Hanging Light
ハニーポットチェア,Honey Pot Chair
凧あげナスビナーラ,Kite Flying Woebergine
大地の箱舟プリズム,Ark of the Earth Prism
門より出でし者たち,Dwellers from the Gate
通常ドロップ率1.1倍,Normal Drop Rate 1.1x
白亜の臨海都市地区,Chalky Waterfront
タロットパック・金,Gold Tarot Pack
パールキャスケット,Pearl Cap
奇跡のさいほう針小,Miracle Sew Needle S
スライムタワー噴水,Slime Stack Fountain
オグショー像こげ茶,Olive Ogreed Short St.
うさみみギフト・赤,Red Rabbit Ears Gift
サマーウルフ衣装券,Summer Wolf Costume Tkt
スライダーク練習札,Nemeslime Tag
大きなタルのベッド,Large Barrel Bed
シスター・ビゴスラ,Sister Bigosla
在りし日を示す地図,Map of the Past
カジノ祭４ビンゴ金,CasinoFest 4 Bingo Gold
ムニエカ地方への道,Road to Munieka Region
オブジェクト座標226,Object Coordinates 226
きなこづちの像・庭,Honeyhood Statue (G)
魔技師ベストセット,Technomancer Outfit
リンベリィトランプ,Linberry Cards
呪われたシシカバブ,Cursed Shish Kebab
ヘイズバットの分身,Avatar of Haze Bat
茶ブチ太猫カプセル,Fat Tea Spotted Cat Toy
うさみみギフト・青,Blue Rabbit Ears Gift
魔物管理人ポリッピ,Monster Manager Polippi
シスター・リアーヌ,Sister Liann
エピステルシャの像,Epistelsia Statue
シュメリアブラウス,Sumeria Blouse
バズスイーツカフェ,Pazu Sweets Cafe
エキゾチックピアス,Exotic Earrings
しぐさ書・バトル改,Emote "Battle" v2
ボルケーノウィップ,Volcano Whip
お菓子のテーブル小,Sweet Table S
実装テストアトラス,Implementation Test Atlas
旅芸人ピュージュＧ,Minstrel Pyuju G
しっこくのターバン,Macabre Turban
サジェのオルゴール,Sajay Music Box
オブジェクト座標253,Object Coordinates 253
ばあさんの愛情料理,Grandma's Loving Cooking
キングスライム噴水,King Slime Fountain
ポールスターボトム,North Star Pants
ヴァルハラメイル上,Valhalla Mail Top
グリーンシザー・強,Vicious Green Scissors
シックゴスグローブ,Chic Goth Gloves
バブルスライム・強,Vicious Bubble Slime
マイタウン古代地区,My Town Ancient District
スライムベホマズン,King Cureslime
くろがねのよろい上,Darksteel Cuirass
始源の歌姫のアーム,First Diva's Armbands
大型の四角い水そう,Square Aquarium L
マジェスタスーツ上,Majesta Shirt
エレガントに猛毒を,Elegantly Venomous
王都カミハルムイ駅,Kamiharmui Station
マジックスープ・小,Small Magic Soup
水の領界のかがり火,Water Realm Brazier
罪深きバラのように,Like a Sinful Rose
マリン調のバスタブ,Marine Bathtub
ビクトリーチップ海,Sea Victory Chip
赤色チューリップ傘,Red Tulip Umbrella
モダンローズドレス,Modern Rose Dress
スタジアムキャップ,Stadium Cap
王様のハンティング,King's Hunting
ルーキーのつなぎ上,Rookie Shirt
エルドナ神の装束上,Eldona's Dress Top
オブジェクト座標107,Object Coordinates 107
どうぐ使いグローブ,Item Master Gloves
月に還る双子の物語,Tale of Two Moons
揺らぎはじめる世界,World That Begins to Shake
フラウススティック,Flaus Wand
スコアアタック銀赤,Score Attack Bronze
初級魔法戦士タイツ,Novice ARM Tights
ファヒータのホウキ,Fajita's Broom
オブジェクト座標170,Object Coordinates 170
深海にうごめくもの,Deep Sea Lurker
ゲルト・勇気の儀式,Gert・Ritual of Courage
オブジェクト座標262,Object Coordinates 262
デュアルブレイカー,Double Down
ライダーヘルメット,Rider Helmet
魔王と副官の肖像画,Demon King Painting
ゴブル砂漠東への道,Road to Goble Desert East
ゼニスの封宮　入口,Palace of Zenith Entry
ストリートシューズ,Street Shoes
祭具・笹だんご絵巻,Bamboo Dumplings Recipe
商人トルネコの依頼,Merchant Torneko's Request
始まりの大魔王の舞,Demon King Origin Dance
オブジェクト座標061,Object Coordinates 061
セラフィムプリズム,Seraph Prism
エルドナ神の紐飾り,Eldona's String Decor
お魚と夏野菜の雑炊,Fish and Vegetable Dish
白のキーエンブレム,White Key Emblem
攻撃時25%バイキルト,Oomphle On Attack 25%
スターリーシールド,Starry Shield
景品交換所リーニャ,Prize Exchange Linya
色飾りタイルの鏡台,Color Tile Vanity
カンダタこぶんプー,Merry Man Pu
キューブライト・庭,Cube Light (G)
ごうかな飾り棚・赤,Red Fancy Shelf
赤のほこらの洞くつ,Red Shrine Cave
しぐさ書・お祝い白,Emote "Celebrate White"
原初の炎（聖火台）,Origin Flame (Platform)
ハイキングパーカー,Hiking Parka
古代オルセコの灯火,Old Orseco Light
第３回カジノ祭・銀,3rd Casino Fest Silver
プラチナのランプ小,Platinum Alch Lamp S
その先に行くために,To Go Beyond
メレアーデのリボン,Mereade Ribbon
スイゼン湿原への道,Road to Suizen Marsh
ドミニオンズガード,Dominions Guard
黄金の飾りよろい下,Gold Ornament Faulds
降魔のサークレット,Demonfel Circlet
マルコの錬金ランプ,Marco's Alchemy Lamp
モダンローズヒール,Modern Rose Heels
ポセイドンチェスト,Poseidon Chest
僧兵のサークレット,Monk Warrior Circlet
ひかりのタクトの本,Glow Stick Book
あなたと私の弓作り,You and I Making a Bow
帝国技術庁のチェア,Empire Tech Chair
岳都ガタラへの出口,Exit to Mount Gatara
キュートなウサミミ,Cute Bunny Ears
無限獣ネロスゴーグ,Eternal Beast Nerosugog
ゴルフメンズウェア,Golf Men's Wear
護門将ゴウシルシャ,Protector General Goshylsa
スチームテーブル大,Steam Table L
ギュッとアンルシア,Anlucia Arm Doll
マイタウン雪原地区,My Town Snow District
タイフーンレザー下,Typhoon Leather Pants
ネオン・虹サークル,Neon Rainbow Circle
ナイトマリーのタネ,Night Marie Seed
チョコが詰まった袋,Chocolate Filled Bag
ゼドラ王国服モブ６,Zedra Royal Clothes Mob 6
虹色のパーカー水着,Rainbow Hoodie Swimsuit
打ち上げ柳花火・赤,Red Willow Firework
黒衣の剣士グローブ,Dark Swordsman Gloves
美と富と豊穣と幸運,Beauty, Wealth And Luck
ダークプラムの花束,Dark Plum Bouquet
ポールスタートップ,North Star Shirt
オブジェクト座標202,Object Coordinates 202
良薬はキケンな香り,Good Medicine Smells Bad
シュバリエグローブ,Chevalier Gloves
賢哲のころもセット,Wise Man Outfit
壁かけのはめ殺し窓,Inset Windows
水底にたゆたうもの,Undersea Dwellers
ダイナースニーカー,Diner Sneakers
学園スキルブック１,Academy Skill Book 1
闇朱の破砕将ボーガ,Red Crush General Boga
プラチナトレイの本,Platinum Platter Book
金のロザリオの破片,Gold Rosary Shard
プリズニャン招き猫,Jailcat Figurine
プラチナ鍛冶ハンマ,Platinum Smith Hammer
千輪菊花火・緑紫桃,Gr./Pur./Pink Fireworks
星座の導き・いて座,Star Guide・Sagittarius
おうえんだんのふく,Cheer Team Suit
エテーネルキューブ,Ethenel Cube
フェアリーウィング,Fairy Wings
深い森の修道院の塀,Monastery Fence
魔法のペンプリズム,Magic Pen Prism
幸せの妖精のたまご,Happy Fairy Eggs
花咲ける木工職人道,The Woodworker's Way
魔塔の青宝石付き壁,Blue Tower Jeweled Wall
ターボル峡谷への道,Road to Tabor Gorge
マジックルーレット,Magic Roulette
全職かいふく魔力+10,Magical Mending +10
ランカーキャップⅠ,Ranker Cap Ⅰ
紫電とどろく時は今,Purple Lightning Time
蒼黒のフランベリー,Blue-Black Flanberry
背離する魔幻の血統,Separation Phantom Family
清廉天使のスーツ下,Honest Angel Pants
だいおうキッズ帽子,Squid Kid Hat
おばけのいしょう２,Ghost Costume 2
イブニンググローブ,Evening Gloves
エンゼルスライム帽,Angel Slime Cap
マジカルギフト・黄,Yellow Magical Gift
キャット・リベリオ,Purrgatroyd
フーたんぬいぐるみ,Futan Plushie
プラズマリムーバー,Plasma Remover
学園女子のエプロン,Schoolgirl Apron
どうぐ使いぼうし２,Item Master Hat 2
オブジェクト座標184,Object Coordinates 184
シルエット・ナイト,Silhouette Knight
サメきぐるみ衣装券,Shark Suit Ticket
白パールコンパクト,White Pearl Compact
モモリオンの日記帳,Sanguini King's Diary
ブランコ付きの庭木,Tree with Swing (G)
三姉妹の飛行船・桃,Pink 3 Sisters Blimp
ユニコーンプリズム,Unicorn Prism
エンドウマメのラグ,Pea Rug
あやしいカウンタ小,Suspicious Counter S
シスター・ディモス,Sister Deimos
ミステリークリーム,Mystery Cream
とある老行者の試練,Trials of an Old Pilgrim
古代魔術のほうい上,Ancient Magic Shirt
幻想画「一宿一飯」,Fantasy Art "Meal and Bed"
ホーリーキャンディ,Holy Lollipop
スライダークコイン,Nemeslime Coin
ゴローさんスリッパ,Goro Slippers
忍びのマフラー・赤,Red Ninja Scarf
レンタルドルボード,Rental Dolboard
タホドラキーぼうし,Drackmage Hat
炎帝のいくさ装束下,Fire God Pants
クリムゾンメイル上,Crimson Mail Top
ホットな海パン・白,White Hot Trunks
ハートの食器棚・黄,Yellow Heart Cupboard
プチＳキラーマシン,Frail Trauminator
異界獣ヘイズバイオ,Haze Bio, the Otherworldly
八の星獣イジュツィ,8th Star Beast Ijutsi
白バラのドレッサー,White Rose Vanity
宇宙船アルウェーン,Spacecraft Alweyn
ヴァルハラグリーブ,Valhalla Greaves
しぐさ書・ひやかす,Emote "Tease"
ブレイブギフト・青,Blue Brave Gift
オブジェクト座標285,Object Coordinates 285
オブジェクト座標077,Object Coordinates 077
魔神のムチのレシピ,Beelzebarb Recipe
苺お菓子のオーブン,Berry Sweet Oven
偽りのエテーネの島,False Ethene Island
聖守護者ブーメラン,Sentinel's Boomerang
氷の領界の氷ライト,Ice Realm Light
ナスビナーラ衣装券,Woebergine Costume Tkt
マデュライトのクギ,Darkonium Nails
オブジェクト座標155,Object Coordinates 155
オブジェクト座標003,Object Coordinates 003
キューピッドの噴水,Cupid Fountain
ザルトラ練習召喚符,Zaltra Trainer Summon
怨霊の憑いた戦士Ｃ,Warrior With a Grudge C
星空のチェスト・青,Blue Starry Chest
ダンクルオステウス,Dunkleosteus
ゴージャスティアラ,Gorgeous Tiara
まごころ駅弁を君に,Sincere Lunch for You
ワンダラーズグラブ,Wanderers Gloves
ゆらゆら牛さん・白,White Rocking Ox
ドルワーム研究ぐつ,Dolworm Research Shoes
壁かけガタラ紋章旗,Gatara Wall Banner
福笑いのラグ・まゆ,Fukuwarai Eyebrow Rug
しぐさ書・ミルク缶,Emote "Milk Can"
レトロなポスト・金,Gold Retro Mailbox
フリルのビキニ・赤,Red Frill Bikini
アンルシアの便せん,Anlucia Paper
しぐさ書・打成一片,Emote "Become One"
異国のレンガ館の塀,Exotic Brick Fence
灰三毛太猫カプセル,Fat Ash Calico Cat Toy
パピヨンベッド・夢,Dream Papillon Bed
プラコン・黒い唐傘,Black Paper Umbrella
しぐさ書・ペンペン,Emote "Spank"
ＤＱＸ１０周年花火,DQX 10th Anni. Firework
オブジェクト座標048,Object Coordinates 048
クリムゾングローブ,Crimson Gloves
第１０回プクラス像,10th Pukulas Statue
キャプテングローブ,Captain's Gloves
第９回ハクオウの像,9th Hakuo Statue
破壊のオノの作り方,Obliteratoriser Book
マスター・ポーリア,Guildmaster Paulia
スラベスぬいぐるみ,She-Slime Plushie
カフェテラスの看板,Cafe Terrace Sign
占星術師のローブ上,Astrologer Upper Robe
オブジェクト座標216,Object Coordinates 216
忍びのマフラー・紫,Purple Ninja Scarf
エテーネのあいさつ,Ethene Greeting
天星郷の翼プリズム,Firmament Wings Prism
ファンキータイツ下,Funky Tights
真・魔幻宮殿の篝火,Demon Palace Flame
舞踏魔プレシアンナ,Dancing Demon Prescianna
オブジェクト座標185,Object Coordinates 185
森林警備隊グローブ,Forest Ranger Gloves
闇芸人ルルルリーチ,Relulu
ブルーハートピアス,Blue Heart Earrings
まもの導師グローブ,Monster Guru's Gloves
廃墟のドミネウス邸,Abandoned Domineus Mansion
回転木馬のモビール,Carousel Mobile
ようせいのあまざけ,Fairy Sweet Sake
三毛猫スーツ衣装券,Calico Cat Suit Ticket
オブジェクト座標000,Object Coordinates 000
メタスラの大剣の本,Metal Gooreatsword Book
ピクニックプクラス,Pukulas Picnic
ゴールドフィンガー,Rake 'n' Break
お姫様キッチン・桃,Pink Princess Kitchen
大きな黄金の秘宝？,Large Golden Treasure ?
セラフィぬいぐるみ,Seraphi Plushie
カンダタこぶんクー,Merry Man Ku
ドラキーぬいぐるみ,Dracky Plushie
バイオレットの花束,Violet Bouquet
メリクリギフト・紺,Navy Christmas Gift
しぐさ書・ショック,Emote "Shock"
オブジェクト座標162,Object Coordinates 162
ごうかなベッド・緑,Green Fancy Bed
すざくの弓の秘伝書,Vermilion Bird Bow Book
ビクトリーチップ冥,Hades Victory Chip
タイタス号の望遠鏡,Titus Telescope
グランドタイタス号,Grand Titus
茶柴ピュアカプセル,Pure Brown Shiba Toy
フューチャースーツ,Future Suit
王都の小さな案内人,Guide to the Royal City
果てなき夢の芸人道,Dream of Entertaining
聖銀のどくろあらい,Sacred Silver Haardvark
りょうりにんぴーら,Chef Peera
とこしえの神殿広間,Temple of Eternity Hall
スライムナイトの像,Slime Knight Statue
ゾディアックコード,Zodiac Code
わだつみのころも上,Sea God Robe Top
ハンディキャンドル,Handy Candle
苺お菓子の間仕切り,Berry Sweet Partition
オブジェクト座標132,Object Coordinates 132
パンジーのかんむり,Pansy Crown
スパングルドレス上,Spangled Dress Top
ブルーハワイかき氷,Blue Hawaii Shaved Ice
ワンダラーズマント,Wanderers Mantle
あらくれチャッピー,Ripped Rabbit
フリルスイムワンピ,Frill Swim Dress
ワーニングな足ヒレ,Warning Flippers
強戦士の聖域・前室,Warrior's Sanctuary - Gate
白柴モダンカプセル,Hip White Shiba Toy
ギュッとメイヴの箱,Meiv Arm Doll Box
ラッキーマシュマロ,Lucky Marshmallows
リーフ柄の便利な壁,Leaf Pattern Wall
ウイングエッジの本,Razor-Wing Book
アズラン地方の木Ａ,Azlan Region Tree A
メルサンディ穀倉帯,Melsandy Millfields
魔女は高らかに笑う,The Witch Laughs Loudly
オブジェクト座標095,Object Coordinates 095
灰ねこシャンデリア,Ash Cat Chandelier
アクロバットスター,Rough 'n' Tumble
千輪菊花火・青緑水,Blue/Gr./Aqua Fireworks
クマリスのブラウス,Kumaris' Blouse
プチキラーマジンガ,Frail Uberkilling Machine
うさぎエステラ人形,Rabbit Estella Doll
ランプ錬金職人の神,Lamp Alchemist God
キャロルコサージュ,Carol Corsage
マイタウン水没地区,My Town Submerged District
異界獣ヘイズナイト,Haze Knight, the Otherworldly
ソーミャ宛ての手紙,Letter to Somya
ニューＶロンコイン,New Vron Coin
ベルセルクブレード,Mad Warrior's Blade
ピヨちゃんＴシャツ,Chick T-Shirt
邪将トロルバッコス,General Gladiator Troll
スライダークの大剣,Nemeslime Greatsword
エイルのスティック,Eir's Wand
つやつやなタケノコ,Glossy Bamboo Shoot
チョコレートリップ,Chocolate Tulip
ギュメイ将軍練習札,Goresby-Purrvis Tag
オルッパ地下洞くつ,Orppa Underground Caves
パドレ救出大作戦！,Padre Rescue Operation!
メタスラぬいぐるみ,Metal Slime Plushie
オブジェクト座標042,Object Coordinates 042
ふしぎな燭台・赤色,Red Mystery Candlestick
白トラ太猫カプセル,Fat White Tabby Toy
ピラミッドの便せん,Pyramid Paper
魔物管理人セモーナ,Monster Manager Semona
巨大風船青スライム,Big Blue Slime Balloon
ヒューザのこころ４,Hyuza's Heart Lv. 4
メロディアシューズ,Melody Shoes
ホイミントドレス上,Heal Mint Blouse
パニガキャッチャー,Paniga-Catcher
ビクトリーチップ祭,Festival Victory Chip
僧兵のころもセット,Monk Warrior Outfit
プレゼントチケット,Present Ticket
錬金魔王の言い伝え,Alchemy Demon King Lore
どうぐ使いのブーツ,Item Master Boots
ピカレスクグローブ,Picaresque Gloves
プチゲルニック将軍,Frail Hootingham-Gore
いたずらもぐら・強,Vicious Mischievous Mole
王軍師のよろいの本,Royal Soldier Gear Book
メス三毛猫スーツⅡ,Calico Cat Suit (F) Ⅱ
スノーモンかまくら,Snow Sanguini Hut
