アルファ用アルウェ王妃の別荘跡(子供たちの隠れ家内部Test),Queen Alwe's Villa Ruins for Alpha (Test Inside Children's Hideout)
バトル班用テストマップ（いにしえのゼルメア）,Team Battle Map Test (Ancient Zelmea)
どらごんくえすとえいとしゅじんこうのいしょう,DQⅧ Hero Costume
このマップは モンスターから逃げられません。,You can't run from monsters on this map.
マッチングテストステージ（同期テスト用）,Match test stage (for sync testing)
マッチングテストステージ（同期後移動用）,Match test stage (for moving beat testing)
　　　～モンスター討伐隊隊員からの依頼～,         Monster Strike Force Request
グランゼドーラ領-グランゼドーラ王国 入口,Gran Zedora Territory - Gran Zedora Kingdom Entry
リャナ荒涼地帯-ねじれたる異形の大地 入口,Lyana Desolate Area - Twisted Deformed Earth Entry
メルサンディ穀倉帯-さびれたほこら 入口,Melsandy Millfields - Deserted Shrine Entry
アラハギーロ地方-アラハギーロ王国 入口,Al-Ahagiro Region - Kingdom of Al-Ahagiro Entry
メルサンディ穀倉帯-こもれびの広場 入口,Melsandy Millfields - Sunbeam Square Entry
アラハギーロ地方-モンスター格闘場 入口,Al-Ahagiro Region - Monster Arena Entry
メルサンディ穀倉帯-メルサンディ村 入口,Melsandy Millfields - Melsandy Village Entry
こうげき力上昇時 特技のダメージ +20<ban>,Skill Dmg. +20 When Attack ↑ (PvP×)
季節イベント「お月見」　コンパニオン,Seasonal Event "Moon View" Companion
ぷらこんだんせいようそくたいむらさき,Purple Ceremony Gown
季節イベント「オ月見」　コンパニオン,Seasonal Event "Moon View" Companion
バトル班用テストマップ（ムスト廃墟）,Team Battle Map Test (Musuto Ruins)
メルサンディ穀倉帯-メルン水車郷 入口,Melsandy Millfields - Melun Watermill Entry
アラハギーロ地方-日除けのほら穴 入口,Al-Ahagiro Region - Sunshade Cave Entry
アラハギーロ地方-ムルードの岩山 入口,Al-Ahagiro Region - Murudo Mountain Entry
受けた属性ダメージの 10%ＨＰ回復<ban>,10% Attribute Damage Taken As HP (PvP×)
しかし　持ち物が　いっぱいだった！,But you're carrying too many things!
ぷらこんだんせいようそくたいみどり,Green Ceremony Gown
ぷらこんすくーるせいふくおとこちゃ,Brown School Uniform (M)
ぷらこんすくーるせいふくおんなこん,Blue School Uniform (F)
ぷらこんすくーるせいふくおとここん,Blue School Uniform (M)
ぷらこんすくーるせいふくおんなちゃ,Brown School Uniform (F)
神代過ぎ～　春の桜よ　無為に咲く～,Past ages divine, the spring blossoms bloom, waiting idly by...
ぷらこんすくーるせいふくおとこくろ,Black School Uniform (M)
ルファ神殿エントランス（オープン）,Rufa Temple - Entry (Open)
ぷらこんすくーるせいふくおとこしろ,White School Uniform (M)
ぷらこんすくーるせいふくおんなあか,Red School Uniform (F)
ぷらこんすくーるせいふくおんなくろ,Black School Uniform (F)
ぷらこんすくーるせいふくおとこあか,Red School Uniform (M)
ぷらこんすくーるせいふくおんなしろ,White School Uniform (F)
アルファ用井戸(ダンダダ団のアジト),Well for Alpha (Robbin' 'Ood Gang HQ)
コニウェア平原-ココラタの浜辺 入口,Coniware Plain - Cocolata Beach Entry
リャナ荒涼地帯-ソーラリア峡谷 入口,Lyana Desolate Area - Solaria Canyon Entry
バトル班用テストマップ(ツスクル）,Team Battle Map Test (Tsuskuru)
ぷらこんじょせいようみどりさんた,Green Women's Santa Suit
ぷらこんじょせいしのびのふくもも,Pink Women's Ninja Suit
ぷらこんだんせいしのびのふくこん,Navy Men's Ninja Suit
だんせいぷらこんふくみっどないと,Midnight Clothes (M)
エフェクトイメージさん（１０個）,Mr. Effect Image (10)
ぷらこんだんせいしのびのふくあか,Red Men's Ninja Suit
ぷらこんだんせいしのびのふくあお,Blue Men's Ninja Suit
ぷらこんだんせいしのびのふくちゃ,Tea Men's Ninja Suit
バトル班用テストマップ（獅子門）,Team Battle Map Test (Lion Gate)
じょせいぷらこんふくあいすぶるー,Ice Blue Clothes (F)
ぷらこんだんせいようそくたいちゃ,Tea Ceremony Gown
ぷらこんだんせいようそくたいあお,Blue Ceremony Gown
ぷらこんだんせいしのびのふくくろ,Black Men's Ninja Suit
ぷらこんだんせいようみどりさんた,Green Men's Santa Suit
ぷらこんじょせいむらさきふりそで,Purple Women's Kimono
ぷらこんじょせいしのびのふくこん,Navy Women's Ninja Suit
だんせいぷらこんふくみすとぐれー,Mist Gray Clothes (M)
ぷらこんじょせいしのびのふくあか,Red Women's Ninja Suit
ぷらこんだんせいようそくたいはい,Ash Ceremony Gown
プンスコのテーブル＆ティーセット,Punsuko's Table & Tea Set
ぷらこんじょせいしのびのふくくろ,Black Women's Ninja Suit
じょせいぷらこんふくみっどないと,Midnight Clothes (F)
あすふぇるどがくえんがくせいふく,Asfeld Academy Uniform
だんせいぷらこんふくだーくぐれー,Dark Gray Clothes (M)
ぷらこんじょせいみこふくむらさき,Purple Priestess Dress
ぷらこんじょせいしのびのふくあお,Blue Women's Ninja Suit
セレドット山道-ベリルのほら穴 前,Celedot Mountain Pass - Beryl Den
リンジャハル海岸-教会シスター 前,Linjahar Coast - Church Sister
レビュール街道北-海風の洞くつ 前,Reviewle Highway North - Seabreeze Cave
リンジャハル海岸-リンジャの塔 前,Linjahar Coast - Linja Tower
マデ島＆エテーネ王宮（4.5CS専用）,Made Isle & Ethene Royal Manor (4.5CS only)
プログラマー用負荷検証ステージ4,Loading Programmer Verification Stage 4
プログラマー用負荷検証ステージ5,Loading Programmer Verification Stage 5
プログラマー用負荷検証ステージ3,Loading Programmer Verification Stage 3
プログラマー用負荷検証ステージ1,Loading Programmer Verification Stage 1
必殺チャージ時 チャージ時間-10秒,Charge Time -10 sec. On Special
追憶の世界-アルウェ王妃の別荘跡,World of Remembrance-The Ruins of Queen Alwe
プログラマー用負荷検証ステージ2,Loading Programmer Verification Stage 2
じょせいぷらこんふくさんせっと,Sunset Clothes (F)
30%の確率で受けたダメージ10%反射,30% Chance to Reflect 10% Damage
ぷらこんじょせいみこふくみどり,Green Priestess Dress
ぷらこんだんせいようくろさんた,Black Men's Santa Suit
ぷらこんじょせいようあかさんた,Red Women's Santa Suit
ぷらこんだんせいようあかさんた,Red Men's Santa Suit
ぷらこんだんせいようももさんた,Pink Men's Santa Suit
はなかりゅうどのころもむらさき,Purple Flower Hunter Outfit
ゴリウスの怨霊＆魔道士キルギル,Gorius' Vengeance & Wizard Kirgyl
ハロウィンクイズ解答ウェディ５,Halloween Quiz Answer Weddie 5
ぷらこんじょせいようあかあろは,Red Women's Aloha
魔天の勇者＆聖夜の破壊者・闇組,Demon Sky Hero & Holy Night Wrecker Dark Team
ハロウィンクイズ解答ウェディ４,Halloween Quiz Answer Weddie 4
ぷらこんじょせいようしろさんた,White Women's Santa Suit
\s\m\eは　コインをなげた。　→　,\s\m\e flips a coin. → The coin lands on !
ぷらこんだんせいようあおあろは,Blue Men's Aloha
ぷらこんこどもようみずぎせっと,Children's Swimsuit
ハロウィンクイズ解答ウェディ７,Halloween Quiz Answer Weddie 7
ハロウィンクイズ解答ウェディ２,Halloween Quiz Answer Weddie 2
ぷらこんじょせいようあおあろは,Blue Women's Aloha
\s\m\eは　カードを引いた。　→　,\s\m\e draws a card. → They draw the !
ハロウィンクイズ解答ウェディ６,Halloween Quiz Answer Weddie 6
ぷらこんじょせいようしろあろは,White Women's Aloha
ぷらこんだんせいようももあろは,Pink Men's Aloha
ぷらこんじょせいようくろさんた,Black Women's Santa Suit
魔天の勇者＆聖夜の破壊者・雪組,Demon Sky Hero & Holy Night Wrecker Snow Team
ぷらこんだんせいようしろさんた,White Men's Santa Suit
ぼうえいぐんのせいふくはいいろ,Gray Defense Force Suit
豪魔将ベリンダ＆豪魔将ブレンダ,Generals Belinda & Brenda
壊れたアストルティアのコンパス,Broken Astoltia Compass
扉は　かたく　閉ざされている。,The door is tightly closed.
\s\m\eは　ダイスをふった。　→　,\s\m\e rolls a die. → It's a !
ぷらこんじょせいようももあろは,Pink Women's Aloha
ぼうえいぐんのせいふくむらさき,Purple Defense Force Suit
ぷらこんじょせいようももさんた,Pink Women's Santa Suit
えるどなしんのしょうぞくせっと,Eldona's Outfit
ぷらこんだんせいはかまむらさき,Purple Men's Hakama
ハロウィンクイズ解答ウェディ３,Halloween Quiz Answer Weddie 3
ぷらこんだんせいようしろあろは,White Men's Aloha
ハロウィンクイズ解答ウェディ１,Halloween Quiz Answer Weddie 1
セレドット山道-セレドの町 入口,Celedot Mountain Pass - Town of Celed Entry
デフェル荒野-不思議の魔塔 入口,Defel Desert - Mysterious Tower Entry
レビュール街道南-三門の関所 前,Reviewle Highway South - Three Way Gate
ドラクロン山地-竜守りの小屋 前,Draklon Mountains - Dragon Guard's Hut
リャナ荒涼地帯-滝を臨む集落 前,Lyana Desolate Area - Waterfall Village
ジャイラ密林-クドゥスの泉 入口,Jyra Jungle - Kudus Spring Entry
モンセロ温泉峡-中央のやぐら 前,Moncello Spring Gorge - Central Scaffold
コニウェア平原-教会シスター 前,Coniware Plain - Church Sister
リャナ荒涼地帯-くずれた灯台 前,Lyana Desolate Area - Collapsed Lighthouse
テンション時のダメージ +100<ban>,Damage During Tension +100 (PvP×)
こうげき魔力とかいふく魔力 +10,Magical Might/Mending +10
戦いで 魔物に狙われにくくなる,Less likely to be targeted in battle
アルファ用追憶の世界 別荘跡編,World of Recollection for Alpha Villa Ruins
会心と暴走時のダメージ +100<ban>,Critical/Haywire Damage +100 (PvP×)
チームゆく年くる年　２０１７,Team New Year 2017
ぷらこんだんせいようきあろは,Yellow Men's Aloha
ハロウィンクイズ解答エルフ５,Halloween Quiz Answer Elf 5
ぷらこんおんなぱんぷきんふく,Women's Pumpkin Clothes
チームゆく年くる年　２０２２,Team New Year 2022
ぷらこんじょせいあかふりそで,Red Women's Kimono
ぷらこんおんなどらきゅらふく,Women's Dracula Costume
ＤＱⅧしゅじんこうのいしょう,DQⅧ Hero Costume
ハロウィンクイズ解答エルフ６,Halloween Quiz Answer Elf 6
魔人エンラージャ＆ムッチーノ,Enraja the Genie & Muccino
チームゆく年くる年　２０２０,Team New Year 2020
だんせいしらなみがらのゆかた,White Wave Yukata (M)
ぷらこんおとこぱんぷきんふく,Men's Pumpkin Clothes
ぷらこんじょせいくろふりそで,Black Women's Kimono
ハロウィンクイズ解答エルフ２,Halloween Quiz Answer Elf 2
行動時 5%でバイシオンとスカラ,Oomph & Buff On Action 5%
ぷらこんすいーとふくだいだい,Orange Sweet Clothes
チームゆく年くる年　２０１９,Team New Year 2019
チームゆく年くる年　２０２４,Team Twenty Twenty Four
ぷらこんしゃわーよういしょう,Shower Outfit
ぷらこんじょせいしろふりそで,White Women's Kimono
巨人コアを守るジア・クトたち,Defenders of the Core
ヴァレリアの仮面（割れる前）,Valeria's Unbroken Mask
フォークに刺さったパンケーキ,Pancakes Stuck in a Fork
チームゆく年くる年　２０２３,Team New Year 2023
はなかりゅうどのころもみどり,Green Flower Hunter Outfit
ぼうえいぐんのせいふくみどり,Green Defense Force Suit
ハロウィンクイズ解答エルフ１,Halloween Quiz Answer Elf 1
ラダ・ガートたちに連絡を取る,Contact Lada Gart's Group
じょせいぷらこんふくむらさき,Purple Clothes (F)
ぷらこんじょせいみこふくあお,Blue Priestess Dress
ぷらこんじょせいみこふくもも,Pink Priestess Dress
ハロウィンクイズ解答エルフ３,Halloween Quiz Answer Elf 3
ハロウィンクイズ解答エルフ７,Halloween Quiz Answer Elf 7
あすふぇるどがくえんふゆふく,Asfeld Academy Winter Wear
ぷらこんおとこどらきゅらふく,Men's Dracula Costume
ぷらこんじょせいみこふくあか,Red Priestess Dress
わかむしゃのかっちゅうせっと,Young Warrior Armor Set
行動時 5%でバイシオンとピオラ,Oomph & Accelerate On Action 5%
嵐魔ウェンリルとアクラガレナ,Wenrir the Storm & Akragarena
ぷらこんだんせいようあかろは,Red Men's Aloha
ハロウィンクイズ解答エルフ４,Halloween Quiz Answer Elf 4
闇に唄う氷にまぎれし聖なる者,Frozen Sacred Singer
はるかぜおうえんだんいしょう,Spring Cheer Team Outfit
どるわーむけんきゅういんふく,Dolworm Research Suit
はなかりうどのころもむらさき,Purple Flower Hunter Outfit
チームゆく年くる年　２０１８,Team New Year 2018
チームゆく年くる年　２０２１,Team New Year 2021
ぷらこんきゅーぴっどむらさき,Purple Cupid
ぷらこんじょせいようきあろは,Yellow Women's Aloha
チームゆく年くる年　２０２５,Team New Year 2025
あすふぇるどがくえんなつふく,Asfeld Academy Summer Wear
じょせいしらなみがらのゆかた,White Wave Yukata (F)
魔天の勇者＆キラークリスマス,Demon Sky Hero & Christmas Killing Machine
ぷらこんじょせいももふりそで,Pink Women's Kimono
行動時 7%でバイシオンとピオラ,Oomph & Accelerate On Action 7%
ロヴォス高地-教会シスター 前,Rovos Highlands - Church Sister
モンセロ温泉峡-南のやぐら 前,Moncello Spring Gorge - South Scaffold
モンセロ温泉峡-ご神体の間 前,Moncello Spring Gorge - Hall of Worship
デフェル荒野-教会シスター 前,Defel Desert - Church Sister
モンセロ温泉峡-管理人小屋 前,Moncello Spring Gorge - Caretaker's Hut
グランゼドーラ領-見張り塔 前,Gran Zedora Territory - Watchtower Front
デフェル荒野-ピラミッド 入口,Defel Desert - Pyramid Entry
コニウェア平原-三門の関所 前,Coniware Plain - Three Way Gate
モンセロ温泉峡-北のやぐら 前,Moncello Spring Gorge - North Scaffold
ジャイラ密林-大樹の根元 入口,Jyra Jungle - Big Tree Root Entry
リンジャハル海岸-高台の遺跡,Linjahar Coast - Hilltop Ruins
セレドット山道-滝見の吊り橋,Celedot Mountain Pass - Fallsview Bridge
追憶の世界-キラキラ大風車塔,World Of Remembrance-Windmill Tower
炎・土・闇の攻撃ダメージ +5%,Fire/Earth/Dark Damage +5%
だんせいぷらこんふくぴんく,Pink Clothes (M)
だるめしあんがーるいしょう,Dalmatian Outfit (F)
ハロウィンクイズ解答オガ６,Halloween Quiz Answer Ogre 6
ハロウィンクイズ解答ヒト６,Halloween Quiz Answer Human 6
攻撃時 5%でチャージ時間-10秒,Charge Time -10s On Attack 5%
だんせいぷらこんふくえんじ,Red Clothes (M)
ドルボ用マネキンプクリポ用,For Pukulipo Mannequin For Dolboard
男性プラコン服ミッドナイト,Midnight Clothes (M)
ハロウィンクイズ解答オガ４,Halloween Quiz Answer Ogre 4
ハロウィンクイズ解答プク６,Halloween Quiz Answer Puku 6
アスフェルド学園女性用夏服,Asfeld Summer Uniform (F)
ぼうえいぐんのせいふくきん,Gold Defense Force Suit
ドルボ用マネキンドワーフ用,For Dwarf Mannequin For Dolboard
ハロウィンクイズ解答オガ７,Halloween Quiz Answer Ogre 7
ハディン地下洞くつへの出口,Exit to Hadine Cavern
ハロウィンクイズ解答ヒト１,Halloween Quiz Answer Human 1
未完のドラクロン山地への道,Road to Undone Draklon Mountains
からすかぐらのしょうぞくⅡ,Crow Dance Costume Ⅱ
アスフェルド学園男性用水着,Asfeld Swimwear (M)
ぼうえいぐんのせいふくあか,Red Defense Force Suit
ドラゴンクエストＸショップ,Dragon Quest X Shop
ハロウィンクイズ解答ドワ４,Halloween Quiz Answer Dwarf 4
行動時 5%でチャージ時間-10秒,Charge Time -5 sec. On Action 5%
ハロウィンクイズ解答ドワ１,Halloween Quiz Answer Dwarf 1
ぷらこんいけてるみずぎあか,Red Cool Swimsuit
ぷらこんいけてるみずぎあお,Blue Cool Swimsuit
砂の都ファラザードへの出口,Exit to Farazard
ランドン山脈山頂付近への道,Road to Landon Summit Area
ムストの町・教会跡への出口,Exit to Morst - Church Ruins
ぷらこんおしゃれみずぎあお,Blue Snazzy Swimsuit
じょせいぷらこんふくえんじ,Red Clothes (F)
魔物商人＆商品ナンバー１３,Monster Merchant & Item Number 13
らんぷれんきんれんしゅうぎ,Lamp Alchemy Training Wear
ハロウィンクイズ解答オガ２,Halloween Quiz Answer Ogre 2
未開のジャングル地区への道,Road to Savage Jungle
ぷらこんえんじぇるふくあか,Red Angel Clothes
ハロウィンクイズ解答オガ５,Halloween Quiz Answer Ogre 5
フラワーガーデン地区への道,Road to Flower Garden District
行動時 5%でテンションアップ,Tension On Action 5%
アスフェルド学園男性用夏服,Asfeld Summer Uniform (M)
ぷらこんえんじぇるふくもも,Pink Angel Clothes
スターキメラから取った羽根,Cosmic Chimaera Feather
キュロンイーターの巣への道,Path to Kyuroneater's Nest
１００万ゴールドの入った袋,1 Million Gold Bag
ぷらこんおしゃれみずぎもも,Pink Snazzy Swimsuit
『ついてクンをひっこめる』,"Remove Pet"
ぷらこんだんせいはかまくろ,Black Men's Hakama
ぷらこんいけてるみずぎもも,Pink Cool Swimsuit
男性プラコン服ミストグレー,Mist Gray Clothes (M)
だるめしあんぼーいいしょう,Dalmatian Outfit (M)
戦闘中常時マホトラのころも,Magic Cloak Always Active
イルーシャのスケッチブック,Illusia's Sketchbook
ルクスガルン大空洞への亀裂,Crevice to Luxgarn Caverns
清き風吹き　草木は芽吹く～,Pure winds blown and trees grown, budding green as the breeze is thrown
ゆうべはおたのしみでしたね,Rooming with a Gamer Gal
壊れたハイハイジャンプさん,Broken Mr. High High Jump
ハロウィンクイズ解答プク１,Halloween Quiz Answer Puku 1
とうばつたいこうほうきょく,Strike Force Bureau
古レビュール街道北への出口,Exit to Old Reviewle Highway North
ハロウィンクイズ解答ヒト４,Halloween Quiz Answer Human 4
ハロウィンクイズ解答オガ３,Halloween Quiz Answer Ogre 3
未来への扉とまどろみの少女,The Door to the Future & the Slumbering Girl
からすかぐらのしょうぞくⅠ,Crow Dance Costume Ⅰ
ぼうえいぐんのせいふくこん,Blue Defense Force Suit
ぷらこんえんじぇるふくあお,Blue Angel Clothes
ハロウィンクイズ解答オガ１,Halloween Quiz Answer Ogre 1
ぷらこんおしゃれみずぎくろ,Black Snazzy Swimsuit
未完のモンセロ温泉峡への道,Road to Undone Moncello Spring Gorge
ハロウィンクイズ解答ドワ５,Halloween Quiz Answer Dwarf 5
ぷらこんいけてるみずぎしろ,White Cool Swimsuit
ぷらこんぱてぃしえふくあか,Red Pastry Chef Suit
ムストの町・風車へのはしご,Morst - Ladder to the Windmill
アスフェルド学園女性用水着,Asfeld Swimwear (F)
はなかりゅうどのころもあお,Blue Flower Hunter Outfit
ハロウィンクイズ解答ヒト７,Halloween Quiz Answer Human 7
ドルボ用マネキンウェディ用,For Weddie Mannequin For Dolboard
ぷらこんえんじぇるふくしろ,White Angel Clothes
ぷらこんえんじぇるふくくろ,Black Angel Clothes
ぷらこんぱてぃしえふくもも,Pink Pastry Chef Suit
ハロウィンクイズ解答ヒト５,Halloween Quiz Answer Human 5
ハロウィンクイズ解答プク２,Halloween Quiz Answer Puku 2
ハロウィンクイズ解答ドワ３,Halloween Quiz Answer Dwarf 3
ぷらこんいけてるみずぎくろ,Black Cool Swimsuit
じょせいぷらこんふくぴんく,Pink Clothes (F)
ハロウィンクイズ解答ヒト３,Halloween Quiz Answer Human 3
ドルボ用マネキンニンゲン用,For Human Mannequin For Dolboard
古グランゼドーラ領への出口,Exit to Old Gran Zedora Territory
ぷらこんだんせいはかまこん,Navy Blue Men's Hakama
イア・タア　シンパッ・ケウ,E-yis, aneu dish cubrey
ぷらこんぱてぃしえふくあお,Blue Pastry Chef Suit
ぷらこんおしゃれみずぎあか,Red Snazzy Swimsuit
女性プラコン服アイスブルー,Ice Blue Clothes (F)
はなかりうどのころもみどり,Green Flower Hunter Outfit
ハロウィンクイズ解答ドワ７,Halloween Quiz Answer Dwarf 7
男性プラコン服ダークグレー,Dark Gray Clothes (M)
女性プラコン服ミッドナイト,Midnight Clothes (F)
ぷらこんぱてぃしえふくしろ,White Pastry Chef Suit
ハロウィンクイズ解答プク３,Halloween Quiz Answer Puku 3
行動時 3%でテンションアップ,Tension On Action 3%
はなかりゅうどのころもあか,Red Flower Hunter Outfit
ぷらこんおしゃれみずぎしろ,White Snazzy Swimsuit
『おうちでついてクン設定』,"House Pet Settings"
ハロウィンクイズ解答プク５,Halloween Quiz Answer Puku 5
ぷらこんだんせいはかまあお,Blue Men's Hakama
ハロウィンクイズ解答プク４,Halloween Quiz Answer Puku 4
ぷらこんだんせいはかましろ,White Men's Hakama
ハロウィンクイズ解答ヒト２,Halloween Quiz Answer Human 2
ハロウィンクイズ解答ドワ２,Halloween Quiz Answer Dwarf 2
ハロウィンクイズ解答プク７,Halloween Quiz Answer Puku 7
ハロウィンクイズ解答ドワ６,Halloween Quiz Answer Dwarf 6
デスディオ暗黒荒原への出口,Exit to Deathdio Darklands
アルムゴーグ＆ロムドゴーグ,Armogog & Romdogog
ロヴォス高地-ゼドラ洞 入口,Rovos Highlands - Zedra Cave Entry
受けるダメージを10軽減する,Damage Taken -10
5000年の旅路 遥かなる故郷へ,5000 Year Journey to a Faraway Hometown
ワルド水源-湖上の休息所 前,Wald Headwaters - Lake Retreat
必殺チャージ時 身かわし+10%,Dodge +10% On Special Charge
テンション時のダメージ +300,Damage During Tension +300
レビュール街道北-谷合の森,Reviewle Highway North - Veil of the Vale
デス・ジャンクション 入口,Death's Juncture Entry
瀕死時 20%こうげき力 +60<ban>,Near-Death Attack +60 20% (PvP×)
異界アスタルジア深部 出口,Depths of Astalgia Exit
受けるダメージを5軽減する,Damage Taken -5
開戦時 10%でヘヴィチャージ,Starting Heavy Charge 10%
デス・ジャンクション 出口,Death's Juncture Exit
プログラマー検証ステージ4,Programmer Verification Stage 4
プログラマー検証ステージ6,Programmer Verification Stage 6
ビンゴすごろくホール 入口,Bingo & Sugoroku Hall Entry
プログラマー検証ステージ1,Programmer Verification Stage 1
宇宙船・立入禁止区画 出口,Spacecraft - Restricted Area Exit
ビタースイーツゾーン 出口,Bittersweets Zone Exit
バルメシュケの研究所 出口,Balmeschke's Laboratory Exit
カルデア山道のアジト 入口,Chaldea Mountain Road Hideout Entry
オルセコ闘技城・舞台 入口,Orseco Combat Castle - Stage Entry
プログラマー検証ステージ2,Programmer Verification Stage 2
モリナラ地下洞・深淵 出口,Molinara Underground Abyss Exit
プログラマー検証ステージ3,Programmer Verification Stage 3
からすかぐらのしょうぞく2,Crow Dance Costume Ⅱ
モリナラ地下洞・深淵 入口,Molinara Underground Abyss Entry
プログラマー検証ステージ5,Programmer Verification Stage 5
スライムレースホール 出口,Slime Race Hall Exit
カルデア山道のアジト 出口,Chaldea Mountain Road Hideout Exit
キュロンイーターの巣 出口,Kyuroneater's Nest Exit
オルセコ闘技城・舞台 出口,Orseco Combat Castle - Stage Exit
古グランゼドーラ王国 入口,Old Gran Zedora Kingdom Entry
スライムレースホール 入口,Slime Race Hall Entry
エピステーサ底なし穴 入口,Epistesa Chasm Entry
プログラマー検証ステージ8,Programmer Verification Stage 8
瀕死時 15%こうげき力 +60<ban>,Near-Death Attack +60 15% (PvP×)
湖の小島・神のまなこ 入口,Lake Islet - The All-seeing Eye Entry
シガール町長の執務室 入口,Mayor Sigal's Office Entry
キュロンイーターの巣 入口,Kyuroneater's Nest Entry
リンジャハル海岸-海岸遺跡,Linjahar Coast - Coast Ruins
アストルティア博物館 入口,Astoltia Museum Entry
スイーツゾーン控え室 入口,Sweets Zone Waiting Room Entry
バルメシュケの研究所 入口,Balmeschke's Laboratory Entry
スイーツゾーン控え室 出口,Sweets Zone Waiting Room Exit
宇宙船・立入禁止区画 入口,Spacecraft - Restricted Area Entry
