マーメイドバスタブ,Mermaid Bathtub
エージェントマスク,Agent Mask
カンフースリッポン,Kung Fu Slip-Ons
職人道具をかかげる,Hold Up Crafting Tool
古代都市地区への道,Road to Ancient Suburb
はじゃのろーぶどう,Bronze Champ Robe
バイカラーメッシュ,Bicolor Mesh
究極邪教司祭練習札,Ultimate Aamon Tag
しぐさ書・ガリバー,Emote "Gulliver Hand"
いしにんぎょう・強,Vicious Dirty Dogu
サーカスハウスの壁,Circus House Wall
ストームグラス・庭,Storm Glass (G)
しおさいキャンディ,Salted Candy
ポセイドンバスタブ,Poseidon Bathtub
ムーンバニーシャツ,Moon Bunny Shirt
オブジェクト座標166,Object Coordinates 166
アクセ購買員ククス,Accessory Buyer Kook
フカフカのもみガラ,Soft Rice Husks
弱体お願いします！,Please weaken!
プラコンぐるみ・黒,Black Clothing
オルフェア民家の扉,Orphea House Door
スライムナイト帽子,Slime Knight Hat
さざなみギフト・赤,Red Ripples Gift
第９回ラグアスの像,9th Raguas Statue
ビッグビッグハット,Giga Sham Hatwitch
ミラクル武器の軌跡,Miracle Sword Book
植物学者のテーブル,Botanist Table
フォーリオン造成地,Fourion Worksite
かがやく星の贈り物,Shining Star's Gift
ダルメシアンハット,Dalmatian Hat
筆頭研究員のブーツ,Top Researcher Boots
壁かけ古びた張り紙,Old Papers Wall Decor
オブジェクト座標141,Object Coordinates 141
セーラススティック,Selas Wand
フォーチュンローブ,Fortune Robe
プラコン・白い唐傘,White Paper Umbrella
フォートレスハウス,Fortress House
ゆらゆら羊さん・紫,Purple Rocking Sheep
ビルダーズブロック,Builders Block
おどるほうせきの書,Goodybag Book
純喫茶のカウンター,Cafe Counter
しぐさ書・ネオン黄,Emote "Neon Yellow"
奇跡のさいほう針小,Miracle Sew Needle S
プティヒューザの像,Petit Hyuza Statue
いたずらウサギの畑,Naughty Rabbit Field
スライダークコイン,Nemeslime Coin
きじゅつしのブーツ,Illusionist's Boots
ダークペルシャの杖,Whiskamancer Staff
エンタシスマン・強,Vicious Prancing Pillar
野いちごボンネット,Wild Strawberry Bonnet
魔技師ベストセット,Technomancer Outfit
ヴァルハラメイル上,Valhalla Mail Top
エレメンレッドたち,The Glows
赤バラのドレッサー,Red Rose Vanity
ステージチュチュ下,Stage Tutu Bottom
暗黒大樹の番人たち,Dark Tree Guardians
パッチ柄ソファ・青,Blue Patch Sofa
カラミティスコルプ,Calamity Scorpion
バトエンマニアの机,Batoenmania Desk
キングスライムの像,King Slime Statue
マリン調の間仕切り,Marine Partition
ヒューザのこころ６,Hyuza's Heart Lv. 6
クルクルポシェット,Bag o' Books
夢のスティック物語,Fantastick Story
アズラン地方の木Ｂ,Azlan Region Tree B
花狩人のころも・青,Blue Flower Hunter Outfit
古代オルセコの祭壇,Old Orseco Altar
ウォルド地方　入口,Angelfall Region Entry
オブジェクト座標220,Object Coordinates 220
ゼブラパーカー水着,Zebra Hoodie Swimsuit
呪文のためのナイフ,Knife for Spells
スライムタワー噴水,Slime Stack Fountain
タロットパック・赤,Red Tarot Pack
カジノ祭４ビンゴ金,CasinoFest 4 Bingo Gold
テーブルとごちそう,Table and Feast
軍馬の大剣の作り方,Great War Horse's Sword
シスター・ビゴスラ,Sister Bigosla
錬金魔王の言い伝え,Alchemy Demon King Lore
踊魔の霊符・花嫁翠,Green Dancer Charm
獄辛党員シニグリー,Prisoner Singuri
フェンサーミサンガ,Fencing Bracelets
十周年大使サリベス,Anniversary Ambassador Sarybeth
お花の鉢植え・家用,Flower Plant Pot
第１０回エルジュ像,10th Erju Statue
ホーローの研究成果,Hollow's Research Results
王宮のチェスト・赤,Red Royal Chest
シックゴスドレス下,Chic Goth Dress Bottom
おしゃれな水着・黄,Yellow Snazzy Swimsuit
やいばのブーメラン,Edged Boomerang
バーベキューセット,Barbecue Set
オブジェクト座標069,Object Coordinates 069
第１０回プクラス像,10th Pukulas Statue
コマンダーシューズ,Commander Shoes
レトロなポスト・赤,Red Retro Mailbox
パレードコステイロ,Mardi Garb Feathers
キラージャグリング,Have a Ball
ザンクローネの心臓,Zankrone's Heart
ステーション機関室,Station Engine Room
警備魔神兵０４５号,Aztech Guard No. 045
コーヒーカップ・黄,Yellow Coffee Set
大怪傑の装束セット,Great Wonder Outfit
果たせなかった契り,Unfulfilled Promise
酒場の庭オルゴール,Tavern Music Box (G)
デビルニャン貯金箱,Devil Cat Piggy Bank
カンフーガール衣装,Kung Fu Girl Costume
マスターマシュマロ,Master Marshmallows
妖精図書館のランプ,Fairy Library Lamp
エステラのこころ３,Estella's Heart Lv. 3
ルーキーのつなぎ上,Rookie Shirt
ヴァルハラグリーブ,Valhalla Greaves
シックゴスドレス上,Chic Goth Dress Top
さざなみギフト・黒,Black Ripples Gift
武器防具屋ランギー,Weapon & Armor Shop Langie
第９回ヒューザの像,9th Hyuza Statue
ごうかなラグ小・赤,Red Fancy Rug S
ふわふわ雲のソファ,Fluffy Cloud Sofa
グリーンシザー・強,Vicious Green Scissors
ドット風セラフィ像,Pixel Seraphi Statue
プリマベーラピアス,Primavera Earrings
くさった死体マスク,Walking Corpse Mask
お姫様チェスト・桃,Pink Princess Chest
ダーマ神官ネイシャ,Abbey Priest Neisha
オブジェクト座標149,Object Coordinates 149
たちきりバチの群れ,A Swarm of Buzzbees
２人のクライアント,Two Clients
ボディーガード呼び,Call Bodyguard
ブレイブギフト・黒,Black Brave Gift
三姉妹人形・庭用桃,Pink 3 Sisters Doll (G)
ファンシークリーム,Fancy Cream
スチーム食器棚・赤,Red Steam Cupboard
プチドラゴンカード,Frail Green Dragon Card
ディカス団長のメモ,Commander Dicus' Note
ふわふわブーケ飾り,Floating Boquet Decor
楽将バトルシェイカ,Music General Maracaraider
チョコレート便せん,Chocolate Paper
記憶のナルビアの町,Memory of Nalbia
千輪菊花火・赤黄桃,Red/Yel./Pink Fireworks
キャンディのピアス,Candy Earrings
オブジェクト座標167,Object Coordinates 167
小さな英雄のよろい,Little Hero's Armor
マデュライトのクギ,Darkonium Nails
チョコが詰まった袋,Chocolate Filled Bag
ルファ神殿・中央塔,Rufa Temple - Tower
王国軍司令部の緑扉,Royal Army Green Door
ナイトメアゾーン針,Nightmare Zone Needle
黒曜の隕石孔への道,Road to Meteorite Hole
りぼんカチューシャ,Ribbon Hairband
ハンドベルエルフ像,Handbell Elf Statue
髪飾りのデザイン画,Hairpin Design Sketch
アズラン大浴場の扉,Azlan Bathhouse Door
アンノウンウィップ,Unknown Whip
メレアーデのお部屋,Mereade's Room
エステラぬいぐるみ,Estella Plushie
わだつみのころも上,Sea God Robe Top
ふわふハーフムーン,Fluffy Halfmoon Betta
オスクトルクラウン,Oscutor Crown
ドワーフカウンタ小,Dwarf Counter S
ばくだんいわ便せん,Rockbomb Paper
タコメットの像・庭,Octopot Statue (G)
ドラゴンキラーの本,Dragonsbane Book
古防砂ダム・展望台,Old Sand Dam Observatory
模様入りしっくい壁,Pattern Plaster Wall
真・幻界諸侯メダル,True Dread Fiends Medal
オブジェクト座標170,Object Coordinates 170
きせきの釣り人列伝,Miracle Angler Book
しぐさ書・おそなえ,Emote "Offering"
ヒューザのこころ１,Hyuza's Heart Lv. 1
レモンスライムの柱,Lemon Slime Pillar
王国の悪夢・洞くつ,Kingdom of Terror - Cave
旅芸人の衣装セット,Minstrel Outfit
オブジェクト座標200,Object Coordinates 200
豊穣の密林への出口,Exit to Forest of Fertility
りょうしゅたけとら,Lord Taketora
ドルバイクプリズム,Dol-Bike Prism
景品交換所マディア,Prize Exchange Madia
プクリポの人形・女,Pukulipo Doll (F)
うんてんしでっかー,Driver Decker
結界の守護者練習札,Barrier Guardians Tag
マンドラゴラコイン,Mandragora Coin
パンプキングローブ,Pumpkin Gloves
ガード時80%でためる,Tension On Parry 80%
カムバックお月様！,Comeback Moon!
エンペラーレグホン,Emperor Leghorn
潜水服・デフォルト,Default Diving Suit
ドレスアップ優待券,Free Dress-Up Coupon
南国の釣りざお・闇,Dark Tropic Fishing Rod
ドルワーム研究ぐつ,Dolworm Research Shoes
機工博士のコート上,Engineer's Upper Coat
くろがねのはちがね,Darksteel Headband
黒鳥のサークレット,Blackbird Circlet
宝珠のプチプチ香水,Jewel Perfume XS
しぐさ書・あらまあ,Emote "Oh My!"
ワラタローカプセル,Warataro Toy
亡き王国に捧げる詩,Ode to a Departed Kingdom
オブジェクト座標274,Object Coordinates 274
オブジェクト座標139,Object Coordinates 139
異界獣ヘイズシナー,Haze Sinner, the Otherworldly
山盛りのキャンディ,Pile of Candy
魔物管理人のぼうし,Monster Manager Cap
ウロコフネタマガイ,Scaly-Foot Gastropod
オブジェクト座標116,Object Coordinates 116
プラコン・黒い唐傘,Black Paper Umbrella
白トラ太猫カプセル,Fat White Tabby Toy
ほこらの祭祀場・嵐,Storm Shrine Ritual Ground
ベビタン竜族人形男,Imp Nadravian Doll (M)
コイン販売所ナクハ,Token Exchange Nakuha
真・幻界諸侯コイン,True Dread Fiends Coin
マジックスープ・小,Small Magic Soup
ブルーハワイかき氷,Blue Hawaii Shaved Ice
古レビュール街道南,Old Reviewle Highway South
聖湖ゼニート　入口,Sacred Lake Zenit Entry
朽ちた遺跡の庭用壁,Ruin Wall (G)
マジカル姫ゆかた下,Magical Yukata Bottom
サプライズラッシュ,Bolt from the Blue
カントリースカート,Country Skirt
ヤドリギ広場　入口,Mistletoe Plaza Entry
バウギアベビーの像,Baby Earthwyrm Statue
ピクニックリベリオ,Purrgatroyd Picnic
キュートなイヌミミ,Cute Dog Ears
キャロル姫ゆかた下,Carol Yukata Bottom
上級・ＭＰ錬金の本,Advanced MP
ごうかなラグ大・緑,Green Fancy Rug L
Ｓジェネラルカード,Shogum Card
王宮のバスタブ・青,Blue Royal Bathtub
預かり所バルバトゥ,Storage Barbatou
トーマ青年の剣鞘無,Sword Unsheathed Toma
ふわふわふうせん赤,Floating Red Balloon
ドラグーンアックス,Dragoon Axe
タップペンギーたち,Pogoin' Penguins
おおきなリボン白水,White Water Ribbon L
イナミノ街道の木Ｂ,Inamino Highway Tree B
マイタウン草原地区,My Town Meadow District
白バラのオルゴール,White Rose Music Box
理不尽な研究に捧ぐ,Devoted to Absurd Research
キィンベルのぼうし,Kimbel Hat
パールリボンピアス,Pearl Ribbon Earrings
マスターの悩みの種,Master's Source of Worry
オブジェクト座標263,Object Coordinates 263
蚊帳つきフトン・紫,Purple Futon with Net
スパングルドレス上,Spangled Dress Top
鋼鉄巨兵のウィング,Steel Giant Wings
ナドラガ教団大神殿,Nadraga Order's Grand Temple
全職さいだいＨＰ+20,Max HP +20
機工博士のグローブ,Engineer's Gloves
オブジェクト座標287,Object Coordinates 287
バンデッドグローブ,Brigand's Mitts
第１１回ファラス像,11th Faras Statue
ゴシック調のベンチ,Gothic Bench
防衛魔神兵０５９号,Aztech Guard No. 059
タータンマフラー紺,Navy Tartan Scarf
サマーなカンカン帽,Summer Can-Can Hat
メダルオーナーの館,Medal Owner's Hall
うつしよの銀箱・改,Worldly Silver Box v2
いたずらジャーミィ,Jammy the Jocular
オブジェクト座標168,Object Coordinates 168
ゼドラ王国服モブ２,Zedra Royal Clothes Mob 2
トゥーンタウン地区,Toontown District
燃えるロマンの宝石,Jewel of Burning Romance
死霊王ギスマイヤー,Spirit King Gismeyer
ぷりんすたきしーど,Prince Tuxedo
ばくだん岩の像・庭,Rockbomb Statue (G)
スライムのバスタブ,Slime Bathtub
リビングスタチュー,Sculpture Vulture
男性白波柄のゆかた,White Wave Yukata (M)
パーティーの招待状,Party Invitation
プクプクピーチの山,Pukupuku-Peach Pile
お祭りやぐら館の壁,Festival Wall
カボチャカウンタ小,Pumpkin Counter S
王宮のオーブン・赤,Red Royal Oven
第２回カジノ祭・銅,2nd Casino Fest Bronze
まけんしのレイピア,Fizzle Foil
オブジェクト座標249,Object Coordinates 249
フューチャーブーツ,Future Boots
あやしいカウンタ大,Suspicious Counter L
灰塵の豪雷将バルケ,Ash Thunder General Barke
青年貴族のコート上,Nobleman's Coat Top
ダークブルーダリア,Dark Blue Dahlia
ビクトリーチップ紫,Purple Victory Chip
エッグの写真ケース,Egg Photo Case
クルーガースーツ下,Kluger Pants
ベラストル家のイス,Belastre Chair
ジア・ルミナのコア,Dia Lumina Core
英雄の真実を追って,Chasing the Hero's Truth
アールヌーボー調扉,Art Nouveau Style Door
みろーれのいしょう,Milore Costume
エンドウマメのラグ,Pea Rug
オブジェクト座標033,Object Coordinates 033
お花のパールピアス,Flower Pearl Earrings
エジャルナの送風機,Ejarna Blower
ドワーフ作業ぼうし,Dwarf Work Hat
ポリ桃パーカー水着,Peach Parka Swimsuit
預かり所仮面オレン,Storage Masked Oran
DQ1勇者たいまつなし,DQ1 Hero Without Torch
ラダトームのよろい,Tantegel Armor
スライム柄彫刻の柱,Slime Carved Pillar
破壊魔神兵０６９号,Aztech Guard No. 069
しぐさ書・やめとま,Emote "Can't Stop"
カラフル風船・赤黄,Red & Yellow Balloons
アズリアのウィッグ,Azria's Wig
どうぐ使いのブーツ,Item Master Boots
モッズコート衣装券,Mod Coat Costume Ticket
ゴールドマンＸ４号,Gold Golem X 4
アンルシアの便せん,Anlucia Paper
海のステンドグラス,Sea Stained Glass
カンダタこぶんプー,Merry Man Pu
ハートガール兵隊服,Heart Soldier Uniform (F)
ドラゴンゾンビ・強,Vicious Dragon Zombie
セクシーギフト・桃,Pink Sexy Gift
エテーネ王宮の鏡台,Ethene Royal Vanity
たれ赤茶猫カプセル,Lazy Mahogany Cat Toy
マスカレイドブーツ,Masquerade Boots
フェンリルアタック,Fenrir Whistle
美術室の石像の写真,Art Room Statue Photo
アラモンドの案内板,Alamond Info Board
スチームテーブル大,Steam Table L
グレン駅の模型・雪,Glen Stn. Model (Snow)
ガチャガチャポスト,Capsule Machine Mailbox
メディカルデバイス,Medical Device
ガートラント兵士Ｂ,Gartlant Soldier B
ハンドベルオーガ像,Handbell Ogre Statue
全職こうげき魔力+10,Magical Might +10
勇気を奮い立たせて,Muster the Courage
壁かけガタラ紋章旗,Gatara Wall Banner
ファラスのうであて,Faras' Armguards
シスター・アニッタ,Sister Anitta
青年貴族のコート下,Nobleman's Coat Bottom
デフェル荒野への道,Road to Defel Desert
エンゼルスティック,Angel Wand
プリティサングラス,Pretty Sunglasses
デルクロアの研究室,Delcroix's Laboratory
スノーボールンの像,Snowballon Statue
オブジェクト座標102,Object Coordinates 102
エンジェルウィング,Angel Wing
銀トラ太猫カプセル,Fat Silver Tabby Toy
魔物管理人シャウラ,Monster Manager Shaula
スライムナイト・強,Vicious Slime Knight
新春虎の子のお年玉,New Year Gift of the Tiger
ふわふわサメバーン,Fluffy Sharkburn
レトロなポスト・金,Gold Retro Mailbox
シュジャクカプセル,Peashock Toy
アマラーク城　出口,Amarak Castle Exit
戦場を舞うガルーダ,Garuda Dances In Battle
きりさきピエロ・強,Vicious Prickly Prankster
おとぎの森グローブ,Fairy Forest Gloves
中辛角竜ボブラノス,Medium Spicy Dragon Bobranos
シスター・ファンナ,Sister Fanna
しられざる神殿の絵,Picture of Unknown Temple
ファヒータのホウキ,Fajita's Broom
コンシェルジュ０７,Concierge 07
ウサギ魔物の装束下,Rabbit Monster Skirt
フォンデュフォーク,Fromage Fray Fork
さざなみギフト・白,White Ripples Gift
灰ねこシャンデリア,Ash Cat Chandelier
苺お菓子の間仕切り,Berry Sweet Partition
しぐさ書・フルート,Emote "Flute"
ポーズ書・ハンサム,Pose "Handsome"
かーにばるこーでⅠ,Carnival Outfit Ⅰ
プチマジンガカード,Frail Uberkilling Card
ポーズ書・釣り仙人,Pose "Fish Hermit"
アイスダンスシャツ,Ice Dance Shirt
しぐさ書・決め左前,Emote "Pose L. Front"
シエラ巡礼地への道,Road to Sierra Shrinelands
プラチナのやりの本,Platinum Lance Book
白雲の烈翼将ヤヌビ,White Cloud General Yanubi
シュバリエメイル下,Chevalier Mail Bottom
花狩人の衣装券・紫,Purp. Flower Hunter Tkt
オブジェクト座標103,Object Coordinates 103
フリルのビキニ・黄,Yellow Frill Bikini
淡い記憶を紐解いて,Unraveling Faint Memories
いたスト・お店マス,Fortune Street - Shop
オブジェクト座標068,Object Coordinates 068
防衛魔神兵０５２号,Aztech Guard No. 052
しぐさ書・バトエン,Emote "Battle Pencil"
おぞましき呪いの絵,Dreadful Cursed Drawing
オブジェクト座標107,Object Coordinates 107
メラゾーマやきそば,Kafrizz Fried Noodles
ヴァランガアックス,Valanga Axe
クロッシュウェア上,Bell Shirt
おうえんだんのふく,Cheer Team Suit
ガーデン花火台・緑,Grn. Fireworks Stand(G)
おおさそりの浮き輪,Scorpion Floatie
灰三毛太猫カプセル,Fat Ash Calico Cat Toy
プスゴンきぐるみ券,Pusgon Costume Ticket
プクリポいいずきん,Pukulipo Fine Hood
旅芸人ピュージュＧ,Minstrel Pyuju G
エルガドーラの水槽,Elgadora's Aquarium
マドハンドの像・庭,Muddy Hand Statue (G)
ゼニスの封宮　入口,Palace of Zenith Entry
サーマリ高原の木Ａ,Samary Plateau Tree A
グレイツェルソファ,Gretzel Sofa
ハートのベンチ・黄,Yellow Heart Bench
魔衛隊士のグリーブ,Demon Guard Greaves
星辰のランプ錬金書,Stars Lamp Alchemy Book
シュメリアブラウス,Sumeria Blouse
だいふごうぶるーの,Tycoon Bruno
赤の錬金石２０こ券,20 Red Gems Ticket
けんぽうぎの作り方,Make a Tussler's Outfit
壁かけキルギルの絵,Kirgyl Portrait
ファラオ・カーメン,Pharaoh Khamun
水色チューリップ傘,Blue Tulip Umbrella
ドラグーンバスター,Dragoon Buster
ホーリーキャンディ,Holy Lollipop
エルボブ像白グレー,W/G Eltona Bobtail St.
学園の廊下の掲示板,School Hall Bulletin
モダンバニーフレア,Modern Bunny Skirt
強化ガジェット零式,Gadget Type-0
支援魔神機０２７号,Aztech Support Mech No. 027
ドルワーム研究服券,Dolworm Outfit Ticket
マジカルじんべい下,Magical Jinbei Bottom
シルエットブレンダ,Silhouette Brenda
エルフのパーティ机,Elf Party Table
しぐさ書・ガクブル,Emote "Tremble"
トロピカルジュース,Tropical Juice
始源の歌姫の髪飾り,First Diva's Hairpin
ゴールドマンＸ８号,Gold Golem X 8
うさみみギフト・青,Blue Rabbit Ears Gift
プリズニャン招き猫,Jailcat Figurine
占星術師のローブ上,Astrologer Upper Robe
しぐさ書・パレード,Emote "Parade Dance"
オブジェクト座標259,Object Coordinates 259
みならいあくま・祖,Ancestor Winkster
アクセ購買員タリス,Accessory Buyer Tals
オルッパ地下洞くつ,Orppa Underground Caves
ガートラント建国王,Founder of Gartlant
ドワーフ市民うでわ,Dwarf Citizen Bangles
バトルガントレット,Battle Gauntlets
第８回ナジーンの像,8th Nazine Statue
げんぶの道着セット,Black Turtle Outfit
しぐさ書・勉強する,Emote "Study"
プクリポの人形・男,Pukulipo Doll (M)
オブジェクト座標267,Object Coordinates 267
グランミュージアム,Grand Museum
大魔王城１階のカギ,Demon King Castle 1F Key
ランカーキャップⅠ,Ranker Cap Ⅰ
キングのピース・黒,Black King Piece
カギ師たちの挑戦状,The Keymaker's Challenge
アンティーク扇風機,Antique Electric Fan
スマート吊りランプ,Smart Hanging Lamp
行動時25%早詠みの杖,Faster Caster On Action 25%
キッズ木馬プリズム,Rocking Small Fry Prism
オブジェクト座標043,Object Coordinates 043
全職さいだいＨＰ+10,Max HP +10
三姉妹人形・庭用黄,Yellow 3 Sis. Doll (G)
若手芸人のてぶくろ,Young Talent Gloves
オブジェクト座標022,Object Coordinates 022
ガールモッズコート,Girl Mod Coat
ツボ錬金職人の看板,Pot Alchemy Sign
ムーンバニーヘッド,Moon Bunny Head
フリルスイムワンピ,Frill Swim Dress
ドラゴンスラッシュ,Dragon Smash
イチゴのクッション,Strawberry Cushion
第１０回ラウル像庭,10th Raul Statue (G)
かんだたしょうぐん,Robbin' 'Ood General
エテーネのあいさつ,Ethene Greeting
アスフェルド学園駅,Asfeld Academy Station
あらびあんいしょう,Arabian Outfit
ヴァリースタジアム,Valley Stadium
ドルワーム研究員服,Dolworm Research Suit
死へと導く滅びの光,Dying Light Leads to Death
オブジェクト座標242,Object Coordinates 242
キラパン黒プリズム,Dark Sabrecat Prism
メロディアトップス,Melody Top
ふわふわホミロット,Fluffy Healix
祭壇風のカウンター,Altar-Style Counter
アスバルのこころ２,Asbal's Heart Lv. 2
ハニーポットチェア,Honey Pot Chair
芳墨の堕天将フィア,Ink Angel General Fia
ごうかなラグ中・緑,Green Fancy Rug M
自由人の集落のイス,Freedom Village Chair
スライムイヤーマフ,Slime Earmuffs
ヴァルハラメイル下,Valhalla Mail Bottom
イカしたＴシャツ桃,Pink Cool T-Shirt
魔天兵ゴルドーたち,Evil Soldier Goldo and co.
ネタ「おたから袋」,Treasure Bag Trick
まがまがしいキノコ,Ominous Mushroom
クスリの入った小瓶,Small Bottle of Medicine
第１０回ナジーン像,10th Nazine Statue
ハンギングアイビー,Hanging Ivy
ギュッとケキちゃん,Cakey Arm Doll
ビクトリーチップ刻,Time Victory Chip
アイスバープリズム,Ice Pop Prism
人の域を超えた強者,Strong Beyond Human Limits
ハチワレ猫カプセル,Tuxedo Cat Toy
ヒマエル印の分析器,Himael Marked Analyzer
ローラ姫のてぶくろ,Gwaelin's Gloves
プチグラコスカード,Frail Gracos Card
オブジェクト座標039,Object Coordinates 039
ブルーハートピアス,Blue Heart Earrings
結界の守護者メダル,Barrier Guardians Medal
ベルセルクブレード,Mad Warrior's Blade
ＤＱＸ１０周年御旗,DQX 10th Anniv. Flag
タイタス号の飾り棚,Titus Shelf
前座芸人のバンダナ,Show Opener's Bandana
凶拳は天を超えるか,Evil Fist Crosses Heaven
学園男子のエプロン,Schoolboy Apron
ハート気球のガゼボ,Heart Balloon Gazebo
千輪菊花火・緑紫桃,Gr./Pur./Pink Fireworks
ザードの尖塔・２階,Zard Spire 2F
オブジェクト座標186,Object Coordinates 186
ドラパンクシューズ,Dracky Punk Shoes
しぐさ書・おびえる,Emote "Scared"
増殖獣バイロゴーグ,Multiplying Beast Biologog
ワイルドジャケット,Wild Jacket
ソルシエールグラブ,Sorciere's Gloves
惜別の置き手紙伝説,Farewell Letter Legend
お花の外灯・ブルー,Blue Flower Light (G)
ディアブロプリズム,Diablo Prism
ギュメイ将軍カード,Goresby-Purrvis Card
ひかりサークレット,Shimmering Circlet
炎の領界の植物・小,Fire Realm Plant S
ヘルヴェルトランプ,Helvel Cards
小さな黄金の秘宝？,Small Golden Treasure ?
しっくいと和紙の壁,Plaster & Paper Wall
天宮騎士のグリーブ,Sky Knight Greaves
強・タロットメダル,Apex Tarot Medal
ストロベリーの花束,Strawberry Bouquet
ポーポラ地方の木Ａ,Popola Region Tree A
封印危機対策委員会,Sealing Crisis Committee
初級魔法戦士グラブ,Novice ARM Gloves
銀マスク猫カプセル,Silver Mask Cat Toy
プラチナ鍛冶ハン小,Platinum Smith Hammer S
ポールスターボトム,North Star Pants
チョコレートの花束,Chocolate Bouquet
戦士のよろいセット,Warrior Armor Set
サファイアのピアス,Sapphire Earrings
第３回釣りコン・金,3rd Fish Contest Gold
ジュリアンテのムチ,Juliante's Whip
オブジェクト座標006,Object Coordinates 006
商人トルネコの依頼,Merchant Torneko's Request
ゴールドマンＸ１号,Gold Golem X 1
しぐさ書・Ｓハート,Emote "Signal Heart"
福笑いのラグ・くち,Fukuwarai Mouth Rug
ユシュカのこころ８,Yushka's Heart Lv. 8
ごうかな食器棚・緑,Green Fancy Cupboard
オブジェクト座標097,Object Coordinates 097
グレイツェルの大鍋,Gretzel's Cauldron
吊るし潜水艦ライト,Submarine Hanging Light
占星術師のターバン,Astrologer Turban
おしゃべりシャベル,Talking Shovel
師団長の七つの教訓,Commander's Lessons
水の領界の室内噴水,Water Realm Fountain
ゴールドマンＭＡＸ,Gold Golem MAX
イレイザーＧｅ５０,Eraser GE50
緑キノコのテーブル,Green Mushroom Table
金のキーエンブレム,Gold Key Emblem
アルウェーンの街灯,Alweyn Lamppost
プラコンゴーレム服,Golem Costume
びっくりルーレット,Surprise Spinner
毒に呪文ダメアップ,Spell Damage To Poisoned Up
ルベランスティック,Ruberan Wand
