大怪傑のはちまき,Wondrous Headband
闇指揮者デリゲン,Dark Conductor Derigen
シスター・リィト,Sister Lito
講師ベスカトーレ,Lecturer Vescatore
アジサイ姫ぞうり,Hydrangea Sandals
カラス神楽の羽根,Crow Dance Feather
エルフのあいさつ,Elf Greeting
ユニコーンのツノ,Unicorn Horn
シスター・ミペカ,Sister Mipeka
ミローレのチョコ,Milore's Chocolate
ヒュプノスハント,Persecutter
メロディアセット,Melody Outfit
毛皮に包まれた氷,Fur-wrapped Ice
素材屋・コイン屋,Material Shop/Coin Shop
ブルークリスタル,Blue Crystal
ダーククリスタル,Dark Crystal
まもの使いの服２,Monster Master Suit 2
中腹への道　出口,Path to Halfway Exit
青嵐のおうぎ絵巻,Tempest Fan Book
天空のオルゴール,Zenithia Music Box
妖精変身ステッキ,Fairy Makeover Wand
ボストロールの像,Boss Troll Statue
ユシュカの便せん,Yushka Paper
ディアナウィング,Diana Wings
大魔王のお召し物,Great Demon King Apparel
よろず屋スワーニ,General Shop Swani
ダイバーグローブ,Diver Gloves
ラグアスキッチン,Raguas Kitchen
アサシングローブ,Assassin Gloves
シルエット・建物,Silhouette Building
アークワンドの本,Celestial Sceptre Book
ステューデントＳ,Student S
フェルナーの客室,Felner's Guest Room
ラブリークッキー,Lovely Cookies
わかがしらひのき,Young Hinoki
プチ幻界の四諸侯,Frail 4 Dread Fiends
レビュール街道南,Reviewle Highway South
スイレンの釣り堀,Water Lily Fish Pond
フェアリー衣装Ⅰ,Fairy Costume Ⅰ
三つ星ブレンド豆,3-Star Blend Beans
ベビタンキャップ,Imp Hood
セラフィのポスト,Seraphi Mailbox
セレモニーロッド,Ceremony Rod
酒場のオルゴール,Tavern Music Box
魔想念ガルドドン,Demonic Thought Gardodon
シーサイドソファ,Seaside Sofa
交換屋メリーポコ,Exchange Shop Meripoko
その者　釣り老師,The Master of Fishing
大魔獣イーギュア,Giga Rapscallion
便せん屋ウィット,Stationery Shop Uito
ビジューな足ヒレ,Bijou Flippers
アスフェルド学園,Asfeld Academy
黒夜叉のよろい上,Black Bane Armor
道具屋・レシピ屋,Item/Recipe Shop
スターのイス・青,Blue Star Chair
エドアルドの工具,Eduardo's Tools
特攻隊長メガース,Kamikaze Captain Megas
夕焼け雲のソファ,Sunset Cloud Sofa
よろこびの玉手箱,Joyful Jewelry Box
スパークショット,Starstrike
集結！　叡智の冠,The Crown of Wisdom
光の郷フィネトカ,Light Town Finetka
まわりにチャット,Nearby Chat
ウィリーデエッジ,Wilide Edge
レジェンズエッジ,Legends Edge
白木のカウンタ小,Plain Counter S
ムストの町・地下,Underneath Morst
たたきモグラの像,Mashing Mole Statue
伝説のさいほう針,Legendary Sew Needle
鍛冶素材屋タブロ,Smithing Materials Tablo
黒曜のカウンタ小,Obsidian Counter S
マーガレットの傘,Margaret Umbrella
赤い金魚と金魚鉢,Red Goldfish in Bowl
ギュッとコッコー,Chicken Arm Doll
キューピッド衣装,Cupid Costume
オーガのあいさつ,Ogre Greeting
コルセアグローブ,Corsair Gloves
つんつくカージェ,Bluecumber
冬来たりなば……,Winter Comes...
バンデッドブーツ,Brigand's Boots
ビッグブレードⅡ,Broader Sword
バトルトリニティ,Battle Trinity
ヒストリカの像＋,Historica Statue +
たれ黒猫カプセル,Lazy Black Cat Toy
まどうしのぼうし,Wizard's Hat
シックゴスブーツ,Chic Goth Boots
モモリオンの王冠,Sanguini King's Crown
水鳥のいる池・庭,Bird Pond (G)
プスゴンのおたま,Pusgon Ladle
ビリジアンの花束,Viridian Bouquet
ファフニルブーツ,Fafnir Boots
花婿のタキシード,Groom's Tuxedo
ＣＭ用ドワーフ１,Dwarf For CM 1
道具屋ポッピーナ,Item Shop Poppina
りぷとん画伯の絵,Ripton Painting
キャプテンブーツ,Captain's Boots
１段ブロック・青,Blue Block
ナシームの洞くつ,Naseem Cave
Ｖロンのラグ・赤,Red Vron Rug
ちあがーるのふく,Cheerleader Clothes
イエローファット,Grand Yellow Belly
インテリローブ下,Scholar's Robe Bottom
とこなつシューズ,Summer Shoes
スライムチャイム,Slime Chime
預かり所スリーズ,Storage Sleaze
ビーナスのなみだ,Venus' Tear
ペリドットの宝石,Peridot Gem
サクランボのラグ,Cherry Rug
時獄獣キュロノス,Kyuronos, Beast of Time
ルティショー像黒,Black Astolti Short St.
星空のラグの絵本,Starry Rug Book
エトワールブーツ,Etoile Boots
ツボ錬金職人頭巾,Pot Alchemist's Cap
水晶のカウンタ小,Crystal Counter S
プラチナウィング,Platinum Plumes
手袋にかけた想い,Thoughts On Gloves
臨時大使ペリレネ,Temp Ambassador Palileo
ふわふわコウリン,Fluffy Kourin
バロンシルエット,Baron Silhouette
護りの盾のブーツ,Boots of Protection
灼熱サーフパンツ,Scorching Surf Shorts
ある魔術師の悔恨,Magician's Regret
ほくほく肉じゃが,Meat & Potatoes
勇者姫アンルシア,Hero Anlucia
ごくじょうソルト,Salt of the Earth
砂丘のカーペット,Sand Dune Carpet
黒のピアノのイス,Black Piano Seat
救助された侍女Ｃ,Relief Maid C
モロコシのベッド,Corn Cob Bed
ニンニクぎょうざ,Garlic Dumplings
メラゾ熱ワクチン,Kafrizz Fever vaccine
アスバルパラソル,Asbal Umbrella
スライムチケット,Slime Ticket
うらないしはっけ,F. Teller Hakke
イシスのブローチ,Isis' Brooch
グランマーズの館,Madame Luca's House
ルーミリアの日記,Lumeria's Diary
死霊兵ガテリアン,Spirit Soldier Gaterian
くさりかたびら上,Chain Mail Top
あこがれの盗賊王,Longing for a Thief King
わかがしらこぐち,Young Koguchi
金平糖ライト・虹,Rainbow Candy Light
第９回ラウルの像,9th Raul Statue
エレガントココア,Elegant Cocoa
表層・ルビン宙橋,Surface - Rubin Bridge
シスター・リリン,Sister Lilin
ふかふかなキノコ,Soft Mushroom
レースの観客０１,Race Spectator 01
郵便局員モニモニ,Postman Monimoni
ギルド移籍許可証,Guild Transfer Permit
オレンジのパーツ,Orange Part
お姫様ベンチ・桃,Pink Princess Bench
星からのまれびと,Stranger from the Stars
語り継がれる真実,The Untold Truth
イグナイトバンド,Ignite Headband
ツインアンテナＡ,Twin Antenna A
ファントムブーツ,Phantom Boots
ダークネスマリン,Dark Seaslime
封印のかかった本,Sealed Book
スチーム本棚・赤,Red Steam Bookshelf
七夕・雲払いの書,Festival Cloud Sweeper
ダーマ神殿のラグ,Alltrades Abbey Rug
かいしんバーガー,Critical Burger
魚交換員ビンチュ,Fish Exchange Bincho
ヘルクラッシャー,Hell Gladiator
しゃしょうばぎー,Conductor Bagy
獄水鬼ヴァーテル,Waterkeeper Vater
全属性ダメージ+5%,All Attribute Damage +5%
メラゾ熱のクスリ,Kafrizz Fever Medicine
さまようたましい,Lost Soul
水神ギルギッシュ,Water God Gilgish
お菓子のチェスト,Sweet Chest
さとりのグローブ,Gloves of Clarity
砂の都のテーブル,Sand City Table
アスバルのマント,Asbal's Cape
世界樹のよろい下,Yggdrasil Armor Bottom
魚交換員ビコメチ,Fish Exchange Bikomechi
シスター・ネジュ,Sister Neju
雪原のアノラック,Snowfield Anorak
メレアーデのカギ,Mereade's Key
パレードウェア下,Mardi Garb Bottom
レスキュマフィン,Rescue Muffin
オルフェウスの弓,Orpheus' Bow
マーメイドトップ,Mermaid Top
ホイミンキャップ,Healie Cap
いやしの服セット,Healing Outfit
猛火竜のウィング,Fire Dragon Wings
トーマ少年期の剣,Toma's Childhood Sword
闇のトーマの仮面,Dark Toma's Mask
乗り物係ガドッソ,Vehicle Clerk Gadosso
スチームモノクル,Steam Monocle
キラークリムゾン,Crimson Killing Machine
エナジーフォール,Magic Blast
釣り鐘守りの日記,Bell Keeper's Diary
レクタリスセット,Lectalis' Outfit
シスター・サテラ,Sister Satella
ボーンのこんぼう,Zombie Gladiator Club
レクタリスのくつ,Lectalis' Shoes
観戦案内ヴェルト,Watch Guide Velt
ファントムダガー,Phantom Dagger
ティプローネ光花,Tiplone Light Flower
郵便局員ツィサア,Postman Tsisa
エテーネルリング,Ethenel Ring
和傘の天井ランプ,Umbrella Ceiling Lamp
マスター・リリム,Guildmaster Lilim
蒼穹兵団のかぶと,Azure Corps Helmet
グロリアススーツ,Glorious Suit
ファータドレス下,Fata Dress Bottom
ファンキードラゴ,Hiptile
飛竜の巣のベッド,Flying Dragon Nest Bed
マルグリットの娘,Margaret's Daughter
隠れスライムの像,Hidden Slime
ドラムクラッシュ,Monster Masher
ドラケンブレード,Drakenblade
ピンクモン便せん,Pink Sanguini Paper
ベホイミスライム,Medislime
王国軍司令部の盾,Royal Army Shields
フルーツの便せん,Fruit Paper
サジェぬいぐるみ,Sajay Plushie
コブタパーカー下,Piglet Shorts
カージナルテトラ,Cardinal Tetra
プクリポキッチン,Pukulipo Kitchen
ギルガランのくつ,Gilgaran's Shoes
便せん屋ヒナゲシ,Stationery Shop Poppy
銀河のかみかざり,Galaxy Hair Ornament
ドルワーム水晶宮,Dolworm Crystal Palace
クッキングデビル,Cooking Devil
星降る夜の大乱闘,Starry Night Scuffle
禁書の守護者・右,Right Banned Book Guard
レースの観客１９,Race Spectator 19
メタルモンスター,Metal Monster
トライバルトップ,Tribal Top
防衛軍の制服・Ｙ,Defense Force Suit Y
荷馬車の作業員Ｂ,Wagon Worker B
レーザーユニット,Laser Unit
モンシロウィング,White Butterfly Wings
ヴァルハラヘルム,Valhalla Helm
ウルタのバンダナ,Ulta Bandana
アデリーカプセル,Adelie Penguin Toy
冥王の大鎌・オノ,Netheraxe
しょこらなどれす,Chocolate Dress
黄金の飾り片手剣,Gold Ornament Sword
しぐさ書・お祝い,Emote "Celebrate"
フォトンサーベル,Photon Sabre
ガタラ原野の木Ｃ,Gatara Fields Tree C
調理職人コック帽,Cook's Hat
ネタ「キンスラ」,King Slime Trick
禁書の守護者・左,Left Banned Book Guard
アズラン駅の模型,Azlan Station Model
ムーディーベッド,Moody Bed
シナイジッチたち,Sinazitch and co.
トキワアカネの花,Red Ibis Flowers
わふうしょうぞく,Breezy Wear
ヒマワリの地植え,Sunflower Plant
閃手賞トロフィー,Athlight Trophy
東洋風ベッド・雅,Chic Orient Bed
マーメイド仕切り,Mermaid Partition
学園男子の海パン,Schoolboy Trunks
先制攻撃率アップ,First Strike Rate Up
神々が住まう聖域,God's Sacred Dwelling
よろず屋パサンタ,General Shop Pasanta
お正月の便利な壁,New Year Wall
シーサイドハウス,Seaside House
代理人ハヤテの像,Agent Hayate Statue
メギラザの洞くつ,Megilaza Cave
ギュッとセラフィ,Seraphi Arm Doll
ホークブリザード,Snowbird
しぐさ書・ピース,Emote "Peace"
防具鍛冶作業着上,Armorsmith's Top
脂たっぷりサバ缶,Canned Fatty Mackerel
しぐさ書・決め左,Emote "Pose Left"
ファラスカプセル,Faras Toy
賢者の杖の作り方,Making a Sage's Staff
蒼天のソウラ印章,Souten no Soura Stamp
がうがうグローブ,Bow-Wow Gloves
アリゲーターガー,Alligator Gar
悪霊の神々コイン,Evil Trinity Coin
トーマぬいぐるみ,Toma Plushie
７ｍｖドワーフ男,7mv Dwarf Man
グイッと青春の味,A Taste of Youth
スクアーロの写真,Squalo's Photo
ももんじゃケープ,Platypunk Cape
財宝のつまった箱,Full Treasure Box
グレートアックス,Bad Axe
形見を取り返せ！,Take Back What's Yours!
想いを針にこめて,Put Thoughts in a Needle
大魔王顔壁への道,Road to Demon Face Wall
スウィートビキニ,Sweet Bikini
縁日のお面屋さん,Festival Mask Shop
ベビタングローブ,Imp Gloves
赤組のたいそう着,Red Team Track Suit
保育地区の移動台,Nursery Area Platform
シンプルキャップ,Simple Cap
便せん屋メビシェ,Stationery Shop Mebishe
キラキラモーモン,Glittering T. Sanguini
欲望の邪鬼ゴモル,Demon of Desire Gomoru
ギュッとプオーン,Rebjorn Arm Doll
魔法戦士団サロン,Armamentalist Corps
セクシーテーブル,Sexy Table
バレンタインの幕,Valentine's Curtain
スラタワーパンツ,Slime Stack Bottom
お花大好きクポ！,I Love Flowers, Kupo!
金平糖ライト・桃,Pink Candy Light
奇跡の錬金ランプ,Miracle Alch Lamp
魔法使いのブーツ,Mage Boots
ケイトのサンダル,Kate's Sandals
のっかりゼラチン,Boingin' Knight
４色ポップコーン,Four-Color Popcorn
ゆめみるちょこら,Dreaming Chokora
友情の彫像の写真,Friendship Sculpture Photo
ばくだんサーカス,Pantomine
ジア燃石生産場１,Diatite Production Plant 1
オーガの人形・女,Ogre Doll (F)
ウィキッドブーツ,Wicked Boots
スチームグローブ,Steam Gloves
ぎんのルアーの本,Silver Lure Book
金のほこらへの道,Road to Gold Shrine
Ｖロンのテーブル,Vron Table
プラチナミミック,Platinum Mimic
軍団長室のソファ,Corps Commander's Sofa
チョコボの像・庭,Chocobo Statue (G)
アドミラルブーツ,Admiral's Boots
オーシャングラス,Ocean Glasses
リゾートかきわり,Resort Backdrop
エビルソーサラー,Evil Sorcerer
ドラキュラパーツ,Dracula Parts
クロ・マネキの像,Black Mannequin Statue
プラチナエンゼル,Platinum Angel
魔天鬼グーラたち,Sky Ogre Geira and co.
打ち上げ花火・青,Blue Firework
取引商アルトゥナ,Trader Altuna
ストームフォース,Gale Fource
建物屋ペルホネン,Building Shop Pelhonen
えるんすてふじん,Mrs. Ernesto
コイン屋ゴンガロ,Coin Shop Gongaro
討伐隊員ポッカラ,Strike Force Pokkara
ケイオスブレード,Berserker's Blade
ゴクラクギョ・黄,Yellow Betta
ジャックの衣装２,Jack's Costume 2
ベルトロの部下Ｄ,Bertro Subordinate D
ふういんのダンス,Dance of Sealing
オーロラクオーツ,Aurora Quartz
スライムモビール,Slime Mobile
イエローシックル,Armour Mantis
聖守護者のつるぎ,Sentinel's Sword
まもの使いの証明,Monster Master Proof
ラウルぬいぐるみ,Raul Plushie
授業ドワーフ男性,Dwarf Male Student
カボチャ間仕切り,Pumpkin Partition
魔物管理人ドリー,Monster Manager Dory
エンゼルブレード,Angel Blade
預かり所ペラーナ,Storage Perana
下級亡霊兵士たち,Lowly Spirit Soldiers
ハンギングベッド,Hanging Bed
キングスパーキー,King Sparky
暗夜の霊堂への扉,Door to Mausoleum of Night
スイカのイス・黄,Yellow Watermelon Chair
マドハンド便せん,Muddy Hand Paper
ネレウスシールド,Nereus Shield
よろず屋リーベン,General Shop Leven
ジュエルシャワー,Jewel Shower
マリーンの宝石袋,Malynn's Jewel Bag
お菓子の間仕切り,Sweet Partition
南国からお届け！,Came From the Tropics!
フルムーンチェア,Full Moon Chair
キュララナビーチ,Kyurarana Beach
キュルル花火・虹,Rainbow Kyururu Fwork
リードシクティス,Leedsichthys
カボチャの食器棚,Pumpkin Cupboard
神授の判定者たち,Judges of Divine Gifts
キャプテンドラゴ,Captain Drago
ゴクラクギョ・赤,Red Betta
ハヌマーン強軍団,Apex Nemean Army
鉄枠木板張りの壁,Iron Framed Wood Wall
ジュレー島の木Ａ,Jule Island Tree A
ポイポイ商会倉庫,Poi Poi Company Storage
レースの観客２２,Race Spectator 22
忍び寄る闇の足音,Creeping Dark Footsteps
武勲の城の庭園灯,Valor Castle Light (G)
ガメゴンのこうら,Wyrtle Shell
エルフテーブル小,Elf Table S
巨大ナスビナーラ,Giga Large Woebergine
スカウトアタック,Scout Strike
ＤＱウォーク印章,DQ Walk Stamp
機工博士の方程式,Engineer's Formula
ワクチンのふくろ,Vaccine Pouch
サメきぐるみ・黒,Black Shark Suit
転送係エグバート,Transfer Agent Egbert
カミハルムイ城前,Kamiharmui Castle Front
ウェディングベル,Wedding Bell
ブレイクキャップ,Break Cap
クマのぬいぐるみ,Bear Plushie
見果てぬ夢の蛮勇,Unfulfilled Dreams
魔獣サルファバル,Demon Beast Sulphubal
記憶のムストの町,Memory of Morst
コルセアマント上,Corsair Cloak
トンブレロ貯金箱,Ham Shamwitch Pig Bank
流れ着いた愛の詩,Drifted Away Love Poem
「楽園」の展示室,"Paradise" Exhibit Room
三角ランタンの木,Triangle Lantern Tree
かばうの性能変化,Chopping Block
滝のかきわり・凛,Cold Waterfall Backdrop
はやぶさの剣の書,Falcon Blade Book
ブリガンオーダー,Brigan Order
黒鳥のチュチュ下,Blackbird Tutu Bottom
防具屋アベーシャ,Armor Shop Abesha
レースの観客０７,Race Spectator 07
神兵のよろいの書,Divine Soldier Book
奇門遁甲の式・参,3rd Divination Ceremony
チョコボのぼうし,Chocobo Hat
風車の丘への出口,Exit to Windmill Way
メタスラのベンチ,Metal Slime Bench
レイダメテス地面,Reidametes Ground
ミミックの像・庭,Mimic Statue (G)
壁画管理ペコリア,Mural Management Pekoria
チャコルのポーチ,Charcoal Pouch
シスター・ルスパ,Sister Luspa
天かける七色の橋,Rainbow Sky Bridge
ドラゴンのしっぽ,Dragon Tail
レースの観客２９,Race Spectator 29
コッケンの乗る棒,Kokken's Riding Crop
ホイップゴースト,Whipped Scream
荒波サーフパンツ,Rough Sea Surf Shorts
踊り子のサンダル,Dancer Sandals
エナジーパウダー,Energy Powder
竜術士のグローブ,Dragomancer Gloves
巨大リルグレイド,Giga Lil' Gray
あしあとカプセル,Footprint Toy
グランゼニスの剣,Gran Zenith Sword
タイタス号の模型,Titus Model
とんぼ玉プリズム,Glass Bead Prism
おばけトマト軍団,Haunted Tomato Army
ギュッとアスバル,Asbal Arm Doll
アルファ用銀の丘,Silver Hill for Alpha
中枢へ向かう通路,Passage to Core
ネグールドラゴン,Nezure Dragon
夢色ショーケース,Dreamy Showcase
郵便局員サショラ,Postman Sashola
ノリまゆげシール,Eyebrows Sticker
アスバルのズボン,Asbal's Pants
新作家具屋クレプ,New Furniture Shop Crepe
バステトのアンク,Bastet's Ankh
預かり所ペコリア,Storage Pekoria
水玉模様のはかま,Polka Dot Hakama
宵と暁の伝承の本,Legend of Dusk and Dawn
上級亡霊兵士たち,High Spirit Soldiers
ミランのスケッチ,Milan's Sketch
魔天骸オロバドン,Demon Skeleton Orobadon
水晶のテーブル小,Crystal Table S
ごうかな本棚・赤,Red Fancy Bookshelf
天地雷鳴士のくつ,Druid Shoes
ゴールデンリング,Golden Ring
くじゃくのおうぎ,Peacock Fan
ジャンボオニオン,Jumbo Onion
ギュッとクラウン,Crown Arm Doll
ネオン・パターン,Neon Pattern
レシピ屋ミアーレ,Recipe Shop Miare
ガートラント兵３,Gartlant Soldier 3
ドール書・いのる,Doll Book "Pray"
星拳士シャドポン,Starfighter Shadowpon
ダイバーシューズ,Diver Shoes
ガウシア樹海の蝶,Gaussia Butterfly
鉱石の天井ランプ,Ore Ceiling Lamp
あくまのツボ呪文,Demon Pot Spell
マローネパラソル,Marone Umbrella
ミラクルチケット,Miracle Ticket
勝てるケンカの本,Winning Fight Book
行動時10%魔力覚醒,Channel Anger Action 10%
竜族人形の作り方,Making Nadravian Dolls
ホンワカ羽毛の束,Snuggly Feather Bundle
フラウスウィップ,Flaus Whip
静かなる湿原地区,Quiet Marshlands
支援端末Ｐ１０９,Support Terminal P109
ピンクラインの柱,Pink Line Pillar
フォーリオン印章,Fourion Stamp
エビルプリースト,Aamon
春風の吹く日まで,When a Spring Wind Blows
れんごくまちょう,Bird of Terrordise
バジリスクの石版,Basilisk Tablet
ウルタ皇女の工具,Princess Ulta's Tools
万物を教え導く者,He Who Teach and Guides
ムチ特技の射程+3m,Whip Skill Range +3m
幻想蝶のウィング,Fantasy Butterfly Wings
タイタス号のタル,Titus Barrel
ピョンスロット卿,Sir Pyoncelot
魔天士ダンタール,Sky Sorcerer Dantal
古強者のグリーブ,Veteran's Greaves
リバイブスナック,Revive Snack
魔創兵長バスラー,Evil Captain Bassler
フラワーウィング,Flower Wings
へこむカンナさん,Dismal Master Kanna
悪意の源への通路,Path to the Source of Malice
七夕の錬金ランプ,Festival Alch Lamp
魔幻都市の便せん,Phantom City Paper
おしゃれカタログ,Fashion Catalog
スタジアムシャツ,Stadium Shirt
ジャゴヌバの幻影,Illusion of Jagonuba
ドミネウス邸の机,Domineus Mansion Desk
トレジャーデモン,Treasure Demon
しっこくのつばさ,Black Wings
グレイブディガー,Grave Digger
ならず者のねぐら,Rogue's Roost
フラウスシールド,Flaus Shield
花柄モダンはかま,Modern Floral Hakama
スピードアップ床,Speed Up Floor
清涼スイムワンピ,Cool Swim Dress
ねこまどう便せん,Meowgician Paper
チェルシーの白衣,Chelsea's White Coat
ネロドスシャドウ,Nerodos' Shadow
白いレースの日傘,White Lace Umbrella
春の和菓子セット,Japanese Sweets Set
パニガルム探査券,Panigalm Explore Ticket
出張購買員ポレロ,Team Vendor Agent Polero
ほしくずのつるぎ,Stardust Sword
工匠神のむねあて,Crafting God's Top
バギ系射程距離+5m,Swoosh-type Range +5m
アルウェーンの町,Alweyn Town
ウィリーデワンド,Wilide Wand
ガニッポのかばん,Ganippo's Bag
エルフの人形・女,Elf Doll (F)
シーサイドチェア,Seaside Chair
お菓子のオーブン,Sweet Oven
よろず屋ミガンス,General Shop Migans
ふかみどりダリア,Dark Green Dahlia
ロベールの家の鍵,Robere's Housekey
ステージシューズ,Stage Shoes
ホシエイアックス,Stingray Axe
ファフニルヘルム,Fafnir Helm
レシピ屋アルキパ,Recipe Shop Archipa
エルダーフレイム,Old Flame
しゃしょうぱーり,Conductor Pari
サイキョーＶロン,Psycho Vron
ザード遺跡への道,Road to Zard Ruins
銀の錬金ランプ小,Silver Alch Lamp S
ファラスキッチン,Faras Kitchen
ウィンターブーツ,Winter Boots
イルーシャの服上,Irusha's Dress Top
育成受付係ブレダ,Training Reception Breda
憤怒のイフリート,Enraged Ifrit
エテーネのつばさ,Ethene Wing
踊り子のティアラ,Dancer Tiara
シスター・ローネ,Sister Rone
ハルバルド海賊団,Halbard Pirates
東洋風飾り棚・雅,Chic Orient Shelf
ダイヤココナッツ,Diamond Coconut
邪神ヤファギル断,Yaphagil, the Severance
えきいんぺいんず,Attendant Penzu
白木のテーブル小,Plain Table S
ゴールデンリーフ,Golden Leaf
ツボ素材屋ジョス,Pot Materials Joss
バケットウィッグ,Bucket Wig
ファンキーブーツ,Funky Boots
プク姫様つきの畑,Puku Princess Field
合唱隊のニーハイ,Choir Knee-Highs
花模様の光るラグ,Floral Glowing Rug
はがねのかなづち,Steel Hammer
ガートラント兵５,Gartlant Soldier 5
しぐさ書・天灯緑,Emote "Green Lantern"
ルベランショット,Ruberan Bow
王宮のタンス・青,Blue Royal Wardrobe
まもの使いハウス,Monster Master House
パープルエッグ２,Purple Egg 2
複数魚水そう・小,Multi-Fish Aquarium S
ドラグーンランス,Dragoon Lance
おおきなリボン白,White Ribbon L
魔因細胞のかけら,Demon Cell Fragment
プラコンナスビ服,Woebergine Costume
カルサドラ溶岩洞,Calsadora Pyroduct
らくらくジョウロ,E-Z Watering Can
ステラツイスター,Stella Twister
ボロボロのリボン,Tattered Ribbon
メルヘンクリーム,Fairy-tale Cream
ももじゃの像・庭,Platypeach Statue (G)
シマ柄のじんべい,Striped Jinbei
栄光のトロフィー,Glory Trophy
究明者のコート下,Research Coat Bottom
ワーニングな水着,Warning Swimsuit
黒宝箱のチェスト,Black Treasure Chest
はじめてのルーペ,Beginner's Loupe
アスバルへの親書,Official Letter to Asbal
ステンドレイピア,Stained Glass Rapier
オパールのダンロ,Opal Fireplace
シャークウェア上,Upper Sharkwear
カジュアルブレス,Casual Bracelet
ボスコイン無料券,Free Boss Coin Ticket
マジカル姫ぞうり,Magical Sandals
フォーリンスター,Fallen Star
究明者のシューズ,Research Shoes
魔幻都市ゴーラ跡,Phantom City Gora
ワンダラー放浪記,Wanderer's Notes
魔の試練・第１層,Demon Trials - Level 1
逆乱の竜ナダイア,Nadaia, Dragon of Rebellion
シンイのこころ９,Shini's Heart Lv. 9
チェイサーアーム,Chaser Armguards
銀の木工刀小の本,Silver Slick S Book
飛鶴文のふりそで,Flying Crane Kimono
マーメイドパレオ,Mermaid Pareo
しぐさ書・かかし,Emote "Scarecrow"
ドワチャカオイル,Dwachakka Oil
ウィリーデクロー,Wilide Claws
オーガテーブル大,Ogre Table L
マリーンの金剛棒,Malynn's Diamond Rod
白亜の博物館の塀,Chalk Museum Fence
ハロウィン衣装券,Halloween Costume Tkt
ロイヤルステップ,Royal Step
ケセランパセラン,Tufty Tot
スマートチェスト,Smart Chest
スターリースピア,Starry Spear
王都カミハルムイ,Royal City Kamiharmui 
３段ブロック・緑,Green 3-Step Block
エレガントヒール,Elegant Heels
シスター・ラクト,Sister Lakuto
シスター・ロッカ,Sister Lokka
ブロブフィッシュ,Blobfish
ツインクルタクト,Twinkle Little Staff
スライムベス提灯,She-Slime Paper Lantern
金平糖ライト・氷,Ice Candy Light
