機工博士の方程式,Engineer's Formula
スラタワーボディ,Slime Stack Body
鉱石の燭台ランプ,Ore Candlestick lamp
ジャングルの岩壁,Jungle Rock Wall
先制攻撃率アップ,First Strike Rate Up
エビルキュビズム,Evil Cubism
ロリータキャップ,Lolita Cap
便せん屋ウツセミ,Stationery Shop Utsusemi
旅芸人の衣装上２,Minstrel Shirt 2
ネオン・メーター,Neon Meter
赤い屋根の家の柱,Red Roof House Pillar
壁かけ羽子板飾り,Hagoita Wall Decor
特急メタル招待券,Express Metal Ticket
学園の教室のイス,School Classroom Chair
出張大使バガトゥ,Ambassador Bagatu
第１２回ピコ像庭,12th Pico Statue (G)
フォトライフ・銀,Photo Life Silver
Ｓキラーブレード,Trauminator Blade
超高性能スコップ,Ultra High Power Shovel
打ち上げ花火・赤,Red Firework
横ウェーブつけ毛,Side Wavy Hairpiece
交換屋メリーポコ,Exchange Shop Meripoko
ベホイミスライム,Medislime
獄嵐鬼ウェンリル,Stormkeeper Wenrir
うらないしはっけ,F. Teller Hakke
ムーディーライト,Moody Light
お菓子のバスタブ,Sweet Bathtub
魔物管理人ツグミ,Monster Manager Tsugumi
ホースデビル・強,Vicious Gamigin
整備士のてぶくろ,Technician's Gloves
エテーネのつばさ,Ethene Wing
グレイトドラゴン,Great Dragon
オルストフの尻尾,Orstov's Tail
朽ちた遺跡の祭壇,Ruin Altar
奇門遁甲の式・参,3rd Divination Ceremony
3rdキョウダイフク,3rd Brother Clothes
妖精図書館の本棚,Fairy Library Bookshelf
冥王ネルゲルの像,Nergel Statue
エネルギー制御室,Energy Control Room
三角ランタンの木,Triangle Lantern Tree
ウィリーデサイズ,Vilide Scythe
魔物管理人の制服,Monster Manager Uniform
レース屋ツキカゲ,Race Registrar Tsukikage
野いちごスカート,Wild Strawberry Skirt
白亜の王城・１階,Chalky Castle 1F
さとりのグローブ,Gloves of Clarity
ブリキ板張りの壁,Tin Plate Wall
オレンジのパーツ,Orange Part
シャンテキッチン,Shante Kitchen
パティシエのくつ,Pastry Chef Shoes
ブランウッドの束,Branwood Bundle
看板・ビックリ！,Sign - Exclamation!
ポポラパの最深部,Popolapa Depths
あるある川柳・銅,Haiku Bronze
ボーンのこんぼう,Zombie Gladiator Club
激情の竜エステラ,Estella, Dragon of Passion
カスタードダリア,Custard Dahlia
フレンジーの部屋,Frenzy's Room
ドラゴンバスター,Wyrmfang
ステラツイスター,Stella Twister
預かり所ティーチ,Storage Tichi
らいだーすすーつ,Riders Suit
シグナルウィング,Wing Signal
ホーリーローブ下,Holy Robe Bottom
リンジャハル海岸,Linjahar Coast
ギュッとヒューザ,Hyuza Arm Doll
グレイナル叙事詩,Epic of Greygnarl
壁かけ吊るし食材,Wall Hanging Food
ココラタのテント,Cocolata Tent
おもちゃのテント,Toy Tent
ミイラ男のぼうし,Mummy Boy Hat
デュエルキャップ,Duel Cap
魔侯爵のグリーブ,Marquis Greaves
ウルベア地下遺跡,Ruins of Urbea
マッシュスライム,Slimeshroom
木彫りのロザリオ,Wood Carved Rosary
防衛軍のグローブ,Defense Force Gloves
しょうにんあがた,Merchant Agata
トポルのパラソル,Topol Umbrella
エトワールブーツ,Etoile Boots
邪眼の盾の作成術,Make an Evil-Eye Shield
謎の大巨人の写真,Mystery Giant Photo
芸人の服の作り方,Making a Talent Outfit
弐の式修了の陰符,Yin II Completion Charm
光攻撃ダメージ+5%,Light Attack Damage +5%
ドラキーの像・庭,Dracky Statue (G)
エネルギー誘導球,Energy Guide Sphere
グレイトマーマン,Merderer
アビスセーラー下,Abyss Bottoms
竜界を継ぐ者たち,Heirs of the Dragon Realm
キンペンカプセル,King Penguin Toy
ポセイドンランプ,Poseidon Lamp
ハイパーマカロン,Hyper Macaron
しぐさ書・ケーキ,Emote "Cake"
初期ウェディ男性,Initial Weddie Male
時獄のドミネウス,Damned Domineus
サンタのてぶくろ,Santa Mitts
アラハギーロ城内,Al-Ahagiro Castle
パティシエの服下,Pastry Chef Bottom
白ねこの便利な壁,White Cat Wall
ほうおうの巻き物,Phoenix Scroll
スターのイス・青,Blue Star Chair
邪精霊マガツカゼ,Magatsukaze, the Wicked Wind
ルーンバックラー,Rune Buckler
うごめくモノたち,Wiggling Things
道化師のグローブ,Buffoon's Gloves
落陽の草原への道,Road to Sunset Meadow
どうぐ使いの特訓,Item Master's Training
青宝箱のチェスト,Blue Treasure Chest
参の式修了の陽符,Yang III Completion Charm
あおりんごダリア,Light Green Dahlia
光のフライパン小,Light Fry Pan S
ガタラ原野の木Ａ,Gatara Fields Tree A
アサガオのアーチ,Morning Glory Arch
南国からお届け！,Came From the Tropics!
カイザードラゴン,Royal Reptile
別離の剣器・全霊,Parting Blade of the Soul
ハロふわモーモン,Halloween T. Sanguini
たたきモグラの像,Mashing Mole Statue
大いなる闇の深淵,Abyss of the Great Darkness
オシリスのアンク,Osiris' Ankh
チアガール衣装券,Cheerleader Outfit Tkt
たまねぎスライム,Onion Slime
スイカのイス・黄,Yellow Watermelon Chair
追加クエダミー８,not used
グランゼドーラ城,Gran Zedora Castle
便せん屋ヒキワリ,Stationery Shop Hikiwari
ばしょうせんの本,Frond Fan Book
ふわふわタツノコ,Fluffy Seahorse
便せん屋シロタエ,Stationery Shop Shirotae
まよえるえうりこ,Lost Eurico
イプチャルの鉱石,Yppchal's Ore
ホーリーパウダー,Holy Powder
想いを花に込めて,Thoughts Into Flowers
フルーツの便せん,Fruit Paper
ハクオウフェイク,Hakuo Fake
奇跡の錬金ランプ,Miracle Alch Lamp
ウイングタイガー,Missing Lynx
ふわふわホホジロ,Fluffy Shark
新商品は桜の香り,Cherry Scented Products
武器屋ニョッププ,Weapon Shop Nyopup
ギュメイ将軍の像,Goresby-Purrvis Statue
しぐさ書・ピース,Emote "Peace"
流星メダル引換券,Meteor Medal Voucher
魔天匠レスヘヴン,Master Les Haven
くさりのあみぐつ,Chain Boots
ふぉーまるどれす,Formal Dress
ウェスタンハット,Western Hat
ドット柄の浮き輪,Dot Pattern Floatie
魚交換員パパルパ,Fish Exchange Papalupa
２段ブロック・赤,Red 2-Step Block
白木のカウンタ大,Plain Counter L
フォルモンティ村,Vollmondi Village
ダストンのポスト,Duston Mailbox
ルフの盾の作り方,Making Luf's Shield
魔女の玉プリズム,Witch's Ball Prism
限定交換屋ポタン,Limited Exchange Shop Potan
壁かけ武器セット,Weapon Wall Set
ラキポルテソファ,Lycae & Porte Sofa
氷の上のぬくもり,Warmth On the Ice
代理人ハヤテの像,Agent Hayate Statue
お祝いシャワー緑,Celebration (Green)
野いちごサンダル,Wild Strawberry Sandals
ブラックゴースト,Black Ghost Knifefish
エドアルドの部屋,Eduardo's Room
アビスソルジャー,Abyss Soldier
魚交換員パッツィ,Fish Exchange Patsy
大きなお菓子の柱,Big Sweets Pillar
チョコっと衣装券,Choco Costume Ticket
謎の首長竜の写真,Mystery Lake Beast Photo
ドワーフ間仕切り,Dwarf Partition
新作家具屋カガミ,New Indoor Furniture Shop Kagami
しぐさ書・ネオン,Emote "Neon"
占い師のテーブル,Diviner Table
ジャックのカード,Jack Card
おうごんのかけら,Gold Nuglet
プシューケーの盾,Psyche Shield
エテーネスズラン,Ethene Lilies
ひらめきのゆびわ,Sorcerer's Stone
ほのおのよろい上,Flame Armor Top
預かり所ジュエル,Storage Jules
東洋風タンス・雅,Chic Orient Wardrobe
キィンベルの服上,Kimbel Shirt
壁かけ紋章旗・青,Blue Wall Banner
ネタ「ひまわり」,Sunflower Trick
死のカラステング,Death Crow
預かり所コライユ,Storage Koraiu
クローバーのカギ,Clover Key
つやめく毛髪の束,Glossy Hair Bunch
スイの塔への出口,Exit to Sui Tower
しぐさ書・土下座,Emote "Grovel"
マスカルポンポン,Mascarponpon
まほうせんしだん,Armamentalist Corps
ダーマ神殿の松明,Alltrades Abbey Torch
シルバーアックス,Silver Axe
絶牙の白獅子たち,White Fang Lions
イラッシャイマセ,Welcome
りゅうおうナイフ,True Dragonlord Knife
修練の竜アズーロ,Azuro, Dragon of Training
トランプポイント,Card Points
さめきぐるみもも,Pink Shark Suit
壁画管理ペコリア,Mural Management Pekoria
ライトニング無頼,Lightning Unreliable
使い魔バジリウス,Familiar Basilius
クリムゾンヘルム,Crimson Helm
剣王ガルドリオン,Sword King Gardlion
ジュレー島の木Ｃ,Jule Island Tree C
はじめての木工術,Would-Be Woodworking
凶禍のフラウソン,Flauson the Wicked
記憶のムストの町,Memory of Morst
神獣アマカムシカ,Amazlantelope
妖精たちのポルカ,Brownie Boost
博愛騎士のピアス,Love Knight Earrings
マジカルチケット,Magical Ticket
月のローブセット,Moon Outfit
学生のローファー,School Loafers
スラミチカプセル,Slimichi Toy
パタプラのうきわ,Patapula's Floatie
ほっとヘッドホン,Soft Headphones
キャプテンクロー,Captain's Hooks
羅刹王バラシュナ,Varashna, the Sinful Spirit
クリスマスライム,Christmas Slime
中型の丸い水そう,Round Aquarium M
超あまつゆのいと,Super Celestial Skein
魚交換員ビコメチ,Fish Exchange Bikomechi
ライダース衣装券,Rider Outfit Ticket
暁の使者コッケン,Dawnkeeper Cuckoo
メギストリスの都,Megistris City
スタジアムパンツ,Stadium Shorts
アツアツグラタン,Piping Hot Gratin
ハンモックベッド,Hammock Bed
小型の球体水そう,Spherical Aquarium S
ファラオ・ゴレム,Pharaoh Golem
暗殺教本・毒殺編,The Poison Assassin
トポルのフェンス,Topol Fence
リュートを奏でる,Play Lute
レシピ屋ルセット,Recipe Shop Ruseto
ナイトメアリーフ,Lethal Leaf
天宮騎士のかぶと,Sky Knight Helmet
ゾンビブラザーズ,Zombie Brother
しょうにんぼちぼ,Merchant Bochi
バルディスタ印章,Valdista Stamps
歌詠みのころも上,Poet's Attire Top
リンクスのヒミツ,Lynx's Secret
マーメイドパレオ,Mermaid Pareo
かぜきりの弓の書,Blowy Bow Book
月見の縁台セット,Moon Viewing Bench Set
レオン・ビュブロ,Leon Byblo
邪神ヤファギル断,Yaphagil, the Severance
ミローレのチョコ,Milore's Chocolate
シスター・ミペカ,Sister Mipeka
案内係エリーシェ,Guide Elishe
光の鍛冶ハンマー,Light Smith Hammer
栄光のローブ・銅,Bronze Glory Robe
アドミラルハット,Admiral's Hat
愛のチョコレート,Affection Chocolate
ファラストランプ,Faras Cards
苺お菓子のベンチ,Berry Sweet Bench
商品ナンバー１３,Item Number 13
シャコガイの大盾,Giant Clam Greatshield
ザード遺跡への道,Road to Zard Ruins
クオードのコート,Quard's Coat
フサフサの白ヒゲ,Fluffy White Mustache
オレンジスズラン,Orange Lily
しびれくらげ１７,Man o' War 17
レンダーシアの服,Lendersia Clothing
師団長のグリーブ,Commander Greaves
あたまリボン桃券,Pink Head Ribbon Ticket
メルヘンクリーム,Fairy-tale Cream
リリオルを探せ！,Find Lyriol!
ちゃがまゴンの像,Wyrkettle Statue
メルサンディ印章,Melsandy Stamps
チアガールの服下,Cheerleader Skirt
ピクニックグリエ,Grei Picnic
イーギュアの大牙,Rapscallion's Fang
アラハギーロ王国,Kingdom of Al-Ahagiro
へんげのステッキ,Mod Rod
壁かけパッケージ,Wall Hanging Package
追想の王城・３階,Memory's Castle 3F
ボロボロのリボン,Tattered Ribbon
聖守護者のタクト,Sentinel's Baton
プラチナサウルス,Platinasaurus
ブチブタカプセル,Spotted Pig Toy
ラウルぬいぐるみ,Rahul Plushie
スライムチャイム,Slime Chime
レッドアーチャー,Bodkin Bloodbow
コルシュール大臣,Minister Corsur
BGMテスト同期部屋,BGM sync test room
グロスナー王の剣,King Grossner's Sword
剣魔ジルドラーナ,Jildrana, the Spellsword
忘我のシシカバブ,Forgetful Shish Kebab
スキップ係オウカ,Skipper Ouka
終わりを告げる者,The Doomsayer
学園女子の夏服下,Schoolgirl Summer Skirt
バケットウィッグ,Bucket Wig
大怪傑のはちまき,Wondrous Headband
カボチャチェスト,Pumpkin Chest
ショップポイント,Shop Points
魚交換員ビスリン,Fish Exchange Bislin
２段ブロック・緑,Green 2-Step Block
さめきぐるみあか,Red Shark Suit
実行委員リーベル,Executive Committee Ribel
ツインアンテナＣ,Twin Antenna C
ようせいのおでん,Fairy Hot Stick
ガケ沿いの集会所,Cliffside Assembly Hall
よろず屋ガーディ,General Shop Gadi
ネヴァンメイル上,Nemain Mail Top
出張購買員ポレロ,Team Vendor Agent Polero
預かり所ボルリラ,Storage Borrilla
スライムウィップ,Slime Whip
よろず屋パサンタ,General Shop Pasanta
祈星のスティック,Prayer Star Wand
ゴマフビウミウシ,Sea Bunny
ラストチョーカー,Ultimate Choker
しぐさ書・ねる３,Emote "Sleep 3"
起源獣ガルドドン,Gardodon, Beast of Origin
極天女帝のぼうし,Sky Empress Hat
ダストンパラソル,Duston Umbrella
マイタウン権利証,My Town Deed
試練のケモノたち,Trial Beasts
やさしさのクスリ,Kindness Medicine
魔法戦士団ハット,Armamentalist Hat
辺境警備隊兵士Ｂ,Frontier Guard Soldier B
女神ルティアナ像,Lutiana Statue
世界樹のグリーブ,Yggdrasil Greaves
パピヨンクラウン,Papillon Crown
星石のハルバード,Meteorite Halberd
仲間のフウキの証,Member's SCC Emblem
検証用家具１０２,Verification Decor 102
ラッキーチケット,Lucky Ticket
動くあいさつ印章,Animated Stamps
お姫様食器棚・桃,Pink Princess Cupboard
壁かけルナナの絵,Lunana Portrait
ダーマ神殿への道,Path to Alltrades Abbey
便せん屋キキョウ,Stationery Shop Kikyo
トンブレロ貯金箱,Ham Shamwitch Pig Bank
どういたしまして,You're Welcome.
赤キノコ栽培日記,Mushroom Diary
プラコン美容院券,Beauty Salon Ticket
エルフたちの集落,Elven Settlement
黒レザーのタンス,Black Leather Wardrobe
悪魔王の同族狩り,Hunting Devil's Family
ジア・クト念晶体,Dia Kut telecrystal
アクロニウム鉱石,Acronium Ore
壁かけ鉄のランプ,Iron Wall Lamp
アズラン駅の模型,Azlan Station Model
儀礼場への洞くつ,Cave to the Court
大魔王顔壁への道,Road to The Faces of Evil
ジェルソルジャー,Gel Soldier
いっぱつのズボン,One Shot Pants
ナスビッＴシャツ,Woebergine T-Shirt
ヤマネコグローブ,Wildcat Gloves
スカウト率アップ,Scout Rate Boost
ふしぎなボレロ上,Glombolero Top
グランゼドーラ門,Gran Zedora Gate
ポセイドンチェア,Poseidon Chair
ポルネア山への道,Road to Polnea Mountain
旬の黄金本マグロ,Seas. Gold Bluefin Tuna
メタル迷宮招待券,Metal Maze Ticket
ながれ星の贈り物,Shooting Star's Gift
ブラッディ・ゼア,Bloody Zea
ボロボロのノート,Tattered Notebook
７ｍｖドワーフ男,7mv Dwarf Man
天空のオルゴール,Zenithia Music Box
人食い火竜カード,Tatsunaga Card
イルーシャの部屋,Irusha's Room
かなしきいれーん,Sad Elaine
ナブレットソファ,Nablette Sofa
それは誰がために,To Whom it May Concern
しぐさ書・うちわ,Emote "Fan"
ごうかな本棚・緑,Green Fancy Bookshelf
タータンシューズ,Tartan Shoes
クルーガーハット,Kluger Hat
お花大好きクポ！,I Love Flowers, Kupo!
獄炎鬼アグニース,Firekeeper Agnis
混沌竜ランブルス,Rumbles, Dragon of Chaos
バトマスグローブ,Battlemaster Gloves
ベジセルクの奏演,Cucumberserk's Act
ジャンボオニオン,Jumbo Onion
フェザーマジック,Feather Magic
桜モダングローブ,Cherry Modern Gloves
ウェディングベル,Wedding Bell
紋入りのレンガ柱,Crested Brick Pillar
魔物管理人シオネ,Monster Manager Shione
銀のフライパン小,Silver Fry Pan S
リカバースナック,Recover Snack
純喫茶の観葉植物,Cafe Houseplant
水の領界の鉢植え,Water Realm Plant Pot
赤の巨人レドノフ,Red Giant Rednov
学園の教室の教壇,School Classroom Podium
オーロラパウダー,Aurora Powder
ツボ錬金職人頭巾,Pot Alchemist's Cap
合唱隊のスモック,Choir Smock
ムーディータンス,Moody Wardrobe
中腹への道　入口,Path to Halfway Entry
グリーンアロワナ,Green Arowana
モンスター格闘場,Monster Arena
もこもこセーター,Fluffy Sweater
授業ウェディ女性,Weddie Female Student
滝のかきわり・雅,Waterfall Backdrop
打ち上げ花火・青,Blue Firework
よろいのきし・凶,Knight Destructant
名探偵のコート下,Sleuth's Coat Bottom
エルフのあいさつ,Elf Greeting
第１１回パドレ像,11th Padre Statue
コッケンの乗る棒,Kokken's Riding Crop
会心時ダメージ+50,Critical Damage +50
若者の家ペコリア,Youth House Pekoria
黒曜のテーブル小,Obsidian Table S
今そこにいる辛党,Now That's a Spicy Party
水鳥のいる池・庭,Bird Pond (G)
ポポラパの洞くつ,Popolapa Cave
口調の書・オレ様,Tone Book - Tsundere
魚交換員ピペッタ,Fish Exchange Pipetta
カジュアルヒール,Casual Heels
ルイーダチケット,Patty Ticket
キングスパーキー,King Sparky
ユグドラシルの本,Spryggdrasil Book
原始獣のコート上,Primal Beast Coat
ナスビのランタン,Woebergine Lantern
レースの観客２４,Race Spectator 24
サイドヘアリボン,Side Hair Ribbons
ももんじゃケープ,Platypunk Cape
聖夜の反逆者軍団,Holy Night Rebel Army
預かり侍女アトリ,Storage Maid Atori
下級亡霊兵士たち,Lowly Spirit Soldiers
れっどたきしーど,Red Tuxedo
臨時大使ムチョロ,Temp Ambassador Mucholo
ベビーサタンの書,Imp Book
しましまキャット,Candy Cat
強酸性の間　入口,Strong Acidity Entry
黒岩削り出しの壁,Black Rock Wall
デーモンフォーク,Archdemon Fork
たれ黒猫カプセル,Lazy Black Cat Toy
ネネットの日記帳,Nenette's Diary
キツネパーカー下,Fox Shorts
銀の噴水の作り方,Making Flower Fountains
超エッチなしたぎ,Really Robust Lingerie
しぐさ書・苦笑い,Emote "Bitter"
スターリースピア,Starry Spear
もこもこスカート,Fluffy Skirt
ニンジャカッター,Ninja Cutter
パルミオトランプ,Palmio Cards
よろず屋ピッペル,General Shop Pippel
東洋風チェア・雅,Chic Orient Chair
スカラベーダーズ,Scaravaders
オファニムのカギ,Ofanim's Key
帝国三将軍練習札,Triumgorate Tag
悪神の心域２印章,Heartlands 2 Stamps
ハートの本棚・桃,Pink Heart Bookshelf
デモンズゲイトＡ,Demon Zugei A
ナスビナーラの像,Woebergine Statue
金のほこらへの道,Road to Gold Shrine
紫イモのテーブル,Purple Yam Table
ピクニックカミル,Kamil Picnic
ギュッとダクキン,Dark King Arm Doll
ウリボーカプセル,Wild Boar Toy
氷のシャンデリア,Ice Chandelier
黄昏の霊堂への扉,Door to Mausoleum of Dusk
ナチュラルチェア,Natural Chair
マホトラのころも,Magic Cloak
レジェンズガード,Legends Guard
奇門遁甲の式・弐,2nd Divination Ceremony
女学生のブレザー,Schoolgirl Blazer
おおきなリボン黄,Yellow Ribbon L
リィンのグローブ,Lynn's Gloves
星空のタンス・紫,Purple Starry Wardrobe
ファルコンダガー,Gryphon's Wing
シャークサンダル,Shark Sandals
サフラングローブ,Saffron Gloves
時の化身の像・庭,Tockle Statue (G)
魔剣士のグローブ,Demon Swordsman Grips
グリエ王子の部屋,Prince Grie's Room
打ち上げ花火・緑,Green Firework
しぐさ書・ギター,Emote Book "Guitar"
コルセアマント下,Corsair Pants
クリーミーカカオ,Creamy Cacao
素材屋看板と敷物,Material Shop Sign and Floor
ドール書・いのる,Doll Book "Pray"
道具屋リーフィヤ,Item Shop Leafia
暗黒大樹の守り人,Guardian of the Dark Tree
ゴールドエッグ２,Golden Egg 2
ディアナウィング,Diana Wings
リバイブスナック,Revive Snack
ルファ神殿・入口,Rufa Temple - Entry
エルダードラゴン,Elder Dragon
あたまリボン茶券,Tea Head Ribbon Ticket
白鳥の弓の作り方,How to Make a Swan Bow
丸小紋のはかま下,Circle Hakama Bottom
ふわふわペコリア,Fluffy Pekoria
夕焼け雲のベッド,Sunset Cloud Bed
レースの観客０１,Race Spectator 01
ギュッとアイゼル,Eisel Arm Doll
エピステーサ丘陵,Epistesa Hills
トロルバッコス強,Apex Gladiator Troll
女性プラコン服紫,Purple Clothes (F)
甘いシロップビン,Sweet Syrup Bottle
しんごんのじゅず,Rosary
ダーマ神殿への扉,Door to Alltrades Abbey
覇者のローブ・金,Gold Champ Robe
ワルド水源への道,Road to Wald Headwaters
エテーネのまもり,Ethene Charm
クリナップロッド,Cleanup Club
切る前の玉子焼き,Uncut Omelet
やりなおしの宝珠,Regretta Stone
預かり所ニノヤズ,Storage Ninoyazu
勇者姫のウィッグ,Hero Princess Wig
スライムチケット,Slime Ticket
板張りの大きい壁,Plank Wall L
ウルタのコート上,Ulta Coat Top
プチガイアカード,Frail Gaia Card
王宮の食器棚・青,Blue Royal Cupboard
マジックトンカチ,Magic Hammer
ケキちゃんハウス,Cakey House
ダークプラネット,Dark Planet
プレミアムな金箔,Premium Gold Leaf
ウェナールシェル,Wenal Shell
ふかみどりダリア,Dark Green Dahlia
かなしきりかるど,Sad Ricardo
ネオケラトドゥス,Neoceratodus
フォン・バルディ,Von Baldi
王国の見張り塔前,Kingdom Watchtower
エステラの紹介状,Estella's Intro Letter
しびれくらげ１５,Man o' War 15
ポポリアきのこ山,Popolia Mushroom Mountain
クラムベリル広場,Crumberyl Clearing
名探偵のシューズ,Sleuth's Shoes
クレセントエッジ,Razer-Wing
はがねのよろい下,Steel Armor Bottom
便せん屋ヤマブキ,Stationery Shop Yamabuki
こわれたスロット,Broken Slot Machine
がうがうキャップ,Bow-Wow Cap
はぐれメタルの像,Liquid Metal Statue
ウィズダムサイス,Wisdom Scythe
ゼクレスの丸イス,Zechres Stool
スノースティック,Snow Stick
まっちゃガーベラ,Matcha Gerbera
きりこみプレート,Aquatic Armour
ジア・クリスタル,Dia Crystal
マスターグレイト,Master Dragon
シスター・レジア,Sister Regia
ドラゴンチケット,Dragon Ticket
アルテミスの恵み,Artemis' Blessing
スチームカッター,Steam Boomerang
預かり所ポンヌク,Storage Ponnuk
スコーピオサイス,Scorpio Scythe
シナイジッチたち,Sinazitch and co.
怪魔鳥バトロウス,Monstrous Bird Batros
中枢へ向かう通路,Passage to Core
冥獣のツメの秘術,Monster Slashers Secret
マイレージメダル,Mileage Medal
獄水鬼ヴァーテル,Waterkeeper Vater
ヘナトライロッド,Blunt Rod
原始獣のコート下,Primal Beast Leggings
ポルテのグルめも,Porte's Gourmemo
スウィートビキニ,Sweet Bikini
今年のブレス対策,Breath Countermeasures
ブラニック採石場,Branick Quarry
シュパルトクロー,Rift Claws
シスター・リィト,Sister Lito
郵便局員ツィサア,Postman Tsisa
しぐさ書・ロック,Emote "Rock 'n' Roll"
貢献賞トロフィー,Contribution Trophy
プロディトヘッド,Plaudit Headdress
パッショントップ,Passion Top
壁かけＤＱⅡの絵,DQⅡ Painting
びっくりボックス,Trap Box
スラタワーパンツ,Slime Stack Bottom
カジノオルゴール,Casino Music Box
クリスタルハンド,Crystal Hand
シスター・マキリ,Sister Makiri
シスター・ヤチヨ,Sister Yachiyo
クマリスのブーツ,Kumaris' Boots
スタン弾ショット,Stunning Shell
春風の吹く日まで,When a Spring Wind Blows
ドラゴン花火・黄,Yellow Dragon Firework
フリーズブレード,Frost Fangs
ブラバニクイーン,Dark Hare
ダンサーシューズ,Dance Shoes
ロイヤルステップ,Royal Step
セルケトのアンク,Serket's Ankh
ヴェリナード領西,Verinard West
フラウスブレード,Flaus Blade
アンノウンロッド,Unknown Rod
ポイックリンの像,Poiclin Statue
メタルなプチ香水,Metal Perfume S
勝利の彫像の写真,Victory Sculpture Photo
第１１回ラウル像,11th Rahul Statue
ふわふわクリオネ,Fluffy Sea Slug
装飾具屋ピッタン,Decoration Shop Pittan
魚交換員グナクー,Fish Exchange Gunaku
郵便局員ペープペ,Postman Pepupe
王立研究所職員１,Royal Research Staff 1
バルディスタ歩兵,Valdista Foot Soldier
求道者のてぶくろ,Seeker's Gloves
ジングルモーモン,Jingly Sanguini
工匠神のグローブ,Crafting God's Gloves
シスター・レレノ,Sister Releno
ホーローの隠れ家,Hollow's Hideout
ごちそうターキー,Feast Turkey
時の車掌ゼーベス,Conductor of Time, Zebes
キラキラモーモン,Glittering T. Sanguini
調理職人コック帽,Cook's Hat
グロリアスブーツ,Glorious Boots
シグナルクラウン,Crown Signal
ジャリムバハ砂漠,Jyarimbaha Desert
おばけのいしょう,Ghost Costume
ヒューザの便せん,Hyuza Paper
よろず屋カエマン,General Shop Kaeman
タンブラーシャツ,Tumbler Shirt
スライムのゆかた,Slime Yukata
夕焼け雲のタンス,Sunset Cloud Wardrobe
剛獣鬼ガルドドン,Gardodon, the Brutal Beast
エックス君の像３,Mr. X Statue 3
ヘルガーディアン,Hell's Gatekeeper
メガトンハンマー,Megaton Hammer
