オーガテーブル大,Ogre Table L
ドルマ★レッスン,Zam★Lessons
キレキレキッシュ,Sharp Quiche
りゅうおうナイフ,True Dragonlord Knife
ぬいぐるみ屋ウー,Plushie Shop Woo
ユシュカのズタ袋,Yushka's Bag
ヒョウモンダーク,Dark Octopot
ハーベストドラゴ,Harvest Dragon
プリズンイーグル,Prison Eagle
チョコボチケット,Chocobo Ticket
超暴走魔法陣・零,Uber Ring of Ruin
チェイサーブーツ,Chaser Boots
ミラクルクッキー,Miracle Cookies
釣り用ダミー宝箱,Fishing Treasure Chest
異国の寺院の牡丹,Exotic Temple Peonies
人形師のアトリエ,Dollmaker's Workshop
キャプテンの部屋,Captain's Room
王宮のタンス・青,Blue Royal Wardrobe
タンブラーボトム,Tumbler Pants
王宮の食器棚・赤,Red Royal Cupboard
おきもの赤キノコ,Red Mushroom Ornament
魔獣調教士ガブラ,Beast Trainer Gabra
蝶模様のふりそで,Butterfly Kimono
鉱石の台座ランプ,Ore Pedestal Lamp
えきいんあぼっと,Attendant Abbot
案内係ピューリィ,Guide Pury
装飾具屋ピッタン,Decoration Shop Pittan
りゅうおうソード,Dragonlord Sword
預かり所マノリタ,Storage Manorita
グロリアスズボン,Glorious Pants
黄金の飾り片手剣,Gold Ornament Sword
レシピ屋ロミルダ,Recipe Shop Romilda
ファンキーブーツ,Funky Boots
『だれでもＯＫ』,"Anyone is OK"
えきいんぴけっと,Attendant Piket
よろず屋ヒャッカ,General Shop Hyakka
カミルのローブ下,Kamil's Robe Bottom
スターリーブーツ,Starry Boots
ちょこっとすーつ,Choco Suit
管理人アチュリン,Caretaker Achurin
すごろく魔法使い,Sugoroku Mage
覇者のローブ・銅,Bronze Champ Robe
バステトのアンク,Bastet's Ankh
ルティショー像茶,Tea Astolti Short St.
住宅素材屋ペペプ,Housing Materials Pepepu
ソードギフト・紺,Navy Blue Sword Gift
ドラパンクセット,Dracky Punk Outfit
シスター・ニニカ,Sister Ninika
冒険者のてぶくろ,Adventurer's Gloves
シャークサンダル,Shark Sandals
別離の剣器・全霊,Parting Blade of the Soul
クリスタルクロー,Crystal Claws
ウェディ間仕切り,Weddie Partition
フォステイル広場,Fostail Square
防衛軍の制服・赤,Red Defense Force Suit
踊り子のティアラ,Dancer Tiara
原始獣のシャプカ,Primal Beast Shapka
ゴスバニーシール,Goth Bunny Sticker
帝国三将軍カード,Triumgorate Card
クルヴィダの王冠,Kuruvida's Crown
東洋風飾り棚・華,Floral Orient Shelf
スペシャルランチ,Special Lunch
手編みのセーター,Hand-Knit Sweater
ニコロイ王の写真,Photo of King Nikoroi
モモリオンのカギ,Sanguini King's Key
プロテ豆入り布袋,Bag with Protein Beans
魚交換員ポップイ,Fish Exchange Popui
念晶錬磨場・初級,Telecrystal Refinery - Beginner
お姫様ベンチ・桃,Pink Princess Bench
幸運を呼ぶサロン,Lucky Salon
ラグアスキッチン,Raguas Kitchen
第３回リーネの像,3rd Renee Statue
クマチャンコート,Beary Cute Coat
荷馬車の作業員Ｂ,Wagon Worker B
黄金のあらくれ像,Golden Toughie Statue
紋入りのレンガ壁,Crested Brick Wall
学園男子の海パン,Schoolboy Trunks
ラーヴァドラゴン,Lava Hydra
クラムベリル広場,Crumberyl Clearing
堕天使エルギオス,Fallen Angel Corvus
うごく箱舟号・雪,Moving Ark (Snow)
時の車掌ゼーベス,Conductor of Time, Zebes
武器鍛冶グローブ,Weaponsmith's Gloves
白ヒゲのサンタ服,White Beard Santa Suit
ルージュアックス,Rouge Rhino Axe
ハンギングベッド,Hanging Bed
名探偵のグローブ,Sleuth's Gloves
栄光に隠された闇,Darkness Hidden in Glory
便せん屋キキョウ,Stationery Shop Kikyo
シーサイドチェア,Seaside Chair
タコメッＴシャツ,Octopot T-Shirt
魔天賊ボティたち,Sky Bandit Boti and co.
交換屋クックルン,Exchange Shop Cocoroon
スライムのゆかた,Slime Yukata
遊び人の服セット,Gadabout Outfit
よろず屋ガーディ,General Shop Gadi
アメジストクラブ,Amethyst Crab
ローベルの報告書,Robel's Report
美容師たちの祭典,Hairdresser Festival
ドワーフの便せん,Dwarf Paper
初心者用の片手剣,Beginner's Sword
ガンコ職人の息子,Stubborn Craftsman's Son
せいれいの杖の書,Spirit Staff Book
たたきモグラの像,Mashing Mole Statue
シスター・マキリ,Sister Makiri
預かり所ティリリ,Storage Tiriri
ゴクラクギョ・青,Blue Betta
人食い火竜メダル,Tatsunaga Medal
ベホイムスライム,Sootheslime
最後の神話の戦い,The Last Mythical Battle
魔天導ビブローン,Bibron, Way of Evil
レース屋シャイラ,Race Registrar Shyla
スカウトアタック,Scout Strike
しびれくらげ１７,Man o' War 17
カレイドスコープ,Kaleidoscope
せいどうのかぶと,Bronze Helm
ドワチャカオイル,Dwachakka Oil
超酸性の間　入口,Super Acidity Entry
ヘルコンダクター,Hell Conductor
さめきぐるみあか,Red Shark Suit
和風の５色ランプ,Japanese 5 Color Lamp
ギンガムの便せん,Gingham Paper
ふぉーまるどれす,Formal Dress
あくまのきしの像,Knight Aberrant Statue
聖天のハイヒール,Holy Heaven Heels
ごうかなイス・赤,Red Fancy Chair
ルシェンダの手紙,Lushenda's Letter
預かり所クイーレ,Storage Quaile
どうぐを愛した男,The Man Who Loved Tools
グレンドラゴニア,Glendragonia
竜王のツメの伝説,Dragonlord Claws Legend
わかめ由来石けん,Seaweed Soap
住宅素材屋ゲラド,Housing Materials Gerado
オーガカーペット,Ogre Carpet
療養地区の移動台,Medical Area Platform
カボチャのガゼボ,Pumpkin Gazebo
はぐれメタル召喚,Liquid Metal Summon
マジカルスーツ上,Magical Suit Top
ダークネビュラス,Dark Nebulus
郵便局員ピティカ,Postman Pitica
ほっとするかばん,Comforting Bag
魚交換員プルンパ,Fish Exchange Purunpa
ふしぎなグローブ,Mysterious Gloves
天ツ風の原への道,Road to Howling Highlands
ドロくさいこうら,Smelly Shell
おしゃれなベルト,Bling-Bling Belt
聖大剣アスカロン,Holy Sword Ascalon
しびれくらげ０４,Man o' War 04
追想の王城・２階,Memory's Castle 2F
キラキラモーモン,Glittering T. Sanguini
占い師の丸型ラグ,Diviner Round Rug
ミランのスケッチ,Milan's Sketch
妖精たちのポルカ,Brownie Boost
初期ドワーフ女性,Initial Dwarf Female
祈願の神殿の金庫,Gratitemple Safe
バトルチョーカー,Dogged Collar
フォトライフ・金,Photo Life Gold
フォーリオンの空,Skies of Fourion
世界一クイック伝,World's Quickest Legend
壁かけ掛け軸・冬,Winter Wall Scroll
ゴールデンコーン,24-Carrot Bunicorn
蒼穹の守護者たち,Azure Sky Guardians
ふぉーまるすーつ,Formal Suit
スパイクグローブ,Spike Gloves
大戦鬼のグリーブ,War Demon's Greaves
ホースデビル・強,Vicious Gamigin
スノードーム・金,Gold Snow Globe
メタスラＴシャツ,Metal Slime T-Shirt
スチームチェスト,Steam Chest
バカン山道への道,Road to Bakan Mountain Pass
お姫様のイス・橙,Princess Chair
エレメングリーン,Green Glow
栄光のローブ・銀,Silver Glory Robe
ファータシューズ,Fata Shoes
やみのしょくだい,Sconstrosity
ゲノミーキャップ,Crankiid Cap
ルティショー像黒,Black Astolti Short St.
カプサイせんべい,Capsai Rice Cracker
ネコ姫のスツール,Cat Princess Stool
聖守護者のタクト,Sentinel's Baton
ジュレー島の木Ｂ,Jule Island Tree B
あおざいいしょう,Ao Dai Outfit
郵便局員ブノワト,Postman Bunwato
アトリエ地下１階,Studio B1F
バトエンフラッグ,Batoen Flag
レースの観客１４,Race Spectator 14
プチデビル衣装券,Petit Devil Costume Tkt
シンプルＴシャツ,Simple T-Shirt
光のフライパン小,Light Fry Pan S
デッドリーソード,Deadly Sword
キャラメルの花束,Caramel Bouquet
しびれくらげ２４,Man o' War 24
魔石球のかがやき,Glow of the Magic Stone
レジェンドホース,Godsteed
ゴマフビウミウシ,Sea Bunny
魚交換員ターラタ,Fish Exchange Tarata
ドルワーム兵士２,Dolworm Soldier 2
ガーデンドレス上,Garden Dress Top
プチ幻界の四諸侯,Frail Dread Fiends
氷の魔王のマスク,Ice Witch Mask
学園男子の夏服改,Schoolboy Summer Wear 2
シュメリアヒール,Sumeria Heels
魔幻都市の便せん,Phantom City Paper
エテーネルスープ,Ethenel Soup
花透かし細工の柱,Floral Pillar
初任務はモリナラ,Molinara First Mission
舞い手の服セット,Performer's Outfit
名探偵のコート上,Sleuth's Coat Top
サフランローブ上,Saffron Robe Top
預かり所アガット,Storage Agato
スコーピオサイス,Scorpio Scythe
防衛軍の制服・Ｚ,Defense Force Suit Z
シーサイド仕切り,Seaside Partition
タイタス号の本棚,Titus Bookshelf
飛竜のタマゴ割れ,Broken Dragon Egg
王家のナイフ全集,Nobleman's Knife Set
コーラルディモス,Coral Dimos
ドラキースタッフ,Dracky Staff
パッションパレオ,Passion Pareo
手品師の服セット,Conjurer's Outfit
花透かし細工の壁,Floral Wall
新兵支給てぶくろ,Recruit Gloves
フォレストの花束,Forest Bouquet
ダーマ礼拝堂の扉,Alltrades Abbey Door
中型の丸い水そう,Round Aquarium M
スチームモノクル,Steam Monocle
預かり所ヒメネス,Storage Himenes
ビーナスステップ,Venus Step
今年のブレス対策,Breath Countermeasures
マジカルチケット,Magical Ticket
しぐさ書・あわわ,Emote "Gasp"
スペースデーモン,Spacebonnet
バーニングバード,Firebird Throw
ラブリークッキー,Lovely Cookies
スイレンの釣り堀,Water Lily Fish Pond
パタプラのうきわ,Patapula's Floatie
弐の式修了の陰符,Yin II Completion Charm
ウェディバングル,Weddie Bangles
ジャンボドラキー,Jumbo Dracky
代理人ハヤテの像,Agent Hayate Statue
ネレウスバスター,Nereus Buster
強者賞トロフィー,Strongman Trophy
まっちゃガーベラ,Matcha Gerbera
アンフィスバエナ,Amphisbaena
パピヨングローブ,Papillon Gloves
春の和菓子セット,Japanese Sweets Set
ウルタ皇女の部屋,Princess Ulta's Room
ゲルト海峡への道,Road to Gert Strait
幸せの花を探して,Look for Lucky Flowers
魔天獅ヒッポルコ,Magic Lion Hippolko
あらくれバングル,Brute Bangles
終わりを告げる者,The Doomsayer
最果ての地下遺跡,Deepest Depths
アサシンコート下,Assassin Coat Bottom
紫イモのテーブル,Purple Yam Table
惨禍の迷路への道,Path to Disaster's Maze
はぐメタルーキー,Rookie Liquid Metal Slime
ガタラ風たいまつ,Gatara-Style Brazier
ポリパーカー水着,Hooded Parka Swimsuit
エラスモサウルス,Elasmosaurus
ザハディガル岩峰,Zahadigal Pinnacle
羅刹王バラシュナ,Varashna, the Sinful Spirit
ジェルソルジャー,Gel Soldier
預かり所トッゴイ,Storage Togoi
イグナイトバンド,Ignite Headband
魚交換員ポッツァ,Fish Exchange Pozza
コバルト池のカギ,Cobalt Pond Key
ツタのからまる柱,Ivy Entwined Pillar
王軍師のグローブ,Royal Soldier Gloves
壁かけＤＱⅧの絵,DQⅧ Painting
よろず屋ポロペン,General Shop Poropen
想いを針にこめて,Put Thoughts in a Needle
源世果フルポティ,Frooty Dracky
エンゼルチャイム,Angel Slime Chime
心をつなぐ初仕事,First Job, Connect Minds
見果てぬ夢の蛮勇,Unfulfilled Dreams
上級亡霊兵士たち,High Spirit Soldiers
アドミラルコート,Admiral's Coat
奈落の門への出口,Exit to Abyss Gate
第１１回ケイト像,11th Kate Statue
おもちゃの岩・雪,Toy Rocks (Snow)
預かり所グログス,Storage Gulgus
デモンズゲイトＢ,Demon's Gate B
真珠商パールポポ,Pearl Merchant Palupopo
おくびょうな白猫,Cowardly White Cat
次期天使長の行方,Find The Next Archangel
メタスラのベンチ,Metal Slime Bench
ちいさな時の球根,Tiny Time Bulb
ベコン渓谷への道,Road to Becon Valley
レモンハルト劇場,Lemonheart Theatre
プラコン用編み物,Private Concierge Knitting
アサシンコート上,Assassin Coat Top
デザートゴースト,Sweaty Yeti
カレーサタンの像,Curry Imp Statue
ふたりの近親憎悪,Their Kinship and Hatred
つやめく毛髪の束,Glossy Hair Bunch
ウィキッドブーツ,Wicked Boots
学生のローファー,School Loafers
シスター・ラーニ,Sister Lani
うんてんしばちゅ,Driver Vatu
フェザーマジック,Feather Magic
アルファ用銀の丘,Silver Hill for Alpha
Ｖロンのテーブル,Vron Table
メカニックハンド,Mechanic Gloves
アリゲーターガー,Alligator Gar
カラフルチケット,Colorful Ticket
ガメゴンのこうら,Wyrtle Shell
東洋風タンス・華,Floral Orient Wardrobe
聖騎士のよろい下,Holy Knight Bottoms
特急メタル招待券,Express Metal Ticket
ジャングルの花束,Jungle Bouquet
におうだちの心得,Forbearance Knowledge
ストリートリスト,Street Wristbands
ダークキングの像,Dark King Slime Statue
しぐさ書・土下座,Emote "Grovel"
預かり所コライユ,Storage Koraiu
ドット毒沼柄ラグ,Poisonous Swamp Rug
リトルライバーン,Little Wyvern
ウリボーカプセル,Wild Boar Toy
歌詠みのころも上,Poet's Attire Top
カンフーキャップ,Kung Fu Cap
宵と暁の伝承の本,Legend of Dusk and Dawn
マリーンの宝石袋,Malynn's Jewel Bag
大魔獣イーギュア,Giga Rapscallion
ズワイガニファン,Snow Crab Fan
スチームカッター,Steam Boomerang
動くあいさつ印章,Animated Stamps
ニーベルのゆびわ,Nibel's Ring
じょうりゅうせき,Distillastone
ミイラ男のぼうし,Mummy Boy Hat
蒼穹兵団のかぶと,Azure Corps Helmet
縁日のお面屋さん,Festival Mask Shop
ソードファントム,Phantom Swordsman
素材屋ミルフィプ,Material Shop Mirfpu
モーモンのゆかた,Teeny Sanguini Yukata
ピンキーパンサー,Pink Sabrecat
梅柄の長ざぶとん,Plum Blossom Floormat L
救助された侍女Ｂ,Relief Maid B
チャージ時間-15秒,Charge Time -15 sec.
古グランゼドーラ,Old Gran Zedora
しぐさ書・お弁当,Emote "Lunch Box"
赤リボンのリース,Red Ribbon Wreath
センボンウィップ,Blowfish Whip
ウィリーデサイズ,Vilide Scythe
超あまつゆのいと,Super Celestial Skein
魔物管理人ドリー,Monster Manager Dory
しびれくらげ２０,Man o' War 20
預かり所ユリーラ,Storage Yurila
弱酸性の間　入口,Weak Acidity Entry
白ゴシック柄の柱,White Gothic Pillar
悪霊の神々カード,Evil Trinity Card
フォーリンスター,Fallen Star
がうがうキャップ,Bow-Wow Cap
神具解放の審問宮,Sanctuary of Divine Relics
ルベランアックス,Ruberan Axe
第８回パドレの像,8th Padre Statue
レオーネトランプ,Leone Cards
たいようのおうぎ,Solar Fan
シュメリアピアス,Sumeria Earrings
スターダムハット,Stardom Hat
りゅうおうクロー,True Dragonlord Claw
ブレスクラッシュ,Breathtaking Bash
薬剤設備・庭欠番,Medicinal Facility (G)
看板・ビックリ！,Sign - Exclamation!
聖夜に燃ゆる聖火,Fire Burns on Holy Night
ボーンプリズナー,Marrow Escapee
プクリポ風アーチ,Pukulipo-Style Arch
ヘルジュラシック,Dragster
シスター・ソルテ,Sister Solte
ラウルぬいぐるみ,Rahul Plushie
鍛冶素材屋タブロ,Smithing Materials Tablo
マッシュスライム,Slimeshroom
ほっとヘッドホン,Soft Headphones
ドリームミミック,Dream Mimic
邪神ヤファギル戒,Yaphagil, the Precept
月のサークレット,Moon Circlet
Ⅲ‐ディアノーグ,Ⅲ‐Diamagon
バラモスの像・庭,Baramos Statue (G)
スマートテーブル,Smart Table
いきのいいサザエ,Very Fresh Turban Shell
アルミラージの像,Spiked Hare Statue
陰陽博士の虎の巻,Yin-Yang's Cheat Sheet
白亜の王城・２階,Chalky Castle 2F
アデリーカプセル,Adelie Penguin Toy
マジカル姫ハット,Magical Hat
バカンウグレ遺跡,Bakanugure Ruins
三毛猫のグローブ,Calico Cat Gloves
ヘヴィーグリーブ,Heavy Greaves
レシピ屋トリーナ,Recipe Shop Torina
カボチャつきの畑,Pumpkin Field
ヴァルハラヘルム,Valhalla Helm
よろず屋リーベン,General Shop Leven
リュウグウノユミ,Oarfish Bow
輝天のスティック,Sky Wand
クレセントエッジ,Razer-Wing
笹と流線のゆかた,Bamboo Yukata
ふわふわネルゲル,Fluffy Nergel
郵便局員グウェン,Postman Gwen
よみがえる不死鳥,Resurrected Phoenix
スウィートビキニ,Sweet Bikini
カテドラルミトル,Cathedral Mitre
魔天殻レメゲノン,Sky Shell Remegenon
預かり所オリジェ,Storage Orige
中型の和風水そう,Japanese Aquarium M
錬金強化屋アーク,Alchemy Enhancement Shop Arc
ハクオウトランプ,Hakuo Cards
音符のベンチ・黒,Black Music Bench
預かり所ラヴィア,Storage Lavia
どん欲のグリーニ,Greedy Greenie
ファラオ・ルドラ,Pharaoh Rudra
トモガラのお願い,Tomogara's Request
くろがねのブーツ,Darksteel Boots
球体式浮遊座椅子,Spherical Floating Seat
トナカイスーツ券,Reindeer Suit Ticket
便せん屋ヒナゲシ,Stationery Shop Poppy
風虎の道着セット,Wind Tiger Outfit
オセアノススピア,Full Fathom Fork
ごうかな本棚・緑,Green Fancy Bookshelf
刺しゅう入りくつ,Embroidered Shoes
魚交換員ビスリン,Fish Exchange Bislin
きようさにくまん,Deft Meat Buns
コットンフェザー,Cotton Feather
複数魚水そう・中,Multi-Fish Aquarium M
ストリングライト,String Light
ドルタムシールド,Doltam Shield
カボチャチェスト,Pumpkin Chest
しぐさ書・まわる,Emote "Spin"
密林の暴獣ザベス,Jungle Beast Zabeth
月のローブセット,Moon Outfit
バラモス強メダル,Apex Baramos Medal
アスフェルド学園,Asfeld Academy
高貴な紋付はかま,Noble Crest Hakama
なけなしのおかね,Bag with Little Money
タータンキャップ,Tartan Cap
ましょうのおうぎ,Devilish Fan
クリスモスゾンビ,Christmas Zombie
大辛魔獣モローン,Super Spicy Beast Marone
ベビーサタンの書,Imp Book
「此岸」の展示室,"Coastal" Exhibit Room
郵便局員ワルダー,Postman Walder
ローゼンニードル,Rosen Needle
きょくげいスキル,Litheness skill
開祖の道着セット,Founder's Outfit
ネレウスハンマー,Nereus Hammer
お正月の便利な壁,New Year Wall
ＣＭ用ドワーフ４,Dwarf For CM 4
メタルキングたち,Metal King Slime
らくらくジョウロ,E-Z Watering Can
しぐさリスト選択,Emote List
シュメリアブレス,Sumeria Bracelets
ノートの切れはし,Scrap Paper
ホーリーパウダー,Holy Powder
拳聖の道着セット,Fist Saint Outfit
ノリまゆげシール,Eyebrows Sticker
神都フォーリオン,Fourion
ファントムブーツ,Phantom Boots
討伐隊員マダラキ,Strike Force Madraki
天女のかみかざり,Celestial Maiden Ribbon
破戒のタリスマン,Sin Talisman
天使のタキシード,Angel Tuxedo
スターリーハット,Starry Hat
エドアルドの工具,Eduardo's Tools
オアシスの隊商宿,Oasis Caravan
聖守護者のおうぎ,Sentinel's Fan
トライバルヘッド,Tribal Hat
丸小紋のはかま上,Circle Hakama Top
トーテムサンダル,Totem Sandals
パハカースのメモ,Pahkas' Memo
壁かけ吊るし食材,Wall Hanging Food
じんめんじゅ・強,Vicious Treeface
レジェンズランス,Legends Lance
アヌビスのアンク,Anubis' Ankh
スタジアムリスト,Stadium Wristbands
ひつじのてぶくろ,Sheep Mitts
住宅素材屋ツイナ,Housing Materials Tuina
テレパスタイツⅡ,Telepath Tights Ⅱ
クオードキッチン,Quard Kitchen
予言者学園学生靴,FTA Shoes (M)
フェディーラの家,Fedira's House
ムーディーベッド,Moody Bed
ジア・クト念晶体,Dia Kut telecrystal
セーラスブレード,Selas Blade
経験値の古文書・,Experience Scroll
南の渡し守ハーリ,South Ferryman Hari
トコトコリゼルコ,Trotting Lieseluco
セレモニーロッド,Ceremony Rod
ジャイラプランツ,Jyra Plant
ヤバい宝石の包み,Dangerous Gem Package
ザンクローネの本,Zankrone's Book
クロックアッパー,Overclocker
クロッシュメット,Bell Hat
セクシーキャット,Sexy Cat
チョコヌーバの像,Fudgeraker Statue
たいようのおどり,Sun Dance
ゼクレスへの関所,Checkpoint to Zechres
音符のベッド・彩,Color Music Bed
バーバニジャンボ,Barbunny Jumbo
ホーローの隠れ家,Hollow's Hideout
戦神の箱＋４・改,War God's Box +4 v2
応援団のてぶくろ,Cheer Team Gloves
しぐさ書・ケーキ,Emote "Cake"
武勲の城のつづら,Valor Castle Wicker Box
クラシック風の壁,Classic Wall
凶将バリクナジャ,General Togrus Maximus
大怪傑のグローブ,Wondrous Gloves
ぐんたいガニ・強,Vicious Crabid
ニンジンリゾット,Carrot Risotto
旬の黄金本マグロ,Seas. Gold Bluefin Tuna
サイクロンダンス,Cyclone Dance
マリン調のタンス,Marine Wardrobe
転生出現率アップ,Rarefied Encounter Boost
Ｖジャンプベレー,V Jump Beret
アトラスカプセル,Atlas Toy
キューティココア,Cutie Cocoa
遺跡の守護者たち,Guardians of the Ruins
プテラノドン・強,Vicious Pteranodon
おばけトマト軍団,Haunted Tomato Army
へいしうぃりあむ,Soldier William
マーメイドチェア,Mermaid Chair
ブラックコンドル,Black Buzzard
窓つきの便利な壁,Wall with Window
預かり所カチュア,Storage Kachua
ある魔術師の悔恨,Magician's Regret
メタルなプチ香水,Metal Perfume S
バズカフェの植木,Pazu Cafe Plant
闇の領界のアーチ,Dark Realm Arch
BGMテストボス部屋,BGM boss test room
よごれたほうたい,Grubby Bandage
音符のタンス・黒,Black Music Wardrobe
クリスタルピアス,Crystal Earrings
王城の悪夢・１階,Nightmare's Castle 1F
屍鬼王ゾルドゥス,Corpse King Zoldus
時元神キュロノス,Kyuronos, Ruler of Time
ピコピコハンマー,Honking Hammer
テラシナーラの像,Bulbergine Statue
ガーベラプリズム,Gerbera Prism
レイダメテス地面,Reidametes Ground
レジェンズソード,Legends Sword
小さな陶器の破片,Small Pottery Shard
ポポリアきのこ山,Popolia Mushroom Mountain
かなしきだみあん,Sad Damien
ラズバーンの手下,Razburn's Minion
昔ながらの扇風機,Classic Electric Fan
なつきやすくなる,Happiness Boost
おむつっこりの像,Bushy Baby Statue
イースターアーチ,Easter Arch
祈星のスティック,Prayer Star Wand
バルディスタ印章,Valdista Stamps
シスター・リンネ,Sister Linne
花華メイドの下駄,Flower Maid Geta
ヘルヴェルの上司,Helvel's Superior
主神グランゼニス,Gran Zenith
レースの観客２６,Race Spectator 26
壁かけ桜の飾り棚,Cherry Blossom Shelf
水晶の壁掛け時計,Crystal Wall Clock
マジェスタブーツ,Majesta Boots
ミラクルブースト,Hurt Converter
タータンドレス上,Tartan Dress Top
グロリアスコート,Glorious Coat
ルーミリアの家前,Lumeria's House
アークデーモンＡ,Archdemon A
落陽の草原の木Ａ,Sunset Meadow Tree A
古びた糸とじの書,Old Thread-Bound Book
モーグリチケット,Moogle Ticket
ドワーフバスタブ,Dwarf Bathtub
ＣＭ用ウェディ２,Weddie For CM 2
ブレイブクッキー,Brave Cookies
魔人の勲章の破片,Ruin's Medal Shard
プチテンタコルス,Frail Abyssal Octopot
りゅうおうエッジ,True Dragonlord Edge
板張りの大きい壁,Plank Wall L
スターリーワンピ,Starry Dress
プシューケーの盾,Psyche Shield
伍の五声は呻の声,Fifth of 5 Voices Moan
イーギュアの大牙,Rapscallion's Fang
ライトバックラー,Light Shield
剥きかけりんご左,Left Peeled Apple
ウェナールピアス,Wenal Earrings
壁かけ穴モーモン,Teeny Sanguini Hole
オーグリード大陸,Ogreed
ボーンファイター,Zombie Gladiator
若手芸人のズボン,Young Talent Pants
はやてのバンダナ,Agility Bandana
クオードのコート,Quard's Coat
合唱隊のスモック,Choir Smock
まもの使いハウス,Monster Master House
クオードの剣の鞘,Quard's Scabbard
キュルル花火・黄,Yellow Kyururu Firework
ウェルカムハウス,Welcome House
ガケ沿いの集会所,Cliffside Assembly Hall
ハッピークリーム,Happy Cream
ふくめんうさぎ３,Masked Rabbit 3
七夕・雲払いの書,Festival Cloud Sweeper
水のはごろも物語,Flowing Dress Story
学園女子の夏服上,Schoolgirl Summer Top
初心者用の両手剣,Beginner's Greatsword
反乱軍メンバー１,Rebel Army Member 1
コッケン様貯金箱,Cuckoo Piggy Bank
凶拳暴鬼ダルカス,Darkas
カンダタ月へ行く,Robbin' 'Ood to the Moon
アツアツグラタン,Piping Hot Gratin
合唱隊のシューズ,Choir Shoes
星降りのグローブ,Starry Gloves
メタルモンスター,Metal Monster
オレンジのパーツ,Orange Part
しんぷあれくせい,Father Alexei
エテーネのつばさ,Ethene Wing
アルゴンズポーチ,Argon Pouch
レシピ屋ユシレピ,Recipe Shop Yusirepi
ダストンキャップ,Duston Cap
キングスパーキー,King Sparky
王宮のベッド・赤,Red Royal Bed
閃手賞トロフィー,Athlight Trophy
ウルタ皇女の工具,Princess Ulta's Tools
パンドラチェスト,Pandoradrobe
異界アスタルジア,Astalgia
アサシンブラッド,Hellbound Hunter
レースの観客１８,Race Spectator 18
サメきぐるみ・桃,Pink Shark Suit
