アルファ用アルウェ王妃の別荘跡(子供たちの隠れ家内部Test),Queen Alwe's Villa Ruins for Alpha (Test Inside Children's Hideout)
バトル班用テストマップ（いにしえのゼルメア）,Team Battle Map Test (Ancient Zelmea)
どらごんくえすとえいとしゅじんこうのいしょう,DQⅧ Hero Costume
このマップは モンスターから逃げられません。,You can't run from monsters on this map.
　　　～モンスター討伐隊隊員からの依頼～,         Monster Strike Force Request
マッチングテストステージ（同期後移動用）,Match test stage (for moving beat testing)
マッチングテストステージ（同期テスト用）,Match test stage (for sync testing)
リャナ荒涼地帯-ねじれたる異形の大地 入口,Lyana Desolate - Twisted Terrane Entry
グランゼドーラ領-グランゼドーラ王国 入口,Gran Zedora Territory - Gran Zedora Kingdom Entry
必殺チャージ時 バイキルトとピオラ2段階,Oomphle & Accelerate x2 On Special
メルサンディ穀倉帯-メルサンディ村 入口,Melsandy Millfields - Melsandy Village Entry
メルサンディ穀倉帯-こもれびの広場 入口,Melsandy Millfields - Sunbeam Square Entry
アラハギーロ地方-モンスター格闘場 入口,Al-Ahagiro Region - Monster Arena Entry
メルサンディ穀倉帯-さびれたほこら 入口,Melsandy Millfields - Deserted Shrine Entry
アラハギーロ地方-アラハギーロ王国 入口,Al-Ahagiro Region - Kingdom of Al-Ahagiro Entry
こうげき力上昇時 特技のダメージ +20<ban>,Skill Dmg. +20 When Attack ↑ (PvP×)
ぷらこんだんせいようそくたいむらさき,Purple Ceremony Gown
バトル班用テストマップ（ムスト廃墟）,Team Battle Map Test (Musuto Ruins)
季節イベント「オ月見」　コンパニオン,Seasonal Event "Moon View" Companion
季節イベント「お月見」　コンパニオン,Seasonal Event "Moon View" Companion
アラハギーロ地方-日除けのほら穴 入口,Al-Ahagiro Region - Sunshade Cave Entry
メルサンディ穀倉帯-メルン水車郷 入口,Melsandy Millfields - Melun Watermill Entry
アラハギーロ地方-ムルードの岩山 入口,Al-Ahagiro Region - Murudo Mountain Entry
ぷらこんすくーるせいふくおんなあか,Red School Uniform (F)
ルファ神殿エントランス（オープン）,Rufa Temple - Entry (Open)
ぷらこんすくーるせいふくおとここん,Blue School Uniform (M)
しかし　持ち物が　いっぱいだった！,But you're carrying too many things!
ぷらこんすくーるせいふくおんなこん,Blue School Uniform (F)
ぷらこんすくーるせいふくおんなくろ,Black School Uniform (F)
ぷらこんすくーるせいふくおとこしろ,White School Uniform (M)
ぷらこんすくーるせいふくおとこちゃ,Brown School Uniform (M)
ぷらこんすくーるせいふくおとこあか,Red School Uniform (M)
ぷらこんすくーるせいふくおんなしろ,White School Uniform (F)
神代過ぎ～　春の桜よ　無為に咲く～,Past ages divine, the spring blossoms bloom, waiting idly by...
ぷらこんだんせいようそくたいみどり,Green Ceremony Gown
受けた属性ダメージの 10%ＨＰ回復<ban>,10% Attribute Damage Taken As HP (PvP×)
ぷらこんすくーるせいふくおとこくろ,Black School Uniform (M)
ぷらこんすくーるせいふくおんなちゃ,Brown School Uniform (F)
コニウェア平原-ココラタの浜辺 入口,Coniware Plain - Cocolata Beach Entry
リャナ荒涼地帯-ソーラリア峡谷 入口,Lyana Desolate - Solaria Canyon Entry
アルファ用井戸(ダンダダ団のアジト),Well for Alpha (Robbin' 'Ood Gang HQ)
バトル班用テストマップ(ツスクル）,Team Battle Map Test (Tsuskuru)
ぷらこんだんせいしのびのふくこん,Navy Men's Ninja Suit
じょせいぷらこんふくあいすぶるー,Ice Blue Clothes (F)
足元エフェクト（おしおきアタック,Something Effect
じょせいぷらこんふくみっどないと,Midnight Clothes (F)
エフェクトイメージさん（１０個）,Mr. Effect Image (10)
ぷらこんじょせいしのびのふくこん,Navy Women's Ninja Suit
ぷらこんだんせいようそくたいちゃ,Tea Ceremony Gown
ぷらこんじょせいしのびのふくあお,Blue Women's Ninja Suit
プンスコのテーブル＆ティーセット,Punsuko's Table & Tea Set
バトル班用テストマップ（獅子門）,Team Battle Map Test (Lion Gate)
ぷらこんだんせいようそくたいはい,Ash Ceremony Gown
ぷらこんだんせいしのびのふくくろ,Black Men's Ninja Suit
ぷらこんじょせいしのびのふくあか,Red Women's Ninja Suit
あすふぇるどがくえんがくせいふく,Asfeld Academy Uniform
ぷらこんだんせいしのびのふくあお,Blue Men's Ninja Suit
ぷらこんじょせいみこふくむらさき,Purple Priestess Dress
だんせいぷらこんふくみすとぐれー,Mist Gray Clothes (M)
ぷらこんだんせいようみどりさんた,Green Men's Santa Suit
ぷらこんだんせいしのびのふくちゃ,Tea Men's Ninja Suit
ぷらこんだんせいしのびのふくあか,Red Men's Ninja Suit
ぷらこんじょせいようみどりさんた,Green Women's Santa Suit
だんせいぷらこんふくみっどないと,Midnight Clothes (M)
だんせいぷらこんふくだーくぐれー,Dark Gray Clothes (M)
ぷらこんじょせいしのびのふくもも,Pink Women's Ninja Suit
ぷらこんじょせいむらさきふりそで,Purple Women's Kimono
ぷらこんじょせいしのびのふくくろ,Black Women's Ninja Suit
ぷらこんだんせいようそくたいあお,Blue Ceremony Gown
リンジャハル海岸-リンジャの塔 前,Linjahar Coast - Linja Tower
レビュール街道北-海風の洞くつ 前,Reviewle Highway North - Seabreeze Cave
マデ島＆エテーネ王宮（4.5CS専用）,Made Isle & Ethene Royal Manor (4.5CS only)
セレドット山道-ベリルのほら穴 前,Celedot Mountain Pass - Beryl Den
必殺チャージ時 チャージ時間 -10秒,Charge Time -10 sec. On Special
リンジャハル海岸-教会シスター 前,Linjahar Coast - Church Sister
追憶の世界-アルウェ王妃の別荘跡,World of Remembrance-The Ruins of Queen Alwe
プログラマー用負荷検証ステージ4,Loading Programmer Verification Stage 4
死亡時 50%でこうげき力上昇が残る,Undying Attack Boost 50%
プログラマー用負荷検証ステージ1,Loading Programmer Verification Stage 1
プログラマー用負荷検証ステージ2,Loading Programmer Verification Stage 2
プログラマー用負荷検証ステージ3,Loading Programmer Verification Stage 3
プログラマー用負荷検証ステージ5,Loading Programmer Verification Stage 5
ハロウィンクイズ解答ウェディ４,Halloween Quiz Answer Weddie 4
ハロウィンクイズ解答ウェディ３,Halloween Quiz Answer Weddie 3
ぷらこんこどもようみずぎせっと,Children's Swimsuit
ハロウィンクイズ解答ウェディ６,Halloween Quiz Answer Weddie 6
ぷらこんだんせいようしろさんた,White Men's Santa Suit
ぷらこんだんせいはかまむらさき,Purple Men's Hakama
ぷらこんだんせいようあおあろは,Blue Men's Aloha
壊れたアストルティアのコンパス,Broken Astoltia Compass
ぷらこんだんせいようくろさんた,Black Men's Santa Suit
ぼうえいぐんのせいふくはいいろ,Gray Defense Force Suit
ぷらこんじょせいようあかさんた,Red Women's Santa Suit
ぷらこんじょせいようしろさんた,White Women's Santa Suit
ぷらこんだんせいようあかさんた,Red Men's Santa Suit
ハロウィンクイズ解答ウェディ５,Halloween Quiz Answer Weddie 5
扉は　かたく　閉ざされている。,The door is tightly closed.
30%の確率で受けたダメージ10%反射,30% Chance to Reflect 10% Damage
ハロウィンクイズ解答ウェディ２,Halloween Quiz Answer Weddie 2
\s\m\eは　コインをなげた。　→　,\s\m\e flips a coin. → The coin lands on !
ぷらこんじょせいみこふくみどり,Green Priestess Dress
ぷらこんじょせいようあかあろは,Red Women's Aloha
えるどなしんのしょうぞくせっと,Eldona's Outfit
ぷらこんだんせいようももあろは,Pink Men's Aloha
はなかりゅうどのころもむらさき,Purple Flower Hunter Outfit
ハロウィンクイズ解答ウェディ７,Halloween Quiz Answer Weddie 7
魔天の勇者＆聖夜の破壊者・雪組,Festive Hero & Holy Night Wrecker Snow Team
\s\m\eは　カードを引いた。　→　,\s\m\e draws a card. → They draw the !
ぷらこんじょせいようくろさんた,Black Women's Santa Suit
\s\m\eは　ダイスをふった。　→　,\s\m\e rolls a die. → !
じょせいぷらこんふくさんせっと,Sunset Clothes (F)
ぷらこんじょせいようあおあろは,Blue Women's Aloha
ぷらこんじょせいようしろあろは,White Women's Aloha
ぷらこんだんせいようしろあろは,White Men's Aloha
豪魔将ベリンダ＆豪魔将ブレンダ,Generals Belinda & Brenda
ぷらこんじょせいようももさんた,Pink Women's Santa Suit
ぷらこんだんせいようももさんた,Pink Men's Santa Suit
魔天の勇者＆聖夜の破壊者・闇組,Festive Hero & Holy Night Wrecker Dark Team
ゴリウスの怨霊＆魔道士キルギル,Gorius' Vengeance & Wizard Kirgyl
ハロウィンクイズ解答ウェディ１,Halloween Quiz Answer Weddie 1
ぷらこんじょせいようももあろは,Pink Women's Aloha
ぼうえいぐんのせいふくむらさき,Purple Defense Force Suit
コニウェア平原-教会シスター 前,Coniware Plain - Church Sister
モンセロ温泉峡-中央のやぐら 前,Moncello Spring Gorge - Central Scaffold
両手剣の単体特技のダメージ +500,Single Target Greatsword Skills +500
セレドット山道-セレドの町 入口,Celedot Mountain Pass - Town of Celed Entry
リャナ荒涼地帯-くずれた灯台 前,Lyana Desolate - Collapsed Lighthouse
リャナ荒涼地帯-滝を臨む集落 前,Lyana Desolate - Waterfall Village
レビュール街道南-三門の関所 前,Reviewle Highway South - Three Way Gate
デフェル荒野-不思議の魔塔 入口,Defel Desert - Mysterious Tower Entry
ドラクロン山地-竜守りの小屋 前,Draklon Mountains - Dragon Guard's Hut
ジャイラ密林-クドゥスの泉 入口,Jyra Jungle - Kudus Spring Entry
ムニエカの深層・隠し通路 入口,Munieka Depths - Secret Passage Entry
戦いで 魔物に狙われにくくなる,Less likely to be targeted in battle
会心と暴走時のダメージ +100<ban>,Critical/Haywire Damage +100 (PvP×)
アルファ用追憶の世界 別荘跡編,World of Recollection for Alpha Villa Ruins
テンション時のダメージ +100<ban>,Damage During Tension +100 (PvP×)
こうげき魔力とかいふく魔力 +10,Magical Might/Mending +10
ぷらこんじょせいももふりそで,Pink Women's Kimono
はなかりうどのころもむらさき,Purple Flower Hunter Outfit
チームゆく年くる年　２０２４,Team Twenty Twenty Four
ハロウィンクイズ解答エルフ２,Halloween Quiz Answer Elf 2
行動時 7%でバイシオンとピオラ,Oomph & Accelerate On Action 7%
ぷらこんじょせいくろふりそで,Black Women's Kimono
はるかぜおうえんだんいしょう,Spring Cheer Team Outfit
ぷらこんおとこぱんぷきんふく,Men's Pumpkin Clothes
チームゆく年くる年　２０２０,Team New Year 2020
チームゆく年くる年　２０２２,Team New Year 2022
ぷらこんおんなどらきゅらふく,Women's Dracula Costume
チームゆく年くる年　２０１９,Team New Year 2019
闇に唄う氷にまぎれし聖なる者,Frozen Sacred Singer
ぷらこんじょせいしろふりそで,White Women's Kimono
ラダ・ガートたちに連絡を取る,Contact Lada Gart's Group
だんせいしらなみがらのゆかた,White Wave Yukata (M)
攻撃時10%で会心と暴走率アップ,Critical/Haywire Boost Attack 10%
ハロウィンクイズ解答エルフ３,Halloween Quiz Answer Elf 3
じょせいしらなみがらのゆかた,White Wave Yukata (F)
どるわーむけんきゅういんふく,Dolworm Research Suit
ぷらこんじょせいみこふくもも,Pink Priestess Dress
ぷらこんおとこどらきゅらふく,Men's Dracula Costume
フォークに刺さったパンケーキ,Pancakes Stuck in a Fork
ハロウィンクイズ解答エルフ４,Halloween Quiz Answer Elf 4
ぷらこんじょせいあかふりそで,Red Women's Kimono
巨人コアを守るジア・クトたち,Defenders of the Core
チームゆく年くる年　２０２３,Team New Year 2023
ハロウィンクイズ解答エルフ１,Halloween Quiz Answer Elf 1
じょせいぷらこんふくむらさき,Purple Clothes (F)
ぷらこんしゃわーよういしょう,Shower Outfit
ぷらこんきゅーぴっどむらさき,Purple Cupid
ハロウィンクイズ解答エルフ７,Halloween Quiz Answer Elf 7
チームゆく年くる年　２０２５,Team Twenty Twenty Five
行動時 5%でバイシオンとスカラ,Oomph & Buff On Action 5%
チームゆく年くる年　２０２６,Team Twenty Twenty Six
ぷらこんだんせいようきあろは,Yellow Men's Aloha
ぷらこんじょせいみこふくあか,Red Priestess Dress
ヴァレリアの仮面（割れる前）,Valeria's Unbroken Mask
ＤＱⅧしゅじんこうのいしょう,DQⅧ Hero Costume
魔人エンラージャ＆ムッチーノ,Enraja the Genie & Muccino
ぷらこんじょせいみこふくあお,Blue Priestess Dress
あすふぇるどがくえんふゆふく,Asfeld Academy Winter Wear
集合ギミック / 全体エフェクト,Some gimmick or effect idk
嵐魔ウェンリルとアクラガレナ,Wenrir the Storm & Akragarena
ぷらこんだんせいようあかろは,Red Men's Aloha
あすふぇるどがくえんなつふく,Asfeld Academy Summer Wear
ぷらこんすいーとふくだいだい,Orange Sweet Clothes
ぷらこんじょせいようきあろは,Yellow Women's Aloha
魔天の勇者＆キラークリスマス,Festive Hero & Christmas Killing Machine
チームゆく年くる年　２０１８,Team New Year 2018
行動時 5%でバイシオンとピオラ,Oomph & Accelerate On Action 5%
わかむしゃのかっちゅうせっと,Young Warrior Armor Set
ぷらこんおんなぱんぷきんふく,Women's Pumpkin Clothes
ぼうえいぐんのせいふくみどり,Green Defense Force Suit
ハロウィンクイズ解答エルフ５,Halloween Quiz Answer Elf 5
はなかりゅうどのころもみどり,Green Flower Hunter Outfit
チームゆく年くる年　２０２１,Team New Year 2021
ハロウィンクイズ解答エルフ６,Halloween Quiz Answer Elf 6
チームゆく年くる年　２０１７,Team New Year 2017
ロヴォス高地-教会シスター 前,Rovos Highlands - Church Sister
モンセロ温泉峡-南のやぐら 前,Moncello Spring Gorge - South Scaffold
デフェル荒野-教会シスター 前,Defel Desert - Church Sister
モンセロ温泉峡-ご神体の間 前,Moncello Spring Gorge - Hall of Worship
ジャイラ密林-大樹の根元 入口,Jyra Jungle - Big Tree Root Entry
モンセロ温泉峡-管理人小屋 前,Moncello Spring Gorge - Caretaker's Hut
グランゼドーラ領-見張り塔 前,Gran Zedora Territory - Watchtower Front
銃撃時2%でターンを消費しない,Free Turn When Shooting 2%
毒時にタナトスのダメージ +150,Vicitimiser to Poisoned Foes +150
モンセロ温泉峡-北のやぐら 前,Moncello Spring Gorge - North Scaffold
コニウェア平原-三門の関所 前,Coniware Plain - Three Way Gate
デフェル荒野-ピラミッド 入口,Defel Desert - Pyramid Entry
リンジャハル海岸-高台の遺跡,Linjahar Coast - Hilltop Ruins
セレドット山道-滝見の吊り橋,Celedot Mountain Pass - Fallsview Bridge
攻撃時 5%でチャージ時間 -10秒,Charge Time -10 sec. Attack 5%
追憶の世界-キラキラ大風車塔,World Of Remembrance-Windmill Tower
炎・土・闇属性のダメージ +5%,Fire & Earth & Dark Damage +5%
行動時 5%でチャージ時間 -10秒,Charge Time -10 sec. On Action 5%
砂の都ファラザードへの出口,Exit to Farazard
ぷらこんおしゃれみずぎもも,Pink Snazzy Swimsuit
イルーシャのスケッチブック,Illusia's Sketchbook
フラワーガーデン地区への道,Road to Flower Garden District
ぷらこんぱてぃしえふくしろ,White Pastry Chef Suit
ぷらこんおしゃれみずぎしろ,White Snazzy Swimsuit
未完のモンセロ温泉峡への道,Road to Undone Moncello Spring Gorge
女性プラコン服ミッドナイト,Midnight Clothes (F)
未来への扉とまどろみの少女,The Door to the Future & the Slumbering Girl
男性プラコン服ダークグレー,Dark Gray Clothes (M)
ぷらこんいけてるみずぎあお,Blue Cool Swimsuit
じょせいぷらこんふくぴんく,Pink Clothes (F)
行動時 5%でテンションアップ,Tension On Action 5%
ハロウィンクイズ解答ドワ７,Halloween Quiz Answer Dwarf 7
ぷらこんえんじぇるふくくろ,Black Angel Clothes
ハロウィンクイズ解答ヒト５,Halloween Quiz Answer Human 5
ハロウィンクイズ解答オガ４,Halloween Quiz Answer Ogre 4
ドルボ用マネキンプクリポ用,For Pukulipo Mannequin For Dolboard
女性プラコン服アイスブルー,Ice Blue Clothes (F)
はなかりゅうどのころもあか,Red Flower Hunter Outfit
じょせいぷらこんふくえんじ,Red Clothes (F)
ドルボ用マネキンドワーフ用,For Dwarf Mannequin For Dolboard
ぷらこんえんじぇるふくあか,Red Angel Clothes
ハロウィンクイズ解答ヒト３,Halloween Quiz Answer Human 3
ハロウィンクイズ解答プク７,Halloween Quiz Answer Puku 7
『ついてクンをひっこめる』,"Remove Pet"
ぷらこんぱてぃしえふくもも,Pink Pastry Chef Suit
キュロンイーターの巣への道,Path to Kyuroneater's Nest
ぷらこんえんじぇるふくもも,Pink Angel Clothes
よわいこころ＆ずるいこころ,The Weak and Cunning Hearts
１００万ゴールドの入った袋,1 Million Gold Bag
ハロウィンクイズ解答ヒト１,Halloween Quiz Answer Human 1
ハロウィンクイズ解答オガ７,Halloween Quiz Answer Ogre 7
ぷらこんおしゃれみずぎくろ,Black Snazzy Swimsuit
ぷらこんだんせいはかまあお,Blue Men's Hakama
ハロウィンクイズ解答オガ６,Halloween Quiz Answer Ogre 6
ぼうえいぐんのせいふくこん,Blue Defense Force Suit
『おうちでついてクン設定』,"House Pet Settings"
ハロウィンクイズ解答プク５,Halloween Quiz Answer Puku 5
ハロウィンクイズ解答オガ２,Halloween Quiz Answer Ogre 2
だるめしあんぼーいいしょう,Dalmatian Outfit (M)
ルクスガルン大空洞への亀裂,Crevice to Luxgarn Caverns
ぷらこんいけてるみずぎくろ,Black Cool Swimsuit
ドルボ用マネキンニンゲン用,For Human Mannequin For Dolboard
ランドン山脈山頂付近への道,Road to Landon Summit Area
ハロウィンクイズ解答ヒト７,Halloween Quiz Answer Human 7
男性プラコン服ミストグレー,Mist Gray Clothes (M)
アスフェルド学園男性用水着,Asfeld Swimwear (M)
ぼうえいぐんのせいふくきん,Gold Defense Force Suit
ハロウィンクイズ解答ヒト４,Halloween Quiz Answer Human 4
スターキメラから取った羽根,Cosmic Chimaera Feather
ハロウィンクイズ解答オガ１,Halloween Quiz Answer Ogre 1
3.0%でターンを消費しない<ban>,Free Turn 3% (PvP×)
ハロウィンクイズ解答ドワ３,Halloween Quiz Answer Dwarf 3
だんせいぷらこんふくえんじ,Red Clothes (M)
からすかぐらのしょうぞくⅠ,Crow Dance Costume Ⅰ
ハロウィンクイズ解答プク２,Halloween Quiz Answer Puku 2
はなかりゅうどのころもあお,Blue Flower Hunter Outfit
未完のドラクロン山地への道,Road to Undone Draklon Mountains
ぷらこんいけてるみずぎもも,Pink Cool Swimsuit
ドラゴンクエストＸショップ,Dragon Quest X Shop
ハロウィンクイズ解答ヒト２,Halloween Quiz Answer Human 2
ハロウィンクイズ解答ドワ２,Halloween Quiz Answer Dwarf 2
はなかりうどのころもみどり,Green Flower Hunter Outfit
だんせいぷらこんふくぴんく,Pink Clothes (M)
必殺チャージ時 身かわし +10%,Dodge +10% On Special Charge
ハロウィンクイズ解答ドワ５,Halloween Quiz Answer Dwarf 5
ぼうえいぐんのせいふくあか,Red Defense Force Suit
2.0%でターンを消費しない<ban>,Free Turn 2% (PvP×)
からすかぐらのしょうぞくⅡ,Crow Dance Costume Ⅱ
ハロウィンクイズ解答ドワ６,Halloween Quiz Answer Dwarf 6
未開のジャングル地区への道,Road to Savage Jungle
とうばつたいこうほうきょく,Strike Force Bureau
ぷらこんいけてるみずぎあか,Red Cool Swimsuit
魔物商人＆商品ナンバー１３,Monster Merchant & Item Number 13
ハロウィンクイズ解答ヒト６,Halloween Quiz Answer Human 6
デスディオ暗黒荒原への出口,Exit to Deathdio Darklands
ぷらこんだんせいはかまこん,Navy Blue Men's Hakama
壊れたハイハイジャンプさん,Broken Mr. High High Jump
イア・タア　シンパッ・ケウ,E-yis, aneu dish cubrey
ゆうべはおたのしみでしたね,Rooming with a Gamer Gal
アスフェルド学園男性用夏服,Asfeld Summer Uniform (M)
ハロウィンクイズ解答プク３,Halloween Quiz Answer Puku 3
ぷらこんいけてるみずぎしろ,White Cool Swimsuit
ぷらこんえんじぇるふくしろ,White Angel Clothes
ハロウィンクイズ解答オガ３,Halloween Quiz Answer Ogre 3
古グランゼドーラ領への出口,Exit to Old Gran Zedora Territory
ハロウィンクイズ解答オガ５,Halloween Quiz Answer Ogre 5
らんぷれんきんれんしゅうぎ,Lamp Alchemy Training Wear
ハロウィンクイズ解答プク１,Halloween Quiz Answer Puku 1
アルムゴーグ＆ロムドゴーグ,Armogog & Romdogog
男性プラコン服ミッドナイト,Midnight Clothes (M)
ハロウィンクイズ解答プク６,Halloween Quiz Answer Puku 6
アスフェルド学園女性用夏服,Asfeld Summer Uniform (F)
ぷらこんおしゃれみずぎあお,Blue Snazzy Swimsuit
ムストの町・教会跡への出口,Exit to Morst - Church Ruins
ぷらこんだんせいはかまくろ,Black Men's Hakama
ぷらこんおしゃれみずぎあか,Red Snazzy Swimsuit
ぷらこんぱてぃしえふくあお,Blue Pastry Chef Suit
だるめしあんがーるいしょう,Dalmatian Outfit (F)
ムストの町・風車へのはしご,Morst - Ladder to the Windmill
ドルボ用マネキンウェディ用,For Weddie Mannequin For Dolboard
ハロウィンクイズ解答ドワ４,Halloween Quiz Answer Dwarf 4
行動時 3%でテンションアップ,Tension On Action 3%
ハロウィンクイズ解答ドワ１,Halloween Quiz Answer Dwarf 1
ハディン地下洞くつへの出口,Exit to Hadine Cavern
ぷらこんえんじぇるふくあお,Blue Angel Clothes
ハロウィンクイズ解答プク４,Halloween Quiz Answer Puku 4
古レビュール街道北への出口,Exit to Old Reviewle Highway North
アスフェルド学園女性用水着,Asfeld Swimwear (F)
戦闘中常時マホトラのころも,Magic Cloak Always Active
ぷらこんだんせいはかましろ,White Men's Hakama
ぷらこんぱてぃしえふくあか,Red Pastry Chef Suit
清き風吹き　草木は芽吹く～,Pure winds blown and trees grown, budding green as the breeze is thrown
ロヴォス高地-ゼドラ洞 入口,Rovos Highlands - Zedra Cave Entry
炎属性の呪文のダメージ +100,Fire Spell Damage +100
ワルド水源-湖上の休息所 前,Wald Headwaters - Lake Retreat
チャンス特技発生率 +1.0%<ban>,Chance Trigger Rate +1% (PvP×)
5000年の旅路 遥かなる故郷へ,5000 Year Journey to a Faraway Hometown
氷耐性低下時のダメージ +100,Ice Vulnerability Damage +100
眠り時に呪文のダメージ +50%,Spell Damage to Asleep Foes +50%
受けるダメージを10軽減する,Damage Taken -10
テンション時のダメージ +300,Damage During Tension +300
プログラマー検証ステージ6,Programmer Verification Stage 6
土属性の呪文のダメージ +5%,Earth Spell Damage +5%
デス・ジャンクション 出口,Death's Juncture Exit
カルデア山道のアジト 入口,Chaldea Mountain Road Hideout Entry
開戦時 10%でヘヴィチャージ,Starting Heavy Charge 10%
とこしえの神殿楯の間 入口,Temple of Eternity Shield Room Entry
アストルティア博物館 入口,Astoltia Museum Entry
ドルマ系呪文のダメージ +5%,Zam Spell Damage +5%
オルセコ闘技城・舞台 出口,Orseco Combastle - Stage Exit
カルデア山道のアジト 出口,Chaldea Mountain Road Hideout Exit
リンジャハル海岸-海岸遺跡,Linjahar Coast - Coast Ruins
湖の小島・神のまなこ 出口,Lake Islet - The All-seeing Eye Exit
プログラマー検証ステージ3,Programmer Verification Stage 3
デス・ジャンクション 入口,Death's Juncture Entry
プログラマー検証ステージ1,Programmer Verification Stage 1
味方死亡時 20%でバイシオン,Oomph If Ally Dies 20%
プログラマー検証ステージ5,Programmer Verification Stage 5
瀕死時 20%こうげき力 +60<ban>,Near-Death Attack +60 20% (PvP×)
バルメシュケの研究所 入口,Balmeschke's Laboratory Entry
からすかぐらのしょうぞく1,Crow Dance Costume Ⅰ
湖の小島・神のまなこ 入口,Lake Islet - The All-seeing Eye Entry
アストルティア博物館 出口,Astoltia Museum Exit
からすかぐらのしょうぞく2,Crow Dance Costume Ⅱ
