勇者姫アンルシア,Hero Anlucia
キィンベルの服下,Kimbel Pants
金剛不壊の武装術,Unbreakable Varja
ヒヨコパーカー上,Chick Hoodie
しびれくらげ２２,Man o' War 22
奇門遁甲の式・壱,1st Divination Ceremony
魔天海フォルネー,Sky Ocean Folnay
姫君のブーメラン,Princess' Boomerang
ぷるぷるスラピー,Wobbling Slurpy
ファラオ・ヘッド,Pharaoh Head
パレードウェア上,Mardi Garb Top
マーチングズボン,Marching Trousers
シスター・ミペカ,Sister Mipeka
ドット毒沼柄ラグ,Poisonous Swamp Rug
コルセアマント下,Corsair Pants
エックス君の像３,Mr. X Statue 3
英知を積み重ねて,Accumulating Wisdom
オパールのダンロ,Opal Fireplace
ひかりのグローブ,Shimmering Gloves
道具屋ズィディリ,Item Shop Zidiri
ガブリエルのやり,Gabriel's Spear
ダイヤココナッツ,Diamond Coconut
ソーシャルレンズ,Social Lens
レギオングリーブ,Legion Greaves
ジア燃石生産場２,Diatite Production Plant 2
昔ながらの扇風機,Classic Electric Fan
試練のケモノたち,Trial Beasts
じゅうたんソファ,Carpet Sofa
ヘルジュラシック,Dragster
おおくちばし・強,Vicious Beakon
ファータドレス上,Fata Dress Top
カエルパーカー下,Frog Shorts
うごめくモノたち,Wiggling Things
ニーベルのゆびわ,Nibel's Ring
たいやきプリズム,Taiyaki Prism
天使の翼プリズム,Angel Wings Prism
みのしまったタイ,Snappy Snapper
排他検証ステージ,Exclusive Survey Stage
ＶＪの飛び出すＶ,V Pops Out!
アウルスティック,Aur Wand
ギュッとウリボー,Wild Boar Arm Doll
氷結らんげき・改,Crushed Ice+
ジャイラジャイラ,Jyra Jyra
ギュッとヒューザ,Hyuza Arm Doll
ミミックの像・庭,Mimic Statue (G)
タータンパンプス,Tartan Heels
グレンドラゴニア,Glendragonia
シンプルキャップ,Simple Cap
グローリーココア,Glory Cocoa
ギュッとアスバル,Asbal Arm Doll
リンベリィのくつ,Linberry's Shoes
大魔王城の便せん,Demon Lord Castle Paper
栄光のトロフィー,Glory Trophy
サンセットの花束,Sunset Bouquet
防具屋アーニャー,Armor Shop Annya
ライダース衣装券,Rider Outfit Voucher
花華メイドの下駄,Flower Maid Geta
しぐさ書・拾遺譚,Emote "Collected Tales"
身代わりのコイン,Substitution Coin
白木のテーブル大,Plain Table L
とこなつバングル,Summer Bangles
しぐさ書・ガード,Emote "Guard"
第８回ラウルの像,8th Rahul Statue
神光放つ短剣の書,Holy Light Dagger Book
しぐさ書・ハート,Emote "Draw a Heart"
ホワイトジャッジ,White Clubber
レグナード変異体,Variant Regnad
超常現象研究会室,Paranormal Research Room
東洋風飾り棚・雅,Chic Orient Shelf
ラズバーンの怨霊,Razburn's Ghost
配達員パッテーラ,Deliverer Patella
フォースセレクト,Fource Selection
魚交換員ビコメチ,Fish Exchange Bikomechi
クリスマスの絵本,Christmas Picture Book
壁かけ羽子板飾り,Hagoita Wall Decor
盆踊りフウラ・庭,Festival Dance Fuura(G)
ある船乗りの手記,Sailor's Memoir
便せん屋ヤマブキ,Stationery Shop Yamabuki
冥獣王ネルゲル強,Apex Netherfiend Nergel
ウェディ風アーチ,Weddie-Style Arch
サジェぬいぐるみ,Sajay Plushie
ショコラなぼうし,Chocolate Hat
オーグリード大陸,Ogreed
桜モダングローブ,Cherry Modern Gloves
討伐隊員マダラキ,Strike Force Madraki
あくむにゅうどう,Nightmare Nomad
ワイルドバングル,Wild Bangles
パンプキッズ・強,Vicious Pumpkid
魚交換員パッピイ,Fish Exchange Pappi
カーニバルマスク,Carnival Mask
エステラのポスト,Estella Mailbox
春風チアーズ衣装,Spring Cheer Outfit
てくてくスライム,Slime Knight
シャイニーメロン,Shiny Melon
ラーの鏡くりぬき,Hollow Mirror of Ra
ダンサーシューズ,Dance Shoes
清涼スイムワンピ,Cool Swim Dress
ソードフライヤー,Goregoyle
おどろきとまどう,Shock and Confusion
ラッキーチケット,Lucky Ticket
メタルモンスター,Metal Monster
めんこ屋チャガン,Pogs Shop Chagan
烈鎚マグナゲイト,Fierce Hammer Magnagate
魔獣ネロスゴーグ,Demon Beast Nerosugog
やさしさのクスリ,Kindness Medicine
渡し守ヌーティフ,Ferryman Nutif
限定交換屋ポタン,Limited Exchange Shop Potan
ぼくめつしんかん,Partislam
おっかけパンサー,Chasing Panther
アルウェーンの町,Alweyn Township
銀の鍛冶ハンマー,Silver Hammer
まじゅうのうぶ毛,Magic Beast Fur
ダーマ神殿の看板,Alltrades Abbey Sign
ドラキーＴシャツ,Dracky T-Shirt
アワードキャップ,Award Cap
預かり所ガリュア,Storage Garua
アマリリスの笑顔,Amaryllis' Smile
どうぐやまろっく,Item Shop Maroc
エキサイトアクス,Excite Axe
アビスキャンディ,Abyss Lollipop
レース屋プクヨミ,Race Registrar Pukuyomi
魔創兵長バスラー,Evil Captain Bassler
タータンシューズ,Tartan Shoes
カボチャのガゼボ,Pumpkin Gazebo
心をつなぐ初仕事,First Job, Connect Minds
全職みのまもり+20,Resilience +20
しぐさ書・ギター,Emote Book "Guitar"
ヴァイパーブーツ,Viper Boots
星空のタンス・青,Blue Starry Wardrobe
シンイのこころ５,Shini's Heart Lv5
そのために生きた,I Lived for That
壁かけ穴ミイラ男,Mummy Boy Hole
プク姫様つきの畑,Puku Princess Field
光の木工刀小の本,Light Slick S Book
ぬいぐるみ屋ウー,Plushie Shop Woo
蘇りし大祭壇の間,Restored Grand Altar
王城の悪夢・３階,Nightmare's Castle 3F
クリスタルピアス,Crystal Earrings
３段ブロック・赤,Red 3-Step Block
王宮のベッド・青,Blue Royal Bed
１０周年記念会場,10th Anniversary Venue
たゆたう瑞雲の詩,Poem of Floating Clouds
超酸性の間　入口,Super Acidity Entry
クローバーのカギ,Clover Key
オーガテーブル大,Ogre Table L
かなしきだみあん,Sad Damien
あざやかな笹飾り,Vivid Bamboo Decor
スライムあんぱん,Slime Anpan
スチームショット,Steam Bow
海魔の眼甲の破片,Nacreous Necromonocle Shard
あくまの錬金ツボ,Demon Pot
しっこくのブーツ,Macabre Boots
ながれ星の贈り物,Shooting Star's Gift
森の井戸の地下洞,Underground Forest Well
経験値の古文書・,Experience Scroll
ひまわりプリズム,Sunflower Prism
魔天剛アロゲイル,Arogeil, Strength of Evil
ブラッドスピアー,Barbarous Pole
射手の服のレシピ,Archer Outfit Recipe
コッケンの乗る棒,Kokken's Riding Crop
わかがしらひのき,Young Hinoki
ワイルドクッキー,Wild Cookies
ダーマ神殿のラグ,Alltrades Abbey Rug
執行獣ニニエルザ,Beastly Ninieruza
風車の丘への出口,Exit to Windmill Way
光の郷フィネトカ,Finetka
ルファ神殿・入口,Rufa Temple - Entry
ツーショット写真,Two-Shot Photo
レースの観客２５,Race Spectator 25
リルチェラソファ,Lilcherat Sofa
便せん屋タマズサ,Stationery Shop Tamazusa
メタキンチケット,Metal King Ticket
反乱軍メンバー２,Rebel Army Member 2
グレイトドラゴン,Great Dragon
時の妖精カプセル,Time Fairy Toy
ジャンボキャベツ,Jumbo Cabbage
郵便局員ジヌデル,Postman Shinderu
預かり所コライユ,Storage Koraiu
フレンジーの部屋,Frenzy's Room
風変わりな研究書,Eccentric Research
ひっさつのおうぎ,Critical Fan
Ⅲ‐スペーディオ,Ⅲ‐Wulfspade
スチームシールド,Steam Shield
エルフたちの集落,Elven Settlement
だいだいカメリア,Sour Orange Camellia
魔壊将のウィング,Wreck General's Wings
フォーリンスター,Fallen Star
スイーツトロル強,Apex Sweet Troll
逆乱の竜ナダイア,Nadaia, Dragon of Rebellion
バトルシェイカー,Maracaraider
ドラムセット・庭,Drum Set (G)
セラフィトランプ,Seraphi Cards
クイーンモーモン,Queenie Sanguini
紋入りのレンガ壁,Crested Brick Wall
シャンテキッチン,Shante Kitchen
虚空の神ナドラガ,Nadraga, God of the Void
アルビノホシエイ,Albino Stingray
なかまモンスター,fellow monster
ヤマネコグローブ,Wildcat Gloves
しびれくらげ０７,Man o' War 07
シスター・ルスパ,Sister Luspa
テンションバーン,Feel the Burn
ふしぎなドロドロ,Odd Clod
ラズバーンの手下,Razburn's Minion
古き踊り子の伝説,Old Dancer's Legend
タキシードうさぎ,Tuxedo Rabbit
トキワアカネの花,Red Ibis Flowers
ハイキングベレー,Hiking Beret
真夜中プリズラン,Midnight Jailrun
レースの観客０５,Race Spectator 05
ダッフルグローブ,Duffel Gloves
ローズプリンセス,Rose Princess
ボーンのこんぼう,Zombie Gladiator Club
パピヨンウィング,Papillon Wings
郵便局員マルセン,Postman Marsen
オルフェアの奇跡,The Miracle of Orphea
追想の王城・１階,Memory's Castle 1F
キュルル花火・赤,Red Kyururu Firework
しっこくのつばさ,Black Wings
妖魔ジュリアンテ,Mystical Juliante
さとりのグローブ,Gloves of Clarity
白鳥の弓の作り方,How to Make a Swan Bow
マイタウンメダル,My Town Medal
ヴェリナード領北,Verinard North
ふわふわ雲のラグ,Fluffy Cloud Rug
シンイのこころ３,Shini's Heart Lv3
さまようたましい,Lost Soul
シスター・リーリ,Sister Leely
旅芸人ピュージュ,Minstrel Pyuju
幸せの花を探して,Look for Lucky Flowers
しびれくらげ１２,Man o' War 12
エレガントココア,Elegant Cocoa
大地の箱舟　１幕,Ark of the Earth Act 1
ユニコーンのツノ,Unicorn Horn
レーザーユニット,Laser Unit
ねこまどう便せん,Meowgician Paper
スライムくんたち,Slime monsters
お宝の写真ケース,Treasure Photo Case
魔の試練・第３層,Demon Trials - L3
スカウトアタック,Scout Strike
オーブなプチ香水,Orb Perfume S
紫竜の煌玉の破片,Dragonic Orb Shard
マーメイドランプ,Mermaid Lamp
郵便局員モルーゼ,Postman Morusei
野いちごサンダル,Wild Strawberry Sandals
オーシャングラス,Ocean Glasses
尖塔の守護鬼たち,Keeper of the Spire
サンダーフロッグ,Zaptile
ミイラ男の衣装３,Mummy Boy Costume 3
かんだたそうすい,Robbin' 'Ood Chief
超鍛冶ハンマー小,Super Hammer S
よろず屋ヤップイ,General Shop Yapui
妖炎魔女の髪飾り,Fire Witch Hairpin
フェリナ姫の部屋,Princess Felina's Room
アロケルのおうぎ,Allocer Fan
魔物管理人メリュ,Monster Manager Meryu
大型の和風水そう,Japanese Aquarium L
討伐隊員リャード,Strike Force Ryard
多勢賞トロフィー,Great Numbers Trophy
クラシック風の壁,Classic Wall
レオーネフェイク,Leone Fake
プクリポバスタブ,Pukulipo Bathtub
演奏ヴァイオリン,Play Violin
竜王のツメの伝説,Dragonlord Claws Legend
カルサドラ溶岩洞,Calsadora Pyroduct
丸型のトピアリー,Round Topiary
海冥主メイヴの像,Meiv Statue
ピンクラインの柱,Pink Line Pillar
星降りのローブ下,Starry Robe Bottom
武勲の城の黒障子,Valor Castle Dark Shoji
おもちゃの木・雪,Toy Trees (Snow)
ショーナへの手紙,Letter to Shauna
ウェディバスタブ,Weddie Bathtub
ブリキ板張りの壁,Tin Plate Wall
郵便局員グウェン,Postman Gwen
ルティショー像茶,Tea Astolti Short St.
フォルムチェンジ,form change
機神の眼甲の破片,Mechanical Eye Shard
奇門遁甲の式・弐,2nd Divination Ceremony
フルムーンチェア,Full Moon Chair
栄光のローブ・金,Gold Glory Robe
サンダーシャウト,Hellbound Hair-Raiser
ふわふわ雲の本棚,Fluffy Cloud Bookshelf
メタスラＴシャツ,Metal Slime T-Shirt
グロリアスコート,Glorious Coat
シスター・イオリ,Sister Iori
カミハルムイの柵,Kamiharmui Fence
壁かけ管理棟の窓,Admin Building Window
ダストンパラソル,Duston Umbrella
丁目古代都市地区,Block Ancient Suburb
光の神殿の便せん,Temple of Light Paper
大きなお菓子の壁,Big Sweets Wall
お正月の便利な壁,New Year Wall
初心者用の両手剣,Beginner's Greatsword
極天女帝のぼうし,Sky Empress Hat
みかわしオムレツ,Evasion Omelet
隠れスライムの像,Hidden Slime
ティプローネ光花,Tiplone Light Flower
超高性能スコップ,Ultra High Power Shovel
ベルトロトランプ,Bertro Cards
学園女子の夏服下,Schoolgirl Summer Skirt
聖賢者のバングル,Holy Sage Bangles
アサシン・ニヒル,Nihilassin
くすしのローブ下,Apothecary Lower Robe
クオードの剣の鞘,Quard's Scabbard
討伐隊員エリオス,Strike Force Elios
ジュアロとゾデラ,Juaro and Zodera
パニガルム探査券,Panigalm Explore Ticket
手袋にかけた想い,Thoughts On Gloves
デーモンフォーク,Archdemon Fork
デフェル荒野の石,Defel Desert Stone
クリスマスのソリ,Christmas Sleigh
ジャンボドラキー,Jumbo Dracky
魂を刈り取る天使,Angel Who Reaps Souls
破戒王ベルムド影,Sin King Bermud Shadow
スライムの石の壁,Slime Stone Wall
花模様の光るラグ,Floral Glowing Rug
魔物管理人ニトト,Monster Manager Nitoto
自由人のつるはし,Freedom Pickaxe
おおきなリボン赤,Red Ribbon L
プチアーノン・強,Vicious Khalamari Kid
せいどうのつるぎ,Bronze Sword
しょうにんでんな,Merchant Denna
神都フォーリオン,Fourion
ジア・クト念晶体,Dia Kut telecrystal
落陽の草原の木Ａ,Sunset Meadow Tree A
巨戦鬼ゴルゴンザ,Gigantic Gorgonza
預かり所シーラナ,Storage Shirana
欲望の邪鬼ゴモル,Demon of Desire Gomoru
ドラキュラパーツ,Dracula Parts
男ならメガもり丼,Mega Rice Bowl Recipe
常闇のスティック,Everdark Wand
ハルファスの紋章,Halphas Crest
ろんぐたきしーど,Long Tuxedo
ガナドールバンド,Victor Headband
若者の家ペコリア,Youth House Pekoria
アビスソルジャー,Abyss Soldier
ドリームミミック,Dream Mimic
ブラックチャック,Dark Brownie
スカラベーダーズ,Scaravaders
種族神像ウェディ,Weddie Tribal Statue
グランプリレシピ,Grand Prix Recipe
星夜のローファー,Starry Night Loafers
死霊兵ガテリアン,Spirit Soldier Gaterian
料理屋クレッセル,Server Kressel
フサフサの白ヒゲ,Fluffy White Mustache
どうぐ使いの時代,Item Master's Era
ゴスバニーハット,Goth Bunny Hat
エピステーサ丘陵,Epistesa Hills
クロ・マネキの像,Black Mannequin Statue
滅亡の砂漠への道,Path to Desert of Doom
美容師のプライド,Hairdresser's Pride
全滅時の復活場所,resurrection spot
第９回カミルの像,9th Kamil Statue
ヘルヴェルの部屋,Helvel's Room
鉱石の台座ランプ,Ore Pedestal Lamp
エルフテーブル大,Elf Table L
ドラキュラスーツ,Dracula Suit
メット無しスーツ,Helmetless Suit
ナイス！ナイフ！,Nice! Knife!
パピヨンプリズム,Papillon Prism
ダーマの神の清泉,Alltrades Spring
アクロバットの像,Acro Bat Statue
黒曜のテーブル小,Obsidian Table S
郵便局員サユサラ,Postman Sayusara
うろこのよろい上,Scale Armor
道具鍛冶サンダル,Toolsmith's Sandals
誘殺参謀リランザ,Seductress Rilanza
かぜきりの弓の書,Blowy Bow Book
海竜ヴォドニーグ,Sea Dragon Vodnig
金平糖ライト・虹,Rainbow Candy Light
悪霊の神々コイン,Evil Trinity Coin
金のフェルマーク,Gold Fel Mark
メロディアハット,Melody Hat
ハロふわモーモン,Halloween T. Sanguini
ヴェリナード領南,Verinard South
奈落にひそむもの,Abyss Lurker
預かり所ニノヤズ,Storage Ninoyazu
セレドの民家庭具,Celed House Decor (G)
破砕将のハンマー,Crush General's Hammer
お姫様ベンチ・桃,Pink Princess Bench
ブロブフィッシュ,Blobfish
竜のうろこの破片,Dragon Scale Shard
バンデッドボトム,Brigand's Bottom
ミラクルボックス,Miracle Box
よろず屋ガーディ,General Shop Gadi
マスカットリップ,Muscat Tulip
笑う地獄の大公爵,Duke of Hell Laughing
ガタラ原野の木Ａ,Gatara Fields Tree A
商品ナンバー１３,Item Number 13
花華メイドブリム,Flower Maid Brim
黒いレースの日傘,Black Lace Umbrella
ごはんいこーよ！,C'mon, Let's Eat!
交換屋メリーポコ,Exchange Shop Meripoko
伍の五声は呻の声,Fifth of 5 Voices Moan
飛竜のベストの書,Flying Dragon Book
ハヌマーン強軍団,Apex Nemean Army
蘇りしラズバーン,Risen Razburn
パワフルニンニク,Powerful Garlic
アンノウンファン,Unknown Fan
ザンクローネパン,Zankrone Bread
魔想念ローガスト,Demonic Thought Logast
ネブラ用とうめい,Transparent for Nebula
狂想鬼メルジオル,Mad Ghost Merjol
銀トラ猫カプセル,Silver Tabby Toy
ファラザード兵Ｂ,Farazard Soldier B
バトエンフラッグ,Batoen Flag
スライムベスラグ,She-Slime Rug
お月見のぼんぼり,Moon Viewing Lantern
マッピング計測器,Mapping Instrument
かんだたげんすい,Robbin' 'Ood Marshal
参加受付クライブ,Receptionist Clive
育成受付係ブレダ,Training Reception Breda
ミラクルブースト,Hurt Converter
クラシック風の柱,Classic Pillar
七夕・雲払いの書,Festival Cloud Sweeper
レシピ屋ルセット,Recipe Shop Ruseto
ルビーのサンダル,Ruby's Sandals
からっぽの赤宝箱,Empty Red Treasure Chest
レースの観客１２,Race Spectator 12
ベージュカメリア,Beige Camellia
パラディンタイツ,Paladin Tights
いきのいいサザエ,Very Fresh Turban Shell
どっかんドンガル,Tintaur
アサシンコート上,Assassin Coat Top
イエローシックル,Armour Mantis
レース刺繍の日傘,Embroidered Umbrella
はがねのよろい上,Steel Armor Top
死せる結晶の荒野,Dead Crystal Desert
妄執のグリンデア,Delusional Grindea
スノースティック,Snow Stick
シスター・リィト,Sister Lito
ヒューザトランプ,Hyuza Cards
カラス神楽の羽根,Crow Dance Feathers
ＣＭ用プクリポ４,Pukulipo For CM 4
客室案内ブレント,Room Guide Brent
ヒストリカソファ,Historica Sofa
青宝箱のチェスト,Blue Treasure Chest
武器屋リュウトウ,Weapon Shop Ryuto
ダッシュラン・強,Vicious Drag Racer
スタン弾ショット,Stunning Shell
ポセイドンベッド,Poseidon Bed
ドワーフ市民くつ,Dwarf Citizen Shoes
アドミラルハット,Admiral's Hat
たたきモグラの像,Mashing Mole Statue
カボチャチェスト,Pumpkin Chest
便せん屋キキョウ,Stationery Shop Kikyo
プチスライダーク,Frail Nemeslime
高価なゴブレット,Expensive Goblet
がうがうキャップ,Bow-Wow Cap
決めポーズ右前列,Decisive Pose R Front
バトエンウォール,Batoen Wall
脂たっぷりサバ缶,Canned Fatty Mackerel
ドルタムの念晶鏡,Doltam's Telecrystal Mirror
春風応援スカート,Spring Cheer Skirt
ベルトロの部下Ａ,Bertro Subordinate A
別離の剣器・朋友,Parting Blade of Friendship
ブレイクシューズ,Break Shoes
ムーディータンス,Moody Wardrobe
ドラゴンクエスト,Dragon Quest
ファルコンクロー,Gryphon Talon
修練の竜アズーロ,Azuro, Dragon of Training
せんすいふくあお,Blue Diving Suit
トナカイグローブ,Reindeer Gloves
スライムウィップ,Slime Whip
ショコラチケット,Chocolate Ticket
鉄枠木板張りの壁,Iron Framed Wood Wall
ギュッとコッコー,Chicken Arm Doll
三姉妹の馬車・桃,Pink 3 Sisters Carriage
ヒュプノスハント,Persecutter
モンスターシール,Monster Sticker
かぜのブーメラン,Gusterang
魔物ソンブレロ券,Sombrero Ticket
シーサイドルーム,Seaside Room
丸小紋のはかま上,Circle Hakama Top
わかがしらこぐち,Young Koguchi
聖王の大剣の壁画,Dryspell Blade Book
奈落より常世まで,Abyss to the Real World
天馬ファルシオン,Falchion
師団長のよろい下,Commander Leggings
氷の領界のベッド,Ice Realm Bed
モロコシのベッド,Corn Cob Bed
激情の竜エステラ,Estella, Dragon of Passion
英雄と少女の物語,Tale of a Hero and Girl
スターリーハット,Starry Hat
フェンサーハット,Fencing Hat
トランプスカート,Tycoon Skirt
シスター・ミアナ,Sister Miana
紫イモのテーブル,Purple Yam Table
バズカフェのイス,Pazu Cafe Chair
カンフーパンプス,Kung Fu Pumps
ＦＦＸＩＶ２印章,FF XIV 2 Stamps
ふくめんうさぎ１,Masked Rabbit 1
ふぉーまるどれす,Formal Dress
エンゼルブレード,Angel Blade
デリシャスカルビ,Delicious Ribs
プクラスの研究室,Pukulas' Laboratory
小型の和風水そう,Japanese Aquarium S
マザー・リオーネ,Mother Lione
ファラオプリズム,Pharaoh Prism
スレア海岸への道,Road to Surea Coast
ミイラ男のぼうし,Mummy Boy Hat
ろうごくドーター,Prison Daughter
イーギュアの大牙,Rapscallion's Fang
武勲の城の金箔壁,Valor Castle Foil Wall
道具鍛冶ターバン,Toolsmith's Turban
ミステリーチョコ,Mystery Chocolate
しんぷあれくせい,Father Alexei
玉ネギのチェスト,Onion Chest
竜族人形の作り方,Making Nadravian Dolls
中型魔神機開発部,Medium Aztech Development
攻撃時10%でためる,Tension Attack 10%
案内係サフィール,Guide Sapphire
木の葉のよろい上,Foliage Armor Top
郵便局員ピティカ,Postman Pitica
アンロックコード,Unlock Code
バグレア教会跡地,Bagulea Church Vestige
マジカルなアーチ,Magical Arch
ブルーマリッジ島,Blue Marriage Island
キツネパーカー上,Fox Hoodie
ストリートベスト,Street Vest
バラのスティック,Rose Wand
ハロウィンアーチ,Halloween Arch
古びたペンダント,Old Pendant
水の領界の鉢植え,Water Realm Plant Pot
パーティーメガネ,Stimulating Specs
紫水晶のキッチン,Amethyst Kitchen
帽子係アンジュー,Hat Clerk Anju
闇のトーマの仮面,Dark Toma's Mask
闇指揮者デリゲン,Dark Conductor Derigen
リトルライバーン,Little Wyvern
マーメイドタンス,Mermaid Wardrobe
便せん屋ウツセミ,Stationery Shop Utsusemi
キャプテンマント,Captain's Cloak
情熱のガナドール,Passionate Victor
大怪傑のはちまき,Wondrous Headband
マポレーナ便せん,Genie Sanguini Paper
素材屋ミルフィプ,Material Shop Mirfpu
メタルキングたち,Metal King Slime
ラッキークッキー,Lucky Cookies
スコーピオサイス,Scorpio Scythe
ブラッドエイプス,Blood Apes
ポイズンカメリア,Poison Camellia
異星からの侵略軍,Alien Invaders
ボーンプリズナー,Marrow Escapee
スタンカのハンコ,Stanka's Stamp
ふかふかなキノコ,Soft Mushroom
ウルフキャンディ,Wolf Lollipop
オーロラカメリア,Aurora Camellia
赤キノコ栽培日記,Mushroom Diary
ファラスのブーツ,Faras' Boots
エレメングリーン,Green Glow
赤組のたいそう着,Red Team Track Suit
スウィ～ツランド,Sweetsland
カントリーブリム,Country Brim
原始獣のシャプカ,Primal Beast Shapka
景品交換所コルナ,Prize Exchange Koruna
エンゼルショット,Angel Shot
王都ネクロデア跡,Necrodea Capital Ruins
おうぎのまい・改,Fan Dango+
聖天区画への出口,Exit to Holy Grounds
魔女の長日傘・青,Blue Witch Day Umbrella
主神グランゼニス,Gran Zenith
ドルボードレース,Dolboard race
ベリアルオリジン,Belial Origins
ドロくさいこうら,Smelly Shell
記憶のパドレア邸,Memory of Padrea Mansion
ボロボロの指針書,Tattered Guidebook
カジュアルドレス,Casual Dress
リラックス浮き輪,Relax Floatie
どうぐやはんちゃ,Item Shop Hancha
わふうしょうぞく,Breezy Wear
パンドラボックス,Pandora's Box
たたかいのビート,Rhythm 'n' Bruise
幻界導師のゆびわ,Phantom Priest Ring
サーチャーギフト,Searcher Gift
夢の王国グローブ,Dream Kingdom Gloves
防衛軍のグローブ,Defense Force Gloves
マジカルドレス上,Magical Dress Top
夕焼け雲のソファ,Sunset Cloud Sofa
弱酸性の間　入口,Weak Acidity Entry
東洋風タンス・雅,Chic Orient Wardrobe
シャイニングボウ,Shining Shot
授業ウェディ女性,Weddie Female Student
まもの使いの服２,Monster Master Suit 2
2015/2月分クエスト,Quest for 2015/02
１階への転送装置,Transporter to 1F
ドラグーンランス,Dragoon Lance
しびれくらげ０２,Man o' War 02
禁書の守護者・左,Left Banned Book Guard
グランマーズの館,Madame Luca's House
白もふ猫カプセル,Soft White Cat Toy
魔物管理人レビデ,Monster Manager Rebide
ホカホカストーン,Warmaline
ふわふわモーグリ,Fluffy Moogle
まるこもんせっと,Circle Pattern Set
グレモリーの紋章,Gremory Crest
兄弟姉妹コーデ券,Sibling Glamour Ticket
トリックランタン,Trick Lantern
トリットアーチズ,Trit Arches
小型魔神機開発部,Small Aztech Development
ニコニコな大冒険,Adventure With a Smile
聖王のブーメラン,Dryspell Boomerang
きれいな釣りざお,Beautiful Fishing Rod
ファラストランプ,Faras Cards
聖守護者の両手剣,Sentinel's Greatsword
スチーム本棚・赤,Red Steam Bookshelf
ベビタングローブ,Imp Gloves
制圧隊長ゾベエガ,Suppress Commander Zobega
ごうかな玉座・赤,Red Fancy Throne
チャージ時間-10秒,Charge Time -10 sec.
オセアノスの祈り,Full Fathom Prayer
まほうのグリーブ,Magic Greaves
中型の和風水そう,Japanese Aquarium M
栄光のローブ・銀,Silver Glory Robe
ブチ太猫カプセル,Fat Spotted Cat Toy
チェイサーブーツ,Chaser Boots
管理人アチュリン,Caretaker Achurin
