整備士のてぶくろ,Technician's Gloves
マスタードロッド,Mustardo Rod
ナイトメアリーフ,Lethal Leaf
スタジアムパンツ,Stadium Shorts
アリアハンマント,Aliahan Cape
カジュアルブレス,Casual Bracelet
水竜ギルギッシュ,Gilgish
ジア・クリスタル,Dia Crystal
野いちごサンダル,Wild Strawberry Sandals
キャプテンの眼帯,Captain's Eyepatch
シャンパンタワー,Champagne Tower
ショコラチケット,Chocolate Ticket
猛火竜のウィング,Fire Dragon Wings
帝国三将軍メダル,Triumgorate Medal
ネイティブ柄ラグ,Native Pattern Rug
ネレウスショット,Nereus Bow
メス三毛猫スーツ,Calico Cat Suit (F)
シーサイドベッド,Seaside Bed
カプレーゼタクト,Fromage Flay Wand
まほうの盾の秘密,Magic Shield Secret
ダークプラネット,Dark Planet
グランドネビュラ,Solar Flair
ウィキッドブーツ,Wicked Boots
しょうにんぼった,Merchant Botta
竜術士のグローブ,Dragomancer Gloves
しぐさ書・天灯赤,Emote "Red Lantern"
預かり所ヒメネス,Storage Himenes
ミステリーカカオ,Mystery Cacao
グレイトグラタン,Great Gratin
パンプキンハット,Pumpkin Hat
レギオンメイル上,Legion Mail Top
うつしよの境界地,World's Boundary
しぐさ書・ハート,Emote "Draw a Heart"
スウィートビキニ,Sweet Bikini
デュークアックス,Aristocrat's Axe
ライダーススーツ,Riders Suit
ブレイブグリーブ,Brave Greaves
ドラゴンクロー絶,Apex Dragon Claws
カエルパーカー下,Frog Shorts
翠嵐の聖塔・外周,Storm Tower Outer Area
スラミチカプセル,Slimichi Toy
バカン山道への道,Road to Bakan Mountain Pass
ルイーダチケット,Luida Ticket
クロッコの全財産,Crocco's Belongings
ミラクルコート下,Miracle Coat Bottom
ＣＭ用ドワーフ３,Dwarf For CM 3
魔盗鬼チャムール,Devilish Thief Chamour
アウルスティック,Aur Wand
原始獣のグローブ,Primal Beast Gloves
見覚えのある人間,Familiar Human
きせきのプチ香水,Miracle Perfume S
ダンディクッキー,Dandy Cookies
メイジももんじゃ,Crack-Billed Platypunk
フラウスウィップ,Flaus Whip
ナチュラルラック,Natural Rack
預かり所シーラナ,Storage Shirana
預かり所ペイジー,Storage Page
種族神像ドワーフ,Dwarf Tribal Statue
しぐさ書・お弁当,Emote "Lunch Box"
救助された侍女Ａ,Relief Maid A
究極Ｖロンコイン,Ultimate Vron Coin
ムーディーソファ,Moody Sofa
はぐメタルーキー,Rookie Liquid Metal Slime
預かり所ヤーディ,Storage Yadi
シュメリアピアス,Sumeria Earrings
デーモンバスター,Demonsbane
封じられた洞くつ,Sealed Cave
ボーンプリズナー,Marrow Escapee
栄光のローブ・金,Gold Glory Robe
家出したスランジ,Runaway Goorange
郵便局員ルジアダ,Postman Rujiada
ダーマ神殿の松明,Alltrades Abbey Torch
ＣＭ用プクリポ２,Pukulipo For CM 2
ジャングル風の壁,Jungle-Style Wall
スノースティック,Snow Stick
ピクニックグリエ,Grei Picnic
王宮のタンス・青,Blue Royal Wardrobe
パンドラボックス,Pandora's Box
ブルービックバン,Blue Big Bang
ホイミンキャップ,Healie Cap
前座芸人のうでわ,Show Opener's Bracers
みやびな打ち掛け,Elegant Wedding Kimono
超かがやきの樹液,Super Sparkly Sap
予言者学園学生服,Prophet Sch. Uniform(M)
春風の吹く日まで,When a Spring Wind Blows
レースの観客２８,Race Spectator 28
レッドタキシード,Red Tuxedo
スマイルリザード,Raptile
デフェル荒野の石,Defel Desert Stone
桜モダングローブ,Cherry Modern Gloves
じんめんじゅ・強,Vicious Treeface
青リンゴのタンス,Green Apple Wardrobe
チャージ時間-10秒,Charge Time -10 sec.
大戦鬼のグリーブ,War Demon's Greaves
伍の五声は呻の声,Fifth of 5 Voices Moan
バズカフェの植木,Pazu Cafe Plant
求道者のてぶくろ,Seeker's Gloves
エンジェルサイズ,Angel Scythe
ふるぼけたタライ,Underpants Dance
アンノウンエッジ,Unknown Edge
エテーネのうでわ,Ethene Armbands
フラワーウィング,Flower Wings
ＣＭ用ドワーフ４,Dwarf For CM 4
シール特別交換券,Sticker Exchange Ticket
ゴレオン将軍の像,Goreham-Hogg Statue
アルファ用銀の丘,Silver Hill for Alpha
異界アスタルジア,Astalgia
巨大ナスビナーラ,Giga Large Woebergine
シスター・サーラ,Sister Sarah
小型の円柱水そう,Small Cylindrical Tank
エドアルドの工具,Eduardo's Tools
王城の悪夢・３階,Nightmare's Castle 3F
リソルの生徒手帳,Resol's Student ID
カルサドラ大空洞,Calsadora Hollow
ガネーシャエビル,Evil Ganesh
キュルル花火・虹,Rainbow Kyururu Fwork
時の妖精カプセル,Time Fairy Toy
暗黒の魔人練習札,Ruin Tag
エテーネのまもり,Ethene Charm
レジェンズワンド,Legends Staff
3rdキョウダイフク,3rd Brother Clothes
呪文ぼうそう率+3%,Haywire Rate +3%
グラコス強カード,Apex Gracos Card
ライトニング無頼,Lightning Unreliable
スチームグローブ,Steam Gloves
オーグリード大陸,Ogreed
ブラッドエイプス,Blood Apes
プリンセスニャン,Princess Cat
トリックランタン,Trick Lantern
オニグモの盾の本,Spider Shield Book
夏のお祭りアーチ,Summer Festival Arch
シスター・リリン,Sister Lilin
光のオーナメント,Light Ornament
レースの観客２５,Race Spectator 25
しぐさ書・身支度,Emote "Get Ready"
茶ブチ猫カプセル,Tea Spotted Cat Toy
光の錬金ツボの本,Light Alch Pot Book
守護鬼の間への道,Road to Keeper's Chamber
ゴシックグローブ,Gothic Gloves
黒宝箱のチェスト,Black Treasure Chest
ヒヨコパーカー上,Chick Hoodie
よろい武者の置物,Armor Warrior Ornament
ラン錬作業ベスト,Lamp Alchemist's Vest
キュルルトランプ,Kyururu Cards
ステンドシールド,Stained Glass Shield
さいほう職人の魂,The Soul of Sewing
黒鳥のチュチュ下,Blackbird Tutu Bottom
さめきぐるみもも,Pink Shark Suit
シュガーシューズ,Sugar Shoes
桜モダンスカート,Cherry Modern Skirt
ブリガンオーダー,Brigan Order
奈落より常世まで,Abyss to the Real World
ガブリエルのやり,Gabriel's Spear
シスター・ヤチヨ,Sister Yachiyo
古強者のグリーブ,Veteran's Greaves
おてんば姫のふく,Alena's Dress
セラフィキッチン,Seraphi Kitchen
青年貴族のぼうし,Nobleman's Hat
ステラツイスター,Stella Twister
まもの使いの服２,Monster Master Suit 2
マーメイドベッド,Mermaid Bed
モンスター討伐隊,Monster Strike Force
せんしあいざっく,Warrior Isaac
ゆめみるちょこら,Dreaming Chokora
ハートの本棚・桃,Pink Heart Bookshelf
ハルバルド海賊団,Halbard Pirates
イオ１０系の写真,Bang 10 Series Photo
男性金魚のゆかた,Men's Goldfish Yukata
プラチナミミック,Platinum Mimic
シマ柄のじんべい,Striped Jinbei
初期ドワーフ女性,Initial Dwarf Female
ワイルドファング,Wild Fang
ファラザード印章,Farazard Stamp
羅刹王バラシュナ,Varashna, the Sinful Spirit
預かり所メビータ,Storage Mebita
毒竜討伐隊の記録,Serpentscale Skean Book
猫貴族のスカート,Aristocat Skirt
ラッカラン住宅村,Luckland Residences
ラニアッカ断層帯,Raniakka Fault Zone
壁かけ紋章旗・黄,Yellow Wall Banner
ホワイトホイップ,White Chocolate Whisp
怪蟲の広場の階下,Insect Square Lower
ギュッとリベリオ,Purrgatroyd Arm Doll
壱の式修了の陰符,Yin I Completion Charm
クリスタルピアス,Crystal Earrings
シスター・トルテ,Sister Torte
ファラスのズボン,Faras' Pants
グレートアックス,Bad Axe
獄嵐鬼ウェンリル,Stormkeeper Wenrir
しぐさ書・あわわ,Emote "Gasp"
ファラストランプ,Faras Cards
メタスラスカーフ,Metal Slime Scarf
ゴクラクギョ・黒,Black Betta
エンジェル衣装券,Angel Costume Ticket
大地の箱舟　３幕,Ark of the Earth Act 3
ルビン宙橋への扉,Door to Rubin Bridge
魔勇者アンルシア,Anlucia, Hero of Evil
占い師の四角ラグ,Diviner Square Rug
壁かけ穴ミイラ男,Mummy Boy Hole
ナブレットソファ,Nablette Sofa
ウサギパーカー上,Rabbit Hoodie
あるある川柳・銅,Haiku Bronze
ヴァイパーブーツ,Viper Boots
幻想蝶のウィング,Fantasy Butterfly Wings
しびれくらげ２２,Man o' War 22
シスター・ノンナ,Sister Nonna
ロリータドレス下,Lolita Dress Bottom
ストリングライト,String Light
ボストロールの像,Boss Troll Statue
デモンズゲイトＢ,Demon Zugei B
闇指揮者デリゲン,Dark Conductor Derigen
マーガレットの傘,Margaret Umbrella
赤組のたいそう着,Red Team Track Suit
預かり所ゾゼルグ,Storage Zozelgu
リゾートかきわり,Resort Backdrop
パルカラス亡霊王,Ghost King Palkaras
ファラオ・ゴレム,Pharaoh Golem
グロリスのしずく,Droplet of Gloris
ユーライザのメモ,Yuliza's Note
シルエット・樹木,Silhouette Tree
ようせいのひだね,Lamplight
トーマ少年期の剣,Toma's Childhood Sword
神秘のテラリウム,Mysterious Terrarium
ふわふわクリオネ,Fluffy Sea Slug
めっとなしすーつ,Helmetless Suit
実行委員エルスカ,Executive Committee Elska
ギュッとプオーン,Rebjorn Arm Doll
ハリケーンエッジ,Blusterang
スチームシールド,Steam Shield
ごうかなイス・緑,Green Fancy Chair
エルフテーブル大,Elf Table L
バッジ交換券・虹,Rainbow Badge Ticket
ガナドールバンド,Victor Headband
王立研究所職員１,Royal Research Staff 1
星からのまれびと,Stranger from the Stars
破戒王ベルムド強,Apex Sin King Bermud
スキップ係オウカ,Skipper Ouka
ハッピーチケット,Happy Ticket
ヤバい宝石の包み,Dangerous Gem Package
ワグミカのソファ,Wagmika's Sofa
参の五声は言の声,Third of 5 Voices Speak
やさしさのクスリ,Kindness Medicine
ルティショー像白,White Astolti Short St.
小鳥のガゼボ・白,White Small Bird Gazebo
氷の上のぬくもり,Warmth On the Ice
三姉妹の馬車・桃,Pink 3 Sisters Carriage
ベリアルオリジン,Belial Origins
打ち上げ花火・緑,Green Firework
バトエンウォール,Batoen Wall
ザイナー衛士団長,Guard Commander Zeiner
エレガントココア,Elegant Cocoa
学園女子の夏服上,Schoolgirl Summer Top
青の巨人ブルメル,Blue Giant Blumel
フカき海の底で２,Bottom of Shark Sea 2
モーグリのぼうし,Moogle Hat
かいぞくＴシャツ,Pirate T-Shirt
プリプリぎんなん,Plump Gingko Nut
名探偵のシューズ,Sleuth's Shoes
ナイス！ナイフ！,Nice! Knife!
レインボーファン,Rainbow Fan
愛のチョコレート,Affection Chocolate
おばけキャンドル,Wax Murderer
新兵支給てぶくろ,Recruit Gloves
妖魔ジュリアンテ,Mystical Juliante
わかがしらひのき,Young Hinoki
パレードウェア下,Mardi Garb Bottom
ホワイトジャッジ,White Judge
おおぞらの便せん,Clear Sky Paper
塔のガーディアン,Tower Guardian
郵便局員モルーゼ,Postman Morusei
まよえるせしりお,Lost Cecilio
アルゴングレート,Great Argon Lizard
はがねのよろい上,Steel Armor Top
ネコ姫の観葉植物,Cat Princess Plant
小さな民家の模型,Small House Model
くさりかたびら下,Chain Mail Bottom
マリン調のベッド,Marine Bed
道具屋ズィディリ,Item Shop Zidiri
預かり所ポピリア,Storage Popilia
キリカ草原への道,Road to Kirika Steppe
ジュレー島の木Ａ,Jule Island Tree A
原始獣のコート上,Primal Beast Coat
女性金魚のゆかた,Women's Goldfish Yukata
アンノウンワンド,Unknown Staff
ギュッとはぐりん,Liquid Metal Arm Doll
壁かけ純喫茶の窓,Cafe Window
オレンジのパーツ,Orange Part
セラフィの便せん,Seraphi Paper
お祭りのはちまき,Festival Headband
坑道跡は黄泉の国,Land of the Dead Mine
谷間の広場への道,Road to Valley Square
聖天のハイヒール,Holy Heaven Heels
天翼のイヤーカフ,Heavenly Wing Ear Cuffs
ドワーフ作業くつ,Dwarf Work Sandals
コットンフェザー,Cotton Feather
大地の箱舟　１幕,Ark of the Earth Act 1
ネタ「ひまわり」,Sunflower Trick
カメさまカプセル,Galapagod Toy
モッズヘッドホン,Mod Headphones
レースの観客１２,Race Spectator 12
異形の大地への道,Road to Deformed Earth
闇騎士のグリーブ,Dark Knight Greaves
ようせいのラムネ,Fairy Drink
便せん屋ヤマブキ,Stationery Shop Yamabuki
指先で触れる世界,World at Your Fingertips
博愛騎士のブーツ,Love Knight Boots
村王クリフゲーン,Chief Cliffgain
魔幻都市の便せん,Phantom City Paper
ステンドレイピア,Stained Glass Rapier
クラシック風の柱,Classic Pillar
グレートハンマー,Great Hammer
ラピスの友達の絵,Lapis' Members Drawing
コルセアグローブ,Corsair Gloves
サメきぐるみ・金,Gold Shark Suit
プラチナエンゼル,Platinum Angel
ギガデンデロベー,Giga Dendelobe
エドアルドの部屋,Eduardo's Room
壱の式修了の陽符,Yang I Completion Charm
バザールを救え！,Save the Bazaar!
チェイサーブーツ,Chaser Boots
あやしいバスタブ,Suspicious Bathtub
お菓子の間仕切り,Sweet Partition
イワトビカプセル,Rockhopper Penguin Toy
黄昏の霊堂への扉,Door to Mausoleum of Dusk
ヘヴィーグリーブ,Heavy Greaves
釣り老師ハルモス,Fish Master Harmos
白バラのチェスト,White Rose Chest
アサシンコート下,Assassin Coat Bottom
ファーグスオイル,Fargus Oil
クリスマスの暖炉,Christmas Fireplace
グランゼドーラ駅,Gran Zedora Station
踊り子のティアラ,Dancer Tiara
ドラグーンランス,Dragoon Lance
たこやきプリズム,Takoyaki Prism
スライム柄コタツ,Slime Kotatsu
エステラの紹介状,Estella's Intro Letter
ピクニックアサヒ,Asahi Picnic
踊り子のスカート,Dancer Skirt
シンイのこころ１,Shini's Heart Lv. 1
大とうぞくのカギ,Great Thief's Key
マジカルドレス上,Magical Dress Top
クモさんお掃除棒,Spider Sweeping Stick
大きなお菓子の壁,Big Sweets Wall
マローネパラソル,Marone Umbrella
黒いバラの花びら,Black Rose Petal
ダーマ礼拝堂の扉,Alltrades Abbey Door
まよえるかみのれ,Lost Caminole
ホーリーローブ下,Holy Robe Bottom
お姫様ベッド・桃,Pink Princess Bed
わかがしらこぐち,Young Koguchi
スチームオーブン,Steam Oven
ふわふわネルゲル,Fluffy Nergel
ゴールドストーン,Gold Nugget
歌詠みのころも上,Poet's Attire Top
デザートランナー,Parched Peckerel
氷の魔王のマント,Ice Demon Cloak
メルサンディ印章,Melsandy Stamps
イシスのブローチ,Isis' Brooch
はじめてのオフ会,First Time Off Meeting
学園の校庭の砂場,Schoolyard Sandbox
絆のエンブレム極,Apex Bonding Emblem
シスター・リュリ,Sister Lulie
ちあがーるのふく,Cheerleader Clothes
虹色のインゴット,Rainbow Ingot
まじんのかなづち,Hela's Hammer
エンゼルショット,Angel Shot
ゴスバニーハット,Goth Bunny Hat
ブラックベジター,Scourgette
ネレウスシールド,Nereus Shield
桜モダンスーツ上,Cherry Modern Shirt
とこなつバングル,Summer Bangles
魔獣ネロスゴーグ,Demon Beast Nerosugog
シスター・ラクト,Sister Lakuto
移動係ディナーラ,Travel Clerk Dinara
ダーククリスタル,Dark Crystal
金剛不壊の武装術,Unbreakable Varja
男性花柄のゆかた,Men's Floral Yukata
スライム露天風呂,Slime Outdoor Bath
まもの使いの証明,Monster Master Proof
プリズンイーグル,Prison Eagle
魚交換員ポップイ,Fish Exchange Popui
パンプキッズ・強,Vicious Pumpkid
つやめく毛髪の束,Glossy Hair Bunch
ネオン・サークル,Neon Circle
よみがえる不死鳥,Resurrected Phoenix
ガズバランの牙Ｃ,Gazbalan's Fang C
シンイのこころ２,Shini's Heart Lv. 2
スターのイス・赤,Red Star Chair
キラーマシンの書,Killing Machine Book
古代魔術のぼうし,Ancient Magic Hat
スチームチェスト,Steam Chest
キュララな夏休み,Kyurara Summer Holiday
キュロドーナッツ,Kyuro Donut
保育地区ペコリア,Nursery Area Pekoria
トーテムサンダル,Totem Sandals
スペースデーモン,Space Demon
始源の歌姫セット,First Diva's Outfit
ショコラなぼうし,Chocolate Hat
ボロボロの指針書,Tattered Guidebook
守護天使のお守り,Guardian Angel Amulet
初心者用の片手剣,Beginner's Sword
アビスセーラー上,Abyss Shirt
木彫りのロザリオ,Wood Carved Rosary
ごうかな本棚・緑,Green Fancy Bookshelf
いくさ化粧シール,Warpaint Sticker
ついてクンマット,Pet Mat
ぴえろいしょうⅠ,Clown Costume Ⅰ
ドラポヨモニター,Tubby Dracky Monitor
オーフィーヌ海底,Orfine Seabed
モンセロの湯の花,Moncello Mineral Salts
どうぐやえいなる,Item Shop Einar
あったかセラフィ,Warm Seraphi
栄光のローブ・銀,Silver Glory Robe
審判の天使リスト,Angel of Judgment Bands
魔物管理人レビデ,Monster Manager Rebide
空のワインボトル,Empty Wine Bottle
セーラスアックス,Selas Axe
スイカのテーブル,Watermelon Table
聖大剣アスカロン,Holy Sword Ascalon
レオン・ビュブロ,Leon Byblo
トキワアカネの花,Red Ibis Flowers
レスキュマフィン,Rescue Muffin
魔天鋼バルバトン,Balbaton, Steel of Evil
転職神官ハクドウ,Vocation Priest Hakudo
「楽園」の展示室,"Paradise" Exhibit Room
アワードキャップ,Award Cap
表層・ルビン宙橋,Surface - Rubin Bridge
ゴールドデーモン,Gold Daemon
磁界の効果アップ,Magnetic Field Boost
妖精変身ステッキ,Fairy Makeover Wand
ウイングタイガー,Missing Lynx
デザートデーモン,Dessert Demon
ティプローネ光花,Tiplone Light Flower
ネタ「たけのこ」,Bamboo Shoot Trick
マリーンの金剛棒,Malynn's Diamond Rod
２階への転送装置,Transporter to 2F
ハッピークッキー,Happy Cookies
シスター・ネジュ,Sister Neju
壁かけプランター,Wall Planter
究明者のコート下,Research Coat Bottom
海竜ヴォドニーグ,Sea Dragon Vodnig
さめきぐるみあか,Red Shark Suit
奈落にひそむもの,Abyss Lurker
スライムのベッド,Slime Bed
討伐隊員シーナン,Strike Force Sinan
支援端末Ｐ１０９,Support Terminal P109
光攻撃ダメージ+5%,Light Attack Damage +5%
キャラメルリップ,Caramel Tulip
しぐさリスト選択,Emote List
キャタピラー・強,Vicious Killerpillar
第３回マイユの像,3rd Maille Statue
レジェンズランス,Legends Lance
ほっとヘッドホン,Soft Headphones
よろず屋ガーディ,General Shop Gadi
悪魔王の同族狩り,Hunting Devil's Family
ダーマ神殿への道,Path to Alltrades Abbey
渡し守ヤンディー,Ferryman Yandey
ガーデンパンプス,Garden Pumps
プクリポ風アーチ,Pukulipo-Style Arch
マッドレインボー,Rainbow Mannequin
ふくろう観察日記,Owl Observation Diary
しょこらなどれす,Chocolate Dress
きのこ村のぼうし,Shroom Village Hat
真珠の取れる浮貝,Pearl Taken From a Shell
ファラオ・ヘッド,Pharaoh Head
おっかけパンサー,Chasing Panther
本読みヒストリカ,Book Reading Historica
魔物管理人スメメ,Monster Manager Sumeme
ソポスのころも下,Sophos Robe Bottom
ぷるぷるスラピー,Wobbling Slurpy
武器防具屋ソロリ,Weapon & Armor Shop Sorori
始源の歌姫のくつ,First Diva's Shoes
妖貴妃ディアーダ,Beauty Empress Diada
しっこくのブーツ,Macabre Boots
古びたペンダント,Old Pendant
エメラルドの花束,Emerald Bouquet
管理人マルリーヌ,Caretaker Marlene
ブレイクスタイル,Break Style
ウェディ秘書モブ,Weddie Secretary Mob
フリーズクランチ,Freeze Crunch
新作家具屋ニニモ,New Furniture Shop Ninimo
ふわふわ雲のラグ,Fluffy Cloud Rug
オルフェウスの弓,Orpheus' Bow
ダストンキッチン,Duston Kitchen
吊るしテラリウム,Hanging Terrarium
壁かけＤＱⅠの絵,DQⅠ Painting
だいまどうのくつ,Great Mage Shoes
実行委員リーベル,Executive Committee Ribel
プラコン用のイス,Private Concierge Chair
王城の悪夢・２階,Nightmare's Castle 2F
ファラオ・ヘルマ,Pharaoh Herma
こぞうバックラー,Leery Buckler
ピンクタイフーン,Pink Typhoon
うさぎの和タンス,Rabbit Wardrobe
ドワーフチェスト,Dwarf Chest
音符のベッド・黒,Black Music Bed
エレガントブレス,Elegant Bracelets
シスター・イオリ,Sister Iori
おおきなリボン黄,Yellow Ribbon L
よろず屋カトラズ,General Shop Katraz
預かり所カーリィ,Storage Karry
上級亡霊兵士たち,High Spirit Soldiers
レースの観客２４,Race Spectator 24
道具屋ドロッジェ,Item Shop Drogger
ＣＭ用プクリポ３,Pukulipo For CM 3
メタルキングたち,Metal King Slime
覇者のローブ・銅,Bronze Champ Robe
黄金のブローチ？,Golden Brooch ?
星夜の長てぶくろ,Starry Night Long Gloves
モーモンの便せん,Teeny Sanguini Paper
ふわふわクマノミ,Fluffy Clownfish
住宅素材屋ピード,Housing Materials Peid
トランプグローブ,Tycoon Gloves
武器鍛冶作業着下,Weaponsmith's Apron
レンダーシア内海,Lendersia Inland Sea
シュバリエハット,Chevalier Hat
クルーガーハット,Kluger Hat
死のカラステング,Death Crow
壁かけＤＱⅧの絵,DQⅧ Painting
マリン調のベンチ,Marine Bench
王家のペンダント,Royal Family's Pendant
パッショントップ,Passion Top
ダーティラビッツ,Bad Hare
ポポラパの最深部,Popolapa Depths
ショーナへの手紙,Letter to Shauna
ミラクルコート上,Miracle Coat Top
天翼のエンブレム,Heavenly Emblem
大魔獣イーギュア,Giga Rapscallion
美容師のプライド,Hairdresser's Pride
しんりのローブ上,Faithful Robe Top
オパールのベンチ,Opal Bench
ブルーナポレオン,Humphead Wrasse
陶芸設備・庭欠番,Pottery Facility (G)
金平糖ライト・桃,Pink Candy Light
三姉妹の馬車・青,Blue 3 Sisters Carriage
どくろあらい・強,Vicious Haardvark
ルティチャビ像白,White Astolti Chubby St.
ラーの鏡くりぬき,Hollow Mirror of Ra
ビントンの陳情書,Vinton's Petition
きんのネックレス,Gold Chain
エレメングリーン,Green Glow
五大陸のモビール,Five Continents Mobile
ドラゴンガイア強,Apex Gaia Dragon
風車塔のほほえみ,Windmill Tower's Smile
預かり所オリジェ,Storage Orige
ハヤブサ観察日記,Falcon Watcher's Diary
ボーンファイター,Zombie Gladiator
ニコニコな大冒険,Adventure With a Smile
エメラルドリリィ,Emerald Lily
案内係ペリュイヌ,Guide Peruine
ワンダークリーム,Wonder Cream
ニンジンリゾット,Carrot Risotto
荒ぶる魔王の痛み,Pain of the Demon King
フェディーラの家,Fedira's House
モーモンゆず風呂,T. Sanguini Yuza Bath
白トラ猫カプセル,White Tabby Toy
プチギュメイ将軍,Frail Goresby-Purrvis
古代文字解読辞典,Ancient Lexicon
小型の和風水そう,Japanese Aquarium S
グラコス強メダル,Apex Gracos Medal
ダイコンのタンス,Daikon Wardrobe
アサシン・ニヒル,Nihilassin
モグふわベビタン,Fluffy Chef Imp
カージナルテトラ,Cardinal Tetra
くじゃくのおうぎ,Peacock Fan
ベジセルクの咆哮,Cucumberserk's Roar
よごれたほうたい,Grubby Bandage
魔王のネックレス,Sock-It Locket
防衛軍のインカム,Defense Force Intercom
ウェディチェスト,Weddie Chest
今年のブレス対策,Breath Countermeasures
夢の王国ドレス上,Dream Kingdom Shirt
聖賢者のバングル,Holy Sage Bangles
バケットウィッグ,Bucket Wig
銀のさいほう針小,Silver Sew Needle S
もうひとつの楽園,Another Paradise
シスター・ミアナ,Sister Miana
レースの観客１４,Race Spectator 14
想いを針にこめて,Put Thoughts in a Needle
シーサイドハウス,Seaside House
必殺チャージ率+1%,Special Charge Rate +1%
リザードマンの書,Mandrake Major Book
魚交換員ポポヘプ,Fish Exchange Popohepu
ドリームミミック,Dream Mimic
極彩色の吊り提灯,Brightly Hanging Lantern
ジェルソルジャー,Gel Soldier
防具屋グリッチャ,Armor Shop Gritcha
水鳥のいる池・庭,Bird Pond (G)
ドール書・いのる,Doll Book "Pray"
レシピ屋ペリンタ,Recipe Shop Perinta
極天女帝のピアス,Sky Empress Earrings
よろず屋ルリーズ,General Shop Luriez
神獣アマカムシカ,Amazlantelope
モンスターシール,Monster Sticker
ガーネットダリア,Garnet Dahlia
雪原のアノラック,Snowfield Anorak
ぐるぐるネジ巻き,Winding Key
サンダーフロッグ,Zaptile
シンイのこころ６,Shini's Heart Lv. 6
キュララナビーチ,Kyurarana Beach
封印の守り手たち,Seal Guardians
プラークラベーン,Giant Stingray
郵便配達人バイグ,Mailman Baigu
パハカースの肋骨,Pahkas' Bone
邪神ヴァニタトス,Dark Deity Vanitatos
おおくちばし・強,Vicious Beakon
テラシナーラの像,Bulbergine Statue
第３回フウラの像,3rd Fuura Statue
パンプキンパンツ,Pumpkin Pants
2013/2月分クエスト,Quest for 2013/02
ボルカノハンマー,Volcano Hammer
ギュッとワンワン,Dog Arm Doll
暗夜の霊堂への扉,Door to Mausoleum of Night
月見の縁台セット,Moon Viewing Bench Set
黒岩削り出しの壁,Black Rock Wall
渡し守ディレーク,Ferryman Direkke
