カラフルチケット,Colorful Ticket
スノースティック,Snow Stick
おしゃれカタログ,Fashion Catalog
オパールのダンロ,Opal Fireplace
よろず屋カトラズ,General Shop Katraz
旬の黄金アマエビ,Seasonal Gold Pink Shrimp
ベジセルクの奏演,Cucumberserk's Act
深い森の邸宅の塀,Forest Manor Fence
中型魔神機開発部,Medium Aztech Development
本読みヒストリカ,Book Reading Historica
はじめての木工術,Would-Be Woodworking
コーラルディモス,Coral Dimos
預かり所ボラデュ,Storage Boradu
ウルタ皇女の工具,Princess Ulta's Tools
幽霊作家バケンズ,Ghost Writer Bakenz
パピヨンプリズム,Papillon Prism
ぷちスラキャップ,Small Slime Cap
ウィキッドブレス,Wicked Braclets
プチＳジェネラル,Frail Shogum
ミリオンスマイル,Million Smile
シグナルスライム,Slime Signal
超あまつゆのいと,Super Celestial Skein
覇者のローブ・銅,Bronze Champ Robe
ごうかなイス・赤,Red Fancy Chair
峡谷のヴァランガ,Valanga Canyon
預かり所ヤーディ,Storage Yadi
ぷりんせすどれす,Princess Dress
サバ太猫カプセル,Fat Gray Cat Toy
キラキラ大風車塔,Wondrous Windmill Tower
博愛騎士のピアス,Love Knight Earrings
しぐさ書・天灯緑,Emote "Green Lantern"
ユニコーンのツノ,Unicorn Horn
打ち上げ花火・赤,Red Firework
おうぎのまい・改,Fan Dango+
キングギフト・白,White King Gift
クリスタルクロー,Crystal Claws
ラニアッカ断層帯,Raniakka Fault Zone
ハンタースーツ下,Hunter Suit Bottom
強者賞トロフィー,Strongman Trophy
パンプキンマント,Pumpkin Cloak
ドワーフ作業くつ,Dwarf Work Sandals
シンイのこころ７,Shini's Heart Lv7
ロイヤルチャーム,Sovereign Seal
ポイズンカメリア,Poison Camellia
合唱隊のシューズ,Choir Shoes
太陽の斧を求めて,Seeking Apollo's Axe
伝説のグリンガム,The Whip of Legend
聖夜の反逆者軍団,Holy Night Rebel Army
トーテムクラウン,Totem Crown
木の葉のよろい上,Foliage Armor Top
くろがねの小ビン,Iron Phial
パンプキンタイツ,Pumpkin Tights
クリスマスの暖炉,Christmas Fireplace
クラシック風の柱,Classic Pillar
さびたペンダント,Rusty Pendant
レクタリスのくつ,Lectalis' Shoes
うつしよの境界地,World's Boundary
キラキラモーモン,Glittering T. Sanguini
ふくびき魔法ビン,Lottery Flask
魔獣ネロスゴーグ,Demon Beast Nerosugog
プクリポ間仕切り,Pukulipo Partition
ブレイブグリーブ,Brave Greaves
ヘヴィーグローブ,Heavy Gloves
ネタ「爆発っ！」,Explode Trick!
タイタス号の積荷,Titus Cargo
ファラオ・ニビス,Pharaoh Nibis
王家の迷宮の燐光,Royal Maze Phosphor
ツボ錬金作業着上,Pot Alchemist's Clothes
レシピ屋ルセット,Recipe Shop Ruseto
グリーンエッグ２,Green Egg 2
シックゴスセット,Chic Goth Outfit
ボスコイン無料券,Free Boss Coin Ticket
きのこ村のぼうし,Shroom Village Hat
ウィンターブーツ,Winter Boots
超エッチなしたぎ,Really Robust Lingerie
魔力吸収布の製法,Magic Cloth Method
フリーズクランチ,Freeze Crunch
壁かけＤＱⅥの絵,DQⅥ Painting
ウェルカムハウス,Welcome House
アラビアン衣装券,Arabian Outfit Voucher
しましまキャット,Candy Cat
郵便局員ツィサア,Postman Tsisa
砂の都のテーブル,Sand City Table
東洋風ベンチ・雅,Chic Orient Bench
ゴールドデーモン,Gold Daemon
プクリポソファ小,Pukulipo Sofa S
ハイクラス衣装券,High Class Outfit Voucher
竜のうろこの破片,Dragon Scale Shard
地獄の帝王の立像,Estark Statue
めいたんていけち,Sleuth Kechi
アンフィスバエナ,Amphisbaena
魔天鋼バルバトン,Balbaton, Steel of Evil
エドアルドの工具,Eduardo's Tools
プリプリぎんなん,Plump Gingko Nut
スイートキャップ,Sweet Cap
カルサドラの風穴,Calsadora Wind Cave
ゴクラクギョ・黒,Black Betta
カボチャつきの畑,Pumpkin Field
ネコミイラ衣装Ⅱ,Cat Mummy Costume Ⅱ
レジェンズガード,Legends Guard
リウ老師の探知機,Master Liu's Locator
魔天海フォルネー,Sky Ocean Folnay
アンロックコード,Unlock Code
キューピッド衣装,Cupid Costume
木の葉のよろい下,Foliage Armor Bottom
バトエンウォール,Batoen Wall
ネイビーリュック,Navy Backpack
ピンクラインの柱,Pink Line Pillar
バトルシェイカー,Maracaraider
遊び人の服セット,Gadabout Outfit
メタスラのタンス,Metal Slime Wardrobe
どうぐやまろっく,Item Shop Maroc
ニンジャカッター,Ninja Cutter
古代文字解読辞典,Ancient Lexicon
オルフェア白色花,White Orphea Flowers
レースの観客２３,Race Spectator 23
夏の渚のサンダル,Summer Beach Sandals
鋼鉄巨兵のピアス,Steel Giant Earring
スカラベテンツク,Scarab Slugger
道具購買員ユシエ,Item Buyer Yushi
バッジ交換券・光,Light Badge Ticket
エステラの紹介状,Estella's Intro Letter
マジックトンカチ,Magic Hammer
死のカラステング,Death Crow
笹と流線のゆかた,Bamboo Yukata
防具屋グリッチャ,Armor Shop Gritcha
輝く守りの両手剣,Shining Greatsword
蒼穹の守護者たち,Azure Sky Guardians
祈願の神殿の金庫,Gratitemple Safe
聖天のハイヒール,Holy Heaven Heels
ミイラ男の衣装２,Mummy Boy Costume 2
シスター・リリン,Sister Lilin
勇者姫のウィッグ,Hero Princess Wig
異界将軍ギュメイ,Goresby-Purrvis, the Otherworldly
コールドランナー,Polar Peckerel
クリスモスゾンビ,Christmas Zombie
魔元帥ゼルドラド,Marshal Zeldrad
バシっ娘を継ぐ石,The Bazoom Girl's Stone
覚醒リーネコイン,Awakened Renee Coin
こあくまの弓の本,Imp Bow Book
博愛騎士のブーツ,Love Knight Boots
レオパードビキニ,Leopard Bikini
過去からの訪問者,Visitors From the Past
アスバルのベスト,Asbal's Vest
お馬さんが見たい,I Wanna See The Horse
白亜の博物館の塀,Chalk Museum Fence
フラウスショット,Flaus Bow
栄光のローブ・銀,Silver Glory Robe
つままれスラベス,Pinched She-Slime
キツネ猫カプセル,Fox Cat Toy
キャンサークロー,Claws of Cancer
ファンシーカカオ,Fancy Cacao
冥王の大鎌・オノ,Netheraxe
ジーガンフの写真,Jiganf Photo
英雄と少女の物語,Tale of a Hero and Girl
流星メダル引換券,Meteor Medal Voucher
航界船マニュアル,Navigational Ship Manual
バジリスクの石版,Basilisk Tablet
シンプルパーカー,Simple Hoodie
アツアツグラタン,Piping Hot Gratin
ナチュラルベッド,Natural Bed
若武者のすねあて,Young Warrior Boots
レースの観客３１,Race Spectator 31
デスマスの礼服上,Death Master Shirt
カボチャのガゼボ,Pumpkin Gazebo
ウィリーデスピア,Vilide Spear
プラチナメイル下,Platinum Mail Bottom
魚交換員グナクー,Fish Exchange Gunaku
羅刹王バラシュナ,Varashna, the Sinful Spirit
ドラゴンの便せん,Dragon Paper
お姫様ベッド・桃,Pink Princess Bed
リザードマンの書,Mandrake Major Book
六大陸堂の便せん,Six Continents Paper
郵便局員カンココ,Postman Kancoco
バラのスティック,Rose Wand
カイザーアックス,Kaiser Axe
シュメリアブレス,Sumeria Bracelets
お祝いシャワー黄,Celebration (Yellow)
妖精郷の舞踏服上,Faerie Realm Shirt
魚交換員プトゥン,Fish Exchange Putun
念晶錬磨場・上級,Telecrystal Refinery - Advanced
脂たっぷりサバ缶,Canned Fatty Mackerel
モーグリのぼうし,Moogle Hat
案内係ディアマン,Guide Diamond
ブラウニー便せん,Brownie Paper
名探偵の鹿撃ち帽,Sleuth's Deerstalker
レースの観客２８,Race Spectator 28
ひつじのころも上,Sheep Shirt
王都ネクロデア跡,Necrodea Capital Ruins
トポルのロウソク,Topol Candles
サクランボのラグ,Cherry Rug
オーナーの館１階,Owner's Mansion 1F
防砂ダム・展望台,Sand Dam Observatory
ヴェリナード領南,Verinard South
ふぉーまるどれす,Formal Dress
バシルーラの起源,The Origins of Bazoom
おたからの花びら,Iridescent Petal
メンメ式万能パテ,Menme All-Purpose Putty
フルムーンチェア,Full Moon Chair
盆踊りフウラ・庭,Festival Dance Fuura(G)
クロックアッパー,Overclocker
大理石の置き時計,Marble Table Clock
伍の五声は呻の声,Fifth of 5 Voices Moan
みやびな飾り扇子,Elegant Decor Fan
クリスマスのソリ,Christmas Sleigh
ようせいのおでん,Fairy Hot Stick
ヒョウモンダーク,Dark Octopot
フルーツの便せん,Fruit Paper
まほうの盾の秘密,Magic Shield Secret
小さな英雄の肖像,Little Hero Portrait
冷眠室ペコリアＣ,Cryogenics Pekoria C
竜族人形の作り方,Making Nadravian Dolls
ピンモッＴシャツ,Pink Sanguini T-Shirt
ダストンキッチン,Duston Kitchen
エメラルドの花束,Emerald Bouquet
ナスビッＴシャツ,Woebergine T-Shirt
小型魔神機開発部,Small Aztech Development
超便利ツール印章,Companion App Stamps
記憶のパドレア邸,Memory of Padrea Mansion
アークデーモンＢ,Archdemon B
カイザードラゴン,Royal Reptile
氷の領界のベッド,Ice Realm Bed
スラタワー便せん,Slime Stack Paper
ビジューなビキニ,Bijou Bikini
カジュアルブレス,Casual Bracelet
記念大王スライム,Commemorative King Slime
屍鬼王ゾルドゥス,Corpse King Zoldus
グロリアス衣装券,Glorious Outfit Voucher
ギガントモンキー,Gigant Gorilla
預かり所デイスン,Storage Dyson
スウィ～ツランド,Sweetsland
しぐさ書・盆踊り,Emote "Bon Dance"
闇の大魔王アーム,Archfiend's Armlets
グリードイーター,Greed Eater
スチームスーツ上,Steam Suit Top
ブチ太猫カプセル,Fat Spotted Cat Toy
クローバーハット,Clover Hat
レインボーファン,Rainbow Fan
マジカルクラウン,Magical Crown
王国の見張り塔前,Kingdom Watchtower
魔獣調教士ガブラ,Beast Trainer Gabra
王城の悪夢・３階,Nightmare's Castle 3F
預かり所ティリリ,Storage Tiriri
ウェディングくま,Wedding Bear
オーガのあいさつ,Ogre Greeting
ガブリエルのやり,Gabriel's Spear
しぐさ書・スイカ,Emote "Watermelon"
蘇りしラズバーン,Risen Razburn
剥きかけりんご左,Left Peeled Apple
武器防具屋ソロリ,Weapon & Armor Shop Sorori
まよえるえうりこ,Lost Eurico
ふっくらにんにく,Plump Garlic
板張りの大きい壁,Plank Wall L
サイクロンダンス,Cyclone Dance
極天女帝のぼうし,Sky Empress Hat
ゾーマ　ソウリョ,Zoma, Priest
ハッピーチケット,Happy Ticket
ひまわりプリズム,Sunflower Prism
ファントムダガー,Phantom Dagger
紫水晶のバスタブ,Amethyst Bathtub
くさりのあみぐつ,Chain Boots
ザード遺跡の息吹,Breath of Zard Ruins
色見本・アイビー,Color Sample "Ivy"
魔物管理人ニョイ,Monster Manager Nyoi
パピヨンウィング,Papillon Wings
ギュッとルコリア,Lucolia Arm Doll
哀愁のパン耳伝説,Sorrow Bread Legend
キリカ草原への道,Road to Kirika Steppe
リリーコサージュ,Lily Corsage
ジュレー島の木Ｃ,Jule Island Tree C
アズラン宿屋の家,Azlan Inn House
グロリアスズボン,Glorious Pants
黒ねこの便利な壁,Black Cat Wall
ギガデンデロベー,Giga Dendelobe
朽ちた遺跡の宝箱,Ruin Treasure Chest
アリエススタッフ,Aries Staff
2013/1月分クエスト,Quest for 2013/01
闇雷竜のまなざし,Dark Thundragon's Gaze
牡丹文のふりそで,Peony Kimono
はじめてのドレス,My First Dress
ドロくさいこうら,Smelly Shell
妄執のグリンデア,Delusional Grindea
魔王のネックレス,Sock-It Locket
カイトバックラー,Kite Buckler
ラーの鏡くりぬき,Hollow Mirror of Ra
壁かけ武器セット,Weapon Wall Set
あやしいバスタブ,Suspicious Bathtub
お菓子のオーブン,Sweet Oven
ひつじのてぶくろ,Sheep Mitts
ダイバーレギンス,Diver Leggings
プチ暗黒の魔造兵,Frail Dark Golem
しぐさ書・たき火,Emote "Bonfire"
ティプローネ光花,Tiplone Light Flower
メレアーデの部屋,Mereade's Room
アヌビスのアンク,Anubis' Ankh
かんだたみならい,Robbin' 'Ood Amateur
３段ブロック・緑,Green 3-Step Block
ギュッとソーミャ,Somya Arm Doll
かたりべのブーツ,Storyteller's Boots
エテーネのつばさ,Ethene Wing
ピクニック魔勇者,Evil Hero Picnic
ウェディングベル,Wedding Bell
ドラゴンクロー絶,Apex Dragon Claws
宵と暁の伝承の本,Legend of Dusk and Dawn
塔のガーディアン,Tower Guardian
パティシエの帽子,Pastry Chef Hat
猛爆隊長ダイノス,Bomb Captain Dinos
弱酸性の間　入口,Weak Acidity Entry
ふわふわ雲のイス,Fluffy Cloud Chair
もぐらのスコップ,Mischievous Mole Shovel
案内係エムロード,Guide Emerald
奇門遁甲の式・弐,2nd Divination Ceremony
プクリポ風アーチ,Pukulipo-Style Arch
１００億の身代金,10 Billion Ransom
交換屋フォーリィ,Exchange Shop Foley
キャラメルリップ,Caramel Tulip
天界のあるきかた,How to Walk the Heavens
住宅素材屋ツィネ,Housing Materials Zinei
ガートラント兵２,Gartlant Soldier 2
かいぞくウーパー,Salamarauder
ブラックゴースト,Black Ghost Knifefish
ぬい合わせた願い,Stitched Together Wishes
魔宮の守護者たち,Evil Shrine Guardians
白鳥の弓の作り方,How to Make a Swan Bow
ユシュカトランプ,Yushka Cards
獄嵐鬼ウェンリル,Stormkeeper Wenrir
プラコン用編み物,Private Concierge Knitting
ガートラント兵５,Gartlant Soldier 5
チェルシーの写真,Photo of Chelsea
はやぶさの剣の書,Falcon Blade Book
氷のシャンデリア,Ice Chandelier
Ｖロンのラグ・赤,Red Vron Rug
魔天獅ヒッポルコ,Magic Lion Hippolko
ピクニックラウル,Rahul Picnic
黒衣の剣士パドレ,Dark Swordsman Padre
しんごんのじゅず,Rosary
スライム露天風呂,Slime Outdoor Bath
ウェーブアイロン,Wave Iron
えきいんしーどる,Attendant Shidoru
あまつゆの集め方,Collecting Rain and Dew
預かり所イリズヤ,Storage Irizya
怪盗ポイックリン,Phantom Thief Poiclin
暗黒大樹のふもと,Foot of the Dark Tree
せんしあいざっく,Warrior Isaac
あくまのツボ呪文,Demon Pot Spell
便せん屋シロタエ,Stationery Shop Shirotae
灰もふ猫カプセル,Soft Ash Cat Toy
フラワーギフト券,Flower Gift Voucher
デスマスクの破片,Slaughtomask Shard
ごくじょうソルト,Salt of the Earth
野いちごスカート,Wild Strawberry Skirt
獄水鬼ヴァーテル,Waterkeeper Vater
灰ねこの便利な壁,Ash Cat Wall
ダイナートップス,Diner Top
バッジ交換券・銀,Silver Badge Ticket
郵便局員キャロン,Postman Caron
魔衛隊士のかぶと,Demon Guard Helmet
「楽園」の展示室,"Paradise" Exhibit Room
はぐメタルーキー,Rookie Liquid Metal Slime
案内係エリーシェ,Guide Elishe
記憶の帝国技術庁,Memory of Empire Tech Agency
ボロボロのノート,Tattered Notebook
しぐさ書・つまむ,Emote "Picked Up"
紺碧のピラー根本,Azure Pillar Root
ぐんたいガニ・強,Vicious Crabid
やいばのよろい上,Spiked Armor Top
初心者用の片手剣,Beginner's Sword
DQ3賢者女　ゾーマ,DQ3 Sage (F), Zoma
レオーネフェイク,Leone Fake
壱の式修了の陰符,Yin I Completion Charm
おばけヒトデ・強,Vicious Scarfish
フォレストドラゴ,Lumbering Lizard
えきいんぺいんず,Attendant Penzu
フェザープリズム,Feather Prism
パルカラス亡霊王,Ghost King Palkaras
アクロバットの像,Acro Bat Statue
エキサイトアクス,Excite Axe
ふくめんうさぎ１,Masked Rabbit 1
ニンジンリゾット,Carrot Risotto
魔幻都市の便せん,Phantom City Paper
スライムくんたち,Slime monsters
アイゼルトランプ,Eisel Deck
邪竜神の使徒たち,Apostles of the Dragon God
しぐさ書・天灯白,Emote "White Lantern"
ミミックの像・庭,Mimic Statue (G)
ろんぐたきしーど,Long Tuxedo
光の木工刀小の本,Light Slick S Book
お祝いシャワー緑,Celebration (Green)
古強者のよろい下,Veteran's Faulds
パンプキンの衣装,Pumpkin Costume
マーメイドランプ,Mermaid Lamp
使い魔バジリウス,Familiar Basilius
道具屋ポッピーナ,Item Shop Poppina
ルーミリアの家前,Lumeria's House
ちゃばしらこぞう,Tea Candle
神獣パチャティカ,Divine Beast Pachatika
プチデビル衣装券,Petit Devil Voucher
木工素材屋ミヅキ,Woodworking Materials Mizuki
調理職人コック帽,Cook's Hat
辺境警備隊兵士Ａ,Frontier Guard Soldier A
エンゼルスタッフ,Angel Staff
ムニエカの作業台,Munieka Workbench
ジャゴヌバの幻影,Illusion of Jagonuba
メタスラのベッド,Metal Slime Bed
あざやかな笹飾り,Vivid Bamboo Decor
怪蟲の広場の階下,Insect Square Lower Floor
シスターペコリア,Sister Pekoria
壁かけ行灯ランプ,Paper Wall Lantern
まもの使いの前進,Monster Master Growth
第３回フウラの像,3rd Fuura Statue
灰三毛猫カプセル,Ash Calico Cat Toy
ごきげんなぼうし,Happy Hat
ブリキ板張りの壁,Tin Plate Wall
ピンクタイフーン,Pink Typhoon
ダッフルグローブ,Duffel Gloves
フォーリンスター,Fallen Star
コルセアマント上,Corsair Cloak
家具＆庭具おきば,furniture storage
ケセランパセラン,Tufty Tot
ダイバーグローブ,Diver Gloves
カジノオルゴール,Casino Music Box
ミラクルボックス,Miracle Box
デモンズゲイトＡ,Demon Zugei A
シルバーウィング,Silver Wings
ラン錬作業ベスト,Lamp Alchemist's Vest
白亜の博物館の窓,Chalk Museum Window
窓つきの便利な壁,Wall with Window
放送局員ドラビー,Broadcaster DV
春風応援ソックス,Spring Cheer Socks
カレーサタンの像,Curry Imp Statue
第１２回ラウル像,12th Rahul Statue
アクセ屋カーメロ,Accessory Shop Karmelo
マイレージメダル,Mileage Medal
星降りのスカート,Starry Skirt
オノでエキサイト,Excite With an Axe
おすもっこりの像,Sumo Baby Statue
神墟ナドラグラム,Nadragram Shrine
ファイアフォース,Fire Fource
フォーリオンの空,Skies of Fourion
クレセントダガー,Crescent Dagger
はがねの防具図鑑,Steel Armor Book
初期プクリポ男性,Initial Pukulipo Male
おうち用青空天井,Blue Sky Ceiling
しぐさ書・きのこ,Emote "Mushroom"
ジャンボドラキー,Jumbo Dracky
シナイジッチたち,Sinazitch and co.
白霊鬼ボータたち,Bota, the White Spirit and co.
クラウントランプ,Crown Deck
ステューデントＧ,Student G
栄光のローブ・金,Gold Glory Robe
チャージタックル,Charge Tackle
討伐隊員マダラキ,Strike Force Madraki
静かなる湿原地区,Quiet Marshlands
霊剣セレンナイト,Sword of Selenite
転職神官ハクドウ,Vocation Priest Hakudo
刺しゅう入りくつ,Embroidered Shoes
ジュアロとゾデラ,Juaro and Zodera
道具鍛冶作業着上,Toolsmith's Vest
便せん屋ハジカミ,Stationery Shop Hajikami
シックゴスピアス,Chic Goth Earrings
王宮のタンス・青,Blue Royal Wardrobe
ドラグーンアーム,Dragoon Armguards
パーティードレス,Party Dress
天使の弓のレシピ,Angel's Bow Recipe
アンタッチャブル,Untouchable
ウェナベリーの枝,Wenaberry Branch
しぐさ書・キラ星,Emote "Stars"
紫水晶のチェスト,Amethyst Chest
キャラメルの花束,Caramel Bouquet
魔物管理人ツグミ,Monster Manager Tsugumi
ブラバニクイーン,Dark Hare
フラウスブレード,Flaus Blade
ダーティラビッツ,Bad Hare
釣りざお作成入門,Fishing Rod Creation
ビントンの陳情書,Vinton's Petition
その者　釣り老師,The Master of Fishing
童話の街並みの塀,Fairy-Tale Fence
プクリポバスタブ,Pukulipo Bathtub
移動係ディナーラ,Travel Clerk Dinara
おおくちばし・強,Vicious Beakon
お嬢さまのリボン,Lady's Ribbon
防衛軍の制服・緑,Green Defense Force Suit
レオーネの髪飾り,Leone's Hairpin
ヘルガーディアン,Hell's Gatekeeper
おばけトマト軍団,Haunted Tomato Army
ゴールデンコーン,24-Carrot Bunicorn
防具屋アーニャー,Armor Shop Annya
ホイミントブーツ,Heal Mint Boots
ヒストリカの像＋,Historica Statue +
壁かけ鉄のランプ,Iron Wall Lamp
カミルのローブ下,Kamil's Robe Bottom
シナイジッチ教頭,Vice Principal Sinazitch
レースの観客０２,Race Spectator 02
Ｖジャンプの仮面,V Jump Mask
ネヴァンメイル上,Nemain Mail Top
パトローネ調査員,Detective Patrone
マッドフィンガー,Muddy Finger
フェザーマジック,Feather Magic
プクラストランプ,Pukulas Deck
ソポスのころも下,Sophos Robe Bottom
パラディンの伝説,Legend of Paladin
武勲の城の黒障子,Valor Castle Dark Shoji
脱力系クッション,Relaxing Cushion
プラズマスカット,Plasma Cut
デザートランナー,Parched Peckerel
便せん屋メビシェ,Stationery Shop Mebishe
まじんのかなづち,Hela's Hammer
ネタ「かんおけ」,Coffin Trick
猫貴族のスカート,Aristocat Skirt
双月のスティック,Double Moon Wand
歌詠みのころも下,Poet's Attire Bottom
まじないしのくつ,Fizzle-Proof Shoes
ファーラット・強,Vicious Feralball
くさりのあみごて,Chain Bracers
シーサイドランプ,Seaside Lamp
アサシンエミュー,Peckerel
スイーツトロル強,Apex Sweet Troll
復讐の兄弟竜・改,Uber Vengeful Dragons
マーチングコート,Marching Coat
壁かけ管理棟の窓,Admin Building Window
王宮の食器棚・赤,Red Royal Cupboard
ジュレー島の木Ｂ,Jule Island Tree B
ハルファスの紋章,Halphas Crest
やまびこの陣+20秒,Echoing Circle +20s
ガーデンシューズ,Garden Shoes
ツインアンテナＢ,Twin Antenna B
スノーモン観覧車,Sanguini Ferris Wheel
悪霊の仮面の破片,Evil Spirit Mask Shard
しぐさ書・ハート,Emote "Draw a Heart"
サンダーフロッグ,Zaptile
シスター・イオリ,Sister Iori
ボロボロのリボン,Tattered Ribbon
アークデーモンＡ,Archdemon A
悲愴のウィリーデ,Vilide the Pathetic
福笑いのラグ・顔,Fukuwarai Face Rug
もうどくバルーン,Deadly Poison Balloon
スラタワーボディ,Slime Stack Body
サイドヘアリボン,Side Hair Ribbons
モンスターシール,Monster Sticker
グロリアスコート,Glorious Coat
ボロボロの魔神兵,Tattered Demon Soldier
郵便局員ケパルト,Postman Kepart
よろず屋ペピール,General Shop Pepeelu
屋根つき露天風呂,Open-Air Bath
水晶のテーブル小,Crystal Table S
イカ焼きプリズム,Fried Squid Prism
剣魔ジルドラーナ,Jildrana, the Spellsword
フライングスター,Flying Star
氷の領界のアーチ,Ice Realm Arch
星空のタンス・青,Blue Starry Wardrobe
悪夢の追っ手たち,Nightmare Persuers
ランプ錬金職人帽,Lamp Alchemist's Hat
ルージュアックス,Rouge Rhino Axe
壁かけ聖天舎の窓,Monastery Window
サジェぬいぐるみ,Sajay Plushie
オス三毛猫スーツ,Calico Cat Suit (M)
ビッグブレードⅡ,Broader Sword
臨時大使ツーウィ,Temp Ambassador Tsui
手編みのシューズ,Hand-Knit Boots
清涼スイムワンピ,Cool Swim Dress
パクレ警部の現実,Inspector Pakul's Facts
古とこしえの神殿,Ancient Temple of Eternity
ローズフォーム上,Rose Form Top
トラップジャマー,Trap Jammer
マジカルチケット,Magical Ticket
和風の５色ランプ,Japanese 5 Color Lamp
壁画管理ペコリア,Mural Management Pekoria
あるある川柳・金,Haiku Gold
シスター・ネリー,Sister Nelly
ウリボーカプセル,Wild Boar Toy
ネタ「だいこん」,Radish Trick
限定交換屋ポタン,Limited Exchange Shop Potan
お祝いクラッカー,Celebration Popper
ファラオ・ナジャ,Pharaoh Naja
クイーンスライム,Queen Slime
餅つきジャーミィ,Mochi-Pounding Jammy
ファンキードラゴ,Hiptile
ラガのタリスマン,Raga's Talisman
素材屋のぼうし紅,Red Material Shop Cap
預かり所トゥーブ,Storage Toube
魔の試練・第２層,Demon Trials - L2
しなびた花の写真,Wilted Flower Photo
ドラポヨモニター,Tubby Dracky Monitor
デリシャスオイル,Delicious Oil
トリットアーチズ,Trit Arches
スライムショット,Slime Shot
ふわふわタツノコ,Floaty Seahorse
キラーなピッケル,Maniacal Mole Pickaxe
郵便配達人バイグ,Mailman Baigu
ゴードンハンマー,Mega Moai Hammer
預かり侍女アトリ,Storage Maid Atori
カミハルムイ領南,Kamiharmui South
グロスナー王の剣,King Grossner's Sword
アビスセーラー上,Abyss Shirt
レースの観客１５,Race Spectator 15
ファントムブーツ,Phantom Boots
マーメイドハープ,Lorelei's Harp
希少な水晶の伝承,Rare Crystal Folklore
住宅素材屋ツイナ,Housing Materials Tuina
ぱてぃきょうだい,Sibling Patti
3rdキョウダイフク,3rd Brother Clothes
ふかみどりダリア,Dark Green Dahlia
悪霊の神々練習札,Evil Trinity Tag
ギュッとコッコー,Chicken Arm Doll
バルディスタ弓兵,Valdista Archer
オーロラパウダー,Aurora Powder
ラブリークッキー,Lovely Cookies
壁かけお正月飾り,New Year Wall Decor
夏のお祭りアーチ,Summer Festival Arch
ウェイトブレイク,Weight Break
黒レザーのベッド,Black Leather Bed
魚交換員プルンパ,Fish Exchange Purunpa
カージナルテトラ,Cardinal Tetra
ゴールドシャワー,Gold Rush
究明者のグローブ,Research Gloves
