お魚と夏野菜の雑炊,Fish and Vegetable Dish
捨てられた城への道,Road to Abandoned Castle
ロードリーローブ下,Lordly Robe Bottom
くろがねのよろい上,Darksteel Cuirass
ギュッとレグナード,Regnad Arm Doll
まけんしのレイピア,Fizzle Foil
シスター・ファンナ,Sister Fanna
ＤＱＸ１０周年花火,DQX 10th Anni. Firework
キョンシーゴースト,Jiangshi Ghost
オブジェクト座標137,Object Coordinates 137
ハスの花ランプ・緑,Green Lotus Lamp
飛竜のベストセット,Flying Dragon Outfit
砂塵の幻馬プリズム,Phantom Horse Prism
まおうの錬金ランプ,Demon King Alch Lamp
フォンデュの像・庭,Fromage Fray Statue (G)
クマリスぬいぐるみ,Kumaris Plushie
ウェディング便せん,Wedding Paper
グレゴールの洞くつ,Gregor Cavern
ミストグレーの花束,Mist Gray Bouquet
花狩人の衣装券・赤,Red Flower Hunter Tkt
チョッピ荒野の木Ａ,Choppi Wilderness TreeA
運動会・白組衣装券,White Team Uniform Tkt
エンシェントワンド,Olde-Worlde Staffe
ピュアブルーダリア,Pure Blue Dahlia
まじないしローブ上,Fizzle-Proof Shirt
アジサイ姫ゆかた下,Hydrangea Yukata Bottom
超天遊戯－弐の書－,Chosen's Teachings Book 2
実装テストアトラス,Implementation Test Atlas
オブジェクト座標159,Object Coordinates 159
ゴルフレディウェア,Golf Women's Wear
たつじんのオノの本,Pro's Axe Book
グレースギフト・緑,Green Grace Gift
お姫様の食器棚・橙,Princess Cupboard
Ｖロンのタンス・赤,Red Vron Wardrobe
イグナイトグローブ,Ignite Gloves
マーチングキャップ,Marching Cap
イナミノ街道の木Ｂ,Inamino Highway Tree B
とこしえの神殿広間,Temple of Eternity Hall
スキマスぬいぐるみ,Skimas Plushie
辺境の雪山への出口,Exit to Snowy Mountain
ポップスターの服下,Pop Star Skirt
新春ドラキーアーチ,New Year Dracky Arch
第１２回セラフィ像,12th Seraphi Statue
ハロウィン衣装券Ⅳ,Halloween Costume Tkt Ⅳ
Ｎ高女子のスカート,N High Girl's Skirt
古代武器図説・杖編,Book of Ancient Staves
オスクトルグローブ,Oscutor Gloves
雪だるまスライダー,Snowman Slide
オブジェクト座標087,Object Coordinates 087
Ｖロンのベッド・赤,Red Vron Bed
学園女子のエプロン,Schoolgirl Apron
すごろく景品係ミミ,Sugoroku Prize Clerk Mimi
黄金の秘宝を探して,In Search of Gold Treasure
タイフーンゴーグル,Typhoon Goggles
学園の生徒会室の棚,School Council Shelf
銀のさいほう針の本,Silver Sew Needle Book
ゼドラ王国服モブ２,Zedra Royal Clothes Mob 2
ヴァレリアへの親書,Official Letter to Valeria
ヒューザのこころ４,Hyuza's Heart Lv. 4
蘇りし冥王ネルゲル,Risen Netherlord Nergel
ポーズ書・キュート,Pose "Cute"
おまじない師プポペ,Charmer Pupope
うぉークンカプセル,War Pet Toy
ユーライザウィッグ,Yuliza Wig
パールリボンピアス,Pearl Ribbon Earrings
プリマベーラシール,Primavera Sticker
オブジェクト座標080,Object Coordinates 080
エンタシスマンの書,Prancing Pillar Book
キラーマジンガの剣,Uberkilling Sword
お祭りの天井ランプ,Festival Ceiling Lamp
リンベリィトランプ,Linberry Cards
サボテンダーコイン,Cactuar Coin
バザールを護るもの,Protecting the Bazaar
スターリースタッフ,Starry Staff
支援魔神機０２１号,Aztech Support Mech No. 021
パピヨンチェア・夢,Dream Papillon Chair
コンシェルジュ０９,Concierge 09
ウィリーデブレード,Wilide Blade
おしゃれな水着・桃,Pink Snazzy Swimsuit
ハクオウのこころ４,Hakuo's Heart Lv. 4
ライトニングソード,Thunderstorm Sword
ゆらゆら牛さん・黄,Yellow Rocking Ox
アズラン大浴場の棚,Azlan Bathhouse Shelf
男子のスクール制服,Boy School Uniform
袋入りプーちゃん帽,Pu-chan Bag Hat
オブジェクト座標116,Object Coordinates 116
王宮のキッチン・青,Blue Royal Kitchen
プチＳグレネーどり,Frail Bombird S
キングスライムの盾,King Slime Shield
オブジェクト座標215,Object Coordinates 215
ゴールデンディスコ,Golden Disco
オバケのかぶりもの,Ghost Hood
トーテムと私の日常,My Totem Daily
ピンクモーモンラグ,Pink Sanguini Rug
奇跡の錬金ランプ小,Miracle Alch Lamp S
ポセイドンテーブル,Poseidon Table
アクセ購買員ククス,Accessory Buyer Kook
防衛魔神兵０５７号,Aztech Guard No. 057
パピヨンソファ・幻,Phantom Papillon Sofa
マジカルスティック,Pixie Stick
月明かりの谷への道,Road to Moonlit Valley
バトエンをかかげる,Raise Battle Pencil
模様入りしっくい壁,Pattern Plaster Wall
お祝い１０連発花火,10 Celebratory Fworks
マスターを目指す者,One Who Aims to be Master
プラコン用丸メガネ,Small Round Glasses
エゼソル峡谷の木Ｃ,Ezesol Canyon Tree C
ゴールドマンＸ３号,Gold Golem X 3
てつのよろいセット,Iron Armor Set
持ち主不明のチョコ,Unclaimed Chocolate
ルティアナの守護符,Lutiana's Protection
ダズの岩穴・大空洞,Daz Grotto - Caverns
プレートインパクト,Plate Impact
アームライオン・強,Vicious Hellion
ドラゴンキラーの本,Dragonsbane Book
プラチナクローの本,Platinum Claws Book
アカシックウィング,Void Wing
パラディンのお仕事,Paladin's Work
空飛ぶ円盤プリズム,Flying Saucer Prism
ギュメイ将軍カード,Goresby-Purrvis Card
ウサギ魔物の装束下,Rabbit Monster Skirt
氷の領界の氷ソファ,Ice Realm Sofa
オブジェクト座標053,Object Coordinates 053
暗黒の魔人強カード,Apex Ruin Card
オブジェクト座標168,Object Coordinates 168
レンタルドルボード,Rental Dolboard
ティプローネ青紫花,Blue Tiplone Flower
マイタウン湿原地区,My Town Marsh District
ハートの兵隊の服上,Heart Soldier Coat
プリズニャンぐるみ,Jailcat Plushie
壁かけマイユ肖像画,Maille Portrait
森のこびとのベッド,Forest Dwarf Bed
おうち用野道のラグ,Field Path Rug
精霊王のクローク上,Faerie King Cloak
プチデビルグローブ,Petit Devil Gloves
死霊姫ヤサギリたち,Dead Princess Yasagil
南国の釣りざお・氷,Ice Tropic Fishing Rod
ゴールドマンＸ１号,Gold Golem X 1
超天遊戯－死の書－,Chosen's Teachings Book 4
しぐさ書・とまどう,Emote "Bewildered"
オブジェクト座標234,Object Coordinates 234
マジカルじんべい下,Magical Jinbei Bottom
三姉妹人形・家用桃,Pink 3 Sisters Doll
トレジャーコート下,Treasure Coat Bottom
打ち上げ柳花火・紫,Purple Willow Firework
アイスダンスズボン,Ice Dance Pants
異国の寺院の庭用床,Exotic Temple Floor (G)
パッチ柄ベッド・青,Blue Patch Bed
キラージャグリング,Have a Ball
ベジセルク・サーガ,Cucumberserk Saga
キラキラねこまどう,Glittering Meowgician
レインスカート・白,White Rain Skirt
ハートの食器棚・黄,Yellow Heart Cupboard
郵便局員ジェノール,Postman Gennault
スライムナイト帽子,Slime Knight Hat
赤熱の荒野への出口,Exit to Red Hot Desert
古代ウルベア魔神兵,Ancient Urbea Aztech
万魔の大紋章の破片,Banma Sigil Shard
ヴァルハラグリーブ,Valhalla Greaves
罪深きバラのように,Like a Sinful Rose
わかめをたたえよ！,Praise the Seaweed!
シエラ巡礼地への道,Road to Sierra Shrinelands
深海にうごめくもの,Deep Sea Lurker
灰キツネ猫カプセル,Ash Fox Cat Toy
モダンバニーのくつ,Modern Bunny Shoes
ガーディアンサラダ,Guardian Salad
エルガドーラの部屋,Elgadora's Room
ゴールドモンスター,Gold Monster
作ろう！てつよろい,Let's Make Iron Armor!
ユシュカのこころ６,Yushka's Heart Lv. 6
歪曲性超空間論・下,Distorted Space Vol. 2
ナイトメアファング,Nightmare Fang
魔物管理侍女マトリ,Monster Maid Matori
ドレスアップ無料券,Free Dress-Up Ticket
ゲフェンダイトの袋,Gefendite Sack
グリーターデーモン,Greeter Daemon
ウサぐるみ衣装券Ⅱ,Rabbit Costume Ticket Ⅱ
デルクロアの研究室,Delcroix's Laboratory
ガード時50%で早詠み,Cast Speed Up On Block 50%
森林警備隊の制服下,Forest Ranger Pants
警備魔神兵０４２号,Aztech Guard No. 042
三毛猫スーツ衣装券,Calico Cat Suit Ticket
オーガＧＰプリズム,Ogre GP Prism
２人のクライアント,Two Clients
ドラキーの写真立て,Dracky Frame
しぐさ書・ブレイク,Emote "Break"
庭用ハロウィンの墓,Halloween Tombstone (G)
オブジェクト座標264,Object Coordinates 264
りゅうおうアックス,Dragonlord Axe
バトルステーキ・小,Small Battle Steak
グランゼドーラの母,Mother of Gran Zedora
呪文のためのナイフ,Knife for Spells
オブジェクト座標010,Object Coordinates 010
オブジェクト座標127,Object Coordinates 127
ゼニスの封宮　入口,Palace of Zenith Entry
お祭りやぐら館の塀,Festival Fence
オブジェクト座標136,Object Coordinates 136
ソルシエールの服下,Sorciere's Bottoms
シスター・カナーテ,Sister Canate
夏の恋は泡のごとく,Summer Love, Like a Bubble
プチグラコスカード,Frail Gracos Card
中型の四角い水そう,Square Aquarium M
ドワーフの人形・女,Dwarf Doll (F)
オブジェクト座標111,Object Coordinates 111
起源将ジェルザーク,Gelzark, General of Origin
ゆらゆら羊さん・紫,Purple Rocking Sheep
第１０回エルジュ像,10th Erju Statue
アルウェーン管理棟,Alweyn Admin Building
デビルアーマーの書,Harmour Book
クロッシュシューズ,Bell Shoes
求めるは仙者の霊薬,Seeking a Hermit's Remedy
蒼穹兵団のよろい下,Azure Corps Leggings
ゼクレス城・宝物庫,Zechres Castle - Treasury
ホワイトキュロット,White Culottes
黄金のペンプリズム,Golden Pen Prism
ソルシエールハット,Sorciere's Hat
クルクルポシェット,Bag o' Books
サマーソルトクロー,Somersault Claw
アシュレイの髪飾り,Ashley's Hairpin
つりしのいしょうⅡ,Angler's Costume Ⅱ
キューブライト・庭,Cube Light (G)
聖地パサラン団子山,Sacred Pasaran Dango Mountain
蝶とレースの便せん,Butterfly & Lace Paper
導きの風に技閃きて,Flash in the Guiding Wind
僧兵のころもセット,Monk Warrior Outfit
ウェディングドレス,Wedding Dress
王都カミハルムイ南,Royal City Kamiharmui S.
ビクトリーチップ青,Blue Victory Chip
プリズニャンコタツ,Jailcat Kotatsu
イブニンググローブ,Evening Gloves
レプリカード発行証,Replicard Proof
蘇生時早詠みと祈り,Casting & Healing Savior
転生の花（つぼみ）,Rebirth Flower (Bud)
ナチュラル吊り照明,Natural Hanging Light
ルネッサンステッキ,Renaissance Wand
てつのさそり浮き輪,Iron Scorpion Floatie
あたまリボン水色券,Blue Head Ribbon Ticket
オブジェクト座標171,Object Coordinates 171
ふわふわふうせん青,Floating Blue Balloon
オブジェクト座標093,Object Coordinates 093
純真天使のドレス上,Pure Angel Dress Top
コンシェルジュ１３,Concierge 13
悪夢より来たるもの,The One From Nightmares
青い翼のペンダント,Blue Wing Pendant
アカツキショウグン,Mandrake Murderer
ホーローの研究成果,Hollow's Research Results
ハート兵隊スカート,Heart Soldier Skirt
ウェディの人形・男,Weddie Doll (M)
スチームカウンタ大,Steam Counter L
カルベローナの記録,Sorceria's Records
レンタル花がら水着,Rental Floral Swimwear
ガメゴンレジェンド,Wonder Wyrtle
レインボーリキッド,Rainbow Liquid
オブジェクト座標276,Object Coordinates 276
おひさまのぬくもり,Warmth of the Sun
ランプ錬金のうでわ,Lamp Alchemist's Cuffs
ゼクレス王のマント,Zechres King's Mantle
光飾りタイルのイス,Light Tile Chair
手作りからあげ弁当,Homemade Fried Bento
しょうにんやっちぇ,Merchant Yatche
モザイクガラスの壁,Mosaic Glass Wall
スカーレットナイト,Scarlet Knight
上級・ＭＰ錬金の本,Advanced MP
メロディアスーツ上,Melody Suit Top
踊り神ボニータ左羽,Dance God Bonita Left Wing
ドルボードの残がい,Dolboard Remains
スライムベスピアス,She-Slime Earrings
ハートの兵隊の服下,Heart Soldier Pants
冥氷竜ジェロドーラ,Jerodora, Icy Dark Dragon
ミラージュウィング,Mirage Wings
ブラッドメイジたち,Blood Mages
千輪菊花火・赤黄桃,Red/Yel./Pink Fireworks
若武者の甲冑セット,Young Warrior Armor Set
セイクリッドソード,Sacred Sword
はやぶさの剣改の書,Uber Falcon Blade Book
蒼天のソウラ便せん,Souten no Soura Paper
結界の守護者練習札,Barrier Guardians Tag
メス三毛猫スーツⅠ,Calico Cat Suit (F) Ⅰ
みちびきのプチ香水,Guidance Perfume S
プラチナフライパ小,Platinum Fry Pan S
ダルメシアンのくつ,Dalmatian Shoes
武器防具屋マシスタ,Weapon & Armor Shop Masista
ウサぐるみ・ピンク,Pink Rabbit
お姫様のタンス・橙,Princess Wardrobe
祭具・七夕の剣絵巻,Festival Sword Scroll
真夏のビーチ便せん,Midsummer Beach Paper
ケーキショーケース,Cake Showcase
とある老行者の試練,Trials of an Old Pilgrim
猛る槌矛のガイオウ,Gaiou, Hammer and Pike
童話の街並みの街灯,Fairy-Tale Lamppost
おぞましき呪いの絵,Dreadful Cursed Drawing
ナイトマリーのタネ,Night Marie Seed
ウルタのピアスの箱,Ulta Earrings Box
ウェスタンレイピア,Western Rapier
陰陽博士のてぶくろ,Ying-Yang Gloves
第５回釣りコン・銅,5th Fish Contest Bronze
スライムのチェスト,Slime Chest
すごろく案内係アミ,Sugoroku Guide Amy
真・幻界諸侯練習札,True Dread Fiends Tag
スターダムシューズ,Stardom Shoes
竜将のよろいセット,Dragon General Armor Set
ドワーフカウンタ大,Dwarf Counter L
ネオンフラッシュ黄,Neon Flash (Yellow)
キャロル姫ゆかた上,Carol Yukata Top
おいしい料理セット,Delicious Meal Set
ふわふわサメバーン,Fluffy Sharkburn
とある天使の罪と罰,Sins of a Certain Angel
取りよせ商ポルルプ,Collection Merchant Porrup
ジア・ルミナのコア,Dia Lumina Core
メタスラのチェスト,Metal Slime Chest
植物学者の実験植物,Botanist Test Plants
破天の防具鍛冶職人,Sky Shattering Armorsmith
オブジェクト座標108,Object Coordinates 108
せんすいふくえーる,Cheer Diving Suit
王国の悪夢・洞くつ,Kingdom of Terror - Cave
ミミックぬいぐるみ,Mimic Plushie
第８回ナジーンの像,8th Nazine Statue
ヴァリースタジアム,Valley Stadium
ディープギアマスク,Deep Gear Mask
こあくまのネイル術,Infernails Technique
メタルたちきりバチ,Metal Buzzbee
ローラ姫のてぶくろ,Gwaelin's Gloves
強・タロットメダル,Apex Tarot Medal
レーナム緑野への道,Road to Lenam Fields
タイタス号の伝声管,Titus Voice Pipe
赤バラのドレッサー,Red Rose Vanity
オパールのオーブン,Opal Oven
かぜのマントセット,Wind Outfit
ネオンフラッシュ緑,Neon Flash (Green)
りゅうおうハンマー,Dragonlord Hammer
英雄はすべてを救う,A Hero Saves All
タコメットの釣り傘,Octopot Umbrella
ブラッドヒストリー,Barbarous History
パッチ柄ベッド・桃,Pink Patch Bed
魔法使いの服セット,Mage Outfit
銅のフェザーチップ,Copper Feather Chip
野いちごボンネット,Wild Strawberry Bonnet
第９回ユシュカの像,9th Yushka Statue
プラズマリムーバー,Plasma Remover
ニブルヘイム・サガ,Nibelheim Saga
極天女帝のサンダル,Sky Empress Sandals
星花火モビール・庭,Star Fworks Mobile (G)
ピッカピカのレンズ,Sparkling Lens
ゼドラ王国服モブ１,Zedra Royal Clothes Mob 1
異国のレンガ館の壁,Exotic Brick Wall
コーヒーカップ・黄,Yellow Coffee Set
花狩人のころも・紫,Purple Flower Hunter Outfit
おしゃれな水着・赤,Red Snazzy Swimsuit
オルッパ地下洞くつ,Orppa Underground Caves
踊魔の霊符・花嫁翠,Green Dancer Charm
大いなる危機の胎動,Great Crisis in Motion
第８回パドレの像庭,8th Padre Statue (G)
スタジアムキャップ,Stadium Cap
水の領界の室内噴水,Water Realm Fountain
見習い自由人の覚悟,Ready for Free Apprentice
ヒッチハイクデビル,Hitchhike Devil
スライムエネルゴン,Energon Slime
オスクトルクラウン,Oscutor Crown
第１１回プクラス像,11th Pukulas Statue
スチームテーブル小,Steam Table S
オブジェクト座標143,Object Coordinates 143
エリュテイアのオノ,Erytheia's Axe
究極邪教司祭メダル,Ultimate Aamon Medal
黒衣の剣士グローブ,Dark Swordsman Gloves
シルエット・犬・白,White Silhouette Dog
カラフル花火台・青,Blue Fireworks Stand
バルディスタ遊撃兵,Valdista Attack Soldier
コーヒーカップ・緑,Green Coffee Set
オーブンの古い写真,Old Oven Photograph
ハンマー屋トカチャ,Hammer Shop Tokacha
ピカレスクグローブ,Picaresque Gloves
オブジェクト座標008,Object Coordinates 008
第９回ナジーンの像,9th Nazine Statue
ほこらの祭祀場・炎,Flame Shrine Ritual Ground
アンドレアルメダル,Rashaverak Medal
オブジェクト座標088,Object Coordinates 088
入団！　カンダタ団,I'm In! Robbin' 'Ood Gang
ゴールデンライト緑,Golden Light (Green)
クマリスのブラウス,Kumaris' Blouse
かっぱえび家の帽子,Shrimp Snack Hat
ヒューザのこころ９,Hyuza's Heart Lv. 9
大怪傑の装束セット,Great Wonder Outfit
しっくいと和紙の壁,Plaster & Paper Wall
ゼニスの封宮　出口,Palace of Zenith Exit
花狩人の衣装券・青,Blue Flower Hunter Tkt
花狩人のころも・黄,Yellow Flower Hunter Outfit
オブジェクト座標173,Object Coordinates 173
プラコン風呂用衣装,Bath Outfit
ソノラのダークネス,Sonora's Darkness
始源の歌姫のドレス,First Diva's Dress
お魚のパーカー水着,Fish Hoodie Swimsuit
プラチナ鍛冶ハン小,Platinum Smith Hammer S
オブジェクト座標282,Object Coordinates 282
なげきムーングラス,Mourning Moon Glasses
夢のスティック物語,Fantastick Story
超ようせいのひだね,Super Lamplight
プラコンぐるみ・黒,Black Clothing
オブジェクト座標140,Object Coordinates 140
取りよせ商チャガナ,Collection Merchant Chagana
エステラのこころ２,Estella's Heart Lv. 2
ヴィーラのサンダル,Vila's Sandals
うつしよの金箱・改,Worldly Gold Box v2
ピクニックラグアス,Raguas Picnic
特別郵便局員レチカ,Special Postman Lechika
魔物ブルーメット券,Blue Helmet Ticket
サンセットスズラン,Sunset Lily
第４回釣りコン・銀,4th Fish Contest Silver
バズズのぬいぐるみ,Pazuzu Plushie
メロディアグローブ,Melody Gloves
アンノウンアックス,Unknown Axe
王国軍司令部の防具,Royal Army Armor
第５回釣りコン・銀,5th Fish Contest Silver
シングルアンテナＢ,Single Antenna B
スライム強スリッパ,Vicious Slime Slippers
イカしたＴシャツ桃,Pink Cool T-Shirt
天宮騎士のよろい下,Sky Knight Bottom
かいふくクリスタル,Recovery Crystal
プラコン女ミイラ服,Women's Mummy Costume
スパイスカレー・小,Small Spicy Curry
タイフーンレザー上,Typhoon Leather Shirt
天の冒険者のグラブ,Divine Traveler Grips
ビクトリーチップ黄,Yellow Victory Chip
シスター・メアリス,Sister Maris
魔想念スコルパイド,Demonic Thought Scorpide
光の錬金ランプの本,Light Alch Lamp Book
アクアマリンマリー,Aqua Marie
ふっかふかマフラー,Soft Scarf
オブジェクト座標268,Object Coordinates 268
サーマリ高原の木Ｂ,Samary Plateau Tree B
シスター・ヒーディ,Sister Heedy
メロディアトップス,Melody Top
ドラゴンスティック,Wyvern Wand
壁かけＤＱⅩⅠの絵,DQⅩⅠ Painting
灰三毛太猫カプセル,Fat Ash Calico Cat Toy
竜族人形女のライト,Nadravian Doll Light(F)
あかつきのメダイユ,Daybreak Medaille
歓迎会用テーブル２,Table for Welcome Party 2
バルディスタ突撃兵,Valdista Assault Soldier
行動時20%バイシオン,Oomph On Action 20%
ドワーフテーブル大,Dwarf Table L
商人トルネコの依頼,Merchant Torneko's Request
オブジェクト座標132,Object Coordinates 132
ケミカルポップ鏡台,Chemical Pop Vanity
あくま神官の像・庭,Wrecktor Statue (G)
会場案内係ファリネ,Venue Guide Farine
水没遺跡地区への道,Road to Submerged Ruins
お花畑に行きたい！,Go to the Flower Field!
ライダージャケット,Rider Jacket
ホーリーキャンディ,Holy Lollipop
バズスイーツカフェ,Pazu Sweets Cafe
庭用金平糖ライト虹,Rainbow Candy Light (G)
炎の領界の植物・小,Fire Realm Plant S
降魔のよろいセット,Demonfel Armor Set
防衛魔神兵０５９号,Aztech Guard No. 059
うつしよの銀箱・改,Worldly Silver Box v2
キラークリムソード,Crimson Killing Sword
シール少年マツタケ,Sticker Boy Matsutake
オルセコ高地への道,Road to Orseco Highlands
英雄の武勲を探して,Looking for Hero's Service
マジカルギフト・黄,Yellow Magical Gift
ヤドリギ広場　出口,Mistletoe Plaza Exit
カボチャカウンタ大,Pumpkin Counter L
しぐさ書・線香花火,Emote "Sparkler"
扉つきアーチ型の壁,Arched Wall with Door
ミスター・シャウト,Hell Raizer
第３回カジノ祭・金,3rd Casino Fest Gold
しぐさ書・ごきげん,Emote "Cheery"
ベビタン竜族人形女,Imp Nadravian Doll (F)
エンシェントクロー,Olde-Worlde Clawse
ドワーフ作業ぼうし,Dwarf Work Hat
オブジェクト座標038,Object Coordinates 038
エンパイアブレード,Legate's Blade
ガタラ原野への出口,Exit to Gatara Fields
オブジェクト座標219,Object Coordinates 219
黄赤チューリップ傘,Red/Ylw. Tulip Umbrella
サーカスハウスの柱,Circus House Pillar
万魔の塔・二の災壇,Banma Tower - 2nd Platform
四季の壁画つき浴槽,Four Seasons Bathtub
ゴージャスクッキー,Gorgeous Cookies
壁かけキルギルの絵,Kirgyl Portrait
エンタシスマン・強,Vicious Prancing Pillar
裏ショコラチケット,Chocolate Ticket Back
ビビッド・グリーン,Vivid Green
悪夢のヤドリギ広場,Mistltoe Plaza of Nightmares
笹と流線じんべい上,Bamboo Jinbei Top
チョコレートのラグ,Chocolate Rug
オブジェクト座標226,Object Coordinates 226
はいくらすいしょう,High Class Outfit
壁かけラウル肖像画,Raul Portrait
小さな英雄のブーツ,Little Hero's Boots
キューキョクＶロン,Ultimate Vron
踊り神ボニータ右羽,Dance God Bonita Right Wing
タウン案内係ポポコ,Town Guide Popoko
カブリオレプリズム,Cabriolet Prism
エステラのこころ９,Estella's Heart Lv. 9
背離する魔幻の血統,Separation Phantom Family
ドミネウス邸のラグ,Domineus Mansion Rug
赤のキーエンブレム,Red Key Emblem
紅蓮のフランベリー,Bright Red Flanberry
ミネアのオルゴール,Meena Music Box
筋肉伝道師キタエル,Muscle Evangelist Trayne
第２回釣りコン・銀,2nd Fish Contest Silver
勇者と盟友の肖像画,Hero and Ally Portrait
エレメンレッドたち,The Glows
しぐさ書・もうそう,Emote "Swoon"
オブジェクト座標009,Object Coordinates 009
オブジェクト座標202,Object Coordinates 202
ヴァンガード冒険譚,Vanguard Adventure Tale
カラフル風船・紫桃,Purple & Pink Balloons
予言者学園女学生靴,Prophet School Shoes(F)
プラコンドレス・橙,Orange Dress
タイタス号の望遠鏡,Titus Telescope
ＤＱＸ５周年の御旗,DQX 5th Anniv. Flag
しょうじょたんてい,Girl Sleuth
フューチャーブーツ,Future Boots
しぐさ書・ネオン緑,Emote "Neon Green"
ふわふわホミロット,Fluffy Healix
エステラのこころ５,Estella's Heart Lv. 5
モモリオンの日記帳,Sanguini King's Diary
ムニエカ地方への道,Road to Munieka Region
邪竜教祖オルストフ,Orstov the Wicked
おもちゃのトンネル,Toy Tunnel
第９回ラウルの像庭,9th Raul Statue (G)
洗たくカゴのベッド,Laundry Basket Bed
魔物管理人マビシア,Monster Manager Mabicia
しぐさ書・ペンペン,Emote "Spank"
ゼドラ王国服モブ８,Zedra Royal Clothes Mob 8
チームゆく年くる年,Team New Year
ワンダラーズマント,Wanderers Mantle
ベラストル家の呪符,Belastre Amulet
マスク・ド・ブギー,Mask de Boogie
シックゴスグローブ,Chic Goth Gloves
第３回釣りコン・銅,3rd Fish Contest Bronze
しぐさ書・桜の魔法,Emote "C Blossom Magic"
三毛猫・双カプセル,Calico Cat Twin Toy
イチゴヤドクガエル,Strawberry Poison Frog
青の巨人ブルメル強,Apex Blue Giant Blumel
ももんじゃプリズム,Platypunk Prism
ヒストリカＴシャツ,Historica T-Shirt
コンシェルジュ０１,Concierge 01
スピリットフレイム,Spirit Flame
ウェディテーブル大,Weddie Table L
オブジェクト座標154,Object Coordinates 154
か弱きスライムたち,Feeble Slime and co.
模様入りしっくい柱,Pattern Plaster Pillar
古代オルセコの祭壇,Old Orseco Altar
ホーリークリスタル,Holy Crystal
ゴルゴンザカプセル,Gorgonza Toy
レクタリスのうでわ,Lectalis' Bangles
第１１回セラフィ像,11th Seraphi Statue
