しぐさ書・パンフ２,Emote "Pamphlet 2"
ユシュカのこころ７,Yushka's Heart Lv7
空飛ぶ円盤プリズム,Flying Saucer Prism
しぐさ書・ひらめく,Emote "Inspire"
ファフニルメイル上,Fafnir Mail Top
オブジェクト座標288,Object Coordinates 288
オブジェクト座標028,Object Coordinates 028
グローリーアックス,Great Axe
オオサンショウウオ,Giant Salamander
陰陽博士のころも上,Yin-Yang Robe
幻界の四諸侯カード,Dread Fiends Card
えんじぇるいしょう,Angel Costume
バスルームのチェア,Bathroom Chair
生と死の重なるとき,Life and Death Overlap
打ち上げ柳花火・赤,Red Willow Firework
偽りのレンダーシア,False Lendersia
プクリポのいいくつ,Pukulipo Fine Shoes
若手芸人のながぐつ,Young Talent Boots
おしゃれな水着・黄,Yellow Snazzy Swimsuit
錬金悪魔の言い伝え,Alchemy Demon Lore
シンプルモダンラグ,Simple Modern Rug
オブジェクト座標124,Object Coordinates 124
メレアーデのリボン,Mereade Ribbon
ディバインメイル上,Divine Mail Top
魔法使いの服セット,Mage Outfit
カーニバルコーデⅠ,Carnival Outfit Ⅰ
古代祭具としての鏡,Ancient Mirrorcles
聖地パサラン団子山,Sacred Pasaran Dango Mountain
錬金術は時を超えて,Alchemy Transcends Time
天使のタペストリー,Angel Tapestry
武器防具屋ランギー,Weapon & Armor Shop Langie
レモンスライムの柱,Lemon Slime Pillar
ポイズントリル・強,Vicious Poison Trill
アイドル握手会会場,Idol Handshake Venue
くろがねのよろい下,Darksteel Faulds
キラパン白プリズム,White Sabrecat Prism
茶キツネ猫カプセル,Tea Fox Cat Toy
マジカルな便利な壁,Magical Wall
だんせいしつじふく,Butler Uniform (M)
キングヒドラ練習札,King Hydra Tag
闇夜の巨人カプセル,Dark Night Giant Toy
灰ブチ太猫カプセル,Fat Ash Spotted Cat Toy
真夏のビーチ便せん,Midsummer Beach Paper
プンスコのソファー,Punsuko's Sofa
空が紅く染まるとき,When the Sky Turns Red
とこしえのゆりかご,Eternal Cradle
ゆめにゅうどうの枕,Napir's Pillow
オブジェクト座標144,Object Coordinates 144
暁天竜ランビリズマ,Lanbelysma, Dragon of Dawn
マスター・ポーリア,Guildmaster Paulia
きりさきピエロ・強,Vicious Prickly Prankster
弱体お願いします！,Please weaken!
アッシュホーンの束,Mandrake Horn Bundle
第９回討伐ＴＡ・金,9th Boss TA Gold
黒柴モダンカプセル,Hip Black Shiba Toy
ゼクレスのテーブル,Zechres Table
ハロウィン衣装券Ⅶ,Halloween Voucher Ⅶ
自動生成ダンジョン,Auto-Generated Dungeons
ネコ姫のドレッサー,Cat Princess Vanity
ラン錬作業トップス,Lamp Alchemist's Top
スカウトローブーツ,Scout Robes
イグナイトグローブ,Ignite Gloves
邪蒼鎧デルメゼの像,Delmeze Statue
プラコンゴーレム服,Golem Costume
紫水晶のテーブル小,Amethyst Table S
オブジェクト座標055,Object Coordinates 055
オブジェクト座標137,Object Coordinates 137
魔衛隊士のよろい下,Demon Guard Leggings
三姉妹の飛行船・桃,Pink 3 Sisters Blimp
セレディーネの手紙,Celedine's Letter
アスバルのこころ１,Asbal's Heart Lv1
デビルアーマーの書,Harmour Book
実装テストアトラス,Implementation Test Atlas
漆黒魔獣ナイダーク,Black Magic Beast Nydark
王宮のチェスト・青,Blue Royal Chest
おうち用野道のラグ,Field Path Rug
ギガンテスカプセル,Gigantes Toy
いやしの服のレシピ,Healing Outfit Recipe
エンゼルスラネオン,Angel Slime Neon Sign
冒険者たちのきせき,Adventurer's Miracle
クリスマスレンタ体,Christmas Rental Body
プティヒューザの像,Petit Hyuza Statue
オブジェクト座標107,Object Coordinates 107
タロットパック・赤,Red Tarot Pack
王宮のバスタブ・赤,Red Royal Bathtub
アスタルジアの護符,Amulet of Astalgia
第２回カンダタの像,2nd Robbin' 'Ood Statue
異界将軍ゲルニック,Hootingham-Gore, the Otherworldly
トナカイのきぐるみ,Reindeer Costume
四葉透かし細工の壁,Four-Leaf Wall
竜族人形女のライト,Nadravian Doll Light(F)
ふしぎな燭台・黄色,Yellow Mysterious Candlestick
森のこびとのポスト,Forest Dwarf Mailbox
月明かりは消えない,Moonlight Never Goes Out
しぐさ書・雪だるま,Emote "Snowman"
エステラぬいぐるみ,Estella Plushie
キラーパンサーの書,Great Sabrecat Book
アジサイ姫ゆかた下,Hydrangea Yukata Bottom
純真天使のドレス上,Pure Angel Dress Top
さすらいのコート下,Errant Coat Bottom
預かり所ガスティン,Storage Gastin
ゴージャスティアラ,Gorgeous Tiara
死霊王ギスマイヤー,Spirit King Gismeyer
ガーデン花火台・緑,Grn. Fireworks Stand(G)
壁かけムーンライト,Moon Wall Light
ゴスバニーモノクル,Goth Bunny Monocle
ポリ桃パーカー水着,Peach Parka Swimsuit
採掘現場地区への道,Road to Mining Site
ゴージャスウィップ,Gorgeous Whip
キューキョクＶロン,Ultimate Vron
王宮のバスタブ・青,Blue Royal Bathtub
アクロバットケーキ,Acrobatic Cake
水しぶき舞う海の精,Splashing Sea Spirit
プチアーノン釣り傘,Khalamari Kid Umbrella
ハートのベンチ・桃,Pink Heart Bench
エンゼルスティック,Angel Wand
バルディスタ遊撃兵,Valdista Attack Soldier
星のきらめく夜会服,Starry Nightgown
ウサぐるみのぼうし,Rabbit Hat
エクリプスアックス,Eclipse Axe
ミネアのオルゴール,Meena Music Box
どうぐ使いのブーツ,Item Master Boots
星座の導き・やぎ座,Star Guide・Capricorn
ウェスリーハンマー,Wesley's Hammer
マーメイドバスタブ,Mermaid Bathtub
メリクリギフト・赤,Red Christmas Gift
猛る槌矛のガイオウ,Gaiou, Hammer and Pike
ビューティクリーム,Beauty Cream
オブジェクト座標048,Object Coordinates 048
小悪魔王子の短パン,Devil Prince's Shorts
ハロウィン衣装券Ⅳ,Halloween Voucher Ⅳ
きじゅつしのネタ帳,Illusionist's Notebook
バウギアベビーの像,Baby Earthwyrm Statue
獄氷鬼フィルグレア,Icekeeper Filglare
メタスラボスメダル,Metal Slime Boss Medal
レンジャーコート上,Ranger Coat Top
ドラグーンメイル下,Dragoon Mail Bottom
小辛翼竜バードアイ,Hot Pterosaur
コンシェルジュ０９,Concierge 09
ステージジャンパー,Stage Jumper
子供向けの木工教本,Woodworking For Kids
フェルアバの洞くつ,Felaba Cave
サイレントアンガー,Silent Anger
ヴァルハラメイル上,Valhalla Mail Top
光飾りタイルのイス,Light Tile Chair
うつしよの竜箱・改,Worldly Dragon Box+
ナルビア民家のラグ,Nalbia House Rug
オブジェクト座標077,Object Coordinates 077
スパングルグローブ,Spangled Gloves
銀の錬金ランプの本,Silver Lamp Book
メタル天馬プリズム,Metal Tantamount Prism
幻界の四諸侯コイン,Dread Fiends Coin
青の巨人ブルメル強,Apex Blue Giant Blumel
けんじゃのせいすい,Sage's Elixir
ピクニックリベリオ,Purrgatroyd Picnic
プオーンのツボ・庭,Rebjorn Pot (G)
ゴーレムのきぐるみ,Golem Costume
ルーキーのつなぎ下,Rookie Pants
第９回カミルの像庭,9th Kamil Statue (G)
しゃしょうぷぷると,Conductor Puprut
しぐさ書・打成一片,Emote "Become One"
ビクトリーチップ紫,Purple Victory Chip
庭用ハロウィンの墓,Halloween Tombstone (G)
踊り神ボニータ左羽,Dance God Bonita Left Wing
ブルーハワイかき氷,Blue Hawaii Shaved Ice
バトルフォークの本,Battle Fork Book
トーテムと私の日常,My Totem Daily
ムーンバニーヘッド,Moon Bunny Head
シャーマニズム大全,Shamanism Encyclopedia
スライムナイトの像,Slime Knight Statue
領界調査バインダー,Realm Survey Binder
セイレーンサンダル,Siren's Sandals
グレモリーの大紋章,Gremory Sigil
蒼怨の邪骨将マッゼ,Navy Bone General Mazze
ヴィーラのグローブ,Vila's Gloves
ウェディカウンタ大,Weddie Counter L
赤い金魚鉢の作り方,Making Goldfish Bowls
せいどうのよろい上,Bronze Armor Top
メデューサウィッグ,Medusa Wig
ミイラエルフ人形男,Mummy Elf Doll (M)
ウェディの人形・女,Weddie Doll (F)
ヴァレリアパラソル,Valeria Umbrella
オブジェクト座標236,Object Coordinates 236
バトルドレスセット,Battle Outfit
シスター・ペポリス,Sister Pepolis
ウサぐるみ衣装券Ⅲ,Rabbit Costume Ticket Ⅲ
ごうかな花びん・赤,Red Fancy Vase
さんぞくのサーベル,Bandit Blade
超ようせいのひだね,Super Lamplight
砂漠の渇きを癒す者,Desert Thirst Quencher
漆黒の匪賊ギャレス,Black Bandit, Gareth
王都カミハルムイ南,Kamiharmui City South
スチーム食器棚・赤,Red Steam Cupboard
ふしぎな燭台・青色,Blue Mysterious Candlestick
オブジェクト座標229,Object Coordinates 229
トライデントテイル,Triple-Tine Whip
モダンバニースーツ,Modern Bunny Suit
きなこづちの像・庭,Honeyhood Statue (G)
さざなみギフト・黒,Black Ripples Gift
ドワーフ市民うでわ,Dwarf Citizen Bangles
ゴルフメンズウェア,Golf Men's Wear
シスター・モスコル,Sister Moscol
もじゃらきラクーン,Raccoon Platypunk
職やりなおしの宝珠,Resetta Stone
蚊帳つきフトン・紫,Purple Futon with Net
ちいさな星の贈り物,Little Star's Gift
光の錬金ツボ小の本,Light Pot S Book
魔塔の木の間仕切り,Tower Wood Partition
スノーベルプリズム,Snow Bell Prism
学園男子のエプロン,Schoolboy Apron
ブロンズブーメラン,Bronze Boomerang
マイタウン古代地区,My Town Ancient District
サンセットスズラン,Sunset Lily
パンプキンシューズ,Pumpkin Shoes
はじめての防具鍛冶,Amateur Armorsmithing
ニードルうさこ人形,Needle Rabbit Doll
王都の小さな案内人,Guide to the Royal City
聖湖ゼニートのラグ,Zenit Rug
ポーズ書・ハンサム,Pose "Handsome"
キィンベルのぼうし,Kimbel Hat
夢見る男のお宝伝説,Dreamer's Treasure Legend
マリン調のキッチン,Marine Kitchen
バトルシェイカー強,Apex Maracaraider
ＰＣの姿を映す和紙,PC's Reflective Washi Paper
聖王のつるぎの壁画,Dryspell Sword Book
グレイブディガー強,Apex Grave Digger
スタジアムシューズ,Stadium Shoes
蒼天のソウラ２印章,Souten no Soura 2 Stamps
ディアブロプリズム,Diablo Prism
人形劇の背景セット,Puppet Show Set
オブジェクト座標022,Object Coordinates 022
道具鍛冶職人の選択,A Toolsmith's Task
シンプルハウスの壁,Simple House Wall
お正月ザンクローネ,New Year Zankrone
ドワーフの人形・男,Dwarf Doll (M)
カムバックお月様！,Comeback Moon!
ピュアスノーリリィ,Pure Snow Lily
行動時20%で魔力覚醒,Channel Anger On Action 20%
ハロウィン衣装券Ⅷ,Halloween Voucher Ⅷ
くさった死体マスク,Walking Corpse Mask
ゆめみの闇箱タンス,Dreamy Dark Wardrobe
スタジアムキャップ,Stadium Cap
メカニックスーツ上,Mechanic Suit Top
前座芸人のバンダナ,Show Opener's Bandana
灰キツネ猫カプセル,Ash Fox Cat Toy
タータンマフラー紺,Navy Tartan Scarf
はじゃのろーぶきん,Gold Champ Robe
プクリポのあいさつ,Pukulipo Greeting
支配されし飛竜たち,The Dragon Rulers
エテーネ軍の兵士Ｃ,Ethene Army Soldier C
オブジェクト座標251,Object Coordinates 251
真紅のダイヤモンド,Crimson Diamond
第３回セラフィの像,3rd Seraphi Statue
背離する魔幻の血統,Separation Phantom Family
ヴィーラのサンダル,Vila's Sandals
炎帝のいくさ装束上,Fire God Shirt
アンルシアカプセル,Anlucia Toy
ホーローの研究成果,Hollow's Research Results
オブジェクト座標216,Object Coordinates 216
ガーデニングセット,Gardening Set
エルガドーラの部屋,Elgadora's Room
ハイキングパーカー,Hiking Parka
フリルのビキニ・赤,Red Frill Bikini
ミニポニテエクステ,Mini Ponytail Extension
王宮のチェスト・赤,Red Royal Chest
作業場・跡地　出口,Workshop - Ruins Exit
小さな英雄のズボン,Little Hero's Pants
？？？？からの小包,Parcel from ????
オブジェクト座標051,Object Coordinates 051
冒険ゼミ会員ベスノ,Adventurer Seminar Member Sheeno
舞踏魔プレシアンナ,Dancing Demon Prescianna
海賊なりきりたき火,Pirate Campfire
小悪魔王子のマント,Devil Prince's Cloak
第１１回プクラス像,11th Pukulas Statue
スターリーキャップ,Starry Cap
３連発花火・青緑赤,3 Fireworks BGR
第４回討伐ＴＡ・銀,4th Boss TA Silver
ブルーム・ブリーズ,Bloom Breeze
ダークブルーダリア,Dark Blue Dahlia
推しに想いを込めて,Pouring Out One's Feelings
しぐさ書・リベリオ,Emote "Purrgatroyd"
バイキルエンハンス,Oomphgrade
はじゃのよろいぎん,Silver Champ Armor
ハクオウのこころ３,Hakuo's Heart Lv3
オブジェクト座標100,Object Coordinates 100
キュートなイヌミミ,Cute Dog Ears
しぐさ書・キンスラ,Emote "King Slime"
新春虎の子のお年玉,New Year Gift of the Tiger
アマラーク城のラグ,Amarak Castle Rug
経験値の古文書・小,Experience Scroll S
オルファの丘への道,Road to Orpha Hill
呪われた大地への道,Road to Cursed Land
アイドルヘアバンド,Idol Hairband
壁かけ朝食シェルフ,Breakfast Wall Shelf
ガナドールスーツ下,Victor Pants
揺らぎはじめる世界,World That Begins to Shake
プラコンプスゴン服,Pusgon Costume
ダルメシアン衣装券,Dalmatian Outfit Voucher
妖炎魔女のパンプス,Fire Witch Shoes
しぐさ書・けいれい,Emote "Salute"
バルメシュケのカギ,Balmeschke's Key
髪飾りのデザイン画,Hairpin Design Sketch
ペロキャンプリズム,Lollipop Prism
サマーソルトクロー,Somersault Claw
スターシルクハット,Superstar Top Hat
シスター・ヒーディ,Sister Heedy
ランニャーカプセル,Scram Toy
魔物管理人ペコリア,Monster Manager Pekoria
伝説の三悪魔カード,Legendary Evils Card
ドミネウスの回顧録,Domineus' Memoir
ハイクラススーツ上,High Class Suit Top
防衛魔神兵０５７号,Aztech Guard No. 057
スライムベスピアス,She-Slime Earrings
ゴージャスクリーム,Gorgeous Cream
タコメットの像・庭,Octopot Statue (G)
プチデビルスーツ上,Petit Devil Shirt
ドレスアップ無料券,Free Dress-Up Ticket
カジノバニースーツ,Casino Bunny Suit
ようせいのわたアメ,Fairy Cotton Candy
アスバルのこころ７,Asbal's Heart Lv7
第１１回ラウル像庭,11th Rahul Statue (G)
魔物管理人のぼうし,Monster Manager Cap
第１０回ヒューザ像,10th Hyuza Statue
リンクスのオフィス,Lynx's Office
妖精図書館のチェア,Fairy Library Chair
グランゼニス神の像,Gran Zenith Statue
しぐさ書・ショック,Emote "Shock"
ニセモノの見取り図,Fake Blueprint
クリティカルロッド,Critical Rod
リソルのフウキの証,Resol's SCC Emblem
アイスダンスグラブ,Ice Dance Gloves
スパイクアーマー上,Spike Armor Top
プラチナルアーの本,Platinum Lure Book
しぐさ書・アイドル,Emote "Idol"
メリクリギフト・桃,Pink Christmas Gift
魔女のとんがり帽子,Witch's Pointy Hat
第１２回ラウル像庭,12th Rahul Statue (G)
動くモンスター印章,Animated Monster Stamps
模様入りしっくい壁,Pattern Plaster Wall
デュアルブレイカー,Double Down
前ウェーブつけ毛Ｂ,Front Wavy Hairpiece B
りんごあめプリズム,Candy Apple Prism
セラフィぬいぐるみ,Seraphi Plushie
しぐさ書・パレード,Emote "Parade Dance"
グロリアスグローブ,Glorious Gloves
限定交換屋セステル,Limited Exchange Shop Cestel
フォグブルーダリア,Fog Blue Dahlia
プクリポプランター,Pukulipo Planter
セクシーギフト・白,White Sexy Gift
演奏会２５夏視聴券,Summer Concert '25 Ticket
ウェディカウンタ小,Weddie Counter S
ナッチョスのテント,Nachos' Tent
オブジェクト座標178,Object Coordinates 178
かたりべのてぶくろ,Storyteller's Gloves
ポーポラ地方への道,Road to Popola Region
ナスビナーラの門松,Woebergine Pine Decor
スマイリー・キラー,Smiley Killer
メカニックスーツ下,Mechanic Suit Bottom
ヒューザのこころ７,Hyuza's Heart Lv7
たゆたう水面ライト,Water Surface Light
第２回討伐ＴＡ・金,2nd Boss TA Gold
お花の外灯の作り方,Making Flower Lights
正しくて優しい強さ,Just and Gentle Strength
ゲルヘナ幻野への道,Road to Gerhena Field
破壊魔神兵０７１号,Aztech Guard No. 071
オブジェクト座標287,Object Coordinates 287
キンスラぬいぐるみ,King Slime Plushie
お姫様のベッド・橙,Princess Bed
月見の隕石型宇宙船,Moonview Meteor Spacecraft
キズだらけのレンズ,Scratched Lens
うんてんしでっかー,Driver Decker
エルドナ神の装束下,Eldona's Dress Bottom
ウェディング便せん,Wedding Paper
ダンディオ団長の妻,Captain Dandio's Wife
プリズニャンぐるみ,Jailcat Plushie
ギュッとリィンの箱,Lynn Arm Doll Box
ニューＶロンコイン,New Vron Coin
オブジェクト座標031,Object Coordinates 031
知の祝祭への招待券,Wisdom Festival Invite
超合金キラーマシン,Killing Machine Toy
しぐさ書・バトエン,Emote "Battle Pencil"
フリルのビキニ・桃,Pink Frill Bikini
道に迷いました……,I got lost...
アスバルぬいぐるみ,Asbal Plushie
ハチワレ猫カプセル,Tuxedo Cat Toy
シスター・グレンダ,Sister Glenda
氷の領界の光る結晶,Ice Realm Glow Crystal
オブジェクト座標058,Object Coordinates 058
プチＳキラーマシン,Frail Trauminator
メタルスライムたち,Metal Slimes
ぼーいもっずこーと,Boy Mod Coat
童話の街並みの街灯,Fairy-Tale Lamppost
アリアハングローブ,Aliahan Gloves
全職さいだいＭＰ+10,Max MP +10
メギス鶏のからあげ,Megis Fried Chicken
バルディア山岳地帯,Valdia Mountain Region
魔物シールド勲章券,Shield Medal Ticket
絶対滅神ジャゴヌバ,Jagonuba, the Absolute Annihilator
レトロなテレビ欠番,Retro TV Missing
行動時10%聖なる祈り,Care Prayer On Action 10%
３連発花火・赤青緑,3 Fireworks RBG
ヴィーラのころも上,Vila's Garment Top
凱歌のよろいセット,Valkyrie Armor Set
宣伝コンテスト・金,Promo Contest Gold
ストロベリーチョコ,Strawberry Chocolate
第８回討伐ＴＡ・金,8th Boss TA Gold
まほうのよろい下２,Magic Armor Bottom 2
アマラーク城の本棚,Amarak Castle Bookshelf
ルベランスティック,Ruberan Wand
ジェントルグローブ,Gentleman's Gloves
イルーシャトランプ,Illusia Cards
異界獣ヘイズバット,Haze Bat, the Otherworldly
メギストリスの都駅,Megistris City Station
サーカスハウスの柱,Circus House Pillar
極天女帝のローブ下,Sky Empress Robe Bottom
オブジェクト座標047,Object Coordinates 047
はじめての道具鍛冶,Trainee Toolsmithing
かーにばるこーでⅠ,Carnival Outfit Ⅰ
荒削りのブーメラン,Rough Boomerang
アグラニ風たいまつ,Agrani-Style Brazier
超さいほう針小の本,Super Needle S Book
王宮魔術師ローブ下,Royal Mage Lower Robe
大地の箱舟プリズム,Ark of the Earth Prism
エアボードプリズム,Airboard Prism
第１回釣りコン・銅,1st Fish Contest Bronze
テスト剣モデルあり,Test Sword Model OK
オブジェクト座標104,Object Coordinates 104
死霊姫ヤサギリたち,Dead Princess Yasagil
ライノス・ルージュ,Rouge Rhino
雷神のやりの作り方,Making Storm Spears
学園の生徒会室の棚,School Council Shelf
王宮の間仕切り・赤,Red Royal Partition
そのオノは星を断つ,Go and Axe the Stars
極天女帝の浮遊椅子,Sky Empress' Floating Chair
レンジャー協会本部,Ranger Association HQ
表層・サフィア宙橋,Surface - Saphia Bridge
タービア草原への道,Road to Turbia Meadows
ディバインクラウン,Divine Crown
マイタウン農村地区,My Town Rural District
ヤドリギ広場　入口,Mistletoe Plaza Entry
クリームつむりの像,Cream Slime Statue
ムニエカの町への道,Road to Munieka
ゲフェンダイトの袋,Gefendite Sack
サーマリ高原への道,Road to Samary Plateau
お姫様バスタブ・桃,Pink Princess Bathtub
光の錬金ランプの本,Light Lamp Book
黄赤チューリップ傘,Red/Ylw. Tulip Umbrella
シスター・ユミール,Sister Yumir
古代武器図説・杖編,Book of Ancient Staves
若手芸人の服セット,Young Talent Outfit
ヘルボードプリズム,Hellboard Prism
タウン案内係スミカ,Town Guide Sumika
攻撃時15%で魔導の書,Magic Book Attack 15%
オブジェクト座標076,Object Coordinates 076
しぐさ書・スライム,Emote "Slime"
まもの導師グローブ,Monster Guru's Gloves
三毛猫・双カプセル,Calico Cat Twin Toy
おうち用水辺のラグ,Waterside Rug
レンタル花がら水着,Rental Floral Swimwear
プチバラモスゾンビ,Frail Bones of Baramos
万魔の大紋章の破片,Banma Sigil Shard
ボディーガード強化,Bodyguard Boost
チームアジトの外観,Team Hideout Exterior
エンシェントワンド,Olde-Worlde Staffe
魔犬レオパルドの像,Evil Sir Leopold Statue
海賊の戦闘服セット,Battle Pirate's Outfit
しぐさ書・とまどう,Emote "Bewildered"
ギンガムマフラー黒,Black Gingham Scarf
ウィキッドスタッフ,Wicked Staff
クレイジー・プック,Sick Satyr
ニヒルなサングラス,Nihilistic Sunglasses
メッキのトロフィー,Plated Trophy
しぐさ書・究極呪文,Emote "Ultimate Spell"
エフェクトダミー傘,Umbrella Effect
アクアマリンの花束,Aqua Bouquet
メダルオーナーの館,Medal Owner's Hall
天の冒険者のころも,Divine Traveler Coat
グレーリリィのタネ,Dark Gray Lily Seed
うつしよの金箱・改,Worldly Gold Box+
シュバルツシュルト,Schwarzchuld
アンティーク風の壁,Antique Wall
シスター・バチコワ,Sister Bachkova
オブジェクト座標155,Object Coordinates 155
サメきぐるみ衣装券,Sharksuit Voucher
ほのおのつるぎの書,Fire Blade Book
ギャルのコサージュ,Stellar Starflower
ガートラント兵士Ｃ,Gartlant Soldier C
第３回アルウェの像,3rd Alwe Statue
黒鳥のサークレット,Blackbird Circlet
ヒストリカのうちわ,Historica Fan
ハロウィンバルーン,Halloween Balloon
りゅうおうハンマー,True Dragonlord Hammer
うんてんしこぺちゃ,Driver Kopecha
伝説の三悪魔コイン,Legendary Evils Coin
レジェンズアックス,Legends Axe
ジェスタースーツ下,Jester Suit Bottom
タロットパック・青,Blue Tarot Pack
真の戦士への道のり,Becoming a True Warrior
整理術は海を越えて,Sea the Art of Organizing
記憶の風穴の研究室,Memory of Windy Cave Lab
ドラパンクパーカー,Dracky Punk Hoodie
プラコン男ミイラ服,Men's Mummy Costume
しぐさ書・あらまあ,Emote "Oh My!"
ルークのピース・黒,Black Rook Piece
オブジェクト座標256,Object Coordinates 256
ヒストリカＴシャツ,Historica T-Shirt
ゴールドニャンの像,Gold Cat Statue
ヒッチハイクデビル,Hitchhike Devil
七夕の吹き流し・星,Paper Star Streamers
いにしえの竜の伝承,Lore of the Ancient Dragon
荒城の宝物殿への道,Path to Palace Treasury
スタースイーツ・小,Small Star Sweets
ゼネシアのころも上,Zenethia's Robe
ホーリークリスタル,Holy Crystal
さとりのころもの書,Clarity Outfit Book
ファルシオンクロー,Falchion Claw
ネルゲルぬいぐるみ,Nergel Plushie
アヌビスのブローチ,Anubis' Brooch
イグナイトメイル上,Ignite Mail Top
スターリーシールド,Starry Shield
スマートローボード,Smart Lowboard
（ラッキーフロア）, (Lucky Floor)
さざなみギフト・白,White Ripples Gift
シルフウィング・白,White Sylph Wings
シックに着こなして,Wear it Chicly
コンシェルジュ１３,Concierge 13
オブジェクト座標212,Object Coordinates 212
クマリスぬいぐるみ,Kumaris Plushie
旅に出ると決めた日,The Day I Went on a Trip
せいどうのよろい下,Bronze Armor Bottom
ごうかなラグ大・赤,Red Fancy Rug L
サイクロンアッパー,Air Raiser
しゅうれん用リスト,Training Wristbands
バトルロードコイン,Battle Road Coin
サマーウルフ衣装券,Summer Wolf Voucher
姉神封印神殿　入口,Goddess Seal Temple Entry
嵐の領界のついたて,Storm Realm Partition
アズラン大浴場の棚,Azlan Bathhouse Shelf
旅芸人ピュージュＨ,Minstrel Pyuju H
メタスラのキッチン,Metal Slime Kitchen
第１回カジノ祭・銅,1st Casino Fest Bronze
庭用金平糖ライト虹,Rainbow Candy Light (G)
自由なるラ・テート,La Tate, the Free
オブジェクト座標204,Object Coordinates 204
イナミノ街道の竹Ａ,Inamino Highway Bamboo
トーマ青年の剣鞘付,Sword Sheathed Toma
オブジェクト座標220,Object Coordinates 220
持ち主不明のチョコ,Unclaimed Chocolate
ウルベア魔神兵の像,Urbea Aztech Statue
届け！　ありがとう,Thanks for Delivery!
ラダトームのブーツ,Tantegel Boots
ゴールドマンＸ７号,Gold Golem X 7
幻想画「一触即発」,Fantasy Art "Touch and Go"
彩虹の死剣将グロズ,Rainbow Death General Glozz
