旅に出ると決めた日,The Day I Went on a Trip
天地雷鳴士の高みへ,The Heights of a Druid
第９回討伐ＴＡ・金,9th Boss TA Gold
鍛冶素材屋レヴェリ,Smithing Materials Reverie
フォンデュの像・庭,Fromage Fray Statue (G)
スマートな水着・赤,Red Smart Swimsuit
デビパンクスカート,Devil Punk Skirt
シスター・ビゴスラ,Sister Bigosla
マーメイドチェスト,Mermaid Chest
キラーマジンガの像,Uberkilling Statue
ビクトリーチップ海,Sea Victory Chip
バレンタインメイン,Valentine's Mein
シックゴスグローブ,Chic Goth Gloves
バトルステーキ・小,Small Battle Steak
極天女帝のローブ下,Sky Empress Robe Bottom
まおうのつかい・強,Vicious Demon-at-arms
鉄巨兵ダイダルモス,Iron Giant Daedalmos
司祭のほういセット,Pastor's Outfit
アンルシアの剣鞘有,Sword Sheathed Anlucia
コウモリボンハット,Batty Ribbon Hat
どうぐ射程距離延長,Item Range Boost
ビクトリーチップ黄,Yellow Victory Chip
魔勇者アンルシア強,Apex Anlucia, Hero of Evil
光飾りタイルの鏡台,Light Tile Vanity
ルコリアぬいぐるみ,Lucolia Plushie
オブジェクト座標170,Object Coordinates 170
黒衣の剣士のブーツ,Dark Swordsman Boots
ドット階段柄のラグ,Stairs Rug
しぐさ書・ぞうきん,Cleaning Cloth
オブジェクト座標250,Object Coordinates 250
ホイミンぬいぐるみ,Healie Plushie
はぐれメタル浮き輪,Liquid Metal Floatie
占星術師のローブ下,Astrologer Lower Robe
マスカレイドヘルム,Masquerade Helm
クラゲの天井ライト,Jellyfish Ceiling Light
ルディアンリッター,Brigadoomian Knight
ミツバチパーカー上,Honeybee Hoodie
くさった死体マスク,Walking Corpse Mask
リエーレの銃士服上,Lierre Musketeer Shirt
魔想念ジェルザーク,Remnant of Gelzark
どうぐ使いのズボン,Item Master Pants
レンジャコート下２,Ranger Coat Bottom 2
花狩人のころも・赤,Red Flower Hunter Outfit
第１回カジノ祭・銀,1st Casino Fest Silver
ごうかなラグ大・赤,Red Fancy Rug L
ルーンクラブクロー,Rune Crab Claws
壁かけライト付き鏡,Wall Mirror with Light
支援魔神機０２２号,Aztech Support Mech No. 022
カントリードレス下,Country Dress Bottom
ハクオウのこころ１,Hakuo's Heart Lv1
オブジェクト座標203,Object Coordinates 203
アブソリュートレイ,Absolute Beam
セラフィムウィング,Seraph Wings
ゼドラ王国服モブ９,Zedra Royal Clothes Mob 9
おしゃれな水着・黄,Yellow Snazzy Swimsuit
魔想念スコルパイド,Remnant of Scorpide
バトルシェイカー強,Apex Maracaraider
戦士のよろいセット,Warrior Armor Set
プロディトスーツ上,Plaudit Suit
ベジタブル家具の本,Veggie Furniture Book
オブジェクト座標089,Object Coordinates 089
モーモンぬいぐるみ,Teeny Sanguini Plushie
きしんのまそうの本,Poker Book
ギガントヒルズ・強,Vicious Drakularge
クモの巣カーペット,Spider Web Carpet
難民キャンプへの道,Road to Refugee Camp
おうち用夕焼け天井,Sunset Ceiling
オブジェクト座標142,Object Coordinates 142
ギュッとヒストリカ,Historica Arm Doll
ローヌ樹林帯への道,Road to Rhone Woodlands
ムーンバニーヘッド,Moon Bunny Head
アイドルギフト・白,White Idol Gift
燃えるほのおの凱歌,Triumph of Flames
メレアーデのお部屋,Mereade's Room
アルケミストン帽子,Sham Hamwitch Hat
プンスコのソファー,Punsuko's Sofa
しらふじいろダリア,White Wisteris Dahlia
プラネタリウム・緑,Green Planetarium
スカウトローブーツ,Scout Robes
純真天使のドレス下,Pure Angel Dress Bottom
ランガーオ村の王者,Langao's Champion
トンブレロの像・庭,Ham Shamwitch Statue(G)
赤い金魚鉢の作り方,Making Goldfish Bowls
妖魔ジュリアンテ強,Apex Mystical Juliante
しぐさ書・Ｓスター,Star Signal
ドラグーングリーブ,Dragoon Greaves
アンドレアル練習札,Rashaverak Tag
ストリートシューズ,Street Shoes
呪文のためのナイフ,Knife for Spells
しゃくねつのカケラ,Searing Shard
フルーツバブルバス,Fruit Bubble Bath
キルティングバッグ,Quilting Bag
オブジェクト座標175,Object Coordinates 175
災厄神話ギャラリー,Calamity Myth Gallery
ゼドラ王国服モブ６,Zedra Royal Clothes Mob 6
サイクロンアッパー,Air Raiser
プチ魔犬レオパルド,Frail Evil Sir Leopold
さざなみギフト・黄,Yellow Ripples Gift
アウトドアテーブル,Outdoor Table
ばくだん岩の像・庭,Rockbomb Statue (G)
ダンシングライト緑,Dancing Light (Green)
ドミネウスの回顧録,Domineus' Memoir
アラビアンウェア下,Arabian Pants
アンルシアキッチン,Anlucia Kitchen
男性もみじのゆかた,Maple Yukata (M)
とうめいイレイザー,Transparent Eraser
若手芸人のてぶくろ,Young Talent Gloves
攻撃時10%でヘナトス,Blunt Attack 10%
シスター・アナベル,Sister Annabel
シープ木馬プリズム,Rocking Sheep Prism
おしゃれな水着・赤,Red Snazzy Swimsuit
ブレイブスラッシュ,Brave Slash
神官のほういセット,Minister Outfit
純真天使のドレス上,Pure Angel Dress Top
ジャゴヌバトランプ,Jagonuba Deck
ファイアタルト・小,Small Fire Tart
オブジェクト座標126,Object Coordinates 126
じゃんぼりぃの帽子,Janbori's Hat
シスター・ヒーディ,Sister Heedy
いたずらもぐらの書,Mischievous Mole Book
ウサぐるみグローブ,Rabbit Gloves
おもちゃの岩山・雪,Toy Mountain (Snow)
お祝い１０連発花火,10 Celebratory Fworks
オブジェクト座標026,Object Coordinates 026
ロッキンマートの塀,Rockin' Mart Fence
星座の導き・いて座,Star Guide・Sagittarius
ガード時20%ダメ軽減,Damage Down On Block 20%
砂漠に甘～い新商品,Sweet New Dessert Product
夏の恋は泡のごとく,Summer Love, Like a Bubble
あやしいカーペット,Suspicious Carpet
ダーマ神殿のテント,Alltrades Abbey Tent
アラビアンシューズ,Arabian Shoes
イルーシャのうでわ,Illusia's Bracelets
オブジェクト座標075,Object Coordinates 075
パインのドレッサー,Pineapple Vanity
ショコラなシューズ,Chocolate Shoes
グレーブルーの花束,Gray-Blue Bouquet
古代オルセコの灯火,Old Orseco Light
小悪魔王子の短パン,Devil Prince's Shorts
はじめての武器鍛冶,Welcome Weaponsmithing
月明かりは消えない,Moonlight Never Goes Out
マスター・ポーリア,Guildmaster Paulia
スターリーシールド,Starry Shield
クラウドブレイカー,Cloudbreaker
昔日のよろいセット,Ancient Armor Set
イグナイトグリーブ,Ignite Greaves
ビクトリーチップ闇,Dark Victory Chip
デスパワーブースト,Death Power Boost
アマラーク城の噴水,Amarak Castle Fountain
オグチャビ像こげ茶,Olive Ogreed Chubby St.
ダンシングライト紫,Dancing Light (Purple)
エンゼルスライム帽,Angel Slime Cap
ラッキーチケット銀,Silver Lucky Ticket
ユニコーンプリズム,Unicorn Prism
おでかけふくびき券,App Tombola Ticket
キングのピース・白,White King Piece
しぐさ書・トランプ,Cards
ようせいのヤキソバ,Fairy Fried Noodles
サンゴールドの花束,Sungold Bouquet
万魔の塔・三の災壇,Banma Tower - 3rd Platform
ゴージャスクッキー,Gorgeous Cookies
ふわふわアーケロン,Floaty Archelon
シスター・メイデル,Sister Maidel
ほこらの祭祀場・氷,Ice Shrine Ritual Ground
しぐさ書・おそうじ,Cleaning
スフィンクスの石像,Sphinx Stone Statue
パピヨンドーム・幻,Phantom Papillon Dome
メリクリギフト・白,White Christmas Gift
ライバルズトランプ,Rivals Cards
袋入りクーちゃん帽,Ku Bag Hat
スライムのかんむり,Slime Crown
スライムナイトの盾,Slime Knight Shield
ゼレスタイトの大盾,Celestite Greatshield
ハートの兵隊のくつ,Heart Soldier Shoes
オブジェクト座標132,Object Coordinates 132
メロディアスーツ下,Melody Suit Bottom
月光スミレのランプ,Moonlight Violet Lamp
マイタウン未開地区,My Town Savage District
レースのミニハット,Lace Mini Hat
第２回討伐ＴＡ・銅,2nd Boss TA Bronze
ダックスビル浮き輪,Splatypunk Floatie
第１１回パドレ像庭,11th Padre Statue (G)
ターボル峡谷への道,Road to Tabor Gorge
帝国のプレゼント券,Empire Present Ticket
しぐさ書・勉強する,Study
壁かけ潜水艦ライト,Submarine Wall Light
オブジェクト座標120,Object Coordinates 120
黄金のペンプリズム,Golden Pen Prism
アグラニ風たいまつ,Agrani-Style Brazier
ペコリア・アルファ,Pekoria Alpha
ノクゼリアシールド,Noxeria Shield
ぶらっくたきしーど,Black Tuxedo
スノーモンプリズム,Snow Sanguini Prism
ライトイエロダリア,Light Yellow Dahlia
管理タブレット中古,Used Management Tablet
第５回討伐ＴＡ・銀,5th Boss TA Silver
メネトの資材置き場,Menet Depository
ウィザードバス・黒,Black Wizard Bath
ハンディキャンドル,Handy Candle
死霊王ギスマイヤー,Spirit King Gismeyer
ホワイトパンプキン,White Pumpkin
第９回ラグアスの像,9th Raguas Statue
ディアブロウィング,Diablo Wings
マジカルギフト・黄,Yellow Magical Gift
夢のスティック物語,Fantastick Story
ほのおのブーメラン,Flametang Boomerang
パピヨンチェア・幻,Phantom Papillon Chair
クマチャンキャップ,Beary Cute Cap
クオードのサーベル,Quard's Sabre
氷魔王の大矛・オノ,Ice Demon King Axe
古レビュール街道南,Old Reviewle Highway South
ギュッとフランジュ,Frange Arm Doll
極天女帝の浮遊椅子,Sky Empress' Floating Chair
雑貨屋さんの屋根白,White Shop Roof
グレーブルーマリー,Gray-Blue Marie
打ち上げ花火・黄緑,Fireworks Launcher (Y)
オブジェクト座標136,Object Coordinates 136
高機能錬金食品の本,Efficient Alchemy Food Book
うぇでぃんぐどれす,Wedding Dress
マジカルギフト・黒,Black Magical Gift
ディバインメイル上,Divine Mail Top
ヴィンテージの時計,Vintage Watch
警備魔神兵０４７号,Aztech Guard No. 047
魔女シュガーのムチ,Witch Sugar's Whip
召集！　五領界会談,The Five Realms Convene
リボンスターの服上,Star Ribbon Top
はじめての道具鍛冶,Trainee Toolsmithing
お菓子のテーブル大,Sweet Table L
第８回ファラスの像,8th Faras Statue
輝けるつるぎの伝説,Shining Sword Legend
庭用ハロウィンの墓,Halloween Tombstone (G)
アズラン地方の木Ｂ,Azlan Region Tree B
オブジェクト座標277,Object Coordinates 277
マリーヌ神像の写真,Marine Statue Photo
魔塔の赤宝石付き壁,Red Tower Jeweled Wall
ハートのタンス・桃,Pink Heart Wardrobe
焼きたてパンセット,Fresh Baked Bread Set
預かり所オレンじい,Storage Old Mandarin
オブジェクト座標283,Object Coordinates 283
新春ドラキーアーチ,New Year Dracky Arch
レンタル衣装無料券,Free Outfit Rent Ticket
レジェンズウィップ,Legends Whip
ドワーフテーブル大,Dwarf Table L
ブルートライデント,Blue Trident
冬風マキシスカート,Winter Maxi Skirt
占い師の星型ライト,Diviner Star Light
ステーション機関室,Station Engine Room
ザンクローネの心臓,Zankrone's Heart
武器屋の家の設計図,Weapon Shop Blueprint
ネオンフラッシュ赤,Neon Flash (Red)
わかめ王子ぐるみ小,King Kelp Plushie S
ヴァレリアへの親書,Official Letter to Valeria
ファントムカチーフ,Phantom Kerchief
ふしぎな燭台・赤色,Red Mysterious Candlestick
エテーネ軍の兵士Ａ,Ethene Army Soldier A
セレドの民家の外観,Celed House Exterior
アンテイクドレス下,Antique Skirt
オブジェクト座標197,Object Coordinates 197
サバイバルボックス,Survival Box
いちばん星の贈り物,First Star's Gift
黄金のパラディン像,Golden Paladin Statue
白霜の流氷野への道,Road to Frosty Floes
サジェのオルゴール,Sajay Music Box
スパイクアーマー下,Spike Armor Bottom
おとぎの森スカート,Fairy Forest Skirt
ファヒータのホウキ,Fajita's Broom
行動時10%バイシオン,Oomph On Action 10%
ドット風エステラ像,Pixel Estella Statue
手品師の服の作り方,Making Conjurer Clothes
パピヨンベッド・夢,Dream Papillon Bed
マデュライトの延板,Darkonium Plate
アズラン地方の木Ｃ,Azlan Region Tree C
タイタス号の天井扇,Titus Ceiling Fan
第６回討伐ＴＡ・銅,6th Boss TA Bronze
大型のマルチ水そう,Multi-Fish Aquarium L
くろがねのよろい上,Darksteel Cuirass
怒れる軍団長の叫び,Angry Legionnaire's Cry
トナカイのきぐるみ,Reindeer Costume
神獣ゼナベスティア,Divine Beast Zenabestia
第７回討伐ＴＡ・金,7th Boss TA Gold
タッツィのお手伝い,Tazzi's Help
スライダークブーツ,Nemeslime Boots
銀甲の崩撃将ダバム,Silver General Dabam
アルウェーン管理棟,Alweyn Admin Building
防衛魔神兵０５７号,Aztech Guard No. 057
プチＳキラーマシン,Frail Trauminator
ネオンフラッシュ青,Neon Flash (Blue)
ゆめみの銀箱タンス,Dreamy Silver Wardrobe
人形劇の背景セット,Puppet Show Set
マジカル姫ゆかた上,Magical Yukata Top
鍛冶素材屋フウザム,Smithing Materials Fuzam
プラコンスーツ・桃,Pink Suit
セイレーンパレオ下,Siren's Pareo Bottom
クラシカルシューズ,Classical Shoes
ポップスターマイク,Pop Star Microphone
ドラゴンスティック,Wyvern Wand
ポーズ書・キュート,Cute Pose
歪曲性超空間論・下,Distorted Space Vol. 2
ポーポラ地方への道,Road to Popola Region
ハクオウのこころ７,Hakuo's Heart Lv7
アラモンドの案内板,Alamond Info Board
学園スキルブック１,Academy Skill Book 1
チームアジトの外観,Team Hideout Exterior
カジノ祭４ビンゴ銅,CasinoFest 4 Bingo Brnz
オブジェクト座標162,Object Coordinates 162
まほうのよろい下２,Magic Armor Bottom 2
ビクトリーチップ地,Earth Victory Chip
きまぐれ猫のブーツ,Silly Cat Boots
ゲルニック将軍の像,Hootingham-Gore Statue
メタスラのバスタブ,Metal Slime Bathtub
カントリースカート,Country Skirt
記念品交換ベスリン,Souvenir Exchange Bethlin
ある船長の航海日誌,Captain's Logbook
スクアーロの写真２,Squalo's 2nd Photo
りょうりにんぴーら,Chef Peera
パラディチェイン２,Paladin Chain Mail 2
白いビーチパラソル,White Beach Umbrella
上級・ＭＰ錬金の本,Advanced MP
初心者用ブーメラン,Beginner's Boomerang
雑貨屋さんの屋根茶,Brown Shop Roof
ブランコ付きの庭木,Tree with Swing (G)
ソルシエールブーツ,Sorciere's Boots
万魔の大紋章の破片,Banma Sigil Shard
第３回釣りコン・銅,3rd Fish Contest Bronze
カラフル花火台・白,White Fireworks Stand
スノー柄の便利な壁,Snow Pattern Wall
魔法使いに会いたい,To Encounter A Mage
ハートの兵隊ぼうし,Heart Soldier Hat
ガナドールスーツ下,Victor Pants
サーマリ高原への道,Road to Samary Plateau
激辛魔人アケローダ,Super Spicy Demon Akeroda
うさみみソルジャー,Rabbit Soldier
クールスターセット,Cool Star Outfit
さいほう職人の看板,Sewing Sign
おしゃれな水着・桃,Pink Snazzy Swimsuit
キャロルコサージュ,Carol Corsage
キュートなクマミミ,Cute Bear Ears
蚊帳つきフトン・黄,Yellow Futon with Net
大型の四角い水そう,Square Aquarium L
スノーハーブの花実,Snow Herb Flowers
オブジェクト座標138,Object Coordinates 138
オブジェクト座標086,Object Coordinates 086
ウロコフネタマガイ,Scaly-Foot Gastropod
ポンポンベタ・青赤,Red Pom Pom Betta
エンジェルクリーム,Angel Cream
氷闇の月飾りの破片,Icy Dark Moon Shard
影の深底への昇降機,Elevator to Shadowy Deeps
Ｓジェネラルコイン,Shogum Coin
スタジアムシューズ,Stadium Shoes
オブジェクト座標073,Object Coordinates 073
花束交換屋ププリン,Bouquet Shop Pupurin
スライムタワー噴水,Slime Stack Fountain
サボテンダーコイン,Cactuar Coin
タマゴ変換屋エギー,Egg Converter Eggy
ミイラエルフ人形女,Mummy Elf Doll (F)
ユーライザウィッグ,Yuliza Wig
アンノウンバスター,Unknown Buster
カジキマグロの置物,Marlin Ornament
ピクニックマローネ,Marone Picnic
DQ1勇者たいまつなし,DQ1 Hero Without Torch
回転木馬のモビール,Carousel Mobile
ゴールデントーテム,Gem Jamboree
ホワイトタキシード,White Tuxedo
おひさまのぬくもり,Warmth of the Sun
予言者学園女学生靴,FTA Shoes (F)
オルッパ地下洞くつ,Orppa Underground Caves
ふかふかないしょう,Hatching Outfit
行動時30%聖なる祈り,Care Prayer On Action 30%
真・幻界諸侯練習札,True Dread Fiends Tag
ハングリーハンター,Hungry Hunter
ヒストリカのうちわ,Historica Fan
三毛ねこの便利な壁,Calico Cat Wall
スイカのタライ・金,Gold Watermelon Basin
えんじぇるいしょう,Angel Costume
おおさそりの浮き輪,Scorpion Floatie
レンジャーコート下,Ranger Coat Bottom
英雄の武勲を探して,Looking for Hero's Service
チョコレートリップ,Chocolate Tulip
ゼネシアの神獣たち,Servants of Zenethia
占い師ミネアの依頼,Help Fortune Teller Meena
ブーキャンとうめい,Boot Camp Transparency
陰陽博士のころも下,Yin-Yang Skirt
風鈴のシャンデリア,Wind Chime Chandelier
はぐくみギフト・燈,Light Nurturing Gift
アシュレイの髪飾り,Ashley's Hairpin
水の領界のサンゴ礁,Water Realm Coral Reef
ファラオ最高幹部会,Top-Level Pharaohs
福笑いのラグ・くち,Fukuwarai Mouth Rug
ドワーフテーブル小,Dwarf Table S
タロットパック・銀,Silver Tarot Pack
ゼドラ王国服モブ７,Zedra Royal Clothes Mob 7
ビクトリーチップ菜,Vegetable Victory Chip
ペンシルフィッシュ,Pencil Fish
Ｓジェネラル練習札,Shogum Tag
りょうりにんぼーら,Chef Bora
赤色チューリップ傘,Red Tulip Umbrella
コンシェルジュ０４,Concierge 04
ガーディアンブーツ,Guardian Boots
プラチナ錬金ツボ小,Platinum Pot S
ファーラット浮き輪,Feralball Floatie
閃輝晶獣ビルビギス,Crystalfiend Bilbigis
パーティーの招待状,Party Invitation
ポンポンベタの置物,Pom Pom Betta Ornament
オブジェクト座標084,Object Coordinates 084
旅芸人ピュージュＧ,Minstrel Pyuju G
上級・魔力錬金の本,Advanced Magic Power
キャット・リベリオ,Purrgatroyd
オブジェクト座標072,Object Coordinates 072
しぐさ書・Ｓタワー,Slime Stack Trick
マスター・ポシェル,Guildmaster Poshel
まじないしローブ上,Fizzle-Proof Shirt
ザ・ボーンズメダル,The Bones Medal
魔物管理人シャウラ,Monster Manager Shaula
ウェディのターバン,Weddie Turban
じごくの弓の黙示録,Oh-No, An Apocalypse
サマーウルフ衣装券,Summer Wolf Voucher
ヒューザのこころ６,Hyuza's Heart Lv6
しっこくのターバン,Macabre Turban
ブラックタキシード,Black Tuxedo
メロディアスーツ上,Melody Suit Top
バルディスタ便せん,Valdista Paper
マダム・フェリシア,Madame Felicia
第１回討伐ＴＡ・金,1st Boss TA Gold
しぐさ書・アイドル,Idol
ハイクラススーツ下,High Class Suit Bottom
レジェンズハンマー,Legends Hammer
ルークのピース・白,White Rook Piece
ユシュカのこころ２,Yushka's Heart Lv2
レモンスライムの柱,Lemon Slime Pillar
オブジェクト座標247,Object Coordinates 247
ヒューザのこころ４,Hyuza's Heart Lv4
オブジェクト座標156,Object Coordinates 156
討伐隊員ライヴァス,Strike Force Laivas
パレードコステイロ,Mardi Garb Feathers
冥氷竜ジェロドーラ,Jerodora, Icy Dark Dragon
結界の守護者カード,Barrier Guardians Card
オブジェクト座標186,Object Coordinates 186
暗黒皇帝ガナサダイ,King Godwyn
公演会２５視聴券１,Summer '25 Show Ticket 1
童話の街並みの門柱,Fairy-Tale Gatepost
メタッピーの像・庭,Mecha-Mynah Statue (G)
バズカフェの飾り棚,Pazu Cafe Shelf
エルフＧＰプリズム,Elf GP Prism
バトルマスターの証,Gladiator's Grant
リソルのフウキの証,Resol's SCC Emblem
ダークネスショット,Darkness Shot
トレジャーグローブ,Treasure Gloves
匠のチャーハン・小,Small Fried Rice
森のこびとのランプ,Forest Dwarf Lamp
パルチザンとわたし,Partisan Secrecy
再しぐさ書・ピース,Peace Sign (Reprint)
フローラルダンディ,Floral Dandy
踊魔の霊符・花嫁白,White Dancer Talisman
大きな黄金の秘宝？,Large Golden Treasure ?
まことの美を求めて,In Search of True Beauty
お花の外灯の作り方,Making Flower Lights
ピクニッククロニコ,Chronico Picnic
古レビュール街道北,Old Reviewle Highway North
黒衣の剣士キッチン,Dark Swordsman Kitchen
ハチ駆除防護グラス,Bee Protection Glasses
表情の書・ドヤがお,Smug
オブジェクト座標159,Object Coordinates 159
遊び人のサングラス,Gadabout's Sunglasses
しぐさ書・おそなえ,Offering
第８回ナジーンの像,8th Najinn Statue
シンプルモダンラグ,Simple Modern Rug
防衛魔神兵０５５号,Aztech Guard No. 055
管理棟エレベーター,Admin Building Elevator
フューチャーブーツ,Future Boots
創失のフーラズーラ,Unmade Fluzula
よろず屋アメジスト,General Shop Amethyst
古代都市地区への道,Road to Ancient Suburb
その先に行くために,To Go Beyond
呪われたシシカバブ,Cursed Shish Kebab
オーガ人形の作り方,Making Ogre Dolls
占星術師のローブ上,Astrologer Upper Robe
捨てられた城への道,Road to Abandoned Castle
魔人エンラージャ強,Apex Enraja
だいまどうローブ上,Great Mage Upper Robe
しぐさ書・お祝い虹,Celebrate Rainbow
ユシュカのこころ３,Yushka's Heart Lv3
魔物管理人ドリアス,Monster Manager Dorias
ゼネシアのころも下,Zenethia's Skirt
マスカレイドスーツ,Masquerade Suit
神都の庭オルゴール,Fourion Music Box (G)
若手芸人の服セット,Young Talent Outfit
アンノウンハンマー,Unknown Hammer
死へと導く獣の伝承,Beast That Leads to Death
カボチャのキッチン,Pumpkin Kitchen
オブジェクト座標251,Object Coordinates 251
グランゼドーラ兵Ａ,Gran Zedora Soldier A
マッシュルーム地区,Mushroom District
ワンダラーズブーツ,Wanderers Boots
求めるは仙者の霊薬,Seeking a Hermit's Elixir
しぐさ書・シャワー,Shower
青い翼のペンダント,Blue Wing Pendant
イエローダイアリー,Yellow Name Diary
ゲフェンダイトの袋,Gefendite Sack
ゴールデンパペット,Gold-Plated Puppet
ソーミャ宛ての手紙,Letter to Somya
フラワーカンカン帽,Flower Can-Can Hat
アマラーク城の玉座,Amarak Castle Throne
封神の参道への出口,Exit to The Sealed Approach
チョコレート便せん,Chocolate Paper
かーにばるこーでⅡ,Carnival Outfit Ⅱ
ゾディアックコード,Zodiac Code
リエーレの銃士服下,Lierre Musketeer Pants
イナミノ街道の木Ａ,Inamino Highway Tree A
まのギフトボックス,Demon Gift Box
光飾りタイルのイス,Light Tile Chair
まもりのペンダント,Adamant Pendant
幻影のドミネウス邸,Domineus Illusion Mansion
炎帝のいくさ装束上,Fire God Shirt
オブジェクト座標137,Object Coordinates 137
うんてんしちっちぇ,Driver Chiche
シスター・アニッタ,Sister Anitta
月に還る双子の物語,Tale of Two Moons
真・幻界諸侯カード,True Dread Fiends Card
オブジェクト座標290,Object Coordinates 290
リゼ＆ルコプリズム,L & L Prism
レジェンズアックス,Legends Axe
始源の歌姫の髪飾り,First Diva's Hairpin
レグルのペンダント,Regul's Pendant
風船星空天井ライト,Starry Balloon Light
うさみみギフト・青,Blue Rabbit Ears Gift
裁縫素材屋フレーツ,Sewing Materials Frets
イチゴのクッション,Strawberry Cushion
前ウェーブつけ毛Ｂ,Front Wavy Hairpiece B
クスリの入った小瓶,Small Bottle of Medicine
リリィアンヌバッグ,Lillian Bag
ヘヴィーアーマー上,Heavy Armor Top
嵐の領界のトロッコ,Storm Realm Minecart
やいばのブーメラン,Edged Boomerang
DQ1勇者たいまつあり,DQ1 Hero With Torch
チョコが詰まった袋,Chocolate Filled Bag
氷の領界の氷ソファ,Ice Realm Sofa
武勲の城の一輪挿し,Valor Castle Vase
ワンダラーズグラブ,Wanderers Gloves
ザードの尖塔・２階,Zard Spire 2F
オブジェクト座標022,Object Coordinates 022
ジア・ルミナのコア,Dia Lumina Core
ゴスバニースカート,Goth Bunny Skirt
チェックのラグ・赤,Red Checkered Rug
レジェンズショット,Legends Bow
グーラ・マシュラン,Gullah Mashraan
シーサイドオブジェ,Seaside Curio
選定者ワルキュウリ,Selector Val-cu-rie
スパイスカレー・小,Small Spicy Curry
オブジェクト座標165,Object Coordinates 165
ジェントルコート下,Gentleman's Pants
サロン・フェリシア,Salon Felicia
森のこびとのおうち,Forest Dwarf Home
クラシカルトップス,Classical Top
暴君バサグランデ強,Apex Tyrant Bogan
烈火の渓谷への出口,Exit to Valley of Fire
フリルのビキニ・黄,Yellow Frill Bikini
