ふうまの盾の作り方,Make a Dampening Shield
ドルワーム研究ぐつ,Dolworm Research Shoes
シスター・カミッラ,Sister Camilla
さはらこーとせっと,Sahara Outfit
しゃしょうまりうす,Conductor Marius
モーモンのランタン,Teeny Sanguini Lantern
プラコンスーツ・紺,Navy Blue Suit
王宮のチェスト・青,Blue Royal Chest
汚染源ヘドロヌーバ,Sludgeraker, Source of Pollution
フラワーカンカン帽,Flower Can-Can Hat
オブジェクト座標234,Object Coordinates 234
パッチ柄ベッド・青,Blue Patch Bed
男性もみじのゆかた,Maple Yukata (M)
ぺろぺろキャンディ,Lollipop
スライムエンペラー,Emperor Slime
ビクトリーチップ闇,Dark Victory Chip
ナドラガ教団大神殿,Nadraga Order's Grand Temple
スカーレットグラス,Scarlet Glasses
青の巨人ブルメル強,Apex Blue Giant Blumel
花狩人のころも・緑,Green Flower Hunter Outfit
大いなる危機の胎動,Great Crisis in Motion
Ｓキラーマシンの像,Trauminator Statue
武器鍛冶職人の挑戦,Weaponsmith's Challenge
あるイケメンの秘密,Secret to Being Handsome
さらつやシャンプー,Smooth Shampoo
お菓子のテーブル大,Sweet Table L
Ｎ高女子のスカート,N High Girl's Skirt
ネタ「Ｘスライム」,X Slime Trick
夢見るスイムワンピ,Dream Swim Dress
小悪魔王子の短パン,Devil Prince's Shorts
ターン消費しない+5%,Free Turn +5%
虹色のパーカー水着,Rainbow Hoodie Swimsuit
レプリカード発行証,Replicard Proof
スライムジェネラル,Shogum
闇の領界の有毒植物,Dark Realm Toxic Plant
きのこのスティック,Shroom Stick
エッグの写真ケース,Egg Photo Case
レンダーシアズボン,Lendersia Trousers
バブスラジャムパン,Bubble Slime Jam Bread
しぐさ書・バトエン,Emote "Battle Pencil"
ゴールドマンＸ４号,Gold Golem X 4
オブジェクト座標063,Object Coordinates 063
黄金のパラディン像,Golden Paladin Statue
ウェディングドレス,Wedding Dress
コンシェルジュ０１,Concierge 01
ウェディの人形・女,Weddie Doll (F)
フェルアバの大洞穴,Felaba Depths
第３回カジノ祭・銅,3rd Casino Fest Bronze
全職さいだいＨＰ+10,Max HP +10
ビクトリーチップ王,King Victory Chip
セイレーングローブ,Siren's Gloves
リーフシードラゴン,Leafy Seadragon
ウェディテーブル大,Weddie Table L
マジカルギフト・青,Blue Magical Gift
オブジェクト座標260,Object Coordinates 260
ミイラ男のてぶくろ,Mummy Boy Gloves
雪原のファーブーツ,Snowfield Fur Boots
アマラーク城　出口,Amarak Castle Exit
シスター・シャディ,Sister Shadi
ドン・モグーラの像,Don Mole Statue
名もなき草原への道,Road to Nameless Field
使い手をいやすオノ,Wielder-Healing Axe
キャプテングローブ,Captain's Gloves
タイタス号の操舵輪,Titus Steering Wheel
ルミナスギフト・黄,Yellow Luminous Gift
しぐさ書・まぶしい,Emote "Dazzling"
光のフライパンの本,Light Fry Pan Book
必殺の輝天のおうぎ,Deadly Sky Fan
ハクオウのこころ４,Hakuo's Heart Lv4
白灰のピラー・内部,White Ash Pillar - Inside
オブジェクト座標033,Object Coordinates 033
しろへびのぬけがら,White Snake Husk
ピクニックプクラス,Pukulas Picnic
たちきりバチの群れ,A Swarm of Buzzbees
グローリーアックス,Great Axe
ボディーガード強化,Bodyguard Boost
魔女ハバネロのムチ,Witch Habanero's Whip
バラレースふりそで,Rose Lace Furisode
陰陽博士のころも上,Yin-Yang Robe
ブラッディグリーブ,Bloody Greaves
第１１回ナジーン像,11th Najinn Statue
紫のキーエンブレム,Purple Key Emblem
スクアーロの写真３,Squalo's 3rd Photo
魔道士キャロルギル,Wizard Kyrolgyl
荘厳な竜のふりそで,Majestic Dragon Kimono
かっぱえび家の甲羅,Kappa Ebisen Shell
ゴールデンパペット,Gold-Plated Puppet
古代魔術のながぐつ,Ancient Magic Boots
防衛魔神兵０５２号,Aztech Guard No. 052
防衛軍の制服・灰色,Gray Defense Force Suit
支援魔神機０２９号,Aztech Support Mech No. 029
オグチャビ像こげ茶,Olive Ogreed Chubby St.
ぷりんすたきしーど,Prince Tuxedo
中辛角竜ボブラノス,Medium Spicy Dragon Bobranos
スライダークカード,Nemeslime Card
ごうかなラグ小・緑,Green Fancy Rug S
祭具・星天の衣折紙,Starry Sky Robe Origami
ギガントヒルズ・強,Vicious Drakularge
しゃしょうぷぷると,Conductor Puprut
ほこらの祭祀場・闇,Dark Shrine Ritual Ground
しぐさ書・ブレイク,Emote "Break"
超おたから花ダイヤ,Diamond Treasure Flower
マスター・ポーリア,Guildmaster Paulia
水晶のイスと机の本,Crystal Furniture Book
ゴスバニースカート,Goth Bunny Skirt
プリムリリーのくつ,Primlily's Shoes
古代オルセコの祭壇,Old Orseco Altar
ウィリーデステッキ,Vilide Wand
ルーキーのつなぎ下,Rookie Pants
輝けるつるぎの伝説,Shining Sword Legend
ほこらの祭祀場・水,Water Shrine Ritual Ground
じょせいめいどふく,Maid Outfit (F)
超天遊戯－参の書－,Chosen's Teachings Book 3
ミスター・シャウト,Hell Raizer
護門将ゴウシルシャ,Protector General Goshylsa
ハロウィン衣装券Ⅳ,Halloween Costume Tkt Ⅳ
メス三毛猫スーツⅡ,Calico Cat Suit (F) Ⅱ
スライムのかんむり,Slime Crown
第９回カミルの像庭,9th Kamil Statue (G)
発信機イヤリング型,Earring Type Transmitter
くろがねのよろい上,Darksteel Cuirass
おどるほうせきの書,Goodybag Book
フューリーブレード,Fury Blade
ギュッとザンクの箱,Zankrone Arm Doll Box
グレイブディガー強,Apex Grave Digger
白銀のフランベリー,Silver Flanberry
ガズバランのしるし,Gazbalan Badge
リボントークハット,Ribbon Toque
壊れた酒場の置き物,Broken Tavern Ornament
天の冒険者のズボン,Divine Traveler Pants
メロディアスーツ下,Melody Suit Bottom
ウサギ魔物のブーツ,Rabbit Monster Boots
チューザー地下空洞,Choozah Hollow
キングヒドラコイン,King Hydra Coin
オブジェクト座標218,Object Coordinates 218
ためしてクルーガー,Try Kluger
王都キィンベルの机,Kimbel Desk
クルクルポシェット,Bag o' Books
クリムゾンレプリカ,Crimson Replica
マジェスタスーツ下,Majesta Pants
しぐさ書・トランプ,Emote "Cards"
セクシードレッサー,Sexy Vanity
リュウグウノツカイ,Oarfish
りぼんカチューシャ,Ribbon Hairband
じゃんぼりぃの帽子,Janbori's Hat
カンダタこぶんリポ,Merry Man Lipo
ハート兵隊スカート,Heart Soldier Skirt
ライバルズトランプ,Rivals Cards
スウィートビキニ白,White Sweet Bikini
ジュレット駅の模型,Julet Station Model
バステトのブローチ,Bastet's Brooch
獄獣のケープセット,Hell Beast Outfit
オブジェクト座標254,Object Coordinates 254
モチつき「つき手」,Pound Mochi "Pounder"
音符のテーブル・黒,Black Music Table
配布用経験値の聖典,Experience Scripture
オブジェクト座標257,Object Coordinates 257
ドルボードの残がい,Dolboard Remains
クラゲの天井ライト,Jellyfish Ceiling Light
ガタラアームズの旗,Gatara Arms Banner
スタンダード２印章,Standard 2 Stamps
導きの風に技閃きて,Flash in the Guiding Wind
まほうよろいの秘密,Magic Armor Secret
ルミナスギフト・桜,Pink Luminous Gift
ナルビア武器屋の槍,Nalbia Shop Spear
シグナルクローバー,Clover Signal
コペのふわふわパン,Kope's Fluffy Bread
三首海竜のウィング,Sea Dragon Wings
ネオンフラッシュ黄,Neon Flash (Yellow)
えんじぇるいしょう,Angel Costume
ゼクレス精鋭兵たち,Zechres Elite Soldiers
コロシアム対戦終了,Coliseum Match End
ラッキーチケット銀,Silver Lucky Ticket
ヴァルハラグローブ,Valhalla Gloves
小型のネオン水そう,Small Neon Aquarium
白パールコンパクト,White Pearl Compact
福笑いのラグ・くち,Fukuwarai Mouth Rug
めざましハンドベル,Alarm Clock Bell
深い森の邸宅の門柱,Forest Manor Gatepost
マスカレイドスーツ,Masquerade Suit
お魚と夏野菜の雑炊,Fish and Vegetable Dish
魔天兵ゴルドーたち,Evil Soldier Goldo and co.
純真天使のグローブ,Pure Angel Gloves
だいまどうローブ上,Great Mage Upper Robe
マジックデモニスム,Magic Demonism
まもりのペンダント,Adamant Pendant
ふわふわふうせん緑,Floating Green Balloon
ビクトリーチップ祭,Festival Victory Chip
究極邪教司祭コイン,Ultimate Aamon Coin
異界獣ヘイズシナー,Haze Sinner, the Otherworldly
スノーボールンたち,Snowballon and co.
学園女子の夏服下改,Schoolgirl Summer Skirt2
イルーシャトランプ,Irusha Cards
はじゃのつるぎの書,Cautery Sword Book
ヴァルハラメイル上,Valhalla Mail Top
セクシーライトの本,Sexy Light Book
ドリームエッセンス,Dream Essence
黒紫チューリップ傘,Blk/Prp. Tulip Umbrella
アルゴンキッズの像,Argon Fry Statue
竜と剣の水玉便せん,Dragon Polka Dot Paper
水着ふくびき招待券,Swimsuit Lottery Invite
メタッピーの像・庭,Mecha-Mynah Statue (G)
星石に隠された秘密,Secret in the Meteorite
マスター・クレップ,Guildmaster Krepp
グランドタイタス丼,Grand Titus Bowl
前座芸人のバンダナ,Show Opener's Bandana
スターリースタッフ,Starry Staff
花狩人の衣装券・黄,Ylw. Flower Hunter Tkt
チェックのラグ・赤,Red Checkered Rug
クラシカルスカート,Classical Skirt
まもの使いのくつ２,Monster Master Shoes 2
エピステーサ桃小花,Pink Epistesa Flowers
ドラグーンアックス,Dragoon Axe
オブジェクト座標209,Object Coordinates 209
エステラのこころ９,Estella's Heart Lv9
蘇生時バイキと覚醒,Attack & Magic Savior
赤キノコのテーブル,Red Mushroom Table
ドルワーム研究員帽,Dolworm Research Hat
モダンバニーヘッド,Modern Bunny Ears
預かり所仮面オレン,Storage Masked Oran
短くなったロウソク,Shortened Candle
オブジェクト座標066,Object Coordinates 066
茶マスク猫カプセル,Tea Mask Cat Toy
ネコ呼びよせグッズ,Call Cat Items
オブジェクト座標224,Object Coordinates 224
蝶とレースの便せん,Butterfly & Lace Paper
神兵のよろいセット,Divine Soldier Armor Set
はじゃのよろいぎん,Silver Champ Armor
マーメイドティアラ,Mermaid Tiara
マジックルーレット,Magic Roulette
グリンガムのレシピ,Gringham Whip Recipe
ビューティクリーム,Beauty Cream
オブジェクト座標163,Object Coordinates 163
お祭りやぐら館の壁,Festival Wall
聖守護者のハンマー,Sentinel's Hammer
ノコギリエイソード,Sawfish Sword
こあくまのネイル術,Infernails Technique
クモの巣カーペット,Spider Web Carpet
じょうぶな釣りざお,Strong Fishing Rod
ヘルヴェルトランプ,Helvel Cards
マイタウン農村地区,My Town Rural District
創世の神の絵の写真,God of Creation Photo
福まねきのタヌキ像,Good Luck Tanuki Statue
暗黒大樹の番人たち,Dark Tree Guardians
捨てられた城への道,Road to Abandoned Castle
タイフーングローブ,Typhoon Gloves
退魔の装束の作り方,Make an Exorcism Outfit
アリアハングローブ,Aliahan Gloves
しぐさ書・狼まわし,Emote "Wolf Spin"
全職さいだいＨＰ+30,Max HP +30
潮風のディーバたち,Sea Breeze Divas
オブジェクト座標016,Object Coordinates 016
キラーパンサーの書,Great Sabrecat Book
だいまどうのうでわ,Great Mage Bracelets
クロッシュシューズ,Bell Shoes
リーフ柄の便利な壁,Leaf Pattern Wall
第２回ディエゴの像,2nd Diego Statue
ブレイブキャンディ,Brave Lollipop
ヒューザのこころ７,Hyuza's Heart Lv7
レーナム緑野への道,Road to Lenam Fields
タイフーンレザー下,Typhoon Leather Pants
リポちゃんふうせん,Lipo Balloon
じょうぶな木枠の柱,Solid Wood Frame Pillar
ハートのタンス・黄,Yellow Heart Wardrobe
お花のパーカー水着,Flower Hoodie Swimsuit
預かり所オレンじい,Storage Old Mandarin
苺お菓子のチェスト,Berry Sweet Chest
しゅうれん用リスト,Training Wristbands
三姉妹人形・庭用橙,Orange 3 Sis. Doll (G)
カジノ祭６ビンゴ銀,CasinoFest 6 Bingo Silver
しぐさ書・おびえる,Emote "Scared"
獣魔ローガストの像,Logast Statue
コンシェルジュ０５,Concierge 05
さいほう職人腕あて,Sewer's Armguards
妖精図書館のチェア,Fairy Library Chair
異国のレンガ館の塀,Exotic Brick Fence
ダラズ採掘場への道,Road to Daraz Quarry
旅芸人ピュージュＦ,Minstrel Pyuju F
アルカナ・セラピア,Arcana Serapia
行動時10%でヘビチャ,Heavy Charge On Action 10%
謎の生き人形の写真,Mystery Lively Doll Photo
まどうしのころも下,Wizard's Robe Bottom
第１０回プクラス像,10th Pukulas Statue
オブジェクト座標228,Object Coordinates 228
ノーブルギフト・黒,Black Noble Gift
パドレア邸ブランコ,Padrea Mansion Swing
シーサイドテーブル,Seaside Table
淡い記憶を紐解いて,Unraveling Faint Memories
スライダーククロー,Nemeslime Claws
第３回カジノ祭・銀,3rd Casino Fest Silver
ネオンフラッシュ青,Neon Flash (Blue)
ガートラント兵士Ａ,Gartlant Soldier A
スワンボートベンチ,Swan Boat Bench
魔物管理人ペコリア,Monster Manager Pekoria
ボーイモッズコート,Boy Mod Coat
オブジェクト座標121,Object Coordinates 121
プラコンドレス・赤,Red Dress
第１０回ナンナの像,10th Nanna Statue
ボーガの盾（小盾）,Boga's Buckler
チェイサーレザー下,Chaser Leather Pants
かっぱえび家の帽子,Shrimp Snack Hat
イナミノ街道の木Ｄ,Inamino Highway Tree D
ごうかな長イス・緑,Green Fancy Bench
砂塵の幻馬プリズム,Phantom Horse Prism
しぐさ書・決め左前,Emote "Pose L. Front"
シーグリーンダリア,Sea Green Dahlia
しましまマフラー赤,Red Striped Scarf
サメバーンプリズム,Sharkburn Prism
入団！　カンダタ団,I'm In! Robbin' 'Ood Gang
オブジェクト座標038,Object Coordinates 038
ウサギ魔物のバンド,Rabbit Monster Band
ポールスターのくつ,North Star Shoes
バウギアベビーの像,Baby Earthwyrm Statue
星座の導き・いて座,Star Guide・Sagittarius
とこしえの神殿広間,Temple of Eternity Hall
ガイアファンタジア,Gaia Fantasia
レッドブレイクグミ,Red Break Gummy
アイスゴーレムたち,Glacial Golem and co.
バトエン屋コロペン,Batoen Shop Coropen
メタリックウィング,Metallic Wings
きらめく星の贈り物,Twinkling Star's Gift
古代王族のバングル,Ancient Royal Bangles
キュートなイヌミミ,Cute Dog Ears
天の川をつかまえて,Capture the Milky Way
クイーン釜プリズム,Queen Pot Prism
偽りのレンダーシア,False Lendersia
まごころ駅弁を君に,Sincere Lunch for You
壁かけガタラ紋章旗,Gatara Wall Banner
Ｓジェネラル練習札,Shogum Tag
大きなメルヘンの家,Fairy-Tale House L
ピクニックワグミカ,Wagmika Picnic
ギュッとアオちゃん,Bluey Arm Doll
迷宮の主の間への道,Path to Boss
オブジェクト座標029,Object Coordinates 029
三姉妹人形・家用桃,Pink 3 Sisters Doll
オブジェクト座標255,Object Coordinates 255
ボンボンヘアバンド,Pompom Hairband
僧兵のサークレット,Monk Warrior Circlet
憎しみは時を超えて,Hatred is Timeless
ミニポニテエクステ,Mini Ponytail Extension
キュートなクマミミ,Cute Bear Ears
冥王の使いマボック,Messenger Mavok
バトルマスターの証,Gladiator's Grant
プチゲルニック将軍,Frail Hootingham-Gore
ポーリアにおまかせ,Leave it to Paulia
りゅうおうアックス,True Dragonlord Axe
ライガークラッシュ,Wild Animaul
クローバープリズム,Clover Prism
第２回釣りコン・銀,2nd Fish Contest Silver
お兄ちゃんへの手紙,Letter to Brother
ライトニングソード,Thunderstorm Sword
クリスマスかまくら,Christmas Hut
ムーンバニーブーツ,Moon Bunny Boots
魔物管理人ヒュリー,Monster Manager Huri
ピオラの杖の作り方,Rod of Rapidity Book
モチつき「返し手」,Pound Mochi "Returner"
バスルームの洗面台,Bathroom Washbasin
マスターの悩みの種,Master's Source of Worry
パピヨンドーム・夢,Dream Papillon Dome
ガーディアンブーツ,Guardian Boots
ラウルの肖像画・庭,Rahul Portrait (G)
コイン販売所イサラ,Token Exchange Isara
アシッドクリスタル,Acid Crystal
スコアアタック銀赤,Score Attack Bronze
アズ・フーラズーラ,Azu Fluzula
グレイスフルハット,Graceful Hat
聖王のつるぎの壁画,Dryspell Sword Book
サジェのオルゴール,Sajay Music Box
預かり所クリスタル,Storage Crystal
メタスラの大剣の本,Metal Gooreatsword Book
冒険ゼミ会員ベスナ,Adventurer Seminar Member Sheena
カテドラルグローブ,Cathedral Gloves
しゃしょうぽろっく,Conductor Pollock
ルミナスギフト・白,White Luminous Gift
ゴローさんスリッパ,Goro Slippers
アジサイ姫ゆかた上,Hydrangea Yukata Top
王宮の魔法戦士たち,Royal Palace Armamentalist
ゴルフメンズウェア,Golf Men's Wear
旅芸人ピュージュＩ,Minstrel Pyuju I
ラブリースティック,Fond Wand
ポーンのピース・黒,Black Pawn Piece
カラフル風船・赤黄,Red & Yellow Balloons
プロディトスーツ上,Plaudit Suit Top
ホオズキランプの木,Winter Cherry Lamp Tree
ミステリークッキー,Mystery Cookies
おめかしＶチケット,Dress-up V Ticket
キッズ木馬プリズム,Rocking Small Fry Prism
ヤドリギ広場　入口,Mistletoe Plaza Entry
サマーソルトクロー,Somersault Claw
サボテンダーマスク,Cactuar Mask
ミラージュウィング,Mirage Wings
オブジェクト座標166,Object Coordinates 166
コルット地方への道,Road to Colt Region
しぐさ書・線香花火,Emote "Sparkler"
オーガ人形の作り方,Making Ogre Dolls
ヴァンガードハット,Vanguard Hat
アンノウンショット,Unknown Bow
七夕の吹き流し・星,Paper Star Streamers
レッドガーベラの傘,Red Gerbera Umbrella
ヴェリナード城下町,Verinard Castle Town
ぷすごんのきぐるみ,Pusgon Costume
オラクルギフト・桃,Pink Oracle Gift
ウロコフネタマガイ,Scaly-Foot Gastropod
オブジェクト座標169,Object Coordinates 169
ゴールドマンＭＡＸ,Gold Golem MAX
オスクトルローブ上,Oscutor Robe Top
ネオンフラッシュ赤,Neon Flash (Red)
シスター・アニッタ,Sister Anitta
純喫茶のカウンター,Cafe Counter
レース受付係タータ,Race Receptionist Tarta
黒パールコンパクト,Black Pearl Compact
花菱模様のアオザイ,Floral Pattern Ao Dai
スライムベス便せん,She-Slime Paper
ジェイドウォリアー,Jade Warrior
キラーマジンガの像,Uberkilling Statue
レトロなサングラス,Retro Sunglasses
メルサンディギフト,Melsandy Gift
歪曲性超空間論・下,Distorted Space Vol. 2
オブジェクト座標004,Object Coordinates 004
ちからのペンダント,Wrecklace
ランプ素材屋ナディ,Lamp Materials Nadi
カラミティドラゴン,Calamity Dragon
祈願の神殿の飾り棚,Gratitemple Shelf
オブジェクト座標199,Object Coordinates 199
マスター・ツェンケ,Guildmaster Zenke
キンスラぬいぐるみ,King Slime Plushie
エージェントの服上,Agent Coat Top
レジェンズウィップ,Legends Whip
コンシェルジュ０８,Concierge 08
バトエンコロシアム,Batoen Coliseum
チアガールシューズ,Cheerleader Shoes
奇跡のさいほう針小,Miracle Sew Needle S
お花畑に行きたい！,Go to the Flower Field!
水色チューリップ傘,Blue Tulip Umbrella
オブジェクト座標282,Object Coordinates 282
サーペントウィップ,Serpent Whip
プチＳキラーマシン,Frail Trauminator
オブジェクト座標084,Object Coordinates 084
オブジェクト座標111,Object Coordinates 111
ゼドラ王国服モブ９,Zedra Royal Clothes Mob 9
悪夢のヤドリギ広場,Mistltoe Plaza of Nightmares
クラウドブレイカー,Cloudbreaker
第１０回エルジュ像,10th Erju Statue
ドット階段柄のラグ,Stairs Rug
たれ灰太猫カプセル,Fat Lazy Ash Cat Toy
きしんのまそうの本,Poker Book
呪術師ゴルガーレン,Shaman Golgaren
サンゴールドの花束,Sungold Bouquet
オブジェクト座標175,Object Coordinates 175
オブジェクト座標203,Object Coordinates 203
ガタラ駅の模型・雪,Gatara Stn. Model(Snow)
グレースギフト・黄,Yellow Grace Gift
パンフレットを読む,Read Pamphlet
モダンバニーブレス,Modern Bunny Bracelet
オブジェクト座標213,Object Coordinates 213
幻想画「一触即発」,Fantasy Art "Touch and Go"
金のキーエンブレム,Gold Key Emblem
フォーチュングラブ,Fortune Gloves
ハートの兵隊のくつ,Heart Soldier Shoes
アクセルギアの破片,Mechanical Monocle Shard
ストリートシューズ,Street Shoes
オパールの間仕切り,Opal Partition
黄チェックの便せん,Yellow Checkered Paper
フライパン屋パオス,Frying Pan Shop Paos
司祭のほういセット,Pastor's Outfit
ドワーフプランター,Dwarf Planter
おぞましき呪いの絵,Dreadful Cursed Drawing
マジックスープ・小,Small Magic Soup
パラソルスティック,Jolly Brolly
お姫様バスタブ・桃,Pink Princess Bathtub
イカしたＴシャツ黄,Yellow Cool T-Shirt
ウサぐるみのぼうし,Rabbit Hat
アイスブルーダリア,Ice Blue Dahlia
ヴァンガードグラブ,Vanguard Gloves
プリズニャンぐるみ,Jailcat Plushie
プチアトラスカード,Frail Atlas Card
ビクトリーチップ青,Blue Victory Chip
魔法使いマーガリン,Mage Margarine
毒に呪文ダメアップ,Spell Damage To Poisoned Up
ポーズ書・ハンサム,Pose "Handsome"
ふわふわ雲のタンス,Fluffy Cloud Wardrobe
みかわしの服セット,Evasion Outfit
チェックのラグ・青,Blue Checkered Rug
カラミティデーモン,Calamity Demon
ドラキーウォーマー,Dracky Warmer
カントリードレス上,Country Dress Top
メカニックスーツ上,Mechanic Suit Top
入学案内係フラッセ,Admissions Guide Flasse
職人道具をかかげる,Hold Up Crafting Tool
学園スキルブック１,Academy Skill Book 1
ストームタルト・小,Small Storm Tart
魔物三度笠チケット,Sandogasa Ticket
トレジャーコート上,Treasure Coat Top
ラッキーペンダント,Lucky Pendant
ストームグラス・庭,Storm Glass (G)
オブジェクト座標214,Object Coordinates 214
かーにばるこーでⅡ,Carnival Outfit Ⅱ
マスカレイドヘルム,Masquerade Helm
黄金のピラー・内部,Golden Pillar - Interior
幻界のゆびわの破片,Phantom Ring Shard
景品交換所リーニャ,Prize Exchange Linya
プラネタリウム・青,Blue Planetarium
レンタル衣装無料券,Free Outfit Rent Ticket
ドワーフテーブル小,Dwarf Table S
まけんしのレイピア,Fizzle Foil
プチゴレオンカード,Frail Goreham Card
庭用ハロウィンの墓,Halloween Tombstone (G)
星のおうぎのレシピ,Stellar Fan Recipe
竜と生きるは竜術士,A Dragomancer's Life
ターン消費しない+1%,Free Turn +1%
ムーンバニーパンツ,Moon Bunny Pants
しぐさ書・おそうじ,Emote "Cleaning"
シュメリアスカート,Sumeria Skirt
オブジェクト座標074,Object Coordinates 074
童話の街並みの街灯,Fairy-Tale Lamppost
冒険ゼミ会員ベスコ,Adventurer Seminar Member Sheeko
スマートな水着・黄,Yellow Smart Swimsuit
妖精の女王ウィング,Fairy Queen Wings
南国の釣りざお・氷,Ice Tropic Fishing Rod
オーガの町人ブーツ,Ogre Merchant Boots
ヒマワリのおおづち,Sunflower Hammer
プリズニャン観覧車,Jailcat Ferris Wheel
グリーターデーモン,Greeter Daemon
自動人形ドミネウス,Automaton Domineus
星座の導き・やぎ座,Star Guide・Capricorn
王宮のバスタブ・赤,Red Royal Bathtub
呪文のためのナイフ,Knife for Spells
清廉天使のスーツ下,Honest Angel Pants
マイタウン湿原地区,My Town Marsh District
真紅の殺人機械たち,Crimson Killing Machines
コンシェルジュ１０,Concierge 10
王宮魔術師ローブ下,Royal Mage Lower Robe
機工博士のグローブ,Engineer's Gloves
ドワーフカウンタ大,Dwarf Counter L
郵便局員ジェノール,Postman Gennault
Ｖジャンプの仮面改,V Jump Mask v2
ディープギアマスク,Deep Gear Mask
オブジェクト座標022,Object Coordinates 022
幸せの妖精のたまご,Happy Fairy Eggs
つやつやなタケノコ,Glossy Bamboo Shoot
オブジェクト座標071,Object Coordinates 071
エゼソル峡谷の木Ｃ,Ezesol Canyon Tree C
ムニエカ地方への道,Road to Munieka Region
グロリアスコートＷ,Glorious Coat and Wig
学園女子のジャージ,Schoolgirl Jersey
ベルセルクブレード,Mad Warrior's Blade
魔衛隊士のよろい下,Demon Guard Leggings
ピクニックパルミオ,Palmio Picnic
カジノ祭６ビンゴ銅,CasinoFest 6 Bingo Bronze
タンブラークロッグ,Tumbler Shoes
カボチャテーブル小,Pumpkin Table S
ふわふわサメバーン,Fluffy Sharkburn
超おたから花ルビー,Ruby Treasure Flower
超フライパン作成術,Super Fry Pan Book
ＤＱＸ１０周年御旗,DQX 10th Anniv. Flag
