アルファ用アルウェ王妃の別荘跡(子供たちの隠れ家内部Test),Queen Alwe's Villa Ruins for Alpha (Test Inside Children's Hideout)
バトル班用テストマップ（いにしえのゼルメア）,Team Battle Map Test (Ancient Zelmea)
どらごんくえすとえいとしゅじんこうのいしょう,DQⅧ Hero Costume
このマップは モンスターから逃げられません。,You can't run from monsters on this map.
マッチングテストステージ（同期後移動用）,Match test stage (for moving beat testing)
　　　～モンスター討伐隊隊員からの依頼～,         Monster Strike Force Request
マッチングテストステージ（同期テスト用）,Match test stage (for sync testing)
グランゼドーラ領-グランゼドーラ王国 入口,Gran Zedora Territory - Gran Zedora Kingdom Entry
リャナ荒涼地帯-ねじれたる異形の大地 入口,Lyana Desolate Area - Twisted Deformed Earth Entry
アラハギーロ地方-モンスター格闘場 入口,Al-Ahagiro Region - Monster Arena Entry
メルサンディ穀倉帯-さびれたほこら 入口,Melsandy Millfields - Deserted Shrine Entry
アラハギーロ地方-アラハギーロ王国 入口,Al-Ahagiro Region - Kingdom of Al-Ahagiro Entry
メルサンディ穀倉帯-メルサンディ村 入口,Melsandy Millfields - Melsandy Village Entry
メルサンディ穀倉帯-こもれびの広場 入口,Melsandy Millfields - Sunbeam Square Entry
ぷらこんだんせいようそくたいむらさき,Purple Ceremony Gown
バトル班用テストマップ（ムスト廃墟）,Team Battle Map Test (Musuto Ruins)
季節イベント「お月見」　コンパニオン,Seasonal Event "Moon View" Companion
季節イベント「オ月見」　コンパニオン,Seasonal Event "Moon View" Companion
アラハギーロ地方-日除けのほら穴 入口,Al-Ahagiro Region - Sunshade Cave Entry
アラハギーロ地方-ムルードの岩山 入口,Al-Ahagiro Region - Murudo Mountain Entry
メルサンディ穀倉帯-メルン水車郷 入口,Melsandy Millfields - Melun Watermill Entry
ぷらこんすくーるせいふくおとこちゃ,Brown School Uniform (M)
ぷらこんすくーるせいふくおんなあか,Red School Uniform (F)
受けた属性ダメージの 10%ＨＰ回復<ban>,10% Attribute Damage Taken As HP (PvP×)
ルファ神殿エントランス（オープン）,Rufa Temple - Entry (Open)
神代過ぎ～　春の桜よ　無為に咲く～,Past ages divine, the spring blossoms bloom, waiting idly by...
ぷらこんすくーるせいふくおとここん,Blue School Uniform (M)
ぷらこんすくーるせいふくおんなこん,Blue School Uniform (F)
しかし　持ち物が　いっぱいだった！,But you're carrying too many things!
ぷらこんだんせいようそくたいみどり,Green Ceremony Gown
ぷらこんすくーるせいふくおとこあか,Red School Uniform (M)
ぷらこんすくーるせいふくおんなくろ,Black School Uniform (F)
ぷらこんすくーるせいふくおんなしろ,White School Uniform (F)
ぷらこんすくーるせいふくおとこくろ,Black School Uniform (M)
ぷらこんすくーるせいふくおんなちゃ,Brown School Uniform (F)
ぷらこんすくーるせいふくおとこしろ,White School Uniform (M)
リャナ荒涼地帯-ソーラリア峡谷 入口,Lyana Desolate Area - Solaria Canyon Entry
コニウェア平原-ココラタの浜辺 入口,Coniware Plain - Cocolata Beach Entry
アルファ用井戸(ダンダダ団のアジト),Well for Alpha (Robbin' 'Ood Gang HQ)
バトル班用テストマップ(ツスクル）,Team Battle Map Test (Tsusukuru)
エフェクトイメージさん（１０個）,Mr. Effect Image (10)
だんせいぷらこんふくだーくぐれー,Dark Gray Clothes (M)
ぷらこんだんせいしのびのふくちゃ,Tea Men's Ninja Suit
ぷらこんだんせいようそくたいあお,Blue Ceremony Gown
ぷらこんじょせいしのびのふくあか,Red Women's Ninja Suit
だんせいぷらこんふくみっどないと,Midnight Clothes (M)
じょせいぷらこんふくあいすぶるー,Ice Blue Clothes (F)
ぷらこんじょせいむらさきふりそで,Purple Women's Kimono
バトル班用テストマップ（獅子門）,Team Battle Map Test (Lion Gate)
だんせいぷらこんふくみすとぐれー,Mist Gray Clothes (M)
ぷらこんじょせいしのびのふくこん,Navy Women's Ninja Suit
ぷらこんじょせいしのびのふくもも,Pink Women's Ninja Suit
じょせいぷらこんふくみっどないと,Midnight Clothes (F)
ぷらこんだんせいようそくたいちゃ,Tea Ceremony Gown
ぷらこんだんせいようみどりさんた,Green Men's Santa Suit
ぷらこんだんせいしのびのふくあか,Red Men's Ninja Suit
ぷらこんじょせいようみどりさんた,Green Women's Santa Suit
ぷらこんじょせいしのびのふくあお,Blue Women's Ninja Suit
ぷらこんだんせいしのびのふくくろ,Black Men's Ninja Suit
ぷらこんだんせいしのびのふくこん,Navy Men's Ninja Suit
ぷらこんじょせいみこふくむらさき,Purple Priestess Dress
ぷらこんだんせいしのびのふくあお,Blue Men's Ninja Suit
ぷらこんだんせいようそくたいはい,Ash Ceremony Gown
あすふぇるどがくえんがくせいふく,Asfeld Academy Uniform
ぷらこんじょせいしのびのふくくろ,Black Women's Ninja Suit
プンスコのテーブル＆ティーセット,Punsuko's Table & Tea Set
セレドット山道-ベリルのほら穴 前,Celedot Mountain Pass - Beryl Den
リンジャハル海岸-教会シスター 前,Linjahar Coast - Church Sister
マデ島＆エテーネ王宮（4.5CS専用）,Made Isle & Ethene Royal Manor (4.5CS only)
リンジャハル海岸-リンジャの塔 前,Linjahar Coast - Linja Tower
レビュール街道北-海風の洞くつ 前,Reviewle Highway North - Seabreeze Cave
プログラマー用負荷検証ステージ3,Loading Programmer Verification Stage 3
プログラマー用負荷検証ステージ2,Loading Programmer Verification Stage 2
プログラマー用負荷検証ステージ5,Loading Programmer Verification Stage 5
必殺チャージ時 チャージ時間-10秒,Charge Time -10 sec. On Special
追憶の世界-アルウェ王妃の別荘跡,World of Remembrance-The Ruins of Queen Alwe
プログラマー用負荷検証ステージ4,Loading Programmer Verification Stage 4
プログラマー用負荷検証ステージ1,Loading Programmer Verification Stage 1
ゴリウスの怨霊＆魔道士キルギル,Gorius' Vengeance & Wizard Kirgyl
ぷらこんだんせいようしろあろは,White Men's Aloha
ぷらこんじょせいようあかあろは,Red Women's Aloha
ぷらこんじょせいようももあろは,Pink Women's Aloha
ぷらこんだんせいようももさんた,Pink Men's Santa Suit
はなかりゅうどのころもむらさき,Purple Flower Hunter Outfit
ぷらこんだんせいようくろさんた,Black Men's Santa Suit
ハロウィンクイズ解答ウェディ７,Halloween Quiz Answer Weddie 7
ぷらこんだんせいようあおあろは,Blue Men's Aloha
魔天の勇者＆聖夜の破壊者・雪組,Demon Sky Hero & Holy Night Wrecker Snow Team
ぷらこんじょせいようあおあろは,Blue Women's Aloha
\s\m\eは　コインをなげた。　→　,\s\m\e flips a coin. → The coin lands on !
魔天の勇者＆聖夜の破壊者・闇組,Demon Sky Hero & Holy Night Wrecker Dark Team
ぷらこんじょせいようももさんた,Pink Women's Santa Suit
壊れたアストルティアのコンパス,Broken Astoltia Compass
扉は　かたく　閉ざされている。,The door is tightly closed.
ぷらこんじょせいようしろあろは,White Women's Aloha
ぷらこんじょせいようしろさんた,White Women's Santa Suit
ぷらこんだんせいはかまむらさき,Purple Men's Hakama
\s\m\eは　ダイスをふった。　→　,\s\m\e rolls a die. → It's a !
ぷらこんだんせいようももあろは,Pink Men's Aloha
ぷらこんじょせいようくろさんた,Black Women's Santa Suit
ぷらこんじょせいようあかさんた,Red Women's Santa Suit
ハロウィンクイズ解答ウェディ３,Halloween Quiz Answer Weddie 3
30%の確率で受けたダメージ10%反射,30% Chance to Reflect 10% Damage
豪魔将ベリンダ＆豪魔将ブレンダ,Generals Belinda & Brenda
ハロウィンクイズ解答ウェディ５,Halloween Quiz Answer Weddie 5
ぷらこんじょせいみこふくみどり,Green Priestess Dress
えるどなしんのしょうぞくせっと,Eldona's Outfit
ハロウィンクイズ解答ウェディ４,Halloween Quiz Answer Weddie 4
ぼうえいぐんのせいふくむらさき,Purple Defense Force Suit
ぷらこんだんせいようあかさんた,Red Men's Santa Suit
じょせいぷらこんふくさんせっと,Sunset Clothes (F)
ぼうえいぐんのせいふくはいいろ,Gray Defense Force Suit
ぷらこんだんせいようしろさんた,White Men's Santa Suit
ハロウィンクイズ解答ウェディ６,Halloween Quiz Answer Weddie 6
ハロウィンクイズ解答ウェディ２,Halloween Quiz Answer Weddie 2
ハロウィンクイズ解答ウェディ１,Halloween Quiz Answer Weddie 1
\s\m\eは　カードを引いた。　→　,\s\m\e draws a card. → They drew the !
ぷらこんこどもようみずぎせっと,Children's Swimsuit
レビュール街道南-三門の関所 前,Reviewle Highway South - Three Way Gate
リャナ荒涼地帯-くずれた灯台 前,Lyana Desolate Area - Collapsed Lighthouse
リャナ荒涼地帯-滝を臨む集落 前,Lyana Desolate Area - Waterfall Village
モンセロ温泉峡-中央のやぐら 前,Moncello Spring Gorge - Central Scaffold
セレドット山道-セレドの町 入口,Celedot Mountain Pass - Town of Celed Entry
デフェル荒野-不思議の魔塔 入口,Defel Desert - Mysterious Tower Entry
コニウェア平原-教会シスター 前,Coniware Plain - Church Sister
ドラクロン山地-竜守りの小屋 前,Draklon Mountains - Dragon Guard's Hut
ジャイラ密林-クドゥスの泉 入口,Jyra Jungle - Kudus Spring Entry
会心と暴走時魔物にダメージ +100,Critical & Haywire Damage +100
戦いで 魔物に狙われにくくなる,Less likely to be targeted in battle
こうげき魔力とかいふく魔力 +10,Magical Might/Mending +10
アルファ用追憶の世界 別荘跡編,World of Recollection for Alpha Villa Ruins
テンション時魔物にダメージ+100,Damage During Tension +100
どるわーむけんきゅういんふく,Dolworm Research Suit
ぷらこんだんせいようきあろは,Yellow Men's Aloha
チームゆく年くる年　２０２１,Team New Year 2021
行動時 5%でバイシオンとスカラ,Oomph & Buff On Action 5%
ぷらこんじょせいももふりそで,Pink Women's Kimono
魔天の勇者＆キラークリスマス,Demon Sky Hero & Christmas Killing Machine
ハロウィンクイズ解答エルフ５,Halloween Quiz Answer Elf 5
ぷらこんじょせいみこふくあか,Red Priestess Dress
ぷらこんだんせいようあかろは,Red Men's Aloha
ぷらこんじょせいくろふりそで,Black Women's Kimono
ぼうえいぐんのせいふくみどり,Green Defense Force Suit
魔人エンラージャ＆ムッチーノ,Enraja the Genie & Muccino
チームゆく年くる年　２０１７,Team New Year 2017
ぷらこんじょせいみこふくあお,Blue Priestess Dress
ハロウィンクイズ解答エルフ４,Halloween Quiz Answer Elf 4
ハロウィンクイズ解答エルフ３,Halloween Quiz Answer Elf 3
チームゆく年くる年　２０２５,Team New Year 2025
ハロウィンクイズ解答エルフ１,Halloween Quiz Answer Elf 1
巨人コアを守るジア・クトたち,Defenders of the Core
チームゆく年くる年　２０２２,Team New Year 2022
ラダ・ガートたちに連絡を取る,Contact Lada Gart's Group
はなかりうどのころもむらさき,Purple Flower Hunter Outfit
チームゆく年くる年　２０１９,Team New Year 2019
ＤＱⅧしゅじんこうのいしょう,DQⅧ Hero Costume
ぷらこんじょせいみこふくもも,Pink Priestess Dress
ぷらこんすいーとふくだいだい,Orange Sweet Clothes
わかむしゃのかっちゅうせっと,Young Warrior Armor Set
ぷらこんじょせいあかふりそで,Red Women's Kimono
チームゆく年くる年　２０２０,Team New Year 2020
ぷらこんじょせいようきあろは,Yellow Women's Aloha
ぷらこんおとこぱんぷきんふく,Men's Pumpkin Clothes
だんせいしらなみがらのゆかた,White Wave Yukata (M)
闇に唄う氷にまぎれし聖なる者,Frozen Sacred Singer
ハロウィンクイズ解答エルフ７,Halloween Quiz Answer Elf 7
ぷらこんじょせいしろふりそで,White Women's Kimono
ぷらこんしゃわーよういしょう,Shower Outfit
あすふぇるどがくえんなつふく,Asfeld Academy Summer Wear
はなかりゅうどのころもみどり,Green Flower Hunter Outfit
ハロウィンクイズ解答エルフ６,Halloween Quiz Answer Elf 6
じょせいぷらこんふくむらさき,Purple Clothes (F)
フォークに刺さったパンケーキ,Pancakes Stuck in a Fork
嵐魔ウェンリルとアクラガレナ,Wenrir the Storm & Akragarena
じょせいしらなみがらのゆかた,White Wave Yukata (F)
チームゆく年くる年　２０２４,Team Twenty Twenty Four
ぷらこんきゅーぴっどむらさき,Purple Cupid
ぷらこんおんなぱんぷきんふく,Women's Pumpkin Clothes
ぷらこんおとこどらきゅらふく,Men's Dracula Costume
はるかぜおうえんだんいしょう,Spring Cheer Team Outfit
あすふぇるどがくえんふゆふく,Asfeld Academy Winter Wear
チームゆく年くる年　２０２３,Team New Year 2023
行動時 5%でバイシオンとピオラ,Oomph & Accelerate On Action 5%
ハロウィンクイズ解答エルフ２,Halloween Quiz Answer Elf 2
ヴァレリアの仮面（割れる前）,Valeria's Unbroken Mask
ぷらこんおんなどらきゅらふく,Women's Dracula Costume
行動時 7%でバイシオンとピオラ,Oomph & Accelerate On Action 7%
チームゆく年くる年　２０１８,Team New Year 2018
コニウェア平原-三門の関所 前,Coniware Plain - Three Way Gate
グランゼドーラ領-見張り塔 前,Gran Zedora Territory - Watchtower Front
モンセロ温泉峡-南のやぐら 前,Moncello Spring Gorge - South Scaffold
モンセロ温泉峡-北のやぐら 前,Moncello Spring Gorge - North Scaffold
モンセロ温泉峡-管理人小屋 前,Moncello Spring Gorge - Caretaker's Hut
デフェル荒野-ピラミッド 入口,Defel Desert - Pyramid Entry
ロヴォス高地-教会シスター 前,Rovos Highlands - Church Sister
モンセロ温泉峡-ご神体の間 前,Moncello Spring Gorge - Hall of Worship
デフェル荒野-教会シスター 前,Defel Desert - Church Sister
ジャイラ密林-大樹の根元 入口,Jyra Jungle - Big Tree Root Entry
追憶の世界-キラキラ大風車塔,World Of Remembrance-Windmill Tower
リンジャハル海岸-高台の遺跡,Linjahar Coast - Hilltop Ruins
炎・土・闇の攻撃ダメージ +5%,Fire/Earth/Dark Damage +5%
セレドット山道-滝見の吊り橋,Celedot Mountain Pass - Fallsview Bridge
ハロウィンクイズ解答プク５,Halloween Quiz Answer Puku 5
ハロウィンクイズ解答ヒト２,Halloween Quiz Answer Human 2
未完のドラクロン山地への道,Road to Undone Draklon Mountains
はなかりうどのころもみどり,Green Flower Hunter Outfit
ハロウィンクイズ解答オガ１,Halloween Quiz Answer Ogre 1
ハロウィンクイズ解答ヒト４,Halloween Quiz Answer Human 4
ぷらこんいけてるみずぎあか,Red Cool Swimsuit
ムストの町・風車へのはしご,Morst - Ladder to the Windmill
フラワーガーデン地区への道,Road to Flower Garden District
ぷらこんだんせいはかまくろ,Black Men's Hakama
ハロウィンクイズ解答ヒト５,Halloween Quiz Answer Human 5
女性プラコン服ミッドナイト,Midnight Clothes (F)
ぷらこんえんじぇるふくしろ,White Angel Clothes
ハロウィンクイズ解答オガ５,Halloween Quiz Answer Ogre 5
ドルボ用マネキンドワーフ用,For Dwarf Mannequin For Dolboard
男性プラコン服ダークグレー,Dark Gray Clothes (M)
ぷらこんだんせいはかまこん,Navy Blue Men's Hakama
アスフェルド学園女性用水着,Asfeld Swimwear (F)
ハロウィンクイズ解答プク２,Halloween Quiz Answer Puku 2
男性プラコン服ミッドナイト,Midnight Clothes (M)
ハロウィンクイズ解答ドワ６,Halloween Quiz Answer Dwarf 6
ハロウィンクイズ解答ドワ３,Halloween Quiz Answer Dwarf 3
砂の都ファラザードへの出口,Exit to Farazard
ハロウィンクイズ解答ドワ７,Halloween Quiz Answer Dwarf 7
ハロウィンクイズ解答オガ３,Halloween Quiz Answer Ogre 3
だんせいぷらこんふくぴんく,Pink Clothes (M)
じょせいぷらこんふくぴんく,Pink Clothes (F)
だるめしあんがーるいしょう,Dalmatian Outfit (F)
らんぷれんきんれんしゅうぎ,Lamp Alchemy Training Wear
ぷらこんだんせいはかまあお,Blue Men's Hakama
ハロウィンクイズ解答ヒト３,Halloween Quiz Answer Human 3
未来への扉とまどろみの少女,The Door to the Future & the Slumbering Girl
ぷらこんえんじぇるふくもも,Pink Angel Clothes
ハロウィンクイズ解答オガ７,Halloween Quiz Answer Ogre 7
ハロウィンクイズ解答ヒト７,Halloween Quiz Answer Human 7
未開のジャングル地区への道,Road to Savage Jungle
ドルボ用マネキンプクリポ用,For Pukulipo Mannequin For Dolboard
ぷらこんえんじぇるふくあか,Red Angel Clothes
スターキメラから取った羽根,Cosmic Chimaera Feather
壊れたハイハイジャンプさん,Broken Mr. High High Jump
１００万ゴールドの入った袋,1 Million Gold Bag
ゆうべはおたのしみでしたね,Rooming with a Gamer Gal
ぷらこんおしゃれみずぎくろ,Black Snazzy Swimsuit
ドルボ用マネキンウェディ用,For Weddie Mannequin For Dolboard
ドルボ用マネキンニンゲン用,For Human Mannequin For Dolboard
ハロウィンクイズ解答プク６,Halloween Quiz Answer Puku 6
ぼうえいぐんのせいふくきん,Gold Defense Force Suit
ぼうえいぐんのせいふくあか,Red Defense Force Suit
行動時 3%でテンションアップ,Tension On Action 3%
ハロウィンクイズ解答ヒト１,Halloween Quiz Answer Human 1
ぷらこんおしゃれみずぎしろ,White Snazzy Swimsuit
ぷらこんぱてぃしえふくしろ,White Pastry Chef Suit
ハディン地下洞くつへの出口,Exit to Hadine Cavern
ハロウィンクイズ解答ヒト６,Halloween Quiz Answer Human 6
アスフェルド学園女性用夏服,Asfeld Summer Uniform (F)
ハロウィンクイズ解答ドワ１,Halloween Quiz Answer Dwarf 1
イルーシャのスケッチブック,Illusia's Sketchbook
ハロウィンクイズ解答ドワ２,Halloween Quiz Answer Dwarf 2
ドラゴンクエストＸショップ,Dragon Quest X Shop
ハロウィンクイズ解答オガ４,Halloween Quiz Answer Ogre 4
ぷらこんえんじぇるふくくろ,Black Angel Clothes
アスフェルド学園男性用水着,Asfeld Swimwear (M)
ぷらこんえんじぇるふくあお,Blue Angel Clothes
ぷらこんおしゃれみずぎもも,Pink Snazzy Swimsuit
ルクスガルン大空洞への亀裂,Crevice to Luxgarn Caverns
ぷらこんだんせいはかましろ,White Men's Hakama
アルムゴーグ＆ロムドゴーグ,Armogog & Romdogog
ぷらこんおしゃれみずぎあか,Red Snazzy Swimsuit
ハロウィンクイズ解答プク１,Halloween Quiz Answer Puku 1
ハロウィンクイズ解答プク４,Halloween Quiz Answer Puku 4
アスフェルド学園男性用夏服,Asfeld Summer Uniform (M)
ハロウィンクイズ解答ドワ４,Halloween Quiz Answer Dwarf 4
じょせいぷらこんふくえんじ,Red Clothes (F)
だんせいぷらこんふくえんじ,Red Clothes (M)
清き風吹き　草木は芽吹く～,Pure winds blown and trees grown, budding green as the breeze is thrown
男性プラコン服ミストグレー,Mist Gray Clothes (M)
ハロウィンクイズ解答ドワ５,Halloween Quiz Answer Dwarf 5
未完のモンセロ温泉峡への道,Road to Undone Moncello Spring Gorge
ぷらこんいけてるみずぎもも,Pink Cool Swimsuit
ぼうえいぐんのせいふくこん,Blue Defense Force Suit
ハロウィンクイズ解答プク７,Halloween Quiz Answer Puku 7
ぷらこんぱてぃしえふくもも,Pink Pastry Chef Suit
からすかぐらのしょうぞくⅡ,Crow Dance Costume Ⅱ
ぷらこんぱてぃしえふくあお,Blue Pastry Chef Suit
行動時 5%でチャージ時間-10秒,Charge Time -5 sec. On Action 5%
だるめしあんぼーいいしょう,Dalmatian Outfit (M)
魔物商人＆商品ナンバー１３,Monster Merchant & Item Number 13
女性プラコン服アイスブルー,Ice Blue Clothes (F)
ランドン山脈山頂付近への道,Road to Landon Summit Area
行動時 5%でテンションアップ,Tension On Action 5%
ハロウィンクイズ解答プク３,Halloween Quiz Answer Puku 3
ぷらこんおしゃれみずぎあお,Blue Snazzy Swimsuit
イア・タア　シンパッ・ケウ,E-yis, aneu dish cubrey
ハロウィンクイズ解答オガ２,Halloween Quiz Answer Ogre 2
ぷらこんぱてぃしえふくあか,Red Pastry Chef Suit
はなかりゅうどのころもあお,Blue Flower Hunter Outfit
ぷらこんいけてるみずぎくろ,Black Cool Swimsuit
古グランゼドーラ領への出口,Exit to Old Gran Zedora Territory
ハロウィンクイズ解答オガ６,Halloween Quiz Answer Ogre 6
ぷらこんいけてるみずぎしろ,White Cool Swimsuit
ムストの町・教会跡への出口,Exit to Morst - Church Ruins
はなかりゅうどのころもあか,Red Flower Hunter Outfit
古レビュール街道北への出口,Exit to Old Reviewle Highway North
『ついてクンをひっこめる』,"Remove Pet"
『おうちでついてクン設定』,"House Pet Settings"
攻撃時 5%でチャージ時間-10秒,Charge Time -10s On Attack 5%
戦闘中常時マホトラのころも,Magic Cloak Always Active
からすかぐらのしょうぞくⅠ,Crow Dance Costume Ⅰ
ぷらこんいけてるみずぎあお,Blue Cool Swimsuit
とうばつたいこうほうきょく,Strike Force Bureau
ワルド水源-湖上の休息所 前,Wald Headwaters - Lake Retreat
攻撃力上昇時特技ダメ+20<ban>,Skill Dmg. +20 When Attack ↑ (PvP×)
5000年の旅路 遥かなる故郷へ,5000 Year Journey to a Faraway Hometown
必殺チャージ時 身かわし+10%,Dodge +10% On Special Charge
ロヴォス高地-ゼドラ洞 入口,Rovos Highlands - Zedra Cave Entry
受けるダメージを10軽減する,Damage Taken -10
湖の小島・神のまなこ 出口,Lake Islet - The All-seeing Eye Exit
プログラマー検証ステージ8,Programmer Verification Stage 8
リンジャハル海岸-海岸遺跡,Linjahar Coast - Coast Ruins
ランプ錬金ギルド 地下１階,Lamp Alchemy Guild B1F
湖の小島・神のまなこ 入口,Lake Islet - The All-seeing Eye Entry
味方死亡時 20%でバイシオン,Oomph If Ally Dies 20%
カルデア山道のアジト 出口,Chaldea Mountain Road Hideout Exit
とこしえの神殿楯の間 出口,Temple of Eternity Shield Room Exit
プログラマー検証ステージ5,Programmer Verification Stage 5
とこしえの神殿楯の間 入口,Temple of Eternity Shield Room Entry
モリナラ地下洞・深淵 入口,Molinara Underground Abyss Entry
プログラマー検証ステージ4,Programmer Verification Stage 4
からすかぐらのしょうぞく2,Crow Dance Costume Ⅱ
ビンゴすごろくホール 出口,Bingo & Sugoroku Hall Exit
プログラマー検証ステージ6,Programmer Verification Stage 6
ゼクレス城・魔導広場 入口,Zechres Castle - Magic Square Entry
デス・ジャンクション 出口,Death Junction Exit
開戦時 10%でヘヴィチャージ,Starting Heavy Charge 10%
カルデア山道のアジト 入口,Chaldea Mountain Road Hideout Entry
宇宙船・立入禁止区画 出口,Spacecraft - Restricted Area Exit
デス・ジャンクション 入口,Death Junction Entry
ビタースイーツゾーン 出口,Bittersweets Zone Exit
ビンゴすごろくホール 入口,Bingo & Sugoroku Hall Entry
宇宙船・立入禁止区画 入口,Spacecraft - Restricted Area Entry
スイーツゾーン控え室 入口,Sweets Zone Waiting Room Entry
からすかぐらのしょうぞく1,Crow Dance Costume Ⅰ
プログラマー検証ステージ2,Programmer Verification Stage 2
モリナラ地下洞・深淵 出口,Molinara Underground Abyss Exit
アストルティア博物館 入口,Astoltia Museum Entry
ゼクレス城・魔導広場 出口,Zechres Castle - Magic Square Exit
プログラマー検証ステージ1,Programmer Verification Stage 1
レビュール街道北-谷合の森,Reviewle Highway North - Veil of the Vale
オルセコ闘技城・舞台 出口,Orseco Combat Castle - Stage Exit
エピステーサ底なし穴 入口,Epistesa Chasm Entry
アストルティア博物館 出口,Astoltia Museum Exit
プログラマー検証ステージ3,Programmer Verification Stage 3
古グランゼドーラ王国 入口,Old Gran Zedora Kingdom Entry
シガール町長の執務室 入口,Mayor Sigal's Office Entry
オルセコ闘技城・舞台 入口,Orseco Combat Castle - Stage Entry
スライムレースホール 出口,Slime Race Hall Exit
スライムレースホール 入口,Slime Race Hall Entry
受けるダメージを5軽減する,Damage Taken -5
エピステーサ底なし穴 出口,Epistesa Chasm Exit
スイーツゾーン控え室 出口,Sweets Zone Waiting Room Exit
