アガレスの大紋章,Agares Sigil
ふかふかなキノコ,Soft Mushroom
タイタス号の本棚,Titus Bookshelf
別離の剣器・全霊,Parting Blade of the Soul
ろくしょうダリア,Green Rust Dahlia
グレイトライドン,Night Rider
ガートラント兵２,Gartlant Soldier 2
中層・ルビン宙橋,Middle Area - Rubyn Bridge
真実に気づいた男,He Who Realized Truth
お花とネコの物語,Flowers and Cats Story
ウェルカムハウス,Welcome House
ガズバラン神の像,Statue of Gazbalan
しびれ弾ショット,Shocking Shot
赤バラのテーブル,Red Rose Table
『他の人の家へ』,"To Other House"
うんてんしだふぃ,Driver Duffy
ギュッとアスバル,Asbal Arm Doll
予言者学園学生靴,FTA Shoes (M)
プチビッグな香水,Big Perfume S
アズラン宿屋の扉,Azlan Inn Door
ネタ「そうめん」,Noodles Trick
ワイルドバングル,Wild Bangles
お姫様タンス・桃,Pink Princess Wardrobe
キューティココア,Cutie Cocoa
スライムのベッド,Slime Bed
よろず屋リューロ,General Shop Ryuro
メラゾ熱ワクチン,Kafrizz Fever vaccine
王家のナイフ全集,Nobleman's Knife Set
さめきぐるみくろ,Black Shark Suit
レースの観客２２,Race Spectator 22
いっぱつのよろい,One Shot Armor
しゃっきりレタス,Luscious Lettuce
レシピ屋ルペッタ,Recipe Shop Ruperta
レシピ屋レズリー,Recipe Shop Leslie
よろず屋ルキーノ,General Shop Lukino
カメラこぞうの像,Clicksy Statue
ライダーグローブ,Rider Gloves
芽生えのゆりかご,A Cradle of Sprouts
ツヤめきペイント,Glossy Paint
はじめてのオフ会,A Face to Face First
たいようのおどり,Sun Dance
フォレストの花束,Forest Bouquet
氷の領界の飾り棚,Ice Realm Shelf
アウルスティック,Aur Wand
魔物管理人ドリー,Monster Manager Dory
新作家具屋メアル,New Indoor Furniture Shop Mare
ユグドラシルの本,Spryggdrasil Book
ゆうたのリュック,Gamer Gal Backpack
異形の大地への道,Road to Deformed Earth
預かり所コライユ,Storage Koraiu
イマドキの遊び人,Trendy Gadabout
継続特典係ミノノ,Benefits Shop Minono
ギルガランのくつ,Gilgaran's Shoes
預かり所・郵便局,Depository/Post Office
欠番ジェニャの卵,Missing # Jenya Egg
奈落いざなう棺桶,Coffin to the Abyss
超暴走魔法陣・零,Uber Ring of Ruin
パティシエのくつ,Pastry Chef Shoes
管理端末Ｑ４８５,Management Terminal Q485
ルティショー像黒,Black Astolti Short St.
水晶の壁掛け時計,Crystal Wall Clock
ふしぎなボレロ上,Glombolero Top
ジングルガーター,Jingle Garter
プクリポ間仕切り,Pukulipo Partition
ネタ「ひまわり」,Sunflower Trick
ゾンビキラーの本,Zombiesbane Book
神都フォーリオン,Fourion
あやしいバスタブ,Suspicious Bathtub
エルフのサンダル,Elf Sandals
錬金強化屋アーク,Alchemy Enhancer Arc
預かり所ガリュア,Storage Garua
乗り物係ガドッソ,Vehicle Clerk Gadosso
闇の大魔王の滅角,Archfiend's Horns
預かり所セテーラ,Storage Setera
アリアハンマント,Aliahan Cape
かんだたみならい,Robbin' 'Ood Amateur
家具＆庭具おきば,furniture storage
オセアノススピア,Full Fathom Fork
れんごくまちょう,Bird of Terrordise
出張大使バガトゥ,Ambassador Bagatu
めんこ屋チャガン,Pogs Shop Chagan
テレパスタイツⅠ,Telepath Tights Ⅰ
封印の守護者・右,Seal Guardian - Right
雪だるまつきの畑,Snowman Field
授業ウェディ女性,Weddie Female Student
わふうしょうぞく,Breezy Wear
へびのおうぎの本,Cobra Fan Book
住宅素材屋ゲラド,Housing Materials Gerado
夏のお祭りアーチ,Summer Festival Arch
磁界の効果アップ,Magnetic Field Boost
魔壊将のウィング,Wreck General's Wings
武勲の城のつづら,Valor Castle Wicker Box
カボチャステッキ,Pumpkin Stick
技師の工具かばん,Engineer's Toolbag
いくさ化粧シール,Warpaint Sticker
ドラゴンクロー改,Uber Dragon Claws
紫竜の煌玉の破片,Dragonic Orb Shard
友情の彫像の写真,Friendship Sculpture Photo
混沌竜ランブルス,Rumbles, Dragon of Chaos
パニガルム探査券,Panigalm Explore Ticket
ほっとヘッドホン,Soft Headphones
やさしさのクスリ,Kindness Medicine
スタンカのハンコ,Stanka's Stamp
星降りのローブ上,Starry Robe Top
酒場主人のピアス,Tavernkeeper's Earrings
王家のペンダント,Royal Family's Pendant
レジェンズガード,Legends Guard
ハイパーチケット,Hyper Ticket
証人ラディスオー,Keen Ladis
冥洞に眠る海魔王,Abyssal Leviathan
プクリポ風アーチ,Pukulipo-Style Arch
魔物管理人の制服,Monster Manager Uniform
ウォーターサイド,Waterside
しびれくらげ１２,Man o' War 12
ドラゴンバスター,Wyrmfang
プチキングヒドラ,Frail King Hydra
シルエット・庭草,Silhouette Grass (G)
メレアーデの資料,Mereade's Documents
オパールのベンチ,Opal Bench
レスキュマフィン,Rescue Muffin
レシピ屋ルセット,Recipe Shop Ruseto
預かり所パリュス,Storage Paruse
ガリバーハンド！,Gulliver Hand!
魔法戦士団ブーツ,Armamentalist Boots
光の錬金ランプ小,Light Lamp S
キャロル姫ブーツ,Carol Boots
しびれくらげ０７,Man o' War 07
茶ブチ猫カプセル,Tea Spotted Cat Toy
リザードマン・祖,Ancestral Mandrake Major
メロディアヘッド,Melody Hair Ornaments
カイザードラゴン,Royal Reptile
ギーグハンマー強,Apex Giga Clubber
プチアーノン・強,Vicious Khalamari Kid
エックスシューズ,X Shoes
雪の女王の洞くつ,Snow Queen's Cave
便せん屋タマズサ,Stationery Shop Tamazusa
ゴクラクギョ・黄,Yellow Betta
素材屋ミルフィプ,Material Shop Mirfpu
色見本・みずいろ,Pale Blue Swatch
武器屋バーニジア,Weapon Shop Banijia
カンフースーツ上,Kung Fu Suit Top
はかなき星に光を,Light on a Fleeting Star
ブレイブグリーブ,Brave Greaves
ごはんいこーよ！,C'mon, Let's Eat!
レジェンズファン,Legends Fan
炎光の勾玉の破片,Firelight Jewel Shard
魚交換員ピッチョ,Fish Exchange Picho
ネタ「かんおけ」,Coffin Trick
ネヴァンメイル下,Nemain Mail Bottom
三姉妹の馬車・桃,Pink 3 Sisters Carriage
ダーマ神殿の噴水,Alltrades Fountain
脂たっぷりサバ缶,Canned Fatty Mackerel
マリーントランプ,Malynn Cards
妖精たちのポルカ,Brownie Boost
シーサイドハウス,Seaside House
和風の５色ランプ,Japanese 5 Color Lamp
おばけキャンドル,Wax Murderer
魔軍十二将の絵画,Twelve Tyrants Painting
ポイズンスケイル,Serpentscale Skean
まよえるかるろす,Lost Carlos
ヒューザキッチン,Hyuza Kitchen
紫獅鬼バイロゼオ,Byrozeo, the Purple Lion
パッションリボン,Passion Ribbon
ブラックチャック,Dark Brownie
神光放つ短剣の書,Holy Light Dagger Book
討伐隊員マダラキ,Strike Force Madraki
クリスマスライブ,Christmas Live
ぬいぐるみ屋ウー,Plushie Shop Woo
インテリのうでわ,Brainy Bracer
渡し守ヤンディー,Ferryman Yandey
魚交換員パッピイ,Fish Exchange Pappi
預かり侍女アトリ,Storage Maid Atori
１段ブロック・赤,Red Block
カスタードダリア,Custard Dahlia
ロイヤルチャーム,Sovereign Seal
タータンスーツ上,Tartan Suit Top
ダーマ神殿のラグ,Alltrades Abbey Rug
フェザープリズム,Feather Prism
ネヴァンメイル上,Nemain Mail Top
ブレイクシューズ,Break Shoes
蒼穹の守護者たち,Azure Sky Guardians
しぐさ書・自撮り,Selfie
帽子係アンジュー,Hat Clerk Anju
ワルド水源への道,Road to Wald Headwaters
ネコミイラ衣装Ⅰ,Cat Mummy Costume Ⅰ
深い森の邸宅の床,Forest Manor Floor
へこむカンナさん,Dismal Master Kanna
ひとくいばこ・祖,Ancestral Cannibox
くろがねのブーツ,Darksteel Boots
黄金のバディンド,Golden Badindo
しっくごすせっと,Chic Goth Outfit
ベージュカメリア,Beige Camellia
初任務はモリナラ,Molinara First Mission
目覚めし５つの鍵,Awakening of the 5 Keys
クライシスマスク,Crisis Facemask
ルファ神殿・入口,Rufa Temple - Entry
ハンマー作り入門,Hopeful Hammer Making
ゴスバニーブレス,Goth Bunny Bracelets
カンフースーツ下,Kung Fu Suit Bottom
花柄モダンはかま,Modern Floral Hakama
遊び人の服セット,Gadabout Outfit
道具屋リーフィヤ,Item Shop Leafia
色見本・きみどり,Yellow Green Swatch
マーガレットの傘,Marguerite Umbrella
ジャックの衣装２,Jack's Costume 2
ファラオ・ナジャ,Pharaoh Naja
ヘルシーワッフル,Healthy Waffles
モーグリチケット,Moogle Ticket
ハイパーマカロン,Hyper Macaron
郵便局員ツィサア,Postman Tsisa
ベホイムスライム,Sootheslime
ガズバランの牙Ａ,Gazbalan's Fang A
バロンシルエット,Baron Silhouette
ブレイブクリーム,Brave Cream
ネコ姫の観葉植物,Cat Princess Plant
特急メタル招待券,Express Metal Ticket
オルフェア白色花,White Orphea Flowers
グイッと青春の味,A Taste of Youth
果ての泉の孔雀姫,The Peacock Princess
奇跡の木工刀の本,Miracle Slick Book
木の葉のよろい下,Foliage Armor Bottom
ハロウィンタンス,Halloween Wardrobe
覇者のローブ・金,Gold Champ Robe
メタルかがみもち,Festival Metal Slime
ヘルガーディアン,Hell's Gatekeeper
レシピ屋ロミルダ,Recipe Shop Romilda
ダストンパラソル,Duston Umbrella
レースの観客１７,Race Spectator 17
しぐさ書・きのこ,Mushroom Trick
デフェル荒野の石,Defel Desert Stone
ノクゼリアワンド,Noxeria Wand
こげ茶猫カプセル,Olive Cat Toy
ゼクレス精鋭槍兵,Zechres Elite Spearman
ふくめんうさぎ１,Masked Rabbit 1
バーニングバード,Firebird Throw
しぐさ書・決め後,Decisive Pose Rear
どうぐを愛した男,He Who Loves Items
第１１回ケイト像,11th Kate Statue
マキュリの冷蔵庫,Makyuri Refrigerator
荘厳な紋付はかま,Solemn Crest Hakama
ギュメイ将軍の像,Goresby-Purrvis Statue
アズラン温泉旅情,Azlan Hot Spring Travels
赤バラのチェスト,Red Rose Chest
ツボ錬金設備・庭,Pot Alchemy Facility(G)
おてんば姫のふく,Alena's Dress
種族神像ウェディ,Weddie Tribal Statue
壁かけ管理棟の窓,Admin Building Window
マーチングパンツ,Marching Pants
ステューデントＲ,Student R
コンキスタグール,Conquistador Ghoul
エテーネのつばさ,Ethene Wing
エンゼルブレード,Angel Blade
ドワーフの便せん,Dwarf Paper
やいばのよろい下,Spiked Armor Bottom
しぐさ書・ハート,Draw a Heart
便せん屋ヒナゲシ,Stationery Shop Poppy
天の川のついたて,Milky Way Partition
野いちごサンダル,Wild Strawberry Sandals
魚交換員ポップイ,Fish Exchange Popui
屋根つき露天風呂,Open-Air Bath
参の式修了の陽符,Yang III Completion Charm
防衛軍のグローブ,Defense Force Gloves
海賊なりきり財宝,Pirate Treasure
討伐隊員ホソバミ,Strike Force Hosobami
魔天鳳レアルフス,Sky Phoenix Realphus
クリスマスの暖炉,Christmas Fireplace
みやびな飾り扇子,Elegant Decor Fan
道化師のグローブ,Buffoon's Gloves
ルビーのドレス上,Ruby's Dress Top
ダーククリスタル,Dark Crystal
東洋風チェア・華,Floral Orient Chair
石だたみ柄のラグ,Cobblestone Pattern Rug
きようさにくまん,Deft Meat Buns
マジカルチケット,Magical Ticket
てれぱすたいつⅠ,Telepath Tights Ⅰ
ナンナのこころ５,Nanna's Heart Lv5
セラフィＴシャツ,Seraphi T-Shirt
Ｖジャンプベレー,V Jump Beret
客室案内ブレント,Room Guide Brent
音符のタンス・黒,Black Music Wardrobe
フラウスショット,Flaus Bow
宵と暁の伝承の本,Legend of Dusk and Dawn
炎の友情☆ダンス,Fiery Friendship Dance
パンプキンの衣装,Pumpkin Costume
ウェナールシェル,Wenal Shell
暁の使者コッケン,Dawnkeeper Cuckoo
トモガラのお願い,Tomogara's Request
マホトラのころも,Magic Cloak
お祝いシャワー黄,Celebration (Yellow)
びようしぱぱーな,Papana
聖守護者のつるぎ,Sentinel's Sword
男性プラコン服白,White Clothes (M)
知の試練・第２層,Wisdom Trials - L2
時獄のドミネウス,Damned Domineus
ヒストリカの像＋,Historica Statue +
荷馬車の作業員Ａ,Wagon Worker A
桜蝶鬼メイガたち,Meiga, the Pink Butterfly and co.
ひと筆のこだわり,A Single Stroke
まほうせんしだん,Armamentalist Corps
シスター・リリン,Sister Lilin
リリオルを探せ！,Find Lyriol!
壁かけ掛け軸・夏,Summer Wall Scroll
魔獣調教士ガブラ,Beast Trainer Gabra
色見本・やまぶき,Golden Yellow Swatch
ボロボロのリボン,Tattered Ribbon
ルビーのドレス下,Ruby's Dress Bottom
カムシカプリズム,Azlantelope Prism
ステューデントＢ,Student B
剥きかけりんご左,Left Peeled Apple
黒騎士のよろい下,Black Knight Kilt
まもの使いハウス,Monster Master House
フロートプラント,Floating Plant
邪眼の盾の作成術,Make an Evil-Eye Shield
いやしのムニエル,Mending Meuniere
どうぐ使いの時代,Era of the Item Master
凍れる時獄の秘法,Art of Frozen Time
復活時早詠みの杖,Faster Caster Revival
ノーライフロード,Lifeless Lord
交換屋フォーリィ,Exchange Shop Foley
カボチャの食器棚,Pumpkin Cupboard
守護天使の装束下,Guardian Angel Pants
光のオーナメント,Light Ornament
ガテリア式動力源,Gateria Power Source
ピンクタイフーン,Pink Typhoon
パティシエの服上,Pastry Chef Shirt
ルフの盾の作り方,Making Luf's Shield
前座芸人のズボン,Show Opener's Pants
しぐさ書・ねる２,Sleep 2
青リンゴのタンス,Green Apple Wardrobe
童話ゆうわくの弓,Fuddling Fairy Tales
スタジアムリスト,Stadium Wristbands
忘れられし王の間,Forgotten King's Room
マーブルシュガー,Marble Sugar
マーブルステッキ,Marble Wand
竜のうろこの破片,Dragon Scale Shard
チャンスコマンド,Chance command
峡谷のヴァランガ,Valanga Canyon
バンデッドボトム,Brigand's Bottom
超便利ツール印章,Companion App Stamps
ビンのテラリウム,Bottle Terrarium
大魔王のお召し物,Apparel for a Demon Lord
ナンナのこころ２,Nanna's Heart Lv2
ダイコンのタンス,Daikon Wardrobe
シュメリアヒール,Sumeria Heels
朽ちた遺跡の寝台,Ruin Bed
ツボ素材屋ジョス,Pot Materials Joss
よろず屋プロシオ,General Shop Proshi
プラチナメイル下,Platinum Mail Bottom
知の試練・第１層,Wisdom Trials - L1
プシューケーの盾,Psyche Shield
バトマスグリーブ,Battlemaster Greaves
さいほう職人の魂,The Soul of Sewing
しぐさ書・苦笑い,Bitter
くさりのあみぐつ,Chain Boots
アイドルスーツ上,Idol Shirt
シスター・レレノ,Sister Releno
ノクゼリアエッジ,Noxeria Edge
ウェスタンハット,Western Hat
シスター・ミアナ,Sister Miana
バケーロの子分Ａ,Bakero's Henchman A
ホワイトショコラ,White Chocolate
メタルスライム強,Apex Metal Slime
聖王のブーメラン,Dryspell Boomerang
レンダーシア上空,Lendersia Skies
はがねのよろい上,Steel Armor Top
ダークキングの像,Dark King Slime Statue
シャドーノーブル,Shadow Noble
素材屋のぼうし紅,Red Material Shop Cap
超酸性の間　入口,Super Acidity Entry
福笑いのラグ・鼻,Fukuwarai Nose Rug
花婿のタキシード,Groom's Tuxedo
古びた糸とじの書,Old Thread-Bound Book
王家の迷宮の燐光,Royal Maze Phosphor
アビサルシャーク,Abyssal Shark
ジングルモーモン,Jingly Sanguini
英知を積み重ねて,Accumulating Wisdom
海竜ヴォドニーグ,Sea Dragon Vodnig
スイの塔への出口,Exit to Sui Tower
乱破の忍び装束下,Spy's Ninja Bottom
水神ギルギッシュ,Water God Gilgish
ふわふわサンダル,Fluffy Sandals
ブリガンオーダー,Brigan Order
魔法学園のぼうし,Magic School Hat
王城の悪夢・１階,Nightmare's Castle 1F
アルゴングレート,Great Argon Lizard
音符のベンチ・黒,Black Music Bench
キュルル花火・虹,Rainbow Kyururu Fwork
せいれいの杖の書,Spirit Staff Book
Ｔカバーな海パン,T-Shirt Swim Trunks
女神の魂の在りか,Soul of the Goddess
アンタッチャブル,Untouchable
シャボンのアーチ,Bubble Arch
鉱物生命体の弾丸,Life Mineral Bullet
しぐさ書・つまむ,Picked Up
よろず屋ペリトン,General Shop Periton
ごうけつのけがわ,Ursa Minor Fur
クリスマスカード,Christmas Card
アロケルのおうぎ,Allocer Fan
リソルぬいぐるみ,Resol Plushie
ろんぐたきしーど,Long Tuxedo
しぐさ書・天灯桃,Pink Lantern
アメジストクラブ,Amethyst Crab
黄金のブローチ？,Golden Brooch ?
大型魔神機開発部,Large Aztech Development
ミラクルクッキー,Miracle Cookies
ギュッとアイゼル,Eisel Arm Doll
ガーデンシャワー,Garden Shower
郵便局員ピティカ,Postman Pitica
ポランパンの書状,Poranpan's Letter
聖王の大盾の壁画,Dryspell Grtshd Book
ボンボンスカート,Pompom Skirt
ベントラーコイン,Bentler Coin
よろず屋ゴーツク,General Shop Gotsuku
壁かけＤＱⅡの絵,DQⅡ Painting
レースの観客２４,Race Spectator 24
セラフィゴーグル,Seraphi Goggles
ドルワーム兵士１,Dolworm Soldier 1
ヴォルカドラゴン,Volcanic Dragon
エンゼルアックス,Angel Axe
エルダーフレイム,Old Flame
ショッパーバッグ,Shopping Bag
めいたんていけち,Sleuth Kechi
第３回魔勇者の像,3rd Evil Hero Statue
フォルモンティ村,Vollmondi Village
反乱軍メンバー１,Rebel Army Member 1
しゃしょうばぎー,Conductor Bagy
虚竜王グリーデル,Griedel, Dragon King of the Void
はやてのバンダナ,Agility Bandana
てんとうスカラベ,Spotted Scarab
太陽の斧を求めて,Seeking Apollo's Axe
メネトのキッチン,Menet Kitchen
光の神殿・最上層,Temple of Light - Top Floor
三首海竜のピアス,Sea Dragon Earring
あくじきオオワシ,Voracious Eagle
しびれくらげ２３,Man o' War 23
あくまのきしの像,Knight Aberrant Statue
吊るしテラリウム,Hanging Terrarium
よろいのきし召喚,Summon Knight Errant
キュートクリーム,Cute Cream
魚交換員グナクー,Fish Exchange Gunaku
兄弟姉妹コーデ券,Sibling Glamour Ticket
しびれくらげ２５,Man o' War 25
実行委員エルスカ,Executive Committee Elska
白亜の博物館の塀,Chalk Museum Fence
マリン調の食器棚,Marine Cupboard
奇跡の錬金ツボ小,Miracle Pot S
デビパンクブーツ,Devil Punk Boots
リラックス浮き輪,Relax Floatie
ワンダークリーム,Wonder Cream
放送局員ドラビー,Broadcaster DV
きら星のドレス上,Twinkling Dress
ストリートベスト,Street Vest
破砕将のハンマー,Crush General's Hammer
ファータグローブ,Fata Gloves
ちょこっとすーつ,Choco Suit
ヤマネコシューズ,Wildcat Shoes
死のカラステング,Death Crow
ハロウィンメイン,Halloween Mein
ロングタキシード,Long Tuxedo
こいするちゅちゅ,Tutu in Love
氷の魔王のブーツ,Ice Demon Boots
ウルベアの自販機,Urbea Vending Machine
ノーブルコート上,Noble Coat Top
マリン調のタンス,Marine Wardrobe
ぐろりあすすーつ,Glorious Suit
トーテムケープ上,Totem Cape
トナカイグローブ,Reindeer Gloves
タダ土地チケット,Free Plot Ticket
これからの私たち,Our Path Ahead
格式高い申請用紙,Formal Application Form
ステューデントＳ,Student S
くろがねの小ビン,Iron Phial
ガーデンスーツ上,Garden Suit Top
イワトビカプセル,Rockhopper Penguin Toy
動くあいさつ印章,Animated Stamps
黒仙翼の羽ばたき,Fairy Wings Flapping
ハロふわホイミン,Halloween Healie
玉ネギのチェスト,Onion Chest
スペシャルランチ,Special Lunch
ファラスパラソル,Faras Umbrella
金平糖ライト・氷,Ice Candy Light
スライムステッキ,Slime Stick
バルディスタ工兵,Valdistan Engineer
武勲の城の黒障子,Valor Castle Dark Shoji
ＣＭ用ウェディ１,Weddie For CM 1
アツアツグラタン,Piping Hot Gratin
ガンコ職人の息子,A Stubborn Craftsman's Son
フラワーウィング,Flower Wings
もうどくブルース,Poisonous Blues
ナチュラルチェア,Natural Chair
出張購買員パタタ,Team Supplier Patata
フォトライフ・銅,Photo Life Bronze
レースの観客１６,Race Spectator 16
ダンダダ団アジト,Robbin' 'Ood Gang HQ
魔改造クリムゾン,Modified Crimson
ルビーのサンダル,Ruby's Sandals
バラモスブロス強,Apex Soul of Baramos
シスター・レジア,Sister Regia
ガートラント城駅,Gartlant Castle Station
第８回ラウルの像,8th Rahul Statue
ドラゴンクロー絶,Apex Dragon Claws
アンルシアの像＋,Anlucia Statue +
ドワーフバスタブ,Dwarf Bathtub
海底都市ルシュカ,Undersea City Ruska
しっこくのつばさ,Black Wings
しぐさ書・あわわ,Gasp
ドワチャッカ大陸,Dwachakka
シスター・ソマリ,Sister Somali
しょうにんでんな,Merchant Denna
スチームスーツ下,Steam Suit Bottom
郵便局員サショラ,Postman Sashola
ドット絵エステラ,Pixel Art Estella
大会係員ブルバー,Event Staff Bruba
しぐさ書・ピース,Peace Sign
くすしのローブ上,Apothecary Upper Robe
預かり所サクニナ,Storage Sakunina
チョコスティック,Choco Stick
プチバズズカード,Frail Pazuzu Card
ドラゴンベスト上,Dragonscale Vest
案内係サフィール,Guide Sapphire
夢の王国ドレス上,Dream Kingdom Shirt
呪われし友に手を,Hand to My Cursed Friend
ごちそうターキー,Feast Turkey
紹介人インジェラ,Introducer Injera
世界一クイック伝,World's Quickest Legend
イオ１０系の写真,Bang 10 Series Photo
レースの観客１１,Race Spectator 11
プラークラベーン,Giant Stingray
キュルルのチョコ,Kyururu Chocolate
あざやかな笹飾り,Vivid Bamboo Decor
ガズバランの封洞,Gazbalan Sealed Cave
合唱隊のスモック,Choir Smock
アクロニウム鉱石,Acronium Ore
餅つきジャーミィ,Mochi-Pounding Jammy
栄光に隠された闇,A Glorious Darkness
スピードアップ床,Speed Up Floor
ライダーススーツ,Riders Suit
はじまりの地の木,Land of Beginnings Tree
キュルル花火・緑,Green Kyururu Firework
バーバニジャンボ,Barbunny Jumbo
授業ドワーフ男性,Dwarf Male Student
授業ウェディ男性,Weddie Male Student
夢見る占い師たち,Dreaming Fortune Tellers
知の試練・第３層,Wisdom Trials - L3
タンブラーボトム,Tumbler Pants
２段ブロック・青,Blue 2-Step Block
閃手賞トロフィー,Athlight Trophy
マーメイドベッド,Mermaid Bed
かぜきりの弓の書,Blowy Bow Book
くじゃくの巻き物,Peacock Scroll
サバイバルスキル,Ruggedness skill
ロリータドレス下,Lolita Dress Bottom
ワーニングな水着,Warning Swimsuit
手作りのロザリオ,Handmade Rosary
渡し守スーティー,Ferryman Sutei
絆のエンブレム改,Uber Bonding Emblem
デビパンクセット,Devil Punk Outfit
悪魔の翼プリズム,Devil Wings Prism
ザンクローネの像,Zankrone Statue
わかめ由来石けん,Seaweed Soap
フォーリオンの空,Skies of Fourion
プロミネンス着弾,Prominence Impact
隠密の装束セット,Covert Outfit
メカニックハンド,Mechanic Gloves
悪夢の追っ手たち,Nightmare Persuers
アステライト鉱石,Astolyte
マザー・ヨハンナ,Mother Johanna
ふわふわ人魂・黄,Floaty Gold Wisp
かいぞくウーパー,Salamarauder
壁かけの鉄格子窓,Iron Grate Window
クロッシュメット,Bell Hat
保育地区の移動台,Nursery District Platform
しびれくらげ１４,Man o' War 14
大地の竜玉の破片,Earthwyrm's Eye Shard
始源の歌姫セット,First Diva's Outfit
きょくげいスキル,Litheness skill
はじめての木工術,Would-Be Woodworking
パハカースの肋骨,Pahkas' Bone
預かり所アガット,Storage Agato
ハンタースーツ上,Hunter Suit Top
バラモスブロス闘,Epic Soul of Baramos
女王たちきりバチ,Queen Buzzbee
ぬすっとウサギ？,Robber Rabbit?
プラコン用白ヒゲ,White Mustache
ラピッドステッキ,Rapid Stick
スライムベスな傘,She-Slime Umbrella
しぐさ書・ツリー,Tree Trick
アヌビスアタック,Anubis Assault
ふわふわ雲のラグ,Fluffy Cloud Rug
レビュール街道南,Reviewle Highway South
パピヨンクラウン,Papillon Crown
シールドブレイク,Shattershield
口調の書・能天気,Tone Book - Easygoing
古強者のよろい下,Veteran's Faulds
しびれくらげ２２,Man o' War 22
夏のかき氷セット,Summer Shaved Ice Set
しぐさ書・天灯黄,Yellow Lantern
グロスナー王の剣,King Grossner's Sword
ラーヴァドラゴン,Lava Hydra
聖大剣アスカロン,Holy Sword Ascalon
ライトニング無頼,Lightning Unreliable
フォトライフ・銀,Photo Life Silver
行動時10%で血吸い,Siphon On Action 10%
天翼のエンブレム,Heavenly Emblem
はじめてのルーペ,Beginner's Loupe
サイキョーＶロン,Psycho Vron
プチガイアカード,Frail Gaia Card
猛火竜のタトゥー,Fire Dragon Tattoo
魔天獅ヒッポルコ,Magic Lion Hippolko
いだいなてんさい,Great Genius
占い師の四角ラグ,Diviner Square Rug
レースの観客１５,Race Spectator 15
黒夜叉のよろい下,Black Bane Legs
ファントムハック,Seeing Stars
