プクリポ風アーチ,Pukulipo-Style Arch
大怪傑のはちまき,Wondrous Headband
講師ベスカトーレ,Lecturer Vescatore
ふかふかなキノコ,Soft Mushroom
ブルームウィング,Bloom Wings
ちあがーるのふく,Cheerleader Clothes
バジリスクの石版,Basilisk Tablet
らくらくジョウロ,E-Z Watering Can
ガートラント兵３,Gartlant Soldier 3
ふわふわキンギョ,Floaty Goldfish
シスター・リンネ,Sister Linne
大地の竜玉の破片,Earthwyrm's Eye Shard
ディバインソード,Divine Sword
ヒャクマガリの根,Terribly Twisted Root
レビュール菜の花,Reviewle Rapeseed
タホドラキー・祖,Ancestor Drackmage
シャインスコール,Starburst Throw
超さいほう針の本,Super Needle Book
ドワーフの便せん,Dwarf Paper
療養地区の移動台,Medical District Platform
防具屋アベーシャ,Armor Shop Abesha
原始獣のシャプカ,Primal Beast Shapka
便せん屋ウツセミ,Stationery Shop Utsusemi
シスター・ミアナ,Sister Miana
景品交換所コルナ,Prize Exchange Koruna
手作りのロザリオ,Handmade Rosary
プチデビルブーツ,Petit Devil Boots
切る前の玉子焼き,Uncut Omelet
ピンクタイフーン,Pink Typhoon
魚交換員プルンパ,Fish Exchange Purunpa
レースの観客１４,Race Spectator 14
悪霊の神々コイン,Evil Trinity Coin
ふぉーまるすーつ,Formal Suit
武勲の城の金箔壁,Valor Castle Foil Wall
真夜中プリズラン,Midnight Jailrun
マジカルクラウン,Magical Crown
つっこみレーサー,Ridge Racer
魔塔研究家マディ,Tower Researcher Maddy
大きなお菓子の柱,Big Sweets Pillar
シール特別交換券,Sticker Exchange Ticket
マリーンの金剛棒,Malynn's Diamond Rod
リュウグウノユミ,Oarfish Bow
まよえるえうりこ,Lost Eurico
王宮のタンス・青,Blue Royal Wardrobe
メガトンチャンプ,Megaton Champ
バトルチョーカー,Dogged Collar
東洋風ベッド・華,Floral Orient Bed
古グランゼドーラ,Old Gran Zedora
ガテリア式真空管,Gateria Vacuum Tube
ラグジュアルリム,Luxury Rim
おおきなリボン黄,Yellow Ribbon L
どうぐやえいなる,Item Shop Einar
かいぞくウーパー,Salamarauder
王国軍司令部の家,Royal Army HQ House
ウイングタイガー,Missing Lynx
グリーンエッグ２,Green Egg 2
スチームチェスト,Steam Chest
くさりのあみぐつ,Chain Boots
レシピ屋ユシレピ,Recipe Shop Yusirepi
交換屋クラリッサ,Exchange Shop Clarissa
サーチャーギフト,Searcher Gift
キャプテンマント,Captain's Cloak
炎の友情☆ダンス,Fiery Friendship Dance
牙狼のジャケット,Fanged Wolf Jacket
行動時 5%でバーハ,Insulate On Action 5%
オセアノススピア,Full Fathom Fork
水晶のカーペット,Crystal Carpet
ミシュアのブーツ,Mishua Boots
ナスビのランタン,Woebergine Lantern
七夕の錬金ランプ,Star Festival Lamp
バカンウグレ遺跡,Bakanugure Ruins
新兵支給てぶくろ,Recruit Gloves
しぐさ書・あわわ,Emote "Gasp"
もこふわパジャマ,Fluffy Pyjamas
花びらチャーム桃,Pink Petal Charm
毛皮に包まれた氷,Fur-wrapped Ice
カンダタ月へ行く,Robbin' 'Ood to the Moon
預かり所ヤムジク,Storage Yamujiku
クリスマスカード,Christmas Card
スペシャルランチ,Special Lunch
札強化屋ラベロー,Card Enhancer Rabero
闇騎士のよろい上,Dark Knight Upper Armor
ベルトロの部下Ｄ,Bertro Subordinate D
黒岩削り出しの柱,Black Rock Pillar
防衛軍のグローブ,Defense Force Gloves
アイスダンス衣装,Ice Dance Outfit
奈落の門への出口,Exit to Abyss Gate
ガタラ原野の木Ａ,Gatara Fields Tree A
ボンボントップス,Pompom Top
ルシェンダの手紙,Lushenda's Letter
アルゴンズポーチ,Argon Pouch
破壊神シドーの像,Malroth Statue
ルフの盾の作り方,Making Luf's Shield
リウ老師の探知機,Master Liu's Locator
月と虹のモビール,Moon & Rainbow Mobile
ニューＶロンの盾,New Vron Shield
攻撃時10%でスタン,Stun Attack 10%
メタスラのベッド,Metal Slime Bed
グランゼドーラ兵,Gran Zedora Soldier
バルディスタ剣兵,Valdistan Swordsman
東洋風ランプ・雅,Chic Orient Hung Lamp
プチビッグな香水,Big Perfume S
排他検証ステージ,Exclusive Survey Stage
魔力吸収布の製法,Magic Cloth Method
ザハディガル岩峰,Zahadigal Pinnacle
はやてのグローブ,Agility Gloves
シスター・パパラ,Sister Papala
ローズフォーム上,Rose Form Top
マジェスタハット,Majesta Hat
かぜのブーメラン,Gusterang
黒ねこの便利な壁,Black Cat Wall
初期ドワーフ女性,Initial Dwarf Female
暗黒の魔人練習札,Ruin Tag
念晶錬磨場・初級,Telecrystal Refinery - Beginner
ケイオスの儀式書,Berserker's Ritual Book
フェンサーハット,Fencing Hat
キュルルのポスト,Kyururu Mailbox
しびれくらげ０７,Man o' War 07
レシピ屋ペリンタ,Recipe Shop Perinta
キューティココア,Cutie Cocoa
脱力系クッション,Relaxing Cushion
魔想念ローガスト,Remnant of Logast
授業ウェディ女性,Weddie Female Student
合唱隊のニーハイ,Choir Knee-Highs
デザートスプーン,Dessert Spoon
ネヴァンメイル下,Nemain Mail Bottom
格式高い申請用紙,Formal Application Form
ホワイトジャッジ,White Clubber
特技の効果範囲+1m,Skill Range +1m
レトロなランタン,Retro Lantern
激情の竜エステラ,Estella, Dragon of Passion
クッキングデビル,Cooking Devil
もこもこスカート,Fluffy Skirt
シスター・マレレ,Sister Marelle
トライバルトップ,Tribal Top
しぐさ書・身支度,Emote "Get Ready"
どくろあらい・強,Vicious Haardvark
壁かけ一輪花の絵,Flower Painting
フライングスノー,Flying Snow
サイドヘアリボン,Side Hair Ribbons
大サバ猫カプセル,Big Gray Cat Toy
代理人グラドマン,Agent Gladman
マジカルドレス上,Magical Dress Top
釣り鐘守りの日記,Bell Keeper's Diary
双月のスティック,Double Moon Wand
中央地区ペコリア,Central Area Pekoria
パワフルステーキ,Powerful Steak
トトゴンカプセル,Totogon Toy
コッケンの乗る棒,Kokken's Riding Crop
新作家具屋メアル,New Indoor Furniture Shop Mare
まよえるまるこす,Lost Marcos
クイーンのカード,Queen Card
しょうにんあがた,Merchant Agata
キャプテンの眼帯,Captain's Eyepatch
ユシュカカプセル,Yushka Toy
ネコ姫のオルガン,Cat Princess Organ
ラブリーチケット,Lovely Ticket
スライムのタンス,Slime Wardrobe
ヘヴィーグローブ,Heavy Gloves
夕焼け雲のソファ,Sunset Cloud Sofa
バンデッドボトム,Brigand's Bottom
つりしのいしょう,Angler's Costume
想いを針にこめて,Put Thoughts in a Needle
ドラゴンバスター,Wyrmfang
便せん屋ウィット,Stationery Shop Uito
ナスビナーラの像,Woebergine Statue
人狼ウォルマード,Werewolf Wolmad
いっぱつのつるぎ,One Shot Sword
メタルモンスター,Metal Monster
中型魔神機開発部,Medium Aztech Development
マルグリットの娘,Margaret's Daughter
金平糖ライト・桃,Pink Candy Light
会心率と暴走率+2%,Critical & Haywire Rate +2%
バズミルクティー,Pazu Milk Tea
サフラングローブ,Saffron Gloves
黄色パンジーの傘,Yellow Pansy Umbrella
パンプキンタイツ,Pumpkin Tights
フラワーギフト券,Flower Gift Voucher
セルケトのアンク,Serket's Ankh
ふしぎなボレロ上,Glombolero Top
お茶屋のパラソル,Teahouse Umbrella
シンイのこころ１,Shini's Heart Lv1
地獄のミサワ印章,Misawa of Hell Stamps
ネックレスの包み,Necklace Package
ドラゴングローブ,Dragon Gloves
便せん屋メビシェ,Stationery Shop Mebishe
こがらしのダガー,Pruning Knife
預かり所セテーラ,Storage Setera
ドラキーのぼうし,Dracky Hat
天象のスティック,Celestial Wand
コルセアバンダナ,Corsair Bandana
マーメイドランプ,Mermaid Lamp
神秘のゴブレット,Mystic Goblet
壁かけ紋章旗・黄,Yellow Wall Banner
預かり所トッケロ,Storage Tokkero
デバフクリスタル,Debuff Crystal
ミラクルチケット,Miracle Ticket
ブレイクキャップ,Break Cap
コルセアマント上,Corsair Cloak
神獣アマカムシカ,Amazlantelope
アンフィスバエナ,Amphisbaena
ごうかなイス・緑,Green Fancy Chair
くらげポンポン帽,Jellyfish Pom Pom Hat
マッピング計測器,Mapping Instrument
しぐさ書・Ｖロン,Emote "Vron"
マジカルかぼちゃ,Magical Pumpkin
スウィートバッグ,Bag o' Sweets
魔物管理人ニョイ,Monster Manager Nyoi
ガンコ職人の息子,A Stubborn Craftsman's Son
レース屋プクヨミ,Race Registrar Pukuyomi
乗り物係ガドッソ,Vehicle Clerk Gadosso
ルティチャビ像白,White Astolti Chubby St.
三つ星ブレンド豆,3-Star Blend Beans
スチームバスタブ,Steam Bathtub
ほうおうの巻き物,Phoenix Scroll
砂の都の吊り飾り,Sand City Decoration
大魔獣イーギュア,Giga Rapscallion
ローゼンニードル,Rosen Needle
オーロラカメリア,Aurora Camellia
ミステリーココア,Mystery Cocoa
美容師マルジャン,Hairdresser Marjan
Ｖジャンプの仮面,V Jump Mask
白猫のワンピース,White Cat Dress
白ゴシック柄の柱,White Gothic Pillar
バトルスタンパー,Battle Stamper
オーフィーヌ海底,Orfine Seabed
キラキラモーモン,Glittering T. Sanguini
踊り子と願いごと,A Dancer and a Wish
道具屋・レシピ屋,Item/Recipe Shop
みずたまドラゴン,Polka Dot Dragon
モーグリチケット,Moogle Ticket
クエド丘陵への道,Road to Kuedo Hill
コイン屋ゴンガロ,Coin Shop Gongaro
小悪魔王子のくつ,Devil Prince's Shoes
ドラムクラッシュ,Monster Masher
水晶のテーブル小,Crystal Table S
レースの観客１１,Race Spectator 11
超便利ツール印章,Companion App Stamps
たったひとつの絆,Only One Bond
ヒューザキッチン,Hyuza Kitchen
審判の天使のくつ,Angel of Judgment Shoes
育成受付係ブレダ,Training Reception Breda
レジェンズエッジ,Legends Edge
紫獅鬼バイロゼオ,Byrozeo, the Purple Lion
ヤマネコグローブ,Wildcat Gloves
ドラグーンランス,Dragoon Lance
しぐさ書・ガード,Emote "Guard"
キツネパーカー上,Fox Hoodie
春風応援ソックス,Spring Cheer Socks
銀のさいほう針小,Silver Needle S
時元神キュロノス,Kyuronos, Ruler of Time
魔法戦士団制服２,Armamentalist Uniform 2
ウルベア地下帝国,The Urbea Empire
デリシャスカルビ,Delicious Ribs
ラニアッカ断層帯,Raniakka Fault Zone
記憶のパドレア邸,Memory of Padrea Mansion
闇騎士のグリーブ,Dark Knight Greaves
ブラックチャック,Dark Brownie
ポセイドンタンス,Poseidon Wardrobe
勇者姫のウィッグ,Hero Princess Wig
かんだたそうすい,Robbin' 'Ood Chief
ナブレットソファ,Nablette Sofa
忠義の勲章の破片,Loyalty Medal Shard
剥きかけりんご左,Left Peeled Apple
ウルタのグローブ,Ulta Gloves
冒険者のてぶくろ,Adventurer's Gloves
あおりんごダリア,Light Green Dahlia
始源の歌姫セット,First Diva's Outfit
黒いバラの花びら,Black Rose Petal
しぐさ書・スイカ,Emote "Watermelon"
プラチナミミック,Platinum Mimic
苺お菓子のベッド,Berry Sweet Bed
リンベリィのくつ,Linberry's Shoes
演奏ヴァイオリン,Play Violin
チャンスコマンド,Chance command
工匠神のむねあて,Craftmaster's Top
デモンズゲイトＢ,Demon's Gate B
シグナルスライム,Slime Signal
静かなる湿原地区,Quiet Marshlands
アントワネット妃,Princess Antoinette
プチデビルハット,Petit Devil Hat
若手芸人のズボン,Young Talent Pants
レジェンズガード,Legends Guard
まじないしのくつ,Fizzle-Proof Shoes
マザー・リオーネ,Mother Lione
賢者のころも上２,Sage Robe Top 2
ゴールデンコーン,24-Carrot Bunicorn
ウェーブアイロン,Wave Iron
モガマルグローブ,Cyril Gloves
まもの使いの証明,A Master of Monsters
フラウスブレード,Flaus Blade
蒼穹兵団のかぶと,Azure Corps Helmet
ヘルガーディアン,Hell's Gatekeeper
幸せの花を探して,Look for Lucky Flowers
アズラン駅の模型,Azlan Station Model
キングギフト・白,White King Gift
じごくのもんばん,Grim Keeper
ガリバーハンド！,Gulliver Hand!
ネコ姫のスツール,Cat Princess Stool
エンジョイ浮き輪,Fun Floatie
炎光の勾玉の破片,Firelight Jewel Shard
どん欲のグリーニ,Greedy Greenie
オパールのダンロ,Opal Fireplace
下級亡霊兵士たち,Lowly Spirit Soldiers
神秘のテラリウム,Mysterious Terrarium
マンドラゴラたち,Mandragoras
壁かけＤＱⅢの絵,DQⅢ Painting
ショッパーバッグ,Shopping Bag
ネタ「たけのこ」,Bamboo Shoot Trick
クリスマスレンズ,Christmas Lens
審判の天使リスト,Angel of Judgment Bands
おたからの花びら,Iridescent Petal
キュロンイーター,Kyuroneater
ソードブレイカー,Sword Breaker
ブラックコンドル,Black Buzzard
スペースデーモン,Spacebonnet
DQ3そうりょぞーま,DQ3 Priest, Zoma
別離の剣器・朋友,Parting Blade of Friendship
ふわふわ雲のラグ,Fluffy Cloud Rug
しゃしょうぱーり,Conductor Pari
起源獣ガルドドン,Gardodon, Beast of Origin
マジカルドレス下,Magical Dress Bottom
ノーブルコート上,Noble Coat Top
ベリアル強メダル,Apex Belial Medal
希少な水晶の伝承,Rare Crystal Folklore
今年のブレス対策,Breath Countermeasures
ホワイトゴーレム,White Chocolate Golem
ピカレスクブーツ,Picaresque Boots
ユシュカパラソル,Yushka Umbrella
アスバルへの親書,Official Letter to Asbal
ショコラなブレス,Cholocate Bracers
つやめく毛髪の束,Glossy Hair Bunch
星降りのローブ下,Starry Robe Bottom
ナルビア宿屋の扉,Nalbia Inn Door
あなたと歩く物語,Tale of Walking With You
しぐさ書・天灯緑,Emote "Green Lantern"
黄金のアンクの箱,Golden Ankh Box
渡し守アリーモス,Ferryman Alimos
セクシーテーブル,Sexy Table
ネタ「ひまわり」,Sunflower Trick
飛竜のベストの書,Flying Dragon Book
しぐさ書・きのこ,Emote "Mushroom"
デンジャーランス,Danger Lance
甘いシロップビン,Sweet Syrup Bottle
げきりんのさとり,Inverse Insight
やつざきアニマル,Bullion
ごうかなツボ・赤,Red Fancy Pot
ベルトロトランプ,Bertro Cards
レジェンズケース,Legends Case
結界の氷殿への道,Road to Ice Barrier Hall
ケラコーナ原生林,Keracona Wild Forest
逆乱の竜ナダイア,Nadaia, Dragon of Rebellion
フェアリーバット,Fruity Succubat
お菓子の間仕切り,Sweet Partition
笑う地獄の大公爵,Duke of Hell Laughing
烈鎚マグナゲイト,Fierce Hammer Magnagate
かぜきりの弓の書,Blowy Bow Book
ヤドカシの像・庭,Draginn Statue (G)
肆の五声は哭の声,Fourth of 5 Voices Weep
苺お菓子の食器棚,Berry Sweet Cupboard
ポセイドン仕切り,Poseidon Partition
グロリアススーツ,Glorious Suit
グロリアスコート,Glorious Coat
ジャイラジャイラ,Jyra Jyra
天使の弓のレシピ,Angel's Bow Recipe
プクリポオーブン,Pukulipo Oven
おきもの緑キノコ,Green Mushroom Ornament
パンジーのズボン,Pansy Pants
かんおけカプセル,Coffin Toy
夢見る占い師たち,Dreaming Fortune Tellers
木の葉よろい全集,Foliage Armor Book
超おたからのタネ,Super Treasure Seed
邪竜教団サミット,Summit of the Dragon Order
博愛騎士のピアス,Love Knight Earrings
ホーローの隠れ家,Hollow's Hideout
大地の箱舟　２幕,Ark of the Earth Act 2
ジャングルリップ,Jungle Tulip
酒場主人のピアス,Tavernkeeper's Earrings
懐かしのゲーム機,Nostalgic Game Console
流星メダル引換券,Meteor Medal Voucher
グロリアス衣装券,Glorious Outfit Voucher
ドラゴン花火・青,Blue Dragon Firework
赤い屋根の家の柱,Red Roof House Pillar
グロリアスズボン,Glorious Pants
バルディスタ槍兵,Valdista Spearman
展望台へのはしご,Lookout Ladder
２段ブロック・青,Blue 2-Step Block
ウルベア魔神兵強,Apex Urbea Aztech
Ⅲ‐ディアノーグ,Ⅲ‐Diamagon
シャイニーメロン,Shiny Melon
カシャル海底神殿,Kashal Undersea Temple
サンダーフロッグ,Zaptile
魔法戦士団サロン,Armamentalist Corps
ラヴィアンローズ,Rose Spectaculars
アルミラージの像,Spiked Hare Statue
音符のベッド・黒,Black Music Bed
暗黒の魔人カード,Ruin Card
チャージタックル,Charge Tackle
妖精たちのポルカ,Brownie Boost
オーガカウンタ小,Ogre Counter S
ネコミイラ衣装Ⅰ,Cat Mummy Costume Ⅰ
スライムの木の壁,Slime Wood Wall
ニンジンのタンス,Carrot Wardrobe
郵便局員ジヌデル,Postman Shinderu
ゴクラクギョ・白,White Betta
プクリポ間仕切り,Pukulipo Partition
ホワイトパンサー,Silver Sabrecat
ドラゴンベスト下,Dragon Pants
レンダーシア地図,Lendersia Map
キュルルトランプ,Kyururu Cards
大王イカのズボン,King Squid Pants
いにしえの廃棄物,Ancient Waste
ダンディクッキー,Dandy Cookies
クモさんお掃除棒,Spider Sweeping Stick
おおみみずの化石,Wiggly Fossil
ふくめんうさぎ２,Masked Rabbit 2
瑞雲の道服セット,Cloudy Outfit
アメジストローズ,Amethyst Rose
観測者モルフェス,Observer Morpheus
お正月の便利な壁,New Year Wall
ピリからペッパー,Hot Stuff
姫君のブーメラン,Princess' Boomerang
シスター・マキリ,Sister Makiri
たまにカウンター,Counterattack Chance
ツボ錬金作業着上,Pot Alchemist's Clothes
Ｓキラーブレード,Trauminator Blade
スノースティック,Snow Stick
大地の竜バウギア,Earthwyrm
レスキュマフィン,Rescue Muffin
サイキョーＶロン,Psycho Vron
ラガのタリスマン,Raga's Talisman
ヴェリナード王国,Verinard Kingdom
シンイのこころ６,Shini's Heart Lv6
魔物管理人の制服,Monster Manager Uniform
遊び人の特注花火,Gadabout's Firework
ジルドラーナの剣,Jildrana's Sword
水玉模様のはかま,Polka Dot Hakama
無法者のバンダナ,Freebooter's Bandana
お菓子の家セット,Candy House Set
スラタワーボディ,Slime Stack Body
クローバーハット,Clover Hat
マザー・ヨハンナ,Mother Johanna
マスカットリップ,Muscat Tulip
魔瘴魂オジャロス,Miasma Soul Ojalos
ルシェンダの武器,Lushenda's Weapon
魔法使いのブーツ,Mage Boots
しぐさ書・決め左,Emote "Pose Left"
奇門遁甲の式・弐,2nd Divination Ceremony
奈落にひそむもの,Abyss Lurker
素材屋看板と敷物,Material Shop Sign and Floor
ポイズンリザード,Killer Gila
情熱のガナドール,Passionate Victor
クルーガーハット,Kluger Hat
ネコ姫の観葉植物,Cat Princess Plant
ネコミイラ衣装Ⅱ,Cat Mummy Costume Ⅱ
討伐隊員ポッカラ,Strike Force Pokkara
デスマドモアゼル,Golden Girl
帝国三将軍カード,Triumgorate Card
オパールのベッド,Opal Bed
ギュッとソーミャ,Somya Arm Doll
ブレイブグリーブ,Brave Greaves
春風応援バイザー,Spring Cheer Visor
スライムの石の壁,Slime Stone Wall
はやぶさの剣の書,Falcon Blade Book
郵便局員マルセン,Postman Marsen
ステンドシールド,Stained Glass Shield
ホーリーローブ上,Holy Robe Top
欲望の邪鬼ゴモル,Demon of Desire Gomoru
東洋風飾り棚・雅,Chic Orient Shelf
ドラパンクパンツ,Dracky Punk Pants
エルトナスイセン,Eltona Daffodil
猫パンチ（左手）,Cat Punch (Left Hand)
メロポネスの財布,Meroponesse's Wallet
紹介人アラーニャ,Introducer Aranya
ジャイラプランツ,Jyra Plant
第１２回ピコ像庭,12th Pico Statue (G)
ダマスク模様の壁,Damask Pattern Wall
便せんは芸術だ！,Paper is an Art
ミサイルユニット,Missile Unit
アクセ屋ルイッサ,Accessory Shop Luisa
南の渡し守ハーリ,South Ferryman Hari
赤宝箱のチェスト,Red Treasure Chest
アークデーモンＡ,Archdemon A
ゼブラマンティス,Zebra Mantis
ファントムブーツ,Phantom Boots
クオードの剣の鞘,Quard's Scabbard
ディバインロッド,Divine Rod
シスター・ルルア,Sister Lulua
リドのタリスマン,Lido's Talisman
預かり所ティーチ,Storage Tichi
カボチャステッキ,Pumpkin Stick
三闘士のハンマー,Hammer of the Triad
中枢へ向かう通路,Passage to Core
ファーラット・強,Vicious Feralball
いねかりぞくの像,Harvester Statue
強者賞トロフィー,Strongman Trophy
ダンディシューズ,Dandy Shoes
ジャックの衣装３,Jack's Costume 3
努力の彫像の写真,Effort Sculpture Photo
参加受付クライブ,Receptionist Clive
オーシャングラス,Ocean Glasses
交換屋メリーポコ,Exchange Shop Meripoko
フェリナ姫の部屋,Princess Felina's Room
魔物管理人ニトト,Monster Manager Nitoto
ボスコイン無料券,Free Boss Coin Ticket
名探偵のコート下,Sleuth's Coat Bottom
レシピ屋ルペッタ,Recipe Shop Ruperta
プラチナメイル下,Platinum Mail Bottom
サンタのてぶくろ,Santa Mitts
シックゴスブーツ,Chic Goth Boots
スチームスーツ上,Steam Suit Top
ドワーフ市民くつ,Dwarf Citizen Shoes
輝ける生命の群生,Swarm of Life
フリーズウィップ,Malevolash
レッドタキシード,Red Tuxedo
アトラス強カード,Apex Atlas Card
おおきなリボン白,White Ribbon L
学園女子の夏服下,Schoolgirl Summer Skirt
シスター・ネジュ,Sister Neju
ゴシックパラソル,Glumbrella
ガタラ原野への道,Road to Gatara Fields
暴君バサグランデ,Tyrant Bogan
チアガール衣装券,Cheerleader Outfit Tkt
星石のハルバード,Meteorite Halberd
兵士の荷物ぶくろ,Soldier's Luggage Bag
ボーンファイター,Zombie Gladiator
きようさにくまん,Deft Meat Buns
真珠貝のささやき,Pearl Oyster Whispers
じんめんじゅの像,Treeface Statue
ガートラント兵１,Gartlant Soldier 1
封鎖された研究室,Sealed Laboratory
天翼のイヤーカフ,Heavenly Wing Ear Cuffs
ダークネスマリン,Dark Seaslime
にじいろの布きれ,Technicolor Dreamcloth
クリスマスのソリ,Christmas Sleigh
育みの大地への道,Road to Flourish Fields
カージナルテトラ,Cardinal Tetra
占い師の服セット,Fortune Teller Outfit
くろがねの小ビン,Iron Phial
なげくカンナさん,Grieving Master Kanna
武神の道着セット,War God Outfit
しびれくらげ０３,Man o' War 03
レシピ屋オオジャ,Recipe Shop Ooja
学園の校庭の砂場,Schoolyard Sandbox
サウザンドダガー,Deft Dagger
あるある川柳・金,Haiku Gold
荷馬車の作業員Ｂ,Wagon Worker B
煙霧の谷への出口,Exit to Misty Valley
つかれきったサメ,Lazy Larry
ビントンの陳情書,Vinton's Petition
メタルスライム強,Apex Metal Slime
ハロウィンアーチ,Halloween Arch
エネルギー制御室,Energy Control Room
えにし紡いで……,Weaving Bonds...
ギガスクラッパー,Giga Scrapper
売り子パナッピュ,Vendor Panapyu
妖精のトンガリ靴,Fairy Shoes
フォーマルドレス,Formal Dress
竜族人形の作り方,Making Nadravian Dolls
ウェディ秘書モブ,Weddie Secretary Mob
レオン・ビュブロ,Leon Byblo
光のオーナメント,Light Ornament
レースの観客２０,Race Spectator 20
フォーマルスーツ,Formal Suit
氷の領界のベッド,Ice Realm Bed
テレパスタイツⅡ,Telepath Tights Ⅱ
ファリネのチョコ,Farine's Chocolate
第１２回パドレ像,12th Padre Statue
防衛軍のインカム,Defense Force Intercom
スイの塔への出口,Exit to Sui Tower
シスター・トルテ,Sister Torte
ホワイトホイップ,White Chocolate Whisp
魔天剛アロゲイル,Arogeil, Strength of Evil
シルバーウィング,Silver Wings
形見を取り返せ！,Take Back What's Yours!
預かり所ズグラム,Storage Zugram
ちゃがまゴンの像,Wyrkettle Statue
ツボ錬金職人頭巾,Pot Alchemist's Cap
エステラキッチン,Estella Kitchen
ふわふわクマノミ,Floaty Clownfish
はぐメタチケット,Liquid Metal Ticket
ぱーてぃーどれす,Party Dress
口調の書・能天気,Tone Book - Easygoing
スタンカのハンコ,Stanka's Stamp
ショックをうける,Received Shock
ファフニルアーム,Fafnir Armguards
お菓子な武器大全,Candy Weapon Compendium
フリーズブレード,Frost Fangs
ワーニングな水着,Warning Swimsuit
灰三毛猫カプセル,Ash Calico Cat Toy
くらやみハーピー,Succubat
壁かけ紋章旗・青,Blue Wall Banner
カボチャ間仕切り,Pumpkin Partition
ロイヤルステップ,Royal Step
初期ウェディ女性,Initial Weddie Female
グロリアスブーツ,Glorious Boots
ろんぐたきしーど,Long Tuxedo
キラーマジンガ強,Apex Uberkilling Machine
ルビーのドレス上,Ruby's Dress Top
華やかなふりそで,Lustrous Kimono
白亜の王城・１階,Chalky Castle 1F
まもの使いの服２,Monster Master Suit 2
壱の五声は歌の声,First of 5 Voices Sing
ダイナートップス,Diner Top
サンゴ礁かきわり,Coral Reef Backdrop
プク姫様つきの畑,Puku Princess Field
魔人エンラージャ,Enraja the Genie
白組のたいそう着,White Team Track Suit
栄光のトロフィー,Glory Trophy
魔人王ドミネウス,Demonic Domineus
お祝いシャワー黄,Celebration (Yellow)
ごはんいこーよ！,C'mon, Let's Eat!
ふかみどりダリア,Dark Green Dahlia
ジャンボオニオン,Jumbo Onion
黒曜のパーティ机,Obsidian Party Table
