バカンウグレ遺跡,Bakanugure Ruins
ひと筆のこだわり,A Single Stroke
ミラクルコート上,Miracle Coat Top
エキサイトアクス,Excite Axe
アスフェルド学園,Asfeld Academy
きようさにくまん,Deft Meat Buns
預かり所ポピリア,Storage Popilia
花の守護者の大剣,Flower Guardian's Sword
村王クリフゲーン,Chief Cliffgain
便せん屋ライジー,Stationery Shop Raiji
よろず屋ピッペル,General Shop Pippel
パニックキャノン,Gone Ballistic
花模様の光るラグ,Floral Glowing Rug
白組のたいそう着,White Team Track Suit
怪魔鳥バトロウス,Monstrous Bird Batros
先王ゾルトグリン,Former King Zoltgrin
シスター・ソルテ,Sister Solte
シーサイドハウス,Seaside House
タイタス号の模型,Titus Model
呪文ぼうそう率+3%,Haywire Rate +3%
おっかけパンサー,Chasing Panther
チョコキャンドル,Chocolate Candle
じごくのたまねぎ,Brimstone Bulb
雪だるまのドーム,Snowman Snow Globe
ぷりんせすどれす,Princess Dress
スターのイス・青,Blue Star Chair
武器鍛冶職人の道,The Weaponsmith's Way
しびれくらげ０２,Man o' War 02
ドルタムの念晶鏡,Doltam's Telecrystal Mirror
ふしぎなボレロ下,Glombolero Bottom
口調の書・能天気,Tone Book - Easygoing
アラハギーロ地方,Al-Ahagiro Region
ナイトメアリーフ,Lethal Leaf
郵便局員ウイロウ,Postman Willow
ブラッディヘッド,Bloody Horns
フォルモンティ村,Vollmondi Village
カーレルの氷雪洞,Carrel Ice Cave
グリードイーター,Greed Eater
真珠の取れる浮貝,Pearl Taken From a Shell
スーパーテンツク,Sluggernaut
ザンクローネの本,Zankrone's Book
ロリータドレス下,Lolita Dress Bottom
ふっくらにんにく,Plump Garlic
ダークネスマリン,Dark Seaslime
バトエンウォール,Batoen Wall
グロリアスズボン,Glorious Pants
それは誰がために,To Whom it May Concern
はぐれメタルの像,Liquid Metal Statue
木彫りのロザリオ,Wood Carved Rosary
道具屋ポッピーナ,Item Shop Poppina
魔天匠レスヘヴン,Master Les Haven
飛竜のタマゴ欠片,Flying Dragon Egg Piece
ニンジンのタンス,Carrot Wardrobe
第１０回ラウル像,10th Raul Statue
エルドナ神の洗礼,Eldona's Baptism
もうどくブルース,Poisonous Blues
炎光の勾玉の破片,Firelight Jewel Shard
マジカル姫ぞうり,Magical Sandals
アンノウンサイズ,Unknown Scythe
おしゃれカタログ,Fashion Catalog
聖賢者のローブ下,Holy Sage Robe Bottom
射手の服のレシピ,Archer Outfit Recipe
カエルの置物・庭,Frog Ornament (G)
エルダーフレイム,Old Flame
エネルギー制御室,Energy Control Room
春風応援バイザー,Spring Cheer Visor
古びたペンダント,Old Pendant
ラニアッカ断層帯,Raniakka Fault Zone
もぐらのスコップ,Mischievous Mole Shovel
レースの観客２０,Race Spectator 20
ポイズンスケイル,Serpentscale Skean
獄水鬼ヴァーテル,Waterkeeper Vater
モーニングスター,Morning Star
武器鍛冶作業着上,Weaponsmith's Top
BGMテスト同期部屋,BGM sync test room
エレガントヒール,Elegant Heels
歌詠みのころも上,Poet's Attire Top
しびれくらげ２０,Man o' War 20
空のワインボトル,Empty Wine Bottle
ダーマ神殿への道,Path to Alltrades Abbey
交換屋クックルン,Exchange Shop Cocoroon
氷の領界のベッド,Ice Realm Bed
まほうせんしだん,Armamentalist Corps
白木のカウンタ大,Plain Counter L
預かり所パレーノ,Storage Palenno
ヤマネコグローブ,Wildcat Gloves
あやしい間仕切り,Suspicious Partition
海のとける洞くつ,Sea Melting Cave
防具屋ピルフォン,Armor Shop Pilfon
水晶宮上層への道,Path to Palace Upper
キャプテンの部屋,Captain's Room
アイドルスーツ下,Idol Pants
奈落の門への出口,Exit to Abyss Gate
子供の家ペコリア,Child House Pekoria
お宝の写真ケース,Treasure Photo Case
プク姫様つきの畑,Puku Princess Field
栄光のトロフィー,Glory Trophy
デリシャスカルビ,Delicious Ribs
ラグアスキッチン,Raguas Kitchen
フィネトカ映写機,Finetka Projector
ハロウィン衣装券,Halloween Costume Tkt
ステージシューズ,Stage Shoes
プチアーノン・強,Vicious Khalamari Kid
ダーマ神殿への扉,Door to Alltrades Abbey
白バラのテーブル,White Rose Table
クマのぬいぐるみ,Bear Plushie
マスター・カンナ,Guildmaster Kanna
ドミネウス邸の机,Domineus Mansion Desk
磁気式図書購入札,Magnet Book Purchase Tag
オノ特技の範囲+2m,Axe Skill Range +2m
ダミー足Ｅ００９,Dummy Feet E009
アークワンドの本,Celestial Sceptre Book
シスター・ペッス,Sister Pess
ゴローさんリボン,Goro Ribbon
くらやみハーピー,Succubat
メモリアフェザー,Memoria Feather
ランドインパクト,Crackerwhack
ジア・クト念晶体,Dia Kut telecrystal
郵便局員リアンナ,Postman Lianna
幻界導師のゆびわ,Phantom Priest Ring
ある船乗りの手記,Sailor's Memoir
甘いシロップビン,Sweet Syrup Bottle
レッスンチケット,Lesson Ticket
おとぎの森ボレロ,Fairy Forest Bolero
アンノウンワンド,Unknown Staff
王家のペンダント,Royal Family's Pendant
黄金の飾り片手剣,Gold Ornament Sword
聖守護者のタクト,Sentinel's Baton
ましょううおたち,Salamanglers
星夜のローファー,Starry Night Loafers
強者賞トロフィー,Strongman Trophy
聖守護者の両手剣,Sentinel's Greatsword
オルフェウスの弓,Orpheus' Bow
白鳥の弓の作り方,How to Make a Swan Bow
ベルトロトランプ,Bertro Cards
ヒポポ・サードン,Hippo Sardon
カンフーシューズ,Kung Fu Shoes
スタジアムシャツ,Stadium Shirt
よろず屋ペリトン,General Shop Periton
預かり所トッケロ,Storage Tokkero
ファントムマスク,Phantom Mask
凶禍のフラウソン,Flauson the Wicked
ジュースの自販機,Juice Vending Machine
スライムＴシャツ,Slime T-Shirt
赤組のたいそう着,Red Team Track Suit
中型の丸い水そう,Round Aquarium M
ふわふわ雲のラグ,Fluffy Cloud Rug
預かり所スリーズ,Storage Sleaze
プリーストナイト,Priest Knight
キュートクリーム,Cute Cream
アックスドラゴン,Axesaurus
はかなき星に光を,Light on a Fleeting Star
クルーガーブーツ,Kluger Boots
セピアンフリル上,Sepian Shirt
かたりべのぼうし,Storyteller's Hat
レスキュマフィン,Rescue Muffin
しぐさ書・スイカ,Emote "Watermelon"
古き踊り子の伝説,Old Dancer's Legend
シャークサンダル,Shark Sandals
ウィリーデナイフ,Wilday Knife
しぐさ書・まわる,Emote "Spin"
フカき海の底で２,Bottom of Shark Sea 2
第１２回ピコ像庭,12th Pico Statue (G)
レースの観客１０,Race Spectator 10
デザートゴースト,Sweaty Yeti
預かり所ぺイジー,Storage Peiji
天命のつるぎの書,Sword of Judgment Book
トレジャーデモン,Treasure Demon
ギュッとプオーン,Rebjorn Arm Doll
小型の丸い水そう,Round Aquarium S
かぜきりの弓の書,Blowy Bow Book
パピヨングローブ,Papillon Gloves
ボスコイン無料券,Free Boss Coin Ticket
レースの観客１９,Race Spectator 19
最果ての地下遺跡,Deepest Depths
小さな陶器の破片,Small Pottery Shard
チョコボのぼうし,Chocobo Hat
バケーロの子分Ｂ,Bakero's Henchman B
ガーデンパンプス,Garden Pumps
メレアーデリスト,Mereade Wristbands
札強化屋ラベロー,Card Enhancer Rabero
シスター・ライラ,Sister Lyra
ネタ「グレドラ」,Great Dragon Trick
よろず屋リーベン,General Shop Leven
第８回パドレの像,8th Padre Statue
ばしょうせんの本,Frond Fan Book
ほくほく肉じゃが,Meat & Potatoes
グリーンエッグ２,Green Egg 2
オーロラウンダー,Aurorarounder
チョコっと衣装券,Choco Costume Ticket
魔物管理人オリー,Monster Manager Ori
こんらんのダンス,Dance of Confusion
Ｌ型のトピアリー,L-Shaped Topiary
ダークネビュラス,Dark Nebulus
クッキーの便せん,Cookie Paper
あくまのいしょう,Imp Costume
フォトライフ・銀,Photo Life Silver
カーニバルマスク,Carnival Mask
魔剣士のグローブ,Demon Swordsman Grips
レースの観客２３,Race Spectator 23
若武者のすねあて,Young Warrior Boots
ほしくずのピアス,Stardust Earrings
はじめてのオフ会,First Time Off Meeting
アスバルのブーツ,Asbal's Boots
ぱてぃきょうだい,Sibling Patti
レジェンズソード,Legends Sword
ラストチョーカー,Ultimate Choker
まよえるまるこす,Lost Marcos
郵便局員ペープペ,Postman Pepupe
悪魔王の同族狩り,Hunting Devil's Family
デルクロアの研究,Delcroix's Research
死神スライダーク,Nemeslime
レギオングリーブ,Legion Greaves
預かり所ティルダ,Storage Tilda
ピクニックリィン,Lynn Picnic
古代王族のベスト,Ancient Royal Vest
銀の噴水の作り方,Making Flower Fountains
サジェぬいぐるみ,Sajay Plushie
スチームオーブン,Steam Oven
預かり所スピーラ,Storage Spira
ネイティブ柄ラグ,Native Pattern Rug
五大陸のモビール,Five Continents Mobile
取引商アルトゥナ,Trader Altuna
転職神官ハクドウ,Vocation Priest Hakudo
月うさぎのランプ,Moon Rabbit Lamp
リバイブスナック,Revive Snack
コブタパーカー下,Piglet Shorts
筆頭研究員の手袋,Top Researcher Gloves
イルーシャのペン,Irusha's Pen
『だれでもＯＫ』,"Anyone is OK"
牡丹の紋付はかま,Peony Crest Hakama
ファントムハック,Seeing Stars
原始獣のコート下,Primal Beast Leggings
さいほうサンダル,Sewer's Sandals
高貴な紋付はかま,Noble Crest Hakama
エステラの便せん,Estella Paper
オーディーンボウ,Odin's Bow
魔女のイヤリング,Witch's Earrings
よろず屋プロシオ,General Shop Proshi
メタスラのタンス,Metal Slime Wardrobe
ドラけしシャワー,Eraser Shower
まわりにチャット,Nearby Chat
魔物ソンブレロ券,Sombrero Ticket
壁かけ紋章旗・青,Blue Wall Banner
スライムベス帽子,She-Slime Hat
おばけトマト軍団,Haunted Tomato Army
１段ブロック・青,Blue Block
ナイス！ナイフ！,Nice! Knife!
語り継がれる真実,The Untold Truth
エナジーフォール,Magic Blast
アビスセーラー上,Abyss Shirt
大きなお菓子の柱,Big Sweets Pillar
預かり所サーニュ,Storage Sannu
クラシカルハット,Classical Hat
パッションパレオ,Passion Pareo
Ｖロンのラグ・赤,Red Vron Rug
妖精とふしぎな火,Fairy and the Fire
取引商ディーリア,Trader Delia
セラフィムのやり,Seraph's Spear
キジ太猫カプセル,Fat Brown Cat Toy
預かり所ガリュア,Storage Garua
タンブラーシャツ,Tumbler Shirt
ニードルマンの書,Needleman Book
レシピ屋ロミルダ,Recipe Shop Romilda
ギンガムの便せん,Gingham Paper
オシリスのアンク,Osiris' Ankh
憤怒のイフリート,Enraged Ifrit
レシピ屋レズリー,Recipe Shop Leslie
ハルファスの紋章,Halphas Crest
小鳥のガゼボ・白,White Small Bird Gazebo
木の葉のよろい上,Foliage Armor Top
クリスタルハンド,Crystal Hand
バズカフェのラグ,Pazu Cafe Rug
バトルシェイカー,Maracaraider
呪術師マリーン強,Apex Monstrous Malynn
プラチナミミック,Platinum Mimic
塔のガーディアン,Tower Guardian
赤い屋根の家の壁,Red Roof House Wall
ヘルヴェルの上司,Helvel's Superior
ライノソルジャー,Rhinoceraxe
にじいろの色鉛筆,Rainbow Colored Pencil
クリスマスのソリ,Christmas Sleigh
星空のタンス・紫,Purple Starry Wardrobe
水晶のテーブル大,Crystal Table L
黒猫のスウェット,Black Cat Sweatshirt
しびれ弾ショット,Shocking Shot
お菓子のチェスト,Sweet Chest
口調の書・オレ様,Tone Book - Tsundere
スライムざぶとん,Slime Floormat
灰三毛猫カプセル,Ash Calico Cat Toy
シスター・マキリ,Sister Makiri
とうぞくぼんがす,Thief Bongas
フォーリオン外郭,Outer Fourion
クオードのコート,Quard's Coat
銅の鍛冶ハンマー,Copper Smith Hammer
しぐさ書・自撮り,Emote "Selfie"
トレーニー育成帳,Trainee's Logbook
クローバーピアス,Clover Earrings
名探偵のコート下,Sleuth's Coat Bottom
アヌビスアタック,Anubis Assault
ルシェンダの手紙,Lushenda's Letter
５００年前の地図,Map of 500 Years Ago
ドワーフキッチン,Dwarf Kitchen
パハカースのメモ,Pahkas' Memo
ボーンファイター,Zombie Gladiator
グロリスのしずく,Droplet of Gloris
清廉天使のブーツ,Honest Angel Boots
サメきぐるみ・青,Blue Shark Suit
ウェディの便せん,Weddie Paper
臨時大使ツーウィ,Temp Ambassador Tsui
アントワネット妃,Princess Antoinette
スクアーロの写真,Squalo's Photo
アラモンドの植木,Alamond Plant
冥王の大鎌・オノ,Netheraxe
グラコス強メダル,Apex Gracos Medal
スチームショット,Steam Bow
ふわふわサンダル,Fluffy Sandals
ふわふわペコリア,Fluffy Pekoria
パンプキンキッズ,Pumpkin kids
スライムのタンス,Slime Wardrobe
タータンドレス上,Tartan Dress Top
黒鳥のチュチュ上,Blackbird Tutu Top
オパールのタンス,Opal Wardrobe
ランプ錬金職人帽,Lamp Alchemist's Hat
魔衛隊士のかぶと,Demon Guard Helmet
シスター・ララニ,Sister Rarani
シスター・ルルア,Sister Lulua
ふわふわキンギョ,Fluffy Goldfish
フェンサーブーツ,Fencing Boots
ボロボロの魔神兵,Tattered Demon Soldier
武神の道着セット,War God Outfit
ファントムブーツ,Phantom Boots
メギラザの洞くつ,Megilaza Cave
ドラグーンヘルム,Dragoon Helm
道具屋ドロッジェ,Item Shop Drogger
武刃将軍のゆびわ,Warrior General Ring
いだいなてんさい,Great Genius
経験値の秘薬・小,Experience Elixir S
ベルトロの部下Ｂ,Bertro Subordinate B
クイーンスライム,Queen Slime
ときのすいしょう,Chronocrystal
預かり所エルミナ,Storage Elmina
超錬金ツボ小の本,Super Alch Pot S Book
ごくじょうソルト,Salt of the Earth
わかめ由来石けん,Seaweed Soap
終わりを告げる者,The Doomsayer
ダンディグローブ,Dandy Gloves
学園の教室のイス,School Classroom Chair
第３回リーネの像,3rd Renee Statue
ふかふかなキノコ,Soft Mushroom
トナカイシューズ,Reindeer Boots
はがねのよろい上,Steel Armor Top
天蓋付きのベッド,Canopy Bed
ピリからペッパー,Hot Stuff
ノーブルグローブ,Noble Gloves
ヴェリナード領北,Verinard North
シスター・ルスパ,Sister Luspa
栄光のローブ・金,Gold Glory Robe
荘厳な紋付はかま,Solemn Crest Hakama
紫のほこらのカギ,Purple Shrine Key
いたずらバーティ,Buttre the Bad
まもの使いずきん,Monster Master Hood
ガナン帝国の勲章,Gittish Empire Medal
星型ランタンの木,Star Lantern Tree
女神の魂の在りか,Soul of the Goddess
海底探検かきわり,Seafloor Backdrop
ブリキパイプの柱,Tin Plate Pipe Pillar
バトエンフラッグ,Batoen Flag
預かり所エフォー,Storage Epho
ステューデントＧ,Student G
かばん工房の秘密,Bag Workshop's Secrets
棺桶クローゼット,Coffin Closet
瑞雲の道服セット,Cloudy Outfit
魔物管理人シオネ,Monster Manager Shione
ホーリーパウダー,Holy Powder
壁かけ桜の飾り棚,Cherry Blossom Shelf
エレガントココア,Elegant Cocoa
ラッカラン住宅村,Luckland Residences
若武者のよろい下,Young Warrior Faulds
イカ焼きプリズム,Fried Squid Prism
クローバーのカギ,Clover Key
プチゴレオン将軍,Frail Goreham-Hogg
ポセイドンタンス,Poseidon Wardrobe
新商品は桜の香り,Cherry Scented Products
ウーパールーパー,Axolotl
ロイヤルグローブ,Royal Gloves
悪神の心域２印章,Fiend's Heartlands 2 Stamp
水玉模様のはかま,Polka Dot Hakama
案内係ディアマン,Guide Diamond
しあわせの玉手箱,Happiness Jewelry Box
占い師のテーブル,Diviner Table
しょうにんまっか,Merchant Macca
ピカレスクコート,Picaresque Coat
フォンデッテの像,Fondette Statue
レースの観客２９,Race Spectator 29
ヘルクラッシャー,Hell Gladiator
魔勇者アンルシア,Anlucia, Hero of Evil
常時呪文暴走率+2%,Haywire Rate +2%
紫水晶のキッチン,Amethyst Kitchen
強酸性の間　入口,Strong Acidity Entry
大魔王顔壁への道,Road to The Faces of Evil
初任務はモリナラ,Molinara First Mission
男性花柄のゆかた,Men's Floral Yukata
ブラッディスーツ,Bloody Suit
ハロふわホイミン,Halloween Healie
プチデビル衣装券,Petit Devil Costume Tkt
マタドールバンド,Matador Headband
あおざいいしょう,Ao Dai Outfit
商品ナンバー１２,Item Number 12
シスター・リコラ,Sister Ricola
イカダ風の座椅子,Raft-Style Legless Seat
実行委員リーベル,Executive Committee Ribel
黄金の飾り両手杖,Gold Ornament Staff
白木のテーブル大,Plain Table L
全滅時の復活場所,resurrection spot
世界樹のよろい下,Yggdrasil Armor Bottom
月世界の都への道,Road to The Moon's Capital
ドラパンクパンツ,Dracky Punk Pants
闇の領界のアーチ,Dark Realm Arch
姫君のブーメラン,Princess' Boomerang
プクリポバスタブ,Pukulipo Bathtub
よろず屋ヤップイ,General Shop Yapui
庭用ネコ草ベッド,Cat Grass Bed (G)
ハンタースーツ下,Hunter Suit Bottom
しぐさ書・高笑い,Emote "Ohoho!"
いやしのムニエル,Mending Meuniere
光のさいほう針小,Light Sew Needle S
おもちゃのテント,Toy Tent
特急メタル招待券,Express Metal Ticket
テラシナーラの像,Bulbergine Statue
ＣＭ用ウェディ３,Weddie For CM 3
金平糖ライト・氷,Ice Candy Light
汚れたペンダント,Dirty Pendant
雪の結晶プリズム,Snowflake Prism
郵便局員ヘヘヒヒ,Postman He-He-Hi-Hi
壁かけ鉄のランプ,Iron Wall Lamp
桜モダングローブ,Cherry Modern Gloves
ベリアル強メダル,Apex Belial Medal
グリエ王子の部屋,Prince Grie's Room
魔法使いのブーツ,Mage Boots
ひつじのころも下,Sheep Skirt
青リボンのリース,Blue Ribbon Wreath
ブレイブクリーム,Brave Cream
転生出現率アップ,Rarefied Encounter Up
ＤＱウォーク印章,DQ Walk Stamp
白亜の博物館の壁,Chalk Museum Wall
魔物管理人ミリィ,Monster Manager Miry
真珠貝のささやき,Pearl Oyster Whispers
家出したスランジ,Runaway Goorange
オーガテーブル小,Ogre Table S
オルフェア地方西,Orphea Region West
シャイニングボウ,Shining Shot
お姫様の本棚・橙,Princess Bookshelf
ホイミントブーツ,Heal Mint Boots
絆のエンブレム改,Uber Bonding Emblem
中枢へ向かう通路,Passage to Core
学園の校庭の鉄棒,Schoolyard Iron Bar
エメラルドの花束,Emerald Bouquet
究明者のコート上,Research Coat Top
はがねの防具図鑑,Steel Armor Book
紅竜の兄弟の写真,Red Dragon Brothers Photo
アロケルのおうぎ,Allocer Fan
ハンモックベッド,Hammock Bed
壁かけＤＱⅡの絵,DQⅡ Painting
カプレーゼタクト,Fromage Flay Wand
神具解放の審問宮,Sanctuary of Divine Relics
カミハルムイの柵,Kamiharmui Fence
ラリー特別参加券,Rally Entry Ticket
ネタ「そうめん」,Noodles Trick
超鍛冶ハンマー小,Super Smith Hammer S
壁かけ羽子板飾り,Hagoita Wall Decor
忍び寄る闇の足音,Creeping Dark Footsteps
手袋にかけた想い,Thoughts On Gloves
ツインアンテナＢ,Twin Antenna B
聖王のムチの壁画,Dryspell Whip Book
魔女の玉プリズム,Witch's Ball Prism
インテリサンダル,Scholar's Sandals
レプリカ加工ロボ,Replica Processor
光の錬金ランプ小,Light Alch Lamp S
しぐさ書・バトル,Emote "Battle"
しびれくらげ２３,Man o' War 23
パタプラのうきわ,Patapula's Floatie
スライムステッキ,Slime Stick
ブレイブストーン,Brave Stone
矢文のポスト・緑,Green Arrow Mailbox
航海冒険かきわり,Voyage Backdrop
やみのしょくだい,Sconstrosity
キャプテンの眼帯,Captain's Eyepatch
Ⅱ‐ディアノーグ,Ⅱ‐Diamagon
バシっ娘バンリィ,Bazoom Girl Banry
シンイのこころ６,Shini's Heart Lv. 6
アシッドテンプル,Acid Temple
バケーロの子分Ａ,Bakero's Henchman A
ジア燃石生産場２,Diatite Production Plant 2
プロディトヘッド,Plaudit Headdress
ラブリークッキー,Lovely Cookies
ぽかぽかマフラー,Warm Scarf
木の葉よろい全集,Foliage Armor Book
バラモスの像・庭,Baramos Statue (G)
おたからの花びら,Iridescent Petal
しぐさ書・つまむ,Emote "Picked Up"
カメラこぞうの像,Clicksy Statue
ちょこっとすーつ,Choco Suit
いねかりぞくの像,Harvester Statue
お正月の便利な壁,New Year Wall
マスタードロッド,Mustardo Rod
ロベールの家の鍵,Robere's Housekey
しぐさ書・かかし,Emote "Scarecrow"
ウィキッドヘルム,Wicked Helm
預かり所ボリバル,Storage Boliver
チェーンジーンズ,Chain Jeans
福笑いのラグ・鼻,Fukuwarai Nose Rug
トリットアーチズ,Trit Arches
大理石の置き時計,Marble Table Clock
しぐさ書・お弁当,Emote "Lunch Box"
オレンジスズラン,Orange Lily
六大陸堂の便せん,Six Continents Paper
ごうかなイス・緑,Green Fancy Chair
パラディンの伝説,Legend of Paladin
海竜ヴォドニーグ,Sea Dragon Vodnig
アンロックコード,Unlock Code
ヴァイパーブーツ,Viper Boots
銀の鍛冶ハンマー,Silver Smith Hammer
ぬいぐるみ竜族女,Dragon Plushie (F)
けんぽうぎセット,Tussler's Outfit
クマチャンブーツ,Beary Cute Boots
武勲の城の漆喰壁,Valor Castle Wall
氷の領界の丸イス,Ice Realm Round Chair
ジュエルシャワー,Jewel Shower
時の車掌ゼーベス,Conductor of Time, Zebes
ジア燃石生産場１,Diatite Production Plant 1
１階への転送装置,Transporter to 1F
オルフェア地方東,Orphea Region East
ルミナスウィング,Luminous Wings
ガーネットダリア,Garnet Dahlia
郵便局員ジヌデル,Postman Shinderu
ゴールデンライト,Golden Light
クロスブーメラン,Crucerang
古びた糸とじの書,Old Thread-Bound Book
マジカルかぼちゃ,Magical Pumpkin
ピンクタイフーン,Pink Typhoon
イルーシャの部屋,Irusha's Room
ソレイユバンドゥ,Sunflower Band
白木のパーティ机,Plain Party Table
あたまリボン茶券,Tea Head Ribbon Ticket
へいしうぃりあむ,Soldier William
便せん屋イトクリ,Stationery Shop Itokuri
クマリスのブーツ,Kumaris' Boots
キュルルトランプ,Kyururu Cards
ダークプラネット,Dark Planet
白トラ猫カプセル,White Tabby Toy
アサガオのアーチ,Morning Glory Arch
Ⅰ‐スペーディオ,Ⅰ‐Wulfspade
バスターウィップ,Scourge Whip
預かり所ボルリラ,Storage Borrilla
シンイのこころ４,Shini's Heart Lv. 4
混沌竜ランブルス,Rumbles, Dragon of Chaos
冥獣のツメの秘術,Monster Slashers Secret
リラックス浮き輪,Relax Floatie
真のエテーネの島,True Ethene Island
出張購買員サシモ,Team Vendor Agent Sashim
アルビノホシエイ,Albino Stingray
バラモスゾンビ闘,Bones of Baramos
ディバインソード,Divine Sword
おめかしカラー券,Recolor Ticket
スタン弾ショット,Stunning Shell
スタジアムリスト,Stadium Wristbands
オルフェアリーズ,Orphearies
立派なレンガの柱,Fine Brick Pillar
ギガスクラッパー,Giga Scrapper
プチテンタコルス,Frail Abyssal Octopot
フォーリオンの空,Skies of Fourion
白ヒゲのサンタ服,White Beard Santa Suit
祈星のスティック,Prayer Star Wand
ヴェリナード領西,Verinard West
シルバーアックス,Silver Axe
黄金のあらくれ像,Gold Thug Statue
ギュッとソーミャ,Somya Arm Doll
まだあたらしい傘,Mint Condition Umbrella
魔物管理人モモノ,Monster Manager Sanguino
魔物管理人コレス,Monster Manager Koresu
メカニックハンド,Mechanic Gloves
メガトンチャンプ,Megaton Champ
ごうかな玉座・赤,Red Fancy Throne
デビルンチャーム,Devil's Delight
預かり所ティーチ,Storage Tichi
ホワイトパンサー,Silver Sabrecat
裏ナイトチケット,Knight Ticket Back
ごきげんなぼうし,Happy Hat
シスター・リィト,Sister Lito
ひつじのころも上,Sheep Shirt
合唱隊のニーハイ,Choir Knee-Highs
ガウシア樹海の蝶,Gaussia Butterfly
大トラ猫カプセル,Big Tabby Toy
アビスソルジャー,Abyss Soldier
プチ伝説の三悪魔,Frail 3 Legend Evils
みやびな飾り扇子,Elegant Decor Fan
猛き炎と渦巻く闇,Flames In The Darkness
ローズコサージュ,Rose Corsage
銀の錬金ツボの本,Silver Alch Pot Book
グレートグリーブ,Great Greaves
よろず屋ポナック,General Shop Ponak
アリアハンマント,Aliahan Cape
立派なレンガの壁,Fine Brick Wall
アラハギーロ王国,Kingdom of Al-Ahagiro
ぬいぐるみ屋ウー,Plushie Shop Woo
キャラメルリップ,Caramel Tulip
スラミチカプセル,Slimichi Toy
タータンキャップ,Tartan Cap
授業ウェディ男性,Weddie Male Student
復讐の兄弟竜・改,Uber Vengeful Dragons
アズラン駅の模型,Azlan Station Model
剣王ガルドリオン,Sword King Gardlion
壁かけＤＱⅢの絵,DQⅢ Painting
インテリローブ下,Scholar's Robe Bottom
破戒王ベルムド影,Sin King Bermud Shadow
怪盗ポイックリン,Phantom Thief Poiclin
フェアリー衣装Ⅱ,Fairy Costume Ⅱ
もこふわパジャマ,Fluffy Pyjamas
