ギュッとレグナード,Regnad Arm Doll
魔道士キャロルギル,Wizard Kyrolgyl
カジノ祭５ビンゴ銀,CasinoFest 5 Bingo Slvr
スチームベッド・赤,Red Steam Bed
三姉妹人形・家用黄,Yellow 3 Sisters Doll
しましまマフラー赤,Red Striped Scarf
シスター・マティラ,Sister Matira
レンジャシャプカ２,Ranger Shapka 2
オブジェクト座標000,Object Coordinates 000
白きヴェールの乙女,Maid of the White Veil
祈願の神殿の飾り棚,Gratitemple Shelf
マイタウン採掘地区,My Town Mining District
ナイトフィーバー赤,Night Fever (Red)
ワイルドフォビズム,Wild Fauvism
モダンバニータイツ,Modern Bunny Tights
第８回ラグアスの像,8th Raguas Statue
聖地パサラン団子山,Sacred Pasaran Dango Mountain
マスター・アーリュ,Guildmaster Aryu
イレイザーＧｅ５０,Eraser GE50
城主ダストンチェア,Duston Chair
オブジェクト座標274,Object Coordinates 274
おうち用野道のラグ,Field Path Rug
エルドナ神の装束下,Eldona's Dress Bottom
第１の試練参加パス,First Trial Entry Pass
ハッチ付き大きな壁,Wall with Hatch
万魔の塔・一の災壇,Banma Tower - 1st Platform
おとぎの森エプロン,Fairy Forest Apron
ウェディングアーチ,Wedding Arch
ホイミンぬいぐるみ,Healie Plushie
天の冒険者のズボン,Divine Traveler Pants
ダーマ神殿のテント,Alltrades Abbey Tent
しぐさ書・おそうじ,Emote "Cleaning"
紅蓮のフランベリー,Bright Red Flanberry
ランニャーカプセル,Scram Toy
モモリオンの日記帳,Sanguini King's Diary
プラコン・白い唐傘,White Paper Umbrella
とある老行者の試練,Trials of an Old Pilgrim
宇宙船アルウェーン,Spacecraft Alweyn
ピクニックアルウエ,Alwe Picnic
まどろみのこんの書,Sleepy Stick Book
トマトのソファ・黄,Yellow Tomato Sofa
オブジェクト座標081,Object Coordinates 081
キナリ太猫カプセル,Fat Kinari Cat Toy
マジカルギフト・黒,Black Magical Gift
オブジェクト座標110,Object Coordinates 110
サイレントアンガー,Silent Anger
ゴブル砂漠東への道,Road to Goble Desert East
キュレクスのポッド,Kyurex's Pod
ごうかなベッド・赤,Red Fancy Bed
マジェスタグローブ,Majesta Gloves
スライムナイトの書,Slime Knight Book
シルエット・DQ1欠番,Silhouette DQ1 Missing #
チョッピ荒野の木Ｃ,Choppi Wilderness TreeC
特注キャットタワー,Custom-Made Cat Tower
マイタウン水没地区,My Town Submerged District
マジックフライ・強,Vicious Splutterfly
真の戦士への道のり,Becoming a True Warrior
スライダークの大剣,Nemeslime Greatsword
Ｓジェネラルカード,Shogum Card
オブジェクト座標138,Object Coordinates 138
アスバルのこころ６,Asbal's Heart Lv6
大自然にあこがれて,Longing for Nature
東洋風透かし窓・雅,Chic Orient Window
しぐさ書・オカリナ,Emote "Ocarina"
バルディスタ重装兵,Valdistan Trooper
悪霊の神々強コイン,Apex Evil Trinity Coin
ジュレリア地下廃坑,Juleria Underground Mine
ふのギフトボックス,Dark Gift Box
七夕デート大作戦！,A Star Festival Date!
学園女子のジャージ,Schoolgirl Jersey
ぬすっとの服セット,Robber's Outfit
かっぱえび家の甲羅,Kappa Ebisen Shell
タウン案内係スミカ,Town Guide Sumika
オブジェクト座標181,Object Coordinates 181
死神のピアスの破片,Reaper's Earrings Shard
エレファントノーズ,Elephantnose Fish
オルフェア民家の扉,Orphea House Door
スライムベスピアス,She-Slime Earrings
ルファ神殿・中央塔,Rufa Temple - Tower
精霊王のクローク下,Faerie King Skirt
ナルビア民家のラグ,Nalbia House Rug
ライトニングシール,Lightning Sticker
古びた制服のボタン,Old Uniform Button
エステラのこころ２,Estella's Heart Lv2
ミシュアの服上・真,True Mishua Dress Top
あやしいカウンタ大,Suspicious Counter L
ダークプラムの花束,Dark Plum Bouquet
エンゼルフィッシュ,Angelfish
ようこそビギナー！,Welcome, Beginner!
ナイトメアゾーン針,Nightmare Zone Needle
ジアクト軍の飛行艇,Dia Kut Army Airship
ガーディアンヘルム,Guardian Helm
シスター・カナーテ,Sister Canate
エルドナ神の装束上,Eldona's Dress Top
もうひとつの星夜祭,Yet Another Starry Night
つっぱりウルフの像,Ruff Wolf Statue
裁縫素材屋フレーツ,Sewing Materials Frets
お正月ザンクローネ,New Year Zankrone
苺お菓子のバスタブ,Berry Sweet Bathtub
ディアブロウィング,Diablo Wings
メダルオーナーの館,Medal Owner's Hall
ごうかな飾り棚・赤,Red Fancy Shelf
緑のほこらの洞くつ,Green Shrine Cave
住宅素材屋ノーニャ,Housing Materials Nonya
強・ボーンズメダル,Apex Bones Medal
ピッカピカのレンズ,Sparkling Lens
ヘヴィーアーマー上,Heavy Armor Top
ベラストル家の呪符,Belastre Amulet
ゴールドマンＸ６号,Gold Golem X 6
シスター・アナベル,Sister Annabel
よろず屋アメジスト,General Shop Amethyst
暗黒皇帝ガナサダイ,King Godwyn
第２回討伐ＴＡ・銀,2nd Boss TA Silver
レトロな水泳ぼうし,Retro Swim Cap
破壊魔神兵０６９号,Aztech Guard No. 069
ミステリークリーム,Mystery Cream
ティンクルカプセル,Tinkle Toy
超天遊戯－壱の書－,Chosen's Teachings Book 1
グレイスフルハット,Graceful Hat
武器屋の家の設計図,Weapon Shop Blueprint
オブジェクト座標183,Object Coordinates 183
壁かけリベリオの絵,Purrgatroyd Portrait
プリマベーラピアス,Primavera Earrings
ティプローネ薄紫花,Purple Tiplone Flower
わかめをたたえよ！,Praise the Seaweed!
コアブラックの花束,Core Black Bouquet
タイタス号の伝声管,Titus Voice Pipe
黒柴ピュアカプセル,Pure Black Shiba Toy
オブジェクト座標111,Object Coordinates 111
シルフウィング・桃,Pink Sylph Wings
コンシェルジュ０４,Concierge 04
ドラキーマの像・庭,Drackyma Statue (G)
ランドンクーンの像,Landon Coon Statue
占星術師のローブ上,Astrologer Upper Robe
植物学者の実験植物,Botanist Test Plants
ディバインアックス,Divine Axe
やまたのおろちたち,Orochi and co.
オブジェクト座標255,Object Coordinates 255
はじめよう！杖作り,Starter Staff Making
森のこびとのベッド,Forest Dwarf Bed
ギュッとトラぐるみ,Tiger Arm Doll Plush
オブジェクト座標047,Object Coordinates 047
スライムタワーの像,Slime Stack Statue
クロウズぬいぐるみ,Claws Plushie
ユシュカのこころ６,Yushka's Heart Lv6
シスター・ユミール,Sister Yumir
オブジェクト座標069,Object Coordinates 069
子供向けの木工教本,Woodworking For Kids
セクシーライトの本,Sexy Light Book
ヴァルハラグリーブ,Valhalla Greaves
魔塔の木の間仕切り,Tower Wood Partition
ウィキッドスーツ下,Wicked Suit Bottom
ランプ錬金のうでわ,Lamp Alchemist's Cuffs
新作家具屋メーベル,New Indoor Furniture Shop Mabel
きせきの釣り人列伝,Miracle Angler Book
クリムゾンウィング,Crimson Wings
ゲフェンダイトの袋,Gefendite Sack
しぐさ書・いねむり,Emote "Nodding Off"
ザ・キャッツメダル,The Cats Medal
しぐさ書・ネオン紫,Emote "Neon Purple"
赤バラのドレッサー,Red Rose Vanity
ウワサの魔物の写真,Rumored Monster Photo
パンジーのサンダル,Pansy Sandals
おおきづちの像・庭,Hammerhood Statue (G)
極天女帝のローブ上,Sky Empress Robe Top
桃果のフランベリー,Pink Flanberry
ゴージャスなゆびわ,Gorgeous Ring
ナイトフィーバー緑,Night Fever (Green)
モザイクガラスの壁,Mosaic Glass Wall
メタスラのオーブン,Metal Slime Oven
第２回カンダタの像,2nd Robbin' 'Ood Statue
マスター・ツェンケ,Guildmaster Zenke
メレアーデキッチン,Mereade Kitchen
モダンローズドレス,Modern Rose Dress
オパールのチェスト,Opal Chest
王国軍司令部の武器,Royal Army Weapons
謎の生き人形の写真,Mystery Lively Doll Photo
常闇の竜レグナード,Everdark Dragon Regnad
オブジェクト座標116,Object Coordinates 116
ムニエカの町への道,Road to Munieka
スターリーシールド,Starry Shield
ポーズ書・釣り仙人,Pose "Fish Hermit"
ドミネウスの回顧録,Domineus' Memoir
灰塵の豪雷将バルケ,Ash Thunder General Barke
さざなみギフト・桃,Pink Ripples Gift
ハンドベルエルフ像,Handbell Elf Statue
ドミネウス邸のイス,Domineus Mansion Chair
モダンバニーブレス,Modern Bunny Bracelet
虹のフェザーチップ,Rainbow Feather Chip
スカイブルーの花束,Sky Blue Bouquet
ジェスタースーツ上,Jester Suit Top
からくりだいみょう,Bamboogieman
魔想念レギルラッゾ,Remnant of Legirrazzo
鍛冶素材屋レヴェリ,Smithing Materials Reverie
武闘家ヤーン分身Ｃ,Martial Artist Yarn Copy C
コタツでメレアーデ,Mereade Kotatsu
アシッドクリスタル,Acid Crystal
レプリカード発行証,Replicard Proof
作りかけぬいぐるみ,Unfinished Plushie
ギュッとフランジュ,Frange Arm Doll
冒険ゼミ会員ベスノ,Adventurer Seminar Member Sheeno
プリズニャンぐるみ,Jailcat Plushie
しぐさ書・キンスラ,Emote "King Slime"
ディカス団長のメモ,Commander Dicus' Note
アリアハングローブ,Aliahan Gloves
りぼんカチューシャ,Ribbon Hairband
壁かけ忌まわしき絵,Abominable Painting
パッチ柄ソファ・桃,Pink Patch Sofa
ナイトのピース・白,White Knight Piece
ヘチマの壁・実つき,Loofah Wall with Fruit
スマートな水着・赤,Red Smart Swimsuit
プラチナ錬金ツボ小,Platinum Pot S
コイン販売所ユアン,Token Exchange Yuan
宿屋スィーテの地図,Sueet's Map
モダンバニーのくつ,Modern Bunny Shoes
モノクロームナイト,Monochromour
ディバイングリーブ,Divine Greaves
創世の神の絵の写真,God of Creation Photo
おもちゃの草原・雪,Toy Grass Field (Snow)
上級・魔力錬金の本,Advanced Magic Power
第１１回ファラス像,11th Faras Statue
ハートのベッド・桃,Pink Heart Bed
ドラグーンメイル下,Dragoon Mail Bottom
ほこらの祭祀場・炎,Flame Shrine Ritual Ground
第９回討伐ＴＡ・金,9th Boss TA Gold
パンパニーニノート,Panpanini's Notebook
グレイツェルの大鍋,Gretzel's Cauldron
姉神封印神殿　出口,Goddess Seal Temple Exit
ユシュカのこころ５,Yushka's Heart Lv5
ゴールデンボックス,Golden Box
カフェラウンジの家,Cafe Lounge House
王都カミハルムイ南,Kamiharmui City South
アストルティアの楯,Shield of Astoltia
ドベルニッチの写真,Dobernitch Photo
花狩人の衣装券・赤,Red Flowerer Voucher
ワーニングなビキニ,Warning Bikini
エイルのスティック,Eir's Wand
星座の導き・しし座,Constellations: Leo
ダラズ大鉱脈への道,Road to Daraz Prospect
スマート吊りランプ,Smart Hanging Lamp
オブジェクト座標207,Object Coordinates 207
ピクニックヒューザ,Hyuza Picnic
オブジェクト座標197,Object Coordinates 197
ふわあまアーモンド,Soft Almond
ラダトームグローブ,Tantegel Gloves
ハートの兵隊ぼうし,Heart Soldier Hat
ポールスタートップ,North Star Shirt
第８回釣りコン・銅,8th Fish Contest Bronze
プラコン・黒い唐傘,Black Paper Umbrella
入団！　カンダタ団,I'm In! Robbin' 'Ood Gang
かざぐるまのアーチ,Pinwheel Arch
オブジェクト座標243,Object Coordinates 243
アスバルのこころ９,Asbal's Heart Lv9
ハートガール兵隊服,Heart Soldier Uniform (F)
アズラン地方への道,Road to Azlan Region
ニブルヘイムのカギ,Nibelheim Key
ごうかなタンス・緑,Green Fancy Wardrobe
第６回討伐ＴＡ・銅,6th Boss TA Bronze
マジカルギフト・白,White Magical Gift
まじないしターバン,Fizzle-Proof Turban
マスターの一番弟子,Master's Top Disciple
断罪のジャマダハル,Judgement Katar
ラッキーチケット金,Gold Lucky Ticket
真・オノむそう・改,Axes of True Evil+
蘇りしバサグランデ,Risen Bogan
輝く虹を追いかけて,Chasing a Rainbow
ボトルシップの置物,Ship in a Bottle
フォートレスハウス,Fortress House
ワンダラーズマント,Wanderers Mantle
タウン案内係メゾナ,Town Guide Mezona
ラッキー便せん３５,Lucky Paper 35
支援魔神機０２１号,Aztech Support Mech No. 021
第４回討伐ＴＡ・銀,4th Boss TA Silver
すいーとないしょう,Sweet Outfit
ヒューザのこころ６,Hyuza's Heart Lv6
ファルシオンクロー,Falchion Claw
ピラミッドの便せん,Pyramid Paper
シングルアンテナＡ,Single Antenna A
うしろの正面……？,The Face at your Back
サマーなカンカン帽,Summer Can-Can Hat
おとぎの森カチーフ,Fairy Forest Kerchief
オブジェクト座標162,Object Coordinates 162
ジュレー島下層遺跡,Lower Jule Island Ruins
たそがれの寄木の壁,Twilight Wooden Wall
異界獣ヘイズシナー,Haze Sinner, the Otherworldly
オーマイドリーム！,Oh My Dream!
カラス神楽の装束Ⅰ,Crow Dance Costume Ⅰ
ターン消費しない+1%,Free Turn +1%
グレイブディガー強,Apex Grave Digger
さざなみギフト・黄,Yellow Ripples Gift
エルガドーラの部屋,Elgadora's Room
エッグの写真ケース,Egg Photo Case
イグナイトメイル下,Ignite Mail Bottom
白のキーエンブレム,White Key Emblem
デスマシーンメダル,Slaughtomaton Medal
カンフーガール衣装,Kung Fu Girl Costume
シスター・サレーマ,Sister Salema
しぐさ書・Ｓスター,Emote "Signal Star"
行動時10%バイシオン,Oomph On Action 10%
バニラリリィのタネ,Vanilla Lily Seed
ペンダントを追って,Follow the Pendant
整理術は海を越えて,Sea the Art of Organizing
太古の偶像を求めて,In Search of Ancient Idols
タイフーンレザー上,Typhoon Leather Shirt
サンゴールドの花束,Sungold Bouquet
怨霊の憑いた戦士Ｂ,Warrior With a Grudge B
ホーリーキャンディ,Holy Lollipop
バトエンコロシアム,Batoen Coliseum
機工博士のコート上,Engineer's Upper Coat
オブジェクト座標244,Object Coordinates 244
ユシュカぬいぐるみ,Yushka Plushie
見覚えのあるドレス,Familiar Dress
スターリーステッキ,Starry Stick
ハクオウのこころ５,Hakuo's Heart Lv5
無限獣ネロスゴーグ,Eternal Beast Nerosugog
スパイクアーマー上,Spike Armor Top
プチドラゴンカード,Frail Green Dragon Card
レジェンズショット,Legends Bow
おつかれさまでした,Thanks for your hard work.
第９回討伐ＴＡ・銀,9th Boss TA Silver
くろがねのよろい下,Darksteel Faulds
チョコレートリップ,Chocolate Tulip
まじないしローブ上,Fizzle-Proof Shirt
アンガーギフト・銀,Silver Angry Gift
チアガールシューズ,Cheerleader Shoes
パピヨンソファ・幻,Phantom Papillon Sofa
ドレスを追い求めて,In Pursuit of the Dress
ハロウィン衣装券Ⅴ,Halloween Voucher Ⅴ
ベスキャンプリズム,She-Slime Candy Prism
マジェスタスーツ上,Majesta Shirt
ゴールドマンＸ３号,Gold Golem X 3
ごうかな飾り棚・緑,Green Fancy Shelf
呪文ぼうそう率 +2.0%,Haywire Rate +2%
はがねのブーメラン,Soarin' Steel
だんせいしつじふく,Butler Uniform (M)
ドランド平原への道,Road to Drand Plains
しぐさ書・バトエン,Emote "Battle Pencil"
ビターチョコヌーバ,Dark Fudgeraker
キュートなクマミミ,Cute Bear Ears
発信機イヤリング型,Earring Type Transmitter
白玉ドットＴシャツ,White Dot T-Shirt
はじゃのろーぶきん,Gold Champ Robe
オブジェクト座標290,Object Coordinates 290
サボテンダーマスク,Cactuar Mask
庭用まちかど掲示板,Town Bulletin Board (G)
絶対滅神ジャゴヌバ,Jagonuba, the Absolute Annihilator
壁かけ朝食シェルフ,Breakfast Wall Shelf
極天女帝の浮遊椅子,Sky Empress' Floating Chair
オブジェクト座標189,Object Coordinates 189
しぐさ書・だいこん,Emote "Radish"
ガウシア樹海への道,Road to Gaussia Woodlands
クラゲの天井ライト,Jellyfish Ceiling Light
防衛魔神兵０５２号,Aztech Guard No. 052
上級・呪文錬金の本,Advanced Spell
万魔の塔・二の災壇,Banma Tower - 2nd Platform
メギストリスの都駅,Megistris City Station
冒険ゼミ会員ベスコ,Adventurer Seminar Member Sheeko
ルミナスギフト・青,Blue Luminous Gift
バルディスタ竜騎兵,Valdista Dragon Cavalry
ほのおのつるぎの書,Fire Blade Book
ＤＱⅧ主人公の衣装,DQⅧ Hero Costume
淡い記憶を紐解いて,Unraveling Faint Memories
まもりのペンダント,Adamant Pendant
ポールスターハット,North Star Hat
ともしびこぞう提灯,Wickerman Paper Lantern
クロスペンデュラム,Cross Pendulum
プスゴンのテーブル,Pusgon Table
プクリポの人形・男,Pukulipo Doll (M)
オブジェクト座標286,Object Coordinates 286
おどる宝石の像・庭,Goodybag Statue (G)
クーちゃんふうせん,Ku Balloon
タロットパック・紫,Purple Tarot Pack
ヒューザのこころ２,Hyuza's Heart Lv2
天地雷鳴士の高みへ,The Heights of a Druid
イナミノ街道の木Ｂ,Inamino Highway Tree B
すごろく景品係ミミ,Sugoroku Prize Clerk Mimi
メルサンディ穀倉帯,Melsandy Millfields
自由人の集落のイス,Freedom Village Chair
壁かけ故郷の風景画,Hometown Painting
スライムレース印章,Slime Race Stamps
マジカルエッセンス,Magical Essence
ビビッド・グリーン,Vivid Green
スノースター衣装上,Snowstar Dress Top
しぐさ書・そうめん,Emote "Noodles"
たれ灰太猫カプセル,Fat Lazy Ash Cat Toy
スピリットフレイム,Spirit Flame
チョコっとシューズ,Choco Shoes
演奏会２５夏レンズ,Summer Concert '25 Lens
幻想画「一期一会」,Fantasy Art "One in a Life"
超天遊戯－弐の書－,Chosen's Teachings Book 2
テンションブースト,Tension Boost
ゼクレスのテーブル,Zechres Table
ウェディカウンタ小,Weddie Counter S
踊魔の霊符・花嫁翠,Green Dancer Charm
白猫オッドカプセル,Odd White Cat Toy
ウェディのサンダル,Weddie Sandals
オブジェクト座標082,Object Coordinates 082
シルエットベリンダ,Silhouette Belinda
輝け！　メダライト,Shine On! Medalite
プチゲルニック将軍,Frail Hootingham-Gore
海のステンドグラス,Sea Stained Glass
レーナム緑野の木Ｂ,Lenam Fields Tree B
氷の領界の氷ソファ,Ice Realm Sofa
植物学者の置きかご,Botanist Cage
深い森の邸宅の石壁,Forest Manor Stone Wall
超錬金ランプ小の本,Super Lamp S Book
オブジェクト座標094,Object Coordinates 094
サリアスぬいぐるみ,Sarias Plushie
アスバルのこころ７,Asbal's Heart Lv7
モーモンぬいぐるみ,Teeny Sanguini Plushie
Ｖロンのベッド・赤,Red Vron Bed
シュジャクカプセル,Peashock Toy
ナチュラルチェスト,Natural Chest
異国の寺院の庭用床,Exotic Temple Floor (G)
壁かけフウラ肖像画,Fuura Portrait
ムーンアックスの謎,Moon Axe Mystery
さいほう職人腕あて,Sewer's Armguards
武器鍛冶職人の挑戦,Weaponsmith's Challenge
ローラ姫のティアラ,Gwaelin's Tiara
迅雷のスーツセット,Thunderclap Set
オブジェクト座標203,Object Coordinates 203
デスディオ暗黒荒原,Deathdio Darklands
ポップスターセット,Pop Star Outfit
魔女のとんがり帽子,Witch's Pointy Hat
オブジェクト座標129,Object Coordinates 129
オブジェクト座標055,Object Coordinates 055
笹と流線じんべい下,Bamboo Jinbei Bottom
第１回カジノ祭・銅,1st Casino Fest Bronze
となかいのきぐるみ,Reindeer Costume
アンノウンシールド,Unknown Shield
レジェンズブレード,Legends Blade
青鮮の根絶将コンネ,Fresh Eradication General Cornelia
ごきげんクローバー,Cheery Clover
白霜の流氷野への道,Road to Frosty Floes
サーカステントの扉,Circus Tent Door
ウェディング便せん,Wedding Paper
背くらべの落書き柱,Height Marked Pillar
蚊帳つきフトン・黄,Yellow Futon with Net
パンツドレスギフト,Pantdress Gift
カラフル花火台・青,Blue Fireworks Stand
竜将のよろいセット,Dragon General Armor Set
ゆらゆら羊さん・紫,Purple Rocking Sheep
ガートラント建国王,Founder of Gartlant
壁かけマイユ肖像画,Maille Portrait
グリンガムのレシピ,Gringham Whip Recipe
ゴブル砂漠西への道,Road to Goble Desert West
オブジェクト座標120,Object Coordinates 120
オスクトルクラウン,Oscutor Crown
南国スラムざぶとん,Tropical Slime Floormat
アイスブルーダリア,Ice Blue Dahlia
ネオン・縦メーター,Neon Vertical Meter
オブジェクト座標151,Object Coordinates 151
チェックのラグ・青,Blue Checkered Rug
光の錬金ランプの本,Light Lamp Book
予言のサークレット,Circlet of Prophecy
サボテンダーポーズ,Cactuar Pose
おばけのいしょう２,Ghost Costume 2
芯層・サフィア宙橋,Core - Saphia Bridge
しょくにんのベルト,Utility Belt
エンペラーレグホン,Emperor Leghorn
オブジェクト座標007,Object Coordinates 007
りべりおのきぐるみ,Purrgatroyd Costume
オブジェクト座標172,Object Coordinates 172
プチギュメイカード,Frail Goresby Card
ちっちゃな恋の物語,A Tale of Tiny Love
荘厳な神殿の便せん,Majestic Abbey Paper
マスターの悩みの種,Master's Source of Worry
ホイミントバンダナ,Heal Mint Bandana
さざなみギフト・黒,Black Ripples Gift
オーガのパーティ机,Ogre Party Table
キーたんのブローチ,Keytan Brooch
ヤマカミヌ王の屋敷,Yamakaminu King's Abode
博愛騎士のよろい下,Love Knight Lower Armor
モザイクタイルの壁,Mosaic Tile Wall
ホーローの研究成果,Hollow's Research Results
ボーイモッズコート,Boy Mod Coat
メイジドラキー帽子,Drackolyte Hat
赤熱の荒野への出口,Exit to Red Hot Desert
イナミノ街道の竹Ａ,Inamino Highway Bamboo
アクロバーガー・小,Small Acro-Burger
苺お菓子のキッチン,Berry Sweet Kitchen
マジェスタスーツ下,Majesta Pants
冥氷竜ジェロドーラ,Jerodora, Icy Dark Dragon
きじゅつしのズボン,Illusionist's Pants
フリルのビキニ・黄,Yellow Frill Bikini
オブジェクト座標107,Object Coordinates 107
残響の海蝕洞への道,Road to Echoing Sea Cave
あさがお柄のゆかた,Bell Pattern Yukata
プラチナトレイの本,Platinum Platter Book
アズラン地方の木Ｂ,Azlan Region Tree B
イルシームトランプ,Ilseem Deck
星雲のモビール・白,White Nebula Mobile
ヒストリカのうちわ,Historica Fan
レモンスライムの柱,Lemon Slime Pillar
ポンポンベタ・青赤,Red Pom Pom Betta
きれいなバラのトゲ,Beautiful Rose Thorn
サンバ・デ・ビーク,Samba de Beak
蒼穹兵団のグリーブ,Azure Corps Greaves
プラコン女あくま服,Women's Imp Costume
オルファの丘への道,Road to Orpha Hill
ぼーいもっずこーと,Boy Mod Coat
経験値の古文書・小,Experience Scroll S
魔女の秘密テーブル,Witch's Secret Table
セイレーンパレオ上,Siren's Pareo Top
ウィザードバス・黒,Black Wizard Bath
武闘家ヤーン分身Ａ,Martial Artist Yarn Copy A
エンシェントククリ,Olde-Worlde Knife
だいまどうローブ下,Great Mage Lower Robe
ねこまどうの像・庭,Meowgician Statue (G)
閃輝晶獣ザウザリィ,Crystalfiend Zauzari
サイクロンアッパー,Air Raiser
祭具・星天の衣折紙,Starry Sky Robe Origami
レインボーリキッド,Rainbow Liquid
マイタウン雪原地区,My Town Snow District
ドミネウス邸のラグ,Domineus Mansion Rug
シュバリエメイル上,Chevalier Mail Top
ピンクモーモンの像,Pink Sanguini Statue
花狩人の衣装券・黄,Yellow Flowerer Voucher
オブジェクト座標115,Object Coordinates 115
おおきなリボン青白,Blue/White Ribbon L
虹色のパーカー水着,Rainbow Hoodie Swimsuit
ユシュカのこころ３,Yushka's Heart Lv3
スラタワーステッキ,Slime Stack Stick
ようせいの首かざり,Papillon Pendant
アンルシアの剣鞘有,Sword Sheathed Anlucia
カーディナルナイト,Cardinal Knight
まほうよろいの秘密,Magic Armor Secret
プラコン男あくま服,Men's Imp Costume
蘇りし怪蟲アラグネ,Risen Araniad
オブジェクト座標238,Object Coordinates 238
ウィリーデウィップ,Vilide Whip
白柴クールカプセル,Cool White Shiba Toy
王さまのプレゼント,The King's Present
オブジェクト座標262,Object Coordinates 262
クールスターブーツ,Cool Star Boots
水晶のイスと机の本,Crystal Furniture Book
ガーディアンブーツ,Guardian Boots
四季の壁画つき浴槽,Four Seasons Bathtub
キャンディのピアス,Candy Earrings
オブジェクト座標270,Object Coordinates 270
中辛角竜ボブラノス,Medium Spicy Dragon Bobranos
ザードの尖塔・５階,Zard Spire 5F
オブジェクト座標064,Object Coordinates 064
オブジェクト座標279,Object Coordinates 279
ヴィーラのころも下,Vila's Garment Bottom
アイドルギフト・青,Blue Idol Gift
男子のスクール制服,Boy School Uniform
古代祭具としての鏡,Ancient Mirrorcles
キューブレジデンス,Cube Residence
小さな英雄の便せん,Little Hero Paper
純真天使のパンプス,Pure Angel Pumps
