プチグラコスカード,Frail Gracos Card
魔カブト草の根っこ,Horseshoe Plant Root
イナミノ街道への道,Road to Inamino Highway
ダンシングライト緑,Dancing Light (Green)
灰三毛太猫カプセル,Fat Ash Calico Cat Toy
さすらいのコート下,Errant Coat Bottom
プチマジンガカード,Frail Uberkilling Card
シスター・アーミャ,Sister Amya
ビクトリーチケット,Victory Ticket
ドラパンクシューズ,Dracky Punk Shoes
チアガールのリスト,Cheerleader Bangles
表層・サフィア宙橋,Surface - Sapphira Bridge
スマートな水着・赤,Red Smart Swimsuit
絶念のアウルモッド,Aurmod the Forlorn
オトシゴスティック,Seahorse Stick
しぐさ書・雪だるま,Snowman
影の深底への昇降機,Elevator to Shadowy Deeps
マイユの肖像画・庭,Maille Portrait (G)
スクアーロの写真２,Squalo's 2nd Photo
パピヨンチェア・夢,Dream Papillon Chair
グレースギフト・緑,Green Grace Gift
ギュッとスライム強,Vicious Slime Arm Doll
凧あげナスビナーラ,Kite Flying Woebergine
リンベリィのドレス,Linberry's Dress
ドワーフ市民ぼうし,Dwarf Citizen Hat
封神の参道への出口,Exit to The Sealed Approach
デスマシーン練習札,Slaughtomaton Tag
ミツバチパーカー下,Honeybee Shorts
常闇の竜レグナード,Everdark Dragon Regnad
古代オルセコの太鼓,Old Orseco Drum
ムーンバニーブーツ,Moon Bunny Boots
エックス君冒険印章,Adventurous X Stamps
チュピちゃんのネジ,Chupie's Screw
魔物黒アイパッチ券,Black Eyepatch Ticket
苺お菓子のオーブン,Berry Sweet Oven
さいほう職人の看板,Sewing Sign
しぐさ書・ビースト,Wild Side
カイラム村長の手紙,Chief Kairam's Letter
妖炎魔女のドレス下,Fire Witch Lower Gown
スタジアムシューズ,Stadium Shoes
かたりべの服セット,Storyteller's Outfit
オブジェクト座標283,Object Coordinates 283
パピヨンドーム・幻,Phantom Papillon Dome
第９回ナジーンの像,9th Najinn Statue
ウェディのサンダル,Weddie Sandals
ホーリーキャンディ,Holy Lollipop
オブジェクト座標016,Object Coordinates 016
強毒性ザラキール液,Toxic Zaraquil Liquid
ぬすむ成功率アップ,Half-Inch Success Up
シスター・グレンダ,Sister Glenda
ノクゼリアハンマー,Noxeria Hammer
オーマイドリーム！,Oh My Dream!
パンジーのスカート,Pansy Skirt
ミステリドールの書,Pocus Poppet Book
降魔のサークレット,Demonfel Circlet
チェイサーレザー下,Chaser Leather Pants
黒鳥のサークレット,Blackbird Circlet
庭用ネオン・ファン,Neon Fan (G)
ゆらゆら牛さん・黄,Yellow Rocking Ox
メタキンボスメダル,Metal King Boss Medal
ギュッと魔勇者の箱,Evil Hero Arm Doll Box
スキマスぬいぐるみ,Skimas Plushie
表情の書・わくわく,Excited
ウィキッドスタッフ,Wicked Staff
コンシェルジュ０４,Concierge 04
メタスラの間仕切り,Metal Slime Partition
タマゴ変換屋エギー,Egg Converter Eggy
さまようよろいの書,Restless Armour Book
ロードリーローブ上,Lordly Robe
ヤングガイアコイン,Young Gaia Coin
ミューズ海岸への道,Road to Muse Coast
セクシーブロマイド,Sexy Bromide
ドラキー柄のゆかた,Dracky Yukata
ピンクモーモンの像,Pink Sanguini Statue
ハロウィン衣装券Ⅴ,Halloween Voucher Ⅴ
ユシュカのこころ６,Yushka's Heart Lv6
アスタルジアの護符,Amulet of Astalgia
ばくだん岩の像・庭,Rockbomb Statue (G)
バルディスタ竜騎兵,Valdista Dragon Cavalry
バブルスライム・強,Vicious Bubble Slime
海賊トニー＆ベニー,Pirates Tony & Benny
氷魔王の大矛・ヤリ,Ice Demon King Spear
学園女子のジャージ,Schoolgirl Jersey
旅芸人の衣装セット,Minstrel Outfit
天の川モビール・白,White Milky Way Mobile
うさぎエステラ人形,Rabbit Estella Doll
第６回釣りコン・銅,6th Fish Contest Bronze
コルット地方への道,Road to Colt Region
マタドールスーツ下,Matador Suit Bottom
しぐさ書・グレドラ,Great Dragon Trick
マリン調のバスタブ,Marine Bathtub
ザルトラ練習召喚符,Zaltra Trainer Summon
ぶらっくたきしーど,Black Tuxedo
赤の錬金石２０こ券,20 Red Gems Ticket
木造御殿のアーチ壁,Wood Palace Arch Wall
フォステイルソファ,Fostail Sofa
デルクロアの研究室,Delcroix's Laboratory
紅爆の暴奏将モグド,Blast General Burrows
異界将軍ゲルニック,Hootingham-Gore, the Otherworldly
第１回釣りコン・金,1st Fish Contest Gold
どうぐ使いのズボン,Item Master Pants
オブジェクト座標101,Object Coordinates 101
会場案内係ファリネ,Venue Guide Farine
大きな黄金の秘宝？,Large Golden Treasure ?
魔天兵ゴルドーたち,Evil Soldier Goldo and co.
おでかけふくびき券,App Tombola Ticket
錬金屋ミス・ドール,Alchemy Shop Miss Doll
オスクトルローブ上,Oscutor Robe Top
剛勇のベルトの破片,Bravery Belt Shard
銀のフェザーチップ,Silver Feather Chip
ゴールデンゴーレム,Balhib
魔物管理人アゼルル,Monster Manager Azerul
クイックジャケット,Quick Jacket
スライムベスハウス,She-Slime House
ゴールドマンＸ４号,Gold Golem X 4
警備魔神兵０４１号,Aztech Guard No. 041
ドルタムのこころ６,Doltam's Heart Lv6
ドワチャッカの秘宝,Dwachakka's Treasure
第９回釣りコン・銅,9th Fish Contest Bronze
きょじんのハンマー,Giant's Hammer
ヘヴィーアーマー上,Heavy Armor Top
アルゴンキッズの像,Argon Fry Statue
創失のガナン帝国城,Gittingham Palace
スイカさまの像・庭,Mr.Watermelon Statue(G)
三毛猫スーツのヒゲ,Calico Cat Whiskers
イグナイトグローブ,Ignite Gloves
ＤＱⅩⅠ主人公の像,DQⅩⅠ Hero Statue
ごうかなラグ小・緑,Green Fancy Rug S
リエーレの銃士服上,Lierre Musketeer Shirt
防衛軍の制服・灰色,Gray Defense Force Suit
大光の管制室への扉,Door to Pulse Control Room
クールスターハット,Cool Star Hat
ブレイブスラッシュ,Brave Slash
アンルシアカプセル,Anlucia Toy
ブランドンビースト,Brandon's Beast
楽将バトルシェイカ,Tyrant Maracaraider
マイタウン草原地区,My Town Meadow District
ディーバギフト・桃,Pink Diva Gift
デスマシーンコイン,Slaughtomaton Coin
断罪のジャマダハル,Judgement Katar
ベルヴァインの森西,Belvain Forest West
コンシェルジュ０８,Concierge 08
キュートなウサミミ,Cute Bunny Ears
オブジェクト座標047,Object Coordinates 047
オブジェクト座標168,Object Coordinates 168
とこなつヘアバンド,Summer Headband
プリズニャンぐるみ,Jailcat Plushie
オブジェクト座標177,Object Coordinates 177
宣伝コンテスト・金,Promo Contest Gold
第５回釣りコン・銀,5th Fish Contest Silver
プラネタリウム・緑,Green Planetarium
釣り道に　王道なし,No Noble Path in Fishing
賢者の杖クラッシュ,Sage's Staff Crash
エテーネ軍の兵士Ｃ,Ethene Army Soldier C
オブジェクト座標085,Object Coordinates 085
グロリアスグローブ,Glorious Gloves
ダラズ大鉱脈への道,Road to Daraz Prospect
セラフィムウィング,Seraph Wings
エクリプスアックス,Eclipse Axe
メリクリギフト・赤,Red Christmas Gift
お花の外灯・ブルー,Blue Flower Light (G)
オブジェクト座標144,Object Coordinates 144
ふたつ結びエクステ,Double Knot Extension
チョッピ荒野の木Ｂ,Choppi Wilderness TreeB
ガーデン花火台・赤,Red Fireworks Stand (G)
伝説の旅芸人への道,Road to Legend Minstrel
タイタス号の羅針盤,Titus' Compass
学園の生徒会室の棚,School Council Shelf
グレースギフト・赤,Red Grace Gift
やりなおしの無限石,Infinite Repeatstone
マジカルエッセンス,Magical Essence
レンタルドルボード,Rental Dolboard
魔塔の青宝石付き壁,Blue Tower Jeweled Wall
キングヒドラ練習札,King Hydra Tag
バルディスタ軽歩兵,Valdistan Infantry
赤眼のデスライダー,Red-eyed Rider
七夕の吹き流し・花,Paper Flower Streamers
黒蛇鬼アクラガレナ,Akragarena
悪夢のヤドリギ広場,Mistletoe Plaza of Nightmares
腐緑の呪老将ズタン,Rot General Zutan
ぬすっとウサギ・強,Vicious Robber Rabbit
マリンスライム・塔,Tower Seaslime
神技のベストセット,Divine Skill Outfit
オブジェクト座標218,Object Coordinates 218
中級・呪文錬金の本,Intermediate Spell
シャインファイバー,Shiny Fibers
ナゾの黒いかたまり,Black Lump of Mystery
ファンキータイツ下,Funky Tights
冬風マキシスカート,Winter Maxi Skirt
デュアルブレイカー,Double Down
決めポーズ中央後列,Decisive Pose Back Row
いちばん星の贈り物,First Star's Gift
黒柴ピュアカプセル,Pure Black Shiba Toy
ペンシルフィッシュ,Pencil Fish
カジノ祭６ビンゴ金,CasinoFest 6 Bingo Gold
冒険ゼミ会員ベスエ,Adventurer Seminar Member Shea
マイタウン未開地区,My Town Savage District
花狩人のころも・青,Blue Flower Hunter Outfit
ピクニックヒューザ,Hyuza Picnic
マスターを目指す者,One Who Aims to be Master
あたらしいお友達？,A New Friend?
アズリアのウィッグ,Azria's Wig
バルメシュケの水晶,Balmeschke's Crystal
アシュレイの髪飾り,Ashley's Hairpin
お菓子のテーブル小,Sweet Table S
ピヨちゃんＴシャツ,Chick T-Shirt
アイスダンスのくつ,Ice Dance Shoes
バランスパスタ・小,Small Balance Pasta
マグマの杖のレシピ,Magma Staff Recipe
しぐさ書・キンスラ,King Slime Trick
マジカル姫ゆかた下,Magical Yukata Bottom
学園女子のエプロン,Schoolgirl Apron
メガトンブラザーズ,Heavy Metal
ゲルヘナ幻野への道,Road to Gerhena Field
扉つきアーチ型の壁,Arched Wall with Door
プラチナさいほう針,Platinum Needle
真の戦士への道のり,Becoming a True Warrior
ファルシオンクロー,Falchion Claw
シーサイドチェスト,Seaside Chest
グランゼニス神の像,Gran Zenith Statue
第９回ファラスの像,9th Faras Statue
ぷらこんすーつくろ,Black Suit
王太后の部屋のカギ,Queen's Room Key
第６回討伐ＴＡ・銀,6th Boss TA Silver
預かり所シャーヤー,Storage Shayer
スピリットフレイム,Spirit Flame
住宅素材屋ピノッピ,Housing Materials Pinoppi
マーメイドオブジェ,Mermaid Curio
果てなき夢の芸人道,Dream of Entertaining
スライムタワー２段,Slime Stack Stage 2
わかめをたたえよ！,Praise the Seaweed!
ズッシリゾット・小,Small Sushi Risotto
ナイトメアゾーン針,Nightmare Zone Needle
オブジェクト座標173,Object Coordinates 173
大怪傑の装束セット,Great Wonder Outfit
ブルーハワイかき氷,Blue Hawaii Shaved Ice
ギュッとザンクの箱,Zankrone Arm Doll Box
小鳥の止まり木の畑,Small Bird Perch Field
星空のチェスト・青,Blue Starry Chest
ミステリークッキー,Mystery Cookies
鍛冶ハンマーの逆襲,Smith Hammer Strikes Back
レインスカート・青,Blue Rain Skirt
ガラクタボックス２,Junk Box 2
怨霊の憑いた戦士Ｂ,Warrior With a Grudge B
ピクニックパルミオ,Palmio Picnic
スノー柄の便利な壁,Snow Pattern Wall
プチデビルグローブ,Petit Devil Gloves
コロシアム対戦終了,Coliseum Match End
クロッシュグローブ,Bell Gloves
うんてんしちっちぇ,Driver Chiche
始まりの大魔王の舞,First Demon Lord Dance
星空のチェスト・紫,Purple Starry Chest
第１０回ラウル像庭,10th Rahul Statue (G)
アスバルのこころ９,Asbal's Heart Lv9
ヴィーラのサンダル,Vila's Sandals
超おたから花ダイヤ,Diamond Treasurebloom
しぐさ書・聞かざる,Don't Listen
カジノ祭５ビンゴ銅,CasinoFest 5 Bingo Brnz
闇の領界のレリーフ,Dark Realm Relief
紅蓮のクイーンビー,Crimson Queen Bee
特別タロットパック,Special Tarot Pack
しぐさ書・ウインク,Wink
ギーグハンマー・狂,Mad Giga Clubber
おしゃべりシャベル,Talking Shovel
アマラーク城の衝立,Amarak Castle Screen
第１３回エステラ像,13th Estella Statue
労働魔神機０３１号,Aztech Labor Mech No. 031
オス三毛猫スーツⅡ,Calico Cat Suit (M) Ⅱ
マキュリのテーブル,Makyuri Table
うつしよの金箱・改,Worldly Gold Box+
ドワーフ作業うでわ,Dwarf Work Bangles
ハクオウのこころ２,Hakuo's Heart Lv2
フリルスイムパンツ,Frill Swim Trunks
ボディーガード呼び,Call Bodyguard
スライムベス観覧車,She-Slime Ferris Wheel
チョッピ荒野への道,Road to Choppi Wilderness
第９回討伐ＴＡ・銀,9th Boss TA Silver
ウェスタンレイピア,Western Rapier
サマーソルトクロー,Somersault Claw
ナスビナーラ衣装券,Woebergine Voucher
エルドナ神のリボン,Eldona's Ribbon
ギュメイ将軍の太刀,Goresby-Purrvis' Sword
第９回クマリスの像,9th Kumaris Statue
さざなみギフト・赤,Red Ripples Gift
魔天導クローマたち,Sky Guide Chroma and co.
土地管理人リステア,Land Manager Listeah
クーちゃんふうせん,Ku Balloon
プラコンスーツ・黒,Black Suit
あどるふうんてんし,Driver Adolf
異国のレンガ館の壁,Exotic Brick Wall
マポレーナプリズム,Genie Sanguini Prism
ガーデン花火台・青,Blue Fireworks Stand(G)
黒衣の剣士のブーツ,Dark Swordsman Boots
バーベキューセット,Barbecue Set
壁かけ潜水艦ライト,Submarine Wall Light
ダルメシアンのくつ,Dalmatian Shoes
フォーマルシューズ,Formal Shoes
第８回釣りコン・金,8th Fish Contest Gold
エアボードプリズム,Airboard Prism
超天遊戯－死の書－,Chosen's Teachings Book 4
しぐさ書・ネオン黄,Neon Yellow
プチアトラスカード,Frail Atlas Card
プリティサングラス,Pretty Sunglasses
奇跡のフライパン小,Miracle Frypan S
ジェスターシューズ,Jester Shoes
しぐさ書・ごきげん,Cheery
ゼネシアのかんむり,Zenethia's Crown
ごうかなダンロ・緑,Green Fancy Fireplace
夜宴館の目玉つき扉,Banquet Door with Eye
謎の幽霊列車の写真,Mystery Ghost Train Photo
花束交換屋ププリン,Bouquet Shop Pupurin
夢のスティック物語,Fantastick Story
新作家具屋メーベル,New Indoor Furniture Shop Mabel
オブジェクト座標169,Object Coordinates 169
ゼドラ王国服モブ２,Zedra Royal Clothes Mob 2
とこしえの神殿広間,Temple of Eternity Hall
花菱模様のノンラー,Floral Pattern Non La
クロッシュウェア下,Bell Leggings
オブジェクト座標207,Object Coordinates 207
オス三毛猫スーツⅠ,Calico Cat Suit (M) Ⅰ
打ち上げ花火・水色,Fireworks Launcher (LB)
セイクリッドソード,Sacred Sword
ライトニングダガー,Thunderstorm Skean
おぞましき呪いの絵,Dreadful Cursed Drawing
氷の魔王のスーツ下,Ice Demon Suit Bottom
裁縫素材屋フレーツ,Sewing Materials Frets
ウェスリーハンマー,Wesley's Hammer
メカニックスーツ下,Mechanic Suit Bottom
祈りの時は来たりて,Time for Prayer Has Come
プラコン・白い唐傘,White Paper Umbrella
クリティカルロッド,Critical Rod
メタル出現率アップ,Metal Encounter Boost
オブジェクト座標045,Object Coordinates 045
ギュッとチュラリス,Chularis Arm Doll
輝け！　メダライト,Shine On! Medalite
大地の怒竜バウギア,Earthwyrm Baugia
しゅうれん用バンド,Training Hairband
カジノ祭３ビンゴ銀,CasinoFest 3 Bingo Slvr
天地雷鳴士の装束上,Druid Attire Top
ニヒルなサングラス,Nihilistic Sunglasses
がーるもっずこーと,Girl Mod Coat
魔物管理人グーボレ,Monster Manager Gubole
アズラン地方の木Ｂ,Azlan Region Tree B
魔物管理人セモーナ,Monster Manager Semona
銀のキーエンブレム,Silver Key Emblem
行動時10%早詠みの杖,Faster Caster On Action 10%
オグチャビ像こげ茶,Olive Ogreed Chubby St.
スチームベンチ・赤,Red Steam Bench
大いなる危機の胎動,Great Crisis in Motion
カントリードレス上,Country Dress Top
お姫様のタンス・橙,Princess Wardrobe
第２回ラグアスの像,2nd Raguas Statue
オブジェクト座標149,Object Coordinates 149
ビクトリーチップ冥,Hades Victory Chip
灰ブチ太猫カプセル,Fat Ash Spotted Cat Toy
フォーチュンブーツ,Fortune Boots
ウロコフネタマガイ,Scaly-Foot Gastropod
ダーマ神官ネイシャ,Abbey Priest Neisha
ピクニックファラス,Faras Picnic
盗賊のチュニック下,Thief Pants
コンシェルジュ０３,Concierge 03
プクリポのいいくつ,Pukulipo Fine Shoes
スパイクアーマー上,Spike Armor Top
妖精の隠れ家の石壁,Fairy Lair Stone Wall
死闘！　山奥の秘湯,Struggle at the Springs
オーガＧＰプリズム,Ogre GP Prism
パラディノアックス,Paladinsaurus Axe
シスター・アニッタ,Sister Anitta
冒険者たちのきせき,Adventurer's Miracle
プラチナ木工刀の本,Platinum Slick Book
ふわふわアーケロン,Floaty Archelon
オブジェクト座標061,Object Coordinates 061
バイカラーメッシュ,Bicolor Mesh
ゆめみの竜箱タンス,Dreamy Dragon Wardrobe
チャーロンへの荷物,Baggage to Charon
オブジェクト座標123,Object Coordinates 123
チョコが詰まった袋,Chocolate Filled Bag
ローヌ樹林帯への道,Road to Rhone Woodlands
レンダーヒルズ地区,Lender Hills District
特別預かり所メメリ,Special Storage Memeri
ピンクダマスクの壁,Pink Damask Wall
トレジャーグローブ,Treasure Gloves
アンティーク扇風機,Antique Electric Fan
幻想画「一触即発」,Fantasy Art "Touch and Go"
マイタウン浜辺地区,My Town Beach District
マスター・ホッチャ,Guildmaster Hotcha
福まねきのタヌキ像,Good Luck Tanuki Statue
おおきなリボン白水,White Water Ribbon L
ロイヤルマシュマロ,Royal Marshmallows
戦士の魔物かぶと券,Warrior Helm Ticket
目覚めし五つの種族,Awakening of the Five Tribes
しぐさ書・パンフ２,Pamphlet 2
ジェントルシューズ,Gentleman's Shoes
異界魔エボルキング,Evolking, the Unworldly
メタッピーの像・庭,Mecha-Mynah Statue (G)
パンプキンシューズ,Pumpkin Shoes
魔道士キャロルギル,Wizard Kyrolgyl
竜族人形男のライト,Nadravian Doll Light(M)
プロディトシューズ,Plaudit Shoes
ゆらゆら羊さん・桃,Pink Rocking Sheep
Ｎ高女子のブレザー,N High Girl's Blazer
精霊王のクローク上,Faerie King Cloak
ナウマンコックの像,Naumanncook Statue
シンプルハウスの壁,Simple House Wall
ソルシエールグラブ,Sorciere's Gloves
飛竜のベストセット,Flying Dragon Outfit
苺お菓子のキッチン,Berry Sweet Kitchen
第２回カジノ祭・金,2nd Casino Fest Gold
福笑いのラグ・まゆ,Fukuwarai Eyebrow Rug
ドワーフの人形・男,Dwarf Doll (M)
バラレースふりそで,Rose Lace Furisode
輪王ザルトラ召喚符,Zaltra Summon
ハンギンググリーン,Hanging Greenery
エピステーサ桃小花,Pink Epistesa Flowers
おまじない師プポペ,Charmer Pupope
ビューティクリーム,Beauty Cream
真・幻界諸侯メダル,True Dread Fiends Medal
作ろう！てつよろい,Let's Make Iron Armor!
ヴァルディスタ兵１,Valdista Soldier 1
ビクトリーチップ地,Earth Victory Chip
グレースギフト・桃,Pink Grace Gift
ゆらゆら牛さん・白,White Rocking Ox
聖守護者のハンマー,Sentinel's Hammer
ハロウィン衣装券Ⅷ,Halloween Voucher Ⅷ
赤バラのドレッサー,Red Rose Vanity
朽ちた遺跡の庭用柱,Ruin Pillar (G)
お花大好きブラバー,Flower Lover Blubba
ゴールドニャンの像,Gold Cat Statue
メロディアトップス,Melody Top
夏休みの絵日記・銅,Bronze Summer Break Diary
ネオン・虹サークル,Neon Rainbow Circle
裏ショコラチケット,Chocolate Ticket Back
知の祝祭への招待券,Wisdom Festival Invite
クスリの入った小瓶,Small Bottle of Medicine
コイン販売所イサラ,Token Exchange Isara
オルクステラへの扉,Door to Orchesterra
華麗なる魔法戦士団,The Great Armamentalist
バトルシェイカー強,Apex Maracaraider
海辺の釣具屋の看板,Fishing Shop Sign
敵の動きを止めて！,Stop enemy movement!
ウィリーデウィップ,Vilide Whip
プクリポカウンタ小,Pukulipo Counter S
バスルームの洗面台,Bathroom Washbasin
かーにばるこーでⅠ,Carnival Outfit Ⅰ
うしろの正面……？,Who's That Behind You...?
しぐさ書・たこ焼き,Takoyaki
ゴールデンライト緑,Golden Light (Green)
バレンタインメイン,Valentine's Mein
ゆめみの冥箱タンス,Dreamy Gloom Wardrobe
お姫様のベンチ・橙,Princess Bench
プラチナトレイの本,Platinum Platter Book
三首海竜のウィング,Sea Dragon Wings
旅人の愛馬プリズム,Traveler's Horse Prism
ダーマ神殿の荷馬車,Alltrades Abbey Wagon
イカしたＴシャツ黄,Yellow Cool T-Shirt
風船星空天井ライト,Starry Balloon Light
エンゼルスラネオン,Angel Slime Neon Sign
セルケトのブローチ,Serket's Brooch
経験値の古文書・大,Experience Scroll L
しぐさ書・バトエン,Battle Pencil
暗黒皇帝ガナサダイ,King Godwyn
風鈴のシャンデリア,Wind Chime Chandelier
三姉妹の飛行船・青,Blue 3 Sisters Blimp
ファラオ・カーメン,Pharaoh Khamun
こおりのやいばの書,Icicle Dirk Book
お花の外灯・ピンク,Pink Flower Light (G)
ハートのオルゴール,Heart Music Box
ガテリア式技術大系,Gateria Technology Book
究極邪教司祭カード,Ultimate Aamon Card
オブジェクト座標049,Object Coordinates 049
オブジェクト座標059,Object Coordinates 059
クールスターマイク,Cool Star Microphone
実録！魔剣の作り方,Making a Fizzle Foil
シスター・モスコル,Sister Moscol
アラモンドの案内板,Alamond Info Board
第２回討伐ＴＡ・金,2nd Boss TA Gold
アイリのぬいぐるみ,Aili Plushie
攻撃時25%で魔導の書,Magical Book Attack 25%
千輪菊花火・赤黄桃,Red/Yel./Pink Fireworks
前ウェーブつけ毛Ａ,Front Wavy Hairpiece A
メタリックウィング,Metallic Wings
しぐさ書・決め左前,Decisive Pose L. Front
オブジェクト座標232,Object Coordinates 232
守護天使のガーベラ,Guardian Angel's Gerbera
預かり所クリスタル,Storage Crystal
月明かりの谷への道,Road to Moonlit Valley
特別郵便局員レチカ,Special Postman Lechika
キュロン丘陵への道,Road to Kyuron Hills
スコアアタック銀赤,Score Attack Silver
フォーチュンローブ,Fortune Robe
若手芸人のながぐつ,Young Talent Boots
いなずまチャーム赤,Red Lightning Charm
コンシェルジュ０６,Concierge 06
ポーンのピース・白,White Pawn Piece
黄金獣アルムゴーグ,Golden Beast Armogog
しぐさ書・まぶしい,Dazzling
第２回討伐ＴＡ・銀,2nd Boss TA Silver
プラコン女ミイラ服,Women's Mummy Costume
お正月ザンクローネ,New Year Zankrone
アルヴァンの像・庭,Alvan Statue (G)
ポーリアにおまかせ,Leave it to Paulia
グレゴールの洞くつ,Gregor Cavern
転生の花（つぼみ）,Rebirth Flower (Bud)
アーイシャの道具箱,Aisha's Toolbox
古代王族のターバン,Ancient Royal Turban
北の空き家・地下室,Vacant House - Basement
チームアジトの外観,Team Hideout Exterior
攻撃時10%で魔導の書,Magical Book Attack 10%
ミスティカルソーン,Spirithorn Whip
ガタラアームズの旗,Gatara Arms Banner
回転木馬のモビール,Carousel Mobile
黒い影の正体の写真,Shadow's True Form Photo
きれいなバラのトゲ,Beautiful Rose Thorn
カントリードレス下,Country Dress Bottom
惜別の置き手紙伝説,Farewell Letter Legend
ミッドナイトの花束,Midnight Bouquet
ギュッとアンルシア,Anlucia Arm Doll
ラン錬作業トップス,Lamp Alchemist's Top
オブジェクト座標060,Object Coordinates 060
未完のラゼアの風穴,Undone Lazea Wind Cave
タップペンギーたち,Pogoin' Penguins
レジェンズショット,Legends Bow
マスター・バレクス,Guildmaster Barex
うさみみギフト・黒,Black Rabbit Ears Gift
オラクルギフト・桃,Pink Oracle Gift
攻撃時10%でヘナトス,Blunt Attack 10%
自由人の集落のイス,Freedom Village Chair
スカウトローブーツ,Scout Robes
カラフル花火台・桃,Pink Fireworks Stand
コーヒーカップ・黄,Yellow Coffee Set
神託のローブセット,Oracle Outfit
ハッチ付き大きな壁,Wall with Hatch
第１回カジノ祭・金,1st Casino Fest Gold
じょせいめいどふく,Maid Outfit (F)
あくま神官の像・庭,Wrecktor Statue (G)
ほこらの祭祀場・闇,Dark Shrine Ritual Ground
ばくだんいわ便せん,Rockbomb Paper
デビルアーマーの書,Harmour Book
ニューＶロンコイン,New Vron Coin
つっぱりウルフの像,Ruff Wolf Statue
ウサギ魔物の装束上,Rabbit Monster Shirt
ドラゴンクローの書,Dragon Claws Book
お菓子のテーブル大,Sweet Table L
七夕の職人道具絵巻,Festival Craftsman Book
シルバリヌスのツボ,Silverine Pot
手本書・お好み焼き,Pancake Manual
無限獣ネロスゴーグ,Eternal Beast Nerosugog
天の川をつかまえて,Capture the Milky Way
ティルツキンの馬車,Tiltzkin's Wagon
たんけんかえるまん,Explorer Elman
オブジェクト座標171,Object Coordinates 171
再しぐさ書・ピース,Peace Sign (Reprint)
