ハチワレ猫カプセル,Tuxedo Cat Toy
ビクトリーチップ王,King Victory Chip
表情の書・ウインク,Expression "Wink"
マリンバックシャン,Marine Derriere
ミツバチパーカー上,Honeybee Hoodie
オブジェクト座標162,Object Coordinates 162
お花の鉢植え・家用,Flower Plant Pot
チェックのイス・青,Blue Checkered Chair
ウィンターグローブ,Winter Gloves
ビクトリーチップ光,Light Victory Chip
賢者のころもセット,Sage Outfit
マジックチャクラム,Magic Circle
中層・サフィア宙橋,Middle - Saphia Bridge
砂漠の渇きを癒す者,Desert Thirst Quencher
美と富と豊穣と幸運,Beauty, Wealth And Luck
しんりのローブの本,Faithful Outfit Recipe
男性さくらのゆかた,Sakura Yukata (M)
肖像画「学究の徒」,"Academic" Portrait
フォンデュの像・庭,Fromage Fray Statue (G)
ガールモッズコート,Girl Mod Coat
レクタリスの花飾り,Lectalis' Floral Decor
ランプ素材屋ナディ,Lamp Materials Nadi
中級・呪文錬金の本,Intermediate Spell
続・暗殺武器の歴史,Assassin Weapons Part 2
ブレイブギフト・白,White Brave Gift
カボチャのキッチン,Pumpkin Kitchen
妖炎魔女のパンプス,Fire Witch Shoes
古代オルセコの玉座,Old Orseco Throne
たれサバ猫カプセル,Lazy Gray Cat Toy
スターの足置き・青,Blue Star Footrest
カウンターブースト,Counter Boost
さらつやシャンプー,Smooth Shampoo
第１の試練参加パス,First Trial Entry Pass
オブジェクト座標155,Object Coordinates 155
オブジェクト座標106,Object Coordinates 106
運動会・白組衣装券,White Team Uniform Tkt
三姉妹人形・家用青,Blue 3 Sisters Doll
シルエット・五種族,Silhouette 5 Tribes
色飾りタイルの本棚,Color Tile Bookshelf
ＰＣの姿を映す和紙,PC's Reflective Washi Paper
ミラクルサンド・小,Small Miracle Sandwich
福笑いのラグ・くち,Fukuwarai Mouth Rug
ウィキッドスーツ下,Wicked Suit Bottom
ハロウィン衣装券Ⅳ,Halloween Costume Tkt Ⅳ
笹と流線じんべい下,Bamboo Jinbei Bottom
第１１回ヒューザ像,11th Hyuza Statue
うさみみギフト・桃,Pink Rabbit Ears Gift
南国の釣りざお・炎,Fire Tropic Fishing Rod
オブジェクト座標150,Object Coordinates 150
ハートの兵隊の服下,Heart Soldier Pants
ももんじゃの浮き輪,Platypunk Floatie
うんてんしこぺちゃ,Driver Kopecha
いたずらウサギの畑,Naughty Rabbit Field
ブレイブマシュマロ,Brave Marshmallows
マイタウン雲上地区,My Town Cloud District
グランゼドーラ兵Ａ,Gran Zedora Soldier A
千輪菊花火・緑紫桃,Gr./Pur./Pink Fireworks
エルドナ神の装束下,Eldona's Dress Bottom
ドーナッツの浮き輪,Donut Floatie
ラディカルシールド,Radical Shield
カジノバニーリスト,Casino Bunny Wristbands
天駆ける冒険者たち,Soaring Adventures
コンシェルジュ１０,Concierge 10
天使のタペストリー,Angel Tapestry
裁縫素材屋フレーツ,Sewing Materials Frets
すごろく案内係アミ,Sugoroku Guide Amy
新七不思議コン・金,Seven Wonders Gold
深海にうごめくもの,Deep Sea Lurker
赤色チューリップ傘,Red Tulip Umbrella
コマンダーキャップ,Commander Cap
オブジェクト座標126,Object Coordinates 126
勇者と盟友の便せん,Hero & Ally Paper
真・魔幻宮殿の燭台,Demon Palace Candles
荘厳な竜のふりそで,Majestic Dragon Kimono
レーナム緑野の木Ａ,Lenam Fields Tree A
しぐさ書・ネオン青,Emote "Neon Blue"
銀トラ太猫カプセル,Fat Silver Tabby Toy
シスター・ディモス,Sister Deimos
とらんす一味ポーチ,Trans Gang Pouch
コマンダーグローブ,Commander Gloves
武器防具屋マシスタ,Weapon & Armor Shop Masista
ロードリーローブ下,Lordly Robe Bottom
ふわふわブーケ飾り,Floating Boquet Decor
シグナルクローバー,Clover Signal
キングエレファント,Elephant King
エフェクト用ダミー,Dummy Effect
Ｖジャンプベレー改,V Jump Beret v2
壁かけバラのリース,Rose Wall Wreath
ネレウススティック,Nereus Wand
ディバイングリーブ,Divine Greaves
守護天使のガーベラ,Guardian Angel's Gerbera
フューリーブレード,Fury Blade
ごうかなラグ小・緑,Green Fancy Rug S
第９回ナジーンの像,9th Nazine Statue
魔人エンラージャ強,Apex Genie Enraja
スパングルフェザー,Spangled Feather
船長より愛を込めて,With Love From the Captain
まもの使いずきん２,Monster Master Hood 2
ファンタスティック,Fantastick
すいーとないしょう,Sweet Outfit
よろず屋アメジスト,General Shop Amethyst
ギュッとレグナード,Regnad Arm Doll
リースのカーペット,Wreath Carpet
きんのブレスレット,Gold Bracer
ふわふわふうせん青,Floating Blue Balloon
シャーマニズム大全,Shamanism Encyclopedia
クラッシュチェーン,Crusher Chain
断罪のジャマダハル,Judgement Katar
はぐれメタル浮き輪,Liquid Metal Floatie
釣り道に　王道なし,No Noble Path in Fishing
アクセルギアの破片,Mechanical Monocle Shard
神具解放の審問宮１,Sanctuary of Divine Relics 1
プラネタリウム・青,Blue Planetarium
カンフージャケット,Kung Fu Jacket
小さな英雄のよろい,Little Hero's Armor
セオドルトの指令書,Theodort's Directive
魔女ハバネロのムチ,Witch Habanero's Whip
防衛魔神兵０５４号,Aztech Guard No. 054
オブジェクト座標220,Object Coordinates 220
古防砂ダム・展望台,Old Sand Dam Observatory
預かり所フォッチャ,Storage Foccia
ベラストル家の暖炉,Belastre Fireplace
アンノウンウィップ,Unknown Whip
シルエット・猫・白,White Silhouette Cat
マジカルじんべい下,Magical Jinbei Bottom
魔カブト草の根っこ,Horseshoe Plant Root
愛しのツボ錬金職人,Beloved Pot Alchemist
ビクトリーチップ闇,Dark Victory Chip
カーディナルナイト,Cardinal Knight
メディカルデバイス,Medical Device
ギュメイ将軍カード,Goresby-Purrvis Card
ムーンバニーパンツ,Moon Bunny Pants
管理タブレット新品,New Management Tablet
うつしよの銀箱・改,Worldly Silver Box+
オブジェクト座標214,Object Coordinates 214
天の冒険者のブーツ,Divine Traveler Boots
花咲ける木工職人道,The Woodworker's Way
オパールのバスタブ,Opal Bathtub
バージンロードラグ,Wedding Aisle Rug
ナゾの黒いかたまり,Black Lump of Mystery
しぐさ書・星の魔法,Emote "Star Magic"
オルフェア民家の扉,Orphea House Door
冒険ゼミ会員ベスエ,Adventurer Seminar Member Shea
オブジェクト座標059,Object Coordinates 059
ゴールドマンＸ３号,Gold Golem X 3
エンドウマメのラグ,Pea Rug
古グランゼドーラ領,Old Gran Zedora Territory
虹のプラネタリウム,Rainbow Planetarium
うつしよの金箱・改,Worldly Gold Box+
ゴシック調のタンス,Gothic Wardrobe
ホワイトパンプキン,White Pumpkin
オブジェクト座標152,Object Coordinates 152
スマートな水着・赤,Red Smart Swimsuit
オブジェクト座標288,Object Coordinates 288
悪夢より来たるもの,The One From Nightmares
キャット・ジュニア,Catrick
ふんさいのおおなた,Heavy Hatchet
オルファの丘への道,Road to Orpha Hill
夏休みの絵日記・銅,Bronze Summer Break Diary
オブジェクト座標091,Object Coordinates 091
セーラススティック,Selas Wand
さすらいのコート上,Errant Coat Top
フーたんぬいぐるみ,Futan Plushie
邪蒼鎧デルメゼの像,Delmeze Statue
しぐさ書・もじもじ,Emote "Bashful"
オブジェクト座標082,Object Coordinates 082
プラチナソードの本,Platinum Sword Book
ガード時50%で早詠み,Cast Speed Up On Block 50%
ヴィンテージの時計,Vintage Watch
ハチ駆除防護グラス,Bee Protection Glasses
おしゃべりシャベル,Talking Shovel
スターダムシューズ,Stardom Shoes
ウェスタンブラウス,Western Blouse
さんぞくのサーベル,Bandit Blade
いたずらもぐらの像,Mischievous Mole Statue
潮風のディーバたち,Sea Breeze Divas
マスカレイドブーツ,Masquerade Boots
ふうまの盾の作り方,Make a Dampening Shield
永眠のフクロウ魔人,Owl of Eternal Sleep
オブジェクト座標163,Object Coordinates 163
モザイクタイルの壁,Mosaic Tile Wall
学園の菜園の飾り棚,Academy Garden Shelf
ペコリア・アルファ,Pekoria Alpha
ぬすむ成功率アップ,Half-Inch Success Up
真の戦士への道のり,Becoming a True Warrior
森のこびとのおうち,Forest Dwarf Home
感謝を求める者たち,Those Who Seek Gratitude
第５回釣りコン・金,5th Fish Contest Gold
パンプキングローブ,Pumpkin Gloves
スコアアタック銀赤,Score Attack Bronze
しぐさ書・こまいぬ,Emote "Foo Dog"
メッキのトロフィー,Plated Trophy
ムーンバニーシャツ,Moon Bunny Shirt
彼女のノートの秘密,The Secret of Her Notebook
はじめてのさいほう,Starter Sewing
ダンシングライト赤,Dancing Light (Red)
妖精の女王ドレス上,Fairy Queen Upper Dress
ヒューザのこころ７,Hyuza's Heart Lv. 7
予言者学園女学生服,Prophet Sch. Uniform(F)
レッドガーベラの傘,Red Gerbera Umbrella
ふわふわフラフの箱,Fluffy Fluff Box
攻撃時25%バイキルト,Oomphle On Attack 25%
おうち用花畑のラグ,Flower Field Rug
青狼鬼グルバレイダ,Grubareyda, the Blue Wolf
イチゴヤドクガエル,Strawberry Poison Frog
バランスパスタ・小,Small Balance Pasta
入学案内係フラッセ,Admissions Guide Flasse
ゴールデンゴーレム,Balhib
蒼穹兵団のよろい上,Azure Corps Armor
しぐさ書・線香花火,Emote "Sparkler"
ムーディーテーブル,Moody Table
翠将鬼ジェルザーク,Gelzark, the Green General
オパールのキッチン,Opal Kitchen
DQ1勇者たいまつなし,DQ1 Hero Without Torch
ジュリアンテのムチ,Juliante's Whip
呪文のためのナイフ,Knife for Spells
じゃんぼりぃの帽子,Janbori's Hat
防衛魔神兵０５１号,Aztech Guard No. 051
キンスラぬいぐるみ,King Slime Plushie
スノーモンプリズム,Snow Sanguini Prism
しっこくのターバン,Macabre Turban
花狩人のころも・黄,Yellow Flower Hunter Outfit
妖精図書館のチェア,Fairy Library Chair
予言者学園女学生靴,Prophet School Shoes(F)
起源将ジェルザーク,Gelzark, General of Origin
大富豪協会員プゴル,Tycoon Club Member Pugol
マイタウン林道地区,My Town Forest District
小さな英雄のズボン,Little Hero's Pants
ステージチュチュ上,Stage Tutu Top
ハートの兵隊ぼうし,Heart Soldier Hat
かまいたちプリズム,Cyclown Prism
烈火の渓谷への出口,Exit to Valley of Fire
オブジェクト座標099,Object Coordinates 099
自由なるラ・テート,Free La Tate
ゴスバニースカート,Goth Bunny Skirt
ディバインステッキ,Divine Stick
エレガントに猛毒を,Elegantly Venomous
ピクニックリベリオ,Purrgatroyd Picnic
緑のキーエンブレム,Green Key Emblem
ごうかなグリル・緑,Green Fancy Grill
不死の魔王ネロドス,Immortal Demon King Nerodos
ドルワームの紋章旗,Dolworm Banner
古代つちわらしたち,Ancient Lickspittles
お姫様バスタブ・桃,Pink Princess Bathtub
パンパニーニノート,Panpanini's Notebook
南国の釣りざお・闇,Dark Tropic Fishing Rod
奇跡のさいほう針小,Miracle Sew Needle S
ニヒルなサングラス,Nihilistic Sunglasses
オブジェクト座標224,Object Coordinates 224
キングアックスの書,King Axe Book
異界獣ヘイズシナー,Haze Sinner, the Otherworldly
スチームベッド・赤,Red Steam Bed
人の域を超えた強者,Strong Beyond Human Limits
ウェットスーツ・金,Gold Wetsuit
神官のほういセット,Minister Outfit
手品師のヘアバンド,Conjurer's Hairband
ギュッとリゼロッタ,Lieselotte Arm Doll
アイドルヘアバンド,Idol Hairband
お花大好きブラバー,Flower Lover Blubba
あたまリボン水色券,Blue Head Ribbon Ticket
プリンスタキシード,Prince Tuxedo
オブジェクト座標058,Object Coordinates 058
トレジャーキャップ,Treasure Cap
花狩人の衣装券・青,Blue Flower Hunter Tkt
ヴァルディスタ兵２,Valdista Soldier 2
始源の歌姫のドレス,First Diva's Dress
マンドラゴラコイン,Mandragora Coin
オブジェクト座標283,Object Coordinates 283
庭用ネオン・アロー,Neon Arrow (G)
ウィザード本棚・白,White Wizard Bookshelf
オブジェクト座標043,Object Coordinates 043
うごくせきぞうの像,Living Statue Statue
プスゴンきぐるみ券,Pusgon Costume Ticket
打ち上げ柳花火・紫,Purple Willow Firework
メタキンボスメダル,Metal King Boss Medal
野いちごボンネット,Wild Strawberry Bonnet
リュウグウノツカイ,Oarfish
プロペラ草の鉢植え,Propeller Plant Pot
オブジェクト座標212,Object Coordinates 212
スチームカウンタ大,Steam Counter L
謎の生き人形の写真,Mystery Lively Doll Photo
ピクニックラグアス,Raguas Picnic
キングスライム・強,Vicious King Slime
ミツバチパーカー下,Honeybee Shorts
踊り神ボニータ右羽,Dance God Bonita Right Wing
銀のロザリオの破片,Silver Rosary Shard
樹天の里へのはしご,Ladder to Treetop Town
スライムのチェスト,Slime Chest
こおりの杖のレシピ,Shiverstick Recipe
プクリポカウンタ大,Pukulipo Counter L
リシアの新作アクセ,Lycia's New Accessory
ごうかなベッド・緑,Green Fancy Bed
オブジェクト座標144,Object Coordinates 144
ジェイドウォリアー,Jade Warrior
カラフル花火台・桃,Pink Fireworks Stand
クマチャンキャップ,Beary Cute Cap
アイスダンスグラブ,Ice Dance Gloves
第９回ファラスの像,9th Faras Statue
ディエゴぬいぐるみ,Diego Plushie
プラコンプレゼント,Private Concierge Present
ストリートシューズ,Street Shoes
闇に唄う白面の隠者,Dark Singing Hermit
聖地パサラン団子山,Sacred Pasaran Dango Mountain
アンルシアのうちわ,Anlucia Fan
死神のピアスの破片,Reaper's Earrings Shard
プオーンのツボ・庭,Rebjorn Pot (G)
エンゼルのみちびき,Angel's Guidance
歓迎会用テーブル２,Table for Welcome Party 2
りゅうおうブレード,Dragonlord Blade
しぐさ書・ミルク缶,Emote "Milk Can"
古レビュール街道南,Old Reviewle Highway South
転生の花（つぼみ）,Rebirth Flower (Bud)
プチギュメイカード,Frail Goresby Card
セクシーライトの本,Sexy Light Book
呪術師ゴルガーレン,Shaman Golgaren
サファイアのピアス,Sapphire Earrings
千輪菊花火・青緑水,Blue/Gr./Aqua Fireworks
ジア・レド・ゲノス,Dia Ledo Genos
しましまマフラー赤,Red Striped Scarf
オブジェクト座標279,Object Coordinates 279
アイゼルぬいぐるみ,Eisel Plushie
青いビーチパラソル,Blue Beach Umbrella
強・キャッツメダル,Apex Cats Medal
モザイクガラスの壁,Mosaic Glass Wall
ナドラガ神のほこら,Nadraga Shrine
護りの盾のグローブ,Gloves of Protection
魔塔の赤宝石付き壁,Red Tower Jeweled Wall
暁天竜ランビリズマ,Lanbelysma, Dragon of Dawn
ゴージャスティアラ,Gorgeous Tiara
炎帝のいくさ装束上,Fire God Shirt
男性白波柄のゆかた,White Wave Yukata (M)
ゆらゆら牛さん・黄,Yellow Rocking Ox
黄金の飾りよろい上,Gold Ornament Cuirass
ゴールデンパペット,Gold-Plated Puppet
メタルスライムたち,Metal Slimes
オブジェクト座標017,Object Coordinates 017
やりなおしの無限石,Infinite Repeatstone
じょうぶな木枠の壁,Solid Wood Frame Wall
フラワーの気球・桃,Pink Flower Balloon
ドラグーングリーブ,Dragoon Greaves
ゴールデンライト青,Golden Light (Blue)
キラーパンサーの書,Great Sabrecat Book
深い森の修道院の柱,Monastery Pillar
オパールのオーブン,Opal Oven
幻想画「一獲千金」,Fantasy Art "Get Rich Fast"
ファフニルメイル下,Fafnir Mail Bottom
スライダークカード,Nemeslime Card
まがんの杖の作り方,Making a Hocus Locus
陰陽博士のころも下,Yin-Yang Skirt
オブジェクト座標136,Object Coordinates 136
海賊トニー＆ベニー,Pirates Tony & Benny
ケミカルポップ鏡台,Chemical Pop Vanity
ホイミントドレス下,Heal Mint Skirt
しぐさ書・ごきげん,Emote "Cheery"
花狩人のころも・紫,Purple Flower Hunter Outfit
キラパン黒プリズム,Dark Sabrecat Prism
とある老行者の試練,Trials of an Old Pilgrim
コタツでメレアーデ,Mereade Kotatsu
パニガキャッチャー,Paniga-Catcher
タウン案内係ポポコ,Town Guide Popoko
スチーム食器棚・赤,Red Steam Cupboard
コンシェルジュ０５,Concierge 05
ツボ錬金職人の看板,Pot Alchemy Sign
お姫様の食器棚・橙,Princess Cupboard
機工博士のコート上,Engineer's Upper Coat
プチキラーマジンガ,Frail Uberkilling Machine
大きなタルのベッド,Large Barrel Bed
プラコンシェルジュ,Private Concierge
オブジェクト座標149,Object Coordinates 149
オブジェクト座標179,Object Coordinates 179
小さな黄金の秘宝？,Small Golden Treasure ?
たそがれの寄木の壁,Twilight Wooden Wall
スライムナイト帽子,Slime Knight Hat
おもちゃの草原・雪,Toy Grass Field (Snow)
イナミノ街道の木Ｂ,Inamino Highway Tree B
アイリのぬいぐるみ,Aili Plushie
庭用チームフラッグ,Team Flag (G)
プラコンスーツ・黒,Black Suit
ユシュカのこころ５,Yushka's Heart Lv. 5
ドット風セラフィ像,Pixel Seraphi Statue
ラッキーキャンディ,Lucky Lollipop
騎神のよろいセット,Knight God Armor Set
ラダトームグローブ,Tantegel Gloves
カーズ・ド・バニー,Cars de Bunny
ディープギアマスク,Deep Gear Mask
サンゴールドの花束,Sungold Bouquet
ドラグーンメイル下,Dragoon Mail Bottom
アスバルのこころ８,Asbal's Heart Lv. 8
ゾディアックコード,Zodiac Code
キラキラねこまどう,Glittering Meowgician
モガリム街道への道,Road to Mogarim Highway
オーガキングの盾扉,Testudogre Shield Door
メガトンブラザーズ,Heavy Metal
ギュッとヒストリカ,Historica Arm Doll
全職さいだいＨＰ+40,Max HP +40
亡き王国に捧げる詩,Ode to a Departed Kingdom
オブジェクト座標012,Object Coordinates 012
ワイルドキャンディ,Wild Lollipop
メギストリスの都駅,Megistris City Station
オブジェクト座標073,Object Coordinates 073
みならいあくま・祖,Ancestor Winkster
フラウススティック,Flaus Wand
魔物管理人ピョンル,Monster Manager Ponel
ドット旅の扉柄ラグ,Travel Door Rug
魔物管理人マビシア,Monster Manager Mabicia
ムーンバニーブレス,Moon Bunny Bracelets
ゴールドマン衣装券,Gold Golem Costume Tkt
ベラストル家の呪符,Belastre Amulet
オブジェクト座標064,Object Coordinates 064
ユシュカのこころ６,Yushka's Heart Lv. 6
アイスダンス衣装券,Ice Dance Outfit Ticket
まじないしローブ上,Fizzle-Proof Shirt
クロスペンデュラム,Cross Pendulum
マタドールスーツ上,Matador Suit Top
童話の街並みの門柱,Fairy-Tale Gatepost
オブジェクト座標047,Object Coordinates 047
星くずの灯ろう・紫,Purple Stardust Lantern
お姫様間仕切り・桃,Pink Princess Partition
エテーネ王宮の鏡台,Ethene Royal Vanity
究極邪教司祭コイン,Ultimate Aamon Coin
オブジェクト座標079,Object Coordinates 079
ドルバイクプリズム,Dol-Bike Prism
プチバラモスカード,Frail Baramos Card
エックス君冒険印章,Mr. X Adventure Stamp
オブジェクト座標198,Object Coordinates 198
いにしえの竜の伝承,Lore of the Ancient Dragon
ゼドラ王国服モブ６,Zedra Royal Clothes Mob 6
いたずらもぐら・強,Vicious Mischievous Mole
花束交換屋ププリン,Bouquet Shop Pupurin
プチゲルニック将軍,Frail Hootingham-Gore
見覚えのあるドレス,Familiar Dress
ゴシック調の食器棚,Gothic Cupboard
小さな英雄グローブ,Little Hero's Gloves
湖の魔獣ボルゲルグ,Lake Beast Volgerg
裏ショコラチケット,Chocolate Ticket Back
盗賊のチュニック上,Thief Tunic
オブジェクト座標019,Object Coordinates 019
音符のチェスト・彩,Color Music Chest
オーガニックサラダ,Ogre-nic Salad
バトルレックスの書,Hacksaurus Book
しぐさ書・お祝い赤,Emote "Celebrate Red"
真・オノむそう・改,Axes of True Evil+
第１回釣りコン・銅,1st Fish Contest Bronze
鋼鉄巨兵のウィング,Steel Giant Wings
オブジェクト座標248,Object Coordinates 248
幻想画「一触即発」,Fantasy Art "Touch and Go"
ウェディプランター,Weddie Planter
ゼドラ王国服モブ５,Zedra Royal Clothes Mob 5
オブジェクト座標142,Object Coordinates 142
第９回ヒューザの像,9th Hyuza Statue
バトルガントレット,Battle Gauntlets
オブジェクト座標111,Object Coordinates 111
残響の海蝕洞への道,Road to Echoing Sea Cave
しぐさ書・みちくさ,Emote "Dawdle"
奇跡の木工刀小の本,Miracle Slick S Book
壁かけＤＱⅠⅩの絵,DQⅨ Painting
魔法使いの服セット,Mage Outfit
光とブレスの防ぎ方,Defend Light and Breath
水没遺跡地区への道,Road to Submerged Ruins
カプサイ神の像・庭,Capsai God Statue (G)
マスカレイドグラブ,Masquerade Gloves
チャージタイム回復,Charge Time Recovery
ビクトリーチケット,Victory Ticket
クモの巣カーペット,Spider Web Carpet
オブジェクト座標128,Object Coordinates 128
冥府より来たるもの,One from the Underworld
古代オルセコの祭壇,Old Orseco Altar
本当にあった降魔術,Art of Demon Conquering
スクアーロの写真３,Squalo's 3rd Photo
警備魔神兵０４５号,Aztech Guard No. 045
メタスラの間仕切り,Metal Slime Partition
ゴブル砂漠西への道,Road to Goble Desert West
きれいなバラのトゲ,Beautiful Rose Thorn
白銀獣ロムドゴーグ,Silver Beast Romdogog
はいくらすいしょう,High Class Outfit
ぷりんすたきしーど,Prince Tuxedo
ゲフェンダイトの袋,Gefendite Sack
ガーディアングラブ,Guardian Gloves
学園女子の夏服上改,Schoolgirl Summer Top 2
時の王者のグローブ,Time Sovereign's Gloves
ガナドールグローブ,Victor Bracers
ハンギングアイビー,Hanging Ivy
マイタウン白亜地区,My Town Chalk District
パンプキャビネット,Pumpkabinet
カイラム村長の手紙,Chief Kairam's Letter
ナルビア民家のラグ,Nalbia House Rug
黄金の飾りよろい下,Gold Ornament Faulds
幻界の四諸侯コイン,Dread Fiends Coin
王宮のチェスト・青,Blue Royal Chest
アリアハングローブ,Aliahan Gloves
コマンダーコート下,Commander Coat Bottom
古代オルセコ闘技場,Old Orseco Arena
フラワースティック,Posey Pole
ファラオ・カーメン,Pharaoh Khamun
占星術師のローブ上,Astrologer Upper Robe
攻撃時10%会心アップ,Critical Up On Attack 10%
バトルステーキ・小,Small Battle Steak
壁かけリソル肖像画,Resol Portrait
マイタウン古代地区,My Town Ancient District
メタスラの大剣の本,Metal Gooreatsword Book
オブジェクト座標134,Object Coordinates 134
プクリポのあいさつ,Pukulipo Greeting
ぷらこんどれすくろ,Black Dress
キャロルコサージュ,Carol Corsage
キャットキャンディ,Cat Lollipop
スライダークスーツ,Nemeslime Suit
キンスラ王冠ランプ,King Slime Crown Lamp
イカしたＴシャツ桃,Pink Cool T-Shirt
死闘！　山奥の秘湯,Fight! Mountain Hot Spring
オブジェクト座標138,Object Coordinates 138
第１１回ファラス像,11th Faras Statue
初級・魔力錬金の本,Beginner Magic Power
クマリスぬいぐるみ,Kumaris Plushie
ウェディのサンダル,Weddie Sandals
ビルダーズブロック,Builders Block
ローラ姫のティアラ,Gwaelin's Tiara
ＭＰ消費しない率+4%,MP Saver +4%
ゴスバニートップス,Goth Bunny Tops
ゼドラ王国服モブ３,Zedra Royal Clothes Mob 3
カントリードレス上,Country Dress Top
カルデア山道の横穴,Chaldea Mountain Road Cave
おおきなリボン水白,Watercolor Ribbon L
黒衣の剣士のブーツ,Dark Swordsman Boots
苺お菓子のキッチン,Berry Sweet Kitchen
プチＳキラーマシン,Frail Trauminator
真・暗殺武器の歴史,True Assassin Weapons
楽将バトルシェイカ,Music General Maracaraider
エンゼルフィッシュ,Angelfish
Ｓキラーマシンの像,Trauminator Statue
マイタウン海辺の村,My Town Seaside Village
壁かけ古びた張り紙,Old Papers Wall Decor
ローラ姫のドレス上,Gwaelin's Dress Top
ごーれむのきぐるみ,Golem Costume
モダンバニーフレア,Modern Bunny Skirt
マタドールシューズ,Matador Shoes
レーナム緑野の木柵,Lenam Fields Wood Fence
レジェンドチケット,Legend Ticket
ユシュカのこころ７,Yushka's Heart Lv. 7
旅に出ると決めた日,The Day I Went on a Trip
壁かけキルギルの絵,Kirgyl Portrait
しぐさ書・ネオン緑,Emote "Neon Green"
りょうりにんぼーら,Chef Bora
魔法のペンプリズム,Magic Pen Prism
オブジェクト座標249,Object Coordinates 249
白雲の烈翼将ヤヌビ,White Cloud General Yanubi
大怪傑の装束セット,Great Wonder Outfit
しぐさ書・ひらめく,Emote "Inspire"
クローバーＴシャツ,Clover T-Shirt
サプライズラッシュ,Bolt from the Blue
