ワイトキングの杖,Wight King's Staff
ラグジュアルリム,Life of Luxury
クロブタカプセル,Black Pig Toy
新エテーネのこて,New Ethene Gauntlets
王軍師のグリーブ,Royal Soldier Greaves
ウルタのコート下,Ulta Coat Bottom
ムニエカの飾り棚,Munieka Display Shelf
ユシュカの便せん,Yushka Paper
えきいんぴけっと,Attendant Piket
ホイミンキャップ,Healie Cap
しぐさ書・ねる３,Sleep 3
王宮のタンス・赤,Red Royal Wardrobe
壁かけ紋章旗・紫,Purple Wall Banner
魔法学園のブーツ,Magic Student Boots
死せる結晶の荒野,Dead Crystal Desert
ワクチンのふくろ,Vaccine Pouch
妖精のトンガリ靴,Fairy Shoes
カミハルムイの柵,Kamiharmui Fence
ポランパンの書状,Poranpan's Letter
哀愁のパン耳伝説,Sorrow Bread Legend
アルゴンズポーチ,Argon Pouch
しょうにんでんな,Merchant Denna
プクリポバスタブ,Pukulipo Bathtub
天使の翼プリズム,Angel Wings Prism
まどうしのぼうし,Wizard's Hat
ジャンボオニオン,Jumbo Onion
景品交換所コルナ,Prize Exchange Koruna
エンゼルハンマー,Angel Hammer
スプリングレザー,Spring Leather
学生のローファー,School Loafers
打ち上げ花火・緑,Green Firework
プリンセスドレス,Princess Dress
預かり所エフォー,Storage Epho
療養地区の移動台,Medical District Platform
アヌビスアタック,Anubis Assault
リドのタリスマン,Lido's Talisman
最後の神話の戦い,The Last Mythical Battle
天界のあるきかた,How to Walk the Heavens
ヤマネコグローブ,Wildcat Gloves
ステラトルネード,Stella Tornado
ファラスパラソル,Faras Umbrella
グリーンエッグ２,Green Egg 2
まほうのよろい下,Magic Armor Bottom
ジア・クト念晶体,Dia Kut telecrystal
はがねの防具図鑑,Steel Armor Book
ガンコ職人の息子,A Stubborn Craftsman's Son
ぐろりあすすーつ,Glorious Suit
ギャルいミュール,Stellar Shoes
バトルシェイカー,Maracaraider
とこなつハッピ上,Summer Top
形見のオルゴール,Keepsake Music Box
ルシェンダの手紙,Lushenda's Letter
人食い火竜コイン,Tatsunaga Coin
大盾サイズの星空,Greatshield Sized Sky
ヘヴィーグリーブ,Heavy Greaves
美容師たちの祭典,Hairdresser Festival
壁かけの鉄格子窓,Iron Grate Window
ガーベラプリズム,Gerbera Prism
おうごんのうでわ,Golden Bracelet
はやぶさの剣の書,Falcon Blade Book
終わりを告げる者,The Doomsayer
しぐさ書・大テレ,Very Shy
古強者のよろい下,Veteran's Faulds
トンブレロ貯金箱,Ham Shamwitch Pig Bank
丸型のトピアリー,Round Topiary
サンダーフロッグ,Zaptile
育成受付係ブレダ,Training Reception Breda
茶トラ猫カプセル,Brown Tabby Toy
源世果フルポティ,Frooty Dracky
壁かけ紋章旗・青,Blue Wall Banner
魔物管理人ツグミ,Monster Manager Tsugumi
紹介人アラーニャ,Introducer Aranya
市松模様のはかま,Checkered Hakama
ナスビナーラの像,Woebergine Statue
らくらくジョウロ,E-Z Watering Can
欲望の邪鬼ゴモル,Demon of Desire Gomoru
ファータドレス下,Fata Dress Bottom
エビルソーサラー,Evil Sorcerer
ステージシューズ,Stage Shoes
しぐさ書・お祝い,Celebrate
フォーマルドレス,Formal Dress
フェルナーの客室,Felner's Guest Room
おしゃれカタログ,Fashion Catalog
魚交換員ポップイ,Fish Exchange Popui
ダークパラディン,Paladead
黒のピアノのイス,Black Piano Seat
キュルルトランプ,Kyururu Cards
ダーマ神殿への道,Path to Alltrades Abbey
スライムマデュラ,Darkonium Slime
ベビーマジシャン,Blinkster
ＦＦＸＩＶ２印章,FF XIV 2 Stamps
誓約の園のアーチ,Arch of the Covenant
ぬかどこスライム,Mouldy Slime
光の神殿・最上層,Temple of Light - Top Floor
ドラキュラスーツ,Dracula Suit
邪神ヴァニタトス,Dark Deity Vanitatos
ジャイラプランツ,Jyra Plant
オスクトルブーツ,Oscutor Boots
スチームスーツ下,Steam Suit Bottom
王宮のベッド・青,Blue Royal Bed
隠密の装束セット,Covert Outfit
ラニアッカ断層帯,Raniakka Fault Zone
エルトナスイセン,Eltona Daffodil
クマチャンブーツ,Beary Cute Boots
クリスタルハンド,Crystal Hand
デスマスの礼服上,Death Master Shirt
魚交換員ピッチョ,Fish Exchange Picho
邪神ヤファギル戒,Yaphagil, the Precept
パラディンガード,Knight Watch
ラウルのグローブ,Rahul's Gloves
よろず屋スワーニ,General Shop Swani
シスター・アシラ,Sister Ashira
タイタス号のタル,Titus Barrel
悪神の心域２印章,Heartlands 2 Stamps
辺境の雪山への道,Road to Snowy Mountain
魔創兵長バスラー,Evil Captain Bassler
お月見のぼんぼり,Moon Viewing Lantern
ユグドラシルの本,Spryggdrasil Book
預かり所ウロック,Storage Ulock
魔因細胞のかけら,Demon Cell Fragment
魔女の長日傘・青,Blue Witch Day Umbrella
あおりんごダリア,Light Green Dahlia
レース屋パマテラ,Race Registrar Pamatera
ピテッザのほら穴,Pitheza Cave
学園男子の夏服改,Schoolboy Summer Wear 2
プレミアムな金箔,Premium Gold Leaf
指先で触れる世界,World at Your Fingertips
花と手紙のセット,Flower and Letter Set
レース屋ミチシオ,Race Registrar Michishio
復活時早詠みの杖,Faster Caster Revival
王家の迷宮の燐光,Royal Maze Phosphor
バズミルクティー,Pazu Milk Tea
よろず屋カトラズ,General Shop Katraz
マスカットの花束,Muscat Bouquet
ディバインロッド,Divine Rod
春の和菓子セット,Japanese Sweets Set
ワープ装置・天獄,Heavenly Hell Warp
ハロウィン衣装券,Halloween Voucher
黒曜のカーペット,Obsidian Carpet
ノクゼリアソード,Noxeria Sword
ホシエイアックス,Stingray Axe
異星からの侵略軍,Alien Invaders
不器用な魔法使い,The Incompetent Mage
イースターアーチ,Easter Arch
水鳥のいる池・庭,Bird Pond (G)
Ⅱ‐ディアノーグ,Ⅱ‐Diamagon
代理人ジェイダー,Agent Jayda
マジェスタハット,Majesta Hat
ヴェリナード領西,Verinard West
ブラックコンドル,Black Buzzard
さんぞくウーパー,Wooper Snooper
五の星獣ウツァト,5th Star Beast Uzato
プロテ豆入り布袋,Bag with Protein Beans
リカバースナック,Recover Snack
ピナヘトのおふだ,Pinahett's Amulet
看板・ビックリ！,Sign - Exclamation!
預かり所トッケロ,Storage Tokkero
三毛太猫カプセル,Fat Calico Cat Toy
遊び人のてぶくろ,Gadabout Gloves
取引商アルトゥナ,Trader Altuna
クリスマスライム,Christmas Slime
ブレイブクリーム,Brave Cream
ルティアナの神気,Lutiana's Divinity
希少な水晶の伝承,Rare Crystal Folklore
ハンマー作り入門,Hopeful Hammer Making
クリュトスの部屋,Krutos' Room
じょうりゅうせき,Distillastone
覇者のローブ・銀,Silver Champ Robe
お詫びの笹だんご,Bamboo Dumplings
シースルーブーツ,See-through Boots
ノクゼリアエッジ,Noxeria Edge
キラキラミミック,Glittering Mimic
ダーティードール,Dirty Doll
ポポラパの最深部,Popolapa Depths
ミニュアデスの盾,Minyades Shield
牡丹文のふりそで,Peony Kimono
クリスマスのソリ,Christmas Sleigh
シスター・ネジュ,Sister Neju
おおとろの切り身,Tuna Belly
キャタピラー・強,Vicious Killerpillar
古き踊り子の伝説,Old Dancer's Legend
ミリオンスマイル,Million Smile
中型の丸い水そう,Round Aquarium M
ドラキーの便せん,Dracky Paper
タキシードうさぎ,Tuxedo Rabbit
合唱隊のニーハイ,Choir Knee-Highs
レシピ屋シャニス,Recipe Shop Chanice
アビサルシャーク,Abyssal Shark
キツネパーカー下,Fox Shorts
ドルタムシールド,Doltam Shield
ゴシック調のイス,Gothic Chair
フライングスノー,Flying Snow
カラフルチケット,Colorful Ticket
ネコ姫のチェスト,Cat Princess Chest
魔人王ドミネウス,Demonic Domineus
ジャンボキャベツ,Jumbo Cabbage
レースの観客１１,Race Spectator 11
木工素材屋ミヅキ,Woodworking Materials Mizuki
氷結らんげき・改,Crushed Ice+
モンスター討伐隊,Monster Strike Force
守護鬼の間への道,Road to Keeper's Chamber
黒鳥のチュチュ下,Blackbird Tutu Bottom
虹色のインゴット,Rainbow Ingot
パレードシューズ,Mardi Garb Shoes
家具＆庭具おきば,furniture storage
魔獣調教士ガブラ,Beast Trainer Gabra
プチムドーカード,Frail Murdaw Card
オオカミアタック,Wolf Whistle
イルーシャの服上,Illusia's Dress Top
フォトライフ・銅,Photo Life Bronze
エルフプランター,Elf Planter
デビパンクブーツ,Devil Punk Boots
原始獣フォドラス,Primitive Beast Fodras
仲間のフウキの証,Member's SCC Emblem
フォトライフ・金,Photo Life Gold
プリーストナイト,Priest Knight
郵便局員モルーゼ,Postman Morusei
ふわふわクリオネ,Floaty Sea Slug
燦滅のノクゼリア,Noxeria the Ruinous
道具屋・レシピ屋,Item/Recipe Shop
賢者セレディーネ,Sage Celedine
オルフェア白色花,White Orphea Flowers
デモンズゲイトＡ,Demon's Gate A
シナイジッチ教頭,Vice Principal Sinazitch
祈願の神殿の金庫,Gratitemple Safe
大きなお菓子の柱,Big Sweets Pillar
天の川のついたて,Milky Way Partition
ステューデントＢ,Student B
六大陸堂の便せん,Six Continents Paper
オーロラカメリア,Aurora Camellia
壁かけ羽子板飾り,Hagoita Wall Decor
第２回トーマの像,2nd Toma Statue
ぶっこみサーベル,Stabby Sabre
おきもの赤キノコ,Red Mushroom Ornament
ひと筆のこだわり,A Single Stroke
初任務はモリナラ,Molinara First Mission
ピコピコハンマー,Honking Hammer
女性金魚のゆかた,Women's Goldfish Yukata
ファラオ・ナジャ,Pharaoh Naja
ＣＭ用ウェディ１,Weddie For CM 1
妖精郷の舞踏服上,Faerie Realm Shirt
キュートクリーム,Cute Cream
レンガの大きい壁,Brick Wall L
モーモンゆず風呂,T. Sanguini Yuza Bath
忍者屋敷の床の間,Ninja House Alcove
ファントムブーツ,Phantom Boots
ファリネのチョコ,Farine's Chocolate
プロディトヘッド,Plaudit Headdress
カボチャ間仕切り,Pumpkin Partition
ホワイトショコラ,White Chocolate
真夜中プリズラン,Midnight Jailrun
海竜ヴォドニーグ,Sea Dragon Vodnig
魔物管理人モモノ,Monster Manager Sanguino
くらげポンポン帽,Jellyfish Pom Pom Hat
トガリアのしずく,Gratite
ナチュラルチェア,Natural Chair
チョコボの像・庭,Chocobo Statue (G)
聖賢者のローブ上,Holy Sage Robe Top
めいふのばんにん,Hellbound Heretic
フォーリオン外郭,Outer Fourion
よろず屋ルキーノ,General Shop Lukino
マッピング計測器,Mapping Instrument
マッドファルコン,Terrorhawk
ボスコイン優待券,Free Boss Coin Coupon
魔人リンジャーラ,Demonic Linjara
討伐隊員ホソバミ,Strike Force Hosobami
ゾーマ　ユウシャ,Zoma, Hero
木造御殿のタイル,Wood Palace Tile
スライム露天風呂,Slime Outdoor Bath
心をつなぐ初仕事,First Job, Connect Minds
ヴァルハラヘルム,Valhalla Helm
キャラメルの花束,Caramel Bouquet
ゆりかごの語り部,Storyteller of the Cradle
レオーネトランプ,Leone Cards
ウルトラ大砲置き,Call Ultra Cannon
たれ灰猫カプセル,Lazy Ash Cat Toy
桜モダンスカート,Cherry Modern Skirt
イオ１０系の写真,Bang 10 Series Photo
ヒストリカチェア,Historica Chair
Ⅲ‐スペーディオ,Ⅲ‐Wulfspade
荷馬車の作業員Ｂ,Wagon Worker B
アメジストの置物,Amethyst Ornament
ヒヨコパーカー下,Chick Shorts
月のサークレット,Moon Circlet
レースの観客２７,Race Spectator 27
バルディスタ弓兵,Valdista Archer
まるこもんせっと,Circle Pattern Set
シーサイドタンス,Seaside Wardrobe
防具屋ペルトラン,Armor Shop Pertran
落陽の草原の木Ａ,Sunset Meadow Tree A
レシピ屋リトリア,Recipe Shop Litoria
ホラーマシンの像,Killed Machine Statue
色見本・やまぶき,Golden Yellow Swatch
プリズンイーグル,Prison Eagle
ズワイガニファン,Snow Crab Fan
ジェントル衣装券,Gentleman's Voucher
グランドネビュラ,Solar Flair
黄金ツボの調度品,Golden Urn Decor
追想の王城・２階,Memory's Castle 2F
戦死者を選ぶもの,Choose Death In Battle
黒岩削り出しの柱,Black Rock Pillar
魔物ソンブレロ券,Sombrero Ticket
三毛猫のグローブ,Calico Cat Gloves
うろこのよろい上,Scale Armor
プチ伝説の三悪魔,Frail Legendary Evils
シャークウェア上,Upper Sharkwear
ブチ太猫カプセル,Fat Spotted Cat Toy
ピクシーシューズ,Pixie Shoes
イシスのブローチ,Isis' Brooch
カイトバックラー,Kite Buckler
ホーリーカロット,Holy Headwear
マーブルヴォルク,Marble Volk
アグラニに潜む影,Shadow Lurking in Agrani
壁かけ掛け軸・夏,Summer Wall Scroll
プラチナハンマー,Platinum Hammer
花華メイドレス上,Flower Maid Top
クライシスマスク,Crisis Facemask
フェアリーバット,Fruity Succubat
星型ランタンの木,Star Lantern Tree
旬の黄金イセエビ,Seasonal Gold Lobster
フェンサーブーツ,Fencing Boots
アトラス強カード,Apex Atlas Card
黒鳥のチュチュ上,Blackbird Tutu Top
コルセアマント下,Corsair Pants
スピンドル兵士長,Captain Spindle
レクタリスの姿絵,Lectalis Portrait
商人たちのテント,Merchants' Tents
堕天使エルギオス,Fallen Angel Corvus
ラーヴァドラゴン,Lava Hydra
スターのイス・青,Blue Star Chair
黒仙翼の羽ばたき,Fairy Wings Flapping
ニードルマンの書,Needleman Book
リトルライバーン,Little Wyvern
つままれスラベス,Pinched She-Slime
ホイミントブーツ,Heal Mint Boots
ほしくずのつるぎ,Stardust Sword
結界の氷殿への道,Road to Ice Barrier Hall
ニンジャカッター,Ninja Cutter
ベージュカメリア,Beige Camellia
うろこのよろい下,Scale Leggings
アリゲーターガー,Alligator Gar
どうぐやはんちゃ,Item Shop Hancha
悪霊の神々コイン,Evil Trinity Coin
脱力系クッション,Relaxing Cushion
アンノウンソード,Unknown Sword
アスバルへの親書,Official Letter to Asbal
スラタワーヘッド,Slime Stack Head
アビスセーラー下,Abyss Bottoms
シュパルトエッジ,Rift Edge
ギュッとヒューザ,Hyuza Arm Doll
東洋風飾り棚・雅,Chic Orient Shelf
ワグミカのソファ,Wagmika's Sofa
ヒュプノスハント,Persecutter
レイダメテス瓦礫,Reidametes Rubble
ヘルビースト・強,Vicious Sculptrice
おばけトマト軍団,Haunted Tomato Army
スマートチェスト,Smart Chest
預かり所ティルダ,Storage Tilda
ピカレスクブーツ,Picaresque Boots
キング釜プリズム,King Pot Prism
ＣＭ用ウェディ４,Weddie For CM 4
赤リボンのリース,Red Ribbon Wreath
荒ぶる王子のオノ,Princely Axe
１段ブロック・赤,Red Block
牙狼のジャケット,Fanged Wolf Jacket
シルバーバングル,Silver Bangles
トライバルブーツ,Tribal Boots
憤怒のイフリート,Deranged Djinn
ロイヤルチャーム,Sovereign Seal
カラミティキング,Calamity King
キィンベルの服上,Kimbel Shirt
ドワチャカオイル,Dwachakka Oil
愛のチョコレート,Affection Chocolate
オルフェアリーズ,Orphearies
氷の魔王のマント,Ice Demon Cloak
闇司祭長ユルイゲ,Yuruige
ザード遺跡の息吹,Breath of Zard Ruins
メルサンディ印章,Melsandy Stamps
ギガンテス便せん,Gigantes Paper
メギラザの洞くつ,Megilaza Cave
ごうかな本棚・緑,Green Fancy Bookshelf
道具屋ズィディリ,Item Shop Zidiri
マッドフィンガー,Muddy Finger
真のレンダーシア,True Lendersia
キュロンイーター,Kyuroneater
ライノソルジャー,Rhinoceraxe
星降りのスカート,Starry Skirt
シスター・ライラ,Sister Lyra
闇の大魔王アーム,Archfiend's Armlets
シスター・マレレ,Sister Marelle
デモンズゲイトＢ,Demon's Gate B
冒険者ゼミナール,Adventurer Seminar
バズカフェのイス,Pazu Cafe Chair
ダイナースカート,Diner Skirt
異界将軍ゴレオン,Goreham-Hogg, the Otherworldly
いきのいいサザエ,Very Fresh Turban Shell
レシピ屋ペリンタ,Recipe Shop Perinta
預かり所ゼーノン,Storage Zenon
１段ブロック・緑,Green Block
パニガルム探査券,Panigalm Explore Ticket
アイアンウィング,Flyin' Iron
アラビアンアーム,Arabian Armguards
ホイップゴースト,Whipped Scream
世界一クイック伝,World's Quickest Legend
チェッカーハット,Checkered Hat
月を手に入れた男,The Man of the Moon
フレンジーの部屋,Frenzy's Room
パペットマン・強,Vicious Magic Marionette
スウィートハイム,Sweet Home
モッズスニーカー,Mod Sneakers
シスター・ミアナ,Sister Miana
へびのおうぎの本,Cobra Fan Book
王宮の食器棚・青,Blue Royal Cupboard
エレメンイエロー,Yellow Glow
シャンテキッチン,Shante Kitchen
師団長のグリーブ,Commander Greaves
プラコン用編み物,Private Concierge Knitting
魔勇者アンルシア,Anlucia, Hero of Evil
センボンウィップ,Blowfish Whip
素材タネ屋ピード,Material Seed Shop Peid
武器防具屋トイム,Weapon & Armor Shop Toimu
あやしいオーブン,Suspicious Oven
メカニックハンド,Mechanic Gloves
ブレイクキャップ,Break Cap
プクラストランプ,Pukulas Deck
スクールブレザー,School Blazer
出張購買員ポレロ,Team Supplier Polero
おもちゃの丸い家,Toy Round House
実行委員リーベル,Executive Committee Ribel
おめかしカラー券,Recolor Ticket
アクセ屋カーメロ,Accessory Shop Karmelo
ほうおうのおうぎ,Phoenix Fan
壁かけ穴モーモン,Teeny Sanguini Hole
フォースシールド,Force Shield
憎悪のダークネス,Darkness of Hatred
ディアナウィング,Diana Wings
暴走したコウリン,Berserk Kourin
帝国三将軍練習札,Triumgorate Tag
ブルームシールド,Bloom Shield
ウェディのパレオ,Weddie Pareo
絆のエンブレム極,Apex Bonding Emblem
カミハルムイ領南,Kamiharmui South
オセアノスの祈り,Full Fathom Prayer
ウルタのバンダナ,Ulta Bandana
ハートのイス・黄,Yellow Heart Chair
あこがれの彼の人,Longing for Someone
凶将バリクナジャ,General Togrus Maximus
ドラキーＴシャツ,Dracky T-Shirt
ケイトのうであて,Kate's Armguards
ウェディングベル,Wedding Bell
レシピ屋トリーナ,Recipe Shop Torina
渡し守アリーモス,Ferryman Alimos
とこしえの語り部,Storyteller of Eternity
第１１回ケイト像,11th Kate Statue
丁目古代都市地区,Block Ancient Suburb
魔物管理人ハズキ,Monster Manager Hazuki
古強者のグリーブ,Veteran's Greaves
アンノウンスピア,Unknown Spear
スマイルリザード,Raptile
ダストントランプ,Duston Cards
初期ドワーフ男性,Initial Dwarf Male
プチキングヒドラ,Frail King Hydra
エテーネのまもり,Ethene Charm
メット無しスーツ,Helmetless Suit
予言者学園学生服,FTA Uniform (M)
ジア燃石生産場１,Diatite Production Plant 1
紫水晶の間仕切り,Amethyst Partition
2013/1月分クエスト,Quest for 2013/01
スカウトアタック,Scout Strike
瑞雲の道服セット,Cloudy Outfit
たいようのおどり,Sun Dance
デスマドモアゼル,Golden Girl
白トラ猫カプセル,White Tabby Toy
トナカイシューズ,Reindeer Boots
しぐさ書・天灯黄,Yellow Lantern
ワンダラー放浪記,Wanderer's Notes
ミルドラースの像,Nimzo Statue
拳聖の道着作成法,Fist Saint Uniform Book
サメきぐるみ・金,Gold Sharksuit
スライムくんたち,Slime monsters
ヴェリナード王国,Verinard Kingdom
クリスモスブロス,Soul of Christmas
デスマスクの破片,Slaughtomask Shard
ハイパーマカロン,Hyper Macaron
三姉妹の馬車・白,Wht. 3 Sisters Carriage
アズラン宿屋の家,Azlan Inn House
たこやきプリズム,Takoyaki Prism
ポポリアきのこ山,Popolia Mushroom Mountain
ハッピークリーム,Happy Cream
ぶたさんの貯金箱,Piggy Bank
インテリローブ上,Scholar's Robe Top
夜に蛍が舞う水辺,Fireflies Waterside
三姉妹のモビール,3 Sisters Mobile
ショコラなぼうし,Chocolate Hat
多勢賞トロフィー,Great Numbers Trophy
目覚めし５つの鍵,Awakening of the 5 Keys
タンクハンバーグ,Tank Hamburger
レプリカ加工ロボ,Replica Processor
乱破の忍び装束上,Spy's Ninja Top
聖域の闘衣セット,Sanctuary Uniform
天魔クァバルナ強,Apex Kukulkannibal
ろうごくドーター,Prison Daughter
アガレスの大紋章,Agares Sigil
マンモスドラキー,Gargantuan Dracky
夢の王国グローブ,Dream Kingdom Gloves
アラビアン衣装券,Arabian Outfit Voucher
烈震竜樹ハダルデ,Quake Dragon Hadalde
ギュッとウリボー,Wild Boar Arm Doll
グレートアックス,Bad Axe
はじめてのルーペ,Beginner's Loupe
ももじゃの像・庭,Platypeach Statue (G)
つかれきったサメ,Lazy Larry
悪しき水の洞くつ,Foulwater Cave
木の葉のよろい上,Foliage Armor Top
ハイキングベレー,Hiking Beret
プチバズズカード,Frail Pazuzu Card
メロンのチェスト,Melon Chest
黒いバラの花びら,Black Rose Petal
魔勇者ぬいぐるみ,Evil Hero Plushie
ブラバニクイーン,Dark Hare
カンフーシューズ,Kung Fu Shoes
自由人のつるはし,Freedom Pickaxe
しぐさ書・ガード,Paladin's Palisade
陶芸設備・庭欠番,Pottery Facility (G)
星石のハルバード,Meteorite Halberd
氷の魔王のブーツ,Ice Demon Boots
滅亡の砂漠への道,Path to Desert of Doom
マーメイドトップ,Mermaid Top
プスゴンステッキ,Pusgon Cane
おうち用青空天井,Blue Sky Ceiling
ユシュカパラソル,Yushka Umbrella
ビジューなビキニ,Bijou Bikini
バトルトリニティ,Battle Trinity
フォーリオンの空,Skies of Fourion
王宮のベンチ・青,Blue Royal Bench
フェリナ姫の部屋,Princess Felina's Room
黒騎士のすねあて,Black Knight Greaves
魔石球のかがやき,Glow of the Magic Stone
ワンピースギフト,One-piece Gift
紫イモのテーブル,Purple Yam Table
メタルモンスター,Metal Monster
しぐさ書・天灯白,White Lantern
モーグリチケット,Moogle Ticket
守護天使のうでわ,Guardian Angel Bands
レースの観客１５,Race Spectator 15
ジア燃石生産場２,Diatite Production Plant 2
ネコミイラ衣装Ⅰ,Cat Mummy Costume Ⅰ
パラディンのくつ,Paladin Shoes
ふわふわエンゼル,Floaty Angel Slime
メタスラスカーフ,Metal Slime Scarf
レシピ屋アルキパ,Recipe Shop Archipa
じんめんじゅ・強,Vicious Treeface
グレートグリーブ,Great Greaves
クラシック風の柱,Classic Pillar
はがねのよろい下,Steel Armor Bottom
道具鍛冶ターバン,Toolsmith's Turban
しんぷあれくせい,Father Alexei
サメきぐるみ・青,Blue Sharksuit
魔物管理人スメメ,Monster Manager Sumeme
防具鍛冶作業着下,Armorsmith's Apron
バルディスタ憲兵,Valdistan Police
パンプキンパンツ,Pumpkin Pants
預かり所トゥーブ,Storage Toube
敵を倒すとためる,Killer Tension
バジリスクの石版,Basilisk Tablet
しぐさ書・決め後,Decisive Pose Rear
星の鍛冶ハンマー,Starry Hammer
レースの観客１２,Race Spectator 12
凶禍のフラウソン,Flauson the Wicked
シルエット・樹木,Silhouette Tree
ネヴァンメイル下,Nemain Mail Bottom
しびれくらげ１０,Man o' War 10
エピソード依頼帳,Episode Request Book
ふわふわネルゲル,Floaty Nergel
サメきぐるみ・黒,Black Sharksuit
常闇のスティック,Everdark Wand
オーラチャーム青,Blue Aura Charm
スチームカッター,Steam Boomerang
酒場主人のブーツ,Tavernkeeper's Boots
まよえるヴぇるて,Lost Verte
エレガントブレス,Elegant Bracelets
銀の錬金ツボの本,Silver Pot Book
グリードイーター,Greed Eater
三姉妹の馬車・青,Blue 3 Sisters Carriage
アスバルのブーツ,Asbal's Boots
便せん屋ヤマブキ,Stationery Shop Yamabuki
案内係ディアマン,Guide Diamond
イクチオサウルス,Ichthyosaurus
王城の悪夢・１階,Nightmare's Castle 1F
スチームスーツ上,Steam Suit Top
記念大王スライム,Commemorative King Slime
まもの使いの服２,Monster Master Suit 2
たいようのおうぎ,Solar Fan
オーフィーヌの海,Orfine Sea
リーネイヤリング,Renee Earrings
足音切り替え検証,Footstep Switching
魔塔紹介人パイク,Tower Introducer Pike
魔天骸オロバドン,Demon Skeleton Orobadon
灰三毛猫カプセル,Ash Calico Cat Toy
神都のオルゴール,Fourion Music Box
雷エフェクト・庭,Lightning Effect (G)
エドアルドのメモ,Eduardo's Note
Ⅲ‐ディアノーグ,Ⅲ‐Diamagon
銀のフライパン小,Silver Frypan S
エンゼルスタッフ,Angel Staff
アンロックコード,Unlock Code
ひまわりプリズム,Sunflower Prism
トモガラのお願い,Tomogara's Request
ダーマ神殿の看板,Alltrades Abbey Sign
便せん屋ヒメウズ,Stationery Shop Himeuzu
聖守護者のおうぎ,Sentinel's Fan
ジュレー島の木Ｃ,Jule Island Tree C
ムーディータンス,Moody Wardrobe
オパールの食器棚,Opal Cupboard
ツイストサイダー,Twist Cider
エメットの手紙２,Emmett's Letter 2
勝てるケンカの本,Winning Fight Book
レースの観客２４,Race Spectator 24
ツボ錬金職人頭巾,Pot Alchemist's Cap
舞い手の服セット,Performer's Outfit
