郵便局員ペープペ,Postman Pepupe
占い師の服セット,Fortune Teller Outfit
ミラクルチケット,Miracle Ticket
サイドヘアリボン,Side Hair Ribbons
ピクシーシューズ,Pixie Shoes
グレモリーの紋章,Gremory Crest
フィネトカ映写機,Finetka Projector
アスフェルド学園,Asfeld Academy
リザードファッツ,Frou-Frou
炎の友情☆ダンス,Fire Friendship☆Dance
スチームモノクル,Steam Monocle
カジノレイド祭り,Casino Raid Festival
春風応援ソックス,Spring Cheer Socks
きせきの釣りざお,Miracle Fishing Rod
しぐさ書・うちわ,Emote "Fan"
ゴクラクギョ・黒,Black Betta
預かり所シーラナ,Storage Shirana
邪神ヤファギル戒,Yaphagil, the Precept
ドラキュラスーツ,Dracula Suit
古びたペンダント,Old Pendant
旬の黄金イセエビ,Seasonal Gold Lobster
アステライト鉱石,Astolyte
アンルシアの写真,Photo of Anlucia
トリットアーチズ,Trit Arches
アグラニに潜む影,Shadow Lurking in Agrani
どうぐやはんちゃ,Item Shop Hancha
スライムチケット,Slime Ticket
ごきげんなぼうし,Happy Hat
オルフェア地方東,Orphea Region East
パティシエの服下,Pastry Chef Bottom
鉄の鍛冶ハンマー,Iron Smith Hammer
シンイのこころ１,Shini's Heart Lv. 1
星空のソファ・青,Blue Starry Sofa
プレミアムな金箔,Premium Gold Leaf
道具鍛冶作業着下,Toolsmith's Apron
アデリーカプセル,Adelie Penguin Toy
ぎょうじゃのこん,Ascetic Rod
ビンのテラリウム,Bottle Terrarium
オーガテーブル小,Ogre Table S
月世界の都への道,Road to The Moon's Capital
セーラスウィップ,Selas Whip
あざやかな笹飾り,Vivid Bamboo Decor
ロリータドレス下,Lolita Dress Bottom
グレン領西への道,Road to Glen West
ファントムマスク,Phantom Mask
マンドラゴラたち,Mandragoras
幸せの花を探して,Look for Lucky Flowers
栄華へのきざはし,Stairway to Splendor
預かり所ティーチ,Storage Tichi
奇門遁甲の式・壱,1st Divination Ceremony
始源の歌姫セット,First Diva's Outfit
表層・ルビン宙橋,Surface - Rubin Bridge
魚交換員プルンパ,Fish Exchange Purunpa
封印の守り手たち,Seal Guardians
銀河のツボ錬金書,Galaxy Pot Alchemy Book
景品交換所シリン,Prize Exchange Shirin
中枢へ向かう通路,Passage to Core
白ヒゲのサンタ服,White Beard Santa Suit
アルゴングレート,Great Argon Lizard
七夕のさいほう針,Festival Sew Needle
漂流者キュレクス,Castaway Kyurex
ルベランアックス,Ruberan Axe
絆のエンブレム極,Apex Bonding Emblem
郵便局員ウイロウ,Postman Willow
名探偵のコート下,Sleuth's Coat Bottom
おとぎの森ボレロ,Fairy Forest Bolero
道具屋チャーロン,Item Shop Charon
ジュレー島の木Ｃ,Jule Island Tree C
めんこ屋チャガン,Pogs Shop Chagan
ミランのスケッチ,Milan's Sketch
ホイミントブーツ,Heal Mint Boots
エルダードラゴン,Elder Dragon
ブレスクラッシュ,Breathtaking Bash
便せん屋マツリカ,Stationery Shop Matsurika
ネオン・メーター,Neon Meter
バルディスタ槍兵,Valdista Spearman
リトライストーン,Retry Stone
奇跡のさいほう針,Miracle Sew Needle
ゴールドデーモン,Gold Daemon
ラピッドステッキ,Rapid Stick
ベージュカメリア,Beige Camellia
タホドラキー・祖,Ancestor Drackmage
渡し守スーティー,Ferryman Sutei
荷馬車の作業員Ａ,Wagon Worker A
オーガテーブル大,Ogre Table L
ポイポイ商会倉庫,Poi Poi Company Storage
ときのすいしょう,Chronocrystal
道具屋リーフィヤ,Item Shop Leafia
闇雷竜のまなざし,Dark Thundragon's Gaze
エトワールブーツ,Etoile Boots
マーメイドチェア,Mermaid Chair
モグラのエリート,Murderous Mole
お花とネコの物語,Flowers and Cats Story
パイソンウィップ,Python Whip
ハンマー作り入門,Hopeful Hammer Making
天使の翼プリズム,Angel Wings Prism
ぷりんせすどれす,Princess Dress
最果ての地下遺跡,Deepest Depths
黒レザーのタンス,Black Leather Wardrobe
（だいじなもの）, (Key Item)
めろでぃあせっと,Melody Outfit
道具鍛冶作業着上,Toolsmith's Vest
文官レジドの手記,Resid's Note
実行委員エルスカ,Executive Committee Elska
住宅素材屋テラナ,Housing Materials Terrana
しぐさ書・つまむ,Emote "Picked Up"
うごめくモノたち,Wiggling Things
スライムの便せん,Slime Paper
ミラクルボックス,Miracle Box
道具鍛冶サンダル,Toolsmith's Sandals
血潮の浜辺への道,Road to Bloody Beach
アンノウンワンド,Unknown Staff
灰三毛猫カプセル,Ash Calico Cat Toy
攻撃時25%でルカニ,Sap Attack 25%
ヴェリナード領西,Verinard West
スウィートバッグ,Bag o' Sweets
オーナーの館１階,Owner's Mansion 1F
ロリータシューズ,Lolita Shoes
赤宝箱のチェスト,Red Treasure Chest
ボーンバット・強,Vicious Bone Bat
ロボとサジェの畑,Robot Sajay Field
カレイドスコープ,Kaleidoscope
立派なレンガの壁,Fine Brick Wall
ミラーアーマー下,Mirror Armor Bottom
預かり所エディス,Storage Edith
１段ブロック・青,Blue Block
トランプスカート,Tycoon Skirt
額のしずくシール,Forehead Drop Sticker
しびれくらげ１０,Man o' War 10
ラブリーチケット,Lovely Ticket
ネタ「究極呪文」,Ultimate Spell Trick
さいほう職人の魂,Sewer's Soul
ビッグブレードⅡ,Broader Sword
おしゃれなベルト,Bling-Bling Belt
じゃんけんチョキ,Scissors
ひつじのてぶくろ,Sheep Mitts
グランゼドーラ兵,Gran Zedora Soldier
フラウスハンマー,Flaus Hammer
プラチナメイル上,Platinum Mail Top
ヴァイパーコート,Viper Coat
ピクニックカミル,Kamil Picnic
敵を倒すとためる,Tension On Enemy Defeat
なげくカンナさん,Grieving Master Kanna
よろい兵士の置物,Armor Soldier Ornament
とうぞくぼんがす,Thief Bongas
ミリオンスマイル,Million Smile
やみのしょくだい,Sconstrosity
情熱のガナドール,Passionate Victor
ウルタのグローブ,Ulta Gloves
トレジャーブーツ,Treasure Boots
育みの大地への道,Road to Nurturing Land
プクリポ研究者１,Pukulipo Researcher 1
ごうかな本棚・緑,Green Fancy Bookshelf
おシャケなポーチ,Fishionable Pouch
レースの観客２３,Race Spectator 23
むげんの弓の物語,Purblind Bow Story
シュメリアの写真,Photo of Sumeria
クオードのコート,Quard's Coat
ウィキッドヘルム,Wicked Helm
ウルタのコート上,Ulta Coat Top
赤組のたいそう着,Red Team Track Suit
預かり所トッゴイ,Storage Togoi
パラディンガード,Knight Watch
プラチナグリーブ,Platinum Greaves
カミルのローブ下,Kamil's Robe Bottom
紫水晶の間仕切り,Amethyst Partition
カルベロビュート,Wizardly Whip
ドラゴンステップ,Dragon Step
木の葉よろい全集,Foliage Armor Book
メタキンチケット,Metal King Ticket
ふわふわサンダル,Fluffy Sandals
ギルド移籍許可証,Guild Transfer Permit
天の川のついたて,Milky Way Partition
クリーミーカカオ,Creamy Cacao
クイーンのカード,Queen Card
うろこのよろい下,Scale Armor Bottom
ふるぼけたタライ,Underpants Dance
ファラスのズボン,Faras' Pants
キャロル姫ブーツ,Carol Boots
便せん屋ウツセミ,Stationery Shop Utsusemi
ふういんのダンス,Dance of Sealing
ホシエイアックス,Stingray Axe
しょうにんぼった,Merchant Botta
ブレイクスケボー,Break Skateboard
究明者のグローブ,Research Gloves
プスゴンのおたま,Pusgon Ladle
キラーマジンガ強,Apex Uberkilling Machine
メタルブラザーズ,Metal Medley
ステューデントＢ,Student B
ファラオ・ニビス,Pharaoh Nibis
フォースシールド,Force Shield
栄光に隠された闇,Darkness Hidden in Glory
メタスラのタンス,Metal Slime Wardrobe
アサシンコート上,Assassin Coat Top
マジェスタブーツ,Majesta Boots
しびれくらげ２１,Man o' War 21
ロベールの家の鍵,Robere's Housekey
魔天士ダンタール,Sky Sorcerer Dantal
大魔獣イーギュア,Giga Rapscallion
案内係エリーシェ,Guide Elishe
しびれくらげ２４,Man o' War 24
預かり所ボラデュ,Storage Boradu
学園の教室の教壇,School Classroom Podium
バズッチャイーナ,Pazuccina
中型の和風水そう,Japanese Aquarium M
郵便局員カンココ,Postman Kancoco
ベビタングローブ,Imp Gloves
ヒヨコパーカー上,Chick Hoodie
覇者のローブ・金,Gold Champ Robe
禁書の守護者・左,Left Banned Book Guard
トトゴンカプセル,Totogon Toy
コバルト池のカギ,Cobalt Pond Key
雪だるまのドーム,Snowman Snow Globe
芯層・ルビン宙橋,Core - Rubin Bridge
ドラゴンシールド,Dragon Shield
武器屋リュウトウ,Weapon Shop Ryuto
ダフィアのお守り,Daphea's Amulet
スマートテーブル,Smart Table
ウイングタイガー,Missing Lynx
アラハギーロ城内,Al-Ahagiro Castle
三闘キノコの胞子,Funguy Spores
じごくのおくり火,Lava Lampling
りゅうおうワンド,Dragonlord Wand
竜王のツメの伝説,Dragonlord Claws Legend
シスター・リリン,Sister Lilin
カルサドラの風穴,Calsadora Wind Cave
パッショントップ,Passion Top
苺お菓子のベッド,Berry Sweet Bed
ゴシックコート上,Gothic Coat Top
レースの観客１４,Race Spectator 14
スウィートビキニ,Sweet Bikini
スライムウィップ,Slime Whip
パンドラボックス,Pandora's Box
におうだちの心得,Forbearance Knowledge
天ツ風の原への道,Road to Howling Highlands
イルーシャの部屋,Irusha's Room
自由人のつるはし,Freedom Pickaxe
いきのいいサザエ,Very Fresh Turban Shell
ベリアルカプセル,Belial Toy
クッキングデビル,Cooking Devil
口調の書・能天気,Tone Book - Easygoing
マザー・リオーネ,Mother Lione
カボチャステッキ,Pumpkin Stick
オルフェア住宅村,Orphea Residences
夢色ショーケース,Dreamy Showcase
取引商ディーリア,Trader Delia
ヘルガーディアン,Hell's Gatekeeper
エテーネルスープ,Ethenel Soup
しっくごすせっと,Chic Goth Outfit
手編みのマフラー,Hand-Knit Scarf
ゴシックビスチェ,Gothic Bustier
魔の試練・第３層,Demon Trials - Level 3
防衛軍の制服・緑,Green Defense Force Suit
フラワーサンダル,Flower Sandals
アルミラージの像,Spiked Hare Statue
第１０回ラウル像,10th Raul Statue
トポルの村への道,Road to Topol Village
タロットテーブル,Tarot Table
竜族の里のベッド,Nadravian's Rest Bed
お祝いシャワー緑,Celebration (Green)
輝天のスティック,Sky Wand
グランゼドーラ駅,Gran Zedora Station
勝てるケンカの本,Winning Fight Book
黄昏の詩人の楽譜,Twilight Poet's Score
冒険スタンプ印章,Adventure Stamp
便せん屋ウィット,Stationery Shop Uito
プラコン用のイス,Private Concierge Chair
パピリオボトムス,Papilio Bottoms
木造御殿のタイル,Wood Palace Tile
たれ黒猫カプセル,Lazy Black Cat Toy
天命のつるぎの書,Sword of Judgment Book
リードシクティス,Leedsichthys
モンスターシール,Monster Sticker
メロディアセット,Melody Outfit
ワイルドシューズ,Wild Shoes
シスター・リィト,Sister Lito
にじいろの色鉛筆,Rainbow Colored Pencil
魔物管理人テナナ,Monster Manager Tenana
かんおけプリズム,Coffin Prism
パニックキャノン,Gone Ballistic
ワルド水源への道,Road to Wald Headwaters
カーニバルマスク,Carnival Mask
しぐさ書・ケーキ,Emote "Cake"
セラフィトランプ,Seraphi Cards
キィンベルの服下,Kimbel Pants
キラーなピッケル,Maniacal Mole Pickaxe
七夕・雨斬りの書,Festival Rain Slayer
ラガのタリスマン,Raga's Talisman
白木のカウンタ小,Plain Counter S
ごうかなイス・緑,Green Fancy Chair
魚交換員パラポン,Fish Exchange Parapon
まほうのよろい上,Magic Armor Top
素材タネ屋ピード,Material Seed Shop Peid
イシスのブローチ,Isis' Brooch
ほうおうのおうぎ,Phoenix Fan
素材屋ジョスリン,Material Shop Joslyn
アンノウンロッド,Unknown Rod
黒猫のスウェット,Black Cat Sweatshirt
シスター・ララニ,Sister Rarani
ゴスバニーブレス,Goth Bunny Bracelets
ほっとイヤーマフ,Soft Earmuffs
グレイトドラゴン,Great Dragon
ダークネビュラス,Dark Nebulus
暗黒の魔人カード,Ruin Card
たこやきプリズム,Takoyaki Prism
レビュールマリー,Reviewle Marie
クマチャンミトン,Beary Cute Mittens
帽子係アンジュー,Hat Clerk Anju
クリスマスライム,Christmas Slime
ツンドラハンマー,Tundra Hammer
ピナヘトのおふだ,Pinahett's Amulet
武器屋ニョッププ,Weapon Shop Nyopup
壁かけ武器セット,Weapon Wall Set
ベルトロトランプ,Bertro Cards
スチームスーツ下,Steam Suit Bottom
ほのおのグリーブ,Flame Greaves
オーフィーヌ海底,Orfine Seabed
プラコンナスビ服,Woebergine Costume
神光放つムチの書,Holy Light Whip Book
ルビン宙橋への扉,Door to Rubin Bridge
キラークリムゾン,Crimson Killing Machine
エドアルドの木槌,Eduardo's Mallet
ギャルいミュール,Stellar Shoes
ファータシューズ,Fata Shoes
レジェンズガード,Legends Guard
アトリエ地下１階,Studio B1F
オアシスの隊商宿,Oasis Caravan
へいしうぃりあむ,Soldier William
壁かけ魔勇者の絵,Evil Hero Portrait
ふしぎなボレロ下,Glombolero Bottom
暴君バサグランデ,Tyrant Bogan
ウルベア魔神兵強,Apex Urbea Aztech
蒼天のソウラ印章,Souten no Soura Stamp
スライムマデュラ,Darkonium Slime
魔物管理人ジラー,Monster Manager Jira
ミラクルブースト,Hurt Converter
スライムベス帽子,She-Slime Hat
星夜のローファー,Starry Night Loafers
アクロニウム鉱石,Acronium Ore
バトマスグローブ,Battlemaster Gloves
青天竜バルケロス,Azure Dragon Barkelos
怨霊の憑いた戦士,Warrior With a Grudge
有翼人のサンダル,Winged One's Sandals
メロディアハット,Melody Hat
超鍛冶ハンマー小,Super Smith Hammer S
カラス神楽の羽根,Crow Dance Feather
モーニングスター,Morning Star
スライムの木の壁,Slime Wood Wall
祈願の神殿のラグ,Gratitemple Rug
パレードシューズ,Mardi Garb Shoes
限定交換屋ポタン,Limited Exchange Shop Potan
シスター・ミアナ,Sister Miana
ファラオ・ゴレム,Pharaoh Golem
プリズニャン・強,Vicious Jailcat
天宮騎士のかぶと,Sky Knight Helmet
あやしいかげ・強,Vicious Shade
スパイクグローブ,Spike Gloves
預かり所ニノヤズ,Storage Ninoyazu
バブリン印の丸薬,Zepling Marked Pill
帝国三将軍練習札,Triumgorate Tag
ギガデンデロベー,Giga Dendelobe
モンスター討伐隊,Monster Strike Force
ポイズンカメリア,Poison Camellia
狂想鬼メルジオル,Mad Ghost Merjol
たたきモグラの像,Mashing Mole Statue
ジャイラジャイラ,Jyra Jyra
ルティショー像茶,Tea Astolti Short St.
赤バラのテーブル,Red Rose Table
桜花のドレッサー,Cherry Blossom Vanity
レシピ屋レズリー,Recipe Shop Leslie
ラズバーンの怨霊,Razburn's Ghost
中層・ルビン宙橋,Middle - Rubin Bridge
学園男子の夏服改,Schoolboy Summer Wear 2
防砂ダム・展望台,Sand Dam Observatory
レースの観客１２,Race Spectator 12
スタンカのハンコ,Stanka's Stamp
ドラグーンランス,Dragoon Lance
王宮のタンス・青,Blue Royal Wardrobe
若き彫刻家の才能,Young Sculptor's Talent
メルヘンクリーム,Fairy-tale Cream
レオーネトランプ,Leone Cards
おそうじ童子の像,Sweepy Samurai Statue
プクリポ風アーチ,Pukulipo-Style Arch
無垢なる勇者の剣,Innocent Hero's Sword
ナドラダイト鉱石,Nadradite
クマチャンブーツ,Beary Cute Boots
フリーズウィップ,Malevolash
預かり所ぺイジー,Storage Peiji
シルエット・記号,Silhouette Sign
マジカル姫ぞうり,Magical Sandals
レンドアのベッド,Lendor Bed
凶拳暴鬼ダルカス,Darkfist
カテドラルローブ,Cathedral Robe
ガートラント兵３,Gartlant Soldier 3
フォースブレード,Force Blade
ましょううおたち,Salamanglers
くらやみハーピー,Succubat
お姫様ベッド・桃,Pink Princess Bed
兵士の荷物ぶくろ,Soldier's Luggage Bag
ピテッザのほら穴,Pitheza Cave
ファラスパラソル,Faras Umbrella
まっちゃガーベラ,Matcha Gerbera
シーサイドベッド,Seaside Bed
デスマスの礼服上,Death Master Shirt
マカイ・マカロン,Demon World Macarons
フサフサの白ヒゲ,Fluffy White Mustache
攻撃時10%でためる,Tension Attack 10%
ライトスティック,Light Stick
ドラキュラの衣装,Dracula Costume
ゴローさんリボン,Goro Ribbon
ニンジャカッター,Ninja Cutter
あるある川柳・銅,Haiku Bronze
おばけキャンドル,Wax Murderer
キツネパーカー下,Fox Shorts
しぐさ書・自撮り,Emote "Selfie"
水のサークレット,Flowing Circlet
エレガントドレス,Elegant Dress
がうがうグローブ,Bow-Wow Gloves
よろず屋ヤップイ,General Shop Yapui
ブレイブクリーム,Brave Cream
天馬ファルシオン,Falchion
サンタのてぶくろ,Santa Mitts
レースの観客０５,Race Spectator 05
バトルチョーカー,Dogged Collar
野いちごブラウス,Wild Strawberry Blouse
シンプルシューズ,Simple Shoes
プリズニャンの書,Jailcat Book
コーラルディモス,Coral Dimos
行動時10%で血吸い,Siphon On Action 10%
調理職人コック帽,Cook's Hat
セラフィＴシャツ,Seraphi T-Shirt
ギュッとルコリア,Lucolia Arm Doll
メレアーデの部屋,Mereade's Room
黒曜のテーブル大,Obsidian Table L
どうぐやえいなる,Item Shop Einar
謎の大巨人の写真,Mystery Giant Photo
ほのおのよろい下,Flame Armor Bottom
ウェルカムハウス,Welcome House
大地の箱舟　１幕,Ark of the Earth Act 1
封じられた洞くつ,Sealed Cave
マーブルシュガー,Marble Sugar
総主教オルストフ,Patriarch Orstov
おおみみずの化石,Wiggly Fossil
過去からの贈り物,Gift From the Past
ゲッチュ君の写真,Your Getchu Photo
整備士のてぶくろ,Technician's Gloves
苺お菓子のベンチ,Berry Sweet Bench
白鳥の弓の作り方,How to Make a Swan Bow
保育地区ペコリア,Nursery Area Pekoria
ユーライザのメモ,Yuliza's Note
口調の書・オレ様,Tone Book - Tsundere
新兵支給てぶくろ,Recruit Gloves
シャインステッキ,Shine Stick
東洋風チェア・雅,Chic Orient Chair
ザンクローネの本,Zankrone's Book
めっとなしすーつ,Helmetless Suit
妖精のトンガリ靴,Fairy Shoes
ケラコーナ原生林,Keracona Wild Forest
グレープジュース,Grape Juice
オーディーンボウ,Odin's Bow
おうごんのかけら,Gold Nuglet
獄水鬼ヴァーテル,Waterkeeper Vater
壁かけ四季の丸窓,4 Seasons Round Window
スチーム本棚・赤,Red Steam Bookshelf
アイドルスーツ下,Idol Pants
リィンのグローブ,Lynn's Gloves
ダーマ神殿への扉,Door to Alltrades Abbey
ゴシックグローブ,Gothic Gloves
ぱてぃきょうだい,Sibling Patti
勇者姫のウィッグ,Hero Princess Wig
地獄のミサワ印章,Misawa of Hell Stamp
いっぱつのズボン,One Shot Pants
魔勇者ぬいぐるみ,Evil Hero Plushie
コッケンの乗る棒,Kokken's Riding Crop
ぷちスラキャップ,Small Slime Cap
預かり所ペコリア,Storage Pekoria
しぐさ書・盆踊り,Emote "Bon Dance"
月見の縁台セット,Moon Viewing Bench Set
エンゼルスライム,Angel Slime
ブラッディ・ゼア,Bloody Zea
メレアーデの資料,Mereade's Documents
ナイトフィーバー,Night Fever
知の試練・第３層,Wisdom Trials - Level 3
懐かしのゲーム機,Nostalgic Game Console
闇攻撃ダメージ+5%,Dark Attack Damage +5%
DQ3賢者男　ゾーマ,DQ3 Sage (M), Zoma
みつあみエクステ,Braid Extension
花模様の光るラグ,Floral Glowing Rug
サイクロンダンス,Cyclone Dance
ヘヴィーグリーブ,Heavy Greaves
深い森の邸宅の床,Forest Manor Floor
ガズバラン神の像,God Gazbalan Statue
万物を教え導く者,He Who Teach and Guides
セレニティワンド,Staff of Serenity
スチームチェスト,Steam Chest
アイドルスーツ上,Idol Shirt
５００年前の地図,Map of 500 Years Ago
必殺チャージ率+1%,Special Charge Rate +1%
黒岩削り出しの柱,Black Rock Pillar
強化屋スコルピィ,Boost Shop Scorpi
ゴレオン将軍の像,Goreham-Hogg Statue
スチームハンマー,Steam Hammer
プリプリぎんなん,Plump Gingko Nut
手作りのロザリオ,Handmade Rosary
水の領界のガゼボ,Water Realm Gazebo
聖使者キルパッポ,Holy Messenger Kilpappo
シーサイドタンス,Seaside Wardrobe
ギュッとアイゼル,Eisel Arm Doll
中腹への道　出口,Path to Halfway Exit
レジェンズワンド,Legends Staff
おばけトマト軍団,Haunted Tomato Army
ネコ姫の間仕切り,Cat Princess Partition
ハイキングブーツ,Hiking Boots
すごろく魔法使い,Sugoroku Mage
絆のエンブレム改,Uber Bonding Emblem
しびれくらげ２５,Man o' War 25
おしえてデーモン,Tell Me, Demon
美容師のプライド,Hairdresser's Pride
白バラのチェスト,White Rose Chest
大賢者のグローブ,Supreme Sage's Gloves
東洋風ランプ・雅,Chic Orient Hung Lamp
森の井戸の地下洞,Underground Forest Well
ボスコイン無料券,Free Boss Coin Ticket
トポルのロウソク,Topol Candles
ハッピークッキー,Happy Cookies
ステンドシールド,Stained Glass Shield
ピリからペッパー,Hot Stuff
銅の鍛冶ハンマー,Copper Smith Hammer
レインコートの像,Raincoat Statue
紫獅鬼バイロゼオ,Byrozeo, the Purple Lion
童話ゆうわくの弓,Fuddle Bow Fairy Tale
クリスタルゲージ,Crystal Gauge
イオ１０系の写真,Bang 10 Series Photo
折れたはがねの剣,Broken Steel Sword
聖騎士のやりの書,Paladin's Lance Book
アンドレアルの像,Rashaverak Statue
姫君のブーメラン,Princess' Boomerang
デスマスターの証,Proof of DTH
家具＆庭具おきば,furniture storage
脱力系クッション,Weak Cushion
バラモスゾンビ闘,Bones of Baramos
ソーサリーリング,Sorcerer's Ring
メカニックフード,Mechanic Hood
案内係ペリュイヌ,Guide Peruine
クローバーハット,Clover Hat
緑の巨人グリモア,Green Giant Greemor
カンフードレス上,Kung Fu Dress Top
預かり所ラヴィア,Storage Lavia
オパールのベンチ,Opal Bench
チョコボの像・庭,Chocobo Statue (G)
石だたみ柄のラグ,Cobblestone Pattern Rug
ふわふわホホジロ,Fluffy Shark
しびれくらげ２０,Man o' War 20
遊び人のてぶくろ,Gadabout Gloves
破戒のタリスマン,Sin Talisman
悪しき水の洞くつ,Foul Water Cave
吊るしテラリウム,Hanging Terrarium
ひまわりプリズム,Sunflower Prism
魔物管理人メリュ,Monster Manager Meryu
ドラゴン花火・緑,Green Dragon Firework
オルセコ王家の墓,Orseco Royal Tomb
大型の球体水そう,Spherical Aquarium L
ギュッとセラフィ,Seraphi Arm Doll
学園ゴシップ新聞,Academy Gossip News
スライムモビール,Slime Mobile
タータンドレス上,Tartan Dress Top
スライムの石の壁,Slime Stone Wall
きのこ村のぼうし,Shroom Village Hat
ウェナベリーの枝,Wenaberry Branch
アンノウンサイズ,Unknown Scythe
あこがれの彼の人,Longing for Someone
ぬいぐるみ屋ウー,Plushie Shop Woo
毒竜討伐隊の記録,Serpentscale Skean Book
アシッドテンプル,Acid Temple
マリン調の食器棚,Marine Cupboard
ヴァース山林地帯,Verse Mountain Forest Area
アスバルトランプ,Asbal Cards
お寿司スライム帽,Sushi Slime Hat
魔天賊ボティたち,Sky Bandit Boti and co.
魔衛隊士のかぶと,Demon Guard Helmet
ぷるぷるスラピー,Wobbling Slurpy
マリーンの金剛棒,Malynn's Diamond Rod
エドアルドの部屋,Eduardo's Room
マーメイドハープ,Lorelei's Harp
Ⅲ‐ディアノーグ,Ⅲ‐Diamagon
エビルキュビズム,Evil Cubism
辺境警備隊兵士Ａ,Frontier Guard Soldier A
魔物商人デイラー,Monster Merchant Dailer
アイアンウィング,Flyin' Iron
グランゼドーラ領,Gran Zedora Territory
シスター・ルルア,Sister Lulua
証人ラディスオー,Keen Ladis
茶ブチ猫カプセル,Tea Spotted Cat Toy
ワイトキングの杖,Wight King's Staff
３０分キャンドル,30 Minute Candle
ナチュラルチェア,Natural Chair
アンタッチャブル,Untouchable
くさりのはちがね,Chain Headgear
はがねのグリーブ,Steel Greaves
しぐさ書・バトル,Emote "Battle"
見覚えのある人間,Familiar Human
清涼スイムワンピ,Cool Swim Dress
先王ゾルトグリン,Former King Zoltgrin
プロミネンス着弾,Prominence Impact
レビュール街道北,Reviewle Highway North
桜蝶鬼メイガたち,Meiga, the Pink Butterfly and co.
三毛太猫カプセル,Fat Calico Cat Toy
さびたペンダント,Rusty Pendant
先制攻撃率アップ,First Strike Rate Up
どうぐやまろっく,Item Shop Maroc
玉ネギのチェスト,Onion Chest
銀の木工刀小の本,Silver Slick S Book
キューティココア,Cutie Cocoa
アークデーモンＢ,Archdemon B
若者の家ペコリア,Youth House Pekoria
アリゲーターガー,Alligator Gar
ネネットの日記帳,Nenette's Diary
強者賞トロフィー,Strongman Trophy
プクリポ研究者２,Pukulipo Researcher 2
ドゥラ院長のメモ,Director Dura's Note
