アルファ用アルウェ王妃の別荘跡(子供たちの隠れ家内部Test),Queen Alwe's Villa Ruins for Alpha (Test Inside Children's Hideout)
バトル班用テストマップ（いにしえのゼルメア）,Team Battle Map Test (Ancient Zelmea)
どらごんくえすとえいとしゅじんこうのいしょう,DQⅧ Hero Costume
このマップは モンスターから逃げられません。,You can't run from monsters on this map.
マッチングテストステージ（同期後移動用）,Match test stage (for moving beat testing)
　　　～モンスター討伐隊隊員からの依頼～,         Monster Strike Force Request
マッチングテストステージ（同期テスト用）,Match test stage (for sync testing)
グランゼドーラ領-グランゼドーラ王国 入口,Gran Zedora Territory - Gran Zedora Kingdom Entry
リャナ荒涼地帯-ねじれたる異形の大地 入口,Lyana Desolate - Twisted Terrane Entry
必殺チャージ時 バイキルトとピオラ2段階,Oomphle & Accelerate x2 On Special
メルサンディ穀倉帯-こもれびの広場 入口,Melsandy Millfields - Sunbeam Square Entry
アラハギーロ地方-モンスター格闘場 入口,Al-Ahagiro Region - Monster Arena Entry
メルサンディ穀倉帯-さびれたほこら 入口,Melsandy Millfields - Deserted Shrine Entry
メルサンディ穀倉帯-メルサンディ村 入口,Melsandy Millfields - Melsandy Village Entry
アラハギーロ地方-アラハギーロ王国 入口,Al-Ahagiro Region - Kingdom of Al-Ahagiro Entry
こうげき力上昇時 特技のダメージ +20<ban>,Skill Dmg. +20 When Attack ↑ (PvP×)
バトル班用テストマップ（ムスト廃墟）,Team Battle Map Test (Musuto Ruins)
ぷらこんだんせいようそくたいむらさき,Purple Ceremony Gown
季節イベント「オ月見」　コンパニオン,Seasonal Event "Moon View" Companion
季節イベント「お月見」　コンパニオン,Seasonal Event "Moon View" Companion
メルサンディ穀倉帯-メルン水車郷 入口,Melsandy Millfields - Melun Watermill Entry
アラハギーロ地方-ムルードの岩山 入口,Al-Ahagiro Region - Murudo Mountain Entry
アラハギーロ地方-日除けのほら穴 入口,Al-Ahagiro Region - Sunshade Cave Entry
ぷらこんすくーるせいふくおんなこん,Blue School Uniform (F)
ぷらこんすくーるせいふくおとこくろ,Black School Uniform (M)
ぷらこんすくーるせいふくおとこちゃ,Brown School Uniform (M)
ルファ神殿エントランス（オープン）,Rufa Temple - Entry (Open)
ぷらこんすくーるせいふくおんなちゃ,Brown School Uniform (F)
ぷらこんすくーるせいふくおんなくろ,Black School Uniform (F)
ぷらこんすくーるせいふくおとこあか,Red School Uniform (M)
ぷらこんすくーるせいふくおとこしろ,White School Uniform (M)
ぷらこんすくーるせいふくおとここん,Blue School Uniform (M)
ぷらこんだんせいようそくたいみどり,Green Ceremony Gown
しかし　持ち物が　いっぱいだった！,But you're carrying too many things!
ぷらこんすくーるせいふくおんなしろ,White School Uniform (F)
神代過ぎ～　春の桜よ　無為に咲く～,Past ages divine, the spring blossoms bloom, waiting idly by...
受けた属性ダメージの 10%ＨＰ回復<ban>,10% Attribute Damage Taken As HP (PvP×)
ぷらこんすくーるせいふくおんなあか,Red School Uniform (F)
リャナ荒涼地帯-ソーラリア峡谷 入口,Lyana Desolate - Solaria Canyon Entry
コニウェア平原-ココラタの浜辺 入口,Coniware Plain - Cocolata Beach Entry
アルファ用井戸(ダンダダ団のアジト),Well for Alpha (Robbin' 'Ood Gang HQ)
バトル班用テストマップ(ツスクル）,Team Battle Map Test (Tsuskuru)
ぷらこんだんせいしのびのふくちゃ,Tea Men's Ninja Suit
エフェクトイメージさん（１０個）,Mr. Effect Image (10)
じょせいぷらこんふくあいすぶるー,Ice Blue Clothes (F)
ぷらこんじょせいしのびのふくあか,Red Women's Ninja Suit
ぷらこんじょせいようみどりさんた,Green Women's Santa Suit
あすふぇるどがくえんがくせいふく,Asfeld Academy Uniform
じょせいぷらこんふくみっどないと,Midnight Clothes (F)
だんせいぷらこんふくみっどないと,Midnight Clothes (M)
ぷらこんだんせいようそくたいちゃ,Tea Ceremony Gown
ぷらこんじょせいしのびのふくくろ,Black Women's Ninja Suit
ぷらこんじょせいむらさきふりそで,Purple Women's Kimono
バトル班用テストマップ（獅子門）,Team Battle Map Test (Lion Gate)
ぷらこんだんせいしのびのふくあお,Blue Men's Ninja Suit
ぷらこんだんせいようそくたいあお,Blue Ceremony Gown
プンスコのテーブル＆ティーセット,Punsuko's Table & Tea Set
ぷらこんだんせいしのびのふくくろ,Black Men's Ninja Suit
ぷらこんじょせいしのびのふくこん,Navy Women's Ninja Suit
ぷらこんだんせいようみどりさんた,Green Men's Santa Suit
だんせいぷらこんふくみすとぐれー,Mist Gray Clothes (M)
ぷらこんじょせいみこふくむらさき,Purple Priestess Dress
ぷらこんじょせいしのびのふくもも,Pink Women's Ninja Suit
だんせいぷらこんふくだーくぐれー,Dark Gray Clothes (M)
ぷらこんだんせいしのびのふくあか,Red Men's Ninja Suit
ぷらこんじょせいしのびのふくあお,Blue Women's Ninja Suit
足元エフェクト（おしおきアタック,Something Effect
ぷらこんだんせいようそくたいはい,Ash Ceremony Gown
ぷらこんだんせいしのびのふくこん,Navy Men's Ninja Suit
リンジャハル海岸-教会シスター 前,Linjahar Coast - Church Sister
レビュール街道北-海風の洞くつ 前,Reviewle Highway North - Seabreeze Cave
マデ島＆エテーネ王宮（4.5CS専用）,Made Isle & Ethene Royal Manor (4.5CS only)
必殺チャージ時 チャージ時間 -10秒,Charge Time -10 sec. On Special
セレドット山道-ベリルのほら穴 前,Celedot Mountain Pass - Beryl Den
リンジャハル海岸-リンジャの塔 前,Linjahar Coast - Linja Tower
追憶の世界-アルウェ王妃の別荘跡,World of Remembrance-The Ruins of Queen Alwe
死亡時 50%でこうげき力上昇が残る,Undying Attack Boost 50%
プログラマー用負荷検証ステージ5,Loading Programmer Verification Stage 5
プログラマー用負荷検証ステージ3,Loading Programmer Verification Stage 3
プログラマー用負荷検証ステージ4,Loading Programmer Verification Stage 4
プログラマー用負荷検証ステージ1,Loading Programmer Verification Stage 1
プログラマー用負荷検証ステージ2,Loading Programmer Verification Stage 2
魔天の勇者＆聖夜の破壊者・雪組,Festive Hero & Holy Night Wrecker Snow Team
ハロウィンクイズ解答ウェディ５,Halloween Quiz Answer Weddie 5
ぷらこんだんせいようももさんた,Pink Men's Santa Suit
ぷらこんじょせいようももさんた,Pink Women's Santa Suit
ハロウィンクイズ解答ウェディ１,Halloween Quiz Answer Weddie 1
扉は　かたく　閉ざされている。,The door is tightly closed.
ハロウィンクイズ解答ウェディ３,Halloween Quiz Answer Weddie 3
ハロウィンクイズ解答ウェディ２,Halloween Quiz Answer Weddie 2
ぷらこんじょせいようくろさんた,Black Women's Santa Suit
ぷらこんだんせいようももあろは,Pink Men's Aloha
じょせいぷらこんふくさんせっと,Sunset Clothes (F)
ぷらこんだんせいはかまむらさき,Purple Men's Hakama
ハロウィンクイズ解答ウェディ６,Halloween Quiz Answer Weddie 6
ぷらこんだんせいようあおあろは,Blue Men's Aloha
魔天の勇者＆聖夜の破壊者・闇組,Festive Hero & Holy Night Wrecker Dark Team
ぷらこんじょせいようあかあろは,Red Women's Aloha
ゴリウスの怨霊＆魔道士キルギル,Gorius' Vengeance & Wizard Kirgyl
ぼうえいぐんのせいふくむらさき,Purple Defense Force Suit
ぷらこんじょせいようあかさんた,Red Women's Santa Suit
はなかりゅうどのころもむらさき,Purple Flower Hunter Outfit
\s\m\eは　コインをなげた。　→　,\s\m\e flips a coin. → The coin lands on !
えるどなしんのしょうぞくせっと,Eldona's Outfit
ぷらこんだんせいようしろさんた,White Men's Santa Suit
ぷらこんじょせいようしろさんた,White Women's Santa Suit
壊れたアストルティアのコンパス,Broken Astoltia Compass
ハロウィンクイズ解答ウェディ７,Halloween Quiz Answer Weddie 7
豪魔将ベリンダ＆豪魔将ブレンダ,Generals Belinda & Brenda
ぷらこんじょせいようももあろは,Pink Women's Aloha
\s\m\eは　カードを引いた。　→　,\s\m\e draws a card. → They draw the !
ぷらこんだんせいようしろあろは,White Men's Aloha
ぷらこんだんせいようくろさんた,Black Men's Santa Suit
ぷらこんじょせいようあおあろは,Blue Women's Aloha
ぷらこんじょせいようしろあろは,White Women's Aloha
ぼうえいぐんのせいふくはいいろ,Gray Defense Force Suit
\s\m\eは　ダイスをふった。　→　,\s\m\e rolls a die. → !
ぷらこんこどもようみずぎせっと,Children's Swimsuit
ハロウィンクイズ解答ウェディ４,Halloween Quiz Answer Weddie 4
30%の確率で受けたダメージ10%反射,30% Chance to Reflect 10% Damage
ぷらこんだんせいようあかさんた,Red Men's Santa Suit
ぷらこんじょせいみこふくみどり,Green Priestess Dress
両手剣の単体特技のダメージ +500,Single Target Greatsword Skills +500
コニウェア平原-教会シスター 前,Coniware Plain - Church Sister
リャナ荒涼地帯-滝を臨む集落 前,Lyana Desolate - Waterfall Village
モンセロ温泉峡-中央のやぐら 前,Moncello Spring Gorge - Central Scaffold
レビュール街道南-三門の関所 前,Reviewle Highway South - Three Way Gate
デフェル荒野-不思議の魔塔 入口,Defel Desert - Mysterious Tower Entry
ドラクロン山地-竜守りの小屋 前,Draklon Mountains - Dragon Guard's Hut
リャナ荒涼地帯-くずれた灯台 前,Lyana Desolate - Collapsed Lighthouse
ジャイラ密林-クドゥスの泉 入口,Jyra Jungle - Kudus Spring Entry
セレドット山道-セレドの町 入口,Celedot Mountain Pass - Town of Celed Entry
戦いで 魔物に狙われにくくなる,Less likely to be targeted in battle
テンション時のダメージ +100<ban>,Damage During Tension +100 (PvP×)
会心と暴走時のダメージ +100<ban>,Critical/Haywire Damage +100 (PvP×)
アルファ用追憶の世界 別荘跡編,World of Recollection for Alpha Villa Ruins
こうげき魔力とかいふく魔力 +10,Magical Might/Mending +10
ムニエカの深層・隠し通路 入口,Munieka Depths - Secret Passage Entry
ぷらこんじょせいみこふくあか,Red Priestess Dress
ぷらこんじょせいももふりそで,Pink Women's Kimono
チームゆく年くる年　２０２６,Team Twenty Twenty Six
ぷらこんだんせいようきあろは,Yellow Men's Aloha
ぼうえいぐんのせいふくみどり,Green Defense Force Suit
ぷらこんしゃわーよういしょう,Shower Outfit
はなかりうどのころもむらさき,Purple Flower Hunter Outfit
あすふぇるどがくえんふゆふく,Asfeld Academy Winter Wear
巨人コアを守るジア・クトたち,Defenders of the Core
ぷらこんじょせいみこふくあお,Blue Priestess Dress
ハロウィンクイズ解答エルフ５,Halloween Quiz Answer Elf 5
チームゆく年くる年　２０２３,Team New Year 2023
ぷらこんじょせいくろふりそで,Black Women's Kimono
ハロウィンクイズ解答エルフ４,Halloween Quiz Answer Elf 4
チームゆく年くる年　２０１８,Team New Year 2018
ラダ・ガートたちに連絡を取る,Contact Lada Gart's Group
魔天の勇者＆キラークリスマス,Festive Hero & Christmas Killing Machine
行動時 7%でバイシオンとピオラ,Oomph & Accelerate On Action 7%
ハロウィンクイズ解答エルフ１,Halloween Quiz Answer Elf 1
どるわーむけんきゅういんふく,Dolworm Research Suit
ぷらこんおんなどらきゅらふく,Women's Dracula Costume
闇に唄う氷にまぎれし聖なる者,Frozen Sacred Singer
チームゆく年くる年　２０２５,Team Twenty Twenty Five
ぷらこんじょせいみこふくもも,Pink Priestess Dress
チームゆく年くる年　２０２４,Team Twenty Twenty Four
ぷらこんじょせいしろふりそで,White Women's Kimono
ぷらこんじょせいあかふりそで,Red Women's Kimono
チームゆく年くる年　２０１９,Team New Year 2019
チームゆく年くる年　２０２１,Team New Year 2021
攻撃時10%で会心と暴走率アップ,Critical/Haywire Boost Attack 10%
ぷらこんおとこぱんぷきんふく,Men's Pumpkin Clothes
あすふぇるどがくえんなつふく,Asfeld Academy Summer Wear
はなかりゅうどのころもみどり,Green Flower Hunter Outfit
魔人エンラージャ＆ムッチーノ,Enraja the Genie & Muccino
はるかぜおうえんだんいしょう,Spring Cheer Team Outfit
ハロウィンクイズ解答エルフ６,Halloween Quiz Answer Elf 6
じょせいぷらこんふくむらさき,Purple Clothes (F)
ぷらこんすいーとふくだいだい,Orange Sweet Clothes
ぷらこんおとこどらきゅらふく,Men's Dracula Costume
集合ギミック / 全体エフェクト,Some gimmick or effect idk
ハロウィンクイズ解答エルフ３,Halloween Quiz Answer Elf 3
嵐魔ウェンリルとアクラガレナ,Wenrir the Storm & Akragarena
チームゆく年くる年　２０１７,Team New Year 2017
ぷらこんじょせいようきあろは,Yellow Women's Aloha
行動時 5%でバイシオンとスカラ,Oomph & Buff On Action 5%
ＤＱⅧしゅじんこうのいしょう,DQⅧ Hero Costume
ハロウィンクイズ解答エルフ２,Halloween Quiz Answer Elf 2
ハロウィンクイズ解答エルフ７,Halloween Quiz Answer Elf 7
だんせいしらなみがらのゆかた,White Wave Yukata (M)
ヴァレリアの仮面（割れる前）,Valeria's Unbroken Mask
チームゆく年くる年　２０２２,Team New Year 2022
ぷらこんおんなぱんぷきんふく,Women's Pumpkin Clothes
じょせいしらなみがらのゆかた,White Wave Yukata (F)
ぷらこんだんせいようあかろは,Red Men's Aloha
行動時 5%でバイシオンとピオラ,Oomph & Accelerate On Action 5%
チームゆく年くる年　２０２０,Team New Year 2020
フォークに刺さったパンケーキ,Pancakes Stuck in a Fork
ぷらこんきゅーぴっどむらさき,Purple Cupid
わかむしゃのかっちゅうせっと,Young Warrior Armor Set
デフェル荒野-教会シスター 前,Defel Desert - Church Sister
コニウェア平原-三門の関所 前,Coniware Plain - Three Way Gate
グランゼドーラ領-見張り塔 前,Gran Zedora Territory - Watchtower Front
ロヴォス高地-教会シスター 前,Rovos Highlands - Church Sister
ジャイラ密林-大樹の根元 入口,Jyra Jungle - Big Tree Root Entry
モンセロ温泉峡-ご神体の間 前,Moncello Spring Gorge - Hall of Worship
モンセロ温泉峡-南のやぐら 前,Moncello Spring Gorge - South Scaffold
デフェル荒野-ピラミッド 入口,Defel Desert - Pyramid Entry
モンセロ温泉峡-管理人小屋 前,Moncello Spring Gorge - Caretaker's Hut
毒時にタナトスのダメージ +150,Vicitimiser to Poisoned Foes +150
モンセロ温泉峡-北のやぐら 前,Moncello Spring Gorge - North Scaffold
銃撃時2%でターンを消費しない,Free Turn When Shooting 2%
追憶の世界-キラキラ大風車塔,World Of Remembrance-Windmill Tower
リンジャハル海岸-高台の遺跡,Linjahar Coast - Hilltop Ruins
セレドット山道-滝見の吊り橋,Celedot Mountain Pass - Fallsview Bridge
攻撃時 5%でチャージ時間 -10秒,Charge Time -10 sec. Attack 5%
行動時 5%でチャージ時間 -10秒,Charge Time -10 sec. On Action 5%
炎・土・闇属性のダメージ +5%,Fire & Earth & Dark Damage +5%
じょせいぷらこんふくえんじ,Red Clothes (F)
よわいこころ＆ずるいこころ,The Weak and Cunning Hearts
ぷらこんぱてぃしえふくあか,Red Pastry Chef Suit
ハロウィンクイズ解答オガ７,Halloween Quiz Answer Ogre 7
ドルボ用マネキンニンゲン用,For Human Mannequin For Dolboard
はなかりゅうどのころもあか,Red Flower Hunter Outfit
ハロウィンクイズ解答オガ３,Halloween Quiz Answer Ogre 3
だるめしあんぼーいいしょう,Dalmatian Outfit (M)
男性プラコン服ミストグレー,Mist Gray Clothes (M)
ぼうえいぐんのせいふくきん,Gold Defense Force Suit
ドルボ用マネキンウェディ用,For Weddie Mannequin For Dolboard
ハロウィンクイズ解答ヒト５,Halloween Quiz Answer Human 5
未完のドラクロン山地への道,Road to Undone Draklon Mountains
ぷらこんおしゃれみずぎもも,Pink Snazzy Swimsuit
だるめしあんがーるいしょう,Dalmatian Outfit (F)
ムストの町・教会跡への出口,Exit to Morst - Church Ruins
戦闘中常時マホトラのころも,Magic Cloak Always Active
ぷらこんえんじぇるふくしろ,White Angel Clothes
ぼうえいぐんのせいふくこん,Blue Defense Force Suit
女性プラコン服ミッドナイト,Midnight Clothes (F)
イルーシャのスケッチブック,Illusia's Sketchbook
ドルボ用マネキンプクリポ用,For Pukulipo Mannequin For Dolboard
ぷらこんぱてぃしえふくあお,Blue Pastry Chef Suit
『おうちでついてクン設定』,"House Pet Settings"
アスフェルド学園女性用水着,Asfeld Swimwear (F)
ハロウィンクイズ解答ヒト２,Halloween Quiz Answer Human 2
アスフェルド学園男性用夏服,Asfeld Summer Uniform (M)
ぷらこんえんじぇるふくもも,Pink Angel Clothes
ハロウィンクイズ解答プク６,Halloween Quiz Answer Puku 6
はなかりうどのころもみどり,Green Flower Hunter Outfit
ハロウィンクイズ解答ドワ２,Halloween Quiz Answer Dwarf 2
男性プラコン服ダークグレー,Dark Gray Clothes (M)
ぷらこんいけてるみずぎくろ,Black Cool Swimsuit
ハロウィンクイズ解答ヒト７,Halloween Quiz Answer Human 7
ハロウィンクイズ解答ドワ３,Halloween Quiz Answer Dwarf 3
ハディン地下洞くつへの出口,Exit to Hadine Cavern
ハロウィンクイズ解答ヒト３,Halloween Quiz Answer Human 3
からすかぐらのしょうぞくⅠ,Crow Dance Costume Ⅰ
ぷらこんおしゃれみずぎあお,Blue Snazzy Swimsuit
ぷらこんいけてるみずぎあお,Blue Cool Swimsuit
ぷらこんだんせいはかまあお,Blue Men's Hakama
ぷらこんえんじぇるふくあお,Blue Angel Clothes
ハロウィンクイズ解答ドワ１,Halloween Quiz Answer Dwarf 1
ぷらこんだんせいはかましろ,White Men's Hakama
ぷらこんだんせいはかまこん,Navy Blue Men's Hakama
ハロウィンクイズ解答ドワ６,Halloween Quiz Answer Dwarf 6
3.0%でターンを消費しない<ban>,Free Turn 3% (PvP×)
ぷらこんおしゃれみずぎくろ,Black Snazzy Swimsuit
ぷらこんぱてぃしえふくもも,Pink Pastry Chef Suit
ハロウィンクイズ解答ドワ５,Halloween Quiz Answer Dwarf 5
ハロウィンクイズ解答プク７,Halloween Quiz Answer Puku 7
ぷらこんいけてるみずぎもも,Pink Cool Swimsuit
ハロウィンクイズ解答プク４,Halloween Quiz Answer Puku 4
とうばつたいこうほうきょく,Strike Force Bureau
デスディオ暗黒荒原への出口,Exit to Deathdio Darklands
じょせいぷらこんふくぴんく,Pink Clothes (F)
ムストの町・風車へのはしご,Morst - Ladder to the Windmill
女性プラコン服アイスブルー,Ice Blue Clothes (F)
未完のモンセロ温泉峡への道,Road to Undone Moncello Spring Gorge
壊れたハイハイジャンプさん,Broken Mr. High High Jump
ハロウィンクイズ解答プク１,Halloween Quiz Answer Puku 1
ハロウィンクイズ解答ヒト６,Halloween Quiz Answer Human 6
ランドン山脈山頂付近への道,Road to Landon Summit Area
ぷらこんえんじぇるふくあか,Red Angel Clothes
清き風吹き　草木は芽吹く～,Pure winds blown and trees grown, budding green as the breeze is thrown
『ついてクンをひっこめる』,"Remove Pet"
未開のジャングル地区への道,Road to Savage Jungle
だんせいぷらこんふくぴんく,Pink Clothes (M)
ハロウィンクイズ解答オガ１,Halloween Quiz Answer Ogre 1
ハロウィンクイズ解答オガ５,Halloween Quiz Answer Ogre 5
ぷらこんえんじぇるふくくろ,Black Angel Clothes
ゆうべはおたのしみでしたね,Rooming with a Gamer Gal
イア・タア　シンパッ・ケウ,E-yis, aneu dish cubrey
ハロウィンクイズ解答オガ２,Halloween Quiz Answer Ogre 2
ぷらこんいけてるみずぎあか,Red Cool Swimsuit
ドラゴンクエストＸショップ,Dragon Quest X Shop
らんぷれんきんれんしゅうぎ,Lamp Alchemy Training Wear
ハロウィンクイズ解答ヒト１,Halloween Quiz Answer Human 1
ぷらこんおしゃれみずぎしろ,White Snazzy Swimsuit
2.0%でターンを消費しない<ban>,Free Turn 2% (PvP×)
ハロウィンクイズ解答プク５,Halloween Quiz Answer Puku 5
ルクスガルン大空洞への亀裂,Crevice to Luxgarn Caverns
行動時 5%でテンションアップ,Tension On Action 5%
古レビュール街道北への出口,Exit to Old Reviewle Highway North
ハロウィンクイズ解答ドワ７,Halloween Quiz Answer Dwarf 7
ハロウィンクイズ解答オガ６,Halloween Quiz Answer Ogre 6
ぷらこんおしゃれみずぎあか,Red Snazzy Swimsuit
１００万ゴールドの入った袋,1 Million Gold Bag
だんせいぷらこんふくえんじ,Red Clothes (M)
ドルボ用マネキンドワーフ用,For Dwarf Mannequin For Dolboard
キュロンイーターの巣への道,Path to Kyuroneater's Nest
未来への扉とまどろみの少女,The Door to the Future & the Slumbering Girl
はなかりゅうどのころもあお,Blue Flower Hunter Outfit
古グランゼドーラ領への出口,Exit to Old Gran Zedora Territory
ぷらこんぱてぃしえふくしろ,White Pastry Chef Suit
ぷらこんいけてるみずぎしろ,White Cool Swimsuit
スターキメラから取った羽根,Cosmic Chimaera Feather
アスフェルド学園女性用夏服,Asfeld Summer Uniform (F)
ぷらこんだんせいはかまくろ,Black Men's Hakama
ハロウィンクイズ解答プク３,Halloween Quiz Answer Puku 3
アルムゴーグ＆ロムドゴーグ,Armogog & Romdogog
魔物商人＆商品ナンバー１３,Monster Merchant & Item Number 13
ハロウィンクイズ解答プク２,Halloween Quiz Answer Puku 2
行動時 3%でテンションアップ,Tension On Action 3%
ハロウィンクイズ解答ヒト４,Halloween Quiz Answer Human 4
ハロウィンクイズ解答オガ４,Halloween Quiz Answer Ogre 4
男性プラコン服ミッドナイト,Midnight Clothes (M)
砂の都ファラザードへの出口,Exit to Farazard
からすかぐらのしょうぞくⅡ,Crow Dance Costume Ⅱ
フラワーガーデン地区への道,Road to Flower Garden District
ハロウィンクイズ解答ドワ４,Halloween Quiz Answer Dwarf 4
ぼうえいぐんのせいふくあか,Red Defense Force Suit
アスフェルド学園男性用水着,Asfeld Swimwear (M)
必殺チャージ時 身かわし +10%,Dodge +10% On Special Charge
5000年の旅路 遥かなる故郷へ,5000 Year Journey to a Faraway Hometown
テンション時のダメージ +300,Damage During Tension +300
ワルド水源-湖上の休息所 前,Wald Headwaters - Lake Retreat
氷耐性低下時のダメージ +100,Ice Vulnerability Damage +100
眠り時に呪文のダメージ +50%,Spell Damage to Asleep Foes +50%
炎属性の呪文のダメージ +100,Fire Spell Damage +100
ロヴォス高地-ゼドラ洞 入口,Rovos Highlands - Zedra Cave Entry
チャンス特技発生率 +1.0%<ban>,Chance Trigger Rate +1% (PvP×)
受けるダメージを10軽減する,Damage Taken -10
アストルティア博物館 出口,Astoltia Museum Exit
プログラマー検証ステージ6,Programmer Verification Stage 6
宇宙船・立入禁止区画 出口,Spacecraft - Restricted Area Exit
味方死亡時 20%でバイシオン,Oomph If Ally Dies 20%
キュロンイーターの巣 入口,Kyuroneater's Nest Entry
エピステーサ底なし穴 出口,Epistesa Chasm Exit
異界アスタルジア深部 出口,Depths of Astalgia Exit
からすかぐらのしょうぞく1,Crow Dance Costume Ⅰ
レビュール街道北-谷合の森,Reviewle Highway North - Veil of the Vale
カルデア山道のアジト 出口,Chaldea Mountain Road Hideout Exit
プログラマー検証ステージ4,Programmer Verification Stage 4
氷耐性低下時にダメージ +50,Ice Vulnerability Damage +50
エピステーサ底なし穴 入口,Epistesa Chasm Entry
からすかぐらのしょうぞく2,Crow Dance Costume Ⅱ
瀕死時 15%こうげき力 +60<ban>,Near-Death Attack +60 15% (PvP×)
デス・ジャンクション 入口,Death's Juncture Entry
湖の小島・神のまなこ 出口,Lake Islet - The All-seeing Eye Exit
受けるダメージを5軽減する,Damage Taken -5
プログラマー検証ステージ5,Programmer Verification Stage 5
アストルティア博物館 入口,Astoltia Museum Entry
湖の小島・神のまなこ 入口,Lake Islet - The All-seeing Eye Entry
シガール町長の執務室 入口,Mayor Sigal's Office Entry
宇宙船・立入禁止区画 入口,Spacecraft - Restricted Area Entry
